,date,funny,business_id,text,user_id,useful,cool,stars,review_id
1761216,2017-06-18,0,19umlhmVB9O3njIBfRAe8g,"Unappealing -- After a evening was spent at this 'Buffet' i was seriously dissapointed at the lack of variety and the poor quality of food. Under the 'Asian' section you will find microwaveable rice and sweet & sour chicken even the wonton soup appeared to be from a can. Out of 3 plates we had i would say the tastiest of them all was the Mexican enchiladas and the 'pork'. Other than that everything was really lacking in flavor, I feel bad for the folks who pay full price; I took advantage of the boarding pass discount and the 2-for-1 coupons. 

I don't think i'll ever be checking out this place ever again, Even with a BOGO coupon its still not worth it. This food is borderline school cafeteria quality and the dinner rolls have been left out for hours with flies all over them etc. I wont be visiting this place again any time soon.",-m5GK6m4hQiZwl8fpSJkYA,0,0,1,-RCUwT285QGDwSFViWsJeA
1839851,2017-05-23,0,19umlhmVB9O3njIBfRAe8g,"This is the best and cheapest food for a lower style hotel. $7 bucks for a lunch Buffett which includes food such as Italian, Chinese, Mexican, and American",XMmUte-0KWHj_RskWoB4zg,0,0,5,T2sQO7Zhbjzosqk1nGkzhA
1869322,2018-02-03,0,19umlhmVB9O3njIBfRAe8g,"Had dinner at the restaurant Culici Town. This was the worst restaurant experience I have ever had. Myself and a group of people got together for a celebration. While dining in the establishment it took 20 minutes to get our first drink order. When we placed our order for food we received a portion of what we had ordered. The food was not good at all. The chicken nuggets arrived soggy and full of grease and everything else was cold. When we asked to speak to the manager it took 15 minutes for him to arrive, he stopped and spoke to the people next to us and proceeded to walk away. My husband to hail him down and ask him to come back. We informed him of the issues and he said he would look into it. 30 minutes later he nor our waiter returned.  People from our party started to leave and we had not received a bill yet. After someone hunted the manager down again he arrived with the bill, stated that he could not locate our waiter and advised us he had taken 20% off. After careful calculation we realized we had been charged for food and drinks we never received and that issue to another 20 minutes to clear up. 

Outside of the service issue there were a couple of other problems. The establishment has a live band that plays Banda music. The musicians go out into the crowd, sing to people, and take special request. They refused to pay any attention to me when My husband requested a song but when the table next to us made the same request they played it. I am not sure if the issue was they did not understand his Spanish or maybe it was the color of his skin. Let me make something clear Hispanics come in all shades of the rainbow and apparently so does ignorance. I recorded a video of him and the way the musician turned his back on him when he made the request. 

The other issue I had with this establishment was while attempting to take care of the billing situation at the register the manager was to busy eating Ramens  he got from another establishment to assist the young lady in correcting the errors on our bill. The reason I know this is because he sat out in the open eating them with a couple of his friends. I don't know about some people but I am a little turned off when individuals that work at an eating establishment don't eat their own food or they eat food from somewhere else out in the public eye. 

Maybe this establishment does not care about making themselves or the casino money an the community they do business in. From what I have read and heard throughout the casino there seems to be a general theme of horrible service. 

If it were not for the fact that this establishment is located in a casino and the consequence of getting black listed from all of their sister casinos we would have all walked out and not paid the bill.",tpOqn0OsbWp0acpw7rkQcA,0,0,1,5XQZ4WLtyuo5p77zNG5WqA
1990296,2008-04-25,2,19umlhmVB9O3njIBfRAe8g,"The only thing I like about this casino is the Sobe Ice Rink thats attached to it. 

If you live in east vegas, it sucks because you have to drive quite a distance to get to it. the other ice rink in henderson sucks, its too small

The sister casino, Fiesta Henderson? ha no comment.",4bgpE8kMw8cQCaMin_dcww,0,1,1,l4NbxnQSuGTIRd2_WOH_yQ
2085953,2016-05-29,0,19umlhmVB9O3njIBfRAe8g,"I am at your bingo hall and have to giveva kudos to Cathie W., one of your bingo attendants. I am here celebrating my birthday and she was as sweet as can be even though i only got the free stuff. It is awesome staff like her that keeps me wanting to come back here for bingo!",sS2AjfEhGmmRSai4ojaZ9w,0,1,5,h2aPU_6h-ZTfvfD-FT1bDg
2145406,2014-12-08,0,19umlhmVB9O3njIBfRAe8g,"As a local I love this place!!  The staff (of the casino) is very generous!  They truly do love locals. Other than a few select staff members at Denny's; I've had minimal problem anywhere in the hotel. I personally enjoy the bingo hall there (could stand to win more). There are many gaming options in the casino. The food options are not bad. They have Panda Express, their buffet is pretty good - especially the Mongolian BBQ - prices are reasonable, Subway is by the ice arena, their Mexican restaurant Gardunos is pretty amazing and next door they have a bar called Blue Agave with great happy hour specials and don't miss out on the delicious Coconut Margarita!!!!  There is also a Denny's in the hotel and I've had minimal problems with the regular staff, it's the graveyard shift you should be weary of. They are rude, disrespectful, and obnoxious. 

The staff of the hotel and casino treats everyone kindly and the players card has many awesome incentives. 

The bingo staff is friendly and personable and at times have felt kind of like family. 

I would give them 5 stars but deducted a star because of the Denny experience.",bJnwIcoWpvOaK7UPK0Pw-Q,2,0,4,gDouJ5oi6D7OccIRVIwrrg
2148017,2012-03-26,0,19umlhmVB9O3njIBfRAe8g,Came here with my family for a Sunday brunch and it was pretty nice. Our waiter was the most attentive person ever. He keep all our drinks filled and even joked with my in laws. I do admit that there's not much of a selection but we had such a good time. I would definitely recommend to use the make it yourself grill. It was fun and delicious!,ecnOLqpg4qVfZLThBdhONg,0,0,4,gmlv3Vduh7gQRb5Vs2JLQA
2200184,2017-11-26,3,19umlhmVB9O3njIBfRAe8g,"Received an offer I couldn't refuse. Free rooms and freeplay!

I was surprised to see how much this place has changed and for the better.

The addition of the drive up sportsbook and new Sinaloan Style restaurant were a plus.  

First off the casino and lobby have been refreshed.  New carpet, wood floors and paint. Also the ventilation was updated.  

The casino floor seems to have a more open layout.

Now to the room. 

Let me say the addition of new ac unit, furnishings, paint and a flat screen tv were very impressive.  The last time I stayed here I felt uneasy seeing a tube tv.  Though the room is still small it is comfortable and clean. 

The casino staff as well as room service were courteous and welcoming.

Not being far from the strip, this is an absolute value play.  

If all you need is a clean place to sleep for a few hours and take a shower, this is a great alternative to the strip hotels. 

The ease of getting in and out of the hotel is another advantage. 

I will never hesitate to stay and play here again. 

Based on my recent visit I'll probably qualify for another free stay and additional freeplay... I'm actually looking forward to it!",Ryxj0u0AW3mRsRypdYli2A,4,6,5,Vb1eOF7Ne5gUCkYBiu3o9Q
2202506,2013-04-02,1,19umlhmVB9O3njIBfRAe8g,"I came here from out of town to attend a family wedding. My wife and her family also stayed here. The hotel rooms were decent. The casino had a huge slots selection. I'm not a big slots fan; I prefer 21. But I looked in vain for a $1 minimum bet table. $5 was the lowest. Margaritas run $1-$3 for guests. They're huge (IMO). The buffet was good and reasonably priced.

My biggest gripe with this hotel (and the reason I only gave it 2 stars) is the extreme incompetence of the woman at the front desk. When I tried to check my father in law and my sister in law in to their room, the person at the desk couldn't find their reservation because she was looking for it using my father in law's FIRST name instead of his last name. She claimed his CA drivers license confused her. It wasn't until I demanded the manager that I was able to clear things up. We wasted 30 minutes with that ordeal (on top of the fact that we were tired from our 3 hour drive from CA)

We will never stay there again.",v2R6t9LMT-dYqzzBjj1LwA,0,0,2,T9Wl_u3vpFkUurj3hICiJQ
2207041,2016-12-16,0,19umlhmVB9O3njIBfRAe8g,"Dare I say the hotel is ... kinda cute? Yeah, it's obviously a budget property, with some signs like worn carpet and etc. ... but the rooms were actually nicer than I was expecting based on the unenthusiastic reviews here and elsewhere. Everything done in a bit of a Mexican villa style. You need a room key to get through a door to get into the hotel area after hours.

Re: thin walls mentioned in other reviews, I was also surprised here. I ended up with a two-bed room since that was all they had, through the bed wall I heard nothing but a faint baby squall here and there ... but when I walked by that room's door en route to the elevator I could clearly hear two older kids being rambunctious as hell in there with the TV cranked up! Wasn't making it through the wall. And that was the thinner wall, each room has one of those and then cinder blocks opposite it which are more substantial. 

The only downsides that dock a star - the wifi flat didn't work (connects but went nowhere) and no mini-fridge in the room. Plus the shower was a little goofy. 

Decent location for budget food. Buffet on site is inexpensive, though unlike other Station properties it is NOT open for breakfast. Panda Express that charges about 50 cents more than normal but is right next to the hotel area for super convenience. Also a BBQ joint that I really wanted to try, but when I stopped by at 11:15 after checking out they were still not yet ready to rock. Outside there's a Terrible's with crazy low prices on many things, Del Taco and a Walmart Supercenter within a quick walk. 

I'd go back. Get the wifi working and I'd give it an extra star.",nNlRYWO00FvLVQx9Hp6_dw,0,0,3,m4BwWyKGpOjqNKCz3dIxQg
2362729,2013-07-24,9,19umlhmVB9O3njIBfRAe8g,"A haiku for the buffet inside this smoke-infested retirement home disguised as a casino littered with gambling addicts: 


Save yourself the time

Explosive Diarrhea 

Combined with mudd-butt",hBEYo4aJRsUOGGoOScvJzw,4,2,1,EwXtfmPdwMkitPeLzMcrUw
2379429,2011-08-22,0,19umlhmVB9O3njIBfRAe8g,"I'm a fan of the station/fiesta casinos for locals. I think they are a great way to indulge in Sin City while staying grounded.

I went here for the buffet last, but I've also gambled here which I do like as well.

Buffet:

They have a variety of food.- good food. The enchiladas are AMAZING. They also have a Mediterranean stations where you can pick out different veggies and meats for a customer stir fry type of meal. It's fabulous! 

The desserts weren't that awesome, but I was pretty full from the food, so I won't complain. You can also get $1 margarita upon entering the buffet! It's not weak either - I was feeling it after one.

Best part - It's only $4.99 with the players card!

Hungry??? GO!",xD0zXwapBausN9rwNLAXcg,1,1,4,8t3Ga65heeemGwjgjv2dlw
2398741,2013-05-25,0,19umlhmVB9O3njIBfRAe8g,"Even though this Fiesta is a bit of a trek for me, I find it to be a nice, comfortable and friendly spot to spend some time.  Staff is nice, choices in venues are varied and serviceable and general vibe is quite friendly and easygoing.  Definitely a place worth going for some casual locals time, grabbing a simple margarita, etc...",x9PSdA_zblUBYGjBVH6jJg,0,0,3,iDfT5juaUlltHj5qaX9JPA
2490052,2015-05-13,0,19umlhmVB9O3njIBfRAe8g,"WOW! If there was a NO STAR option, I'm in! What a joke! I have been a Station customer for 17 years, Fiesta usually isn't my thing. I now now why. The people here HATE your business! That is that! They act as if they could care less you are there, I could only laugh and leave...Melvin (the gentleman in charge) was particularly clueless, the pit boss on at the time (Tim) was out of a Ron Burgandy skit, except a complete d'bag! Guess this is where the first time Station employees go...smh...no more Fiesta!",52vw6BT-iBM26-SYh9F-KA,3,0,1,xpbNwdBUjuK6QrSOhO1eJA
2535034,2018-02-11,0,19umlhmVB9O3njIBfRAe8g,"Racist!!!! This place well the club os racist to all Non-Latino people. Do not Go!! Very unfair. Not right, my friends got mistreated...what coincidence that the only 2 white people of my group were told they could not come in because of looking drunk. Terrible!!! Not a friendly place to be....i just could not wait to go back to our hotel. Even if we got a $300 VIP table and treated this way...no way.",DaDlVtG3A2zp8pHZMn4Yqw,0,0,1,AS22Zb1qy6FwUeJvu5htcQ
2635016,2017-08-20,0,19umlhmVB9O3njIBfRAe8g,"What is (or is not) happening to the Fiesta Rancho Casino?  Is there some new management??We are locals who are at this casino usually a couple times a week.  In the last several months we have notices a lot of little changes that are not positive.  I feel that this property is and has been ignored, and funds spent have been funneled into the newer acquisitions.  The buffet has shown major decline in the last year or so.  The selections have gone from pretty good for the price,to not so hot.  Things like Cholula and jelly are not unavailable.  Meatloaf used to be a staple and now is gone etc etc.  The main reason we continue to frequent this casino is the employees.  We are on a first name basis with the valets,buffet servers and cashiers, and cafe waitresses.  I  understand budgets etc,, but for another dollar or two a much better buffet can be found very near.",Aoa3S9-Z0KI-SepXSsdwJg,0,0,3,6AN4YAXO1GuwMUvRTqahMA
2659253,2015-08-18,5,19umlhmVB9O3njIBfRAe8g,"Fiesta Rancho is a dive, no question about it. But that isn't necessarily a bad thing, depending on the mood you are in. There are many wonderful attributes that Fiesta Rancho has that simply cannot be found elsewhere. The value that the casino offers is second to none when it comes to prices of the buffet, limit table games, and rarified classics such as ALL PAPER Bingo. The clientele is older, lower middle class locals and a few stereotypical degenerates that find Texas Station to be too high falootin'. It is a poor man's Station Casino, that's for sure, but that doesn'tmean it should be avoided. Quite the opposite, actually. 

Occasionally when I'm driving home from a late night playing cards on the Strip, I'll stop by Fiesta Rancho just to throw some dice or play some 21. Their crap table is often just run by the dealers. No box man, and half of the table is closed. The limits are $3 with 10x odds, which puts them better than most Strip casinos that usually offer 3x4x5x odds. The place is rarely crowded and the atmosphere is casual, smoky, degeneracy laden, and fun. 

The buffet offers a great value, especially if you have kids. Though the prices have been raised, lunch is still right around $6. No breakfast is offered. Dinner is $7 or $8 and included a pretty good selection of somewhat flavorful Mongolian, American, and Mexican choices plus pizza and pasta (I hesitate to truly call it ""Italian"")

The casino offers an ice skating rink (random, I realize) and a small sports book. 

Overall, I do recommend Fiesta Rancho for those wanting a divey local's casino that is world's above Poker Palace but light years below Red Rock.",xEbCNG-3GTw-OxFusnVP9g,5,3,3,utzfFb1cPGshGhScb6VHBQ
2751658,2012-09-14,1,19umlhmVB9O3njIBfRAe8g,"Let's just say my siesta at the fiesta was amazing! 

I was in heaven sleeping in that nice big comfy king size bed!  Ah...I have so many good things to say about this place, just wait! 

1) Loved the fact that check-in was incredibly simple (I used the Hotels app on my phone to book one day in advanced).  I gave my name, ID and she found me and already had my room keys set aside.  **One thing to remember is that no matter whether you're a local or not, you have to put a $100.00 deposit down, don't forget!  

2) The room was nice and clean, plenty of towels, face cloths, soap and shampoo

3) The AC unit was a traditional unit but was controlled from the wall, AWESOME feature- it got really cold fast too, just how I  like it!

4) The bed didn't come with a bagillion covers like some hotels do, it had the sheet and nice thick duvet on top, lovvvvvved that

5) There was free wifi access and a cord as well to plug in (which saved the day when we had a storm)

6) Plenty of lighting and a nice big window to let in plenty of sunshine

7) Newspaper every morning when I woke up to leave for work, kudos!

8) I almost forgot to mention! For the shower lovers out there who just have to have the right pressure- well, LOOK NO FURTHER! This is the BEST hotel shower I have ever used, I mean EVER! You can control the pressure, and the heat is incredible! I even shut the door turned it to max and enjoyed a 'sauna-like' environment for 20 minutes

Please note that there is a $11 and change charge each day (resort fee) which includes things such as # 5 & #7, but seriously the room was only $19.79 a night so were talking like $30 and I got all this awesomeness!  Even though it wasn't a Wynn or Bellagio, it was fantastic for the price and just what I was looking for! 

For TV fanatics, note that the TV is just a standard tube 32incher, BUT it comes with movies still in theatres, a selection of your preference of 'out of theaters' Thriller, Comedy, etc. and for the more risky lovers, they have lots of adult channels; straight, bi, gay, lesbian- whatever your preference you have it! 

The casino itself was nice, great size and offered quite a few places to eat.  Check out Gurdanos! And heck smash burger too, they were all wonderful! 

The absolute only thing that I can say about this visit where I had to call the front desk was in regards to the ice machine.  It was not working, but I called them and they had it fixed within 48 hours.  It's not bad enough to knock off a star, so Fiesta gets 5 stars in my book!",aF0x_jysPRIkR9O-qq8xuw,6,2,5,mIN61bPxxIxGnN9Esyv4Aw
2846902,2017-04-13,0,19umlhmVB9O3njIBfRAe8g,You're not going back up! I don't think so! I'll bust all your teeth up! Screwing me over like that!,dQr6bJooK0RZaEgm0r2Mcw,0,0,1,nRh8XXuhfMO4-_cnzy-ohQ
2882551,2015-08-05,0,19umlhmVB9O3njIBfRAe8g,"I see a lot of bad reviews on here, but really Fiesta isn't bad. We stay here when we come to visit my father in law. It isn't the Bellagio, but for the money you really can't complain!!! 

Bonus - The tables are affordable and the payout is pretty good if you like gambling. The dealers are also really friendly. If you've never gambled before, I'd recommend going early in the morning and the dealers are friendly enough to teach you the basics.",xek2FPsjTc8ts4KKrsj-iA,0,0,4,cyNemjKcapOhIiAiUPPb0g
2893306,2010-03-18,0,19umlhmVB9O3njIBfRAe8g,"Went to the Fiesta Rancho today for a business meeting at the Club Tequila.  The place is located right next to another Station Casino property by the name of ""Texas Station"".  The pro's of Fiesta are the Garduno's Mexican restaurant that has always been a good chain in town.  The Club Tequila that I visited today seemed like a great concert/club venue during the night hours.  They also feature the Ice arena for the UNLV hockey home games, which I find cool.  

Overall, I think the Fiesta has a few extras that Texas Station lacks, and lack a few qualities the Texas delivers restaurant and overall look wise.  However, if your on Rancho and looking for a little old school Casino fare don't be afraid to try Fiesta.",jo8vV5iUZLHp617cTKZ7mA,2,1,3,iIzIYT1Bvu43gd5xlJGD0w
2961856,2013-05-23,0,19umlhmVB9O3njIBfRAe8g,"The Mongolian Grill at the Buffet is ONLY good if ROMERO is there.  Any other chef is lazy sloppy and makes uninspired food. but Romero takes his time and is a show within himself when he prepares your dish. He is polite debonair and I want to bring him home. Thanks for a wonderful dish tonight, Mr. Romero the Mongolian Grill Chef",mMdQvwWGrNeqPs3xARHezQ,0,1,3,y8JKugKdOlQB9-9imFHyQA
3000488,2016-04-07,0,19umlhmVB9O3njIBfRAe8g,"If I could do -stars, I'd give this place a -5. No bellhop no coffee or bottled water in the room. No exhaust fan or heating in the bathroom. Room is dirty, the bathroom sink pipes gurgle when water goes down & green moss surrounds the on/off knob. 

Pool is empty & no one knows if it will be refilled. 

No housecleaning after check-in. Only one person at registration during day & night. No room service. 

Employees have no answers and most of them were rude. The house cleaner & yes there is only one. She was the only employee who was nice & helpful. 

If you can stay someplace else to it DON'T STAY HERE!!!!! Especially if you are disabled in any way and need help like me. You won't get any help.",51IpHgrscrFFmm76vvrTPg,2,0,1,m-hJSLOadY6w-v3gwmGyqQ
3023190,2015-01-16,1,19umlhmVB9O3njIBfRAe8g,"Yea, okay, this place is a shithole and it's super smoky.  Whatever, it's an older casino and that's to be expected.  I'm not expecting to get a Four Seasons experience at the Fiesta Rancho.  It's close to home and I LOVE LOVE LOVE their all paper bingo.  I may be an addict.  I play at least once a week.  Cheap entertainment and a more level playing field since people don't have machines with 3754903874593 cards in them.  My only gripe is that the cocktail lady comes around after the games start and usually you don't get your drinks til halfway through the last game.  There's gotta be a more efficient way.  All in all, yea, the place is ghetto but the parking is close, staff is nice and it's a convenient neighborhood casino.",zbRjeEkON8EXFk_VrcTAiA,1,3,3,QjORkIftoDEboAJ0di0tUg
3041212,2014-11-11,2,19umlhmVB9O3njIBfRAe8g,"on Veterans Day weekend I came to eat the buffet with my family (party of 6) , one the hostess was overheard saying by one of my daughters "" these people should eat somewhere else"", ...really?, don't want to play the race card out here but maybe she was just having a bad day? maybe we should tan a bit more...or less.. not quite sure...as a veteran of this country I think it was a bit uncalled for, but that's just my opinion...last trip here, foods great but not now, not ever...
truly disappointed ... not worth the one star at all, if you're thinking of taking a taxi from the strip here I wouldn't bother, why pay a 50.00 dollar cab ride when you can stay downtown at freemont at a third of the cost.",nNDFxvn8e1dCvApGIyfb9w,2,1,1,_DjnJqBhD8gY-X8R2QN1mA
3061315,2011-03-19,0,19umlhmVB9O3njIBfRAe8g,"I was playing in a hockey tournament that gave your team preferred times and rink choice if you stayed at the hotel, plus it was the cheapest of the three tournament hotels. I should have known something was up, when one of the major cross streets was Martin Luther King Jr. Blvd. (if you do not know what I mean, go watch videos of Chris Rock). Saying the area was not the best is an understatement. The hotel and clientele reflect this. I respect the fact that it is a ""Locals"" hotel and Casino, but so is the Orleans and Terrible's off the strip. The hotel check in is fairly hidden in a small alcove, and the casino is fairly smoky. 

THE ROOM- well what can I say, 2 beds, a shower and a tub, and a basic TV. They say they have wireless, but in a 3 night stay, the first 2 nights they had to come and reset the access point. The last time they did this, they said the access point in our room was broken, so we did not have WiFi, but they were ""nice"" enough to loan us an ethernet cable. The speed is terrible, and do not even try to stream a video with their network. 

Casino- Fair at best. Few blackjack tables, and if you think other sports are better than basketball, stay away. When I was placing some bets on hockey games, people in line were yelling to hurry up, even though there were no other open windows. (I was up there for less than 2 minutes)

FOOD- when one of the fancy sit down restaurants is a DENNYS, you know you are in trouble. 

I value my safety and life, so I will be staying away from this place like the plague.",9loVWED0Zc5KXAuMOg-Inw,1,1,2,CCMqkbbl6CyTLKmn5lXD5Q
