,date,funny,business_id,text,user_id,useful,cool,stars,review_id
3063479,2011-01-12,0,19umlhmVB9O3njIBfRAe8g,"This Casino, which looks very old, probably seen better days. 

Usually I would come here to eat breakfast at Denny's. But looking at Fiesta overall, I would not stay here, even if they gave me a free room. But I'll give credit where credit is due. 

The gift shop, is small, but the lady behind the counter was nice and concerned, that I wasn't feeling to well, when I was buying a few Advil's and bottle of water. It did put a smile on my face when I left. Denny's has its ups and downs, in which, I like going to Denny's before 6am, if possible, the service seems to be nice before 6, after 6am, service kind of sucks. 

I think I gamble there probably twice, and both time I lost. The dealers there, would not talk to me much, not unless you tipped them, then they'll say ""Thank You"". Any other time, they'll probably glare at you for placing a bet. Being a dealer myself, I learned to interact with people, regardless if they tip or not.  Seeing dealers who don't say a thing, makes me wonder, why they even became a dealer and how do they make tips, if their not interacting.  

Over all, I probably would suggest to stay away from Fiesta as much as you can. But if you have too, do not gamble, and just eat there. Denny's food was good, but service sucks after 6am, but if you don't mind the service, then go for it.",VsL7I-dRjo4eToDC7Un_3Q,2,1,2,KHzqB8knq2YRCVqjNZHJ9g
3197728,2011-09-18,0,19umlhmVB9O3njIBfRAe8g,"WORST PLACE EVER. My girlfriend and I stayed here because we thought it would be super cheap. There are several hidden fees and at the end of the day, if we would have paid a tiny bit more, we could have stayed at a WAAAAAAY better place. Trust me.",UO2b3ehhJJOMjtWJPMXpRQ,0,0,1,6vr0rnwL8_2tKhh_hgqeEA
3203032,2018-05-14,0,19umlhmVB9O3njIBfRAe8g,"$3 table is obviously rigged. It always gives dealer 20's or convenient one more than you on the table. Dealer rarely busts making the Bust It game pointless. Table only ever gives money to one in three people playing at the table, otherwise the machine sets it up to always give dealer 20's or hardway wins in perfect basic strategy. What a scam.

A week later I decided to give this place one last chance. Maybe I got unlucky. Nope, same story. Suspicious convenient one more than you. Dealer always had nothing but 19-20 or would get a miraculous low card to keep themselves in while not paying bust side game while always giving player bust 10's. Also miraculous 5-6 card 20's and 21's. This place is a scam. Go somewhere else. 

What's even worse is they contacted me and asked for my information then proceeded to ignore me. Oh yeah really wanna keep me as a regular don't ya? Never coming back here again.",TP3BIySOxUUEqSfn7vus9A,1,0,1,8uyefon3z5WsUDibaIWNgg
3341103,2013-08-26,3,19umlhmVB9O3njIBfRAe8g,"We came for the buffet at about 6:00pm on a Sunday. Regular price is only $9 and we had some two for one coupons, so the price was right  The selection was not great, but decent. They have two soft serve ice cream machines, neither of which were working. Soft serve has become a staple at almost every buffet, so this was a huge disappointment. However, it was entertaining watching people young and old attempting to get soft serve despite the ""Not In Service"" sign hanging on the machine. It got so bad buffet personnel had to remove all of the bowls to keep people away from the broken machine. The lowlight of the evening, though, had to be the poor eight year old boy who got sick and vomited all over the buffet floor, smack dab in the middle. Response from buffet workers to clean up the enormous amount of projectile was slow at best and there were not enough wet floor signs for proper coverage.  Chairs had to be used to keep oblivious people from strolling through the puke and spreading it through the entire buffet. We never did see a mop show up in the fifteen minutes were we there following the initial vomit. I felt really bad for the poor kid and shouldn't hold his misfortune against the buffet. We will probably be back someday, but I need some time for this memory to fade.",18xIAA444UuAWwEWiPCW-A,2,2,2,YCf_4Wc_asnA8eopgIL0cw
3397227,2012-03-21,1,19umlhmVB9O3njIBfRAe8g,"The price of their buffet can't be beat. The food selections may not be as much as the other buffets, but the food they do have is very good. They have a Mongolian station where customers can select their own ingredients and the hamburgers are made to order. The wait to be seated is short and the service most of the time is very good.",la8agHqCk1halDA8DAX7Ng,3,3,4,xTFT7cjXIEUSKxz0EQXp5Q
3419856,2018-05-02,2,19umlhmVB9O3njIBfRAe8g,"This place was HORRIBLE!!! I thought staying at circus circus was going to be bad. F*CK NO!!!! They make circus circus seem like a 5 star resort. We stayed here because we went to their empty club (got dragged into it by a friend) and didn't want to have to drive anywhere else so we ended up staying here. The club didn't have a restroom inside (weird af and inconvenient!) So our drunk asses had to walk through the grimy casino to get to the restroom, hoping we didn't get robbed on the way! I could go on and on about this place, but I'd rather not. They definitely need to put some money into this place and maybe attract a different crowd here.",OEkYRJphzd7EyfxL_43bWg,1,1,2,I5SKn6GOn0wq70zstlOW6g
3591533,2012-10-09,0,19umlhmVB9O3njIBfRAe8g,"My fiance & I went in to check on hotel rates for people coming to our wedding from out of town. There was a Be Right Back sign on the hotel registration desk. We stood there for about 10 min before a lady came over & said they will be with us in a moment. So, finally a clerk comes out and just looks at me. She says ""Checking in?"" & I replied ""No"", so then she says ""Checking out?"", and again I said ""No"". She let me know she was just coming on shift & had to set up the computer, etc. So we waited some more & then I asked for a manager. The lady that was in the back was now walking by & said she was the manager. I pointed out that ignoring customers is probably not the best way to get business & she just wanted to argue about what took place. 
That horrible first impression cost them a lot of money.",DVXyzEsbFM9nfkvDP6-2IA,0,0,1,3D65nBu3KN_0V4xLEfv_ag
3712304,2018-04-09,0,19umlhmVB9O3njIBfRAe8g,"If I could give this place ZERO stars I would. Horrible service, horrible mean cocktail waitresses &  bartenders.
Don't waste your time & money go to boulder station",SIQ7GLJUHvLWr8qmAvNsuw,0,0,1,4cGXe4I_JKEX6iWMC8lyTg
3809740,2016-04-26,0,19umlhmVB9O3njIBfRAe8g,I do like the Mongolian BBQ at the Buffet and Gardunos.   A lot of good food for a fair price.,zlOBgbSyLvju471GiWDcbA,0,0,4,dhLYuJBu0PfpgLwTac7R1Q
3826985,2011-02-03,3,19umlhmVB9O3njIBfRAe8g,"I remember when this place was pretty cool.  When it opened in 1994 it changed the game for local casinos.  It was once known as the ""Royal Flush Capital of the World"".  The Buffet attracted tons of people from all over the Vegas Valley and it was hopping every night.  That was when the Maloof's owned the joint.  

Fast forward 17 yrs later......now this place is a shell of it's former self.  I walked into this place a couple of weeks ago and it hasn't aged well.  The vibe it once had.....gone.  The excitement at the slots and table games....gone.  The happy employees.....gone.

My desire to return to this place.....gone.

Return Factor - 5%",QJI9OSEn6ujRCtrX06vs1w,7,2,2,EPRFkhTyJ9mPi5sNYgMAKA
3835484,2018-06-15,0,19umlhmVB9O3njIBfRAe8g,"I didn't really enjoy my experience at Fiesta Rancho because it seems as though the materials and rooms are older. 

They also don't really offer any really good restaurants. They are average, but priced affordably. 

The elevator basically solidified the quality of this place. It's one of those where you are nervous to enter it because it looks like it needed some fixing!",dtE5sjRYNIUiIiJxHA89Qg,0,0,2,oKIgLZAJdU0OnFdUXFqo3g
3858809,2014-05-13,1,19umlhmVB9O3njIBfRAe8g,"The bed was good. The towels were fluffy. There were flat panel TVs. Water pressure in the shower was good. That's about all I can say that is good. Very small bathrooms, where you can't be sitting on the toilet and close the door at the same time. No in-room coffee, no fridge. I didn't notice it in our room, but the smoke really bothered my husband. He felt like it wafted up through the floor. 4th floor was non smoking, but I suspect the 3rd floor is a smoking floor.  Also, my son complained multiple times about the cooling system; he claimed it was loud and sounded like ""a plastic bag flapping in the wind."" The food at Denny's inside was pretty bad, even for Denny's standards.  The fiesta buffet was pretty good, but few healthy options (probably the norm among buffets). The Mexican restaurant was good but pricey. We will not be returning.",dP1R8pGYGUUEHNbvSDkI9A,3,1,1,zqhg_X807_qDO0-0i68rlg
3879622,2017-03-17,0,19umlhmVB9O3njIBfRAe8g,Used to be a great plan to come. Now too many rule changes and restrictions. I will be looking for a new local place to go to. It's a sad day.,d6BaSRMGaNA1i123wX1KTQ,0,0,1,wMaAMm6kmrJigVJf09-KtQ
3889934,2018-05-05,0,19umlhmVB9O3njIBfRAe8g,"My two closest casinos - just a hop, skip and a jump away on the other side of the North Las Vegas Airport - are this Fiesta (the original Fiesta opened by the Maloof family in December 1994) and Texas Station directly across Lake Mead Boulevard which made its debut in 1995.

The Fiesta is the smaller and more intimate of these two casino options. Seniors with mobility issues may have an easier time getting around here due the more compact floorplan and convenient arrangement of all the pertinent attractions.

The Fiesta has one of the most reasonably priced buffets in the Las Vegas metropolitan area and is always worth a visit with it's plentiful variety of food attractively presented at six cooking stations and multiple international cuisines.

A coffee shop and a Denny's are also located on the premises. The usual casino table games and a plethora of one-armed bandits/poker machines are available whenever your itch to gamble needs scratching. 

Diverse contests and promotions are always underway throughout the year, especially now that the Fiesta is owned by Station Casinos.

Be sure to stop on by whenever you find yourself in the badlands of North Las Vegas.",1aJni3g7tN1ikyCxIHnmtg,0,0,5,uf_eqRFnBhPZYi8mp3Tutw
3971542,2016-01-09,6,19umlhmVB9O3njIBfRAe8g,"I used to come to the Fiesta Rancho in the past but with the building of casinos closer to where I live, the Fiesta became less of an option.

I came here to have dinner at Garduños and I stayed to play some slots after dinner. The casino is on the small side but it is pleasant.  It's a typical locals casino.  

If you have the desire, there is an ice skating rink.

All in all, an OK place but a drive for me to get to.",PKEzKWv_FktMm2mGPjwd0Q,13,9,3,-1lTHSjiu-DcMerK5s86Qw
3977641,2018-03-09,0,19umlhmVB9O3njIBfRAe8g,"Since the last time that I been here it was pretty poor. They picked it up quickly and I realize that the food is being served hot and fresh. I'll come here every once in a while. Maybe I'll stop by and grab some food and check to see if my girlfriend is there. She's not actually my girlfriend, but I just wanna see her cute little butt.. Their buffet needs a little more improvement and a bigger variety.",8xoiTVHPawcYxeaW8fZpDg,0,0,3,YbRIec7UpP13lMdlEesriA
4015051,2013-12-13,3,19umlhmVB9O3njIBfRAe8g,This place made me feel like I smoked two packs a day while just passing through. The air is so thick you can actually see it. The clientele didn't inspire much confidence either. I felt like a victim-waiting-to-happen.,ChshgCKJTdIDg17JKtFuJw,3,2,2,rDhoKCHDdZr_0Tdaelx7gg
4028096,2013-04-12,0,19umlhmVB9O3njIBfRAe8g,"Last resort to stay here, as it was the NCAA championship games weekend, so all the prices for the fancier hotels on the strip were extremely overpriced.  This hotel is old.  Our non smoking room still smells of cigarette smoke.  No free breakfast, fridge or microwave.  (I've received better value at a Comfort Inn which includes the previous 3 items)

Pros: really friendly staff.",C1XZDAUUb3MSUy_Iz-_50Q,0,0,2,ojk2kJ9NuQOgjW3GHcOL9w
4220903,2018-04-21,0,19umlhmVB9O3njIBfRAe8g,"This is one of our favorite local casinos! My husband and I had a staycation for the weekend! The room was standard, but just perfect for our short get away. The service was excellent. Every weekend they have a live band which is always ""amazing!"" So, it makes it easier and safer to have a few extra drinks and jump on the elevator and crash!  The buffet is very good. It takes you around the world Mexican, American, Italian, huge salad bar, sugar free desserts.I love the whole experience and highly recommend this business. I will also say I have never experienced any racist attitudes!",8Fdhqn-_YufU2nx2ea-3xw,1,0,5,jZLGiHhB9IMhXYZmzoFoVg
4238489,2017-04-05,0,19umlhmVB9O3njIBfRAe8g,"Eh frfr, this is the Low-Key hang out spot on Friday Night.  Around the corner is the Mexican restaurant but this is not about that restaurant...another day for that, it is GOOD.  I can't think of the name of the place, but there is a lounge that has a band that play on Friday night.  I personally go for the cheap drinks, but now I go for the PEOPLE WATCHING.  You really get to see locals get down on a Friday night.  

So the lounge has a cool little band that play, kind of has the feel of 'Phil Flowers-esque'.  Ol' skool music, a place where you won't find to many young ppl, no 30 and under crowd over here.  I will be 38 yrs old Labor day, hell I felt like a baby sitting up in there.  This is the place that you would bump into your PLAYA-RIFIC Old Ass Uncle and his friends, still talking about how they use to get down back in the day.  Yes indeed, CATDADDY's and COUGARS on the prowl, and me and my friends looking like fresh fish off the line.  

Cheap drinks, yes they serve the $0.99 margarita, my drinks of choice for that evening was Bud Light (bottled) and Crown on the rocks $13 total.  This is going to be my secret hideout, no need to get all fancy, just some chucks, shorts and a tshirt.  Don't go in there looking crazy, do your hair at least, all I'm saying is that you can go hang out on a super casual status.

A FRIENDLY NOTE: note to da ladies, gear up...I said CATDADDY's and yes on da PROWL.  They come at you at every angle, be prepared.  You've been WARNED.  Sorry, I'm just being honest, you better get your catdaddy's lingo up.  :-)

But this is just my opinion....hahahaha ahahahah I'm over here in tears cracking up, reading this...but it's true",ikEbNrDG-0Qtmo9FFb2qwg,0,2,4,zxeundad_-8stpp-EUGX6Q
4308425,2013-12-21,0,19umlhmVB9O3njIBfRAe8g,Royal flush Capitol of the world my ass. The machines are tight. The clientele is scary. I was constantly looking over my shoulder. I felt so uncomfortable here that a future visit is highly unlikely.,Sn6b4vSAEwvVEw2ZsJ-cCA,0,0,1,ocsW-kdO4XelC-APfJJj1A
4448918,2017-10-22,0,19umlhmVB9O3njIBfRAe8g,"This is a review for the hotel only. I didn't visit the casino.

The reservation desk was speedy and moderately friendly.

A key card was required to access the tower with the rooms. I was waiting in the lobby and I saw A LOT of people having trouble getting their key to work. I had trouble getting my key to work. There's a problem with their key reader that makes it fussy.

The elevator going up to the room was run down and trashy looking. I didn't have high hopes for the room. Much to my surprise the room was nicely decorated and clean. The bathroom was ""economy"" in its styling but, hey, I only paid $28 (total) for the room!!! It was a smokin' deal!!!

Overall, I'd give them a higher rating if they worked a little harder around their rough edges.",gxlxakxEgvE1PYMRvPYgHQ,0,0,2,E-A76YVK6aCpKPRADEp6gA
4452311,2014-08-25,0,19umlhmVB9O3njIBfRAe8g,Another stop on my off strip casino tour.  This is an older casino with a large attached parking structure.  I was surprised to find a Hockey ring here.  It kind of reminds me of the casinos along Fremont before they cleaned them up a bit.  Place looks a little old but it seemed to be pretty busy with a lot of locals.,uIZWBUF9ovbXWG2dVJ6Zfw,0,0,3,rByZSMxz5AWB33v7xx4K1g
4455266,2016-09-07,0,19umlhmVB9O3njIBfRAe8g,"I would think twice before staying in the hotel.  It's cheap, but I'm not sure that makes it worth it to stay here.

The front desk staff was useless.  I was only waiting behind one family, but it took FOREVER to get checked in.  One receptionist was hopelessly trying to help the family, and the other one was just sitting there doing nothing.  I understand sometimes that there's a wait, but neither one of them said ""I'll be with you in a moment"", or ""I'm sorry, I'm in training (or whatever) and she'll help you in a moment"", or anything remotely useful.  When I got helped, not only did I not get an apology for the wait, but the receptionist was rude and brusk.

The key reader to get into the hotel tower didn't work 80% of the time, regardless of the key.  I saw quite a few people struggling with it.

We had booked a room with a king bed, but they gave us a room with two doubles.  We were only there for one night, so we just put up with it because there was no way we were going to try and deal with the front desk again.

The room was clean, but very basic, almost to the point of being prison-like.  If you like staring at cinder block walls, you will love the decor here.  The walls and doors are paper-thin, to the point of being nearly able to hear conversations in the next room.  You could definitely clearly hear conversations people were having in the hallway.  It's the kind of place where you worry that people will hear what you're doing.  The clientele was a bit sketchy since it's a cheap place, but the place was well-lit and had security everywhere.

The casino was fine, they had cheap video poker with decent odds.  I sat at the bar and got a ton of free drinks, which made the whole experience easier.",8zIf_lcx2DGx8V_njPZpcw,0,0,2,1BcHOocxGyIaAgUiJ4u1Lg
4458698,2015-09-06,0,19umlhmVB9O3njIBfRAe8g,"Not in a good area, and it does have a bad smoke smell to the casino.The buffet has made my husband sick several times we don't eat at any restaurants in Fiesta, but if you wanted to eat there; think the Mexican restaurant  is reasonable. it is a ghetto casino I see more low lives druggy people. And slots suck not much play back just like Wildfire. I prefer to play at Texas Station won more",yfgsUkUER6Mf276hlEHI2A,0,0,1,9b5BGH_9hhEVChKvnHK0NA
4552110,2014-06-29,0,19umlhmVB9O3njIBfRAe8g,"We checked in yesterday and chose the Fiesta Rancho because we are here for a hockey camp that is held in the hotel's ice arena. I was a bit worried after reading other reviews that said it was smoky and dirty. I was happily surprised. I've stayed at the Venetian and New York New York and this casino is not much smoker than those. It definitely seems to have a ventilation system.  I have never smoked and am sensitive to smoke but honestly it's fine. It is a casino after all!  The staff has been very friendly and helpful. I was playing a machine and noticed staff going around cleaning, straightening chairs.  The rink isn't too cold for spectators, even in summer clothes.

Food: my teenager is happy that there is a SubWay, Panda Express, and Denny's right inside the hotel/casino. We had a nice Mexican dinner at a Mexican restaurant in the casino last night with yummy coconut margaritas. They put toasted coconut around the rim with honey.  We haven't tried the buffet. They have Italian, Mongolian, not sure what else.

Cleanliness: like I say, they're cleaning a lot in the casino. My room smelled very clean, even a little bleachy when we arrived. The shower is a little worn, but I don't care. They have a non-smoking area of the casino. No tables in that section, just machines. Public bathrooms in the casino are large, modern (lots of tile), and very clean. The carpet in the Denny's is a bit trashed looking but the Denny's is otherwise clean. They decorate a lot and have left lots of adhesive stuff on the walls. Weird, but not an issue.

Room: clean, basic. No microwave, coffee pot, or fridge. They do have wall outlets handy, which is sometimes not so even in more expensive hotels. I have a view of a parking lot, abandoned drive-in and a billboard advertising a Hawaiian buffet. No free Wi-Fi. I think it's $6 for 24hrs. I'm using the hot spot on my phone. No conditioner.  Newer, up-to-date bedding. Air conditioner works great. Plenty cool in there.

Location: 22 min North from McCarren Airport  on MapQuest.  10min North of Downtown/Fremont Street Experience.  Next to Texas Station, same property owner. Texas Station has a bowling alley, theatre, Starbucks.  People say their buffet is good.

Transportation: taxis on site. We took the 106 bus from a bus stop across the street and rode 20min south to Downtown last night to go to the Fremont Street Experience. The bus was running every 30min. $2 for single trip. $3 for 2-hr pass. $5 all day. There is a 24-hr ""Deuce"" shuttle between Downtown and the Strip. It's over 100 degrees, so it was hot waiting but there is a small bus shelter. Not bad.

Pool: basic, small, clean.  Clean towels provided poolside but no food, drinks, or dressing area.

Casino: a few card tables, lots of  machines, a Keno runner circulating at least thru Denny's, a Keno machine area, several bars, a large Bingo hall.  I had an issue with my machine so lit the call button. The guy was there in about 10seconds to re-boot it. Very friendly. There's a bar in the center of the casino; not walled in.

This is not as upscale as properties on the strip, but it's not on the strip.  Smoky? Yeah, but not bad. I would come back!

-AC",CLpTCaFUYFthJn8DznEZ5Q,6,1,4,EkwLSaNjO9QO00LY5O9LDQ
4558353,2011-08-05,1,19umlhmVB9O3njIBfRAe8g,"First of all, I live near this place. Also, I'm cheap and dislike driving long distances. So living close to a place that sells $1 margaritas automatically puts this place up in three-star range for me. What makes it a four, you ask?

First of all, this place is for locals. No doubt about it. This place has deals all the time, and the Latin club inside this place isn't bad at all for the area it's in. It's actually pretty cool. I usually just come here for the drinks and occasional meal at Panda Express, so I don't know how good the hotel portion of this place is. I assume it's also no-frills, though.

All in all, this place is alright. It's cheap, it's close to my house, and it caters to my demographic. I'll be here time and time again.",D-ZyQ4iT1XRFkcOAWXnxCQ,4,2,4,oFcY6upBIF50XZpDc9NgYw
4611917,2014-12-14,1,19umlhmVB9O3njIBfRAe8g,We dined at Fiesta Rancho Buffet.  Service as always was excellant!  Hubby was happy!,nnEnDNIxuOjp7brpTNM9iQ,0,0,4,uiTuWUEpg1gJ9-a5tlSzrg
4625639,2017-04-08,0,19umlhmVB9O3njIBfRAe8g,"The Martini Bar bartender may need a refresher course on how to make an old fashioned. My husband ordered one and I knew immediately it was the wrong color. I am a bartender as well but I hate when other bartenders try and tell me how to make a drink so I kept silent and tried a sip of his drink. It tasted like soda water. No recipe for an old fashioned requires soda water. I told the bartender his drink didn't taste good and he got all defensive and said he has been making these for ""100 years"" and asked if there was some ""new way of making these now or something."" I wasn't questioning his bartending skills or being rude... I just wanted to let him know it didn't taste good. Rule of thumb to this fellow bartender... maybe try tasting your own drinks before you sell them. If you won't drink it... then I certainly won't either. By the way... here is the most common recipe for an old fashioned I could find just in case...

The Old Fashioned is a cocktail made by muddling sugar with bitters, then adding alcohol, such as whiskey or brandy, and a twist of citrus rind.",b-QBXPiLxKth98KDrDcgiQ,3,0,1,WymiYWYVNKP2su75COfdlQ
4631296,2017-09-06,2,19umlhmVB9O3njIBfRAe8g,"Came in with my mother to play bingo, we play on occasion, I never win but it's still fun. Today was NOT FUN. The people who gave us our papers were nice but the cocktail waitress was super rude. She skipped our table and a woman next to us had to get up and go ask her for a drink. Nery was the cocktail waitress. Nery told the woman she already went by our table and she put in her order but after the women told her she skipped us she got an attitude and said fine and ordered the woman her hot chocolate. She brought the woman her drink and we politely said excuse me we were skipped and would like to order a drink. Nery responded with ""I came but you didn't hear me"" we very nicely told her no one at our table saw her come by and she got really rude and said ""fine what do you want"" at this point we declined drinks and said nevermind. I don't appreciate her speaking to us that way. She said ""ok"" rolled her eyes and walked away.  I've never seen a cocktail waitress act that way!",W8kK7Ntnrk_kY3b7PNX9IQ,2,0,1,qX1y5vzza4FRpRO-z3eb3w
4705886,2017-09-04,0,19umlhmVB9O3njIBfRAe8g,"Station Hotels has managed to turn this place into a bigger dump than it originally was. We came here to eat at Garduños Mexican restaurant which is now out of business. 
We ate in the Buffet which was decent except for several dishes that were luke warm at best. 
We left without gambling.  We have learned on too many occasions that you cannot win a dime at Station properties.  They sucker so many people with their tv ads which are just a come-on to get you in the door. Think anyone has won more than $5 with those stupid ads?  Very few. Maybe 1/2 of 1%!  Never again to this horrible casino.",wXR0Bis9TnbJR1ijE49sfw,0,0,1,ZnWvIkwgjGkCOdvyL7IAAQ
