,date,funny,business_id,text,user_id,useful,cool,stars,review_id
5663518,2016-02-15,0,1MrSwj8i2VEBHdp3IsWCpQ,"Well the three amigos had mixed feeling on this fairly new restaurant.  The atmosphere is great, we loved the sea shore motif and the large outdoor patio.
Nearly all of the food here is ala carte. The moment we took a seat the waiter was quick to bring a cup of their seafood broth in this tiny silver cup.  I thought this was kind of odd and felt the soup should have been delivered after we had seen the menu and at least ordered.  Ignacio loved the soup, Uriel and myself both thought it was way to fishy.  Yea, I know its a fish soup.  But while it came with a lime wedge we just did not like the flavor.  We started with the freshly make quac and chips.  It was a nice size for $6 but for us we added more lime and salt.  Ignacio had the gordita plate @ $9 choosing the chicharron and the Rajas gorditas. These were not a hit for him as he said they lacked any flavor at all and the rice an beans that came with it were just mediocre.  Uriel had both the shrimp tostada @ $6 and a carne asada taco at $3.50.  He was more than happy with both and said he would have them again.  I had the shrimp caesar salad @ $11.  This came in a nice large bowl but the salad was mostly the inside lettuce pieces of the romain lettuce.  I pulled out 3 or 4 pieces of core from the salad which just is really not even edible.  The rest were the inside leaves of the romain and not those large green delicious outer leaves.  The shrimp was small and the croutons were plain as was the dressing.
While we had a groupon worth $20 our bill still came to $29 making this meal $49 plus the tip. So this place is somewhat more expensive than your average taco joint.  The owner did bring us a couple items to try because Ignacio did tell him he did not like the gorditas.
I think we will probably try this place again in the future.
Enjoy!",hLdd68fn1VP1s7BAZElNhQ,0,0,3,-DHj0T_8pn0lf_OfQox3oA
5664128,2015-05-02,0,1MrSwj8i2VEBHdp3IsWCpQ,I Love This place! Finally something different not your typical tacos the fusion of flavors is amazing 2 tums!!!,flsiwF0uB8dhLyT_29mnLA,0,0,5,svhc5qQ6-Idz1lZZznB2Rg
5674658,2015-04-24,0,1MrSwj8i2VEBHdp3IsWCpQ,"Today's lunch was a pleasant surprise, we happen to be their first customers. The food was very fresh & delicious. We were immediately served, very attentive friendly staff. They have some unique items on the menu and the establishment was tastefully decorated.",nAyqw8U_sZfpmsINjeq_-Q,2,0,5,B9xoddnrdr6_SBLG4EEB6w
5680908,2016-09-18,0,1MrSwj8i2VEBHdp3IsWCpQ,It's 7:30pm Saturday... and they are closed! They should update their hours... or continue to waste people's time. How upsetting.,N1SRDhbaevbQZc0NleHUCA,0,0,1,3SDGv7UaAoF5wjypcT-ijw
5726603,2015-08-27,0,1MrSwj8i2VEBHdp3IsWCpQ,"Super nice experience over all, the place really nice,clean, the service really good, she was always checking on us making sure our drinks where always full, but the way the jamaica was delicious it was obviously the real thing not the fake stuff that they always give you other places, I have the chance to try the lobster, shrimp and fish tacos and it was Delicious the fish my favorite,shrimp really good lobster to but a little bit over priced for a person who will eat 5 tacos ( me) lol.... And of course They have a lot more to choose from but definitely is going to be my place to go for fish tacos and real good Jamaica.... Oh and don't forget the dessert you will not be disappointed",KZYZfT_BeVDYusXDL7WQXQ,1,1,5,25Xcvm4LhoJtWWy0gbxw3A
5731370,2015-09-12,0,1MrSwj8i2VEBHdp3IsWCpQ,"Second time I've been here now, and I must say service was slow both times. The server/host/food runner combination really takes away from efficiency in my opinion. However the server is always friendly, despite the lack of expediency at times. 

Moving on from the service, the food is actually a refreshing change of the usual Mexican foods, as you won't find the generic carne asada and such dishes here. Octopus Tostada is one I highly recommend, very nice blend of textures and flavors. Price is also very acceptable for the portion and sizes.",7HfB-_decLkQCC8yC5glag,0,0,3,8PM3U4yhXrr4n6v2vpSBZA
5747881,2015-08-07,0,1MrSwj8i2VEBHdp3IsWCpQ,"This place is amazing I am so happy to have been introduced to this place. Everything was fresh customer service was amazing and it is very clean!! 

I got the lunch special $4.99 two tacos of your choice a small shrimp soup and a agua fresca either jamaica or horchata it was delicious filling and such a cute presentation!!!

Highly recommend it!!",HZ6aEh5Clu6qZ1QZY5bfWA,2,0,5,cl2Zy_25AkMxTWKSYEs4vA
5846157,2016-04-27,4,1MrSwj8i2VEBHdp3IsWCpQ,"Well now the make the own rules we been there few times never a problem with the gruponn  now 
They didn't want to take it why the have to be so picky because my date was Latina big BS 
We had a Groupon to spend $40 with 4 guess they never enforce that until today .. we spend over $40 in you over price food no way Jose ...
Off my list.  Over price tacos any ways...
And every thing else..
THIS IS A MEXICAN JOINT IN THE GETTO 
YOUR ARE NOT ON THE STRIP.....
no wonder they have a Groupon deal to get people in....",PFENoZUD77aioJGrnllIKA,1,0,1,QOy_blpFBL40ltJIk4VyFw
5896939,2015-07-20,0,1MrSwj8i2VEBHdp3IsWCpQ,Super great service and absolutely delicious food. I am impressed and will be returning to explore more of the menu. I am very happy I found this place.,YdQFuCJsVvPXmUHpWDgVdg,1,0,5,8eVsOx8RR8To4N-TjR0G_g
5982124,2016-06-03,0,1MrSwj8i2VEBHdp3IsWCpQ,"What a great place!  Good service, nice vibe and amazing food.  We had the 'house special' Costra, the octopus taco, the seared ahi tuna tostada, hibiscus water - and finished off with a Nutella crepe.  Everything was first rate, tasty, not too spicy.  I will be back!!!",LIeFHPRfI_pBtCqVrgQ--g,0,0,5,jHet3Y7U6Quvnx7jgr6bgw
5982312,2015-12-29,0,1MrSwj8i2VEBHdp3IsWCpQ,This place is literally the best!! if you haven't tried it or don't like Mexican food you're definitely missing out. I'll keep coming back to this place,BsNiE8LnkspJ9VlwLK4uZA,0,0,5,IbJiF6CGeqjPONLAuhUYtQ
5988355,2016-04-30,0,1MrSwj8i2VEBHdp3IsWCpQ,Have been a few times and never disappointed! Great variety and quality of food! Good service as well!,lyBhGOZSUKMxy-pwDqwAjw,0,0,5,iumbODzZcA1kYDmeysi6VA
