,date,funny,business_id,text,user_id,useful,cool,stars,review_id
5585121,2016-01-08,0,3QzPhQ3ltbon0-1gC7Q18Q,Hells ya great place to grab a beer after checking out freemont street. Pizza is bomb too!!,_fX0XQdoX-Ff0cWSrfCf3A,0,0,5,vbde64QBjP1jC22ctEtn4A
5604186,2015-10-08,2,3QzPhQ3ltbon0-1gC7Q18Q,"It's a nice little unpretentious drop by spot, you can either take a seat and people watch, or grab a quick brew to go. Sadly, kids aren't allowed inside, not even on the patio, they would have actually really liked the food selection. 
 That's the only thing that kept us from eating here, so we had to grab dinner elsewhere to accommodate the family. 
 However, I did take a Pranqster from North Coast Brewing Co. to go, never heard of it before, turned out to be a delicious wheat. Will now look for it, it was fresh, smooth, very tasty. 
 The girl working the counter was very sweet and super friendly, the patrons seemed to be having a great time. Definitely a return to place in the future, hope to try the food and experience the patio next time.",7Vfy39A_totC-w70qZi0MA,3,3,4,KjR9f1IrcDgIvRl6S-MZeA
5726698,2016-01-15,0,3QzPhQ3ltbon0-1gC7Q18Q,Good selection of beers. Never noticed it there and I go there twice a year. The beer is a good price ($6 for an IPA pint) The bar staff was very enthusiastic and fun. Enjoy it. Would recommend a stop in of you are down in old Vegas.,2m44NBBJCcff2c22JwQ0zA,0,0,5,IxHWrexidKe6pSgiGV3Ehw
5736805,2014-06-10,1,3QzPhQ3ltbon0-1gC7Q18Q,"A few of us decided to try this place out for lunch and we were pleasantly surprised. It is located next to the food court and is a step above your basic food court options. They were working on the patio area, adding more grass, but it looked really cool. There are TV's and a cute little structure outside, but I didn't see any fans or misters. This may be a cool area to hang out at night or in the spring or fall. The indoor seating area is actually quite small, there are maybe 5 tables, but there is a ton of counter seating. 

The waitress/bartender was SUPER nice and attentive. She greeted us and walked us through the menu. I don't drink beer, but they had an elderberry cider on the menu so I decided to give it a try. It was delicious and I'm happy they try to cater to everyone. We started with the giant pretzel and it could easily feed more than 4. The pretzel was warm and super tasty. The German sweet mustard on the side was a perfect accompaniment and made us all very happy. I ordered the Stardust and it was very large. It also came with my choice of fries, crispy onions, or coleslaw. In my world only fries exist, so that was an easy choice. The sausage was flavorful, but there was a bit too much bun. I wish the onions were a bit more caramelized, but the flavor was really great. The fries were crispy and delicious and there was the perfect amount on the side. Overall, we were really happy with the meal and experience. I would definitely come back in the evening to enjoy the outdoor space with a brat and a beer (or cider).",p9TNT6pNKRuvBSzNf27JkQ,4,2,4,ksY6x0D15anW2wSZ1S-K1Q
