,date,funny,business_id,text,user_id,useful,cool,stars,review_id
51729,2015-06-24,0,45513UgSlMqWV_yAPVkXrg,This is hands down the best Pizza & Wing spot in town!!! Vegetarian Pizza & Hot Wings. Money Team Approved. #TMT #Authentic,aa-KQ0ppeZ4yDvnKTuPqPw,0,0,5,GGciWgIjb3-6L-L31uH0Mw
82674,2015-10-24,0,45513UgSlMqWV_yAPVkXrg,"Excellent.  Had burger and fries and both were awesome.  Also ordered a pepperoni pizza.  Perfect NY style pizza.  Only problem was I ordered more than I could eat.  For the price, I expected much smaller portions but the bacon burger was huge and came with a ton of fries.  That was more than enough for my meal but adding the pizza was going overboard. It was so good that I tried my best to finish it all.  Oh well, the pizza will be a great leftover snack. Also I want to add that the delivery driver was nice and friendly.  Very polite.  Overall a great experience.",o8nG7FuWRj3gOAYXezPk7A,0,0,5,cklyMKztqcVCiZAJZtf-RQ
104098,2016-12-19,0,45513UgSlMqWV_yAPVkXrg,I ordered a pizza and wings. The wings were overcooked and the pizza was dripping of grease. The worst i ever had. The delivery driver was very rude. I told him that i dont want it because it was so greasy. He told me to go. F*** you. I should have never ordered from them,KW4_bnhg0QuQQFisbWAfpw,1,0,1,YULysdqSbtSWpvEzwS-J1A
105369,2017-09-28,0,45513UgSlMqWV_yAPVkXrg,A little delay in the rating but I had this a few days ago and the pizza here is amazing!!! I have had pizza all over Las Vegas and anyone who has also went in a pizza adventure they know it's hard to find good pizza in this town.,XtrD6ir1X1D3swpAWgALrg,0,0,5,QcoMCV3i6mW5Apur1OOklw
140210,2014-09-03,0,45513UgSlMqWV_yAPVkXrg,"ICK!

We received a flyer today for this place and decided to try it out. Terrible decision! We just wasted $35 on mediocre food.

We ordered an 18"" Supreme Pizza, a Patty Melt and Fried Mushrooms. The pizza was very burnt and had to be sawed through with a steak knife just to cut and was painful to chew. We ended up having to removed the cheese and toppings just to eat it and leave the breading behind.

The Patty Melt came on a sub roll rather than on Rye and there was little meat. Not to mention, the fries that were supposed to come with it didn't. 

The fried mushrooms were ho-hum and did not come with dipping sauce as they should have.

I WOULD NOT recommend wasting your money on this place unless you prefer disappointment.",pk4kVtaCAfhyr7QBpQnRAw,0,0,2,VX7CKEXivGxk5jAbz5HtAQ
186563,2016-09-04,0,45513UgSlMqWV_yAPVkXrg,Good pizza nice staff went the extra mile to give good customer service I would recommend.,vCJue4UthAUcvwFJNpebgQ,0,0,5,Byx8wCWpZ-ra_fALCd9WLw
315806,2014-05-19,0,45513UgSlMqWV_yAPVkXrg,"My husband and I have called several times in the last month, more than I would like to admit, they do a good job and the food is tasty. We've tried several of their sandwiches, strombolis, pizzas, and chicken fingers. All good every time. Reliable.",nveECOFDrqvXD93KePAUEg,0,0,5,-3gSqJI80sqdLDvHH4xscg
424337,2015-11-27,3,45513UgSlMqWV_yAPVkXrg,How did ppl rate 4/5 stars?? Like what are you tasting??? I went based off reviews. It was my thanksgiving dinner so I still ate everything but eh it seems like it's hard to find good local wings here in Vegas lol. Oh yeah and the wings don't already have sauce on them it was all on the side? And the sauce is nothing special it's basically Louisiana hot sauce. Thanks anyway!,zi67-P_zxvuGpfoQqbeuyg,4,0,1,uiaZgKI593Y0y-b_1AthsA
483560,2017-09-13,0,45513UgSlMqWV_yAPVkXrg,"Great spot off the strip awesome $3.99 
2 slices of pizza deal with Soda
Awesome place just around the corner from the strip 
Delivery is available as well",dXQX4itzl6dvl2p6a2HLxw,0,0,5,khmv5f1yG2773slqh4R7RA
521521,2016-08-18,1,45513UgSlMqWV_yAPVkXrg,Awesome stop for some quick pizza at a good cost. Usually order delivery which is always consisten fast and hot. The owner neon takes good care of his regulars and makes sure of the service. Will definitely continue to order from here regularly...,YPD4JbuvOy3uvr3GuzZT4g,0,0,5,DLSxCJLYRr589mkYB-7zsQ
650927,2016-09-11,1,45513UgSlMqWV_yAPVkXrg,"Terrible food. Terrible service. A very unfriendly, sad guy reluctantly took my order, with what can only be described as a look of despair on his face.  I felt like I had inconvenienced the restaurant simply by walking in. It was as if I had ruined this guys day by deciding to eat here. The fact that the pizza was one of the worst I've ever had wasn't even the worst part of the experience.  If you want to be saddened, and treated as if you are a burden to the business, then this is the place you should go.",XIiuItxjrs3ftR6XwB80CQ,1,0,1,yeiqxAW2eR0RHiyH2EpGJg
653952,2016-04-12,0,45513UgSlMqWV_yAPVkXrg,"Ordered delivery from Verona and the experience was not great. The menu said we would receive salads and bread with our entrees. None was in the order. The fettucine alfredo opened in the bag and sauce was everywhere.
Otherwise, the food was solid. It wasn't amazing, but it wasn't bad. The mousse cake was quite good though.",_MWSX7DUY-7-x_f_RJbvOQ,1,0,2,PFK7VeRRa3fvbwvEkthHhw
683716,2016-10-25,0,45513UgSlMqWV_yAPVkXrg,My order arrived an hour an a half after I ordered it. It was cold and really was just cheap frozen food I could have gotten at the dollar store. The kicker is I was staying in a hotel for the night while my apartment was being renovated and there was a surprise $5 surcharge for delivery to a hotel which the delivery driver said they wouldn't have charged me if they had known I was a local. Who treats people like that?,oO0T0lk6tXE-FkpQC_X6NA,1,0,1,GtgEz9azlsfinXwqiNDdGA
770133,2014-11-01,0,45513UgSlMqWV_yAPVkXrg,"Great customer service and reasonable prices. When you need a late night pizza, they are the best!",O11tw0DcEqxYmismRwaFoQ,0,0,4,6-oDNgWvBs_2IoN7M4o7qw
893920,2017-01-03,0,45513UgSlMqWV_yAPVkXrg,"First time. Last time.  Ordered delivery because we were busy at work. All prices on their delivery flyer have changed. Didn't even offer to honor it. Says free delivery - there is now a charge. Took over an hour to receive 2 orders of chicken fingers and a sandwich less than 1/2 a mile away. Fingers are overcooked and now rubbery.  Meal came with a can of soda. We asked for coke (they didn't have any) so we asked for 7up & Sunkist. We got 2 7-up. As stated in the headline - first time, last time.",sJ810jkTNAjvpl-sg91_OA,0,0,1,SKpWRihauR0Q_NrnS81BAg
937750,2016-08-21,1,45513UgSlMqWV_yAPVkXrg,"Sorry I ordered take out and wasn't impressed. I ordered the meatball submarine - you didn't get whole meatballs just thin slices of meatball with sauce with a lot of bread. I ate it becuase I paid for it, but for the money I should have received full size ""meatballs"" not slivers of meat. I ordered a greek salad and they gave me a tossed salad. I still tipped the driver becuase it wasn't his fault - but save your money and go elsewhere.",fMnwCOUf8OhO-QX6g6TwhQ,2,0,2,CogkEfQNlm3NNjNarJqFCw
1010297,2015-11-20,0,45513UgSlMqWV_yAPVkXrg,"In Vegas from out of town and wanted some great pizza, therefor I found Verona Pizza on Yelp! & I do not regret it ! Ordered a 18 slice Supreme Pizza & Mild wings, flavor was on point for both items. The employees / owner are beyond great. They made sure food was right or if we needed anything & very attentive. I'm most definitely coming back in my next trip to Las Vegas. Not to mention its conveniently not too far from the strip :-) thank you Verona Pizza",OldLP1V7zuqpGDDewTW2Tg,2,0,5,kkMtDo4z_jkwMC808s5xZQ
1090974,2017-12-17,0,45513UgSlMqWV_yAPVkXrg,Was looking for great late night delivery food that would arrive hot. I have no way to heat food in my hotel room. I ordered the Chicken Parmesan with meatballs and a soda. The food arrived on time and was carefully packaged to keep it warm. The drink was cold. The chicken parmesan and meatballs were excellent. I was so happy to get a flavorful warm meal without paying anywhere near the price of the restaurants in this Las Vegas Strip hotel! I have two more days here and will definitely be ordering again from Verona Pizza. Delivery is facilitated by Eat24. I was able to use the PayPal option as a secure way to pay for the meal.,HhHtOSjqEjreB3oTPDc5Ww,1,1,5,G4FD4aVBvbHPpzmJrBZDEw
1166956,2017-02-07,0,45513UgSlMqWV_yAPVkXrg,"I ordered the 2 cheese slice special w/drink for 3.99

The pizza was tasty and seemed fresh.  I was in and out in 5 minutes.   Great deal for a quick and tasty bite.   I will definitely be back....",yI27yodFNujaCHlNDr_rVw,1,0,4,_REn_xaHviUTlSmTx8yYuQ
1171477,2016-07-14,0,45513UgSlMqWV_yAPVkXrg,Delivery was 10 minutes sooner than estimated delivery time. Pizza was fresh and reminds me of home (NY style). Driver nice- waited for me to maneuver down from my hotel room!,YlheJuG-s25jFADIWt1iIQ,0,0,4,Hp_mRVuVan8idcX9v78rfg
1217927,2017-02-09,0,45513UgSlMqWV_yAPVkXrg,"I've been eating here for years and the quality has never changed. Their food is delicious, and when you're looking to grab a quick bite for lunch, you can't beat two slices and a soda for $3.99. Ordering a pizza for dinner is never a bad idea either. I'll definitely continue coming here for years to come.",CkfUmtcYXl3uJiGBtsaw5A,0,0,5,pUVKtFVikJgaUVilgGntJw
1357108,2016-05-09,0,45513UgSlMqWV_yAPVkXrg,The owner himself made the pizza for us...the veggie pizza was very delicious...the taste was similar to what I used to eat in india..I would definitely recommend!!,EaBw2scvvXymw-LEa3th5A,0,0,5,vd2X6GIg1LATuKajUM266Q
1379236,2018-01-21,0,45513UgSlMqWV_yAPVkXrg,"2.5 hours, multiple phone calls, 30 plus minutes on hold. No food. Promise of a managers call tomorrow and as of now a supposed refund. Absolutely unbelievable, also let the record show that the business number goes to ""call center"". I'm a very understanding customer but this went to a very unacceptable level.",UKYXeCi97sg0yKj9lZa9Fw,2,0,1,opa2CwS_qeYxZuszs9HdOg
1411531,2016-09-19,0,45513UgSlMqWV_yAPVkXrg,"Unfortunately, at 10:45pm my hunger pangs set in and I was on the hunt for food. 
I called Verona Pizza, unaware they would be closing soon, and put a small order. The man checked with his driver to see if they would deliver. Lucky for us, they did!!! All I ordered were onion rings and chicken wings, nothing fancy. But you know what?!?! It was BOMB! 
They delivered my food fresh, hot, and damn delicious. The cook was thorough and had the correct amount of crisp, which told me they didn't rush the quality of my food. 
A wonderful mom and pop restaurant providing excellent service with damn delicious food.",B8jDgDcUduR3EyGDso0T3A,1,0,5,FLH_MopQ7rENPOQIOxZO3w
1603046,2017-06-26,0,45513UgSlMqWV_yAPVkXrg,"Got into town on the New Years Eve of 2017. Wanted a decent delivery pizza. Chain pizza is a no-no if you know pizza so I gave this place a shot. I have eaten pizza from coast to coast in well over a dozen states. I have lived in PA, CO, CA, GA and spent a lot of time in NYC. I have had lots of pizza and I will give this pizza a 7 out of 10. 10 being the best. I don't have anything bad to say about it, but I have had better. I saw a couple of postings knocking them for the amount of grease the pizza had. Well some of the best pizza in NYC is greasier. 

I would order from here again.",o3R62kTkhl0iw8MXaEYTow,0,0,4,naYbe8Qui440uSq79sstsQ
1635159,2017-10-22,0,45513UgSlMqWV_yAPVkXrg,Delicious pizza and wings. The pizza is thin crust and perfectly toasted. The wings were delicious and perfectly sauced. We came in late after a wrestling tournament and the staff was accommodating and friendly. We'll be back after next year's tournament.,wKF4uKuMsGJpuy3URcMoZQ,1,0,5,jq-gbHisAp1yl6Cez9eQdw
1692142,2013-12-20,0,45513UgSlMqWV_yAPVkXrg,"Verona Pizza was the pick for lunch in the lab today because a pamphlet was thrown in the crack of the door of a friend's apartment.. 

We ordered a large pizza topped with just pineapple (a favorite of a girl in our lab, who's vegetarian), an order of chicken wings spiced medium, and a 2-liter of soda (Sierra Mist). When I arrived to pick up the order, we were greeted by a gentleman who told us that he had just called Tim (the guy who placed the order) to let him know it was done- he didn't want to take it out of the oven and let the food get cold. ""Cool!"" I thought, as I paid the man and picked up our food, which came out to about $28. So while we were carefully juggling all the food, he asked us where we worked and asked us to hand out some menus and call him after our meal to let him know how everything was. They get an A in guest service, I really appreciate when an owner cares about the guest, but the food wasn't all that special.

Pizza: The dough wasn't that bad, but the sauce was lackluster. Unfortunately, bland sauce typically means bland pizza. Cheese was adequate and there was plenty of pineapple on the pizza. It was nothing to write home about, but it wasn't terrible either. I don't know that I would come here for their $3.99 2 slice pizza special as others have come for, since I imagine that re-heated ordinary pizza is probably worse. 

Wings: The wings weren't bad. There was no spice to them at all, and they were overcooked a bit (I think the restaurant probably par-cooks them before then refries them to order to make sure everything is cooked). Although I appreciate them taking the time in serving fully cooked chicken, they would definitely be better if they were cooked completely to order. There was many more wings than I had expected, although they were small. One more bone to pick, if I must, there weren't any carrots or celery served with the wings. :(

THE RANCH HERE IS DELICIOUS!! It probably knocked the wings up from 2.5 stars to 3. 

Overall, it wouldn't be my first pick for pizza. HOWEVER, since the place is right across the street from UNLV, I imagine we will be ordering from here at least once more. I plan on calling the manager/owner tomorrow and letting him know how lunch was. Who knows, maybe they'll impress me next time. :)",lluNN1aQlFN7NQQ2BxFBUQ,3,1,3,OmSxXv6v7fvEP_HyUwkltQ
1702962,2018-04-22,0,45513UgSlMqWV_yAPVkXrg,"This place is good for cheap pizza & that's about it. The crust has an old oven like burnt crust taste. The pepperoni is basic, and the cheeses on the toppings are just edible. $4 will get you 2 slices & a can soda. Slices are $2 & extra toppings are just 50cents extra.",YnAdjnp47pG54vfgLF3TOg,0,0,2,FJCMhlBTfNHCYozEA_YmXg
1737937,2016-05-09,0,45513UgSlMqWV_yAPVkXrg,"Hopped in by accident, but Mind you this is one of the best places to have freshly baked oven pizzas. The owner of the restaurant himself made the pizza for us. Extremely humble and friendly owner. If you are confused after the glittering Vegas, this is the place to be!",CHowJHyaHHBfXhVKRmWkvw,0,0,5,eNc7bHA3U2qx7xE8J2YBDQ
1798058,2014-12-31,1,45513UgSlMqWV_yAPVkXrg,"Both awesome and amazing!
You got that great customer service by the manager, Mo, combined with super speedy delivery by the driver, Tim. This team rocks! 

But, of course the real star of the show is the food!
My staple dish is the Spinach Stromboli. What were talkin about here is well baked dough seasoned down to a science stuffed with fresh spinach, onions, fresh garlic, and loads of feta cheese juiced around in olive oil. Mo makes the calzone himself. And, it is gooood.  The portion is huge and the fresh tomato sauce is homemade.  For $8 you cant find a better deal in town. And, especially not delivered to your front door at such a low price. 

Tim, the delivery driver is fast. 
Now, this is to be expected. But, what came as an unexpected surprise to me was how clean and polite he was. His car was very clean and neat. Nobody wants food from a dirty vehicle. And, his personal appearance and demeanor were both professional and groomed. He was very polite.  It is a genuine pleasure to give him 20%+ gratuity every time he delivers to us. 

I have nothing but good things to say. I only wish I could walk to it from my home. I would eat here at least twice a week!",n8EU0_mKr2TX8iz9a7yHxg,1,1,4,cFvdaDc39BRLSc-NXFb8_Q
1823332,2016-04-08,0,45513UgSlMqWV_yAPVkXrg,"I ordered from here today. The man I presumed was the owner was very nice, addressed a traffic problem that might have slowed the delivery, but nevertheless arrived early, and the pizza was great. He was as courteous in person as he was on the phone.",vxtUkIpzjN7xjOao33ilZg,0,0,5,lzn9dTsCy4EAIF33bLvGBA
1832522,2015-02-18,0,45513UgSlMqWV_yAPVkXrg,"Yummy pizza, fast and inexpensive!  $3.99 for 2 cheese slices and a drink!  Owner and workers were very nice as well",HFqTmJmP6cKFnHSAf9SIpg,2,0,5,OGLv49iCbX4ul6nS9kfWDA
1890792,2016-11-16,1,45513UgSlMqWV_yAPVkXrg,Inexpensive greasy pizza. Bread and cheese that's about it. Enough grease to lubricate a bus.,v72-S0kcq2FFSRTBKpO2eQ,1,0,2,k_bQIXz-ZuyWtO-J9Imrew
1903279,2018-02-10,0,45513UgSlMqWV_yAPVkXrg,"Wow 3.99 for 2 slices and a drink, and better yrt......the pizza is actually really good.  My slices ehere freshly prepared and cooked as I waited. 

Friendly engaging owner, I highly recommend you give this small business a try!",doQXKQEh5ZEHuTdXps-zQg,0,0,5,iaKkSTiTOf5HtqSMRGHWug
1907443,2016-10-01,1,45513UgSlMqWV_yAPVkXrg,"Ordered take out to be delivered to my hotel after a conference I am attending.  The only reason that they get two stars instead of one, is that the salad was fresh and just fine and the garlic bread was okay.  However, the eggplant parmesan was HORRIBLE.  Overcooked, completely soggy, with soggy overcooked spaghetti.  I had ordered it in order to save half to take on the airplane for lunch on my trip home-- and instead, I threw it in the garbage.",yGrAWUx5nCwY3jG4_kbxtg,2,0,2,UL1JfTYK6c_gZrhPF3xWrg
1948760,2018-02-25,0,45513UgSlMqWV_yAPVkXrg,While in Vegas we were on a budget and as usual everything is so expensive. We found this place and it was awesome; great wings and even better pizza!! We got the cheese pizza and it was great.,fiK_CEfxzAhPYAZA1k1P2Q,0,1,5,-nIaahQej2Qyk-bAc87XXg
1999539,2016-03-05,9,45513UgSlMqWV_yAPVkXrg,"Low prices don't make pizza taste better. $4/2 slice combo is a bargain, but the pizza itself lacks flavor in the cheese, sauce, and crust. I added mushrooms (slimy and canned) and pepperoni and that was all I tasted. Service was friendly but I wouldn't come back for the food.",bLbSNkLggFnqwNNzzq-Ijw,16,7,2,bPPRctvnFmco5LS6thGEhQ
2047372,2015-02-08,1,45513UgSlMqWV_yAPVkXrg,"That bacon cheeseburger is delicious and all..but don't be fooled..that shit is turkey..it's turkey bacon in your bacon cheeseburger

Also the chicken wings...they say size doesn't matter, BUT THEY LIED!!!!!!",SQ3vZwUhkogfYt_9rXCSiA,0,1,4,Y5ALgd8rsN6x9tuVnPYgaw
2385705,2011-01-25,1,45513UgSlMqWV_yAPVkXrg,"eeeeeeeeeehhhhhhhhhhhhhhhhhhhhhhhhhhhhh it was ok.

...continues search for best pizza in the 169",m0aeKCg9AAvwvnKUf1Evcw,0,0,3,_5-nMMBIHVT4OTU6PZT8kQ
2416676,2011-07-17,0,45513UgSlMqWV_yAPVkXrg,"We originally went to terrible's casino for some cheap dinner now, which was around 10:30 pm, but graveyard specials didn't start til 11pm. So I kinda waited around before deciding to leave my folks and walk down flamingo and see what there was to eat cheap. I was starving haven't eaten since breakfasts. Busted out the yelp app and saw a donuts place nearby.  Walked towards the donut shop then changed my mine. Ended up winging it and just walked, passed Roy's and saw 9091. Ok let's do this. Aww closed. Ok what else was there, I didn't want to walk back without anything. Walked some more towards jack in a box, didn't really want to settle for them and hoped there was something on the way. A message place, a pizza place looked like they were closed, a nice dressed restaurant skipped it  i was in  shorts and slippers, walked a little more then turned around to see if the pizza place was open. Ahh Verona Pizza, a girl was cleaning the floors, chairs were up, has to be closed nope they were open. A relief, saw the $3.99 for 2 slices of cheese pizza  and a soda and got it after checking out the menu.  Sat outside, enjoyed the full moon, cool night, pizza slices and soda, fast and friendly service. Pizza was very good, made like NY style but with a better tasting dough, thinner crispy edible crust, light and not oily or greasy which helps a lot because it wasn't a sloppy and saggy mess. The owner or at least what looked like the owner seemed cool too he spotted me the tax cause I only had $4 cash and my card.  The rest of their menu was looked pretty good and at a good price, definitely coming back. 12 wings and a soda for around 6 bucks.

My night here wasn't actually over with the food, it is again Vegas on a Saturday night. During my meal, a guy asked me to use my phone, no problem looked like a local boy from Hawaii probs UNLV student who was stressing cause his friends left um there. Hawaii people can usually spot each other out and always show that aloha when needed. But if he wen dig wit my phone, my slippaz was off and ready fo run lol. Later on there was a customer who walked out of Verona swinging his carry-out pizza box in all kinds of direction and the owner looking guy ran out and nicely scolded him and told him that he was gonna mess his pizza up, probably first time having a pizza in a box lol. Also when I was about done there a guy who was walking back and forth, in and out of Verona, across the parking lot, who I thought was a regular customer waiting for pizza. But then he stood by the entrances 10 feet from me, quiatly speaking to himself, then went all out talking to himself swing his arms, shaking his pocket filled with coins, sounded like he was bragging about how much coins he had. I dunno I was already done and bailed. Pretty good night so far enjoyed my pizza and energized myself. Lol sounds more like a Facebook update then a review but I figured share my experience.

Add they have sitting indoors and outdoots. And a big menu that includes, pizzas, salads, calzones/stromboli, sandwiches, and more. Open til 2am Fri and Sat, 12 am Sun-Thurs.",vWP8-aQX0rYJszqkWVL7Ew,1,0,4,p4DsB0zA0Ut19G0p9z-GKA
2424394,2016-07-25,0,45513UgSlMqWV_yAPVkXrg,Very good Stromboli and wings! Fettuccini Pasta was not the best choice here. Best to take out or have delivered. Dining space is small and hot (next to pizza oven),bZgdyaBYa5GN-VxbAfVlIg,0,0,4,OvbV8P5uiC9pS55Vw0syHw
2548813,2018-05-14,0,45513UgSlMqWV_yAPVkXrg,"The food was very good. I always judge a pizza place by How their cheese pizza tastes. The ingredients tasted fresh. The dough and sauce were good . And they have slices. And I had a good conversation with the owner, he was very friendly. I will be back here.",HJaEtUfoP5fAmuM9lXjnKQ,0,0,5,BGpqysEv8-CrIeSbYxcqXA
2611225,2015-02-21,0,45513UgSlMqWV_yAPVkXrg,"The owner was nice and friendly. Food was fast and fresh. We had pepperoni pizza, mozzarella sticks (really good!) & wings which were crispy with just the right amount of delicious sauce. Overall great experience!",7VaxNpgksMnbXXcw_JwiFA,2,0,5,qqAjfp8K1ISMSaJTXORicQ
2612739,2017-07-28,0,45513UgSlMqWV_yAPVkXrg,"Horrible customer service!!!!!!!!!! Food was okay, but the customer service was so bad that I would never order from here again. They couldn't follow simple instructions. In addition to that first delivery incident, I told them ahead of time I was paying cash. Driver shows up with zero change. I was forced to tip $10 for a $20 order. I suspect the driver was lying about change to get a bigger tip. Avoid this place and go somewhere else that cares about your business. I also called to complain, and I was told a manager would call me back. Two days later and no phone call....",BOXTtd3IVKq4b2RADIXc4A,2,1,1,AG_Hckgl-CpUwsJIMYVnYQ
2681270,2016-09-04,0,45513UgSlMqWV_yAPVkXrg,Good midnight pizza if you don't want to leave your hotel room to go to a buffet. Taste is comparable to a chain like Papa Johns. Friendly delivery person,K7ad0gdQepwWglXIkVVxyg,0,0,5,6mJlodBc3ZJv5TDKFIGoag
2776965,2016-05-06,0,45513UgSlMqWV_yAPVkXrg,Pretty good pizza spot. Cheap and not too far from the strip.,eon1bUSPkZRlRn-Ao7zNwg,0,0,3,tEq90t-FrwpchJDxqd3KIA
2792868,2015-04-02,0,45513UgSlMqWV_yAPVkXrg,"Great value, have eaten there twice this week.  They just need to clean it up a bit and clean and refill the chili flake shaker.",ceLFSre4hrzkT5VpSlt2Lg,1,0,4,RhidR2wtTlKyCJJgIVGrhg
2878256,2016-05-02,0,45513UgSlMqWV_yAPVkXrg,"Skip the garlic bread, but great pepperoni pizza. Sweet delivery lady and under 45min. Would recommend in Vegas when you need that greasy fix!",h-17QHSpLYSZTa0yVFQgmg,0,0,4,tVCy08CDqyshApEqv18kfQ
2971969,2014-09-22,0,45513UgSlMqWV_yAPVkXrg,Best wings in the city.. Always takes good care of customers.. Great food and fast service!,uxoKMU39okG9nIHpRibguQ,0,0,5,vvUmny6dYp57kvzxtKWeEg
3011474,2012-12-03,1,45513UgSlMqWV_yAPVkXrg,"Very prompt and friendly delivery, but there was a large piece of mangled plastic wrap inside my italian sub. Gehh..",mdsxL8IshpfaIubYJygjtQ,0,0,2,88QiUfCsvNSrGM1nt40T5g
3149105,2016-01-09,0,45513UgSlMqWV_yAPVkXrg,"After visiting the Atomic Testing Museum we popped in here for their 2 Slices with a Soda deal for $3.99 to only receive one of the best pizzas I've had in a long time! 
The cheese and pepperoni slices were as fresh as they come, plus the best part was the crust. Ooooo, so crunchy and hot, highly recommend.",DCDz5lzUCaSTj1S8Bt4nbA,0,0,5,4qg2OjcX3Sn34xEE8FqCzQ
3169178,2015-06-10,1,45513UgSlMqWV_yAPVkXrg,"The following review was from 2012.

I ordered a medium peperoni pizza to be delivered to my hotel room.  It only took 25 minutes and only cost $11.00. The reason I gave it 2 stars is because it looked like they tried NOT to put any pepperoni on it but accidentally got some pieces to stick.  In other words, there was not much pepperoni on it. Some slices had none. And it tastes like a frozen pizza. Not good.

Would not recommend even to a hungry person.",YDeLID6un4A75trl37pGeA,3,2,2,3_T1BNobaxOOMYIW2-aPvg
