,date,funny,business_id,text,user_id,useful,cool,stars,review_id
3126971,2014-12-30,0,5CJL_2-XwCGBmOav4mFdYg,"Visiting Vegas, was in the mood for late night Thai food. Found Krung Siam on Yelp and decided to give them a try. I called for delivery, and they weren't sure at first if they could deliver to the hotel I was at(Marriott Grand Chateau) After confirming they could deliver that far, I decided to try the Basil Fried Rice and the BBQ Thai Chicken. Literally after I called, it took them an amazing 20 minutes to deliver the food, while estimating 45 minutes! The food quality was pretty good as well, and not overly expensive for the amount of food. The only thing was when I ordered how spicy I wanted the fried rice to be, I ordered a 10 on a 1-10 scale, and wasn't too spicy, but that might just be me. Overall, great find. Great portion sizes for a reasonable price, and FAST delivery.",Er4gFULImMq4diCUd8yb2A,0,0,4,Wg0D5_f7Zq2c5EFaLde6ig
3143806,2013-12-20,0,5CJL_2-XwCGBmOav4mFdYg,"I dont have much to say but i ordered the eggplant dish and my girlfriend ordered tofu dish and they were both delicious, flavorful, and spicy! Ive been here twice so i have no complaints. We ordered bloody marys and it came out pretty good.",G-PsiVrKNVhqwTdto_bFIA,0,0,3,8H3cGuZFVM9xJfqIwTn08Q
3144477,2012-07-09,0,5CJL_2-XwCGBmOav4mFdYg,"This place should be ashamed of calling itself a Thai restaurant. The food was unfathomably difficult to take in. We ordered seafood tom yum soup, crab fried rice, chicken larb, green curry, and shrimp salad. We requested that the tom yum soup, chicken larb, and shrimp salad all be ""mild."" I'm pretty sure that translates roughly to ""slightly spicy."" None of our dishes were spicy in the least bit. We couldn't even find chili flakes or remnants. Our tom yum soup was sweet rather than spicy, the crab fried rice tasted plain and flavorless, and the chicken larb was shockingly sour. We had to ask them to take it back to make it less sour and give it some type of spicy flavoring. Chicken larb (version 2.0) tasted exactly the same. Are they taste-blind or something?! As for the last 2 dishes, the green curry was nothing special and the shrimp salad...well, let's just say we played rock paper scissors, and the loser had to finish the shrimp salad (we didn't want to waste it).

I feel slightly bad for giving their food such a terrible review because the service was great. They were very receptive to our complaints about the chicken larb. Unfortunately, the chef just couldn't deliver. Oh yeah, and they forgot about the chicken larb until we mentioned it. The other dishes had come out and we were almost full until we realized we hadn't received our chicken larb yet. We reminded the waiter, who said it would take just 2 more minutes...15 minutes later, he comes out with it. Proof that they forgot and started cooking it shortly after we reminded them.

A couple of other notes: There's a small stage inside the restaurant, and apparently they have live music every night starting at 8 or 9 pm until 2 am. The inside decor was nice and clean...restroom was a horror show though.",gJK2xAhGQV5zkApt5bQROg,3,0,1,qOmqMo8bx2lkom6WWU3v0A
3148613,2015-04-29,0,5CJL_2-XwCGBmOav4mFdYg,"Very delicious, spicy 4 was perfect.  Had veggie delight, tom yum soup and vegetable red curry.  Entertainment was an added bonus.",3pHfgFuEBbsUtSyLNQVEYw,0,0,4,Uik3EDoFRUS7eldzH__NCg
3173247,2014-07-10,0,5CJL_2-XwCGBmOav4mFdYg,"Delicious!!! We are visiting from Georgia and have been trying local food away from the strip. We had the Drunken Noodles and the Cashew Nut w/chicken.  Neither were spicy, but the flavors were spot on! Ambiance is nice and the setup looks like they have live music.",kpv8n7bZBAjrp_Uv9AnF0Q,0,0,5,JQGTwglAw9azHefNh_LjuA
3176447,2018-04-11,0,5CJL_2-XwCGBmOav4mFdYg,"I really did not want to write a negative review about this spot, but after so many negative experiences during late hour service, I have to at least admit that there is consistency in one aspect. This place is notoriously terrible for customer service and the food is always inconsistent. The first few times I came here with friends after work, the food was alright. I have tried the papaya salad, the pad thai, the pad ""z-u,"" drunken noodles, chicken wings, tom yum, and the thai bbq chicken. 

Best dish here is hands down the chicken wings because they are the only things that are consistently good. It is insane how that statement can even be said about a thai spot especially since they are just frozen wings that are deep fried with a little sweet thai chili sauce with cilantro. 

The pad thai here is overly sweet and sometimes drenched in sauce. The pad see ew inconsistently comes with flat noodles that are broken up and it almost does not even feel like a noodle dish because there is so much inconsistency with the way the noodles are in this bowl. Same principle goes for the drunken noodles. 

The tom yum soup is ok at best, unless you come at a time where they serve it to you at ""room temperature,"" and it is super sour at other times. I stopped ordering it altogether because it came out super salty the last time and the salt kick was disheartening more so than the times it was at a wrong temperature or when it was sour. There is zero flavor balance. 

Thai bbq was good when I ordered it, but the portion was very small for what I had grown used to at other thai spots around town like PinKaow. 

So, after review of all the food I have had over the dozen times I have been there, I can say the food is a close  2-3 star experience for your money. However, with the service also having consistency in being awful every time I am there, I give that a solid 1/2-1 star experience. 

This spot is open late night, so it limits options for thai for all hours, but honestly, I won't be recommending going back here for anyone. Last night I went with a few of my best friends and service was terrible yet again. I asked for thai bbq chicken and the waiter completely forgot about the order and by the time we were done eating, I had to ask another waiter to make sure to take that off the check because it was an oversight. There was no apology at all on their end and if anything, the guy looked annoyed for their mistake? I thought that was pretty hilarious.  The same waiter refilled my iced tea with water and when I pointed that out, he snapped at me and said, ""I'll get you another one."" Wow for sincerity? You messed up, & couldn't at least apologize? 

Last week when I brought a couple of my friends here after work, the waiter gave us the check after our appetizer order. I asked him why he gave it to us preliminarily, and he had no idea we hadn't received our food! Yay!-for paying attention! We waited over 35 minutes for dinner and this guy handed us the check after chicken wings LOL. Unbelievable.

Myself, & my connections in hospitality won't be coming back to this place ever. Service is gawd-awful and food is not worth the trip. I recommend going to Pin Kaow on eastern near BJ's and Crepe Expectations. There are other good thai spots like Lucky Thai that are mountains better than this rude, salty spot. 

Let me just advise you guys that this location has been closed down in the past and with service etiquette and inconsistent food quality, you will be on that same road for the future. This is not the best way to run a restaurant. This place needs to incorporate some training for the staff to be better and not so terrible to guests. Tips are earned, & it says a lot when all of us food & beverage industry people feel like we've wasted our money on shit service. Maybe management needs to notice.",KxuNoB6BaSboVkYQ0T4w7A,2,0,1,kKP8tq7zuY3G5gC0NI2X7g
3176666,2014-09-23,0,5CJL_2-XwCGBmOav4mFdYg,"Today was the 30th anniversary of when I moved to Las Vegas so me and my friend Tony came here around 8:30 pm.Let me preface this review by saying that I'm not a huge aficionado of Thai food.I like Chinese food and sushi more.But anyway,we came here and it was a mixed bag,which is why I'm giving it 3 stars:not bad enough to get 1 star nor great enough to get 5 stars.

Good points include:

I enjoyed the live singer and his older songs from the 60s,70s and 80s were perfect for me.

The place had a decent,modern look.

I ordered a Thai Iced tea which I enjoyed.

The service was good.

The food quality seemed adequate.But I'm not real knowledgeable  about Thai food,so I can't say for sure.


Bad points include:

The place is very dimly lit.It was tough to read the menu,plus there was a transparent plastic sheet on the menu which tended to distort the menu.

The prices are slightly higher than I am comfortable paying.

The portions could have been a bit larger.

The last Thai restaurant I went to was Thai place in Target Shopping Center on Flamingo and Maryland.While it is not a fancy place by any stretch of the imagination  (most people would consider it a ""hole in the wall"") ,the quality
and quantity of the food seemed much better.(I'm talking about a simple
Pad Thai dish in both cases.) The price was lower there,too.

One of the biggest turn offs that both my friend and I experienced was when the
food server brought the check while I was still eating and asked if we could pay it right away.That seemed to us like a combination of being rushed and being distrusted.While we all know that feelings are very subjective and that might not have been the servers intent,that's how we took it.It definitely rubbed us the wrong way.

I might come back here again,but I won't go out of my way.If you feel like eating
here,by all means try it.You'll probably like it.In this review,I was just attempting
to share with you what my experience was like.I've had better and I've had worse.
Good luck to you if you eat here and I'm not saying that in a sarcastic way.",8BGl261AJRO7pJNiQJ8Tsw,1,0,3,tei_X4U2BMb-49NCb5W1qw
3199509,2015-07-20,1,5CJL_2-XwCGBmOav4mFdYg,"BLAHH.... =\

Did I order something WRONG??.... or should I have just eaten the food there? First of all when we entered... the place was SUPER DARK like night club status & they had gaming. We went to the bar to order take-out & we were given a menu right away.

We got some Thai iced tea while we were there but it was PACKED full of ice so after like 4 gulps it was done. It didn't take very long for our food to be made maybe 15 minutes tops...

PAD THAI $10.99 - it seems like there was a good amount... but it just seemed to have no flavor... the spice level was awesome but I literally couldn't eat it... I just ate the shrimps & threw away the rest =[ I never throw away food.

TOM YUM SOUP $8.99 - first time trying this soup... it was a bit too sweet for my liking.. I also don't know if it is suppose to be sweet. But loved the large amounts of mushrooms floating around 

THAI DUMPLINGS $8.99 - these looked like steamed thin dim sum... pretty good nothing special. Definitely not worth the price for how many...",x-8ZMKKNycT3782Kqf9loA,6,2,3,o9iiWho67J22yCeqjNx5cQ
3238502,2018-01-03,0,5CJL_2-XwCGBmOav4mFdYg,"What an experience, truly.

I came to Krung Siam after receiving just awful attitude from a nearby restaurant (ahem DJK) and I am very pleasantly surprised. We had the garlic shrimp, the chicken wings, pad Thai and Tom Yum hot pot to share for our party of 6 (we had double orders of every dish). Everything tasted fantastic but the true winner of the night was the pad Thai. This was hands down the best pad Thai I've ever had in the States, so congratulations KS! I'm very excited to come back to this restaurant with friends when I'm in town and I'm happy to recommend it to anyone visiting the LV area. 

Service was great, prices were decent and the decor and mood was inviting.",vM6Uoprp-f_BotmqpwA2yw,0,0,5,gbXr94mQ5XSPUDcjOVQu4Q
3239452,2011-03-29,4,5CJL_2-XwCGBmOav4mFdYg,"$4.99 lunch specials M-F? $1 Thai Iced Teas? YES, PLEASEEEE! Sure it's a short drive away from the strip, but with a price like that, how can you deny the perfect hangover food of noodles, rice, and spice? Not to mention, the decor of this restaurant is pretty modern, spacious, and they had a really good CD on that was playing good covers of Michael Jackson songs! 

The lunch special I ordered was Drunken Noodles with chicken and came with the soup of the day which was kind of like a thick sweet and sour soup. I had a few slurps of it and wasn't a fan :[ As for the Drunken Noodles, Krung Siam has you choose on a scale from 1 to 10 how spicy you want your noodles. Why did I say 9? I HAVE NO IDEA! I'm a fan of spicy foods, but maybe I should have gotten a 7! Once my noodles came out, you could smell the load of chili peppers that were mixed into the dish. Before I even had a bite, I knew how spicy my meal was gonna be...and how I would regret it soon after we had left the restaurant and came back to the hotel :[ Poor tummy. Poor toilet :[ Nonetheless, it was still perfectly edible, but I wish I had gone for something more on a medium spice level to actually enjoy it. If you can take on the spice, try getting it at a 10! And with unbeatable lunch special prices at $5, sure, I'd come back!",kTf9SuxJU5p0LSv4Pt_9Bg,3,3,4,i8ad08JwfANogxdk7SdZZw
3245908,2013-08-03,0,5CJL_2-XwCGBmOav4mFdYg,"We were hungry and decided to grab some Thai food on the way back from Red Rock Canyon.  It wasn't too crowded but filled up after we got seated.  They had a singer that night and he lent a nice touch to dinner; we declined to be seated next to the stage as it would've been uncomfortably loud. 

Can't say it was the best or most authentic Thai I have had - but service was good, portions were fair but I thought prices were high for the the food we got.  They also have a bar area but we didn't imbibe that evening.",YjN12eknlZBpSORkNCwuYQ,0,0,2,-d2DvdpJxVImwnHwi7K-Iw
3262460,2015-12-21,0,5CJL_2-XwCGBmOav4mFdYg,"I've been eating here for years. Best veggie fried rice ever. Delivery usually takes about 45 minutes, but always hot and correct order! If you're going to sit down, the atmosphere is great. Light and fun, not too noisy. Staff is always nice, but sometimes you do have to hunt a server down. Overall, one of my favorite thai restaurants.",dDrEF55iaO-1qTmNqj43_A,0,0,4,r03P3IspGLjTfF0Yl7pS5A
3282719,2014-07-03,0,5CJL_2-XwCGBmOav4mFdYg,Horrible service! Waiting for table to be cleaned and wait 15 min to find out table was given to another couple! Order food and waiter doesn't speak any English and leaves are table and doesn't send another waiter until I find someone myself..then doesn't bring drinks out while everyone in place is screaming drunk to the lame karaoke..after waiting forever to get food I have to take my drink to bar to ask for anther because no one will come back to out table then I ask why we haven't even gotten out appetizers to find out their going to be serving everything we ordered at once..this is crazy I've never had such horrible service with them before and have been here serval times and this will most definitely be the last time I come.,eKF-xnpu7Fn6E2L_Uh4yFQ,1,0,1,05ftc535npxICERfyFoGvw
3283585,2011-09-07,0,5CJL_2-XwCGBmOav4mFdYg,"Great location with night hours. There's a guy with a great voice who sing oldies there on friday and saturday night, so if you're into that, it's a great place to enjoy some chill music. Otherwise, they have late night karaoke on the stage during the week = *avoid late nights if you don't like drunk people screaming into the mic while you eat*

The food here is average and they have a scale of 1-10 for spiciness. Ask the waiter for reference because the spiciness ratio is different for each dish. A level 5 salad is as spicy as a level 10 curry. It also depends on how much coconut milk is in the curry. So if you don't want to take the risk, better to ask when you're ordering.",RajSojRxTWY2PYrCWF9gBQ,0,0,3,UDQMe8Yi-TQfoO2kERehCQ
3283743,2017-01-18,4,5CJL_2-XwCGBmOav4mFdYg,"This place is how you do business. Located in China town this place stands out the most. Bear in mind there are a million other Thai spots on the street. So choosing this one was strictly based of Yelp reviews. Man am I glad we listened.

Walked in and first thing you see is a gorgeous stream of water running down a mirrored wall. At night it's beautiful and adds flair as you walk in. We were immediately greeted and sat. Restaurant wasn't too busy but again it was early dinner. I don't mind when it's slower because my food is faster and always tastes better. 

We ordered our drinks and appetizers off the bat. We got and order of crab rangoons and a platter which consisted of chicken satay, spring rolls, crab Rangoons and pork dumplings. Each having their own sauce to dip in such as sweet and sour and peanut sauce. Best satay I have had in a LONG time. Spring rolls weren't my favorite but everything else was good for an app.

Our server came to take our order. He didn't write it down but spoke it back to us perfectly. Food came out staggered with entrees. I think they thought we were doing family style which we were not. So my meal came about 5 minutes later.

The staff seems to work as a team because I had about 4 different people waiting on us from order taking, to bussing, to drink refills. Team work makes it work better. I didn't sit there waiting for anything because someone was always around.

I obviously ordered Pad Thai. As we all know on here that's like all I get. Their spice meter is all over the place. I can handle spice and the 2 was a lot. For me it tasted great. For some at the table it was TOOOO hot and that was just a 2 out of 10.
Pad Thai was great. Didn't have too many peanuts which I like an abundance of. I actually added pineapple to it and it made it even better. Try it next time you get pad Thai. All meals were large and can be split for two or good for take home left overs.

We all saw fried bananas on the menu so you KNEW that was happening. Came out at a good time. Not overly battered and very warm. The bananas were very tasty. I thought it was a caramel sauce on it but it was honey and I hate honey so I had to eat around it :( we had ours served with mango and coconut ice cream.

Other than that this place is great! Defiantly check it out if you are in China town. I know there is a lot to choose from but you won't regret this place.",ugpGI6jgFq_gDyaGBn1Cmw,3,4,5,-7_Ar6txJTuFmq2YOgNbfw
3287609,2010-02-18,0,5CJL_2-XwCGBmOav4mFdYg,"After having a few drinks at MIX at THEHotel, I was starving.  We decided to go off the strip to get some food.  I guess none of us felt like getting ripped off anymore from expensive hotel eateries.  We went to Krung Siam simply by luck.  We were planning on going to the Pho place in the same plaza but somehow Thai food seemed more inviting at that moment.

The decor at Krung Siam was surprisingly nice.  It had a loungy restaurant feel unlike any other Thai place I've ever been too.  There were candles on the tables and the servers were all very friendly.  Best of all, they ad $4 buy one get one free bottles of imported beer.  Wow, that is cheap coming from the Strip where one bottle would run $7-9 bucks!

We ordered the Pad Thai, Chicken Green Curry and Glass Noodle Salad.  We orderd everything medium spicy but the food came out SUPER spicy.  So a word of caution, if you can't handle spicy food, ask them for low low spice.  They had a spice scale from 1-10, we got 5 but next time I'll know to get 2 or 3.

I was pleasantly delighted to see the large portions and taste the great flavors.  This was one of the better Thai places I've ever been too....mind you I was pretty drunk so my review might be a tad skewed.  Nevertheless, this place is definitely going to be one of our usual places off the Strip.",jzRM1YIahBc4GGzvn-4wMQ,0,0,4,xkOuwcGVC94xxZ0NyYt8sw
3289372,2016-09-04,0,5CJL_2-XwCGBmOav4mFdYg,Food is delicious try the yellow curry and the cashew chicken vegetable dish go through amazing watch out for the Spice we did 3 out of 10 and it was definitely medium. Just like in the other reviews the service is pretty weak but I'll still be going back,LzM_f-GeQFhKFvEnBKfJPg,0,0,4,0-5VfrbvTFQ1wb2nT5C3vw
3296377,2015-03-03,0,5CJL_2-XwCGBmOav4mFdYg,"In the mood for some Thai, like spicy wtf is this made with hot sauce spicy? Then this is the place. I order the shrimp red curry with the spiciest they can make; which is a ten. Well damn every office or my body was leaking water, my sinus cleared up and I drunk more water in 45minutes than I had in the last weak. It was oh so worth it and it washes down great with Thai tea. The perfect sweet to spicy combination that can never do you wrong.
They have a huge variety of food choices; I have to come back again to try them all but this place is a must try!

The service is pretty decent but sometimes the server can forget you if you are in a both or a corner and if it's not to busy. Otherwise night spot for date night.",HRP5zLOrhXgLYAlaBt-HgA,0,0,4,_QUrPugHOEUfC5rPS_-Muw
3333597,2017-02-17,0,5CJL_2-XwCGBmOav4mFdYg,"This review is for 3.5 stars.

This is a solid Thai spot but hardly the best in Vegas.  Pretty big restaurant with open space makes it a nice venue for a full table and even for live music some nights.  They have a pretty good wine menu and some good menu options, but everything is priced a few dollars higher than the quality.  Dishes are large as the spicy eggplant and beef salad filled up 2 people.  Throw in the appetizer platter and you have lunch for tomorrow.  I ordered a 10 spicy level and it was hot but more of a late burn.  There are definitely hotter options in town.  Fine food but there are better options (some literally right down Spring Mountain) for better Thai.  But still should be on the short list for Vegas Thai food in China Town.",JaqcCU3nxReTW2cBLHounA,0,0,3,Cu10HjGlAjgKxafil7qE6A
3337775,2009-09-26,1,5CJL_2-XwCGBmOav4mFdYg,"Wanted to go to Lotus of Siam, but we went here instead as a random pick. The food wasn't bad, but not great. Service was slow (I'm writing this review as we're waiting), but atmosphere was alright. Nice guy at the karaoke though.",VfpO9h5nNDM1oMAoH7eXtg,0,0,3,KLUCF8DxG2R2BoWgMeLFUA
3340272,2015-08-08,0,5CJL_2-XwCGBmOav4mFdYg,"Good for lunch!
Staff was nice and very attentive.
Basil chicken was a good choice.
Want to go back to try dinner.",5ArMzPUBncPqDrB7PmZBCg,0,0,4,kiAAAZbYcLs33PKYl6dQwA
3344802,2017-04-28,0,5CJL_2-XwCGBmOav4mFdYg,Pad Z u is excellent! Little bit Vietnamese style than Thai. That's why it was better than other place in Las Vegas. Service was good and pleasant. Live music in night time.,lUvUr--o2qQOPZcq29rstQ,1,1,4,khMLnnGD84Yd1gm8lRJu0w
3365473,2014-05-22,0,5CJL_2-XwCGBmOav4mFdYg,"I don't know why my friend loves this place but I certainly will not be going back. Service was bad, three waiters came to take our order after another one already done so. 2ndly, after a 20 minutes of wait, our food came but cold. 3rd, it looked like they gave 2/3 of my Pad Thai to another person. I wouldn't suggest this place to anyone.",IOAcz7CbNxI-ntSfctZJMQ,0,0,1,pUcFfhBWq_GtEJKjXPS6hg
3374014,2013-11-11,0,5CJL_2-XwCGBmOav4mFdYg,"Basil Chicken....

I really liked this place. I brought 2 other people who dont eat a lot of Thai food and they both loved their dish. The Cashew Chicken and Basil Chicken were both excellent and the Satay sauce was delightful. I would definetly go back.",5DPMSq581Jp-JWy4a7sm_w,0,0,4,YPfWOPpNgoiqZqut6PeWSA
3385235,2017-12-17,0,5CJL_2-XwCGBmOav4mFdYg,"When it's late and your hungry and you have a taste for Thai, Krung Siam is a perfect choice. We had the crab fried rice, panang curry chicken, rad nar with beef and the sweet sticky rice with lychee. The crab rice was very good, not overly greasy, not mind blowing but very nice on the palate. The rad nar was like an Asian version of an American beef stew but not as rich and heavy. It was warming on a cold winter night and the thick flat noodles were a delightful change of pace.  The panang curry chicken was loaded with flavor and I love the fact that they use white meat chicken which was very tender and cooked just right... they serve a bowl of white rice on the side which is great for absorbing all the delicious panang sauce, personally I think they need to make the side of rice a little larger. Finally, for dessert we had the sticky rice with lychee, it was served warm and had a mildly sweet flavor.  The lychee fruit added a nice touch with its combination of sweet and tart... we all agreed that we prefer the sticky rice with mango at Archie's best!
I have been to this location a few times, originally at the recommendation of one of my poker dealer friends from a Strip hotel.  It is a high-quality, fantastic option for those people getting off of work late, just wrapping up from a night of partying or celebrating or like me - a mom with her daughter and her daughter's friend starving after a night of ice-skating at the Cosmo:-)",f3670JXvEcEbTvqBc1Igrw,2,2,4,5-I_jZLvdUbloNVu98tIJA
3394587,2017-03-07,1,5CJL_2-XwCGBmOav4mFdYg,"As with most places in Chinatown this restaurant is open late, which makes it a great late night stop as well as day time stop. The inside is clean and wide open with plenty of seating. If you can snag one of the big booths, it makes for a private and intimate meal. 

The service is attentive and good, and your drinks will never be empty. They have occasional live music that can be very loud, making it difficult to have conversations without yelling. The entertainment has always been of mediocre quality.  

The food is great quality and the spicy levels seem to be what you expect. I personally get the drunken noodles, pad kee mao, and they are some of the best I have had in the city. I also enjoy the basil fried rice. 

Overall, good ambience and quality food.",uso43PtZRUPcYxgxs12U1g,1,1,5,Yhtrdymigiihkzf8vkPv_Q
