,date,funny,business_id,text,user_id,useful,cool,stars,review_id
1947531,2010-09-10,0,5CJL_2-XwCGBmOav4mFdYg,"Had dinner here the night before. Wasnt really crowded and it looks as if karaoke was on the agenda for the night.

The menu is a bit limited, at least in my opinion, for a thai restaurant. The pricing and limited menu didnt look like it would play well with conventional asian family style communitive dinner.

The beef salad was by far the best tasting item we ordered during this meal. It was nicely seasoned and grilled to order so it had that fresh off the grill smokey, concentrated, burnt taste. 

Krung Siam platter is...quite...insulting to be honest. 13 hard earned dollars for two of everything: 

Two satays one chicken one beef both lacking the fresh off the grill smokey flavor, seems more like broiled, chicken was overly dry. Sauces were there obviously to cover up this fact.

Spring rolls: more like miniature egg rolls with bland tasteless filling. Another excuse to show off the sauces or serve something deep fried, or both.

Fried Battered Shrimp: tasteless with more deep fried flavor then shrimp flavor. Might as well deep fry presoaked and reshapened cardboard if you have a deep fry fetish be a lot cheaper too

Thai Dumplings: Best thing on the plate but seriously not thai. Not even close unless Dim Sum started in Thailand and the Chinese came, knocked out the Thai, stole their food and the Thai woke up and completely forgot about it.

Crab Ragoons: Again i have a problem with this. Crab implies fresh crab, a little guy with two pinchers, a bunch of claws and sweet sweet meat. Krab is a biproduct of liquefied, reshapened, reseasoned and food colored crap (yes crap not krap). Anyway no surprise here it had a heavily deep fried taste, very little texture from the Krab, lots and lots of cream cheese. Here's an idea why not just bread and deep fry cream cheese?

Okay enough of that lets move on to the main courses:
Panang Curry
Quite nice. Ordered mild and everything was nice, flavorful, and mellow until i started fishing pieces off the bottom. Diced up chilis were waiting for me leaving my mouth burning and attempting to chill the flames with the coconut/peanut sauce from the sampler.

Beef Fried Rice
Yeah we can call epic fail on this one. Your basic very very dry not seasoned very well, wth is wrong with this beef it's colorless and tasteless fried rice.

The last complaint is the insulting price to food ratio. the sampler was 13.99 with only 7.99 worth of food. Both the rice and the curry were a decent size for one person but not filling.

Overall i can only give this place three stars. It's just too much money for too little food. This would be a place to take a date but not a place for serious eating",7A7FOLZZKL0iokQVOAEbgA,1,0,3,2wAQR14-0OYodH8a3EjBzQ
1953727,2011-10-03,0,5CJL_2-XwCGBmOav4mFdYg,"Friendly greetings.  Ok atmosphere.  Good singer - not sure what language maybe Thai, but nice vocal and music. Great food. I'm quite picky and have tried a lot of Thai restaurants.  This one stands out as one of my favorite.  The beef noodle soup has a great soup base - hot, spicy & little sour- great for winter time.  Spicy mint leave stir fried with ground pork is much better cooked compare to most LA Thai restaurant.

Great service.  We got there 15min before 15% discount & buy1-get1 free Singha beer promotion which starts 10pm, but the  server instead of having us wait outside, figured out a way and took care of us....nice!

Well definitely be back and next time with more friends to share the good stuff.",5u12eFTqMD_caURre-wKNQ,0,0,5,XLby3np2q7nhgemjNHas4Q
1956404,2014-07-01,0,5CJL_2-XwCGBmOav4mFdYg,"Solid Thai food. Bar in the back. Great at night. Quality ingredients all around.
Watch out for Karaoke least your night out be ruined haha.",ezxZV_SknCxs_0tmUGRNTA,0,0,4,PLdIfkfWYKGXH53PrYPu_A
1971888,2016-07-12,1,5CJL_2-XwCGBmOav4mFdYg,"I got food poisoning from the chicken satay. This was two nights ago and I'm
Just now feeling better. I just wanted to make the owners aware that their chicken is spoiled and should be discarded. It cost me to miss the main event of the World Series because of it.",v34dAifEKf5uJk3a_L2dcw,1,0,1,ZRvgCifKwoEsHDcHU_yqtw
1979949,2014-07-28,0,5CJL_2-XwCGBmOav4mFdYg,"Food is ok, service is hit or miss! Beef jerky us my favorite dish. Thai tea is not my favorite",LAwBC9FEBuwsyzotIrwX_Q,0,0,3,9gCftRrevgtHi0utSx2Pug
1991757,2012-10-06,0,5CJL_2-XwCGBmOav4mFdYg,"As a recent escapee from the 
California tax nightmare, I looked forward to finding some excellent Thai food in Las Vegas. We stumbled into this place when the wait at another restaurant was too long. All I can say is WOW. I tried the chili basil, my son had the shrimp curry blossom, and the yellow curry,both at a heat level of 7. My wife had a pad thai. We were blown away by the complexity and depth of flavor. We have gone back 3 more times and are amazed at the consistency and service.",8x0o9q7Bi6ag1JWoIbqGRg,0,0,5,t_ZhSt21pIXJDUm_hyUisw
2002595,2013-04-27,0,5CJL_2-XwCGBmOav4mFdYg,"My parents recently moved to Las Vegas and I've never been anywhere outside of the strip, so was excited to check out Chinatown area where the locals thrive.  We came here on a Friday night and there was a decent crowd there.  They had a live musician singing classic songs with some accompaniment and on guitar.  It added to a nice family vibe.  We decided to split some entrees among the three of us.  The portions were good and the food was a bit more spicy than we hoped (even though we asked for less than medium), but still yummy.

The prices are reasonable, but actually not much different from what I would expect to see in NYC.  Was hoping for a little bit more of a bargain, but not bad.  I wouldn't mind coming back here again with my family.",OVtuIGyUhewxfTl4No9Rwg,0,0,3,1J10cuOHxMTJRVFyDABZng
2015662,2016-06-09,0,5CJL_2-XwCGBmOav4mFdYg,"Came here with my husband yesterday and the food was good. We ordered a chicken pad thai and a pineapple fried rice. We went at an odd time around 5:30 so a bit early for dinner, but there was no music playing, though I could see the set up. It was quiet and we got seated at a big booth right away. We were able to enjoy our time eating while chatting. The waiters were attentive and refilled my water without being asked. That's always a plus for me because I drink a lot of water. I think the price is a little more than usual thai food restaurant, but I wouldn't say it is pricey. I think entrees start at about 11 dollars.",JLlZgkxIUJHLuBcYOFDvaA,0,0,4,7_bFFRHhTJzQWUsn1JZKUg
2016475,2012-05-06,0,5CJL_2-XwCGBmOav4mFdYg,"This gem is located in China Town; On the corner of Spring Mountain & Valley View.  There is a Starbucks in the same plaza.

Great lunch special! A co-worker took me here last week for lunch.

I ordered:
- Thai Iced Tea: first time having this.  It's very sweet but has an interesting flavor that I couldn't put my finger on.  I would definitely order this again.

- Chicken Pad Thai: OMG!  Probably within my top 2 favorite Pad Thai's ever!  Not spicy at all, but great flavor, yummy chicken and I think fried tofu?  Delicious!

The lunch special says its served with soup, egg roll, fried wonton and salad.  We only got the soup.  The soup had some veggies and tofu in it.  Good flavor.

I'm kinda glad it didn't come with the rest, because I was stuffed after the plate of Pad Thai.  The plate is a generous portion, especially for lunch, but I finished it off like a champ, because it was that good.

The restaurant is very clean inside and everyone was very nice.

I can't wait to take my husband here!",Ii1PkdRpONUNwKC3lmhl1A,0,0,4,rUMXedK2GXptnI9lU_UYkg
2022411,2013-10-16,0,5CJL_2-XwCGBmOav4mFdYg,"Where to start. So came here around 3ish to grab a late lunch. There was only 2 or so other parties in the restaurant besides us. We were seated promptly as soon as we got in. 

We ordered the lunch special pad Thai and Red curry with the normal order of drunken noodles. The waitress never asked how spicy we wanted our food,  which is what I'm usually accustomed to at a Thai restaurant. We also ordered some Thai teas. 

We got our 2 soups which wasn't too bad. Not sure what kind of soup it was. Now onto the entrees. 

-Pad Thai (chicken) : Wasn't much flavor to it at all, just overly sweet. Chicken was ok. 
-Red Curry (chicken): Not spicy at all. Wasn't that good. Didnt even if finish it. 
-Drunken Noodles (beef): Not spicy at all. The description made it sound like it was spicy and sounded like pad kee mao. This wasn't very flavor either. Just oily noodles and some garnishes. 

Now the service. We were in here close to an hour and the server came by once to check up on us and refill our drinks. We then waited a while so we can ask for our check and she never came at all and nowhere in sight. I had to get up and find her. She was talking to a coworker and chit chatting it up. 

The service and food were both equally lacking here.",XetOgmeZKHhpiauBCK_t1w,0,0,2,4co7jr26PsKitEVmar_mlw
2023410,2016-07-29,0,5CJL_2-XwCGBmOav4mFdYg,"So i went to Krung Siam Thai at a random Wednesday night. We were planing to go to another Thai restaurant but it was already around 10pm, the one we planed to go close at 11pm. So we decided to go this Thai restaurant instead since it opens until 5 in the morning. 

The restaurant has a wall of wine in front of the bar seat, and as i walk in more, there is a stage with a guitar. The atmosphere is good and the only bad thing is it is too dark. The table next to us used their phone's flashlight to see the menu. 

We started with a Tom Yum soup with shrimp. We order 2 level of spicy out of 10, but it was not as spicy as we thought. Some thai restaurant's level two could possibly kill me... The Tom Yum soup comes in a metal pot. It has a bright orange color, the soup is clear and watery. They use cocktail shrimp, which is moist and tender. I like it better than those skinny shrimp that is usually used. The soup is a little spicy and sour with a kind of scent strong of lemongrass.

For appetizer, we had a raw shrimp and papaya salad. The raw slimy shrimp is one of my favorite thai dish. It is like a Thai sashimi but with a little piece of garlic and a green spicy chili sauce which makes it a high note dish. The shrimp is gummy, moist and rubbery. The shrimp itself is bland, but it goes well with the garlic and the sauce. The sauce is a little sour but very spicy. Next one is the papaya salad, the salad is made with green papaya, peanuts, tomatoes and carrots. The salad is very fresh and crunchy with a sweet, sour and spicy lime sauce. However, it is too spicy that i only had one bite of it. 

For entree, we had a basil fried rice with pork. It has a very strong basil smell with a colorful appearance. The rice is soggy, grainy and a little oily. The pork is tender and smooth. 
For a good ending, we ordered a mango sticky rice. Its bottom has a layer of sticky rice and top with a whole mango with some coconut sauce. Is rice is very gummy, soggy and creamy. The mango is not sour at all, which is quite sweet with the sweet coconut sauce. The coconut flavor is just right as it will not cover the taste of mango but goes well with it. 

In conclusion, the food is tasty and the service is wonderful. As the salad is too spicy to eat, i drank a lot of water and they refill the water very quickly. And as we were ready to order, I looked at one of the server and he came immediately to take our order. In the middle of our meal, a performer went onto the stage and started to perform some nice song which makes our whole experience even better!",sxYzUCnu_vW2dV5hg5IdBA,0,0,4,OZ8fRusCNLl0xollqRsoLw
2031415,2014-03-14,0,5CJL_2-XwCGBmOav4mFdYg,"Great atmosphere inside! Cannot tell from the outside of the restaurant.
Papaya salad was very refresh and juicy, cannot eat spicy so only got level 2, fitted my taste well, love love. Very great to have for hot weather. Red curry was creamy and delicious, fried rice w/ crab meat tasted good as well, great with red curry together. Chicken sauted is a great appetizer, recommend too",KS5puY9OkGyRMoPlUjcKSw,0,0,5,eiROwtY91U7yvPdd0ocfIA
2049712,2017-04-10,0,5CJL_2-XwCGBmOav4mFdYg,"went to krung siam thai because thai spice was closed, I decided to try something new was the best decision ever, I ask for a menu once inside a pretty waitress gave me the menu and I begin searching for what I usually get at the other place found it order it and I ask another waitress to recommend me something and they did, they let me try a ginger tea and they warned me that was gonna be really spicy and it wasn't it was just perfect , I will be back to this restaurant again and Im not going to order to go , next time time Im there ima actually seat down and eat there the fish with the ginger sauce, and the fried tofu were delicious.",yRxNTFAGXC3wNSqkg7_Vng,0,0,5,fi13fJiQKyuerHYezLOcFw
2057627,2018-01-09,0,5CJL_2-XwCGBmOav4mFdYg,"This has become one of my favorite Thai spots in China town. It's open late, I've never had to wait to be seated, the atmosphere is very clean and put together, the staff is always friendly (sometimes there is a language barrier but never had a mix up with my order), and the food is DELICIOUS!! The prices are a bit high but you get a lot of food and I've never been disappointed with the taste or presentation.

The ambiance is great for a little date night or hanging out with friends. If there is live music sometimes it can be a little loud but not too overpowering. 

I used to go to a well known spot in the plaza next door but Krung Siam is a more intimate experience without the hassle. 

P.s. try the pad Thai..your taste buds will thank me later!

Oh, and a shout out to my favorite sever Tom for always being the best!",7pWqqaAH1JVflLV8R4FepA,1,1,5,NgKqAJGZXlZuTk78XZocGA
2063745,2017-12-27,0,5CJL_2-XwCGBmOav4mFdYg,Me and my family were actually planning on going to another Thai restaurant but saw this one on the way and decided to stop by. Let me just say that was the best decision we made. The pad Thai with beef was delicious. The Panang curry is something to try if you like spicy food. The customer service was excellent and the prices were reasonable.,y_CbAFnwI5A00eU7L_kTZQ,0,0,5,qlmWmiBPCWIKkgb10hcQlw
2092551,2015-11-29,0,5CJL_2-XwCGBmOav4mFdYg,"This place is a rip off. Who's ever reading this please reconsider about going there. The food is okay but when the bill comes you'll see what I mean. There is no love in that place, just smiley faces and sometimes not even that...",T4onLNngtpArqDPmeHjN-g,0,0,1,JljWmcXK7YDPBiiRLFBCwA
2105814,2011-09-29,1,5CJL_2-XwCGBmOav4mFdYg,"3.8

If I ever want Thai in Vegas, this would be the place I'd go. 

They are open until 6am!! 

Food is pretty good. I really like the curry. The salads are a bit salty. I'd recommend asking for the dressing on the side. Service sometimes can be slow even when it's not so busy, but it wasn't a big deal. 

I'm not sure if it's every night, but they would have entertainment. Someone will be serenading us while we dine. That's usually a treat,. 

Enjoy.",xEfWrET-mCCeoN4dSOLwNQ,1,1,3,9n2UdD0Ue5YyepNRF9EIPw
2117826,2014-07-19,1,5CJL_2-XwCGBmOav4mFdYg,Food was good. The male singer was good too. Everything was working out well until the female singer started singing. The happy mood we all were having suddenly turned bad. Her singing was OFF key ....  If u just have the male singer there u will have more customers who will come back!,kYN8CBKgtsGBNGbXer_l2g,0,0,2,5P9eTn-1G5HN0ZL_RqABgQ
2135338,2012-01-10,2,5CJL_2-XwCGBmOav4mFdYg,"I was driving around in Chinatown looking for something to eat. Then the Krung Siam Thai catering truck caught my eye. If they do catering, they have to be good right? Yet again confirming my thoughts are the Yelp and Urbanspoon stickers on the door. 

Lunch special from 11a-3p? Yes please!
Beef drunken noodle + thai ice tea = $7.56. Yes thank you!

The thai ice tea is super sweet so I love it. The drunken noodle was a bit on the oily side but still pretty tasty. The portion seemed a little on the small side but I guess that means I can eat again in another hour. 

This place is A-ok.",BE4fE4R3TaVn8xy4sYYjbg,4,1,3,Ev7CUeQ_n3fOloOaCNYvBg
2140012,2013-06-21,0,5CJL_2-XwCGBmOav4mFdYg,"The food was okay, the singers were funny and entertaining (singing off a karoake machine) until it got annoying. The waitress tried to tell me she ""forgot"" to bring my change back..not impressed",QcckMs29Z47tuSyWDCMUlA,0,0,2,wbaKAMo59rYRHUJII0rW4w
2145210,2017-07-14,0,5CJL_2-XwCGBmOav4mFdYg,"The reason I keep going back is simple. Service, they deliver to just about any where. They never get my order wrong and the food is always hot and fresh. Sometimes it is not about mind blowing food. Krung Siam is just fine as far as Thai food goes. Sometimes it is about reliable service and the comfort in knowing your favorite Thai place will always be there for you.",xhF16fDpg4BvC_7yJOjsig,0,0,3,YYsbzfKbRQWSq8uYs-W_Vw
2148677,2010-12-03,0,5CJL_2-XwCGBmOav4mFdYg,Didn't go here for the food. But to get away from drama from another Resturant. Place was pretty kewl. Just drank two bottles of sojo in the late early morning with my girl friends. Before we all headed home! More crazy karaoke happens at this spot too!!!,T2_RfLMqw8v_UbObfvP1xw,0,0,4,6hvJ916_1IZTTcKNjL5g0Q
2159592,2018-06-20,0,5CJL_2-XwCGBmOav4mFdYg,"The green curry is delicious! I love getting a spicy level 6 with a tai tea to cool down the heat in my mouth. Try the sticky mango dessert. It is perfectly sweetened. 

The service is great. Our server answered all the questions we had and made sure our cups were never empty. 


Will come again!",UzmO7EjFDYEfXXgG1kRw3Q,0,1,4,J5LRKQAN2LPoOzZfsnc_nw
2165467,2018-06-14,0,5CJL_2-XwCGBmOav4mFdYg,Currently my mother and I have food poisoning after having dinner here last night. We ordered the chicken drunken noodles and pork basil. Flavor wise it was decent.,-ZEoNDtlTqL1ob6a-rb_XA,0,0,1,dFz00lzaV2ZtfLVEPpEnng
2177349,2010-03-20,0,5CJL_2-XwCGBmOav4mFdYg,"The food here was all great.  The flavors were excellent.  Everything was served fairly quickly once we were able to order.  
And that is where they lose a star. 
We were a party of two and the restaurant was fairly empty when we arrived.  We were seated in one of their tall backed booths near the stage they had setup for a guitar/vocalist (pretty decent).  There was a party of 12 in the middle of service and three other tables of three-four customers.  
We waited at least 10 minutes after being seated as we saw three different servers working with the other tables.  I finally leaned out of the booth and waved to the manager.  He came to the table and became our server.  He even put on the black apron.  He was dressed in business attire while the servers all had their uniform on.  

So the food was great.  We had the pork jerky that you dip in this great chili spiced dressing.  Chicken Larb (hot level 3) which was super tasty of citrus and heat and onions.  A really great pad thai with chicken.  There was a lot of flavor in this.  Some pad thai dishes are kind of bland.  Not this one.  Great green curry...sweet and spicy and creamy.  Again it was rich and flavorful.  The beef itself was pretty ick though.  It was overcooked.

Two for one SingHa beers made up for some of what was lacking.  
Let's hope that no one else has as much trouble getting a server's attention, though.",tsNceSt_nK0Zw9ro-XK-2A,1,1,3,n69xUEE5u-fy3j6308c16w
2239129,2013-02-25,0,5CJL_2-XwCGBmOav4mFdYg,"Although there a lot of Thai places around Las Vegas, I am still looking for my one place that I can always count on. Krung Siam is ok, but not sure it is my favorite of all places. The service was ok - it was not a busy night and they somehow managed to not get our order correct, even though the server had repeated what we wanted. 

We ordered the yellow curry with tofu, beef drunken noodles, and the spicy chicken wings. The flavor for all of the dishes were good, although for medium spicy, it felt like it was more mild. Each Thai place is very different as I have been to other places that their mild was more like hot. I wish the restaurants were more consistent. For the price, the portion sizes were decent, but not huge. They also charge for extra rice. 

The one good thing is they do have happy hour drinks/beers - so go before 8p and get your pints/pitchers for a great price!",6QFyYvYgN1XcVfxMMMWxGw,0,0,3,tNdzWNsQ83V-xplivvJ6DQ
2250600,2011-06-30,2,5CJL_2-XwCGBmOav4mFdYg,"This is really a 3.5-star rating; the bump has to go in some direction, and I feel like Krung SIam has 4-star potential. (Also, my husband's review will be three stars, so together it works out. Yelp math!)

We hit Krung last night after doing an ""Open Now"" search on Yelp at 2 a.m.. After eliminating all of the usual casino coffeeshops (with their limited late-night menus) and deciding against a drive to Jean to try the all-night buffet (summer break = Teachers Eating Wild!),Krung it was.

""Wait, didn't this building used to be Satay?"" My husband had been bugging me to go to Satay ever since trying their chicken sticks at the International Food Fair. (Translation: 2007.) Well, look honey, you finally got your wish.

I was rubbing my hands in anticipation because my love affair with Marnee Thai, also in ""Chinatown"" and also open in the very wee hours, was cut short on the second visit when we found the menu, ownership, and seemingly the chef had all changed. Noooo! We were supposed to be the Brangelina of late-night Thai. Shari + Marnee =... Sharnee! A portmanteau for the foodie ages! But now I had a second chance at finding late-night Thai love. (Shari + Krung =... Shrung? Hm.)

Right away I was struck by the pleasant, spacious decor. (Space is a big deal with me. It's an only-child thing.) We were seated in a long, cushy booth by the little stage where bouncy remixes were blasting. A customer soon came over to turn it up even louder. Eeek. The cushions in the booth were shaking like we were playing the Top Gun slot and just got the bonus game. Then a waiter hurried back to turn it down; we gave him an appreciative nod. Then he came back to turn it up again, asking us if it was okay. Awkward. At this point we were the only people sitting by the stage, and the few other patrons across the room didn't appear to be the partying type. We shrugged it off as Krung's ""thing"" and got used to it. If the restaurant had been busier, though, the overall noise may have been too much.

Several reviews of Krung complain about the promptness of the service. Our two servers were polite and swift with refills. Absolutely no problems there.

We ordered large. We're never too proud to get to-go boxes for tomorrow's lunch. Fried tofu, chicken satay sticks, fresh (not fried, although that's available) spring rolls, pad thai with tofu, and basil with chicken. Although I'm disappointed every time I go to a Thai restaurant and they don't have summer rolls like Panna Thai does, the menu was nicely varied and much on par with Archi's in that regard.

Fried Tofu: The best I've had in Las Vegas. Definitely crispy, pieces not so large that the center is gooey, and I really liked the usual sourish sauce with a heavy layer of peanuts on top. 

Chicken Satay Sticks: And these were, according to my husband, the worst in Las Vegas. Ever. Bland. Kind of cold. ""Tasted like they'd been microwaved, and not very well."" The satay sauce was not unlike unsalted peanut butter.

Fresh Spring Rolls: Huge! Imagine a double-fistful of salad wrapped in lettuce, and the salad is deliciously aromatic with a spicy crunch. Fun to try, but hard to eat, and we definitely didn't need four of these giant things. (Came with the same satay sauce in quasi-shot glasses with peanuts on top. We eventually started dipping them in the bowl of sauce that came with the fried tofu instead - much easier to manage.)

Basil: I'll let my husband review that one on his own, but he liked it.

Pad Thai with Tofu: I know, not very adventurous, but I just love pad thai. The tofu seemed to be fried first then cut up, making for some unfried sides, which is not how I prefer it, but it was still good, especially since the tofu pieces were small. 

I asked for the heat to be ""7, maybe 6-7,"" and I feel they nailed that perfectly. That said, on a few occasions I crunched into a tiny pepper-pocket that must've still had seeds, as my tongue nearly blistered right off. I don't seem to get that problem elsewhere.

Overall, the flavours mixed well to suffuse the entire dish, and I can honestly say this is the only pad thai I've had in a long time where I didn't seek out all of the tofu bits to eat first.

As good as the service was, we did have a timing problem after all. Our two main dishes came out within a few minutes of our appetizers, so we had almost no time to linger and enjoy the ""courses."" Instead it was like a tableside buffet. Luckily we'd realized at this point that we'd prefer a quick meal, but if it had been a more normal hour and we'd not been on the tired side, this would've been disappointing.

Overall, Krung is a place I will delight in visiting after-hours, but when the sun is up, it's still going to be Panna Thai, Archi's, and maybe Pin Kaow II for me.",l9YOhaPYvTJi_qfD3Y-wBQ,1,1,4,Xjqgr4Ajot0NzO1M4YcKiw
2275541,2012-09-11,0,5CJL_2-XwCGBmOav4mFdYg,It was fine. The food was OK but I've certainly had better and fresher Thai food elsewhere. I would not go back.,G4KDU_p4sQpm4dcJa6AniA,1,0,2,096h3tsWx-vMNTqWoShGaA
