,date,funny,business_id,text,user_id,useful,cool,stars,review_id
4277017,2014-01-05,0,5CJL_2-XwCGBmOav4mFdYg,"This place was just ok. Not amazing, not aweful, but just ok. I came in for a quick lunch with my dad and the sign stated that the week of Christmas and New Years, they didn't have lunch specials, which was the main reason we came. Both of us were freaking starving, so we just decided to stay.

We pretty much got there right when they opened so service was good. They were pretty attentive and kept refilling our drinks. That's a good sign. Now on to the food.

Crab rangoons
This is one of my favorite things to order for an appetizer. I was really disappointed. We were the first ones in the restaurant so I expected them to come out hot and fresh. Nope, these were just warm like they were  made 20 mins before and just sitting. When I opened one, you could see how greasy it was. 

Chicken panang
I enjoyed this dish a lot. Big chunks of chicken and chunks of bell peppers. It was really good, like what panang is supposed to taste like, but the portion was really small for the $10 price. I could have just eaten that myself. 

Beef larb
I'm not a fan of their version. Instead of using chopped pieces of beef, they used ground beef. They use cabbage instead of lettuce like I'm used to at other places. To me this dish reminded me of another Filipino dish called papaitan (spelling?). For anyone who knows who that is, you know that distinct taste I'm talking about. Not really pleasant in Thai food. 

Overall, I had a decent experience here. I'd come here if someone else was paying, but I'll stick to other Thai places around town.",BI4jBJVto2tEQ0NiaR0rNQ,0,0,3,fCrHT9_HuFUUf4obXK2PKg
4298223,2015-05-19,0,5CJL_2-XwCGBmOav4mFdYg,Overall good is good. Curry is awesome. As for the service. It's ok... Takes a while to get things. Nice bar to hang out and a entertainment stage.,aaPAKVWc50YPUv5zdaaQWA,0,1,3,R3xxzro2Szg-4HFpFzpXQA
4300177,2010-08-31,0,5CJL_2-XwCGBmOav4mFdYg,"The wife and I were running errands around town, and our path was going to take us through China Town. We had both been craving Thai food, and because we were without a computer, we had to choose a place the old fashioned way, that is, we looked to see which restaurant had the most cars outside of it. Its hard to tell in China Town because it is just strip mall after strip mall, but there seemed to be many cars in front of Krung Siam and people going inside. 
When we got in, we were pleasantly surprised. The decor was very modern, and I felt like we were in an upscale Asian restaurant in Chicago or New York. Additionally, from the looks of the lights and the sound set up on the inside, this place gets hopping after dark. 

We were greeted by a very young looking hostess, and actually all the staff we saw were quite young, which was just not what we are used to in this part of town. On to the food! I got the Pad See Uw with Tofu and the wife got pineapple fried rice. We also both got Thai Iced Tea. The tea was not as sweet as I've had other places, which was very nice. The spices were more prominent, and the flavor was bold, but not overpowering. My dish was amazing. I think its probably the best tofu I've had in a while. It w as fried, but not over fried and the black soy sauce filled the pores of the tofu. It was nice and firm, but not too crunchy. The noodles were also cooked perfectly. I could have eaten them by themselves. The veggies were also cooked well, not too stiff and not soggy. The wife's lunch was also very good. All the veggies and fruit was very fresh, and including raw cashews and unsweetened raisins really completed the meal. It was flavorful but not too sweet and not too salty. 

The price was very reasonable. Less than at our other Thai haunts. We paid about $22 for the 2 entrees and 2 Thai teas. Not bad at all. 

If I could give Krung Siam a 3.5 I would, but I will round up to a 4. I am excited to come back to this place.",qF1V8GyuLL5Fpv40Cyturw,0,0,4,6c_eDUdoHu0bOJs0KsslFw
4315065,2014-07-05,2,5CJL_2-XwCGBmOav4mFdYg,"Out late and want something besides steggs?? Tired of waiting in those long lines when all you want to do is grab a nice late night dinner? Okay, lets skip all the ridiculous intros and get into this review

This place was really appealing to me for some odd reason.  A cool mechanical waterfall when you enter the restaurant, dimly lit, neon everywhere, a stage for live music and waitresses walking around with bunny ears? Definitely a place different from where I normally eat at but I do enjoy the charm. 

Service: Was absolutely great!  The guy we had was very cordial, made sure our glasses were always full (big plus) and was very pleasant.  Towards the end of our meal, the manager took our leftovers and personally placed them into individual boxes (YES!). 

Food: The sauce that accompanies a lot of the dishes I got the spring rolls which were perfectly crunchy and flaky without destroying the contents.  The drunken noodles were a yelp favorite? but really wasn't that great.  It was like a 80:20 ratio of vegetables/meat to noodles and the noodles were more like sheets.  The Thai BBQ chicken gets  flambed which is pretty freaking cool but make sure you move the chicken off the plate and onto your plate or else it'll burn the bottom.  The fried rice and pad thai looked good so i'll definitely will get those next time. 

Music: We had a guy playing a guitar while we were eating which was pretty charming.  

Overall: Great place to eat whether it be afternoon or late night.",lXZ7aziyUJyA6V0FlIR1Wg,2,2,4,6RsicfsYkHvCmL4SeqY8LA
4326523,2013-09-09,0,5CJL_2-XwCGBmOav4mFdYg,"For  a 24hr Thai restaurant in China Town I was actually surprised. I was expecting it be americanized and super bright inside, but It had a traditional vibe and was almost romantic. Music was playing through YouTube videos that the waitresses were choosing and you would think I'd be annoyed, but it actually added to the homeliness experience. The food was okay, I ordered the pork jerky and sticky rice, which you can't mess up, and chicken satay, which wasn't my favorite, but I'd definitely go back for that late night craving.",aZtJzH3fRIRzrGnQRIVaRg,0,0,4,sHkoDPCDDyJPctMVjfM9Ig
4335975,2017-04-08,0,5CJL_2-XwCGBmOav4mFdYg,"Amazing flavor, great music, friendly staff! 1-10 spice level: level 6 accumulated heat at a tolerable range. Large entree and green tea, quite affordable at less than $15!",KAMyp0-hS2orYmpoMaBj-Q,0,0,5,Ff0PnyvK-DOEzjWz5dGQfw
4341890,2017-02-15,0,5CJL_2-XwCGBmOav4mFdYg,I'd come here every time when im in Vegas. Food is great especially the green papaya salad. Customer service here is also wonderful. They often come by to check to see if everything's ok. They also have happy hour menu if u come 11-3 which serve in smaller portions.,CggZwJYMBu7nrhaqXVGE8g,1,1,4,EoYTBylZfPZ2dwxgGX7-YA
4344962,2010-05-12,0,5CJL_2-XwCGBmOav4mFdYg,"Came on a Sunday night after work to find myself greeted by a friendly you g lady and a nicely unobtrusive singer with a guitar.
Had the Tom Kha and a satay chicken and they were both pretty great. It wasn't overwhelmingly outstanding, but it was certainly worth me stopping in. 
Pleasant atmosphere and a friendly staff, not a bad night out.",QeTQEQniqwaMf_ZsGBhaSQ,1,1,3,4VUvy--IWwlUP24iiusB_A
4360590,2012-01-24,0,5CJL_2-XwCGBmOav4mFdYg,"I had Pad See Ew, it was good but I had frequent chewy bits of beef. Thai Tea doesn't come with free refills. Bathroom is creepy to find (took like 2 hallways to find)

I might come back for the bar and live entertainment.",a7Oby4yiZ8wHKvu2zhoC5Q,1,1,3,yrfl98V9RmtMl1V20LF5oQ
4369964,2011-12-27,0,5CJL_2-XwCGBmOav4mFdYg,"I love going here with my coworkers for lunch.  Parking can be tough.  The atmosphere is pretty nice.  Better than mom & pop style, but not quite the high end decor of Vegas strip.  Servers were friendly, but slow.  Food is always fabulous!  I lover their yellow curry.  They will make it as hot as you want.  Many different lunch specials at only $6.99, what a bargain.  In addition, their Thai tea is only $1 during lunch.",tixImBjX6uTCBDYcg0JvuA,0,0,5,LKses-1IqPXQMpxf0mQa9g
4371811,2012-03-18,0,5CJL_2-XwCGBmOav4mFdYg,"I guess we were just lucky to come on a good day because my party and I received great service when we went. 

The food also tasted great. Their yellow curry, the taste, I can still recall to this day. Their Thai iced tea may not have tasted as good as other places but I didn't mind. Our drinks were refilled on a timely manner and our server was very attentive. We didn't need to call out to him because he checked up on us without fail. 

So I don't know what made our visit different from those who had a bad experience, but I'm glad we gave Krung Siam a chance.",YUzqKt7hmG5BkRykHeZ0gg,1,0,4,4lNBCUzTuXbF0MHhwzKXYw
4371975,2014-04-24,0,5CJL_2-XwCGBmOav4mFdYg,"We ordered thai iced tea to go and it was one of the best places. 
We have to go back and try food next time!",NFodPTpbWK7dSymxaBiUXg,1,0,5,ms0_ew5d17egbdcLaRUzZg
4378388,2017-05-13,0,5CJL_2-XwCGBmOav4mFdYg,"Chada Thai, Ocha, and Weera fans, you've got serious competition. This place has southern Thai food that rivals the best in town and beats street food in Bangkok. 

Thai beef salad is incredible. Soups are great, and the noodle dishes have complex and spicy flavors. Even their dry chili has a smoky taste unlike the rest. 

Of that's enough, this place has soul. It's a late night spot, often busy after midnight. And there is usually someone playing on stage.",ChADwrKjusoOHLlU0v_iRg,0,0,5,F3YPpuNK0OKi2o280L-1OQ
4381304,2014-01-10,0,5CJL_2-XwCGBmOav4mFdYg,"Service= Good
Food= Very Good. 
Ambiance = Good

We went here for dinner and ordered Satay,  drunken noodles and Fried Rice.   All very good.   Rice was really good.   Pair it with some dry chicken and you will love it.",OmooyMuY7DKVFJ7i36Ik1w,1,1,4,PsaIRsJn5_YAWg9OXSJhgQ
4395539,2014-07-04,13,5CJL_2-XwCGBmOav4mFdYg,"The atmosphere reminds of Firefy- dimly lit, loud music, and close seating. It was hard to have a conversation in such close quarters, but the live band kept us entertained and we shortly got our entrees after.

Drunken noodles: pick your choice of meat and spice. We got chicken in medium spice. There were plenty of bell peppers, chicken, and tomatoes...but where's the noodles? I was a little disappointed for not having enough noodles. But it was flavorful and had a perfect amount of spice and plenty of leftover meat and veggies after the noodles were gone! 

Thai chicken: when the server brought it out, he poured some liquid over it to make it sizzzzle! Talk about dinner and show! And it came with two dipping sauces, one was a sweet chili sauce and the other had a spicy/fish sauce/lime taste to it. The chicken was juicy and tasty by itself! But the sauces did elevate the flavors and give it that Thai twist! 

Spring rolls: I didn't realize they weren't the fresh kind. It was the fried egg rolls filled with noodles and vegetables. It also came with a delicious dipping sauce that was different from the sweet chili sauce given to us with the chicken. It was my favorite of the three sauces we got! They also cut the spring rolls in half, but they're as big as normal sized eggs rolls. 

I love how they're open late and not too far from the strip. Great place to grab food after work. And I did see a beer tower advertised for $18 all day! A lot of people ordered pad thai and fried rice when I went, so I'm gonna go back and give that a try!",z4RytucxI_XfcMFaEI2DRg,16,14,4,4pKSsh-vxefMjJJauPi6dA
4417296,2018-03-14,0,5CJL_2-XwCGBmOav4mFdYg,"Amazing thai food. We ordered the Penang curry,  Pad thai and drunken noodles. All of these were simply amazing. The best thai food we have had so far.",wOgR01tRSVWK4FJSBajXmg,0,0,5,0YH51slQeYq2MpoWwr9IQQ
4438629,2014-03-19,0,5CJL_2-XwCGBmOav4mFdYg,The rice was dry. The curry was alright. My boyfriend got the fried rice and it had no taste whatsoever.,KgB4y_s_vrAgsrCbKbS8oQ,0,0,1,vZZW1dARlNVvWWCbu0YgPA
4476305,2013-12-15,0,5CJL_2-XwCGBmOav4mFdYg,"Upon walking in there's was a live band performing, which was pretty cool. The wait to be seated was short.  I ordered the drunken chicken noodles.... But I received beef w a few pieces of noodles! Now although I ordered chicken and got beef and I hardly had any noodles at all... The food was still decent.. They ask if I wanted to send the food back but I'm not one to send food back w/o worrying about the cook doing something to my food so I ate it and it wasn't bad, but  not what I wanted.. Overall average experience",9c_pBXCur57U294IPGg77w,0,0,3,3D2s1NzzjUedc4K7vP3fOw
4491386,2012-04-21,0,5CJL_2-XwCGBmOav4mFdYg,The Drunken Noodles here are so delicious!   I tried them after Angela H suggested this dish. This is the first time I've had them so I have nothing to compare them to but this tastes better than Pad Thai. I had this with a side of white rice and it was a satisfying meal. It was spicy enough where I didn't have to add anything to it. I typically don't like thick noodles but these were flat but big. Yummy!,48vRThjhuhiSQINQ2KV8Sw,0,0,4,AcG2T4lgeqC5WNTVEDYdMQ
4493653,2012-03-23,0,5CJL_2-XwCGBmOav4mFdYg,Suggestion: Dim the lighting a bit and offer larger beer selection. The lady singing is very soothing.,KyIVQz2ktjkCwn5ic_48yg,0,0,3,c0-4vWefG7TPGcSAH2Cj-g
4508729,2014-05-17,0,5CJL_2-XwCGBmOav4mFdYg,"Have been back to Krung Siam several times since my first review, and I have to say that the more I go... the more I love this place.
My favorites are still the crying tiger!! (if you don't try this you are doing yourself an injustice!)
I also love love love the fried cornish hen!!
The whole fried fish is amazing, and still love the drunken noodles!
I changed my stars from 4 on my first review to 5 stars now, I have been several times and I really recommend at least trying this restaurant once, it has a certain appeal that brings you back...",FEwPxhjdVKxSPVQQAHX2gg,0,0,5,ErjjANluUFr-eirFwtIpGA
4522823,2016-07-05,1,5CJL_2-XwCGBmOav4mFdYg,Really good Thai food! Everything is fresh. My boyfriend and I always come here anytime we come out to Vegas. I love their Pad Thai and Papaya Salad. I ordered it at a spicy level 1 and it was pretty spicy for a 1. Very friendly staff.,s3gdgRPFtUpunf34JMD_bg,2,1,5,Q19z9SlPXhaTcLRNz_NpGQ
4530789,2015-07-20,1,5CJL_2-XwCGBmOav4mFdYg,"Before my husband and I ate here, we went to a place across the street first. We were seated, given menus and water. We were then ignored for 20 minutes so we walked out and came here. I am SO glad we did! Everything about this place is great! Atmosphere, staff, food, entertainment, presentation were fantastic. Our server, Sam, was great. Very informative and friendly. He asked me how spicy I wanted my food on a scale of 1-10 and I'm glad I said 3. It was the perfect spice that it wasn't so overpowering that I couldn't taste all the other flavors. Neither of us had an empty glass on the table, and my husband had at least 4 refills. He never had to ask for one. We are definitely going back and recommending them to everyone we know.",pIzyC-oPzQccanodA2ckWQ,0,1,5,GzkoLTediSYBIsTcDFTb5A
4532746,2018-01-06,0,5CJL_2-XwCGBmOav4mFdYg,"I came to Krung Siam on boxing day. It was not busy. The staffs were  nice. The pad Thai was excellent, the best I have ever had! We also tried the Tom Yum hot pot and raw shrimp, they were pretty good. My family loves the chicken satay. we had a good time there.",GX1L_SDILfs5qTau-cnRzA,0,0,4,ISfZweSS-ObxEHqrb8HsRw
4554884,2017-02-14,2,5CJL_2-XwCGBmOav4mFdYg,"I'm so thankful I live in 2017, a day in age where a random stranger will pick up and deliver food to your doorstep over a few small strokes of an iPhone app. Yes I'm talking about UberEATS and all it's glory. 

I placed a delivery order on Saturday since I was obviously stuck to my couch and it was pouring rain. The order arrived within 20 mins, hot and fresh. I had the Tofu Pad Thai with medium spice. Let me tell you that medium spice did not play, it was definitely on the spicier side of things but still very good. The portion size was large too, enough for two meals. 

Overall the food was delicious and I'd definitely order again. Thanks for keeping my weekend vibes real!",OXSJCjKtvZPf-YPDCXcWZg,2,1,5,fTqyKYNJl8020kjvoR-7nA
4555284,2017-07-01,0,5CJL_2-XwCGBmOav4mFdYg,Was very good and was delivered in a timely manner! Price were good! Would eat here again. Thanks !,mjZxBOwooPyVwhqyYWDffA,0,0,4,r6i7U-2KsU9FSwb-cRTNzQ
4565157,2010-03-10,0,5CJL_2-XwCGBmOav4mFdYg,"A friend took us out here and it is truly some of the BEST thai food i've ever had. Every dish was so flavorful and authentic tasting. Now, i'm not thai, but you could really taste the complex flavors and cooking style were not watered down for americanized taste buds.

I ordered the Thai Basil with steamed tofu and the sauce was just to die for! perfect balance of sweet, salty, basil flavor. The eggplant basil dish was also mind blowing. The eggplant was slightly caramelized and meaty. The drunken noodles had soft, succulent noodles. the Pad thai was so different from the overly-peanutted(is that a word?) dishes I've had elsewhere. Lots of great flavor & texture everywhere. 
We also orderd a pot of tom yum soup for the table which was fantastic. However, please be warned, those are not green beans in there! it was a 5 alarm fire in my mouth for a minute when i took a bite into one of those chiles!

The prices are great - $4.99 lunch specials during the week and $8-$15 entrees otherwise. Everything was out of this world delicious. Don't miss this place if you are in Vegas and have a hankering for Thai food! I wish I had a place like this near home.

oh, also, it's in the Chinatown area off the strip so you can also go get foot massages at sketchy places across the street. ;-)",UG8cewYtZdep2hzSekIqYg,3,1,5,RI5sDNfvLtot3bAbRGZysg
4577189,2016-07-19,0,5CJL_2-XwCGBmOav4mFdYg,"Yes it is on the outskirts of the strip, but personally I thought the food was really good and worth the drive. In fact, my friends and I hit this place up two times during our trip this weekend. 

Food: 
1. Day One: Tom Yum Noodle Soup
I ordered this dish with flat rice noodles and it definitely hit the spot after a crazy night of drinking. The soup tasted super authentic and was not too tart.  As for the meat and fishballs, there was plenty of that so no need to worry about the portions here! 

2. Day Two: Spicy Basil Fried Rice 
I had a taste of my friend's order the day before and I was hooked instantly. The rice had a strong garlicky taste so this is a great dish for a garlic lover. The beef that came with this dish actually surprisingly tender and not chewy at all.

Final Verdict: 
Thumbs up.",8-S4AUMpk_3ZKQQbWgiwvQ,2,1,4,yZlrmHEi5XPVnWOh9CVxhA
4588307,2016-07-12,0,5CJL_2-XwCGBmOav4mFdYg,"We loved this place a lot! Authentic and delicious tai food, live music, very pleasant prices, and friendly personnel. We got thai pod soup and drunken noodle, both were delicious! Special note about their singer (asian man in glasses, didn't get to know the name), he was very good, nice song selection, definitely added to our positive experience. Highly recommended!",nQoXeiXcz1IrM260OVLtPw,1,1,5,jQyooXBbAGKI9iWI2BHUaA
4600665,2014-07-01,1,5CJL_2-XwCGBmOav4mFdYg,"I can't believe I haven't written a review about this place yet since it is the best! This was one of the first restaurants my boyfriend and I tried when we moved to Las Vegas in 2011, and let me tell you it did not disappoint! 

When we arrived (with a party of 7) for his 24th birthday, we were greeted and seated almost immediately. Earlier in the day I came by to drop off a birthday cake and some decorations and they waitress had them set up when our party arrived.

First thing ordered was Thai Ice Teas for the table. Which were amazing. Not too sweet, and not too strong, just perfect.

For appetizers we order 3 servings of the Thai beef Jerky. Very tender with just the right amount of spice.

My dinner selection was the shaved papaya salad (I ordered a 4 in spiciness) and it was crazy hot, but I washed it down with the tea ( the next time we visited I ordered a 3 and it was perfect).

The waitress brought a round of martinis to the table to commemorate the birthday celebration, and the person doing karaoke at the time joined us in singing happy birthday. It was an awesome night.

Pros:

atmosphere
service
food

cons:
Parking
lighting (it was a little on the dark side)

This review is from my first visit in 2012 and we have been back 8 times since. Definitely recommend!",1sghNitdObSPFhxqS5Othg,1,1,5,EnZq2zhX3dP18Qst1vqqqQ
4608934,2010-03-07,0,5CJL_2-XwCGBmOav4mFdYg,"We stopped here for a quick Thai meal before a play on a Saturday early evening in February. There were only 2 or 3 tables filled. I ordered an ice tea, only to be told they were OUT OF TEA! We ordered an appetizer and two pad thais, one with shrimp, the other with seafood. The pad thai was delivered before the appetizer, about which we had to remind them. There was no lime with the pad thai. When I asked for a slice, the waiter returned with a slice of lemon. The pad thai tasted off; the seafood was rubbery rings of calamari.  After struggling to get the waiter's attention, we paid the bill without finishing the meal and left. The next day, my dining companion (the ""seafood"" orderer) felt sick to his stomach all day and ran a low fever. Never again. Bad food; bad service. And this in s down economy. You'd think they'd treat their patrons better.",WVNFUjZPtKqI7YPle-EMTA,0,0,1,uAX81fUErHmyr7ZNv4KOEA
4615577,2011-08-04,0,5CJL_2-XwCGBmOav4mFdYg,"This place would be a 4-star if the prices aren't so steep. Let's face it... the only justification for Thai food having such prices is that it's pretty close to the strip; otherwise, it's better to go to other Thai restaurants throughout Vegas that are more reasonable. 

Despite the prices, the food is certainly 4 stars! We ordered several dishes and shared ""family-style"" and were able to try a little bit of everything. Bowl of seafood soup, fried rice, chicken, the popular basil dish, green curry, and pad thai...  I love that you can specify the level of spice for your meal ... levels one through ten. 

I finally went back a 2nd... and 3rd time and had a chance to order my dish 10/10 level the 2nd time and 15/10 level ;) the 3rd time. They did a fantastic job with the level of spice, and when I didn't like my first order *(for the first time in my life I found a dish I do not care for... it's the Thai beef noodle soup... the flavor was not enjoyable for me)*... the waiter was kind enough to replace my order with the Drunken Noodles, one of my all time favorite Thai dishes, which was EXCELLENT. 

I will definitely be going back... just not too frequently because it'll probably burn a hole in my wallet ;).",WpZTKVU09--Fb2qFneqkZg,0,0,3,7rsaaRf9cl-IzV1DrR8nMQ
4617402,2015-01-04,0,5CJL_2-XwCGBmOav4mFdYg,Best Thai restaurant in Las Vegas. Good prices and wonderful staff. Casual environment with a nice stage for bands to play. All good comes in levels of spiciness. 5 is a good level to begin with if you enjoy spicy food; their levels run on the spicy side so 6 will be what is a normal 8. I highly recommend the panang curry and the Thais beef salad.,EK5Ag1PkZh2gXL79V-fGDw,0,0,4,g9KlmcvMDTfBmZuuIRR3mQ
4632396,2013-05-01,2,5CJL_2-XwCGBmOav4mFdYg,"Yelp 100 Challenge * 59/100

Landed here with the parentals during another of our foodie ventures. 

Spotlight goes to their $5.99 lunch specials. 

Frankly, I was skeptical about trying this place out at first, especially after hearing mixed reviews. Alright, maybe the servers were not as homey or warm as I would've expected them to be - but I will give them the benefit of the doubt and take it that I do get groggy myself at that time of day (2pm). Nonetheless, they got our orders down like lightning and our food arrived in less than 10 minutes.

Papa had the sweet and sour shrimp, mommy had garlic and pepper chicken and I got the yellow curry beef. I must've been the most satisfied out of the three of us. Curry was extra mild, as requested and the coconut milk brought out a rich overall flavor to the dish. I'd say it was sweet with a touch of spiciness - not eye-watering hot, but enough to keep the spoonfuls coming in.

Mommy liked her chicken. Didn't last too long. Papa wasn't too keen on his order because he said that it tasted like pre-cooked, pre-packaged and refrigerated shrimp tossed into a plate of sweet and sour sauce. To put it simply, I guess he meant that the flavor did not soak in too well. 

Oh and how could I forget? We absolutely loved the soup! (it came with the lunch specials) Would've liked it too if there were side servings of egg roll and fried wonton for every order like the krung siam website said. Salmon was crossed out the menu for some reason (that was going to be my first option) so it's best to not rely on their site to be in the know how about what they currently have. 

We'll be back here again for lunch soon. Enjoyed the peaceful ambiance and papa had a great time keeping score of the NBA playoffs thanks to the tellies lined up along the walls. They each had a different sport playing. At some point, he needed to know a team's score so I sifted through my phone to check it and hola, there was wi-fi! Could've been jacked from the starbucks right beside (very very possible) but still, you get to access it and that's the best part.",QJMOgjRYeogK43kyfX6PKw,2,2,4,InZWvvl8d5V8NSt7uSPwWQ
4643242,2017-06-15,0,5CJL_2-XwCGBmOav4mFdYg,Seriously one of the best thai food spots ive ever ate in my life curry is to die for ... This place is truly ine of my all time vegas faves !!!,bHufZ2OTlC-OUxBDRXxViw,0,0,5,luHjelP3XpSXWlHOJyfPWA
