,date,funny,business_id,text,user_id,useful,cool,stars,review_id
5944929,2014-04-18,0,6bVEM9jD-mpU4WNXcJ9tHA,"First off I have been on a pizza craze lately this one hit the spot and knocked it out of the park. 

After owning a pizza restaurant I can tell its fresh dough witch is nice had great flavor and texture air pockets in the crust when you bite into it the way its suppose to be. Good pizza sauce really great toppings. 

I have Philly cheese steak pizza and let me first off say its a light pizza again referring to ability to eat pizza how many slices etc.. Also they add toppings. I thought I got extra toppings on it but no I like that it makes it feel like your getting more bang for the buck. I saw the box's too that they advertise for wsop witch you know its going to be a great pizza to get a sponsor like that ! 

Also ordered chicken wings.. wow good flavor not raw or pink on inside almost kinda tasted Asian like, my only gripe was that some how bye the time I got home the sauce fell off the wings and lost its coating, witch would of been amazing if it could of stayed on lol. 


They have a HUGE ! extensive menu like 3 -4 pages covers everything from ribs to wins and dessert with 2 slices starting at $4.50 14' pie ( pizza's ) $7.95 and large 16' pies starting at $9.95 they about 10 different kinds of hamburger combinations,10 different kinds of subs, grinders and also gyros they run lunch specials at $6.50 also offer up delivery 

Honestly alot better then California Pizza Kitchen. There pizza dough is amazing !

will be back !",8hJM27VoDr3rrOqWSQfrLw,5,3,5,QVip4clzX8rVa1Eiuundzg
