,date,funny,business_id,text,user_id,useful,cool,stars,review_id
27146,2017-04-29,0,6bVEM9jD-mpU4WNXcJ9tHA,"Absolutely terrible. No NOT order from this place. I was going to call it a restaurant, but restaurants actually cook food properly and know how to show they appreciate their customers. No, this place is awful. 
First of all, our food arrived looking like someone dropped a bowling ball on it. The containers were crushed. The chicken dinner we ordered was all legs and far too overcooked that it did not get eaten. We also ordered a 12 piece order of wings with medium sauce which came absolutely naked and flavorless. 
I called their shop to tell them how bad the order arrived and the ""owner"" who picked up kept claiming our order was right. I explained to him several times, while receiving a lot of attitude from him, what was wrong and he did not seem to even understand. Eventually he handed the phone off to someone else, while he talked loudly about me cursing in the background. I explain to the second person and eventually I'm told they will be doing nothing about this. 

I just wasted nearly $40 on food that was not eaten. Let this failure of a ""restaurant"" go out of business like it surely will. Do not order.",CS76Jp5WXssR_wexW2qt2A,0,0,1,Ydfz4AB8-lIexSv52K8n7g
99251,2016-09-09,0,6bVEM9jD-mpU4WNXcJ9tHA,"I'm happy to have found this place.. yummy food, great service, and huge portions.",CmTSZNEjcwxFfvq71WTM0g,1,0,5,M2Mk0XVmDaUjC8egfYY4mw
166296,2014-12-20,0,6bVEM9jD-mpU4WNXcJ9tHA,"Rodney gave me the fastest delivery ive ever experienced!  Seriously 15 min after ordering, I was pleaslantly shocked! 5 stars for that alone.  Got the lunch special,  very pleased with portion size, added a coleslaw for 90 cents, cant go wrong.",iK_w7Td8RFB4p_IGQOCY7Q,1,1,5,oLw2LoPHhErNk1TQ9T8ceQ
173334,2013-01-31,0,6bVEM9jD-mpU4WNXcJ9tHA,"The food here was really good! I had the shrimp basket, Garlic bread with pepperoni, slice of pepperoni pizza, and mozzarella sticks. The tab was $22.00 which was very reasonable, and the service was fast. The only thing that could use some work was the energy in the store ( a little low energy, maybe some music.) but that aside I recommend this place.",d2AoUIIt0_XddAR_wSVHXA,2,0,4,Oqpr33HS761D_GfjftLYlg
233927,2016-06-29,0,6bVEM9jD-mpU4WNXcJ9tHA,"1 star is being generous. I called in to order, the guy tells me to ""hold on"", and sets the phone down. While I wait, there is a guy in the background practically screaming ""fuck you."" The guy then picks up the phone and as I try to proceed to order, again..then the guy rudely states "" hold on, I'm busy as hell!""

Uhm, excuse me, you have a guy screaming profanity in the background and you're ""busy as hell"" to take my order? How unprofessional of a business.
That's fine though, I'll order from East/West Pizzeria. 
Their service/food is better anyways.",qxGQqK9H5MB_-hdIlUnahg,0,0,1,Mb4aRcHeypYu2OJ4-wYNWA
294459,2017-12-18,0,6bVEM9jD-mpU4WNXcJ9tHA,"I came here with my dad and walked in for the first time and was unsure if it was open or not because the lights were turned off at 4:50pm but a customer was waiting too in the dark. It took awhile for the lady to come to us. She was the only one there so I gave her time. She turned on the lights for us to see. As we ordered, it was too late to use my discount on Yelp.
We went to Walmart and came back since the lady said 30 min. We waited an extra 10 min and got our food. We ordered a large pizza, baked beans, and calamari. Everything is good. Came out fresh and hot.
The guy is friendly and very generous when it came to the discount on yelp. He made it up for the service.
I will be coming back again.",hktqVwzT-qIordt-MAfa-Q,0,0,5,hmDyQ7VkMwyg5xCupLjmXQ
305770,2016-11-23,0,6bVEM9jD-mpU4WNXcJ9tHA,"This is really delicious pizza! I just wanted a quick dinner one night and my friend recommended this place. The square pizza is really where its at, the regular pizza is pretty boring. Definitely recommend!",I8_9Untdw3eJpG3wp4-osQ,0,1,5,WaDo6BhsmCxDvO3RICj3pw
420195,2017-08-07,0,6bVEM9jD-mpU4WNXcJ9tHA,I order the pepperoni pizza and it was delish! I found a new place to have lunch and the prices are great!! Great customer service. I will definitely return and try more stuff on their menu.,PnhKIE9HmdKhAZywt__HaA,1,0,5,pKEWJ-hiKkIQMJQ9RdKhrA
432241,2017-11-05,0,6bVEM9jD-mpU4WNXcJ9tHA,Great little spot. Super friendly staff and delicious pizza. A bunch of stuff on the menu I want to try but haven't yet... Will definitely hit them up again!,zSh-EYYi8vf9GRC8gzsXnw,0,0,5,vKluShwVq3n0olH7ZvEVcg
489704,2017-03-28,0,6bVEM9jD-mpU4WNXcJ9tHA,"I drive past this joint everyday for school by the local college and I decided to stop by and get pizza instead of mcdonalds today and it paid off well! Amazing staff and friendly, pizza came out fresh and perfect temperature to dig right in. Made sure I was stocked with pepper and cheese and even mentioned whenever I return that maybe they'll have some ghost peppers for the customers! Overall amazing place and will be back with more people! 2 slices of pepperoni pizza and Dr Pepper for $6 can't be beaten.",iuP_g_kQEyAvF-XZ_ZWtBQ,0,0,5,jEmXWPLy3AewamZhRnWOsA
498228,2017-11-09,0,6bVEM9jD-mpU4WNXcJ9tHA,"Not too sure about all the 4-5 star reviews. Picking up an order and the guy is absolutely rude. Door is open directly to kitchen as I am sitting right outside. Pretty disgusting and probably a Heath violation.  I hope the pizza speaks for itself without any critters on top. So he says 20 min my food DELIVERY order will be ready, it's has now been 40 min and he is talking story with their own delivery driver.  Two people ordered after I got here and they both got their food before me.  Now this is ridiculous. By the way, kitchen door still wide open to parking lot. I really hope the owner reads this and I hope the cook ain't he.

More updates!! Cook comes out with cigarette already lit and then runs back in kitchen with it! Gross! 

By the way, still waiting for my food..over an hour...",euNbjUhzS7_jK-rMibmEVw,0,0,1,Bgh3Jb9hNpMJW_qpRWj2Rg
552496,2017-03-29,0,6bVEM9jD-mpU4WNXcJ9tHA,"Been a loyal customer here for a while and one day decided to try out the delivery as I ordered my total was 11.50 and they told me it had to be a minimum of 20 but then one of the employees said it was fine s9 that was nice of them , they got here pretty quick and When the guy came I handed him a 20 and told him to keep the change and the biggest smile of disbelief came to his face with a "" really ,oh thank you!!!""which made my day , he thanked me and i happily enjoyed my food :)",nyrOV_rAeaNzwmbqUvGFKg,0,0,5,UHVfWaxHafhH4AtNBsvPtA
563406,2016-10-04,0,6bVEM9jD-mpU4WNXcJ9tHA,"Cool place!
A very good old-school style pizza and pasta joint. We had the baked clams which were nicely seasoned and you can still taste the clam even with the breadcrumbs and filler. We also had the pie with meatball, sausage and pepperoni. The meats weren't overpowering and it was a good meat to pie ratio. We also shared the bucatini which was nicely al dente with a flavorful sauce with lots of pancetta. Our server was very attentive and spoke Italian too!",SnoDLCsVjvsdPZi5Q38sog,0,0,5,ef2qPG8xhZRr2RAkFVkpRg
580368,2017-09-19,0,6bVEM9jD-mpU4WNXcJ9tHA,"They forgot my order of fries, i had to drive back to pick up. My salad was expired, the lettuce had hints of brown as in OLD already. On top of everything i asked for yellow peppers/jalapenos and they said ""No"" i said ""No? No you don't use them"" they said ""No"" WTF. After i had to drive back to pick up an order of fries these fuckers should have gave me a cub of peppers. A picture of a pizza posted shows jalapenos as a topping. So they DO use jalapenos. Never coming back. Tossing this rancid ass salad out",VJtMinmukfcg5dmqKSLOFQ,0,0,1,hTYVh2EC_m3Z-0IT7VwZew
673911,2017-12-06,0,6bVEM9jD-mpU4WNXcJ9tHA,I like this pizza. I'm student at College and sometimes have a lunch at this place. Workers very friendly. Recommend for students CSN. Place clean. I love New York style design.,RKvqilHp02_owuYduXl-zg,0,0,5,LZGvByemAT5orn0AK69k_w
699708,2017-07-02,0,6bVEM9jD-mpU4WNXcJ9tHA,"It's an inexpensive place to eat, but you get what you pay  for we waited over an hour and a half for ribs that tasted like the meat was old  and chicken that was fried so hard it was dried out I would NEVER  order from them again!",l6GCdgXtZZRzd2iYODvEJw,0,0,1,HWu8kTl-f3yY0sNsdhZB2w
727550,2017-01-16,1,6bVEM9jD-mpU4WNXcJ9tHA,"We came in this pizzeria again . And this time everything was amazing.  We ordered two pizzas, and they were great. The key thing is not overdoing it but having the right balance of crust to ingredients. These are thin crust pizzas New York style. If we come in Vegas next time. We will come here again.",BJC6kOTdGj14IgWfiF09WA,1,2,5,6foDhRXuFsdP8deQsC_TVw
740254,2017-01-31,0,6bVEM9jD-mpU4WNXcJ9tHA,"I definitely like the pizza here. Definitely New York style and they have a credit card limit of $10.00 USD, but still. It is worth it. I do not frequent often, but I definitely like the taste, it stands out. They have unique combinations involving chicken, especially the chicken, onion, and peppers. It must be my favorite!",JOQIvKvXBQUHv4zRzkK3Jw,0,0,5,kVWKYfmedhoNQHFMgYcW5g
806390,2015-04-26,0,6bVEM9jD-mpU4WNXcJ9tHA,"I've ordered from here a few times and they ALWAYS take forever to deliver. Tonight was their last chance. After waiting an hour and a half, when I was quoted 45-50 minutes, I callled to check on the order. I was told the guy was on his way. 3 minutes later, some idiot calls me back and says that my order was canceled. But they can make it now and bring it to me. No thanks. You lied. You messed up, gave a BS excuse, no one canceled it and you should have owned up to your mistake.  Had you been honest, i would have waited for it. Now you've lost a customer for good!  Your pizza sucks anyways.",Oy42RzDXVxNEhLlQadqq5w,0,0,1,Dq8clkQEit1y57X0gdxcLQ
809445,2016-07-19,0,6bVEM9jD-mpU4WNXcJ9tHA,"I'm a foodie traveler,I'm travelling the world for the sake of new taste sensation,the first time I tasted New York's pizza when examining this beautiful city...then I had a long journey through USA ...And I was surprised when I having met the same taste at the other side of US . And it was in Vegas...The place name is New York Pizza Wings & Ribs !!! Wonderful location and very friendly stuff. This is the BESTplace in Vegas where You can taste the real NY Pizza ... GREAT JOB *****",hlbMuh1VjhnYaj-bKRc4QQ,1,1,5,N1tgu2CVFLro1yvfw-gGBw
962588,2017-08-29,0,6bVEM9jD-mpU4WNXcJ9tHA,"I have ordered 4 additional times since my first initial review. The food continues to be a good alternative to the franchise options you have. However the service is beginning to be sub par. Once when we ordered for delivery we ordered a pepperoni and ham pizza. Only to receive a pineapple and ham pizza. We called back and the owner said he would send out the correct pizza. The night ended and no pizza the following day we had to call back to have the correct pizza brought to us. Again on Saturday we ordered the same pizza this time for pick up and we had the same issue. I had to wait 20 minutes while the correct pizza was made. The owner gave me a free cheesecake to make up for it. However there's a limit to what giving someone something will do. Yesterday was just the final straw I called at 8 to place an order for delivery the owner answered the phone as he usually does, took my number and said he would call back in 10 minutes. 20 minutes went by with no call back and I just went with Pizza Hut instead. 

Moral of the story, the food is great but no matter how good the food is if the service isn't adequate, you're better off finding a different place. I understand it's a small business but I will stay away for some time and hope the service improves.",5CEQ1oTyE_5IcnfFTuggfw,1,0,2,d38gOcgDXpE0Xqg5oC3bIQ
983188,2016-12-17,0,6bVEM9jD-mpU4WNXcJ9tHA,"We went at lunch so there was no wait time issue. Pizza was great! Huge slices, and super great lunch special $5 with a drink, I think. Awesome speed to prepare pizza, clean tables, friendly staff. Definitely going to be a regular spot!",AatkDrTfzaEboM97Xi0VXA,1,3,5,Dv01rEyVCz4iZGZWRqBNqQ
1016646,2017-05-30,0,6bVEM9jD-mpU4WNXcJ9tHA,"Feta pizza was amazing. Menu has organic salads. Friendly staff, affordable prices. Close to CSN.",4I2BIXtqmGGte4i69S8kQQ,0,0,5,0tKiLr77-OmM2gjruxbqQw
1022978,2017-07-27,0,6bVEM9jD-mpU4WNXcJ9tHA,We just first time here order for the office and it was great please New York pizza 16 inch was great it was delicious we will get a full bucket of wings medium was excellent !!!!!they going to give it to us free ranch carrots and salary and we ordered ribs dinner it's comes with coleslaw beans and Italian bread roll  was incredible thank you guys.. we will be back thanks :-),IzHs7c7AL8IUtU1nId_LKQ,1,0,5,1rfy0B2kbTP022avAUEbUQ
1054329,2016-05-21,0,6bVEM9jD-mpU4WNXcJ9tHA,"I ordered something. I was not impressed either! I made a complaint over the phone. Along with Yelp and now I have two charges on my bank account! They are retaliating and I  do have the upper hand all because I  can prove it! Two different charges for the same amount on the same day! Like I  posted before, this establishment is nothing but a rip off of your money!

I also contacted my bank and I am in the process of disputing the second bogus charge. 
This establishment is highly not recommended due to their dishonesty and their business practices!",O08i-9YI_kc8cyq92Ag78w,0,0,1,f3cssO9nM5z-c6hKWtHXqg
1094302,2017-01-20,0,6bVEM9jD-mpU4WNXcJ9tHA,"Love this pizza joint not only because of the food but because of the people there! They are always friendly. Customer service is a must at every establishment. Pizzas are so good and crispy.
Huge slices too! Sergey create cool pizza! Reccomended :)",AelrIsUDWMdSgKYtUgLeow,1,1,5,32ppWrhe-Wwbvyup87_gyQ
1096539,2018-01-14,0,6bVEM9jD-mpU4WNXcJ9tHA,"An exceptionally great pizza place. My friends and I decided to order a delivery something off the strip. We got ourselves a large New York Special Pizza, full rack of back ribs, and fries. The food has arrived in about 35 minutes which was super fast for delivery (we were extremely hungry). The pizza was absolutely amazing. Lots of mushrooms, pepperoni, and extra cheese. It was melting in the mouth. So yummy. All ingredients were spread evenly making whole slice taste as good as the tip.
The back ribs were something incredible. Soft, hearty, and juicy. Lots of meat. Those are great quality ribs.
Fries were crispy and perfect for my taste.
Everything was hot when it arrived. My friends and I loved what we ordered.
Overall, it's a great place to order a delivery when you want to enjoy large portions, lots of fresh ingredients and delivered fast to your door or hotel.",Qh-zIT3jvPm-h5SOwt_t_A,0,0,5,WBmfUZ-Wz60NxZOYfyAx-g
1121129,2017-11-28,0,6bVEM9jD-mpU4WNXcJ9tHA,Great lunch specials! And the customer service was excellent! Definitely be back to try all their specials.,s9837cTpLHKlNi-O261VDg,0,0,5,TdcJaos1DCNRBssdrsJ7bg
1251218,2016-12-29,0,6bVEM9jD-mpU4WNXcJ9tHA,I love this home made pizza and the service is bellisimo!!! Home made ranch...nothing better than that!!,SEbcWZfT7n-D2_7DG6Nqlg,1,0,5,WQyCi9UgPSP9DKnLl0bc7A
1300115,2017-08-03,0,6bVEM9jD-mpU4WNXcJ9tHA,"I am actually very dissapointed, my co-workers and I  order from them at least 2 times a week. And the last 3 transactions with them have been horrible. Either shorting is on our orders or running 30 minutes late with no phone call to let us know. Their wings are good but they need to fix customer service. Not good enough for me to continue ordering delivery from there. Step up your game. Wingstop has better service.",L7OVxZtuP_VXnmdaCnA78g,0,0,1,d0eYwBsMk7mTKKjeyPWHYw
1346745,2017-05-16,0,6bVEM9jD-mpU4WNXcJ9tHA,"I was recommended this place by my sister in law and gave it a try. I ordered the Cheesy Philly, a cheese pizza and the Italian sub. WOW,WOW, WOW! All three items were real and delicious. I wasn't disappointed at all. I highly recommend it to anyone who's looking for affordable tasty food. I love that they have variety as well. Sergei was extremely friendly and gave me a very homelike feeling as soon as I arrived. Places like this are difficult to find in Vegas, I'm happy I gave it a shot.",uOkzOGlT1g4KyQ_MBx706Q,1,0,4,kT8Lkuy4L4Ck-JN35c16jQ
1352276,2015-04-25,1,6bVEM9jD-mpU4WNXcJ9tHA,Awful pizza. Nothing like New York. These guys think if they add New York to there pizza name it will taste better. People that make good New York pizza actually stay in NEW YORK. The failures try and make it other places.,6vCfxynGA5cZkrLsWMgyvw,0,0,1,V-7GT7Bg5IVazsxEWF1ktg
1416184,2013-10-16,1,6bVEM9jD-mpU4WNXcJ9tHA,"I ordered from here all summer, the food was fabulous! The ribs were better than most rib joints, the chicken & potato salad were wonderful, even the salads were worth talking about. The portion sizes were huge, we ended up over-ordering until we figured it out.  So why not 5 stars? Because they stopped delivering to my area. I know, I know, spoiled. But sometimes the POINT of ordering online is to have it delivered because you can't get away to pick it up. Now we have to plan ahead if we're going to order from here. Such a sad first-world problem to have...",O11n5wP5sq_NtxEGF6dwMA,5,2,4,xmX4sOGrQmHztKZgz5chRA
1476054,2014-02-09,0,6bVEM9jD-mpU4WNXcJ9tHA,"BF ordered delivery lunch from here earlier today- got a flier on our door earlier in the month and didn't want to cook or go out in public today.

Called in for the 12 piece medium wings with fries ($10) and the mushroom cheese steak ($7). Delivery seemed to take quite some time, but I didn't set a clock or anything.

Pricing was good, and delivery was brought to us by a Russian lady- kind of surprising, I'm so used to seeing guys doing delivery. 

Opened up our order and dug in.
Had mixed feelings about the wings: they were ordered medium and were crisp, but they were almost completely dry and while they had a good flavor to them, they didn't have sauce and were not spicy. They seemed to have forgotten to actually put sauce on the wings. Very odd.
The fries are steak-cut and dusted with seasoning, very tasty. All served with two cups of a dipping sauce- flavorful and delicious with an unexpectedly strong dill taste? Not sure if it was supposed to be a house-made ranch or what but it was good. Devoured it all.

The cheese steak was legit though- huge split roll piled with melted cheese and tons of mushrooms. Would order this again, and I'm not typically a cheese steak kind of girl. Great value for the cost.

Not sure if we'll order here again necessarily- if I'm  craving mushrooms the cheese steak might hit the spot, and I'm curious about their pizza, but the wings were disappointing.",bLbSNkLggFnqwNNzzq-Ijw,4,1,3,Dny6Qo98coPq-SlzB3hhrQ
1691273,2017-09-13,0,6bVEM9jD-mpU4WNXcJ9tHA,I love their sandwiches there. I recommend to order steak sandwiches. It's great place to eat. Their prices are great.,i_zFYEjNTzyLQhOvj0wFLQ,0,0,5,9Z4S6jryzgtwKfbi0E1bHA
1743061,2017-05-14,0,6bVEM9jD-mpU4WNXcJ9tHA,They had the best wings and chicken fingers I've ever had in a while there the best and it's made fresher then most known places . Thanks for the good food keep up the good work !,smqoU5bzfcPLm_1Be6qiNg,0,0,4,IacyrKsek7h1NyiCzo7PXA
1755092,2015-05-30,0,6bVEM9jD-mpU4WNXcJ9tHA,"I've ordered from here several times and each time I go on yelp to make another order, I'm a bit skeptical because of several bad reviews. However, they have never disappointed me.

Their spinach white pizza is AMAZING. I always get my order around 40-50 min as expected and the food is delivered hot. Definitely my favorite pizza spot!",Ut_su1XxNPNHGjdue7JTcg,2,0,5,sXRfr9YfI2U-wY3Fgxk1Mg
1765060,2017-01-05,0,6bVEM9jD-mpU4WNXcJ9tHA,"Good pizza great people nice little , friendly and inviting people came from cali they offered me cheesecake which was very nice 
Overall nice and cool place would come back",DKyqVLnJe0_EDIygg85q6Q,2,0,5,FFmbRlF7zeUpUcYa4zkHWg
1796222,2016-12-15,2,6bVEM9jD-mpU4WNXcJ9tHA,"I rarely write reviews but I had to this time. I live about a minute walk from the place, I geaux all the time. Sergey, who typically works on weekend nights is amazing. Each time I come in he is juggling calls on the phone, people in front of him and has control of the whole operation, all at the same time. He still keeps a great personality each and every time I see him. Someone....please give this man a raise. The guy works like a horse.Oh yah, and the pizza is great too, solid ingredients, made consistently well.",noj10Mm3fXsX3qCxUivXPQ,2,1,4,w_uf25EYuF_eghQ8tVn49w
1810464,2018-04-24,0,6bVEM9jD-mpU4WNXcJ9tHA,"We meet Sergio the store owner. He is a very nice, friendly and professional guy. Food was prepared quickly at a reasonable price. We got 2 large pizzas and got them piping hot and ready to go. We will definitely be coming back",cDVytkZ_DdmGHVz5BiUoGw,0,0,5,WORJgHtn5N-HQPnMg_g-Qw
1858757,2017-04-24,0,6bVEM9jD-mpU4WNXcJ9tHA,Pretty solid pizza. They are not my first choice but a close second. Great crust and good service. Delivery always seems to take an hour. Seems a little (just a little( pricy to me. I've only ever ordered the pizza so I cant speak to the sides.,C9KbGKrby4tIx9Qp3KwVpg,1,0,4,xcJLk5cV1BEYvSZfQg3U5A
1861180,2013-02-23,0,6bVEM9jD-mpU4WNXcJ9tHA,"Me and hubby (poster below) tried out this place this evening. They're a bit hard to 
spot unless you are looking for it. They're in the shopping center right behind the Jack in the Box (all the way at the end).  We got the Philly Steaks with fries and some side orders to get a feel for the place. The side orders were tasty. The philly steaks could use a little bit more seasoning, I personally like some Tony's (creole seasoning) sprinkled in. Otherwise they were great. Good bread - a little crispy with good chew to it and holds in all juicy from the steak. The thin slices of meat were great. They use provolone cheese (if you get it with cheese) and melt it in. The steak fries were pretty good and a very large portion for an extra $1.25.

They have a large menu and you can call ahead, walk in or even delivery. It has a small dinning area if you wish to eat there. It looked clean and you can see into the kitchen. They're new to the neighborhood and I was scared to give them a try, but glad we did.",Qjfmzb-TGBwJDNm2yuM18w,0,1,4,mGGGpYVSCK_Gbv_yl40I4Q
1934934,2017-12-16,0,6bVEM9jD-mpU4WNXcJ9tHA,"The food is really good. We have had both take out and delivery and it's excellent either way. The delivery is fast, the people there are nice and friendly. The Calzones are authentic NY style which is really hard to find in Las Vegas. They use the correct type of dough as well as using ricotta cheese which most Vegas Italian restaurants don't. We have had their ribs and pizza a few times too, which were also amazing. I definitely recommend this restaurant.",BWlSWu2FvEjU21F1SXbMEg,0,0,5,BqFQgkhb1c5U8BUVA5jT_g
1952542,2017-10-20,0,6bVEM9jD-mpU4WNXcJ9tHA,"First of all I would have deducted a star because delivery was a bit longer but then I realized I accidentally ordered from the other side of town, plus it was a friday and rush hour on the 95 came into play...
Other than that with those factors in mind ~delivery was pretty fast
~food was still hot
~food is delicious, usually I dont rate pizza places because im fairly picky but this is now my favorite place to eat
~Customer service from both the driver is pleasant as well as the owner, Sergio.

Delicious place to grab a bite and I highly recommend!",1MLDG3lxKa8rFbVpnWJ2Mg,0,0,5,A-UTrNn368n7LDCAdTZqCA
1968653,2016-05-20,1,6bVEM9jD-mpU4WNXcJ9tHA,"Food was incredible. I was gonna give the restaurant 4 stars for having to wait a while, and because the woman who took our order was a little unfriendly. But it was totally worth the wait! Amazing pizza! And my son loved their wings and spaghetti with meat balls. The owner came out to talk to us and to make sure that we were happy with everything, so 5 stars for this place for their food and service!",HHUzO3AXZECiC3oSUoY-bA,2,2,5,deQUDjhIi-rb-f4MzFGGPg
2005781,2016-09-04,0,6bVEM9jD-mpU4WNXcJ9tHA,"Customer service was good, food came out better than expected.  Our family were all very satisfied.  We wouldn't hesitate to go back and would recommend this place for a quick, cheap and good eats joint.",CFQsVxrvSoHmXtRz27g5Dg,1,0,4,qNF_1Yw_wtgduG6-mrwxQg
2074113,2016-07-20,0,6bVEM9jD-mpU4WNXcJ9tHA,"Served with plastic ware, to go dishes only. No ice. No cups. Water for purchase only. Salad very fresh. Ranch very good, lots of flavor. Baked ravioli not really baked at all. I will take home and put in the oven. Owners try but the area doesn't support a good buisness. Near CSN college but not much traffic. Fair over all. Probably won't go back but good for local area.",GQ1FJxhowR9Qf4a5QuqcOw,0,0,3,4mOtIuxg1XYzLl_EQgjdxw
2271627,2018-03-15,0,6bVEM9jD-mpU4WNXcJ9tHA,I love their pizza. The crust is so crispy and the sauce is really good. Their ranch is delicious. Their fries are perfectly seasoned and fresh. I would give them 5 stars if their customer service was better. Some of the employees are rude.,N-YKdtrN9Tx8Gi3nxUlbWg,0,0,4,5KeOnzfrgjpRwbaAMvOYpA
2278657,2014-06-11,0,6bVEM9jD-mpU4WNXcJ9tHA,"I was out running errands and stop at New York Pizza becauce friends how great it was . They were so right , we tried thier party special 3 that gave us pizza wings  fingers and fries plus we added ribs too! Everything was to die for !!! I l  will telling everyone about this place. The staff is nothing but the best from owner to the cook . Everyone would be a fool to not try out this great place.",y4uEA08nxx3keq-tql9VIA,0,0,5,jP2AEt4x9QsjMhUiLLpipw
