,date,funny,business_id,text,user_id,useful,cool,stars,review_id
4268720,2017-02-01,1,AoGCnRtwifZ2gTGHtg8KTw,"Rude, rude, rude. I've been in AND tried to order through Postmates. They cancelled 3 orders at different time of day, one being 3pm on a Wednesday, saying they were TOO busy.  Then I finally got to place an order, at 5:30 on a Friday, and they said it would be 1.5 hours. Okay great, let's try it. The delivery guy got there and they told him it would be another 20-30 mins. AFTER the 1.5 hours. He said they were incredibly rude to him. I didn't order anything hard, 2 basic rolls and edamame, so it's not like it's difficult. NEVER again will I give them my business and I recommend you don't either.

UPDATE: I tried to give them another chance today and again, awful service and awful sushi. Awful edamame. No no no",zZuI28r4-zvYmsJ4f6tysw,7,1,1,w0qxEsACUvN_oWqwbH36IQ
4287662,2016-10-02,4,AoGCnRtwifZ2gTGHtg8KTw,"It's almost noon, opening time is 1130... doors locked. 5 cars waiting for them to open. 

This is ridiculous, you run a lunch special all over FB, yet are not even open?? Come on. 

6th car just showed up.",cJh4F1zFNJb2wXCNT1uNWQ,12,2,1,V-9ZB4uR3EhWy2mUOmBSTw
4304326,2016-12-05,0,AoGCnRtwifZ2gTGHtg8KTw,"Extremely slow service! It took 1.5 hours to get two rounds of rolls for 3 people. This was my 2nd time there and it had not gotten better. Even with the holiday discount, it was not worth it! 

Dishes were dirty. Sushi was mediocre, with a few OK rolls and a few poor. 

Not one Japanese person working in the restaurant. The server looked like a meth head. He had some sort of melt down and the the sushi chef who could have been his older brother had to take over serving. Had to ask for water refills and left hungry because we didn't have more time to waste. 

We will not be back.",NZPsR2iwu2aL-x6g44BDtQ,2,0,2,w6fLnLKx1z0C1PCSIwHTFg
4313169,2015-07-02,0,AoGCnRtwifZ2gTGHtg8KTw,My friend and I love coming here for the awesome sushi! It's always consistently good and Kris and Paul make the experience even better!! Ask for the Taylor Swift roll!!!,paHQpwcvr2MIKGCEoK4YUw,0,0,5,EDikGEVBJh_AAW6RV0g_tg
4340279,2016-10-28,0,AoGCnRtwifZ2gTGHtg8KTw,Interior was nice there was a crack upholstery in one of the booths and they didnt cleaned it out there were crumbles of tempura evrywhere came here for the $10 all you can eat sushi and oh boy we had cream cheese overload we couldn't finish our sushi and because of that we ended up paying $20 more for left overs next time we'll try their soups. Vegas roll was the bomb.com,BHYst4CTDfQyYFSSLDvjAw,0,1,3,-5QocLCfagghGUSn4Ug3Iw
4359572,2016-12-22,1,AoGCnRtwifZ2gTGHtg8KTw,"As others have said. This place is not worth the money.  Even at such a low price.  Let me list the pros and cons:

Pros: 
 Rolls are okay at best
 I didn't get sick.
Cheap

CONS:

 Place is packed and you have one server and one chef.  This is a management issue.  They are setting up the staff to fail. 
Staff is not professional.  The chef is okay.  He is a champ really.  Now the server looks like a tweeker I'm sorry to say.  He also kind of freaks out on himself.  It's not a comfortable experience.  
 Place is sticky and dirty.  Bathrooms are a mess. Not what you want your spot to look like when  eating  uncooked food.
 The menu is incredibly limited no sides, no sushi only a few  rolls with lots of rice, crab mixture, tempura shrimp and spicy tuna pretty much.  I ordered a rainbow roll and there was just a smear of fish on top same thing with avocado. 
 being that there's only a few people that service is incredibly slow.  I was limited to how many roles I could order for my daughters and I at a time, and some of them were even forgotten until at this point we needed to go.   In one hour and a half that got us two roles each and I eat sushi up very fast. 

Again I think the sushi chef is the brightest part of that place.  He is just incredibly limited by management or lack thereof to be honest.  If money is too little to  hire the correct amount of staff then start raising your prices again, we have been here many times and every single time it gets worse I no longer will be coming back I'd rather go to Smith's and just get sushi from that place.",t-fNUJTl8hz8Zd524GiXCg,2,1,2,Oo26lxbtqXo1_NpdH63QCQ
4388702,2015-11-01,0,AoGCnRtwifZ2gTGHtg8KTw,"Had a coupon for 50% off, although they also had great deals for all you can eat. My husband and I have been trying new restaurants  (to us) lately and I had the coupon, so we went. I like most sushi, but not all. I, however, loved everything we tried! Very good, but different flavor combinations that were awesome! We will definitely be back.",St3LRIgPxkkmf0G7a80YXw,0,0,5,D3aUO01x2BdsB-dBENv33g
4429756,2015-10-18,0,AoGCnRtwifZ2gTGHtg8KTw,"Very friendly, casual. We sat at the bar and were well taken care of. Our chef made us several legacy rolls since it was our first time here. He also made us a ""9/10 hot roll"" b/c he saw we liked it spicy! It was very hot! Made us feel special to get special rolls. Servers/bussers were slow but nice. Had to ask for personal plate with wasabi and ginger, which didn't feel very hospitable. I feel we received better service than the tables, so sit at the bar if you can. I think overall service was average for a place like this. Price was great and they really make you feel like a VIP.",uuQbvvR7pDlMn11KdYXwmA,0,0,4,lDDI1U1lXatDp5tX0ks5EQ
4503099,2015-03-02,1,AoGCnRtwifZ2gTGHtg8KTw,"We have been coming since before the owner change. We were upset at first at the change but have now come
To like it and found favorites and they have kept a few of the rolls/apps they used to have. Tonight we had a table of 5. For a Sunday  it was busy and obvious that they were under staffed. I will never hate on servers when a restaurant is clearly not staffed correctly has I have been there in that position. But at the bar I noticed two men at the end chowing down on sushi the whole time we were there and noticed they walked in the back several times so I knew they were the owners. Our poor server was so swamped that he couldn't keep waters full of keep up. Rather then the owners step in and help they say there and watched and did nothing. I wanted to grab the water pitcher and help. I loudly said way to go and help your staff when the men exited the restaurant and after they
Left it was a big relief on the staff. We will be back because we like the food but shame on the owners who could give two shits about their staff and the patrons of their establishment. Your lucky to still be in business and deserve to rot in hell for the way you treat your employees and customers",OHBOQiDM3inWdjUydDLiBg,0,0,1,i3NLKIQu729MLfSV7Cym2w
4514453,2011-01-29,0,AoGCnRtwifZ2gTGHtg8KTw,Are 0 star reviews allowed? We had take out and it was a freaking rip off. For two chicken teriyaki's and a small cup of miso soup it was $24? WTF?! It tasted like a  frozen dinner. Stay away and warn your friends.,5fQ9P6kbQM_E0dx8DL6JWA,0,0,1,-lLs5g9T7ibwBc31_v8ErA
4551329,2016-11-24,0,AoGCnRtwifZ2gTGHtg8KTw,"Went there for the special.  
1) half the menu isnt included in the special . including nigiri
2) be ready for some bright noen colored sushi. Maybe from being frozen? Or farmed fish with color added? Idk
3)shitty service.
4) 7/8 people at our table didnt like the food.  And the last guy will eat anything.
5)they said avacado dosnt come in a california roll??   Later they said they ran out.  Come on....
6) bathroom toilet leaks and they have a kicthen pot catching the water.  Gross.    


Get your shit straight tokyo house.   Get fresh fish and get rid of the special, your menu is very small to begin with",iR_1zT6KsyQjPQybcbBpdA,1,0,1,Mud-rsYFFeDT0V9SeBntZA
4566921,2015-04-08,0,AoGCnRtwifZ2gTGHtg8KTw,"I love this AYCE place! 
This is the spot me and my sister go to when we are looking for great sushi at a pretty great price. I am almost afraid to say how great their price is in fear that they may change it. 

The rolls are always great! The side items are always amazing! (Please Note: For some reason... when you go one week then the other week, even thought the appetizers are the same, they are always made different... still good though)

I just can't say enough about this place. The price is great, food, and environment is just great!",49xkBUeRM0Ii_PiaQMGL_g,0,0,4,d5b9Kph8uTZDcp268fUqhg
4583015,2013-06-15,0,AoGCnRtwifZ2gTGHtg8KTw,Food was okay. Good service. I will go here if I'm in the area. I'm not going to go out of my way to eat here though. There are better sushi places closer to me.,aD263WOD4RShoqgvVhcKqQ,0,0,3,n1_zM4lwYA9ZAvBSUiMShg
4588570,2010-10-09,0,AoGCnRtwifZ2gTGHtg8KTw,"I love this place! I'm lucky a friend introduced this sushi restaurant to me, I don't go to any other sushi restaurants anymore. The staff is always very nice and very helpful. They're rolls are creative and wonderful, my new favorite is the Light & Crunchy Tofu Roll. I highly recommend this place and will be back time and again.",9A5Cqqp7M92J3iEzO6HBEg,1,0,5,AvnexQ9WMHKj5uK8kozfZQ
4612255,2013-01-11,0,AoGCnRtwifZ2gTGHtg8KTw,"Tokyo Sushi House is a decent, solid all-you-can-eat sushi place. It stands out for its creative, interesting rolls and competitive pricing - at $15 for lunch - so if you're more into modern-style sushi and/or a bargain sushi session, this is the place to go. The appetizer entrees are pretty good too. Everything else about the place is just about standard (or a bit less), but put it in perspective of the great AYCE value. 

Highlights were the unagi nigiri, and the Dragon and Volcano rolls. The rolls are creative and well-made, without excesses of sauce and seasoning; you can order half-rolls too, which let us try a lot of the menu! Definitely a good place for rolls. 

The unagi is particularly good if you prefer the sauce a little less sweet. Besides the unagi and hamachi, the rest of the nigiri was disappointing; the fish was so-so, and the rice was cloyingly dense. I prefer nigiri over rolls so that was unfortunate; if you require a variety of good nigiri, you may be disappointed, but it's also a matter of preference here, or maybe a bad day/selection.

The service was a bit lackluster, though sufficient. The waitress was spotty considering we were the only party for majority of our stay, and kept making awkward placements with the dishes. The chefs were better - attentive, and skilled, though difficult to engage with any depth. As a whole, staff interactions were pretty awkward, and I'm hesitant to visit on the same shift to have to go through that again. 

I will be back, though, to give the place a second chance on the misses, and to try more of the great, unique rolls on such a good bargain.",KcBC-1eQ5ycshERutvKccw,1,0,3,DDYr1bZKOZ3pVyzuieo1dw
4631288,2017-01-31,0,AoGCnRtwifZ2gTGHtg8KTw,"Went with the mom last night and It was amazing. Great food! We had the Maui roll, hello kitty, Cajun lover and a few more and they were all delicious. We also had lost of garlic tuna nigiri and the fried cheesecake. All awesome. Staff was Super nice and the prices are great as well. Also love the decor and upbeat popular music playing. Will be back again soon.",W8kK7Ntnrk_kY3b7PNX9IQ,2,1,5,BYePIazdY2c7n1Q0MTMZ2g
4654692,2017-05-07,0,AoGCnRtwifZ2gTGHtg8KTw,"I just left this place SUPER-annoyed. I showed up by myself around 8:30pm on a Saturday night and  took a seat at the bar. The chef then tells me that they are not seating any more tables. As soon as the seated guests were done, they were closing early for the night. I asked what time they normally close and he let me know they closed at 10:00pm. 

Customer service in this situation was horrible. There wasn't much of an ""I'm sorry about that"" or anything. It was basically ""We're closing early. Get out"". So I did. And I won't be back to see if the food was actually any good. Lame.",z_jxPMFMJXcSogoH602Xpg,3,0,1,pG_62rRqwnf5HRYXQbxseQ
4659400,2015-07-19,0,AoGCnRtwifZ2gTGHtg8KTw,"I will never come back. Not because of the mediocre food and service, but because of the dishonesty. Also, everything is mushy.

I only decided to try Tokyo Sushi House because I got a 50% off coupon on a supermarket receipt. They were very sorry they had arbitrarily stopped accepting these coupons a couple weeks ago, but they had nothing else to offer than claiming they were victims of big bad supermarkets not stopping the coupon being printed. Expiration date is 2 months from now. Dessert to go? 10% off as a courtesy? Nothing. Ironic that a Japanese restaurant would have issues with honoring their promises.

The food was marginal. Solid C- to C across the board. The fish was okay, mostly on the bland side though. I've had better at most AYCE places I've been to, but it was better than the sushi offerings at Smith's. The Hawaiian roll was bland and mushy, but okay. The Vegas whatever roll was also bland and mushy, but okay. The sweet potatoes in the tempura vegetables were awesome, but the other veggies ranged from overcooked and mushy to having soggy crust from either too much moisture in the vegetable or too low a frying temperature. The eel sauce was imbalanced toward vinegar, and the tempura sauce was lacking in any sort of flavor. The rice in everything fell apart. This was especially true for the nigiri, which I guess is a good thing because it meant I could just have sashimi. Thankfully they didn't argue with the crumbled piles of rice that went back on those plates. The rolls barely held together. Other reviews have mentioned the wonder of what are now called ""legacy rolls""...but the legacy rolls seemed more like a vehicle for getting rid of a too large cream cheese delivery, so I didn't order any.

The rock shrimp aioli was quite good. I tried my friend's. The texture was way different than I was expecting, but it was pleasantly reminiscent of dim sum (a little context goes a long way). Also quite good was the green tea ice cream. I've nearly gotten used to green tea ice cream that's more like frozen egg nog with green food dye. But this had a strong flavor and that slight bitterness that sweetened matcha has, and apart from a few icy bits was some of the better green tea ice cream i've had.

Service was worth a 15% tip. When asked if we wanted wasabi and ginger, my friend said yes, and i asked to have wasabi with no ginger. A small plate with both came out, and nothing else. It seemed to be shocking that I wanted my own wasabi with no ginger, despite asking for it. Very large water glasses meant I didn't have to ask for a refill, and it tasted neutral. I asked for lemon for my water, and despite there being a lemon floating at the bottom of the rock shrimp aioli that came from the same round of ordering, I never got a lemon wedge for my water. Other than that, service was just fine: friendly, attentive, but not cloying...about what you would expect here in town. 

I feel like the positive reviews have to be shills, people who have never had good sushi and really like cream cheese and sugar sauce, or have no teeth.

I'll be perfectly happy to stick to my proven favorites: Osaka (on Sahara), Yama, and Sushi Roku.",YG-Vg20GYIA6dHRg5SRJZg,2,0,1,R6_F1Z2IfkHv3NmVhUtzbg
4678873,2015-11-20,0,AoGCnRtwifZ2gTGHtg8KTw,"American style sushi, food is so so. The wait is horrible. Took over an hour for a simple chicken teriyaki meal. The restaurant literally had 10 other people  just waiting . Will never return again.",M5LzvXilXgadjAhKtPzg9w,0,0,2,RTliMzLd9ep1q6MCVS1Oxw
4688782,2017-01-02,0,AoGCnRtwifZ2gTGHtg8KTw,"Worst sushi restaurant by far. They are out of every fish you want. They stated that they were out of salmon when I ordered nigiri. Then they serve a roll to the person next to me with salmon on it. Worst service by far. I ordered yellowtail, and waaaalaaa they are out of that too. They were out of almost every fish on their menu. Place is garbage!!!!! Sasa sushi is right down the road and far better service and quality.",-_mJOjsuSy9ocu4S5ddmTg,0,0,1,cJW4TSXm-a7PRgGLJdymag
4765960,2016-07-25,0,AoGCnRtwifZ2gTGHtg8KTw,"Finally decided to re download the Yelp app (my phone needs the space for photos and videos haha) so I can make a specific review for this restaurant. 

I always love giving new chances to restaurants. I was a huge patron of the original establishment back in 2012 (this restaurant not the Craig one), I loved it at the time. But slowly it began getting worse. By 2013 I switched completely. I reluctantly call myself a sushi addict, so I go have sushi at a minimum of once a week. 

Last time I was here was about 10+ months ago. Basically few things have changed, and somehow, the only change that's been going on is it keeps getting worse. 

I've had the unfortunate opportunity to try out both places (hoping one would be better than the other, no luck). 

At the moment, I'm writing this review from my bathroom. A little more than 7 hours ago we are here, and I've been stuck going in and out of the restroom due to food poisoning from this restaurant (when I go out to eat sushi, I don't eat for the whole day, so this is the only explanation. PS I don't eat the whole day, so I get my money's worth come dinnertime.). This place charges $27 yet does not offer the typical dinner favorites that other AYCE sushi restaurants offer, sea urchin, sweet shrimp, salmon eggs, etc. I finally came around to downloading the Yelp app again (I need the space, 16gb iPhone struggle), considering the food poisoning. 

Like its other restaurant, the rice is either crunchy or undercooked, when you get the opportunity for that perfectly steamed Nigiri rice or sushi rice, it's a rare and exciting moment. Like their other restaurant, the sushi ""chefs"" are young, inexperienced, and often side tracked by using their phones or talking with their buddies in the back kitchen. This place did better than the other, it took about 20 mins for me to receive a roll (the other place it took 30 mins for me to receive a spicy tuna roll, and my date a rainbow roll). When I received the Super White tuna, it seemed like it had been sitting out to thaw from its previous frozen state. The slices were not at all cut properly, one piece would be a sliver of fish, while another piece would be a two biter. There are two trending issues, employees who don't care (aka sushi chefs who, I feel, are doing their job just to pay bills instead of for the love of cooking; coming from a previous Le Cordon Bleu student who loves the art of cooking) and understaffed restaurants. This place was not busy, much like it's other restaurant on Craig. Somehow, even though it was half empty, dinner here lasted for more than 2 hours (while at any other one of its competitors it would last about an hour for the same exact orders; Im a plain person, I get the same thing everywhere I go so it's easy to compare lol).  2 hours for a sushi dinner would be reserved for a gourmet restaurant like Nobu, NOT AYCE, and especially NOT Tokyo Sushi! 

Do yourself a favor and go to any other AYCE restaurants , just not this place (or it's Craig location, or any other future location it may have)! 

In case you got lost in my little rant, here's an easy overview:


The Good:

-Some great lemonade (although other restaurants have the same amazing lemonade)
-Nice decorations 
-Yummy SOUNDING rolls 

The Bad:
-Slow Service/inattentive chefs 
-Undercooked/crunchy rice 
-Kitchen workers who are allowed to join the sushi chefs (essentially, they learn how to make sushi and you're the ""lucky"" one who has to eat it, OR be charged for the roll) 
-Higher possibility of food poisoning (at the other location my date got food poisoning, and at this location I got food poisoning. There's always a risk when eating sushi, but the odds of us both getting sick? No so likely unless it's bad quality/sits out for too long)  
-Like the other restaurant, people wearing gloves while touching your food is a rare sight to see (strange considering it's an SNHD healthcode violation NOT to wear gloves)",FoCkGAce6Hjy3mpfUSq-_w,0,0,1,R2OXAp7xKyWETXB5VTN7dA
4778357,2014-10-23,1,AoGCnRtwifZ2gTGHtg8KTw,"Writing a review while I wait; been here for an hour now. I received my 1st order of nigiri after 30 minutes. Places a second order after 10 minutes after my last bite of nigiri. Waited another 10 minutes for my rolls. Then another 10 after my last bite for a bill. I came for AYCE and we were only allowed to request half rolls for our last order. I order half rolls and I received full rolls. 

Rolls were ok. Fish was not up to par. Looked as though they used long grain rice. 

During my entire visit, I received only one drink refill. The ice cubes in my iced green tea had little green particles frozen into them. My boyfriend tried to convince me that it was green tea mix. It looked like algae to me. 

Maybe I came on a bad day and they were short staffed. Either way, I did not have a good experience.",VupFODj-mzL4wwipJKN9aw,5,0,1,Txn7RPyzZE7Mlp09VwRo0A
4778508,2015-03-16,0,AoGCnRtwifZ2gTGHtg8KTw,Great food and service. They played some fun regae music which we love. The garlic yellow jalepeno and salmon crisps were so yummy   Paul was amazing and we'll definitely come back.; ),XtinI2GZFSytTmNKTyrUOA,0,0,5,y1IO4qD7kTxjBT9WVJldqw
4779980,2014-11-02,0,AoGCnRtwifZ2gTGHtg8KTw,"I love sushi, and I often come here even though it's 20mins away from my house.
First, price is unbeatable. I never seen $19.99 for dinner at AYCE. Most restaurants charge between $24.99 to $26.99. So I always tip them like $6 that only makes full price at other AYCE restaurant.
Their quality of sushi isn't different from other AYCE sushi restaurants. The rolls are beautiful (especially Cherry Blossom) and so delicious. I love Mortal combat, Lasagna, Kiss of Fire and Volcano.
The service is also great. Strangely I only go there on busy nights. Servers keep running to follow up the orders. They always check back how my table is doing, apoligize for delay if any, and thank us. 
Some people who never been a server doesn't understand how crazy working at a restaurant is on a busy night. I see they're trying their best and I'm happy that they are respectful and responsible.
So far this is the number one restaurant for me.",sf8w4vCA_ppXUAje04FjOQ,3,3,5,TlF14XmOLJBU_gqV8kGK_g
4813603,2010-12-20,0,AoGCnRtwifZ2gTGHtg8KTw,"I have never had such horrible customer service right from the beginning.   So bad, that I had to walk out after they brought out our waters.

The waitress does not want to be there at all, she doesn't try to hide the fact.  She's very rude and short, and rushes you to take your order and throws menus and drinks at you AND has major attitude if you ask her ANY QUESTION(S).

Apparently they have this 'all you can eat' special, but you have to finish within an hour and anything you leave on your plate you are charged for and its about $15 per person.... NONE OF THE APPEARS ANYWHERE ON THEIR MENU OR SIGNS.

Also, like in the previous comments for this place, the owners do watch you like a hawk as your eating, although I didn't eat, I could see them.",h3EcaFeeyRLniBh8CZP27g,1,0,1,qnOz9nBgY-oMGI8lDTeeOQ
4853953,2016-03-05,0,AoGCnRtwifZ2gTGHtg8KTw,"The sushi was good, chef was creative, but the service was anything but great. We are Yelpers and showed the chef our ""free sake"" coupon on Yelp and in turn he showed our server and never got it. I ordered edamame and baked mussels and they came 20 minutes later and the baked mussels were burnt. Our waters were only refilled when I asked and we were never asked (by our server) if we needed anything.",j-IctuokxTHbkzNl_b1Xng,1,0,3,m0Kw5e5OKrh20WVyJ2bWHA
4876777,2016-04-18,0,AoGCnRtwifZ2gTGHtg8KTw,"My husband and I came here for our anniversary and got the deluxe Ayce, it was absolutely amazing. it included all the sushi, appetizers, all you can drink sake and beer. The waitress brought us samples of a few appetizers which was perfect as you waited for all the sushi orders.",x2OUGMqQ4JeOhjYXX4P1bA,0,0,5,YNaA3ph2G4dIOH3FSK0VHQ
4930827,2012-07-14,0,AoGCnRtwifZ2gTGHtg8KTw,"One of the best sushi places we have been too!
Great chefs, awesome rolls & pretty good prices :).
If your ever near it stop in I recomend the volcano roll!",s5cPcXcI0-3qBuPp8VPXsg,1,2,5,V12Kjl1eRxgerDCi39sUHw
4949297,2016-02-20,0,AoGCnRtwifZ2gTGHtg8KTw,"Went in and was told it was going to be about 20 minutes. After waiting a half hour (probably a little longer) went back in and another waitress said they would have to wait for another table (again). And she didn't know how long it would take. 
We waited outside the entire time due to the tiny size of the place. 
Won't be back.",KjaD3rOVeNNpsOuESfyxHA,0,0,1,UOy2Cbyg_rvstFwLsSKSsA
4967110,2016-10-03,0,AoGCnRtwifZ2gTGHtg8KTw,"It's $15 dollars for all you can eat for a reason. You get what you pay for. Sushi was not well presented, the taste wasn't fresh at all, and the rice was hard. The sushi in general was the worst sushi ive had at an AYCE. I have added another star only because I could tell the waiter was a bit stressed but was trying his very best, which I appreciated.",L2qBBB_Psip0mbmsuEETDw,2,0,2,1juDVNnsuF7KdgdWiAPUSA
4967162,2015-01-30,1,AoGCnRtwifZ2gTGHtg8KTw,"Cheapest option nearby - good food, we've been back several times. When you compare it to the other AYCE sushi places nearby though, Tokyo definitely falls a little short. 

Their rolls don't have the finesse that other restaurants do, but they are good, and for $15 AYCE lunch or $20 AYCE dinner you can't beat the price. I wish they had mochi as a desert option though!",2i-vlvGFvy9JoVzGlursww,0,0,3,dbmNMEucX1QLeJ8TIUyM2A
