,date,funny,business_id,text,user_id,useful,cool,stars,review_id
2904183,2015-03-08,0,AoGCnRtwifZ2gTGHtg8KTw,My gf loves this place as it has cheap all you can eat sushi with good quality. Service was good and fast,x3azRbv5vtqywPaGmSkVdg,0,0,5,lcBP6mn04VFeeN3kEoPdwg
2918387,2015-06-12,0,AoGCnRtwifZ2gTGHtg8KTw,"One of our favorite sushi spots to visit as of late.  Great selection, friendly staff, and good food. The place is not huge, but low key in an odd location on Cheyenne going toward 215.  Check this place out if you're ever in the area and you won't be disappointed.",Rs2bBWj0f4EBVk6t5eXCYw,2,0,4,iv6TarWLwlvN5tRzbfJ6rA
2948510,2017-02-11,1,AoGCnRtwifZ2gTGHtg8KTw,"So much for the customer always being right.. so this is my experience from my visit back in December. At the time they were advertising some special on Facebook for $10 AYCE. We had been previously and enjoyed our meal with no issue. This time was a totally different experience. We went on a weekday.. there were several families in the restaurant including mine. The floors were filthy, they were sitting people at tables with disgusting floors. There was a toddler at another table in a high chair who's parents had poor control over their child. After the waiter left their table I kid you not he says to us, ""God I want to stab that kid in the face"" Seriously?!! You say that to another family who's also sitting with a child! The most unprofessional thing I've ever heard anyone say while they're at work. Thank god my kid wasn't acting up that day I wouldn't want anyone talking shit about her to another table!  So it comes time to pay and we're charged full price not the special price online.. my boyfriend gives me his wallet and he goes to put the baby in the car and when I question the waiter about the price him and another employee hover over me both rudely talking at the same time saying how the rules of the discount changed two days ago and because we didn't mention that we were doing the fb promo BEFORE we ordered that's what we need to pay. I couldn't get a word in. If it was a public ad online and they didn't hear us mention it when we sat down WHY wouldn't you bring it up to us?  I pay and leave. Later that evening my boyfriend calls to speak to a manager just to get the same rude attitude that we received earlier. This place is run by a bafoon that probably hired all of his buddies that couldn't get hired else where. Unprofessional, dirty, will con you for your money. Also on Facebook they advertise a menu of over 40 items, when you get there about half of them or more are sharpied out. Let me not forget about the quality of the food we could order was pretty average, nothing special... you could go to most sushi spots and pay $20 and get better AYCE. Anyway, I'll end with if that's how they care for their business and customers, I wonder how well they're taking care of things in the back and if everything is up to health code.",UQ7K_EX4id8Vy7deFuiomw,1,1,1,z2z5Ac60E7WZKJgDhT9AOw
2954007,2016-12-07,2,AoGCnRtwifZ2gTGHtg8KTw,"Most unprofessional restaurant I have ate in a VERY long time. Super slow service. I don't think this is a staff problem, but a management problem. For example: The server serving us jumped in the back and started making sushi after taking our orders? Doesn't make sense. Then as someone came in he started taking the orders again. Should  hire a sushi chef that specializes in that field.
No professional attire with the staff. Your sushi chef will make you sushi with his flannel on.
Waited 33 minutes for my first order of sushi to come out. Not worth the holiday discount. At all!
As for the sushi, it wasn't bad. I enjoyed it actually!

Super slow. Not professional. Horrible. Never again.
Not blaming staff. Just management.
Please Chef Gordon Ramsay, come save this Sushi House!",vAYx913eXGSQ7Ucsr0N1uQ,3,0,2,tT91S0cvjIcbtoRoVvbmuw
2977145,2016-07-27,1,AoGCnRtwifZ2gTGHtg8KTw,"Every Worker was outside in the front smoking and one worker even said ""oh you guys are our first costumers in three hours "" if you're hungry for sushi and beer this is the place for you for if you want bad service (AYCE&Beer) but the service isn't that great and the food comes out really slow . The server has no clue what's on the menu every answer was ill ask my manger or sushi chef it was kinda annoying . 
I wouldn't come back because of the service and how far the location is from everything .",PM-CpWgPzMo5TusieBUf1A,1,0,1,om8MljV2mxtiTHFAUjMb8g
2985877,2016-07-01,0,AoGCnRtwifZ2gTGHtg8KTw,"This place used to be my favorite sushi place, but now is really bad, I will not be coming back here!!! Service is slow and the sushi is terrible!!!",17kPJcOKRZ5Gsha1-nz6RA,0,0,1,XWk9Kr_sHGnA-vf_uVH2bw
2993154,2015-12-17,0,AoGCnRtwifZ2gTGHtg8KTw,"I've been here about 5 times and the food is always fresh and good. On my recent visit, some of the food was a little bit inconsistent. The fresh water eel was dry and the salmon nigiri was paper thin with tons of rice so it just tasted like I was eating rice. Besides that, everything else was tasty. My favorite is the vegas playboy roll and bomb.com. The service was very fast and our server Billy was very helpful and attentive. One warning though, DON'T GET THE STICKY ICKY ROLL. It's a shrimp tempura roll with peanut butter and coconut flakes and our group of 4, who all like peanut butter, all thought it was terrible. The combination of peanut butter and rice is so off putting. 

On another note, they are doing a promotion of $14.99 lunch AYCE till the new years but it doesn't stack with the restaurant,com gift certificate so keep that in mind. One other thing to keep in mind is that there is only 1 server and 2 sushi chef at all times. So service and food will be extremely slow if the restaurant is packed. About 6 months ago, I once ended up waiting over an hour just for 2 dishes to come out and my party was so pissed off that we left while still hungry because we just wanted to get out of there. 

Overall, decent and cheap food, great service(when it's not busy), and I will come back here often since it's so close to my house. I'll just avoid the sticky icky roll next time!",bmmgelxV1eBpWmT32F3xhA,1,1,4,1m_eVL6N491gBOoLvnHK3g
3009432,2015-06-23,1,AoGCnRtwifZ2gTGHtg8KTw,"This place has the WORST service, whether they're busy or slow. The food is good, but every time I've been there, the service is somehow worse than before. Never coming back :)",zVnuuCkUCSsZkwteYJ1I4w,1,1,1,8Cw-fyHsdLoauxJjWLchhg
3051379,2012-11-26,0,AoGCnRtwifZ2gTGHtg8KTw,"Love this place! My Dad and sister went to this place and loved it so much they took me and I love it too. Their fish tastes really fresh, no weird fishy taste here. The salmon, yellowtail, and tuna were amazing!",S1aJCeCdJcxnGk55OMM5mA,1,2,5,iXUiGU0dmxZYPkeE6SnZSg
3055920,2016-05-28,0,AoGCnRtwifZ2gTGHtg8KTw,"This place used to be so great. Good food and fast, friendly service. Now it is under different ownership and it takes forever to receive your food and drink. I waited 25 mins just to receive one sushi roll. I knew something was wrong when I saw Chef Paul waiting tables and running register on a Thursday night. I think it is very unprofessional and in poor taste to see the owners come in and immediately get served meanwhile you have a restaurant full of paying customers who are waiting just to receive drinks alone as well as food. The menu used to be larger but has been cut in half and the quality of food has taken a turn for the negative. Please bring back the charm that made this restaurant great! I felt awful for the staff all they could do was apologize for the terrible experience we had. I probably won't go back.",v8QSQXbo95E4Nx5ABQfNQQ,1,0,2,cbTpOVKWdFcZnmSg6lHoBg
3065852,2016-03-25,1,AoGCnRtwifZ2gTGHtg8KTw,"Update: just went back and the only dissatisfaction I can express is that you can expect to wait about 20-30 for your sushi .

Just tried this sushi restaurant today. The atmosphere is really nice and the waitress who helped us was amazing. She remembered most of our orders from memory while handling multiple guests. It did take a while to receive our orders, but I didn't mind because it was well worth the wait. 

I recommend the tuna lovers roll and the lasagna. Their fish is super fresh. I really loved the tuna! I wish I lived on this side of town because I would probably eat here every day",eoclNgxfpc0e4xOjWQE0Zg,0,0,3,NYWaNlueQV0dd34viP1YbA
3080934,2016-07-22,0,AoGCnRtwifZ2gTGHtg8KTw,"This is unfortunate. We used to love coming to this sushi restaurant. The chefs were awesome, the sushi was excellent and the service was quick. To see this place fall apart before my eyes makes me sad. If I've ever seen a business pull a 180, it's this one. And not in a good way. To start, there are all new chefs.. Or should I say.. A single chef. The old ones left because they knew what was in their best interest. The sushi doesn't even taste the same. The last two times I've been here I've heard the employees discuss how one employee left the fish out and was serving it to customers. How is that legal? The service is SLOW. Previous reviews can testify. Customers sitting and waiting for 2 hours to not even be able to enjoy everything they hoped to order. And the best part? They opened another restaurant. How can you do that when you don't even have the staff to run the one you already have? Oh and they open at 11:30, not 11:00. Don't make the same mistake we did and show up 45 minutes early. I don't know why we even waited around. We shouldn't have given them the benefit of the doubt the last time we were here. We are gone, just like the sushi chefs, the sushi, and service that used to make this business thrive.",nM9MFDuy-KzpwQJTH9NDpw,0,0,1,4vP3cwpfeilFU17Sy2rjpg
3106591,2015-06-28,0,AoGCnRtwifZ2gTGHtg8KTw,"Horrible, I sat by the car for 15 minutes and then never open the restaurant when it said it was open at 11 am . Had music on , I check the door and nothing , bad management skills",xnYfu9lGLxP8nNbiINLbkw,2,0,1,QT21QynF8K7gd0pxlGk1Cg
3114770,2012-10-23,1,AoGCnRtwifZ2gTGHtg8KTw,"Not a fan of the uninspired, emotionless staff here. After living in Japan for 4 years I thought maybe the ""Tokyo"" name attached to this place would provide a good experience. The Korean staff here were zombie like and the nigiri and rolls were average to me. Form your own opinion but for me this is nothing like a ""Tokyo Sushi House""",AlDOhL4Cl1GaBeUv32VYTA,1,0,2,JHygdNttm3UXbTdcyspWKg
3121772,2016-10-03,0,AoGCnRtwifZ2gTGHtg8KTw,Incredible AYCE Sushi house...  Chefs and servers are the best and extremely helpful...  10 Star!,Wz_lm4d4wf4bdYHn1afWDQ,0,0,5,E46mSlWKzIktjlX6qZQJlQ
3139568,2016-10-01,0,AoGCnRtwifZ2gTGHtg8KTw,"Came here for the deal they have on a AYCE, which is a great deal. However, I'm really disappointed in their customer service. It seems they're short staffed. Only 1 waiter and it's a packed house. I had to wait 15-20 between orders or to even be acknowledged. The rolls were decent, not amazing. I definitely prefer other Sushi places more and wouldn't not choose this as my first option.
On another note, their playlist is amazing almost every time and the employees are kind when we do interact, but I'm not sure I'll be returning.",UuLiUJQivwS-93VthqDgHQ,1,0,2,6LG22HBuqOS73Dzxb1aPzQ
3162906,2017-01-07,0,AoGCnRtwifZ2gTGHtg8KTw,Ive been to this place twice. The first time I showed up at 1pm and it was closed due to the rice not being ready. The second time we showed up at 8pm on a Friday night and informed us it was closed cause they ran out of fish. What kind of management is running this joint?! I recommend Naka Sushi down the street for real consistency and excellent service.,EMM0B_JVy4WIggb0ITwJgg,0,0,1,zXjdw-LmYwqt1V09bnzuAA
3175013,2016-09-29,0,AoGCnRtwifZ2gTGHtg8KTw,"If I could give this place 0 stars I would. The service is the absolute WORST. Between being seated, ordering, eating, and paying, it was a 2 hour process. The food was absolutely repulsive and made me regurgitate in my mouth. The sushi chef (some tall white guy with tattoos) was annoying and arrogant the entire time. Seriously I've never been so upset with a restaurant before. Why does it take 45 minutes to get your check? Even when we asked for it 2 times. Don't ever come here. I will hope and pray this place gets shut down.",Oi6SM-SdS5V8UpR9MgHH_Q,0,0,1,LuAahKBvsCJHTXwl8HA7Dg
3176402,2015-10-18,0,AoGCnRtwifZ2gTGHtg8KTw,"First time here very very good ,server Bill was amazing considering his first day chef Steve was bomb gave us samples that were off the chain I think I just found a new sushi home and till the end of October just 14.99 all u can it so glad I found this place ...thanks guys",10gQ-ARzQqQKE3HVeBuiWA,1,1,4,Q9TPARUYA8g9H-T1IEg-aQ
3185946,2015-10-17,0,AoGCnRtwifZ2gTGHtg8KTw,"Just tried the Maui roll... It was great! The waitresses spoke English which made ordering easy... No mis-understandings....just nice, quick and easy dinner!",KUMmlPSp9Mg4Z5Lok760aQ,1,0,5,XE3ZHPb67H9Gj-pZC2VmAw
3195329,2014-07-20,0,AoGCnRtwifZ2gTGHtg8KTw,Great sushi option right here.  All you can eat has a great selection of rolls and sides and apps.  Fish is fresh and the restaurant is clean.  We've come a few times near closing and they have always been friendly and welcoming.,lwhksSpgIyeYZor_HlN93w,0,0,4,ZWKtqXdh8mjVJEpScwdQ1Q
3200707,2017-01-21,0,AoGCnRtwifZ2gTGHtg8KTw,"Came here about 3 weeks ago  randomly, little did I know it would be my favorite sushi spot. I've had great experiences with the server Jose, who recommends the best rolls. The chef Travis was quick with our orders even though they were busy. Definitely worth a shot.",bEjkgQNdHpiwtvSc4fqBOQ,0,0,5,CJQMSBk1-HDnk7b12j-d6A
3215201,2016-06-25,0,AoGCnRtwifZ2gTGHtg8KTw,What happened? Since it's under new management the service and quality of food has gone way down. Very uncomfortable sitting down trying to enjoy a meal while the servers sit on the other side of you cursing and eating their non-restaurant food. I use to enjoy their Rock shrimp and now they cut three shrimps into fours and still charge you the full price for it.  What shame I won't suggest this place to anyone!,4LVz5urnse5xoE4pmjQ0GA,0,0,1,1b_Be8OQDjAfUQfERKAqdw
3223164,2016-01-26,0,AoGCnRtwifZ2gTGHtg8KTw,"I didn't care for this place. They didn't really have anything spicey. And what we did order didn't taste very good. 

Pros is customer service was great. And they offer an all you can eat menu",6J8koMq6k0GM437QWMHRSw,0,0,1,vjod9sVDUKO8txD0MYVVCg
3243011,2016-10-22,1,AoGCnRtwifZ2gTGHtg8KTw,"Only scoring a 2 because I haven't gotten sick...yet.   Worst sushi experience ever.  Service is atrocious...1 person, waiting on 10 tables.  Running constantly.  1 hour after opening, they are out of tako, eel, calimari on the menu but they say they don't have it anymore.   Orders don't come out.  Have to beg for a refill of tea.

Definitely won't be back.",8jzM8dJvK42qke26zLvkDw,1,1,2,f2xmTzgosp0NHb5iy5Dmjw
3267598,2016-03-12,0,AoGCnRtwifZ2gTGHtg8KTw,"Gave them another chance since they have a new menu, which is decent. The service, on the other hand, is horrendous. We waited 45 minutes to get our first roll after ordering. They also allowed a table of about 15 people in the middle of the restaurant to carry on, extremely loudly yelling profanities, all the while families and couples were at other tables. The waitress claimed she was new, but gave us attitude when we questioned her giving our order to this large table. We endured this for two hours. Worst dinner of my life!",TizqrE38uQu9sa1Ymh3-UA,0,0,1,CAWl-5u5qzRI7iJnWTqiFA
3273642,2016-10-11,0,AoGCnRtwifZ2gTGHtg8KTw,called and said they were not busy. got there. was packed. no clean table to even sit. seated in front seemed to be warm. ordered ice tea. no ice or sweetner. seemed to get hotter as we sat. ask to move to sushi bar only open clean space. they said it was reserved. didnt know they took reservations. ordered 4 tables still waiting. more people came in. no extra tables. finally and in closing so i wont dwell on this horrible place. wanted to leave because temperature and fear of getting food poisoning. charge for a warm ice teas no apology or for your inconvience tea on us. i will call channel 13 for dirty dining. yuk yuk yuk,DYKUcYtGAmLCwIUs9zGKLQ,0,0,1,TxLUqzcFTVIgtTZZfqVFwg
3321195,2016-08-09,1,AoGCnRtwifZ2gTGHtg8KTw,"If I could give negative stars I would. Came here on a Monday and experienced probably the worst AYCE sushi place I've ever had not only in Vegas but all my travels.  From quality of fish to service everything was so bad.  If you like throwing your money away, have hours to waste, or have no taste buds then this is the place for you.  I'd list everything wrong but I don't think I'm allowed that many characters to type on here.  Usually I'm the type of person if I have nothing nice to say then I don't say anything but I'm considering this as a public service announcement to save people from wasting their money and time.",VxljrF5dBkgMm_C4aLJXlg,0,0,1,sBgMQO34Ewtug0Cd-9l8Pw
3335368,2016-12-05,1,AoGCnRtwifZ2gTGHtg8KTw,"We decided to try this place out because it was close to the house and they were running a deal via Facebook. After eating here I can understand why. The sushi quality isn't even grocery store level sushi. They had one server who was mediocre at best and inattentive. We ordered two rolls to start and had finished one before ever seeing another. We had to leave quickly because of a babysitter emergency and even tracking down the server to get the check was a hassle. There was a table that sat dirty for the entire time of our dinner, roughly an hour and the girl who came out eventually to bus tables was wearing sweat pants. Overall a complete disaster and I certainly won't be eating here again, so many better options in the area.",Y7cKsLwCRzFVPpDnhYm6Rw,0,0,1,EMk47z-DOArJCOUyReQgvg
3357717,2014-03-25,1,AoGCnRtwifZ2gTGHtg8KTw,"** Do not be afraid of the low price!**

For too long I was afraid of this place because the price seemed too good to be true.  I figured there's no way the fish will be any good.  Well, I am here to tell you I was wrong.

The business is clean and there is no fishy smell which can be found at some sushi bars.  The staff was very quick and attentive.  I also dug the decor. 

I enjoyed 4 rolls on this visit which include: Kiss of Fire, Fire Dragon, Spicy Yellowtail and a Spicy Salmon.  I recommend the specialty rolls, especially if you like your sushi spicy.

The fish was fresh and the flavors were excellent.  The Miso Soup was also very good.  You may say ""well how can you screw up Miso Soup?"" Trust me when I say that Sushi places do it all the time.

Best of all is the price.  I would normally give this place 4 stars because it isn't quite as good as some other places in town, but when you factor in the cheapest AYCE price in Vegas, it gets 5 stars!

If you are budget minded and can eat your weight in sushi, give this place a try!!",cMZVJdi_fKG7rp1no_2ZvA,4,2,5,U7F6v4KFu5QkwxGRafPIhQ
3382339,2016-03-11,0,AoGCnRtwifZ2gTGHtg8KTw,"Love this place! Definitely not your traditional sushi. I have been here a few time now and still good. I like the atmosphere here for some reason. Usually good music and the people that work here are always nice and seem to enjoy being here. 

You will get better service sitting at the bar because usually they only seem to have one waitress working.",4CWvRrqEFOhewgcEWkO5iw,1,0,5,jB6dZeccAkjNvHJhxbBHow
3401437,2015-07-31,3,AoGCnRtwifZ2gTGHtg8KTw,"Sushi was good. Happy hour is worth it. Can't really judge the service, she was new. Still did good. The kitchen took foooooorever. 45 minutes to get a chicken teriyaki bowl. Restaurant wasn't busy at all. No excuse. Only one sushi chef working so the rolls took a long time to come out. 2 hour overall experience. Way to long. But like I said earlier, the sushi and rolls were good. Worth a 4th star if it didn't take so long.",hp7a4dDL0px7qoxy-wunrw,2,2,3,6_xMRLSVyUmMNMLPH_ZFEQ
3404074,2016-05-13,0,AoGCnRtwifZ2gTGHtg8KTw,Wonderful Sushi. There is a large variety of rolls and desserts. It's fairly priced at $17.99 for all you can eat lunch. The staff is very friendly and upbeat and the restaurant is extremely clean. Love this place!!!,2yV_hQTliKqSyCj5Hg_TnQ,0,0,5,W8D9vA2EJkzDaKz5syArNA
3417109,2015-01-09,0,AoGCnRtwifZ2gTGHtg8KTw,"My very first experience at Tokyo sushi house was nothing less than absolutely satisfying. The AYCE lunch special price is unbeatable for the delicious food, awesome atmosphere, and spectacular service! Paul took special care of us right at the sushi bar, even from the upcoming, unreleased menu and Maggie was on top of everything! Will definitely be frequenting this restaurant much more often!!",ZkdYI-cWq3hPIlOKPmaw-A,0,0,5,DQJJK6TLIKH4rpTBdby8Pw
3456491,2016-05-17,0,AoGCnRtwifZ2gTGHtg8KTw,"Misty charged us for an all you can eat, when we only had one plate.
Probably won't be returning.",GLPlsxMjClSUqikpXVnZ1w,2,0,1,Sla-dP_1ugThIpF_mmTf6Q
3498934,2015-07-04,0,AoGCnRtwifZ2gTGHtg8KTw,"Came here on a busy Friday night, but sushi chef Kris was able to keep up with our orders. We started off with the salmon sashimi with lemon on top, and if you haven't tried eating salmon this way I highly recommend it. They have quirky names for rolls like the ""Jessica Albacore"" roll and ""Scallop Johanssen"" roll. Everything came out tasting delicious, and I couldn't ask for a better ending than with the tempura cheesecake. Yup, you heard me! Tempura cheesecake. Order 2. You won't regret it.",x9UlbQUV5TMUgIsMr92XLg,0,0,5,miwN1EG4-mwgVGlRjnHdlg
3506077,2015-12-10,0,AoGCnRtwifZ2gTGHtg8KTw,"One of the best sushi places in Las Vegas, the Maui Roll was AMAZING, awesome recommendation from Ann, our server who's also amazing. Check it out if you haven't yet, highly recommended.",mzkiYZunba5SRL2BdtT8rg,0,0,5,WlbVZQaf8qjUge_zKGd9mg
3517900,2016-08-22,0,AoGCnRtwifZ2gTGHtg8KTw,"I've been a few times but I won't be back.  Last night they were short-staffed, with one chef, in fact. A bad situation for sure but they could have handled it better than they did.  When we sat down, they could have told us that they were short-staffed and that there would be a long wait.  During the hour that we waited for the first food items to be brought to us, they could have thrown some seaweed salad on a plate, or made a few quick nigiri pieces, to hold us over.  It's sushi, so they could have made 1-2 orders per table at a time, giving everyone a trickle of food rather than most of us getting nothing.  During the second hour, more food came slowly but after 2 hours we still hadn't received everything we ordered.  The table next to us left after they waited 45 minutes for no food.  I had better experiences here in the past, and they did give us a 25% discount for our troubles without us asking, which was a nice gesture so I'll give 2 stars, but there are plenty of other AYCE places in Vegas.",JW7BqtiCgIKVlH-lidXZ6A,1,0,2,LiKYk4qJvZewelbyyjJtyQ
3550822,2010-11-25,0,AoGCnRtwifZ2gTGHtg8KTw,"This place has the worst customer service ever..  They take forever to take your order and then rush you out when your hour is over.. The owner or manager, who ever she is that just stands around and watches you like a hawk doesn't even help out at all.. There were only 3 tables being used and they told us to share 1 menu... hello?!?? There's no one here!! You can spare 2 menus right now I think you guys will be ok without that 1 menu... The sushi isn't even that good the only thing you guys got going for you is the cheap $15 lunch all you can eat price and even then if you pass that time while you are the the snotty owner/manager doesn't give it to you and gives you attitude about what time it is and gives you the dinner price... Bottom line is that place SUCKS no wonder why they are also dead... With crappy waitresses and management this place needs to be re evaluated and shut down!",XL1ymBrRvgvhzD8_vSdqiw,1,0,1,XO6yC2GkO1M4Cyjds3QIiw
3555436,2015-08-31,0,AoGCnRtwifZ2gTGHtg8KTw,"This restaurant is located near I-215 and West Cheyenne. The ambiance is nice and small with a cozy feel. The sushi menu consists of classic rolls, bowls, tempura rolls etc. There is a lunch, dinner and deluxe all you can eat. With the deluxe it includes sake as well. It is well worth getting that as opposed to ordering on the menu.

We came here for the first time and had the deluxe all you can eat. We tried Vegas Playboy- flash fried tuna, salmon, yellowtail, albacore,& avocado roll served w/spicy mayo & eel sauce.
 J&B Special- soft shell crab, cucumber roll topped w/salmon, tuna, avocado, spicy eel sauce, tempura flakes, green onion & smelt eggs and also Hit & Run sushi rolls. They were fresh but I felt there were too much rice on the rolls.

The server, I think he is a owner or a co-owner who tends to us last night was very nice.",8dxkcmAXY4ttrVFD1GhbdQ,0,0,4,NN1tXWYPpMwXCYpnpin2QA
3567289,2016-11-13,0,AoGCnRtwifZ2gTGHtg8KTw,"We're here for their $10 AYCE lunch special. We got here 11:30am, they literally just opened. There was a family on a table when we walked in, 1 server, 1 sushi chef. Later on there was a group of 4 people walked in, sat on the same table.
So, the server and chef tried their best to serve 3 tables. 

I heard the first family complained about the wait. Come on, maybe you should placed 2-3 items per person when you ordered and then placed more order when you were eating your last item like we did so there was no wait time, your food will keep coming.

All items we ordered were good, except unagi roll; they put tons of cucumber and very little eel so when we took a bite all we can taste was cucumber.

We had a good lunch. Each of us ended up with 4 rolls each.",Ffeg7Fl5-tes6kxBDVEX1g,1,0,5,9kYdGTDXNMU6KKm0WEmFnw
