,date,funny,business_id,text,user_id,useful,cool,stars,review_id
5218280,2009-02-18,14,E-3LCDxXg8ojxDe4c7VZ1g,"Another afternoon in the Summerlin area, we decided to trek over to the Suncoast Casino for some grub.  I'm so happy we encountered this place that serves happy hour deals all day everyday!   Appetizers are half price in their large bar area.  The Tuscan Spinach Dip was served with fresh (warm) tortilla chips.  Their $1.50 bucket of fries weren't really served in a bucket, but were way worth it.  A high point of our dining experience was the sliders, each for $1.50 on the happy hour menu.  With a nice charbroiled taste and caramelized onions, we ended up ordering more.  A low point was my incomplete house salad.  This order usually comes with croutons, cucumber slices, and a garlic breadstick.  I pretty much had a small plate of just lettuce.  They did bring me a garlic breadstick later though.

Speaking of bringing it...all the waiters work as a team, tending to all patrons.  I must've dealt with six different waiters after we were seated.  Service was with a smile and diligence!  The drinks weren't bad either during happy hour.  I tried their Electric Lemonade which was like kool-aid with a little kick.  Their $5 Margarita, with 1800 Silver Tequila, was flawless.  

The next time I visit, I will partake in their Endless Soup, Salad and Bread Lunch Deal.  From 10am to 4pm, $4.99 will get you all you can eat soup, salad, and bread.  What a freakin deal.  Hell...I might just have to get a slider or two while I'm at it.",KOWl_ZhqhYqY33-CbaJubw,17,15,4,_Iui0gZ3I3F-dACoJ1X6nw
5257520,2013-05-03,0,E-3LCDxXg8ojxDe4c7VZ1g,"Always love TGI Friday's.  Love the atmosphere and the staff.  

Definitely recommend getting the club (the bread is amazing).  One of the best club's I've had.  Oh, and gotta love Happy Hour ;)",NUEQYD6T-ixWejImJYlDHQ,0,0,4,b-yD36rWUbFP_i0A2a02pQ
5565550,2014-07-19,0,E-3LCDxXg8ojxDe4c7VZ1g,Really good food and service !!! Cool endless appetizers !!!  JORDAN  was our waiter and ask for him !!! He was excellent ! We will be back.,x3AZN7ErnhQiNK9zfT7vdQ,2,0,5,XhVNsV_5B9k1DPvrWsWP7A
5885043,2011-05-05,0,E-3LCDxXg8ojxDe4c7VZ1g,I read a review on google maps that was quite negative.  I disregarded it and am glad that I did.  The food was great and the service was awesome!,tjjbe6s3j99K2dFkWZwHnQ,0,0,5,JxhU_2wW_dl70Q5CUsGljw
5902338,2012-01-30,0,E-3LCDxXg8ojxDe4c7VZ1g,"Lately we've had some very good experiences at this Friday's.  We were there on a Sunday evening with another couple, which means all day and night Happy Hour, and not just at the bar.  We sat in the back, so we wouldn't interrupt all the football fans watching the game on TV.  :D  

Naturally, we had two BOGO coupons, so we sure couldn't find much fault with four main courses and reduced-price drinks.  The service was also very good.  

I'm not a fan of chain restaurants in general, but the one thing that usually can be said it that you always know what you'll get.  My one consistent nit with TGIF is that you NEVER know what you'll get; no matter how often we go, and being that it's so close, that's fairly often, there always seems to be a new menu.  Just once I'd like to be able to know where to find what I'm looking for!",m-BZLIIh5PCAKnzH0qj_0Q,0,0,4,huiVASsLJ-1AD86DYEwvDg
5928951,2013-07-17,1,E-3LCDxXg8ojxDe4c7VZ1g,"I haven't been to TGI Fridays for years. Lately, we have been coming to Suncoast to watch movies. Since this restaurant is right next door to the theater, it's the perfect place to eat before or after a movie.

What I like about this place:
-clean
-not crowded 
-friendly service
-food comes out quickly

Of course whenever I come here, I just have to order the Loaded Potato Skins. They are a little bit stingy with the cheese and bacon, but they still taste very good. This is one dish that you have to eat right away. It doesn't taste as good if you take it home, trust me!
Here are their current Happy Hour Deals:
-$6 appetizers, ultimate cocktails
-$5 sangrias
-$4 20 oz. glass draught beers, well drinks, wine by the glass
-$3 14 oz. glass draught beers, bottled beers
Monday-Saturday: 3-7, 9-close bar area only
Sundays: all day bar and dining room (yay!)

It may not feel like ""Friday"" here, but its a nice, relaxing place with good food. Also FYI, they have a rewards program called Give Me More Stripes. You can register for it online, and they send you a coupon for a free appetizer or dessert, just for signing up. You earn 1 ""stripe"" for every $1 spent, which can later be used to redeem rewards. This location does participate in the program.",FOoN3DJzDUnl4EAQaTJIGg,3,1,4,y1BUoB6Dx9RrIJqdq5yGNw
