,date,funny,business_id,text,user_id,useful,cool,stars,review_id
37345,2014-11-22,0,E-3LCDxXg8ojxDe4c7VZ1g,"No longer open in the sun coast casino!!!
Closed for months

How can this been on yelp. Incorrect info!!'",vHUmIX4x_sIlMdhLBpUY8Q,1,0,1,tLMUiQNdL_Kn0YGfHiqOXw
174323,2014-09-11,1,E-3LCDxXg8ojxDe4c7VZ1g,"OK let me get right to the point: The food was NOT Very good. I ordered their sizzled chicken and spinach and it didn't even look a little like the picture. The chicken was small as hell and it was supposed to come with mushrooms. PLUS they only gave me very little vegetables and it was supposed to be a lot of veggies. On the bright side my family absolutely loved dessert and the service was great, But they most definitely need a new chef on board.",T-qMfNmFz8soV9wa_iZTNw,1,1,2,X6O-pCe1HNjnG6FWl0p-hw
303314,2012-01-16,0,E-3LCDxXg8ojxDe4c7VZ1g,"Nice place. They've got some great bargains.  Check out the menu before ordering anything. Some drinks are triple the specials price if ordered with different brand liquor and food specials will keep you from looking at regular priced stuff. 

Great sliders!

Bartender really friendly.",W_JWFvxVuUiFs9nb2XyxGQ,0,0,4,7bfl9UJ7BhHotGqwomptuw
409378,2013-11-15,0,E-3LCDxXg8ojxDe4c7VZ1g,Yummy. Good food and good service.Luv their wings with the bone haven't tried boneless but I get their scorching hot sauce on the side.,KenhG5urwrJB9wqvOjZP0w,0,0,5,ZHg4Q7A-65CF_3kYEbbo4A
479219,2013-06-29,0,E-3LCDxXg8ojxDe4c7VZ1g,Always choose this location because there is never a long wait! Maybe only five minutes. The food has always been amazing and for the most part the staff is decent. Only a few times we had a so-so server. Great location because the casino is right there if you want to hang out before you get to your table or even fun if after you eat you have a place to hang out at! Dessert is always the BEST!!!!,XWRws7WO0ct4gGifQpNNKg,0,0,4,ALlSCy42l83N0RmRIY4Kjw
1362164,2013-07-24,0,E-3LCDxXg8ojxDe4c7VZ1g,"If you have looked at my review history you know how rare it is to get 1 star from me.  I'm pretty easy going and easy to please! The reason I say that is because if you get a 1 star review from me...you really suck.  

We went here on a whim after being in the casino.  I knew it was going to be a rough ride when we stood at the hostess station for 5 minutes before we were even greeted.  After she finally came to seat us she took us to a booth in the back where she told us it was happy hour and K*** would be our server.  (Remember that she told us it was happy hour)  While waiting the 10 minutes it took our server to make her way to us we noticed a sign on the table detailing happy hour pricing and specials, which sounded good.  After she finally arrived and asked what we'd like to drink we asked for two drinks that were shown on the happy hour sign.  We were then informed that you have to be in the bar area to take advantage of happy hour pricing. WTF? Then why did the hostess tell us it was happy hour when she seated us outside of the bar area? Why are there signs on our table about how awesome happy hour is, with prices, when the table is outside of the designated happy hour area? Anyway, our ray of sunshine waitress told us there are tables open over there if we want to move, which we agreed to do. 

After grabbing our novels that are the Friday's menus, we follow K*** over to the promised land where she proceeds to wave her hand at an open table and walk off. After 5 minutes or so of setting there with no service we walked.  You suck Suncoast Friday's...you suck!  

And that concludes the story of ""The Great Happy Hour Misunderstanding of 2013"".",xSt--5JG6QqTEOwXJj_pRw,0,0,1,BynAwz-B4Io6CWOBgAIcDg
1364400,2012-06-14,5,E-3LCDxXg8ojxDe4c7VZ1g,"I was happy until I went to this TGI Friday's for happy our and ruined my mood. 
Let me first tell you that TGIF is one of my favorite chain restaurants, I usually go to the one at the Orleans casino but this time there was some kind of event going on and they were real busy, I had set my heart on the steak and lobster so I decided to take the trip all the way across town to the sun coast.
When I got there the place was almost empty and honestly I was happy it was since I was starving. The hostess offered us to sit at the bar area so I we take advantage of the happy hour which we agreed.... and happiness was over.
 We waited for a long time to order our drinks, we waited a lot time to order our appetizers then we waited a long time to order our entrees and having worked in the service industry I'm the first one to stand in defense of the help. I understand that many things can happen that affects good service, problems at home, bad management, crew under staffed, super busy, but when it happens to me that's when understanding stops, specially when the place is this dead, I could find no excuse for him but that we didn't fit the waiter's ideal tipping customer's profile?
 By this time I was willing to ignore the waiters sad service during happy hour, get my own beers at the bar and concentrate on my much anticipated steak and lobster.
 Short version .....WTF!",EG6qatWgJ2WTJnzBCCH_Dg,0,0,2,B4vipx4V3-bXh7_OhQLqZg
1386058,2011-07-02,0,E-3LCDxXg8ojxDe4c7VZ1g,Service is not that good but the pork chop is! I was pleasantly surprised.,_i3IZYU28R3xgV4hxkmKjw,0,1,3,EISdgkKwbUwumr_HrPu-xg
1446213,2014-01-18,0,E-3LCDxXg8ojxDe4c7VZ1g,Friendly service. Decent food. Close to the movie theater. And pool tables if you want to take a break from gambling!,5v6juPIOisfmogp7QSso-A,0,0,3,C3L9yHxpcal0egR1gfhl6Q
1594915,2009-08-30,0,E-3LCDxXg8ojxDe4c7VZ1g,"This TGI Friday's is a bit out of the way for me, but it's worth it.

First off, not all of the TGI Friday's outlets in Las Vegas are created equal.  Usually when we're talking chain restaurants (e.g. Chili's, etc) you can't tell the difference if you're in San Diego or Santa Fe.  But I've been to a few Friday's in Vegas and let me tell you the spectrum of quality on what is some fairly basic food is vast.  But here at the Suncoast, you'll find the best staff and that's a good start.

I've only sat at the bar to grab a bite before or after a movie.  All the bartenders and servers I've come in contact with are very attentive, friendly and don't mind chatting you up as you wait to pass the time.  The food is the same at all Friday's but it seems like the cooks know what they're doing and put some effort into the preparation and presentation.  I usually get the Gourmet Mac & Five Cheese, which is just the right portion size and pretty good for a cookie cutter chain.

I also like the entertainment setup here.  Plenty of HD flat screens well positiond for sports viewing.  Most the appetizers are half-price and domestic beers are cheap for vegas at $2.50.  The only downfall I have is that my iphone gets bad reception for its internet service, putting me at Edge rather than 3G... or sometimes nothing at all.  But that's really stretching to find something bad to say about my experience here.",On_1ZwRgD2Ry0eoKYC29iQ,1,1,4,YgGuat29wTVe4_A1Kq1udg
1615606,2014-08-08,0,E-3LCDxXg8ojxDe4c7VZ1g,Amazing service and Jordan is THEE BEST server we have had in quite some time! He was full of recommendations and kept our endless appetizers coming faster than we were able to keep up with. We definitely plan  on making this our new hangout when we're looking to get out.,yZmitTfUaQVZcIXKN-G0AA,1,0,5,ylApAxHWftCZXImAOyPuYw
1958324,2014-09-01,0,E-3LCDxXg8ojxDe4c7VZ1g,"Friend and I went at 4pm as we had tickets for a 5pm movie so we decided to sit at the bar. Brian at the bar got us taken care of and quickly with Buffalo Wing Appetizers, while my companion had the French Dip while I had the Jack Daniels Chicken sandwich. We both had Jack and Cokes also. Great service and food.",VdKkGBEXvD6uBUl2k1ljfg,0,0,5,aztLNXqAiIeEG18ulFrpIQ
2024917,2014-09-20,0,E-3LCDxXg8ojxDe4c7VZ1g,Took 40mins for my meal to come out horrible !!! Got my buzz before my food ! Horrible but the bartender was really good about it n comp'd out bill! U better sucker,zHowc7nVm1NxGbsCwYaf8Q,0,0,1,ThKD0IJcuJU6COgY9_aKBQ
2106508,2011-08-18,0,E-3LCDxXg8ojxDe4c7VZ1g,"I've had better experiences at OTHER T.G.I. Friday's.

The food is still the same like other locations.  ""Thank goodness.""  BUT the service need to be worked on especially when there's only five tables to service and three servers are out on the floor.  The means something, which is called POOR SERVICE!

I'm here with family and it's my cousin's 21st birthday.  It's not the best place for dinner but we want to make it something special for her.  The birthday celebrant's sister asked the waiter in advance to bring out  a birthday dessert for her so that we could sing her Happy Birthday but the server failed to remember and offer it.  We asked him three times and instead gave the brownie with ice cream dessert with no candles to the celebrant's brother.  We looked at him and said where's the birthday dessert.  The server replied, ""Oh I thought it was for him.""  He instead brought out his cigarette lighter and told the lady celebrant ""here you can pretend to blow of the light with this.""  HORRIBLE!!!",Gdzqo32xFRrHF2-27FW7vg,0,0,2,efqEAJq_IHcx2QcDeQOViQ
2149148,2014-01-11,0,E-3LCDxXg8ojxDe4c7VZ1g,Very bad customer service. The server gave my to go order to somebody else and they claimed it is not their fault. The manager apparently don't care and just blamed it on the other customer. Customers are treated very poorly and we waited 47 minutes for the guy to pick up the check. We keep trying to stop somebody to get our check so we can go home but nobody is paying attention! We feel so discriminated! The manager had the nerve to tell me that next time we should the to go bag. As a customer I have never been treated this poorly before. I cannot imagine myself going through somebody else's to go bag!,SHNeOoHDz8SnF0insLurhw,2,0,1,Qo5vHWOVm3Ipgff5LIrSnw
2265352,2014-01-30,0,E-3LCDxXg8ojxDe4c7VZ1g,"Lets start off with being seated. The host was having a ""lovely"" conversation with another employee and took a good 5-6 minutes to finish her conversation and address our party. Loss of a star right off the bat. Once we were seated it took 20 minutes till a server arrived to take our order. Loss of another star. This is no exaggeration. Once we placed our order it took exactly 43 minutes for our food to come out. Yes i timed it. Lost their third star right there. Next my ""burger"" which i feel is a dishonor to even give it the name burger was about the size of a slider...and not to mention the order was messed up. I had asked for a few specific modifications to my ""burger"" for example no tomatoes. However when it arrived it had exactly what was written on the menu. As if the server completely ignored my requests. The patty was dry and bland no flavor at all. And they were extremely skimpy with the fries. It was a bag with about 15-20 fries in there, it looked like it had been half eaten. Boom lost their fourth star there. If yelp would allow me to give 0 stars i would. So it seems this yelper will not be returning to T.G.I fridays.",49_0pBoLFXuAoFz0uNlO7A,0,0,1,HotGUvUsKJQ0-WD5spFVaQ
2289817,2010-12-19,0,E-3LCDxXg8ojxDe4c7VZ1g,"I used to love TGI Fridays about 10 years ago but it went downhill at some point and I stopped going.  But looking for a bar in Suncoast, TGI Fridays seemed as good as any of the other options.  I'm glad we came!  The bartender was super nice and helpful.  We made just in time for the 9pm happy hour which offers $4 beers (anything on tap), $5 sangria, and $6 for any ""ultimate"" drink.  

They have Styrofoam cups and lids in case you need to take your drinks ""elsewhere.""  I'm not sure about the food but the bar is definitely a good time.",iAevEfcmtCr2cpd6IRqnTA,1,0,4,YOyW288masfZuq0kcN99dw
2599253,2011-06-20,0,E-3LCDxXg8ojxDe4c7VZ1g,"The guy cannot operate the ordering machine, the bar tender did not care to serve us.  The food is just like any other T.G.I. Friday's - but the people working there are dumb and rude.  We went there because it was very late... We didn't have that many options... There are definitely better places to spend your money.  DO NOT GO HERE.",YzCRr11c7KVCK4nF9sIeog,0,0,1,oX89CPXceHSiRFM2Gk5S3Q
2797511,2013-10-09,2,E-3LCDxXg8ojxDe4c7VZ1g,"My last trip to a TGIF was at the Aliante Casino and that was a 1 star. We just got done watching Casey Abrams at the showroom and was feeling too lazy to go out anywhere else to eat. Soooooooooo I held my breath as we sat down and went over the menu.

From my experience at the other location, I knew what not to get. This time, for our party of 3 we decided to share wings, nachos, fried green beans, and a beef quesadilla. I was pretty sure you couldn't mess any of those up. When it was brought out, it was actually decent except for the nachos were a bit salty.

Service was below mediocre because as soon as we got our food, we didn't see our server for a good while. Since the nachos were a bit salty, I finished my water quick. it was only when more people showed to be seated was when we got the attention of our server. What is it with service at all these TGIF's? It starts out ok and then they disappear.

I have been to numerous TGIF's in my lifetime and I seem to recall back then the service was usually pretty good. Same for the food. I know it has gone downhill too. Maybe too much overexpansion? It is a chain but I refuse to believe that's the cause. At least this location the food was a bit better but the service was about the same.",0FMte0z-repSVWSJ_BaQTg,2,2,3,ZOg3JX6B9_ecX18hz3Fo5A
2955424,2012-07-06,0,E-3LCDxXg8ojxDe4c7VZ1g,"When service is this bad, who even wants to try the food?! Went here last night with my wife and six other people. When we arrived the hostess actually appeared unhappy to see us. The place was a ghost town except for one family and a couple but we were still told it would be a 10 minute wait. After waiting 15 minutes and receiving no updates from the surly blonde in front, we decided to go spend our usual $200 plus tip someplace where they would be happy for the business.",8QIGuDmmbc-KKaGJrHgwNg,0,0,1,5PucX4GkfQvHNE4igQwr9w
3067037,2014-03-01,0,E-3LCDxXg8ojxDe4c7VZ1g,Stopped into the bar for happy hour while waiting to meet a friend. Not very busy but bartender failed to greet me for at least 5 minutes. When he did look at me he seemed like he was distracted or if i was adding to his awful day. One beer (20 Oz) for $4 on tap not a bad price but really put off by the experience.,3NW_sfFhRFxxmo3x4P7Dig,1,0,2,Eeo797oEso6HPkxWJunUHg
3342682,2009-06-18,0,E-3LCDxXg8ojxDe4c7VZ1g,"Happy Hour All Day Everyday

1/2 price on appetizers
$1.50 Cheesburger Sliders
$2.50 for domestic beers

It doesn't get any better than that. Any time you need a slider fix, you can go to ""Happy Hour"" at T.G.I. Friday's at the Suncoast Hotel Casino. Happy hour lasts ALL DAY LONG (I think this goes for all TGIF locations in Vegas).  I've only tried their wings and I just love the sliders for a late night munch... I'll be going back soon to try their other appetizer dishes! At half off! What a deal!",0W_z7mfRic4MzIUmniocHw,5,2,4,kTxYwDTEVpSbNeOhfOismg
3492079,2012-03-15,0,E-3LCDxXg8ojxDe4c7VZ1g,Service was friendly. There was abundant seating. We arrived after seeing a movie at Suncoast theatre where the restaurant is located adjacent to it.  We enjoyed a 9pm to close happy hour  and ordered some cheeseburger sliders and a quesadilla.  We also split a Chicken Cesar Salad. I thought TG's at Suncoast was fast and with friendly service.  It's not a bad date night combo hitting the slots before the movie and ending with a cheap good meal.,PtEQ6LrPT4qO5L7sno95Hw,0,0,3,fRU0Mpj7UxTGKFyWLlJ4kA
3675496,2013-02-09,0,E-3LCDxXg8ojxDe4c7VZ1g,Happy Hr in the bar! $6 cocktails & $6 appetizers are great. But the service sitting at the bar is what sold me! I will definitely be back there ;-),2i4n1dxsxQL2C2eRTJwdmQ,1,0,4,ZeVtGESNmGt234lnqPQcUw
3728355,2014-02-03,1,E-3LCDxXg8ojxDe4c7VZ1g,Yuck.   I remember a day when I loved TGIF's.   It wAs in the 80s.   Now it's just greasy bar food but not the good kind.   I think they started the potato skin trend....  And they ended it too!,HK-TlD0yVA_tpTXZxfzu2w,1,1,1,_BHQV-5zsUGOq-kajYl1lw
3916568,2010-04-09,0,E-3LCDxXg8ojxDe4c7VZ1g,"Not a HUGE fan of TGI Friday's (I prefer indies to chains), but they do have all day happy hour, which is pretty solid.  Alvin L summed it up pretty well in his review.  Also, the Jack Daniels steaks are pretty tasty.",1O638BDK_fWuxgTVJwff-A,2,0,4,MMlFpRxKLW89vY3wF4mJqA
3946127,2014-08-02,0,E-3LCDxXg8ojxDe4c7VZ1g,"Sitting here on a Friday night with my wife and son, and the place is not busy.  It took my waiter (short guy with a beard) almost 20 minutes to take our food order.  He told me he was responsible for a lot of tables.  I joked that I see 5 people cleaning but he is the only server taking orders,  and he stated he was the only one...somehow I think he flat out lied.  The food was served quickly and was good, just not the waiter.",492pgUYsy95WykTjiTW4SA,0,0,2,O4DBbhI09wtG3O1BjAmISw
3972807,2011-11-07,0,E-3LCDxXg8ojxDe4c7VZ1g,"We gave the place another try tonight because of two promotions at this location.  It was a complete reversal of the last less than delightful visit.  

We were seated in the restaurant area which was much quieter than the bar area, and I could watch the damn Patriots throw the game away to the Jersey Giants.  Oh well, that's not why we were here.

This location is doing an ""Eat Like a High Roller"" promotion through the end of December.  It's $10 off when you spend $25 or more.  That's a good discount.  I ordered their steak and lobster promotion.  I got a 6 ounce sirloin done rare the way I requested, two sides, and a cup of clam chowder.  The steak and lobster is $13.99 and the soup added for $1.99.  That's a great value and everything was very good!

My wife ordered their sizzling chicken and cheese with a double side of broccoli.  She brought one of the chicken breasts home and she enjoyed her meal.

For dessert, I got a slice of red velvet cake with vanilla ice cream.  Total for the two of us after the $10 off was $35.  That included two iced teas.

Our server was Olivia and she was a gem.  Delightful young lady with a great personality and good service.  I'll ask for her another time when we're there.  I am a fan!",PKEzKWv_FktMm2mGPjwd0Q,2,1,4,C0OSWzWaljEAIG6U1xE7bQ
4435053,2011-07-03,2,E-3LCDxXg8ojxDe4c7VZ1g,"After passing up sushi, create-a-burger and mexican food, I found myself at a TGI Friday (yeah I know...).  For some reason back in Michigan the atmosphere always rubbed me the wrong way, but I'm pretty glad I came here.

The 2 for 22 special is pretty great.  I loved the food selection, they didn't skimp on the portion size.  The service was pretty great.

Our waiter seemed like a pretty cool guy, he was definitely had a look similar to Travis Touchdown from No More Heroes.  I will not apologize for using a videogame reference in a Yelp review, but I'm not that great of a reviewer so anything outside of saying, ""FOOD...GOOD..."" is great in my book. 

Great value overall and an enjoyable experience, I can seem myself coming here more often relative to my once every other year visit to a TGI Friday's.",UER4m0CBVgcFlVbMqhCvCg,1,0,4,IjumjDoqDD1soHnNHYplwA
4470139,2013-08-02,0,E-3LCDxXg8ojxDe4c7VZ1g,"We went for lunch on a Saturday afternoon using a 25% off coupon from the internet.  I hadn't been to a TGI Friday's in over 5 years.  They were located in the Suncoast Casino near the Century theater.  We were seated in a booth in the bar area.  Some other people joined us, so we had to move in the main dining area since there was a minor joining us.

I ordered the Grilled Chicken Cobb Salad which had balsamic-marinated chicken breast fire-grilled and drizzled with balsamic glaze. served over chopped romaine with sliced avocado, grape tomatoes, hard-boiled egg, applewood-smoked bacon and crumbled bleu cheese with choice of dressing on the side.

My friends both ordered the Skillet Garlic Shrimp which was a sizzling skillet of risotto-style rice topped with tender garlic-marinated shrimp, roasted garlic and a bruschetta mix of diced tomatoes and fresh basil in a creamy roasted alfredo sauce.

They had a Happy Hour menu offering half off appetizers.  I would come back for the Happy Hour.",XKo5IT6o-WslzHPT69PRSQ,1,0,3,LqQ-pzbMIDwuuRn8DzlQXA
4540367,2014-08-19,0,E-3LCDxXg8ojxDe4c7VZ1g,"It was ok...what can you say about a chain..the service was just ok, the food was fine, the price was fine.

If you happen to be in the area the food is ok here.",kzRq4H_nSf4b3F_sdymWSw,0,0,3,-3SEC7LEHBPCI063tomuKg
4607799,2014-07-24,1,E-3LCDxXg8ojxDe4c7VZ1g,"Took forever to be seated; no hostess at station and had to go into bar and ask bartender if someone could seat us.  After we were seated, no one took beverage order or even stopped at table to say I'll be with you in a minute even when several waitstaff walked by us as they were coming & going from other tables.  We waited about 10 minutes and then walked out. Would give negative stars if I could.  Don't come here; they don't want your business.",bvnu6ts51ICEPI0p3HMm8g,1,1,1,LYfhjmUswL3HJhYWn7N_KA
4660976,2013-03-13,0,E-3LCDxXg8ojxDe4c7VZ1g,"SO my fiancé, mother, and I came to this location last week and decided to sit at the bar, biggest mistake ever. The whole experience was a hot mess! The bar was not that busy for a Friday evening, we sat down and a few minutes later one of the bartenders (a young kid) came to take our drink orders, after he dropped them off it took him quite a while for him to come back to take our dinner orders. So this is where it gets real awkward, the food runner is on her way to deliver our appetizers but on the way she gets into it with our bartender on not putting the correct seat numbers for the order, she proceeds to tell him to run his own food then THROWS OUR PLATES IN FRONT OF US (seriously they were about to fall off the bar if i hadnt caught it) and just leaves without asking if we needed anything else. I was dumbfounded. The remainder of our time there we were drink-less and just uncomfortable with all the bickering going on in front of us with the staff. We tried again and again to get one of the bartenders attention but nothing, oh except when we asked for the bill when it was convenient for them.",SC3a1engYICtwNI2FqQMug,0,0,1,7rSybeg-ZwfjKx_4e_bKTQ
4698986,2013-06-12,0,E-3LCDxXg8ojxDe4c7VZ1g,"We only eat here before a movie starts since it's right next to the Century theater in Suncoast. The service is usually very slow even though there are a lot of wait staff walking around.

The staff really brings this place down. All of the female employees talk and tlak and talk and gossip. Do I really have to hear about your work problems because the hostess sat me next to the bus station?

We've never had an issue with the food but the employees are unprofessional and the service is slow.",EZzV8WIUGWJ7D-e5E7XdjQ,1,0,3,vKQw-ykwq3ANGE2lnrpm5g
4754522,2014-09-02,0,E-3LCDxXg8ojxDe4c7VZ1g,"This Fridays is located inside the Suncoast casino. I like the late happy hour hours, and service here has been pretty good. You can stop in after a movie, or do some gaming after dinner. The food is good, standard for the Friday's chain.",ObQl16Vuc4sHPGKtzSGNUw,0,0,3,opuoSkozFpkjb-VROc81dw
4971527,2013-03-19,0,E-3LCDxXg8ojxDe4c7VZ1g,"$10 Jack Daniel's Burger & Queso dip, $3 happy hour beer, super friendly staff and no wait on seating...heck yeah.  Great place, great food.  4 stars is my rating.

-Doug",Y6otbk7H7mDMbXBVKL9yeA,0,0,4,9fPJMSUAWq2l7Qp8Y16yRQ
5168477,2014-09-18,0,E-3LCDxXg8ojxDe4c7VZ1g,"Wed. is baby back  rib day. What a deal, a full rack of delicious ribs,at 1/2 price..Sides of broccoli, and sweet potato freis were excellent.. The server was very good. Seated promptly.  Food delivery was timely.  Caesars salad was not very good. Very acidic.
All and all, a very nice experience.",rZQa3JrFbM4IvDxGOcM_qA,0,0,4,AgQ9o5N-hLQ-XynStnrCVA
5190785,2013-07-01,0,E-3LCDxXg8ojxDe4c7VZ1g,"Suncoast has a promotion where you can use your movie stub to get B1G1 free entree along with 2 drink purchases. 

So we watched a movie and stopped next door to cash in on the free entree.  We ordered the Strawberry Fields Salad (salad, strawberries, bleu cheese, nuts, balsamic sauce) and Angus burger special with Parmesan fries.  

The salad was really good, the cheese and strawberries were a nice mixture. The burger was super flavorful and the fries were dripping in oil, good thing there were only 7 of the steak fries.  The total bill came out to be $25 including tip ($21.xx + tip).  For the drinks we ordered a strawberry lemonade and Newcastle ($4).  The waitress was nice enough to offer to wait and put in the order for the beer since it was 5 minutes til Happy Hour.  

I would totally come back here again after watching a movie to get the promotion.  You can also use your movie stub to get a free game of bowling ($2 per game + $3 shoe rental).  You have to leave your movie stub when you pay for the bill though.",SAPltgfFSgI1K9aUuOWcXw,1,0,3,s1sk9i5hvK4yM64LwZsRAQ
5193972,2013-09-09,0,E-3LCDxXg8ojxDe4c7VZ1g,"The service and friendliness levels were exceptional on this specific visit. The speed of food preparation was extraordinarily slow. The food was average, and priced high at this hotel location. The brownie sundae was extremely horrible tasting like plastic boxed brownies.",Q7IoE5m2heQKThuVq3SYFA,1,0,4,cZa1EOo5c6DwQ4fcf0--Lg
