,date,funny,business_id,text,user_id,useful,cool,stars,review_id
4448894,2017-01-04,0,elqbBhBfElMNSrjFqW3now,"I'm new to this area of town so I haven't found a great Thai restaurant yet.
  Pin Kaow Thai has good amount of Stars so I went there to order take-out without reading reviews first.  
  I ordered Pad Thai for myself and Pad See Ew for my friend. We also order spring rolls to split.  We both order 4/10 stars.
  I found both entrees to be bland.  I ordered low stars b/c I didn't want the food to be too spicy but I wanted it to have flavor.  My friend agreed with my assessment.  We say edible but not great.",gxlxakxEgvE1PYMRvPYgHQ,3,0,2,u8hTiVN5oD_K3jHXwFdaOw
4468000,2016-12-15,2,elqbBhBfElMNSrjFqW3now,"So disappointed. I've been coming to this restaurant for years, but I've noticed that their service has been declining. 
Server forgets about order and the water is never refilled. 
The staff members seemed annoyed and bothered when I ask for anything.
There are so many outstanding restaurant in Las Vegas, therefore, you expect good service. 
I hope they get better service otherwise, my family and I won't be returning to this restaurant.",Pis8OEdKzyF8M46ShGWWgQ,4,0,1,KcniBmoRaIF9YyDXzUVrOw
4469558,2016-09-23,0,elqbBhBfElMNSrjFqW3now,"We went here yesterday with a couple friends that were visiting from out of town. We thoroughly enjoyed ourselves and the food was very good.  

We were rather full from lunch so we split two different entrees among the four of us and we have plenty to eat. The food was well prepared and quite tasty. 

Our waiter (Chris) was knowledgeable and very pleasant to talk with and he was quite witty which made us feel comfortable and it a light hearted mood. Overall it was a good evening.

We will definitely go back and ask for Chris again.",MZ3xgnosTaxKooMhxB3SUA,0,0,5,WTZlIQWl2sqa29snvjH0ng
4477907,2017-01-31,0,elqbBhBfElMNSrjFqW3now,One of my favorite Thai places to go to! The green curry is my favorite and the levels you get are pretty accurate I think a 4 is just right! The receptionist that is there is super sweet and fast. I think the prices are reasonable for some delicious food.,PUIY4ylQogGXKirIbAw4mw,0,0,5,aOQ2tYHYEmvW9cFDKM6IDw
4491703,2015-10-07,2,elqbBhBfElMNSrjFqW3now,"This was our first visit, nice atmosphere, beautiful wood work through out the restaurant, and love how everything around was very clean and organized.
The service was good and professional, except I had to request the spices 2 times. 
I ordered the shrimp/mushroom soup w/ steam rice (wished they would use the traditional straw mushrooms) and the pad thai rice noodles w/ chicken level 5 mild spicy (end up not being spicy at all). 
Over all it was a good experience. Best I've had in Las Vegas. I do recommend eating here. I will be back!",JXVDGeVS_av8BCrzyNGNPg,3,4,4,gvluZXNl-4P_-nhoLCYagg
4504574,2014-09-24,0,elqbBhBfElMNSrjFqW3now,The service here is excellent. The staff is very attentive good with the beverage refills. I ordered the combo Fried rice and my companion had Pad Thai and the green salad. We also shared an order of Spring rolls. Everything tasted freshly prepared and flavorful. I had hot green tea and she had an alcoholic drink that she raved about. So of course she had two. A very good dining experience.,bOVks84IqfVzdh6Vx2LUeQ,1,0,4,p9PTsxnureZqWGPG8NrZ1A
4514451,2012-05-15,0,elqbBhBfElMNSrjFqW3now,Delicious food. The place is always busy (a good sign) and the service is decent. The only thing preventing me from a 5 star review is the service wasn't great-only decent.,5fQ9P6kbQM_E0dx8DL6JWA,1,1,4,hztYr502KsEYQ1yx7UDXdw
4544844,2014-03-22,0,elqbBhBfElMNSrjFqW3now,So Thai food is slightly adventurous for my taste. So we started the meal with a bottle of white wine which was great. Then we had three appetizers the crab Rangoon the chicken satay and deep-fried shrimp with cream cheese. They were all very good. Then we all decided to share the pad Thai with shrimp and a wonderful soup with lemongrass and coconut.  Then we had a fantastic grilled pineapple with coconut ice cream and a butter rum sauce that was really the star.  Great service too. I would go back even though I'm not the biggest fan of Thai I thought the food was good.,m96igVtonhN98jfF63lr8Q,0,0,4,eQO1SMwS51xKZtNY0TTZdw
4553170,2016-08-09,0,elqbBhBfElMNSrjFqW3now,"Ok so I have lived in the Northwest for 10 years, drove by this place a thousand times, always just assumed it was not good because of the older location and plain outside decor, and was dedicated to my Weera Thai. Now I will ONLY go here after my friend took me here a few months ago! I have already been 5 times in the last 2 months and just celebrated my birthday there. Not only was the food stellar but was serenaded ""Happy Birthday"" and ""Love me Tender"" haha by the WONDERFUL new manager Toy. Everytime I have been there he walks around making sure everyone is enjoying their meal. He is always happy, smiling, and truly LOVES his job. It is awesome to see such pride in the restaurant and concern for his customers. The food is ALWAYS so damn good!! Flavorful and fresh. My faves are definitely the crab rangoon, garlic tofu, pad thai, pad see ewe, and I swear I cannot figure out if they buy it or make it but the coconut ice cream is THE BEST I have ever had! Real shreds of coconut and even got a free scoop with a candle and a cherry on my bday! The ONLY reason I am taking off one star is because I feel like the portion size is sometimes a little inconsistent. I feel like the portion sizes are always larger for lunch than dinner. Regardless, this is my new thai place..sorry weera :( I'm sorry I didn't try this place much much sooner!!",otgJn5Z4Ka7xTO2Pn8QKKQ,1,0,4,6ai4_gP9qhU4Vbcb7LK7Hg
4562843,2015-12-20,0,elqbBhBfElMNSrjFqW3now,"Been to a lot of Thai restaurant in Vegas and Utah but Pin Kaow is absolutely the best Thai food restaurant of them all! awesome food and flavor luv the green curry, my fav....I will be a regular in this establishment! (1st time review)

2nd visit....me and my wife went here again, sure the food was delicious but you insulted me and my wife running at and chasing us at the parking lot saying that we didn't pay it was absolutely embarrasing! well the credit card receipt showed my wife's signature on it and pointed at it, make sure to pay attention to detail next time and avoid embarrasing your costumer. Oh btw I found a much better Thai restaurant - Kung Fu Thai & Chinese at Chinatown!!!",TJxqyS7bgBmtoiAz8SWVrA,0,0,2,taOGzL6XsdSwgu8yojpAug
4577461,2010-07-29,0,elqbBhBfElMNSrjFqW3now,Good food fast service. A little bit expensive over all. Every time I have been there the place has been packed. Possibly the best Thai place by my house.,3DjTbhg_HndAxtRnRBt0aQ,0,0,3,-jW9DBxoA8FYIrKR4AO1OA
4591680,2014-10-17,0,elqbBhBfElMNSrjFqW3now,Like many restaurants it comes down to what you order. Took the advice of another yelper and got chicken pad see ew. Great flavor and awesome dish. Only problem was ordered spicy and it was not. Shrimp cakes reminded me of shrimp toast you used to get at Chinese restaurants. Rating on this restaurant is very very good,PFJ3_j-Fc1e-9t5k9ZjAxA,0,0,4,R0OFJIiVSBBlM8q8_xLyug
4597469,2016-08-31,0,elqbBhBfElMNSrjFqW3now,I really like the way the place looked Wouldn't know it from the outside We were greeted with a  smile from the hostess and was very friendly Our server was ok ( seemed a bit rushed )  We ordered our food and the tofu soup was pretty simple and good But when the entree arrived  ( i ordered some ginger dish with beef I thought the portions were kinda small But would have been worth it if it was good But unfortunately it was not  The first bite was cold?? I had to stir it up a bit And it was  a bit warmer but still only warm not hot  The rice and salad was good But the entree part was extremely bland It absolutely had  no seasoning or flavor My mom ordered the sweet and sour and she thought it  was delicious  and good Didn't get a check back from the server which was kind of let down : ( Would i return to this place?? I dont think i will If i do it will be a long time before i will,OVyUyT1M4PI-3W6cO-F2MA,0,0,3,ooggFtWV2P7vKO4z36e04w
4598921,2015-07-18,0,elqbBhBfElMNSrjFqW3now,"Enjoyable meal Pad Thai and Tom Ka Soup. Remember to ask for the spice tray  to make your dish just the right amount of heat!    Staff is dressed in traditional Thai apparel and rich wood work in the walls transports you from this strip mall restaurant to the Far East.   Oranges at
the end of the meal were delicious.",lpOv0Whjogq1Ca-X55BpFg,0,0,3,bqOOAAfVMuL3zIWQN_Cfdw
4624277,2012-09-14,0,elqbBhBfElMNSrjFqW3now,"In general their Thai food is very good. They have a fast and good service. I would recommend their Tom Yum soup or any of their curries. Each plate is between 10-12 bucks, but the quality of the food is very good! You cannot go wrong with this place! 
Tip of the day: dont forget to order some thai tea!",wtNopFY2ybprzk4FuEbWJQ,0,0,4,u7fZs6rdbUehfXkImAEc1Q
4631287,2017-09-05,0,elqbBhBfElMNSrjFqW3now,"Been here a few times and I love it. Inside is super cute and the staff is very friendly. Food arrived quickly, was delicious and had me so stuffed I had to unbutton my pants  the lunch specials are great and come with soup of the day and egg roll or fried wonton. They have a special chef menu and drinks menu but I haven't ordered off it. The panang curry, tom yum and tom kha are also amazing.",W8kK7Ntnrk_kY3b7PNX9IQ,0,0,5,jGcizBKcSBZgMaaxQRU3QA
4634793,2011-10-21,0,elqbBhBfElMNSrjFqW3now,Great Food!! I love the red curry as hot as they'll make it and the pad Thai is always delicious. The prices are very reasonable and I always end up with leftovers. They have awesome lunch specials and the service is always wonderful.  Great place for a date!!,7QXtasoVTQJuEjbmbLsDGA,0,0,4,vrbdbnzBgJE6iVZFz-Fkyg
4643604,2010-08-19,0,elqbBhBfElMNSrjFqW3now,"We've been coming here since it was a little hole-in-the-wall. It's awesome. About the best Thai food in Vegas. Chicken Satay is great. Tom Ka Kai soup is wonderful. All the noodle dishes are great as are the curry entrees. The only complaint is that it's always busy and every once in awhile the service is a bit spotty. Overall, great!",uzReH7zIh5tJX9ICBgTwNQ,0,0,4,Yqz_cGRjdjd0bfjT7ldjxA
4653342,2014-11-06,0,elqbBhBfElMNSrjFqW3now,"Pin Kaow ~ The Best Thai Food in Las Vegas!!

I am Asian, and Pin Kaow is my favorite Thai/Asian restaurant in Las Vegas!!

The food is always consistently good.  The prices of their entrees are very affordable.
They have great Lunch Specials which includes, soup, appetizer, main dish & rice for less than $10.  Served from 11am -3pm.

For dinner, portions are larger and there are lots of choices.  Dinner entrees are very reasonably priced.

For great Thai food... go to Pin Kaow on Rainbow & Lake Mead.

http://www.pinkaow.com",n0ipqJw5oCqKYsjJqs--_A,0,0,5,NfG0qH_rlZbfPrVDcjHl9Q
4655735,2018-02-06,0,elqbBhBfElMNSrjFqW3now,the best Thai food in town...I love the chicken green curry and pad thai.....you have got to try their chia tea and coconut  ice cream.   i have been to many Thai restaurants but this by far is my favorite!,bdnF0w2FQkR6wxunbTRwsQ,0,0,5,aYZAW2LN3MVt4IoznJp9oQ
4661869,2018-07-01,0,elqbBhBfElMNSrjFqW3now,I'm convinced that Pink Kaow makes THE BEST pad see ew here in Las Vegas :) I just recently moved to summerlin area and I've came to get food here 4 times and I've only been here for a month! Soooo good!!!,-IeEjOdMQd_WNGEhB9Cotg,0,0,5,AGj4cb8kYKawB16AEvk57w
4662442,2014-05-22,1,elqbBhBfElMNSrjFqW3now,"I've lived nearby it before and had never gone in, I had heard good things from people who's food opinions I trusted and decided that today is the day. Their lunch specials were great, something everyone could enjoy and great prices. There were no pictures of the entrees so I was a little worried but when my food arrived it was lovely, delicious pad Thai awesomeness. Everyone at our table cleaned their plates (except for me because, you know, I'm a dainty flower and large portions for me means doggie bag left overs for the boyfriend.) Their Thai tea was perfect, it made me smile and I had to use some self control instead of just chugging the whole glass. The food was authentic and fresh and  delicious and their prices make it even better. Now I know where to go when my Thai food cravings hit again. And the name of the place is fun to say...",PKhNTl32IRMXFOK1cUuOPQ,1,1,4,WM1vxeOcADuk-cr5gGQEMQ
4672720,2016-04-27,0,elqbBhBfElMNSrjFqW3now,"Just be sure to order it hotter because they typically run less spicy.  The food is very tasty and the portions are decent. They use powdered peppers to spice with, not fresh. We come here often.",nuyqwMN0AscCgEkhnMfWWg,0,0,4,oaSU55wuu2RBFEbMeyr6Mg
4673335,2017-10-18,0,elqbBhBfElMNSrjFqW3now,"Atmosphere - 5/5 the most authentic interior I've ever seen for Thai restaurant. Staffs in their traditional outfit even made me smile. 

Food - 2.5/5 I was really excited to go to this spot. My original destination was a different spot near the strip, but with my Uber driver's strong recommendation my friend and I decided to try out. Portion was very small, especially Thai food being one of my favorite types of food. I've been to many different Thai places. We ordered many plates between two of us. Before we saw the portion, we were 100% sure that we'd have many Togo boxes coming back to the hotel with us. But, we finished most of the food. You'd think that because the food was tasty.. NO. NO. If we weren't hungry enough, we wouldn't have even eaten the food. They were mostly very salty. Besides food being salty and a small portion, it seemed like they were using a pretty good quality of seafood and others. We had ordered, gulf of Thai, fried cream cheese, papaya salad, chicken satay, and shrimp pad see weu.

Service - 4/5 Staff here were very friendly but a bit slow on refills on drinks. 

Overall, I'm sad to say my 20min drive from my hotel was just a waste of time. I'm being pretty generous on my overall 3 stars.",esD3YU8xIT5KtKRDs0iXjw,0,0,3,cV5WHKyQsaHIa92k9XsfeA
4687233,2018-04-30,0,elqbBhBfElMNSrjFqW3now,"Really becoming one of my favorite places in NW part of town. The service is always excellent, the food is consistently well prepared and the atmosphere is excellent. The crab fried rice was awesome and the beef jerky appetizer is yum! No complaints and highly recommended!",NBUBjS50tVvX5umoTXbjAA,0,0,5,476_qcVaEZtcY9Vkm-lI3A
4718677,2017-02-03,0,elqbBhBfElMNSrjFqW3now,"The food is excellent and and the prices for the lunch specials are very reasonable. I have tried at least 10 different dishes and I am always pleased. The service, however is sometimes a bit slow. I once waited 15 min for my server to return my card to me after I paid my bill. I had to practically beg him to run it so I could leave and get back to work, which is why I am only giving 4 stars.",-kcEI1z8adWJWs4-ev1o4A,0,0,4,u3Z1R-TTfk8-IGiZaUgSeg
4735959,2008-01-13,0,elqbBhBfElMNSrjFqW3now,"introduced by a local. one of the best thai meals i had recently.
garlic fish, spicy pad thai, green curry on spicy level 7 - everything was excellent. 
attentive service, good price, quiet and cozy atmosphere.",0dR-v7AlPwDUDWbXKgi_aA,0,0,5,8NM9Lkzt_3BBZv5OVFcT1A
4738252,2011-02-22,0,elqbBhBfElMNSrjFqW3now,"Been coming here since they were a tiny undiscovered hole in the wall. As they have grown the original charm has gone down somewhat, prices are up a little portion sizes down some but it remains our go to place for Thai. Good food in an elegant atmosphere hidden in a non descript strip mall. Well worth a visit!",A6D2DRxPAgJJ2I7hzEBz4g,0,0,4,Q2ggVeViPpRnKwz3zopncA
4740949,2018-05-20,0,elqbBhBfElMNSrjFqW3now,Omg this is by far my favorite Thai place!... though the only thing I've ever had is the green curry with avocado. SO GOOD I DREAM ABOUT IT. This is not a joke. I've literally had dreams about it. Restaurant has a great atmosphere too and they give you orange slices for desert... How refreshing!,pC4K544W5_b2B2BvG4Lp_g,1,0,5,UvXxmxrvMnzCEvx85siBxg
4742775,2014-06-20,1,elqbBhBfElMNSrjFqW3now,"Unprofessional staff
Overpriced food
Will never go back there again. This is my 3rd bad experience here.",uOCvVJns1mA0fdhnnW_dnw,1,0,1,kAYxtgMq8uiFJ0c5OcBCVA
4758934,2015-10-09,0,elqbBhBfElMNSrjFqW3now,"Great food! I ordered the Combination fried rice, spicy basil pork (no spice) and the silver noodle soup. 
I would pass on the silver noodle soup again, I ordered the hot pot and I felt the proportions were off. There wasn't enough chicken and it was hard scooping the noodles/veggies out of the bowl. 
I absolutely loved the spicy basil dish and I plan on getting it again when I go back!
The combination fried rice was also very good! 

I wasn't to happy with our server, he kept leaving the table before everyone could order, totally not cool. 

Overall a great restaurant with great food!",en3OMUKWjeON-1-6wo8VrQ,0,0,4,YZj5RPL-_pjmsmQRALOMeA
4763572,2016-06-29,0,elqbBhBfElMNSrjFqW3now,"My husband and I really like the food here. Recently we went to eat here and all the prices have gone up. Also, there was a bus boy just standing there watching us eat and as soon as a plate was done, he was there collecting it. Very annoying. Now, they are doing transactions at the table. It really cheapened the experience and makes us not want to go back.",DedE1IfGcnUs1QtI_lATsg,0,0,3,1A0zUBE6VLxeWsYee9KKKQ
4813867,2007-02-18,2,elqbBhBfElMNSrjFqW3now,"Now I'm picky about Thai food. I like traditional Thai. This is definitely the place. The Thai Iced Tea is definitely perfect. I love their Satay....Pineapple friend rice.....curry.....pad thai....thai beef salad....And when I want something hot...they make it hot. Not that gringo hot...It's like they go out of their way to give me food sweats and make me cry like a baby.
There's another location on S Rainbow. I haven't tried it yet. But I'm hoping it's the same!!!",UvY0E6Wuhv_0Bita52RPOw,2,1,5,0tqhavI8azsD617E-ye-dQ
4856593,2015-04-22,0,elqbBhBfElMNSrjFqW3now,"We had dinner here on a Friday night. The place was super busy. The food was good. I had Kung Pao and my wife had Pad Tai. The potsticker appetizer was Fantastic! The food is 4 stars, but the server was 3 stars. She frequently forgot about us and I went to the hostess for service requests more than once. But despite that, it's a nice place and when I return, I'll hope for a different waitress.",9eRRQL3JwekCLFPY25tO2A,0,0,4,BG2kqt-7-oHMLGIdDBHciw
4862605,2017-07-11,0,elqbBhBfElMNSrjFqW3now,"I loved the food! Ordered everything at '7'. Spicy Eggplant was good and tasty and spicy enough to inspire liquid refreshment. Kung Pao Thai version had just enough peanuts, good size pieces of chicken, and got progressively spicier as it was eaten. The magic is in the sauce! The Chili Mint noodles were good, not very spicy (we'll have to amp that one up next time) but tasty and flavorful as a 'cool down' in comparison. Highly recommended!",OpGANAobgMjdzf2gvpSEYg,0,0,4,gQRf2c8SrXCgQr8YJH_v3A
4888969,2007-02-02,0,elqbBhBfElMNSrjFqW3now,"now... this is my FAVORITE thai restaurant. not as much variety as the last restaurant i reviewed but everything here is superb. their thai tea is not too sweet like most places. portions are big enough to share between two people. it gets really busy for dinner so expect a wait but its well worth it. staff is very friendly and attentive and you wont be broke when you leave..

great items to try:

cream cheese shrimp tempura (only at the south rainbow location)

panang curry (with chicken!) i love the string beans that come with it. careful guys.. they like to make it really spicy so dont go above a 4 (scale of 1-10) if you really cant eat spicy...

pad thai. everyones favorite. i like it with beef

they have a dinner special for 2. its about $20 per person and you get house wine or champagne. 2 salads. 2 entrees and rice. i chose pad thai and chicken panang and it was more than enough for the 2 of us. the salad had a yummy carrot ginger dressing. and i'm not a fan of wine or champagne but i had the white zin and it was delish.",SssXdhbeYJOCF6sfSFwC-Q,1,0,5,5F890l-vQ8-o4lpDKPiOXQ
4890385,2015-05-09,0,elqbBhBfElMNSrjFqW3now,"The food was good, but because of our kids, who were behaving well, the manager judged us, she lied by telling us that they were out of glass cups, and gave us disposable cups, then continued to serve the customers next to us glass cup, I found that disrespectful from the manager Nattaya.",JZuY5aBZwI1as1o_GdE29w,0,0,1,lGhj05nD6e9sX3Yywgm3xA
4906424,2018-02-15,0,elqbBhBfElMNSrjFqW3now,"I love Pin Kaow! They are fast, consistent and the food is always yummy! This is my go-to Pad Thai restaurant in Las Vegas.

I order the chicken pad thai and spring rolls. It's the best! I recommend it. I've dined in the restaurant and have ordered out. The food is consistent across the board. 

Go check them out ;)",UW5NYYocUXNvhhtehl2LeA,1,0,5,7bFW_IjcSfa2Kp1-ORHWWQ
4936474,2017-11-07,0,elqbBhBfElMNSrjFqW3now,"Come here on a regular basis as my mother in law lives close by. I have only ordered the yellow curry, fried rice and pad se ew (I think that's what there called) the noodles with soy sauce. I really love those 3 dishes I order and I'm very picky about my Thai food. It's always had really good flavor and the servings are pretty good also.",eAxjXAk2VjnsZraN0DqCiQ,0,0,4,ayuQZ48fMBTDcW3bErVXmw
4950035,2016-09-10,0,elqbBhBfElMNSrjFqW3now,"Amazing food. Great staff. Affordable pricing.

I would recommend this place if you like Thai food. Best place in town. 
The Thai scale is true to its numbers.",CjBxn0PAT5IFlILVbU4Ebg,1,0,5,n8clD9Z1MHsSoNSd9b5P2w
4951092,2015-01-22,0,elqbBhBfElMNSrjFqW3now,"My family and I are regular customers since 2007, we just love the food!!! It's surprisingly delicious. The service is always excellent. I've tried other thai places... none of them are as good as Pin Kaow! Atmosphere is really calming and just amazing :)  I would give them 10 stars if I could",sWkwGckdAEVOSCwrSQcY0A,0,0,5,FQDD6lrvOUcU6w4twoKfdA
4971475,2015-10-30,0,elqbBhBfElMNSrjFqW3now,"Exceptional food with amazingly authentic Thai atmosphere.  We dined here for lunch which happens to be an amazing deal.  Chicken Pad Thai comes with an egg roll, Rangoon, and soup all for just $7.95!  I was shocked and amazed not only at the price, but the quality of food that was served.

Other Thai restaurants charge at least $11-$12 for the same thing, but without all the extras.  This place is far superior to any other Thai restaurant in the Las Vegas Valley.

As for service, it was excellent.  Our waters didn't get close to half empty before being refilled.  Also the attention to detail on our orders was second to none.

I'd heard great things about this place in the past, and I must say that I'm hooked.  Expect to see me at least once a week to enjoy your amazing food.  Thank you so much for keeping up a phenomenal establishment.",Y6otbk7H7mDMbXBVKL9yeA,0,0,5,pIpzx1ckUKnaCeG_aYe44Q
4992054,2015-12-24,0,elqbBhBfElMNSrjFqW3now,Nice atmosphere. Service was awesome as they were always checking up on us. Chicken pad Thai and fried rice was delish.,yQOy6zrVM_tMcLwlV5USSg,0,0,4,EswiZLWSW4AcngzlC2ecaA
4992178,2015-02-10,0,elqbBhBfElMNSrjFqW3now,"I avoided this place for quite some time because the exterior comes across very much like a dive bar. I gave in last night due to a sticky rice craving and was pleasantly surprised. The interior was a beautiful, cozy little restaurant. The servers were very pleasant but could have been a bit more attentive. The service was slow overall but still very good. The portions were good and food was very fresh but could use a little more kick of flavor. Overall, I was very satisfied with my visit and I'm looking forward to many more visits in the future.",qIZNrA256rP0x6qkgakFFA,0,0,4,53fl9oc8n8krD09_dysx-A
5009633,2014-11-09,0,elqbBhBfElMNSrjFqW3now,"Great food, but service was ridiculously slow.  Three of us got our entrées and the server went to get the fourth.  The three of us were nearly done eating by the time the fourth came.  But it tasted great!",yR0MUw5Muu24M5UcxqXhfw,0,0,4,aMEM9BdXpSoIsit2LtUyuA
5023068,2017-06-09,0,elqbBhBfElMNSrjFqW3now,"This place was recommended by a friend and I've been twice and disappointed both times. The food the first time just wasn't very good. 
The second time I went, they rushed our food out so fast. My friend had no time to finish her soup before her next plate was aggressively thrown down on the table. The appetizer I got was cold and I don't think it should have been. 
I ordered the avocado curry. Chicken had no flavor and I had a bone in my meat. Will not be returning.",Hbc-lEpUQD99_26tP71SWg,0,0,2,2JYXGuO7Pnqae5DnhZJuwQ
5035009,2016-10-04,0,elqbBhBfElMNSrjFqW3now,"Delicious as usual & hit the spot! 
Great lunch amount especially for the price!  

Yum yum",dQfQok80y8YNwkZCh99Yeg,0,0,4,NfQQiRtlXNNR1YmLPdH7lA
5044943,2016-06-08,0,elqbBhBfElMNSrjFqW3now,"Really really good...especially for the Summerlin area 
Can't wait to go back the service was spot on as well",nh4xURBFqZbBaP1Lzem_Uw,0,0,5,EabTWbDoSYIN2taqCHHpTA
5048619,2015-02-16,0,elqbBhBfElMNSrjFqW3now,"I'm sure many dishes here are amazing, but my favorite are any of the curry dishes and the spring roles. Many dishes offer a vegetarian option, which is nice. Both for carry-out and dine-in the service is quick and friendly. Order/arrive early on the weekends, this place gets packed! I will definitely miss this place.",tYSBQrizyMMl-efDsU0KhQ,0,0,5,OBsYoqOVoPbcWm_m34KCTQ
