,date,funny,business_id,text,user_id,useful,cool,stars,review_id
3,2011-02-25,0,elqbBhBfElMNSrjFqW3now,"Back in 2005-2007 this place was my FAVORITE thai place EVER. I'd go here ALLLLL the time. I never had any complaints. Once they started to get more known and got busy, their service started to suck and their portion sizes got cut in half. I have a huge problem with paying MORE for way less food. The last time I went there I had the Pork Pad se Ew and it tasted good, but I finished my plate and was still hungry. I used to know the manager here and she would greet me with a ""Hello Melissa, nice to see you again, diet coke & pad thai or pad se ew?"" Now a days, I know she still knows me but she disregards my presence. Also, I had asked her what was up with the new portion sizes and she had no answer for me. Great food but not worth the money. I havent been back in over a year because I refuse to pay $10-15 for dinner and still be hungry after. Sorry PinKaow, you are not what you used to be!!",msQe1u7Z_XuqjGoqhB0J5g,2,0,2,Er4NBWCmCD4nM8_p1GRdow
6268,2014-07-23,0,elqbBhBfElMNSrjFqW3now,This place is delicious!! The pad Thai was the best I have ever had! It has the perfect amount if spice! The spring rolls are to die for! I got my food to go and cannot wait to have it again!!!,0L1v-XnTfzUmY-TbfdiZ2w,0,0,5,2Rjs7CPKi15xYU8H5zDACA
15878,2016-11-30,0,elqbBhBfElMNSrjFqW3now,Delicious soft shell crab salad. The thai iced tea is a must. Larb is a bit heavy on the vinegar. Overall though one of the better Thai restaurants in the Vegas valley.,CbdasTsuaHjg84OZy80ngA,0,0,4,UA1geGMjNbg2W62kyaDZmQ
22061,2011-08-17,0,elqbBhBfElMNSrjFqW3now,"Pretty bomb Thai food! Love the beef jerky, shrimp pad thai and coconut chicken soup with a side of sticky rice!! You wouldn't think it's nice in the inside from the out but it's a nice chill environment. The service is cool I have no complaints. The place is always busy and I don't every wait more than 10 min to be seated.",oA_cyKMPIBsjgynv7ro1yg,0,0,4,ClhDhy37cMyRnLJgbyDYig
27103,2012-12-15,0,elqbBhBfElMNSrjFqW3now,"The food is great but the service is horrible. 

I wanted to get some food delivered for dinner, so I called the store around 4:35pm and they refused to take my order until 5pm (and then rudely hung up on me). Despite the attitude I decided to call back at exactly 5 to place my order, when the same rude woman picked up she told me that it would be at least 2 hours since they had 4 orders ahead of me. I am not going to tolerate the double standards, horrible service and small portions anymore. It is unlikely that I will return.",ABW5pxgm9oi6tBkExeYeAQ,0,0,1,irQJ91GS-G3cdwGL8DwQjQ
29037,2011-02-11,0,elqbBhBfElMNSrjFqW3now,"I love Thai food, and Pin Kaow is one of the better places in town I've been to.

I get the spicy mint chicken nearly every time I visit, and it's consistently delicious. Their spice scale is about the same as other Thai restaurants I've experienced --an 8 is sufficiently spicy, but not unbearable.

I love the ambience in here. Dimly lit, nicely decorated and quiet. The service isn't exceptionally noteworthy, but it's -- in my experience -- at least as good as any other Thai restaurant in town.",UYACF30806j2mfbB5vdmJA,0,0,5,y4pDXUemFR48H8fpBi0rCw
32098,2015-02-22,0,elqbBhBfElMNSrjFqW3now,"All of the normal Thai dishes like yellow chicken curry are not good here. It tastes watered down. Their vegetable spring rolls tastes like something I would get from Costco. The Tom yum Kung soup is not good either. The only thing decent were the fat noodles my husband ordered. The service was good before because we got the only good waiter, his name is Bon. Everyone else seems like their held at gunpoint to be there.",-ouzfV5nm0Fmv3JRLXegmQ,0,0,2,d8ZEsPDvfkucnwN4lMeWuQ
36828,2015-07-22,0,elqbBhBfElMNSrjFqW3now,"after a few years of not eating here cuz it was terrible, I thought I'd give it another try. here's my thoughts.. still the worst food ever.. pad Thai fishy tasting. ruined the taste of Thai tea, very expensive for the horrible food. will never eat here again.",FYjNGFsoVpRkS70vcgvOZA,0,0,1,L8P_UA-QDMZtK3Ywllcv_g
59445,2013-12-04,0,elqbBhBfElMNSrjFqW3now,"This is by far my most favorite Thai restaurant EVER. The food is delicious, but the red curry I had was too sweet. The pad see ew and chili mint noodles are delicious, but the best things are the beef jerky, stuffed chicken wings, and my favorite the Lemongrass Trout. I get the Lemongrass Trout with Tilapia instead because I don't like to bother with picking out the bones. The dish is delicious and I wish I could eat it every day. I want to try other dishes, but I keep going back to my favorites. Guess I need to go with a bigger group!",3rC6h6TvlR_veGqC8QUNAQ,0,0,5,Lk5VoLgKMEJbrCeZlO9GXA
66945,2016-10-31,0,elqbBhBfElMNSrjFqW3now,Come to this place often and they never disappoint. Can never go wrong with Tom Kha chicken hot pot with a side of rice and a Thai tea to drink. Atmosphere is nice. Food comes out pretty quick. They also deliver which is nice to have at home. Definitely recommend this place.,w_B8hRcgXOzntK4MFNefXQ,0,0,5,iCboLODaUn9tye21OhJJag
70540,2013-09-23,0,elqbBhBfElMNSrjFqW3now,I love their lunch specials. Tasty thai food + fast and friendly service! Decor and ambiance is also nice.,zP7rdU6VkEWKwRAcuQzOMQ,0,0,5,2NM9_n4-A1tauXfHe61Rnw
77787,2016-02-15,0,elqbBhBfElMNSrjFqW3now,"Lemon Chicken, Crab Rangoon, and for an adventure, duck fried rice. Aj had something unpronounceable with beef and hot peppers, and some chicken satay.  All of it delicious. Been meaning to try this place out for a while, had heard good things; really glad we did. They were very busy as it was Friday night, but the service was excellent, the food hot and delicious. The restaurant is located in what is essentially a strip mall so I wasn't expecting the elegant interior. Next time I'll get more adventurous with the menu, but they did really well with my favorites first time out of the gate. The fried rice was excellent,  with huge pieces of tender duck. The crab Rangoon were light, fluffy and crisp, as was the lemon chicken. The satay were very tender and tasty. I didn't risk the beef because AJ asked for the heat too be at 8-10. He really enjoyed it though. We'll definitely go again.",cTkSIP4yp-vXR63KwfiHlA,0,0,5,sAg18tpRupH2p167kYKocQ
79982,2007-10-08,1,elqbBhBfElMNSrjFqW3now,"So excited to find a good Thai place semi-near my house.  Just as wonderfully yummy as the other Pin Kaow location and much more centrally located.  The decor isn't quite as nice, but who really cares.  I had excellent spring rolls and green curry with tofu.  Just spicy enough and very flavorful.  Very good service also.

Unfortunately, not everyone was as pleased with the restaurant as I was!  This weird lady at the table next to me, eating alone, just had to inform the server that the soup was ""nice, but it's not worth 5 dollars"".  Then, when the server tried to take something, she said, ""Leave that please!""  I then heard her mumble, ""Get away from me!  Just get away!"".  I don't know what her deal was, but Pin Kaow is not the kind of place that should cause a traumatic dining experience like this!",2WniIUDY7MqU1rNL1nwolQ,2,2,4,27lb2HUu_cpm5p6EvOb0cw
88157,2016-06-01,0,elqbBhBfElMNSrjFqW3now,"I totally LOVE this Thai restaurant... the Tom ka kai (sp?) (Both the coconut milk based or the reddish lemongrass based) soup over rice is my staple when either dining in or ordering to go. In the restaurant though, is better, they serve it in a hot pot over a hot flame candle and for some reason I think the simple presentation of that alone makes the soup that much better lol. I'm pretty sure it's safe to say that if you like thai food then you'll love pin kaow. The service is always fantastic too, always a smiling beautiful face to greet you.",WWdxOQ53TAE3l-abLo7e2w,0,0,5,RrO80FeL8BfL1PhEJ_lLcQ
88763,2016-06-29,0,elqbBhBfElMNSrjFqW3now,"Went here with my wife for dinner on a Friday evening.  First of all, we were seated right away, which is hard to come by in this town.  The decor was amazing, traditional Thai.  Even down to the dress of the staff!  
And the food...  Let me tell you, I have tried many Thai places in my time, and I will say this is absolutely the best I have ever had!  
We had the Pinang curry with chicken, yellow curry with chicken, papaya salad, and crab rangoon.  My wife and I will make this our regular Friday night outing for sure!
I would highly recommend to anyone.",KWgZObm3i-q50ZJoX7cGDg,0,0,5,oZQsQPInraNmHFkMrrPO9g
109199,2010-01-23,0,elqbBhBfElMNSrjFqW3now,"Used to be a really good Thai restaurant but after its expansion several months ago the quality has declined dramatically. I ordered takeout from them this week and had to wait 40 minutes after the time they said the food would be ready. There were a lot of people waiting for food and while I was waiting I heard several complaints from diners who received the wrong food.  Anyway once I got home with the food we found that the shrimp in the shrimp salad had not been cooked properly, the beef satay was extremely rare and the shrimp cakes were cold/uncooked. After calling to complain they said they would reverse the charge on my credit card. My suggestion is to wait several months until their kitchen hopefully expands to accommodate the orders from the larger restaurant.",7Eypc88M-G9Lp7fw6kfBdg,0,0,2,Ls5PfncJvMhipW8DZ-0sCw
122119,2012-07-30,0,elqbBhBfElMNSrjFqW3now,"My wife and I were expecting much more.  The restaurant was highly recommended to us by a friend.  We were rushed in our ordering by the waiter who was not helpful and rude to the other bus staff.  We asked for medium spicy so that we can gauge the spiciness level and we received bland.  I ordered the red curry that ended up being sweet milk and my wife ordered chili mint noodles (their version of drunken noodles) which was basically sweet fried tofu with barely any mint or chili.

We have tasted wonderful food in NYC, San Diego, Dallas and even Little Rock Arkansas and this was by far the worst Thai food we've had. As a vegetarian I would rate this pretty low.",G-4c_G7iXLbSVuMxa5t0IA,0,0,2,knxH2tEIIoXbMc_tg9082Q
128938,2015-03-16,0,elqbBhBfElMNSrjFqW3now,"From the look of the outside of this place you would not expect what you get on the inside.  It is really nice. 

We had the ribs, chicken wings and ginger chicken.  It was all very good but I think the wings were the best part.",cY4Wy8wYy5Kh6k4KU0kvxQ,0,0,5,ge8QFwex4RW2TigvxoFcXA
141452,2011-10-29,0,elqbBhBfElMNSrjFqW3now,"This place has been busy whenever I've been. That is a bit surprising. The curries are disappointing. Are they making them overly creamy and bland to satisfy the white folks' palate? The green curry isn't even green! It's cream colored. Maybe she misheard me and thought I ordered a cream curry?! I ordered a heat level 9 and didn't feel any heat whatsoever, let alone break a sweat or get a runny nose; did they not believe I could handle the heat? Or maybe she misheard me again and thought I said five? Also, curries come with plain rice; if you want sticky rice, specify that you want that instead of plain rice; otherwise, you get both, which is a waste. 

The service was ok. 

I might go back for a soup or other non-curry dish, but for now, based on my non-green too-creamy curry, I can't go higher than ""Meh. I've experienced better."" I've actually made better green curry! 

This place is close to where I live, but I think I'll travel down to Sahara unless pressed for time to a more modest but more authentic place to get my Thai curry fix.  The gas money will be covered and then some in the price difference as well.",BJOLgnc5gtHlkwhBIqNW5Q,1,0,2,nFgWEuB-UF1sMXZsP-LCiw
163545,2014-03-07,1,elqbBhBfElMNSrjFqW3now,"If you read my other reviews you'll see that I'm a Thai food foodie. Whenever I travel I search Yelp for Thai restaurants in search of great Thai food. So, keep in mind that I'm comparing this place with some of my favorite restaurants. 

This place has fast service.  My cachew chicken was brought out in under 5 minutes, hot and with a generous serving of sticky rice. I ordered medium spicy and it was about a two on a scale of five. 

I would rate the flavor three out of five. I've had better and worse. 

I would recommend this place if you're hungry for Thai food and live nearby. 

This is my first review from Las Vegas, look for at least a couple more.",QZIbEjY4QhSjgSuMxgLyVw,0,0,3,9Cqpe1Av7sRnBpYjDkJ10g
165912,2013-05-26,0,elqbBhBfElMNSrjFqW3now,"I've been coming here for 10 yrs.  Obviously I like it. Food is good. Prices are fair. 
Complaints:  
          service is normally very good except getting the check (ask for it early)
          Spicy level I think changes depends on the cook (we like a little spicy but not too much). #2 was more like a #4 once. Kids couldn't eat it. 

That being said, I've never had to send food back or a complaint about cleanliness. That's hard to say these days. 

From the outside it looks like a dump. I like that because they're often busy.",qGRyN_oAZ-v42be-YMJXcg,0,0,4,EdjuUNcppS-MSt1hi_kyfA
171107,2015-02-28,0,elqbBhBfElMNSrjFqW3now,"Very expensive and the food wasn't even that good. Ordered to-go for Mongolian Beef, Tom Yu Goong and Thai Tea. Portions were too small for a ridiculously high prices. Wait time was almost 45 minutes. I don't mind waiting this long if the food tasted good! Never going back to this place again!",IjLHDRNDzzgMO_Kh4Oa4Eg,1,0,1,bI4onC1UTzTOE5Ae_3uq6Q
181514,2015-01-07,0,elqbBhBfElMNSrjFqW3now,"The consistency is what does it here.  Like any restaurant you will have an ""off"" serving, but I have been here many times and the quality is consistently good.  Their spice level tends to be on the mild side so you'll have to up your number by one or two.  Although less authentic then say ""Lotus of Siam"" and (no comparison in the wine selection) the quality is on par.  Great find in the Henderson area.",XATgzdq2Wv5E_yIhTNIC1g,0,0,4,_2jZAiQKUatlTnRpqgd5Lg
192936,2008-07-19,0,elqbBhBfElMNSrjFqW3now,"I'm not the biggest Thai food eater but this place was ok. It didn't really blow my mind. The pad-thai noodles with shrimp, #5 in spicy-ness was good and the green curry with beef, #7 in spicy-ness was not too spicy and I was slightly disappointed. I like the fact that it's close by and I loved their Thai tea. 

The service was good, they were friendly, and my water glass was always full. They also tried their best to seat everyone asap.",4lluRV6mBDUmen1R6WAztA,0,0,3,zYnFU2CSOtoYZAzghyguHQ
222579,2015-02-21,0,elqbBhBfElMNSrjFqW3now,Quiet and not busy at around 8 on a week night I was impressed by the food.  They gave me spot on recommendations and enjoyed it.  Will definitely be back when I'm in Vegas.,OFObFNZ9MM7EJTuF9V9XIw,0,0,4,O6cX16MAQpqYFr3wrNtXlA
228825,2016-12-04,0,elqbBhBfElMNSrjFqW3now,"I've lived in Thailand. This restaurant is run by native Thai people and the flavors are quite good. We had Thom ka soup, phad thai, and panang curry. All were good. Not the best I've ever had (but I've eaten a lot of Thai food). You can't go wrong here.",SUmjaZ4rdNOW4LP08sa0QQ,0,0,4,9rC9-v6NrgDABDhfsj0Lnw
245788,2014-09-25,0,elqbBhBfElMNSrjFqW3now,"The perfect place to go for a lovely evening., featuring extraordinary service, excellent Thai food, and a romantic (in that it's quiet, has background music playing, and is softly lit) atmosphere. The closest to  authentic Thai atmosphere I've seen outside of Bangkok. 
Highlights: all the food, of course, but in addition a full bar with great cocktails, attentive but NOT obtrusive wait staff (we especially appreciate that they do not hover and scoop up one diner's plate while the others are still eating), taking drink and appetizer orders before the main entree orders AND not serving the entrees until the appetizers were consumed.
We cannot wait to go back--our new fave Thai place--even better than Archi's!",a2UulLNGc15lCz1uJ4Y7nw,0,0,5,BzceZnoyufmdUuzh2y_1lA
266455,2011-01-10,0,elqbBhBfElMNSrjFqW3now,I love this place!  Best curry ever!  I cant seem to order anything else when I eat here.  Service is great as well!  YUM!,ixBTPK60H9oMmy2-kbta0A,0,0,5,ebyGDWtyiEDFCUgM8-vnsg
276561,2014-05-01,0,elqbBhBfElMNSrjFqW3now,"Last nights dinner (take out) was disappointing.  We have ordered a couple times from here in the past, and this was not what we remembered.... or perhaps we have just been to enough other top-notch Thai restaurants since then?  

We ordered the Crying Tiger beef, catfish green curry, and chicken pad thai.    The crying tiger beef was ok -- it was basically a steak with a little heap of salad and a big wedge of cabbage.   The sauce was good, but we would have preferred if the steak were marinated in it more.  

Catfish Green Curry was pretty good, but a little salty.   Otherwise we would go back for that dish!

the Pad Thai was well, pitiful.   Cooked well, but hardly any flavor - not what one would expect from pad thai.     Added some of our own lime juice (it did not come with any lime) which made it more palatable.   Needed more sauce and it would have been good. 

Overall, not a bad meal, but we probably won't be back -- Especially not for their prices!",nGOSfjYybicoGNhSB6Mnjw,1,0,2,PBNOuOsrCJrbKduArWOibQ
276614,2014-03-22,0,elqbBhBfElMNSrjFqW3now,"I've been here at least more than five times and the food has always been delicious! They have great lunch specials from 11am-3pm, which comes with an entree, soup, rice, wontons or egg rolls for under $10. I also love how conveniently close it is to the gym - nice post-workout meal!",QEt0Dav4bj7lRRdiZ6mNrA,2,1,5,OqK272aFOue1m5sgZ-59FA
292750,2017-06-26,0,elqbBhBfElMNSrjFqW3now,Food was so great. And service was excellent even if when they were busy. We had Thai style BBQ chicken and yellow curry chicken. It was so good. This is an authentic Thai food you'll definitely have to try. 10/10 for this restaurant.,0JQytE64pkUVXHOX7t-X9g,0,0,5,OqQKyg6Fw9F4u5UdAL_FHg
294334,2016-04-04,0,elqbBhBfElMNSrjFqW3now,Fantastic food.  We get the coconut milk soup with shrimp.  Service is consistently good.  Prices are extremely reasonable for quality.,KERR-doMPDEBdSqcYHjBLw,0,0,5,XwILdKgv8Cq0Je1-jCrfEA
302169,2015-12-01,0,elqbBhBfElMNSrjFqW3now,"We eat here atleast 4 times a week because its close to our house.  I order the spicy basil ""Level 4"" which is just the right amount of hotness for me.  The food is excellent and you can't beat the value.",JS246huajESiHElOmkmUGg,0,0,5,Oxs7B38dfiVfND2cvzqpQQ
312411,2014-12-14,0,elqbBhBfElMNSrjFqW3now,"Love this place!  The red curry is great,  as well as the mint pork. Yum! Their regular 1-10 spice level isn't THAT spicy so I usually get a 10 and it is just right.  The service is great,  maybe not overwhelmingly friendly but fine.  The interior is not what you would expect from the strip-mallish exterior as it is warm and inviting. Certainly a regular Thai stop.",tzXuVHY6IsKCp-05cjRBQw,0,0,4,m28gRSO2UoluAAOw4rrKCQ
325949,2014-08-11,0,elqbBhBfElMNSrjFqW3now,"I've been coming here for so long I can't remember. The hot pots, the duck, the sticky rice, the people, everything about this place is awesome. Will always be a favorite and will always be a regular. One of my favorites.",00g3A6CTz-B4QOwqFIS7BA,0,0,5,KcCBxLSUShQsSBcL3RY8iQ
338057,2008-12-28,0,elqbBhBfElMNSrjFqW3now,"Step into a quiet, traditionally decorated Thai house where all the servers are dressed in formal Thai clothing, that almost makes me feel naked in jeans and a shirt. My family calls this place the pink cow, but only because we adore it so much. Strap in and buckle down for some spicy soup served in a bowl that is literally on fire (get either the Wor Wonton or the Tom Yum Koong -- though my dad just describes these as the soups with the shrimp and the spicy and the lettuce). Ordered:

Chicken Sat Tay -- Delicious! Only comes with four though, might want to get more.

Masaman with Tofu, level 6 -- Not that spicy. Could have definitely added a few notches to get a real kick in the face. 

Chicken BBQ -- I'm not a big fan of this but everyone else gulped it down. I just think it's not spicy enough. 

Spicy, soup, with the shrimp and the noodle things -- as my dad called it. I have no idea what the waitress brought (I think one of the wonton soups), but it was pretty tasty. The wonton soups don't give you a lot of shrimp so if your taste buds are flamingo-like in tendency you should order the Tom Yum Koong. 

All very good. Top it off with a Thai Ice Tea that could only be better if someone could figure out how to put alcohol in it. Kahula maybe? Cheers!",BMEmpeosi4LfwRlAMgtjbg,0,0,4,x-zvUVO3-wyIA01gHgqhWA
344476,2012-08-07,0,elqbBhBfElMNSrjFqW3now,"Went here yesterday for the first time. The restaurant is nicely decorated and the it really does make you forget you are in Vegas. Very nice atmosphere.

I ate the Red Curry at a number 10 with Shrimp and we also ordered Chicken Satay and Red Curry with Chicken at a three. The food was excellent. I did think the 10 wasn't very hot. It was hotter then the three which seemed very mild to me. This may just be my tolerance for spicy or hot food though but other places I've eaten at seemed much hotter, even at a 7. 

The portions were decent and the price came to about $50 bucks with desert and three drinks. The price seemed reasonable. I was satisfied with both the service and the value. 

The one complaint I have is very minor but I thought the amount of rice served with the meal wasn't enough. Still I'd recommend you stop in.",dnp-e7SBVygsGo0TQXGTWQ,3,2,4,5s0w6f3GtlXJpaJnm0hCKg
345288,2017-12-24,0,elqbBhBfElMNSrjFqW3now,"Awful NEW manager named ""MON"" who treated our family (longtime customers for over 10 years) so incredibly rudely!  We were less than 10 minutes late due to holiday traffic and she gave away our reservation. No problem, our bad. We decided to wait since it was our fault for being late. As tables opened up she gave tables to other customers with NO reservations. She finally pointed out a table for us instead of the booth we requested, so we said that's fine. Then, she CHANGED her mind and gave us a table located near the door where cold wind was blowing through.  Wow. Don't ever be a few minutes late here if you have a reservation. Sad to say after so many years of being loyal customers this new manager named MON will give us pause as to whether we should ever return. Terrible manager!!!",f1wIHnyD5inqtSzDE9SkHg,0,0,1,UnlPA4egrROssi41wWvW3Q
345605,2014-08-24,1,elqbBhBfElMNSrjFqW3now,"I have been to Pin Kaow many times and the food is very good. However, I went there last night at 9:25pm and immediately upon walking in the manager told me the restaurant will be closing in 15 minutes.  Clearly on the front door it says they close at 10pm. However, the real issue is they should have been much more accommodating to any customer, especially a regular customer. Instead they unnecessarily turned down business. I went to Gaati Thai restaurant right after and they were much more accommodating and have much better food. They also close at 10pm and even though I got there at 9:45, they still set up a table and did not rush the meal at all. 

I will never go back to Pin Kaow and will no longer recommend it to friends and family. That is thousands of dollars lost for their lack of customer service and decency.",WBdZonA8c2x7W-iguaMv4g,6,0,2,imvEVDX0RSLpAd1bY-If8Q
345618,2015-05-27,0,elqbBhBfElMNSrjFqW3now,"fast service, nice atmosphere. friendly staff. i had thai style bbq chicken and steam rice. the food tasted ok the chicken didnt have that fresh off the grill taste. tasted like its been sitting in the fridge precooked and microwaved. the steam rice was good.",YxkWlFauMzoqhwWtZbPHiQ,0,0,3,QiG10tSmbBK-QcjAosSLLw
348554,2011-10-27,0,elqbBhBfElMNSrjFqW3now,"This is a hidden gem with great authentic food. Four of us went out to dinner on a weekend night and was seated right away. Always a good sign when there is a consistent flow of people waiting for their takeout food and practically all of the tables are already occupied. 

It has a cozy atmosphere where you do not feel rushed. The staff was friendly and quick to get refills or check on us. The food will leave you very satisfied. The Thai tea and Pad See Ew was delicious and wroth getting it again next time I am in the area.",6e0khvHCOJU1YTCx8gDfSw,0,0,4,nnvDCftayHr32604tWK-RQ
375817,2016-09-30,0,elqbBhBfElMNSrjFqW3now,"Really friendly service, and excellent food! All around delicious, good portions, and great prices!",Pk_qH7M6i2G87QhJL78J9w,0,0,5,61Ax-Yw3pronvEFlAAGVsw
378370,2014-09-01,0,elqbBhBfElMNSrjFqW3now,"Company policy is not to serve eggplant in panang curry among other vegetable combinations. Not that  there is an extra charge which I would understand, but that they simply would not make it due to their ""company policy"" . I think that this restaurant has forgot their purpose for being in business: to make people's food the way their customers like to eat it, while charging what is fair, and getting their customers to want to return. Having company policies about which ingredients are allowed and which aren't is absurd. We didn't even stay to attempt to eat, why should I pay for a meal that is made the way the cook wants to make it rather than the way I want to eat it.",GTSv5QBAjgtTzWX1vB6gpw,0,0,1,1z_7Ct-mBT87WQIfxceimw
394641,2013-07-09,0,elqbBhBfElMNSrjFqW3now,"Their pad prik king is tasty, and their prices are very reasonable.",pyISYCYFbATv9gUs58O7sQ,0,0,4,6lA7U-P1MlSrLwIPZ8Nvyw
403793,2015-04-09,0,elqbBhBfElMNSrjFqW3now,First review I've ever written on yelp!!!!! This  is by far the best Thai food restaurant EVER!!!! Great service and I kept reading all the reviews about chili mint noodles and hands down the best noodles ever!!!!!!!! And if you like spicy food get level 8 because level 7 ain't cutting it lol!!!!,6gyptzY40How8eqPDwlDFA,0,0,5,-tOkHIaFo9bOVGtij22LcA
