,date,funny,business_id,text,user_id,useful,cool,stars,review_id
1527492,2015-11-24,0,elqbBhBfElMNSrjFqW3now,"There are many great Thai places in Vegas. Do not waste your time with this one. I didn't actually think Thai food could be inedible, it's my favorite cuisine. Pin Kaow proved me wrong. The server did not offer me another meal choice, simply brought me the bill when I told him I wasn't enjoying my lunch. I left with a literal and figurative bad taste in my mouth, feeling both sad and nauseous.",AR-i6whJLS-KFqCl6RjUUQ,0,0,1,zqx7ZWeM_k7-IcYm2V85hw
1533100,2016-12-27,0,elqbBhBfElMNSrjFqW3now,I've been coming to this place for a long time. Around 4 or 5 months ago I had an issue with the service and I stop going for a little bit I decided to go back again. After waiting for an 1h and 40 min our food was served cold and in pretty bad condition. They don't even offer to replace it. The service is horrible and the staff is rude. I'm done with this place.,G1s_ObdHV-1DfISysJ2aNA,0,0,1,_IaUFYIQUCOu8mGZ9_RBuA
1548728,2016-10-21,0,elqbBhBfElMNSrjFqW3now,"Food poisoning alert

     I used to love coming here. It was one of my absolute favorite Thai restaurants in town. After yesterday's event, I will never be back. My girlfriend and I stopped by Pin Kaow for lunch where we both had the pumpkin Thai curry (my absolute all time favorite dish from here). I got my usual shrimp curry and my friend got chicken curry. We noticed as we were eating the squash was undercooked and there were hardened pieces we had to pick out. The dish was also served warm and not hot. We ate around 1230 and left around 1pm. I live about 6 minutes from the restaurant and my stomach was intensely cramping the whole way home. I literally had to run to the bathroom when I got in. Then the nausea started and the vomiting and you can guess how horribly the rest of my night went. My friend was fine, so I think I had bad shrimp since that's the only difference between our two dishes. I will NEVER be back. Gross. Just gross.",V9o57LjR2CXPet2mZ759ng,3,0,1,u7Hv8X9_LcUP8WrhaEO8Fw
1554674,2013-01-27,0,elqbBhBfElMNSrjFqW3now,"Pin Kaow has great Thai cuisine! I come to visit the in laws twice a year and we make sure we stop in here every time we are in town! The green curry is delicious but I found a new favorite tonight, the pumpkin curry! Order at least a 7 for spiciness! The mint chicken is also tasty!",PiWLZvyl7M2aJ0ykWs8V-A,0,0,4,uz_Ce08c7rJh4sebB0XPaw
1576850,2013-09-13,2,elqbBhBfElMNSrjFqW3now,"Pin Kaow is that old standby, the one that you know is always good, always has great service.  You can relax when you come to Pin Kaow.  Your Thai food is going to taste just like you remember it did the last time you were here.  Chicken Satay, Pad Thai, and the best Tom Yum Kai in town are our 3 go-to dishes, no matter what.  The atmosphere is soothing.",jNI9GYFHzInokLpoZ_OPBA,3,3,4,4X6xupHRupZLPAoZUu82Eg
1588328,2014-04-05,0,elqbBhBfElMNSrjFqW3now,"BF went here years ago, and ever since we moved back, he's mentioned it every time we go out for Thai. We finally made it in this evening for dinner.

Though it's located in a strip mall, the interior décor is quite nice, and the service was on point throughout our visit: attentive, polite, and professional. I was impressed before we even got to the food.

Started with the Fishcakes app- $8. Good portion for the price, cakes weren't too greasy and seemed meatier than others we've had. Herbs and seasonings were mixed into the patties, making them quite flavorful. The cucumber salad was also fresh and flavorful, perfectly complement to the cakes.
Shared the hotpot of tom kha kai soup- $12. Large hot pot serving is good for us, since we love this soup. First impression of the dish was that it was incredibly well balanced. The broth was super flavorful, and there was a good amount of chicken, mushrooms, onions, and cilantro in the soup itself.
Lastly, we split the duck curry entrée- $14. As my BF put it, ""This is possibly the best curry I've ever had."" The duck was perfectly cooked, the curry sauce was amazing, and the pineapple and peppers worked well to bring the dish together. Portion was a good size, and came with a small side of white rice. The only change I might make to this dish would possibly be to add more veggies to it.

All in all, dinner with tip was just over $40 for two on a Friday night. Service was impeccable, food was flavorful and well balanced, and this is definitely a place I'd go back to- Vegas has a lot of good Thai restaurants, but this one has all of the elements to make it stand out as great.",bLbSNkLggFnqwNNzzq-Ijw,3,0,4,QJXLxL9sLRp2nwYNrWcsMw
1598721,2011-08-27,1,elqbBhBfElMNSrjFqW3now,"My family and I love this place!! Service is always good, prices are reasonable, and the food is delicious!! We always order the shrimp pad thai, spicy chicken mint, and the one sun beef. Perfect meal every time and there are always leftovers for the next day!",YSDJnpPocWMT2aX34K3sFQ,1,1,5,gbAwRzlcDa_gXQn8y4Azuw
1650272,2012-10-03,0,elqbBhBfElMNSrjFqW3now,"I love Thai food and this is my go-to place.  The restaurant is small but beautiful.  I love the wood wall and all the orchids.  They occasionally have a Green Mango Salad on their specials board, which is amazing.  It's not my favorite for Thai Beef Salad (the beef is overcooked and dry) and their Thai tea is really, really sweet.  I have tried almost the entire menu and it is all outstanding. The staff is attentive.",XTeRALY5Xd8QM6m7KBG9ng,0,0,5,nAN6XKKw2Fqd-L8XodWiDw
1656964,2018-02-25,0,elqbBhBfElMNSrjFqW3now,"I love this place. Every time I order carry-out it's great, which is DEFINITELY saying something. My special order is never messed up. The customer service is amazing. I'm always greeted with kind smiles at the door.",LoyN9K1Vxf9CoYWFVn6aKw,0,0,5,yMUy1UlkSt9CKbo_Z_kppQ
1660118,2014-06-17,0,elqbBhBfElMNSrjFqW3now,"LOVED IT! I love Le Thai, but seen the reviews and decided to give it a try! We got the Panang curry and combination fried rice. I'm pretty picky with Thai food because not every Thai restaurant is good. I've actually went to one that was down right gross and literally made me sick. I was off Thai food for a while until my friend had me go to Le Thai and reminded me as why I loved it. this place is pretty much as good as Le Thai but I do feel like I get more food at Le Thai. Next time I go I'm going to have to see but I'm pretty sure I do. None the less this place was good. I just wish it was a little bigger servings. (Maybe I just eat too much lol)",MLxoeNn0ZPpXahLJvuWNgw,0,0,4,hCGGzGLQI0U16h-b5YkmKQ
1664075,2013-12-30,0,elqbBhBfElMNSrjFqW3now,"Excellent Red chicken curry, pad Thai, Tom young goon soup. Papaya salad with dried shrimp is excellent.  Excellent customer service",7XBDv7ci2Pi3TQmcOMYgRQ,0,0,4,V30tgopWEQn1iEH6gzqDAw
1666955,2009-11-16,0,elqbBhBfElMNSrjFqW3now,"The service and food at this Pin-Kaow location is outstanding.  Everyone who works there is so friendly, I usually meet friends there for lunch.  Everyone I take there enjoys the food and the lunch specials are so fantastic.  Penny O'Brien",4X-iM3t51JDmttS2SZK1WA,0,0,5,Ix3fCsT_4izDd1BoFPd-Dw
1685100,2016-07-14,0,elqbBhBfElMNSrjFqW3now,"This restaurant had good, delicious Thai food. I got the chicken pad Thai, while my husband had the chicken pad see ew. The only thing I found odd was that I had almost no chicken in my meal while my husband had more than he could eat. I would definitely return!",Rl9tRa2QlcjGSvIfUVFwSQ,0,0,4,MoyquTLo1fzvoZVfrzepuw
1704521,2017-11-19,0,elqbBhBfElMNSrjFqW3now,Travelled all over sampling a variety of Thai cuisine and Pin Kaow is the only one that comes close to the fare you would find in Thailand. Service is phenomenal and they genuinely care about the customer.,xus1lqMLWJyhqe4M2WeXzw,0,0,5,0eAbbU5hz1H-VtgWkVmpSg
1709425,2015-07-31,1,elqbBhBfElMNSrjFqW3now,"Customer service was ok, but the food wasnt.

I asked for level 9 for red curry and they simply added three slices of jalapeño. The taste was BLAND, very flavorless. I wouldn't recommend it. My friend got the brocolli beef and sames story. I'm dissapointed.",3zQB0occCSGJgkT05ae3vg,2,1,2,nAzMJAYnWeNdQjk0scLioQ
1724923,2017-03-12,0,elqbBhBfElMNSrjFqW3now,"First time visit today...the service was seriously the best I've ever had in an Asian restaurant.  Just the right amount of genuine attentiveness and friendly.  They were exceptionally kind to my toddler daughter who got her own little plate, utensils and kid cup without me asking.  
The food was good.  My pad Thai was a bit sweet for my taste but still very high quality and enjoyable.  We went on a Saturday and there was no lunch special.  It was kind of expensive for the portions and lunch in general.  The only real complaint I had was the seriously horrible loud music they had playing.  It was so strange!  A combination of bad jazz and elevator music.  The other patrons were laughing at it as well.  It didn't fit the restaurant mood at all.  
Stars for fast attentive service but lose a star for being overpriced.  We may be back, if it were less expensive, definitely.",Sw69CeTA03hsCR_UqJTlvA,1,2,4,sQCwCKgTCAmn-Vzm1H3xXA
1728026,2010-12-23,0,elqbBhBfElMNSrjFqW3now,"There aren't very many good places to dine in vegas outside the strip, so at first I was hesitant to try this place out, but I'm glad I did.  It's in a little plaza that usually looks empty, but my favorite pho place was closed, so I tried it out.  

First off, I LOVE the decor inside! They put a lot of effort into their ambiance and it shows!  You wouldn't guess it looked this way from the outside and the neighboring buildings.

I haven't explored the menu too thoroughly because I'm just hooked to their green chicken curry! So good I have to it every time I go.

My fiance usually gets the Pad Thai,  which is also very good.  I believe they offer shrimp or chicken as their meat choices

He also really enjoys their green curry with catfish.

Service is always good.  Staff is always friendly!",n_nVzNQfxiDbyKFIUqTolg,0,0,5,_UKGmzjrqU3qB6bnNysIOg
1742726,2014-03-25,0,elqbBhBfElMNSrjFqW3now,"SERVICE:

Every time I've come here I've ordered take out so I'm not familiar with the waitress' service but they always greet me when I walk in and out. 

FOOD:

Curry here tastes very authentic and perfect. I like how they give you a scale of 1-10 for spiciness instead of just mild/medium/hot. The mango tasted fresh and sweet. Mm mmm mmmm. Next time I'll have to order other items.",N-w5bezXsbZ5wGztI1n8gQ,0,0,4,EkZ3ybZ5wsENq8ZeF1Jidw
1758590,2018-05-12,0,elqbBhBfElMNSrjFqW3now,"I have visited Pin Kaow twice now. Once when I was SUPER exhausted after a flight (and anything would taste good at that time) and once for a night out with a friend. 

The restaurant has a nice, dimly lit atmosphere and you're greeted as soon as you walk in. Bathrooms are kind of awkwardly placed right as you enter...but I mean...who cares I guess. So far, I have tried the chicken pad thai, pad see ew, green curry, and crab rangoon. 

The food is good. I've had a hard time finding Thai food in Vegas that isn't overly salted, and overly saucy. The only issue I had was they really seemed to struggle with the spice level. I asked for a high level of spice, but really it barely had any spice. This is a big no no for me because I like my thai food SPICY. Either way, I would likely return, because it's a nice atmosphere and the food was good overall.",Pi0l64sVG69_ov2j6MwePw,1,0,4,2IlksDPTN4_rn-s0zi3rFA
1767779,2011-08-01,0,elqbBhBfElMNSrjFqW3now,Place is always crowded.  Good sign.  Many vegetarian options and the food is very fresh.  I've eaten here many times and I'm a bit surprised by some of the poor ratings they've received.,aK4gDV3q0T1nalGW5MJPmQ,0,0,4,NBbkQC3wAWWOUpF7cy3PhA
1782432,2014-05-16,0,elqbBhBfElMNSrjFqW3now,"I have been to a lot of Thai restaurants in Las Vegas, and nothing compares to the quality of food found in Pin Kaow.  The customer service is also top notch.",GxvE9_P1ClaaQSIBgv9xDA,0,0,5,zXTYMO2LJV2PUBGjB1M7mg
1794341,2014-07-16,0,elqbBhBfElMNSrjFqW3now,Seafood dishes are good. Beef jerky is yummy. Yellow curry seafood is my favorite. Always make room for sticky rice with mangoes or get it to go. Definitely one of my comfort food.,-RWHoFxUURZ4TvEdZRieiQ,0,0,5,2FJSIPn1dzWyrDybumXhPw
1804209,2014-04-19,2,elqbBhBfElMNSrjFqW3now,"I usually dont eat Thai food. but when I do, this is the place. For you Latino and non Latino spicy lovers 1-10 heat level is available. Easy access and parking. Staff friendley, quiet, didn't even hear clacking of silver ware. Awesome woodwork decor. Authentic, along with the staff's authentic Thailand dress wear. The food, ""Caliente Bueno"".",hVZ4ZYvGPN6zSRx2Fll1Ag,2,2,5,q3PR0-HYzriUx8xZV_xKQQ
1807637,2017-06-27,0,elqbBhBfElMNSrjFqW3now,"This is our go-to for the last 9 years! Whether it's for wonton soup or panang curry, you won't be disappointed! Amazing coconut shrimp, edemame, chicken chow mein and now matter what time of year, they always have the BEST oranges for an after-dinner delight. Their coconut ice cream is to die for!",P10N2DIDBl0qaFtOfXaCHw,0,0,5,Ba1OnVsTwyiVmqo9eGGVWA
1829185,2011-03-29,0,elqbBhBfElMNSrjFqW3now,"Once upon a time, during a quick trip to Vegas, I was determined to find great Thai food outside of California (specifically Hollywood/No Ho).  After much research, I was set on treating a very special man in my life (and extremely picky Thai food eater) to the much lauded Lotus of Siam.  However, being in the neighborhood, we decided to grab a bite at Pin-Kaow, and we were not disappointed.  Located in an unassuming strip mall off Rainbow & Lake Mead, the sign for Pin-Kaow, in big bold caps, is definitely not hard to miss.  However, for those unfamiliar with great Thai food, it may be easy to overlook.

Upon entering the restaurant, we were impressed with the elaborate traditional design.  Think intricately carved, polished wood, and slightly dim lighting.  Classy enough for a lovely dinner date, yet casual enough for quick daytime lunch.  This was exactly the kind of place  we had opted for.

We were seated promptly and given several different menus, one of which was for their lunch specials.  We both went with entrees and ended up ordering a bowl of boat noodles, red curry with chicken, nam kao tod  and spicy chili mint noodles.  Everything was ordered at a level of 7 or 8 spiciness, but be cautious with this spice level, as some dishes were spicier than others.  The boat noodles and curry were good and satisfied a craving, as did the spicy chili mint noodles.  The portions were big enough for two people with big appetites (or as my boyfriend would say, ""big enough to feed a small family."")  However, what really made a big impression on us was the nam kao tod!  If you've never ordered this, you're missing out.  It's basically a crispy rice salad with sour sausage, cashews, lime juice, chili flakes, and other elements of deliciousness.  The texture, and bold flavor were a perfect complement to a sunny vegas afternoon in Spring.  Neither of us ordered from the drink menu, but they seem to have a nice beer selection for a reasonable price.

All in all, although I have yet to try the critically acclaimed ""Lotus"" in Vegas, Pin-Kaow is a nice (and more cost effective!) alternative.",TxWBHR4WE4BmIRtlgFYaWg,0,0,4,JzAjgjZS7qBHV0rr3fKu2A
1835963,2014-09-27,0,elqbBhBfElMNSrjFqW3now,"I was really unimpressed. My boyfriend and I went in wanting pad thai like we are used to finding at other restaurants. What we got was expensive, not anything special, and a small portion size.",kdeRPWjw7nPgjexgVZwgeg,0,0,2,9r7pA8pDxN-2N4kW1br0BA
1844170,2014-08-06,0,elqbBhBfElMNSrjFqW3now,Awesome curry and chili mint noodles. Definitely one of my favorite places to eat around town.,NIUofZwMISQp-FAk3yKihg,0,0,5,xJHDmxag3WkdB4XDwanRzw
1848970,2014-01-03,0,elqbBhBfElMNSrjFqW3now,Located in a strip mall with plentiful parking. Lovely mango bellini. The fried tofu left much to be desired but my entree (panang curry) was quite good and was substantial enough for me to have leftovers too. Wait staff was a little pushy at the end; it was only 10 pm and they basically booted us out the door. It gets really busy during regular dinner times but they will seat you even if your entire party is not yet present.,XfHOhgHWjLwh80qvA94Dsg,1,0,3,aiFcytVbzLJbm0eOa79_IA
1864294,2018-03-27,0,elqbBhBfElMNSrjFqW3now,"We used to love this place, but I agree with some of the other opinions - it is inconsistent and I feel like quality is going down. However, i still think this location is the best Thai food in town. Much better than famous Archie's ( horrible, greasy, greasy, greasy, food drowning in old, low quality oil). We love vegetarian pad soon sen and vegetarian panang. 4 stars for the inconsistency.",icNj2JJmMFrPZ34qSlabsg,0,0,4,HINOLN-k4tUNWRKYb2xF4g
1865419,2018-02-25,0,elqbBhBfElMNSrjFqW3now,"I am in Love with their tom yum hot pot!! So delicious! Every time I am in that area, I have to stop there to eat! Another favorite dish is the spicy eggplant with beef! I love eggplant so I usually get additional eggplant added too. One of my favorite Thai restaurants in Vegas!",CjLkVSzP42JP65cC6C7LHQ,0,0,5,mWPB9cfsjwVEGkfK7csJ-Q
1883876,2013-11-08,0,elqbBhBfElMNSrjFqW3now,"I got takeout from here today. I hadn't been there before but I decided to try it out. I'm not adventurous with Thai food, so I typically default to pad se ew. I ordered this, spice level 3, with chicken. Wow! Best pad se ew I've even eaten! It was incredibly flavorful. It was $10, but it was a good portion size, and it tasted amazing! I will definitely be back to get this again and likely check out other parts of the menu.",BcRLNKrzznjGH01UjlAdGg,0,0,5,QTCaGjguY_Tu6_NcdEzKYw
1886783,2015-12-14,0,elqbBhBfElMNSrjFqW3now,I had a craving of bbq ribs. So my husband brought me here. The ribs were a little not too much tender. The chowmein was good. I liked the steamed veggies.  The service is good but waitresses dont smile. I like to smile to my customers. Thats why I notice that a lot in a person when Im the customer.,B2Pv4Tnekou6jsVZ_C5JxA,0,0,4,t80BK1pKpffFLGUgid1w5w
1896679,2017-01-18,1,elqbBhBfElMNSrjFqW3now,"Food is good, but horrible customer service. We ordered from them every week about once a week since my job is down the street them there. Ordered online on MLK day and paid then received a phone call saying they do not have the lunch specials on holidays because they need to pay their staff overtime because it is a holiday. I was working when I placed the order and was not being paid overtime because of it being a holiday, but that is not the point. Unfortunately they have lost all of my business. I will not be returning to their location because they wanted to charge the dinner portions during lunch hours on a Monday(holiday). Being selfish for 10 more dollars that have lost a regular customer who spends 30+ dollars a week at the restaurant. 
Also, since they have new management they have reduced their portions.",bdx8L6O9-DaQ9lZ5MqblHA,1,0,2,Tnbb2Xz4PHp3k-0vpvhadg
1896972,2016-11-13,0,elqbBhBfElMNSrjFqW3now,This place is solid!! It's always busy and bear my house. I tried the Thai beef salad - easy on the spice !!! Good place for Thai!,ESBXYiZQJcXNNAvRki-IiQ,0,0,4,TsJNPC7ZhFvcn9Tn0E_4qg
1901645,2015-06-26,0,elqbBhBfElMNSrjFqW3now,"First time here. It was ok. The lunch specials are great with the soup egg roll and entree. I got the chicken pad Thai. The pad Thai was great although the chicken was really rubbery. It almost tasted like 2 or 3 day old chicken. Definitely not freshly cooked. That was pretty disappointing. The service was great, everyone was on top of everything. Very efficient. Atmosphere was great. If the chicken was better it would have been a 5 star experience.",forZnbTtitJKkRyMQmP8vw,0,0,4,8PDbCsO-vz_dUvDyTI-lGQ
1919380,2015-04-13,0,elqbBhBfElMNSrjFqW3now,"Service was rushed , the manager and waiter were very argumentative and made me uncomfortable , the food was not made in a vegetarian way , will not be coming back again .",xFtd2Wla_xefXO8EI1V7BA,0,0,1,n3jqb9Lo0tepbmw39a6naA
1919904,2016-09-24,0,elqbBhBfElMNSrjFqW3now,My favorite thai place.... come in and visit they have reall great food and customer service,3xY9Nc84r7WPLrGo7gfyTQ,0,0,5,OyD4OuNe6go4qGLzfoaTeg
1920573,2014-03-20,0,elqbBhBfElMNSrjFqW3now,"My go-to Thai food utopia. Lake mead and rainbow is the best location and that only  one I will go to. I love the shrimp pad-thai and these people have anything tofu, mastered. Everyone should go here, and if u happen to try their other locations first, you will be even happier with the original.",vooY-9UWfompZ61RDRIGqQ,0,0,5,XJb8y6hGVVUS8jEL_mfp5g
1921590,2015-03-09,0,elqbBhBfElMNSrjFqW3now,"Always a quick, well made delicious meal. Great for business meetings when time is limited. Friendly staff.",HS4Y-QWGkyIEC3wFx4DEXg,0,0,5,qhtf457xTk8Tn0foyZeDWg
1945775,2008-07-11,0,elqbBhBfElMNSrjFqW3now,"Thank goodness this place is right around the corner!

Awesome Thai food, and their Thai Tea is excellent!  My favorite dish is the seafood soup (can't remember the thai name at the moment) and their catfish delight.  

Great to go to during non-peak hours for good service; you can also order to go -- the restaurant isn't that big so you'd probably be better off that way.",wqhuRhMwwlbuqW9xa1li8A,2,1,5,VMYMqxm1zzslRp1c_W2wPQ
1947225,2010-08-09,0,elqbBhBfElMNSrjFqW3now,I have been here many times and usually the food is pretty good although it is never hot enough for us.  Went yesterday and had the seafood curry in young coconut off the specials menu YUM!!! It was really really good although a little pricey.  Also tried the Mint Duck which was OK.  The fish cakes are always good.,or9VwGPVMkBPS1ReXcg6kA,1,1,3,Aqgc07LDblnId_dg5irC5A
1947687,2016-02-01,0,elqbBhBfElMNSrjFqW3now,"This place has amazing food and great service. Their Tom Yum soup is probably the best I've had. Place is very pretty and always clean, food comes fast and they are very accommodating.",mUw3yRX2o1dwuXLuVdKUxA,0,0,5,SgLDCWp74BROmn0YoofhUw
1952955,2011-09-30,0,elqbBhBfElMNSrjFqW3now,"I always go to Archi's when I want Thai food (Yes, yes, I know Archi's is not authentic, but it taste really good xD). When I found out there is a thai restaurant 5 mins from my house, I know I have to try it out.
The first experience was a take out order, I ordered the pad thai, and I thought it was pretty good. Then, I took my friend here to try it together. 
The atmosphere here is great, it's a little dark, but the decorations and everything add the 'thai' feeling to the restaurant. The seats are pretty comfortable. 
We ordered the Tom Yum Kung Soup, Panang Curry(Waitress suggested this one), and Pad Thai. The soup and pad thai was good, but nothing special. The most important thing is that the panang curry was awesome! It's better than red, yellow, or green curry that I have tried :) 
Although the food was good, the portion was quite small for the price...",2XqETTftamZ56peivVb0Ig,0,0,4,hrHMiWwNsOuB7c7TXqrDlQ
1960326,2016-03-15,0,elqbBhBfElMNSrjFqW3now,"If you come to eat at a Thai restaurant for pad Thai, fried rice etc. this will be fine (favored by locals). If you're looking for a more interesting dining experience than that keep looking. The sea bass was tough and they kept asking me if ""everything is okay"" and when I told them why I wasn't eating it they did nothing to address the issue. Nice waitress but it didn't make up for the subpar food. There is a good Thai restaurant in a strip mall but I can't remember the name....",hAKRff2b2SzqSM9jpaStXg,0,0,2,rtu_DQqLJUDkQlRVs-FrOA
1961147,2018-01-18,0,elqbBhBfElMNSrjFqW3now,Worst place first time and last time i order tum yum soups from here better at kung fu plaza... here is more expensive and dont give rice with the order,H9A6Bh-vQFJ0GjJLF2inYA,0,0,1,cCSkjBG7kpuji5WgAHzy8A
1985131,2016-11-09,0,elqbBhBfElMNSrjFqW3now,"Vegas is home to a ton of amazing Thai restaurants, and Pin Kaow is not an exception. Their food is delicious (my table got a selection of curries, noodles, and vegetable dishes, and everyone was happy with their meals), the ambiance is unbeatable, and in a convenient location, it really has so much to offer. Our food was out really quickly, and the service was top-notch. I definitely recommend Pin Kaow if you're in the area!",pcv-MEpcI6t4_ytr49LFpw,0,0,4,Ojldc7UnFJbo5ym9rkWcaw
1988861,2017-06-18,0,elqbBhBfElMNSrjFqW3now,Went here on the advice of a friend.  the staff were helpful and prompt.  We have standard dishes we order when eating tai.  Chicken pad Tai was a bit sweeter than we like and the spicy chicken eggplant had flattened pieces of chicken that were under seasoned.  The eggplant and the sauce were good.  Pricing was similar to other Thai Restaurants we have tried locally.  They did have extensive seafood options. We did not try any of the seafood.  They were helpful talking to the kitchen regarding ingredients.,IDeEVoEObXIyZ7jMMEJH4w,0,0,3,UdpuJIUTPPZdNW3qRDB2xQ
1991498,2011-10-05,0,elqbBhBfElMNSrjFqW3now,"Simply awesome Thai food. Another example of how this town has many diamonds in the rough. Had the Bell Curry on a level 7.5 (yes they humored me) and I can't wait to try a 9. A lot of heat with a ton of flavor. If you've never tried Thai, go there now!",EWEmxT_Mnp_B-54vUmsmYg,0,0,4,h1sKtyL9AmAyreI2g4c-Jg
1992493,2016-04-03,1,elqbBhBfElMNSrjFqW3now,"Expensive, not good food (meat had gristle like they handpicked the crappiest piece available), charges you for refills (who does that?). Please stay away from this place. Go anywhere else but here. It's a rip off. Small portions with super expensive prices. Won't ever eat here again. Like I said, any other place is better than here. Absolutely do not recommend it.",BRcgHLkCDMr-oIurtdlGcQ,1,0,1,TRNZx8he7JDpJ-Dmkx4ntA
