,date,funny,business_id,text,user_id,useful,cool,stars,review_id
4329857,2013-04-22,7,ewIXHLlaIfp9U3NrsgilVw,"NOW THAT'S A KNIFE!

And I am sure that the server wanted to stick it in me!

I have never come here by choice. I have only been here for team dinners or as I like to call it group fun. It is easy because you just tell them 15 people and no one needs to even look at a menu.

Let's get back to that knife getting stuck in me.  This place is not like a Fogo because they really do not want you to eat a lot of meat here. The waiter was handing out turkey breast and my co-worker said he did not want one. I asked the waiter for a second turkey and he told me, ""NO!""  He then looked at me and said, ""I am bringing sausage next. You can have that!"" I then said, ""I do not want sausage, I want the turkey breast!"" He still refused to give it to me. Can we say, ""Awkward!""

When the waiter came back he refused to give me sausage! He said, ""You told me you did not want sausage!"" I said, ""Yeah I did but since you told me I couldn't have the turkey breast. I want the sausage out of principal!"" It was quite funny because my co-worker then made the waiter give me two sausages. I am glad that I did because the sausage was really tasty. I might have missed out on that.  From that point on the waiter was a little mad at me.  In fact, he chose to cut all of the meat directly in front of me. I was just waiting for him to spill on me or drop something in my lap. It was very weird and a little of a power play on his part. 

I also must point out that the food here is really salty. The chicken was good but it was over salted. We ordered a bunch of pitchers of water for the table.  Something strange also happen. About 30 minutes after we ate our chicken, the waiter came back with thongs to pick out our chicken bones off of our plate.  Why didn't they just give us a clean plate? And he was only grabbing chicken bones. He was leaving the beef fat and other various scraps of meat. I told my buddy that the chef needed the bones to make a stock. Sadly I believe that this is what was happening right at our table. I also joked that they were going to make a stock out of our bones and make us drink it as a team building experience. Yuck!!!

The sides here are terrible. The Brazilian buns are the worse Brazilian buns ever. At other places I can not stop eating them but here I would not even feed them to a bird. The only side that is good is the fried polenta or at least I think that is what it is.

The bartender is a sweet old lady but she can not remember your drink. So make it easy and just order a beer or a scotch or a wine.  We started drinking at the bar and the bartender could not even remember what rum she used in one of my co-workers drinks. The funny part is that she sold us at the bar that it was the best dark rum and then 20 minutes later could not even tell us what rum it was. Lies!!!

The owner here is also all business. He tries to up sell everything. He also tried to get us to buy bottles of wine for the table. He told us that it would be easier for us to get a drink if we just poured our own wine. I found this unbelievable that an owner would try and talk us out of mixed drinks. He even went as far as to tell us it would be hard for us to get our drinks. I really did not like this. We all stuck with ordering from the bar but it was a slow painful process. This place lost money!

On another occasion we had a bunch of female co-workers with us and the owner was all over them. It was a little sick. He was hitting on them and ignoring all of the men at the table. I found this a little tasteless. We did not have to worry about this on our most recent visit because we had 14 men and 1 woman.

I also must point out that I usually come here during the two largest conventions in Vegas (CES and NAB) and we can always get a table. Try that at the other restaurants and you will be waiting 1 to 2 hours for a table.  Yes there is always a table open here and it is easy to get in. That tells me that a lot of people are not going out of there way to come here and eat.

The best thing that I had here was the shrimp cocktail which the owner pushed us to order along with fried calamari. Do not get the fried calamari because it is not fresh. I believe it is frozen and it does not taste good at all. These were all add on's and the owner never came back once we refused to buy bottles of wine. He went to work other tables and get there bills inflated.

The only good cut of meat here was the tri-tip. It was really tasty. It was sad that after all of that meat, it was the only one of the cuts that actually stood out. Also, beware that the waiter is going to control how much meat you get and the process is slow and long... painfully long.

This place is not fancy. The interior could use a face lift along with an attitude adjustment by the staff. I am sure that the owner tells them to not give people a lot of meat even though it is all you can eat. The menu should say, ""All you can bare!"" because after a while you just want to get out of here!",CY9iLsE2z_yLhLqJdD1WGw,22,6,1,piSLEesqvV3Suki7SleEVw
4769423,2015-03-31,0,ewIXHLlaIfp9U3NrsgilVw,"I visited Yolies for dinner and loved the food and experience.  A great Brazilian experience with wonderful sausage, chicken, lamb, turkey, pork and sirloin!  The accompanying entrees were perfect!  Service was impeccable!  I enjoyed my visit and meal and will return again.",C_w9eFnA16xIkaOjy_oPXQ,0,0,5,4Rs2WM6z3MaVMWIvudxMvA
4801846,2011-03-05,0,ewIXHLlaIfp9U3NrsgilVw,"I have been there twice so far now. 
I agree that the decor is VERY outdated.  Bathrooms need a bit of work. We had really really good service there.  I only have had the seafood and both times my food was amazing!!!

The shrimp cocktail is fabulous and fresh.  The salmon was prepared just right!! and the seafood past was out of this world.  So, I guess it is all a matter of taste. The people around us eating  the meat seemed very pleased, so who knows?

Prices were very affordable. Will be back again.",SnoIHr0CHLa1jhcpcDAOhw,2,0,3,Ngk1SoceXpKQWVrF-r2cQQ
4809016,2012-03-09,0,ewIXHLlaIfp9U3NrsgilVw,"Overall was very disappointed

the good:
service is good, waiter and servers were friendly and prompt with food. 

the bad:
the meat was overcooked mostly
decor needs updating
kind of pricey for the quality (Spent $100 with tip for two drinks, two meals, bottled water)
only one guy brings around the meat....seemed awfully rushed",aD5KUm0mJjXfX0tp5zLw7Q,0,1,1,_gb5iE7nqgUZa-mQs2l1Mg
4812821,2012-09-29,0,ewIXHLlaIfp9U3NrsgilVw,"It's no Espetus or even Fogo, but the line was non-existent so we got seated in under 10 minutes. That's good, right?

My manager brought me and some colleagues here. Well, we'd aimed for another restaurant but their wait was 45 minutes and growing. So we wandered over here. No line, as I mentioned, and about half of the tables were empty. Lots of shrimp cocktails moving around the place, and  I didn't see the ever popular ""meat on swords"" until we'd been there for about 15 minutes. Thought maybe it was conventional table service, which made no sense. 

The food was pretty good, and one upside to eating here is that they give you a light side salad and one bowl of bread, so you don't fill up on the salad bar (as can be tempting at more upscale churrascarias). They took care of the ""cooked"" (well-done) meat eaters at our table, and the ""let me hear it moo before I eat it"" eaters as well. 

I probably wouldn't be eager to go back, but if I were in a hurry to get seated and pig out, I'd give it serious consideration. I didn't see the bill (thanks Dan!) so I can't speak to price or value, but I'd go with Meh+ on this venue.",ZoYuMXefr09ZsKziXoVPyg,2,0,2,_075Dd3IT6INXvJVs9Me2A
4813906,2007-02-13,2,ewIXHLlaIfp9U3NrsgilVw,"It's hard for me to admit when I'm wrong about things. But there is a glimmer of hope when I find something that really stimulates my manmones""You'll never find Brazilian food in Vegas. It's not the same."" Ok I'll admit that Rum Jungle has the rodezio experience where they bring meat around on huge metal skewers. But Rum Jungle is a fusion experience. Well there's Samba at the Mirage. There's Pampas at the Dessert Passage.  Then there's Yolie's off the beaten path near Ruth Chris on Paradise. Now Yolie's sits with these green awnings on the second floor of this strip mall. The staff is very friendly and it's kinda a family setting. 
WARNING: THIS IS A MEAT EXTRAVEGANZA. Ok sure they bring some rice and some fejoida, or even some plantains. But wait for the MEAT. There's marker to signify when to bring the meat and when to stop the carnage....It comes in waves, if you haven't been to a Brazilian Rodizio and ate churrasco....you don't know what you're missing. If you're a carnivore, you get waves meat in large metal skewers. Like roast pork tenderloin, trip tip, sirloin, rib eye, chicken, Portuguese sausage, lamb, ribs, and they keep coming....until you turn your little marker to make it stop. When you start crying out tears of ground beef....you know you're done....The price is affordable for all the meat you get. WAY CHEAPER and closer to authentic than Rum Jungle. This is also one of the few places in town that actually serve real cachaca and caipirinhas...Yea. 
Overall - it's a meat lover's fantasy. The carb portions are small. I'd definitely eat here again. But I'm not thinkin 4 star. More 3.5 But I guess I'll round up....


No Animals were harmed during this review....Sorry Vegans I'll eat more veggies.....",UvY0E6Wuhv_0Bita52RPOw,0,1,4,vwkegEQN_m3l9bcdXMzxXQ
4956532,2009-04-07,0,ewIXHLlaIfp9U3NrsgilVw,Went with a large group and had a great time. The staff was totally on top of the service. Food was cooked to perfection and the lamb was some of the best I've eaten.,wJMKvunzHELMZy6K-Z8qbA,1,0,4,AT3ZdoCspCUi47-XIUw2fw
5089236,2012-01-16,0,ewIXHLlaIfp9U3NrsgilVw,"I was a little worried given some of the recent reviews but I have been to Yolie's on many visits to Vegas over the last 15 years and have never had a bad experience.  This was no different.  We went during CES but were still able to get a table, probably because everyone went to TdB or FdC, which are definitely better known.
As usual, the meat was outstanding.  Cooked perfectly, served as you wish.  I like the TriTip from the middle and the lamb from the edge, which the waiter was happy to oblige.  The other thing I always like about Yolies is that the wine list is reasonable, plenty of good choices for $50 and less.  I always start with a Caprihana, and this time it was good but not great and took a while.
The only reason I dont give 5 stars is the decor is dated and the tables a little cramped and the service to start (for soup and salad) was slow.  
But it was still a great experience and a nice family run place if you dont want the corporate route.  Yolie is as friendly as ever and the maitre d' is hysterical.
LOCATION NOTE: this place is NOT on the strip, dont know why the map is wrong.  Its down on Paradise, which is another great reason to go and avoid traffic.",VjS1x1dNXN6OUNbolwE_gQ,0,0,4,iJKc3AfZpfUgpnsalsYW7w
5090315,2016-03-07,0,ewIXHLlaIfp9U3NrsgilVw,This was a nice clean restaurant. Very friendly staff. The food was very filling and fresh. Don't judge this place based off prior reviews. I gave it a chance and I will be a regular here. For the price the portion sizes are impeccable. I would bring my friends here for a dinner it has a large floor plan and great for large dinner parties. Highly recommendable.,Zp2PAbqHrJSE4-L4X_iB-A,0,0,4,DXBviZMcCihX44P50rBS_g
5160349,2009-01-29,6,ewIXHLlaIfp9U3NrsgilVw,"Okay 1.5 stars nooo 1, nooo 1.5, I dunno!?
Okay here's why, this place was my single most weird/awkward dining experience I've ever had or hopefully ever will have....!

My girlfriend and I where going to go to firefly which is in the same parking lot... and firefly was booked on tables and way crowed inside so we thought maybe marrakech instead... ""no we've been there a bunch of times, plus that's a lot of food to eat, not being that hungry let's try this Yolis place!"" 

We see the menu posted outside, there are some things we can order that sound good. So we walk up the stairs to the restaurant and go inside. First thing you see in here, is the crazy lighting everything is NEON green... Maybe cool looking for a bar perhaps, but a restaurant I dunno why anyone would think that was a good idea. 

We get seated,... and here's where is got really strange. Before we ordered our food three people had come to our table, we had no idea who our waiter was. They brought bottled water without us asking. Someone came over to the table said hi with the water, someone asked us for our drink order, and then someone else for our entree order. 

So this last person we ask, 
""Are you our waiter?"" Can we see a menu?
""'Oh you want a menu?"" You don't want to get the firepit?""
My friend, ""What's that?""

--- the manager or the owner comes over and he is talking to us really enthusiastically like a car salesmen...telling us to order the firepit, which is like 5 or 6 different kinds of meat, etc etc...----
My friend, ""Sounds neat, do you guys have menus though?""
""Oh we have menus, why do you want one when I am telling you this is the best thing to order."" 
""Ummm, well we'd just like to see what else there is?""
---Tells the waiter to get us a menu.---
(What the heck right?)

So he leaves for a second and my friends like we can leave, and me stupidly I say, ""No we're already here and already ordered our drinks..."" 
(Regret)
So we stay....
After not even a few minutes of looking at our menu, the owner and the waiter come back over and start telling us more about the firepit on and on about how this is the Brazilian thing you have to try this, etc etc. 

I said, ""I just wanted a lamb pita."" 
""A pita!!?? Why would you order a pita at a Brazilian steak house?!""
My friend, 'Why is it on the menu then?""
--I forget what he said but it didn't make sense, and I said, ""no that's what I want.""--
(Honestly I wish we would have just walked out but this was my first time ever having something like this happen to me I didn't really realize how to react.)

After bombarding us with the whole firepit thing he railroaded my friend into ordering the firepit. Which was the traditional meat on a spear that the bring around from one table to the next and cut off onto your plate. Normal, and pretty neat to do,... but she didn't really want that much food-specially meat!?

Think about we where going to go to tapas... it was SO much meat and they actually splattered some of it onto my friend shirt! The meat was dry and not very good. They also seemed to be serving it to everyone on the same schedule so it was not just 3 or 4 tables it was more like 8-10 tables... It took forever.

After we left some guys in the same situation as us, peering up the stairs where thinking if they should check it out, as we came down they asked us ""Is this place good....?""
Our answer obviously, ""NO!!""",bEhO6RG2rgf-jFAv0th0gA,5,3,1,MKN4eNXSG2DK-OPftXy1HQ
5173958,2014-01-12,6,ewIXHLlaIfp9U3NrsgilVw,"Wow. Horrible fucking service and not so great food. We made a reservation for 6 at 730pm and got there at 8. As soon as we walked in,  we were seated right away.  After that, it all went downhill. It took 10 min for them to ask us what we wanted to drink. We ordered a round of waters and she told us the waiter would bring us water and she got upset cause no one ordered alcohol.  20 minutes pass by and finally the waiter comes to bring us water.  So that's 30 min to get some fucking water. To top it off, my water came in a dirty glass and when I asked for a new one, the waiter said they ran out of cups. Umm hello? Fucking wash one. We ordered calamari as an appetizer and when it came out,  for sure that shit came out of the freezer.  It tasted really fishy. Next, the salad comes out and the dressing tasted so nasty. not one of us ate the salad. we had to ask 3 times for them to start serving the meat and after another long 30 minute wait, the meat finally comes. i was so hoping for the meat to be tender and well seasoned but that backfired as well. the only thing that i can say was good was the chicken. after 1 full round of all the meats, the waiter kept asking us if we were done. i guess it was his time to go home. what the fuck man. at this point we were all fed up already and just wanted to leave so we ask for our check. ANOTHER 30 min pass by and finally i got tired of all this bullshit and got up to ask for the check. the polite waiter who i give my 1 star to told us that ever since the manager that was wearing a wig took over, the restaurant started going to shit. the pos system that they used was broken so they had to manually write down everyones order. he apologiezed to everyone and gave us 15%off coupons for future use. i will NEVER go back to this bullshit ass restaurant.",wKkYkDAIBjDSyFhJs5I-wQ,4,2,1,SEnO9GcZL5tZdChCA1WEAA
5207758,2008-09-24,0,ewIXHLlaIfp9U3NrsgilVw,"Brazilian restaurant Soprano Style.  Kinda gives you that feeling as you walk in and gaze upon its red, gold, and black color scheme.  I like the idea of meat skewered in swords. Grilled to perfection as you watch it in their glass rotisserie room. Served by various waiters as they parade infront of you variety of meat (beef, pork, chicken, and lamb).  You have the choice of trying all meat (buffet style) or a few. I had the Chilean  sea bass just to mix it  a bit. Outstanding service which what made this a 5 star. The waiter was so nice to even include a mouth-watering flan dessert for free (freshly made).  Will definitely recommend.",Pni5m0POzxp0IuNykdP8Ng,0,0,5,0LkIxco2ADDjSvm_94omUA
5261263,2016-04-25,1,ewIXHLlaIfp9U3NrsgilVw,The food is excellent along with the service. I had the steak and it melts in your mout. I also tried the lamb which is superb. The server George was very attentive to his tables.. Thanks George!!##,veHhHguwPCz4fo0Ra-E8pA,0,0,5,fmhf-IRRm0261sMYwFyx2A
5364248,2016-02-21,0,ewIXHLlaIfp9U3NrsgilVw,Amazing food!  Great service!  First time ever eating Brazilian food.  We found this gem by accident and totally loved it.,7CumyXtHIkx3roApFUb61Q,0,0,5,sTlLWQ9eXMKSRjWD84QiXA
5375914,2014-03-10,0,ewIXHLlaIfp9U3NrsgilVw,"We have been to this particular Yolies in the past.  This place has gone extremely down hill since the last time we were there!  The service was horrible, they didn't even have a cocktail waitress so the elderly female owner took orders, and she screwed most of them up.  The sides to the main dinner were also horrible!  The vegetables were served cold, and were served 15 minutes before the meat showed up.  The salad dressing tasted like pure vinegar, I couldn't eat it.  The meat was fair/good.  They had one server for about 70 people, 2 tables of 18 walked out.  My only regret was we didn't leave with them.  What should have been a 2 hour dining experience turned into a 4 hour one!  Time for the owners to retire and sell this place, because the doors won't be open for very long!  There are so many good restaurants in Vegas, don't waste your time or money on this restaurant!  Oh yeah, and another thing, the guy serving the meat spilled blood from the beef plate all over 2 people at our table.  They didn't even offer to clean their shirts!  An awful experience to say the least!",-gQxg-Z7wDvt5gVbOupzjg,0,0,1,nPgNRnkxvuLnYjfPYy-pHA
5529457,2008-01-09,4,ewIXHLlaIfp9U3NrsgilVw,"We came here July 4th after we found out Firefly had closed due to some electrical problems.  The place was pretty dead.  Staff was funny in a weird way.  They would all say ""You should just get the grill.  Its what we're famous for.""  We must've heard that from 5 different staff people b4 we ordered.  Funny as it was..I was the only one to go for the grill...cuz that was what they're famous for!  Nothing was very memorable about the place.  It was just ok.  I don't plan on going back.",8DEyKVyplnOcSKx39vatbg,6,6,3,wXksfTOmIAp2UdSrR4gq5A
5536424,2014-09-04,1,ewIXHLlaIfp9U3NrsgilVw,"I've been to Yolie's about 8 times over the years and only just now decided to post a review. 

Really surprised at some of the reviews posting one star because the ""food is great, but place is old"". 

Yeah, it's old decor, but along with the absolutely delicious food, I like the fact that the staff has been with them for so long. You can tell they treat their staff (and their customers) like family. 

I also love the owner. He's just a cool guy that loves to make his customers smile with a few jokes. 

As far as how the place smells... Are you kidding me? The place smells like delicious meats! 

I've been going to Yolie's for years, and I'll continue to go for many more. As a matter of fact, I'm headed there tomorrow night with a buddy visiting from out of town and I'm getting hungry just thinking about how good their food is...",jdb99ppiySCe_bDsb7NXTA,1,0,5,wrcKpthv1eMO46CickYaRQ
5564187,2010-02-22,0,ewIXHLlaIfp9U3NrsgilVw,"I am a meat lover. We had a group of 20 people. The service was great. The waiter gave me a creme burlee on the house. That was very nice of him. Ambiance was perfect for a relaxing dinner. Although the meat was on a saltier side, non of the meat tasted dry even the chicken.",uHIM9EeO-9-AdVtmHERBWw,1,0,4,TzBk-w2qNKG8hg7TzsdhrA
5619419,2016-01-08,0,ewIXHLlaIfp9U3NrsgilVw,"Been coming here for over 20 years. Yolie is a wonderful person and her food is even better than she is!

The try tip is Apsley wonderful as well as the chicken.  The good news is you get to try seven different meats.  

I highly recommend this place!",Os_u1VHoESbCIHmHclF0CQ,2,1,5,x4MODnJLQQXYgu-kM5xSmw
5799000,2014-08-27,0,ewIXHLlaIfp9U3NrsgilVw,"This place is in dire need of a make over. I walked in and the smell reminding me of my grandmothers apartment. So did the decor. So far the place looks old and smells old. The service was great, and then the food starting coming. The chicken dry, the turkey wrapped in bacon was dry, the sausage was okay, then they brought old tri tip. We could not eat it. As they were cutting it, it looked grey, the taste was bad! 
I would never go back there and any reviews on here that say this place is amazing must be from the owners family. Save your money! Buy one Get one is a waste of your money. Nice people but they are not serving fresh food.",H1DdXT2zGzAylXeiI67gGA,3,1,1,LVn4oviTwT0XiOvOOd5d4w
5883826,2008-10-16,1,ewIXHLlaIfp9U3NrsgilVw,"Everybody I take here adds this dining experience to their list of favorites! The experience comes right from Copacabana Beach in Rio.. It is a carnivore's delight with 7 different meats served to your contentment with all the trimmings.  I am not sure how to spell it for sure, but the &quot;ciapina&quot; (Brazilian Margaretta) will knock you on your ass then pick you right up. It is a wonderful place for a party and a delightful experience.  I've been to many Brazilian barbecues... including in Brazil. This is my favorite. And the hostess-- Yoli is friendly and nice.  If your there for a trade show, or other busy times, make a reservation, and make it early as the place becomes a mad house pretty quick.",Dpxxh-7yz9zrNPopaVoHAA,3,1,5,tio0YgDkXqhIQ7RNxv4UVg
5932912,2007-03-29,0,ewIXHLlaIfp9U3NrsgilVw,"YUM! I have been to Yolies several times and not once have I been disappointed. As others have mentioned come hungry and be prepared for a serious meat fest. No I don't mean the Thunder from Down Under show, I am talking about skewers of tasty goodness.

One thing I appreciate about this Brazilian steak house is that they don't just bring out the meats and slap it on your dish. They ask if you want it rare, medium rare, well done, etc. They explain the preperation which makes it more personal and enhances the experience. 

The wait staff was attentive and never left us hanging. The plantains are sweet and delicious and besides the meat the only other thing stuff in my face. Wonderful wine list and Brazilian beers and sodas. I had one that like a fruity ginger ale that was a great way to finish the meal.

Go and try it. I thought the meats and experience was far better then Samba. A favorite stop anytime I am in Vegas.",hm694yLxGMvm0w0WZGHG6g,1,0,5,1VO1i_AOUsWSfuJI8FmLmA
5990455,2014-12-03,2,ewIXHLlaIfp9U3NrsgilVw,"We ate at Yolie's Brazilian Steak House last night. We had a living Social that was like $50 for 2 with 2 drinks. It was exhalant despite the fact that they were set up for a Christmas party coming in in 45 min. Our Waiter was Frank and he was superb. He apologized right off saying that he was going to rush us a little so we could get out before the party. WE thanked him ahead for that as it was the UNLV Marching Band so it was going to be load college students that were going to be drinking a lot.
The food was really good started with soup and a salad then we had some Vegies and Chicken. Fallowed up by Bacon Raped Turkey, then Tri Tip, Top Sirloin , Pork loin and finally lamb. I did not care for the lamb as I don't like Lamb in general. Also the tri tip was just ok. But my favorite things were the Chicken and the Turkey. 
We will for sure be back again at full price. 
Oh it is a little hard to find as it is up an inside corner of a Food Shopping center up stares",kr5gKgvNxE7ETKAQmZPKJg,1,0,5,7ZP3j5B_IpgfbhTZLpZJrg
