,date,funny,business_id,text,user_id,useful,cool,stars,review_id
2543826,2010-08-18,12,ewIXHLlaIfp9U3NrsgilVw,"If I could give a 4.5 stars, I would.  

I was on my way to Firefly with my wife, but my wife doesn't really dig tapas.  Me being as resourceful as I am, find a Brazilian BBQ tucked upstairs and across the street.  Boy were we in for a pleasant surprise.  

The place isn't your typical Vegas, glamour, baller, bling bling restaurant... It looks old on the inside... Do they need an update on decor?  Sure.  But am I willing to look past that because I'm here for food?  Abso-effin-lutely...

The only reason why I actually picked up the menu was to see how much the Brazilian BBQ costs.  Not bad...Comparable to strip buffets for us non-locals...Wasn't really too concerned because I was about to get the welcomed self-induced meat sweats. 

The staff was really attentive and really made sure that my wife's first Brazilian BBQ experience was pleasant.  They gave us generous portions of meat with every pass.  There was no lull in-between meats.  They didn't rush us with the meat service and actually took the time to explain everything that was going on.  Meat wasn't overdone and although the variety was a bit short, they made up for it by making the meat they had really well...A really pleasant evening.

After eating, I checked the other reviews on this place. I don't know how this place got reviews any less than two stars.  I understand that there are phenomenal Brazilian BBQ places out there and personal preferences come into play, but if you didn't like this place because of the decor, you obviously didn't come here to eat and shouldn't be writing reviews for food.  If it was service, then I can sorta take your review with some gravity.  However, if your complaint was about the lack of people in the restaurant, once again, you obviously didn't come for the food.  I would think that that's why people go to restaurants. To eat. To eat food.  If you can't manage to do simple things like eat by yourself, you must get really frustrated in a bathroom. 

Let me let some of you other delusional yelpers in on something.  If you go to a Brazilian BBQ and don't get the Brazilian BBQ, you look like a moron.  That's like going to In-N-Out and asking for Chicken McNuggets.  Or better yet, asking for a hot dog at a vegan restaurant.  (Side Note: I do realize there are vegan hot dogs, vegan tofu burgers and vegan bacon. That is disturbing...I wouldn't eat a vegetable if it was shaped like meat.  I'm not going to ask for meat shaped into cabbage.  You're just lying to yourself.  There's a reason to why you have the instinct to eat meat.  Because it's good for you in balance.  It's your own business to look like you walked out of Auschwitz, but stop pretending that you don't miss bacon...) Nobody forced you into the meat buffet.  The ONLY reason why you would and should go to a Brazilian BBQ is to stuff your face with more meat than a gay gangbang bukkake flick.  

HAHAHA...Sorry, I had to laugh at that one myself.",W8eQoKwuZPu7Gdz8TW-7yA,5,2,4,yEkKjoVt0FECcnTbRbm54w
2549502,2012-10-06,0,ewIXHLlaIfp9U3NrsgilVw,"Firefly was booked solid, so the team suggested this place instead.  I didn't realize what it was until I got here - the same mediocre Brazilian I tried years ago.
Compared to my last visit, service was (slightly) better and the food was worse.
It's very much a silver hair crowd, so if you're bringing your hot date here, don't.
Given both Fogo de Chao and Texas de Brazil up the road, there's no reason to come here.",m7mQf4FbNRZ6u1wrHEmonQ,1,0,2,YFxxXDTqDVWCA2jzAmlmBg
2615978,2012-08-23,3,ewIXHLlaIfp9U3NrsgilVw,"There are much better Brazilian restaurants.  The poor service overshadowed the food.  The waiter and bus boy gave us the hard sell on the all you can eat, we succumbed, and then we waited 10 minutes before we saw any meat!  I called the waiter over and discussed our displeasure with the delay, especially after seeing the waiter walk by with meat and requesting meat directly from him.  The waiter had the nerve to argue with me before finally bringing out some meat.  I am fine with paying $35 for all you can eat, but if I'm paying $35, I expect the meat to come around at a reasonable interval.  I'm never going back.",fBEwo1ogY45H85oRW86L_w,1,1,1,UhHAfV9GRJIQq9kkmE1cPQ
2805384,2010-08-05,0,ewIXHLlaIfp9U3NrsgilVw,"No impressed, very old, dingy places. food was very dry. meat selection very limited, price very high. Great place if you like dining alone, not many customers here. service was very good, lots of employees hanging around with nothing to do...",QrHAOWGkahT2nmvwcHt56w,1,0,2,T6DHbD2IbLKXQlApEoklxg
2852732,2012-03-04,0,ewIXHLlaIfp9U3NrsgilVw,My GF and I were going to Firefly and like usual they were packed and we didnt want to wait 45 mins for a table so we decided to try Yolies. BAD idea!!!! The whole experience was a nightmare. For a hundred bucks all we both took away from here was a bad after taste and stomach ache. Avoid this dump at all costs.,8PD09BCUavP71paN77aijg,2,0,1,czhG8XLbfARDbzfhQZM49Q
2873280,2010-02-25,0,ewIXHLlaIfp9U3NrsgilVw,"I haven't been here for a while as I found it unremarkable on my last visit.  Soup, salad and other items outside of the main meal were forgettable, entree items from the rodizio were reasonably good, sometimes a little off (i.e. dry turkey), service was very hit or miss, with wait staff either moderately attentive or hard to get a hold off.  Decor and sensibility of restaurant was dated and uninteresting.

I have not been to other options in town (i.e. Texas de Brazil, Samba or Brasil) other than Rumjungle's rodizio, which was a little better on the food, but I did not like the club atmosphere (and I hold nothing against them on the club atmosphere, as this is delivered as advertised but not my taste for dining at least).

Would recommend trying other options.",Oixv0VgElz8pxQFp2lkdJg,0,0,2,Q_hntynEon12ESgxXvpy4g
3098309,2015-10-18,0,ewIXHLlaIfp9U3NrsgilVw,"Had a reservation for a month, called a week ahead to confirm, showed up and the place was DARK! Apparently they had 30 MAJOR health code violations. Went to Fogo De Chao instead. Go to Fogo, ditch Yolies",OIUfWIsArrsloW3UIsxH8g,2,0,1,mSDGqH9ONtQPnUkTsXB7YQ
3203578,2008-01-27,0,ewIXHLlaIfp9U3NrsgilVw,"If this is how churrascaria is done in Las Vegas, it's a shame!  My family and I went here for lunch.  We were the only ones in the restaurant and we couldn't locate any of the employees.  Not one sound came from the kitchen, which I found to be odd.  I was begging to leave because the emptiness and silence of the restaurant suggested that this place was going to suck....and man, was I right!!  There was only one server handling the small selection of meats.  The meat was DISGUSTING.  I could not finish what was on my plate because it was just horrible.  All the meats were dry and some tasted old.  I think that they just warmed up the meats leftover from the day/s before and served it because we did not wait long at all.  I learned what real churrascaria was supposed to taste like when I tried it in Chicago.  If you're looking to eat at a Brazilian steak house in Las Vegas, I'm warning you, do not go here!!!",McfNTO1xiR1vtmdQ5rmXag,1,0,1,qLOcOyp3KQNypNkkkN6esA
3211639,2010-01-03,1,ewIXHLlaIfp9U3NrsgilVw,"My husband and I went there to try something different. And different is what we got. We were the ONLY people there on a Saturday night at 8pm..prime dining time right? we got the huge meal tour even though I was not hungry enough for it, it was, I felt a good deal for as much food as they give you. I felt like we were in ""The Shining"" a huge elegant ballroom completely alone.But instead of creepy twins, our waiter looked like Moe from the Simpsons. Awesome.The other wait staff was freakin hot tho. One of the guys gave me some salsa, He warned me 3 times ut was hot. I was thinking how hot could it possibly be? It was like fire incarnet. AMAZING!! But you HAVE to ask and you HAVE TO USE SPARINGLY!! Food was good, def a meat eaters place for sure!! Half way thru the meal, a couple came into the completely empty place and they sat them, right next to us. I mean, whatever but I would like privacy if it is all empty. NOT have to listen the akward first date obviously not going well echoing through the place. At any rate, I will be back to see what it is like when I know what to expect.",ftim8Jl7IOS53p0XxR3D_A,0,1,4,R9a4FB_jTgEUoiRTBEr6NA
3234664,2008-07-13,0,ewIXHLlaIfp9U3NrsgilVw,"Wow, This place has actually gone down hill. I remember when it first opened, it was less formal and not as well decorated inside. It was also not a busy as it gets now. I think that success has actually hurt the place. The service used to be EXCELLENT! They made you feel like part of the family. Now that they are busy they seemed rushed. 

The food is still very good. It is easy to overeat in this place. If you like huge portions of meat cooked over a fire this is an excellent choice",jzSQHqViGjdB4MJDqNISEA,2,0,3,nWpCTXV94Da4khc3_EC39g
3294137,2007-12-26,0,ewIXHLlaIfp9U3NrsgilVw,"I went here about a year ago, so my memory might be a bit fuzzy.  However, my general impressions were that the food was pretty good and the service was well intentioned, but a little bit slow.

Anyway, this place, as I recall, was not all-you-can-eat, though you probably will get enough to eat.  I don't remember exactly how much it was since our out of town dignitary was kind enough to pay up.  I thought it was around $30 a head.  Not exactly a bargain, but probably better than the deal you will get at the Mirage.

If you need Brazilian food bad and you in town for a few days, I would recommend checking this place out.  I would not go in with super high expectations, though.",xgcxhbbnokR-ZBazUrtXnA,0,0,3,sAJf7b7G-_kJiWr2623xug
3317084,2014-07-27,2,ewIXHLlaIfp9U3NrsgilVw,"So, unlike another reviewer, I don't really know what Brazilian food is like. But, what I can say is that the food at this place is great! I definitely recommend getting the package where you get to try all the different meats. It cost about $35 per person but then you get to try a little bit of everything!

Everything was very good, and some things were exceptional! The waitstaff was friendly and the service was also good.",Q0-eFcI7bq9ABmNuPgGoqw,2,0,5,3wFVcIK6sFjM215DjmfJqg
3561320,2013-04-25,0,ewIXHLlaIfp9U3NrsgilVw,"I have been a regular at Yolies for years, it has always been totally top notch, from service, to food, evreything..  I have to say I was dissappointed this time... hopefully just a random bad day.  
The lettuse on salad was just a bit brown around the edges, some of the meats were dry, even the service was a bit stale... 
From a place where customer is always king, service food is always sterling, I  was saddly disappointed... 
Step up the game, update restaurant, the carpet is from old Vegas!!",eNwOWFVoMn_nzirel2KPpw,2,0,2,SZPMjFB58WcWg62QSEabAQ
3647575,2013-01-07,0,ewIXHLlaIfp9U3NrsgilVw,"It's been a while since I've been here, but I would like to tell you about my experience.

It was nothing like I expected.  In fact, I had no idea what to expect when we came here to have dinner.  The place seemed big to me, and we pretty much had our choice of where we wanted to sit.  We were given menus and as we were looking them over the manager came over and said something like ""I can tell you've never been here because you're looking at the menu!""  He then explained the plan to us.   

We were given a set of tongs and when servers would come by our table with a huge skewer of cooked meat, they would slice it off and we would pick it up with our tongs.  Don't use your fingers!  So much meat...such a limited appetite!   I can't remember every meat that was served to us but there were at least 4 or 5, and I'm thinking there were more than that.  All I know is that we were stuffed when we left.

I think the worst I could say about this place is that it forces me to interact with my servers; I'm so used to the regular routine where a server comes to our table, takes our drink order then returns with drinks to take the food order, delivers the food then shows up occasionally to see if everything is ""still okay"".  Even though I don't have to interact much with the servers except to tell them ""Yes, thank you"" or ""No, thank you"", I still have to step out of my routine and it's a bit of a distraction when I'm talking to the Hub.  Still, I'd come back here.  I love giving restaurants a second chance to see if I liked them as much as I did the first time around....and it would give me an opportunity to update my review.  ;)

Like I said, it's been a while since I've eaten here, and I'm hoping they're at least as good as when we ate here.  However....your results may vary.  ;)",AQXx0_3hB71kQ23gwi-gOw,2,1,4,0eA2bTq18QeE6BVOXAkPXg
3718574,2012-03-06,0,ewIXHLlaIfp9U3NrsgilVw,"I LOVE YOLIES! Every time we go to Las Vegas (3-4 times a year) we go to Yolies. 

I honestly think in our current society of ""I want what I want, when I want it"" makes it harder for Yolies to shine. Yolies shines with its all you can eat sampler menu.  Honestly, I think of it as a meat orgy, its amazing. but when someone is accustomed to being handed a menu and being served exactly what they order than ordering a whim of ""meat orgy"" it makes it harder for them to truly appreciate the awesomeness of a promenade of meat.

The service is always amazing. The coffee tastes like heaven.

Once we went with a party of 12 and the service was still great, even with two vegetarians, though I am not sure why they choose to come with us to a MEAT dinner, they really liked their dinners as well. 

Its my all time favorite place to eat, and I look forward to it for months between our trips to Vegas.",G4Mlt64y1RvpZ-zyim_aFQ,0,0,5,HaMPvToPcOKHe5l0dQGdpA
3821097,2014-11-19,0,ewIXHLlaIfp9U3NrsgilVw,"This was my second experience and place when it comes to Brazilian steakhouses. Though sadly over time it has seemed to nose dive quite a bit, it's been around longer than the other competition that's now in Vegas but that's probably the reason. New competition has shown up and this place doesn't seem to be able to keep up. We've thought about going back but we've found better, who knows, maybe one day.",Ir4_vnstzggNRfwODHvLzA,1,0,3,ClsmWSQ6zlBy6I2VONDPXQ
3928153,2012-02-23,0,ewIXHLlaIfp9U3NrsgilVw,"The service was excellent. 

It is an ""old school"" kinda place. Nothing trendy here. 

The food was top notch. 

We went to Yolies because we heard they had an ala carte menu as well as an all you can eat sample menu. My husband never eats much at one time. So he ordered the porterhouse. The waiter told him that the rib-eyes were the way to go. He was right. The steak my husband had was perfect. 

I had the sample menu.  I couldn't have been more impressed.",BkFn7V7fNc2bCWWyyF_3uA,2,1,5,vcEYHeOyGrejPNUskmg7CA
3955533,2016-06-21,0,ewIXHLlaIfp9U3NrsgilVw,"Very good food, family environment. Everyone is attentive and nice. Polenta and lamb to die for. The beef was delicious and juicy. I had wine w my meal ...my daughter had iced tea... never had to ask for refill. Food kept coming .... Very expensive but worth every penny...",ACoz7n_bR1l7lTBHlWX0Dg,0,0,4,EbZb3TU7l6nNLVUR5vd8aw
3965695,2016-01-26,0,ewIXHLlaIfp9U3NrsgilVw,"Went to Yolie's for a holiday party and the waiter gave me a discount coupon to come back.  Went for lunch with co workers, but they were closed by opened up just for us.  The owner Yolie always treats you like she has known you for years.  Excellent service and yummy food!",Ec58JQSmmdcgFKY79MMS0g,0,0,5,r1C_Npxh2B3ZsyAGwjjgAA
4071332,2009-06-06,1,ewIXHLlaIfp9U3NrsgilVw,"DO NOT GO HERE!!!!

AS always I should have listened to you Yelpers. I tried, I really did but the rest of the party I was with insisted they wanted to go here even though the restaurant next door was Moroccan and had belly dancers! ( not to mention 4 stars). Just as other people have commented, Yes there is a very annoying Italian manager that just loves to teach you about ""Brazilian steak house"". I have a feeling he is going deaf, everything coming out of him is very boisterous and he even bends over when you place your order and yells in your ear ""WHAT?"" The horrible part was there was an actual Brazilian in our group but the manager had no idea... he thought us so many things about ""Brazilian steak house"" he even taught me how to drink out of a cup.  He was very perturbed when we wanted to see the menu instead of getting the ""Brazilian steak"", ""YOU DO NOT WANT TO EAT BRAZILIAN FOOD??"" This is because it is the most expensive thing on the menu.

The restaurant inside looks like they picked up everything at a garage sale and then put it all together in one big space. There is a huge chandelier in the middle of the restaurant that consists of 40 green desk lamps turned upside down. The restaurant also comes complete with pastel crane ""posters"" from a 90's hotel.

The food:
DISGUSTING.
I ordered the Greek salad because I was scared to get anything else. They over drenched it with salad dressing and the feta was out of those President packages you get at the supermarket. The Brazilian guy we were with got the actual ""Brazilian Steak"" which is all you can eat of different cuts of meat. ""NO DOGIE BAGS AND NO SHARING"" barked the manager. I didn't want to eat any of his stinking meat anyway it looked like it had been recycled from day to day. One of the waiters asked my B.F if he wanted more turkey ( Brazilians don't even eat turkey) and he said ""no"" he was full and the old geezer got mad and said that he is required to ask and that he should be polite! ok... the B.F puts up with my shit all day long and doesn't say a thing... this guy just wanted to be a dick.

P.S- Even some of the other waiters were making crazy faces(LOCO) behind the managers back  when he was talking to the table!! Everyone thinks he's an idiot, even his employees!!",EUQNMT_lU1_oromNfNeWzw,2,1,1,guMtZNBkj5YSBgcN3kYyWQ
4110300,2008-07-09,4,ewIXHLlaIfp9U3NrsgilVw,"Service - 0 stars (it's my system, so I can give it a 0 if I want)
Food - 1 star
Value - 0 stars

This was the absolute worst place I have ever eaten, or given a review to actually.

How bad was it?  Frankly, if you could give negative stars, this place would get it.

The staff was extremely rude, especially the manager/owner ... whoever we ended up talking to.  The food was below average -- we seriously think they ran out of meat but were still bringing people in there.  There were lines waiting for the one inept cook to slice the meat, and there really wasn't enough to go around.

When we attempted to go up for seconds (um, hello, all you can eat?) we were TURNED AWAY and told to have some of the salad bar.

Seriously, worst place I've EVER been to for food.

Finally, we just got fed up with the lousy service, lack of food, and the attitude of the staff.  We demanded to talk to the manager (not sure who we ended up talking to) who we complained to due to the lack of meat.  His response?  ""You should try the rice.  Plenty of people come here for the rice.""  Are you kidding me?  

We were going to pay for a garbage meal, cutting our losses (we had a concert to go to shortly thereafter), but after hearing his response, we exchanged words in front of the entire restaurant about the poor service and the lack of food, AND OTHER PATRONS CLAPPED.

We walked out, refusing to pay for garbage, and warned other people outside from going in.  They were thankful and left and didn't waste their money.

WORST RESTAURANT (if you can call it that) EVER.",vHxGDZJuqDo1M3NiDtfmwg,11,2,1,JpNntqWrBC-KzqkB1J82Hw
4177948,2009-01-12,0,ewIXHLlaIfp9U3NrsgilVw,"Thank you Yolinda for always making me and my guest welcome to your restaurant.

It's always nice to come to this fabulous restaurant for business meeting with my clients. The food and service is always excellent, and of course, my guest was amazed by the selection of meat you always have to offer.

Keep up the good work and always keep the 4 stars!!",F33utOIKKTw6jV_03cDV-g,0,0,4,VIysQSYYTzyG6cQX71kbjQ
4202364,2015-12-26,0,ewIXHLlaIfp9U3NrsgilVw,My girlfriend and I went to Yolie's for Christmas dinner and we were not disappointed. Yolie herself came around and greated the few guest who were eating dinner and welcomed us. Everything from the salad to the meat was delicious. Definitely get the Mix meat. We will be back!,ievQHqbKya5iyOFVoWJgBQ,1,0,5,JJKvAOt4ILLIkbni6qlrrw
4211039,2012-10-13,0,ewIXHLlaIfp9U3NrsgilVw,"This is my favorite Brazillian steak house in town. I like Texas De Brazil, but this place is more homely. It's intimate, the staff treats you like family and the owner is a character! 

The rodizio meats are excellent. The banana is sweet crispy on the outside and soft on the inside, The rodizio pineapple is stellar, The fried cornmeal is phenomenal, the service is amazeballs, and the price is decent. MUST TRY.",Xx9KxKczJUkSJEcWmKtvLw,2,0,4,xHLdQLhzFPwkzROXOEYLJQ
