,date,funny,business_id,text,user_id,useful,cool,stars,review_id
400,2009-08-06,0,ewIXHLlaIfp9U3NrsgilVw,"My first time to try Brazilian Steakhouse a couple years ago and I went to dine at Yolie's.  Atmosphere is serene and romantic, salad bar is not as articulate as Texas de Brazil, however the food is just the same ~ great steaks, friendly gauchos but not as friendly as TdB's gauchos, price range is reasonable (shelled out $35 for dinner of 1).  I would recommend this place.",AuIK5tF2GjO7SftHawTLKw,0,0,3,lt7nl9Zlmlo8Uq175yIVaA
12251,2015-02-19,0,ewIXHLlaIfp9U3NrsgilVw,"READ THIS BECAUSE THIS IS ALL TRUE!!!!! When we went there an old lady was being are rude to us. We asked her where we could sit and she said "" I'm right here maybe you could tell me!"" We were shocked by how rude she was. Besides that, this guy brought us 5 little pieces of bread and it was 3 people at the table. We asked him for more and took him about 40 minutes to ""cook it"" when he brought the first piece of meat it was literally BLACK and when he cut it blood poured down of my plate. I was grossed out!!! After a couple minutes he brought more meat and it was BLACK again and as hard as a rock! Every meat I tried here it tasted worse than trash!!! We left there feeling sick and I'm NEVER going there EVER again. I RECOMMEND NOT to go there. Save your money unless you like to throw your money in the garbage can because this steakhouse is the same!",uw-aCFJHO_WeuvDd8uphMA,3,0,1,UBbyq86NY9jaqkHtocLK5w
68578,2014-02-25,0,ewIXHLlaIfp9U3NrsgilVw,"I was really surprised by all the low ratings! We went  recently on a Saturday night and were wary because it was fairly empty inside. We almost left, but were glad we stayed. The sides were a nice selection and all enjoyable. The tri-tip and lamb were outstanding! I woke up the following day thinking about the tri-tip. I enjoyed everything we ate. The turkey and chicken were also excellent. The pork and sausage were a little salty for my taste, but everyone else had seconds. The tiramisu for desert was the weakest course we had, but even that was okay.  The service was good, they all seemed to be trying.  I will definitely be back.",vWj0EJB6P1ktQUvvq8T_vA,0,0,4,CIjaj_guNL5xnVac9R64mQ
88341,2014-04-08,1,ewIXHLlaIfp9U3NrsgilVw,"I had gone to Yolie's many times in the past when I had visited Las Vegas but hadn't been there for at least 5 years before I ate there last night. The food is still good as it has always been. You definitely have to like meat and more meat but all that was offered was very good. The drink service however was horrendous! We had a group of six and came in early in the evening when the place was about 25% full. After, what I'm assuming was the owner, gave his little introductory speech and left, we waited about 15 min before we had to flag someone down for drinks. The frazzled waiter took our drink order and that's the last we saw of home for 20 minutes. Then only a few of us received our drinks. One of our party had to reorder his beer three times and finally got it about 45 minutes after he originally ordered it. On top of that the cocktail waitress came with an attitude and seemed irritated when we mentioned that our friend had ordered his beer three times. When we asked for the bill, we again waited at least 15 minutes when we had to finally get up and start walking out before they would respond.


This will be the last time at Yolie's for me!",gGMQj8bklUhBzyZEWUXKvg,5,1,2,5iJ3UQEof40yWUNRed_FHA
92312,2012-05-22,0,ewIXHLlaIfp9U3NrsgilVw,"Yolies at some point WAS the best in town but they have fallen off the wagon. Service now sucks, and food has become mediocre. Although I must say that their Chimichurri sauce is still the best! Its time for the place to have a renovation as well because the decor in there takes you back to 1989.",e8PJsg17Nwgi84KV15v2UQ,0,1,3,EzWSBkcgpvrM-6_pLMxFOA
175048,2014-01-12,1,ewIXHLlaIfp9U3NrsgilVw,"It was terrible. I received a coupon from United Blood Service $70 value for 2.  With 2 sodas, our total bill was $84, without tip. A waste of money considering I left hungry.

The restaurant looks old, a little dirty, but smells delicious. We got rice, potatoes, polenta, broccolli, carrots, bread and cold butter as side dishes. The rice was very, very bad. Potatoes were ok. The best part of dinner was the broccoli.

The wait staff and owner weren't very friendly to my husband and me (because of coupon?). We were offered 7 cuts of meat. The chicken and turkey were good. All the other meat were bland. When I asked if that was all the food, they told me yes. Quite disappointed, but at least I know. Last time I ate here was 1997 and I don't recall it being this bad. I am not sure what all these good reviews are for. I have been to many more awesome Brazilian Churrascarias.

It's great food if you don't have taste buds.",Aa7VXpZqfSXXGdFmnjks1A,6,2,1,UXdOFocQGbRgURQv7fF05g
230677,2015-02-15,1,ewIXHLlaIfp9U3NrsgilVw,"Wish I could put 0 stars. Customer service was horrendus. Came here and got seated with a menu and waited. It took 5 minutes to get just water. After about 20 minutes,  the owner comes over and pushes the all you can eat for $40 on us; but no one was that hungry, so we were ordering off their menu. After berating us for coming to a brazillian restaurant and ordering off their menu and not spending a couple hundred dollars on what he wanted, we finally just walked out. Right on our heels were two other groups that got pissed off as well. Good job owner, because you decided to be a dick you lost out on not only our money, but others as well. Avoid this place if you can!",ePkuQUh_g0t09hXQ98dhfg,5,1,1,o4-t20gZ9b-HR5n6VSDC1g
266418,2014-02-02,0,ewIXHLlaIfp9U3NrsgilVw,Great food and excellent service.  Most of the reviews don't match the actual place.  The chicken and lamb are superb.,pZuLCKnWEAamt1WzlD0yGg,0,0,5,aT1-oYg5KVZETHSNOlYHRA
317333,2014-02-15,3,ewIXHLlaIfp9U3NrsgilVw,"I've gone to hundred's of restaurants and seen my share of service blunders, but this one is the absolute worst.  It's amazing how they can make you feel like they don't care within 30 seconds of sitting down.  Waited 20 minutes to be acknowledged at the table, and saw the same happen to other couples there.  I walked out, and so did two other couples in my area.  This place is a disgrace to those hardworking restaurant owners who care about their guests.

Food was garbage, and what a joke it was to watch them take the piece of meat and use the knife to move it to my plate.  I guess they were  too cheap to purchase tongs to grab the pieces.

I will repeat - worst restaurant I have been in in over 10 years - avoid at all cost.",JJ7axbbzYFXqGEDZOwtBWQ,5,2,1,yp8CPsIHkGjiLjH0-O3AoQ
386872,2015-02-15,0,ewIXHLlaIfp9U3NrsgilVw,"If it was possible to give this experience 0 stars, I would. This restaurant swindled us. We were a party of 13. When we sat down, we asked the waiter what the vegetarian options were and he said he would ask the chef but ensured us that it would be delicious (he said he had a girlfriend who was a vegetarian and he promised to provide a delicious vegetarian meal). Then he said he would bring us some appetizers. He brought several. We never saw menus. He just ordered for us. He doubled shot sizes without asking. The vegetarian meal was steamed vegetables. Tasteless steamed vegetables. I had to add salt to make it mediocre. My friends said the meat was not yummy. It was not worth the price.

Our total bill for 13 people was $1000 before tip. $400 of that was 4 doubled shots. We were all blown away by this. Why would the waiter double the shots without asking, especially at that price? We were swindled at this restaurant and I wouldn't recommend it to anyone because I just don't trust them.",RnmelK_i5YLf9D9WMwpH-w,4,0,1,Rw8pR-eS651wh7LjR7gPEw
425423,2011-04-04,0,ewIXHLlaIfp9U3NrsgilVw,"I have been going to Yolie's since the mid 90's - when tradeshow crowds dictated a 1+ hr wait.  I haven't been there for several years - and was a bit concerned based on some of the recent reviews on Yelp.  So I took my wife here this weekend for her first Yolie's experience.  It was just as I remembered it!

The staff was VERY friendly - getting our Caipirinha orders out quickly, to accompany the bread and salsa that is served.  

I knew better than to order anything OTHER than the special - all you can eat meat!  

We feasted upon chicken, bacon wrapped turkey, sirloin, tri-tip, porl loin, sausage, and lamb.  The waiter was bringing it as fast as we could eat it - and we were offered as much as we could possibly take.

I am still a bit puzzled as to how some folks say that they were denied meat?  If anything, they could use the red/green cards used at many of the chain Brazilian places (all a copy of Yolie's!).  We passed on several rounds of meat, but as soon as we asked for something, it was on our plate within seconds.

Granted, this is not a glitzy place that you go to for the ambience.  But Yolie herself has always greets me, along with her very gregarious Italian head waiter (I never learned his name).  

I will always choose Yolie's over any of the big hotel's or chains that are present in Vegas.",Cds2ZCeHiMA_Hm7pjJ9Q7Q,4,0,4,8PTXQS8ErJl2yOFgKusFkQ
460977,2009-01-14,0,ewIXHLlaIfp9U3NrsgilVw,"i have been going to Yolies for years . This is the best Brazilian Steak house out side Brazil.  if you love meat this is heaven. Quality of the meat is the best . staff are nice and price is right. 
just remember if you are short in time this not the place to go.",VP0OFseqZlV0UkJ9IS56sA,0,0,5,nMTaeQgM7H6BnDQjPKETGA
507950,2016-02-15,0,ewIXHLlaIfp9U3NrsgilVw,"Bad bad bad service.....!!! on valentines day...!!  Waiting 30 min to get a drink, another 20 min to get one liltle  piece of meet ....i was ignore for the waitress many times and THE RESTAURANT WAS HALF EMPTY.....",XqaYrCR91-Ln8X6AFsGmVw,0,0,1,d9a--gXMWNODPaoVAkwvnA
557502,2015-07-16,0,ewIXHLlaIfp9U3NrsgilVw,"This was the most awful meal and service we experienced in a long time if not ever.  The staff was entirely confused.  No one knew who was expected to do what so we just sat around for long periods of time waiting for service from anyone.  The waiter was apologizing for the waitress who was running around aimlessly.  We had four different employees bring us food/drinks and it took about 15 minutes for each acknowledgment (15 minutes to get water, 15 minutes to get wine, 15 minutes to get bread...etc.).  Once the food came my shrimp scampi tasted like nursing home food.  The veggies were flavorless as well as the side of rice.  The shrimp were small and drenched in a generic cream sauce.  All in all it was an overly expensive meal which for the same money I could have had a fantastic buffet at any of the casino hotels.  Stay away!",-4L6vSCT4W2jvMgvYH4woA,4,0,1,243y1GmpgdH17F9kvhsmeA
568269,2016-04-26,0,ewIXHLlaIfp9U3NrsgilVw,"Walking away VERY UNHAPPY!  We called ahead for lunch, and were told ""yes vegetables, rice, fried plantanes and all meat included in lunch price of $17"". So we thought great! Showed up, they looked closed. Extremely dark.  Service was nice, but hard to understand their accent. I guess that's where we went wrong. Asked to see a menu, and went with the lunch price rodizio style lunch. 

Went pretty slow, took over hour and a half.  Food was OKAY. Most all the meat was dried out, but had okay flavor. 

Bill came and it was $87!!!!! 
We asked why so much and he said ""price is $43 per person"". We argued, asked to speak to the lady who told us $17 price and they said ""sorry"" but wouldn't budge on price.  

We feel super scammed, and ended up spending over double what we were told, for just an ""okay"" meal.    We wouldn't have paid that price for dinner.  Let alone lunch!!",W_FvvA8PhVtswXPlVUGpJw,2,0,1,PIOqyq8omFBHoAeioMdrJA
621175,2016-01-22,0,ewIXHLlaIfp9U3NrsgilVw,Worst place ever! Took more than 30 mins just for a glass of water. All the meat was rare (bloody) I don't do meat that rare. Don't make the mistake get pizza you will be better off.,OIDJR9rCu5LP16pnW_ZdZQ,0,0,1,sjoh6xaTShoRKhr7kQIZyQ
810786,2011-11-09,0,ewIXHLlaIfp9U3NrsgilVw,"Food is great! Unfortunatly the service isn't. Only 1 person serving meat not like others where there are 5 or 6 people serving. They better improve there game! Fogo di Chao is opening across the street! This place better improve on service! We went the following week to Texas de Brazil, what a difference! I like people to try Texas de Brazil or even Fogo di Chao and try to come back here! Food is ok here, there banannas are the best here out of anyone so far in Vegas, but the downside is you only get 1. I can unfortunatly see this business go out of business maybe with-in the next year if there lucky 2 years. Reason of this would be because of Texas de Braizil and now Fogo di Chao. They would count on visitors that don't know better to eat at Yolies. But locals and returning customers would go to Via Brazil, Texas de Brazil, or Fogo di Chao, or even Sambas at the Mirage.
It's just sad to see a business run down in service, quaility and even the decore. Even if they improve on service and have good selections of meat, they won't be able to compete with the top 4 Brazilian Resturants in town. The food is good but now there are better places, it's not the 80's or 90's anymore where this was the only thing.",rFeuV4U0vfls21N4ROgPKw,0,0,2,m8PUMG3lSv0vYra-537OrA
904298,2012-11-08,0,ewIXHLlaIfp9U3NrsgilVw,"Yolie's KILLED IT!  The Maitre d' was the best I'd ever had.   He was nice, funny, charismatic and very helpful.   He remembered my colleague's name from the year prior.  He had stories from all over the world and shifted between English to Spanish, French and German with ease.  

The black bean ""soup"" was phenomenal, in fact, that's what lead me here; I'm looking for a similar recipe.  

In the end, the sirloin was the tastiest, but there wasn't one meat that I didn't thoroughly enjoy.   The lamb, which I don't usually love, was even VERY tasty. 

Not sure how they earned One-star ratings from some people, but I loved it.  I was sad to hear how the traffic to their restaurant had dwindled since the other area Churrascarias started paying $5/person to the local cabbies.   


Anyway...GREAT place!",r0m3SPEZfqb1dD8xO0Z4gw,1,0,5,L0OFkCImGxIJ3dfrX4qioA
929414,2010-08-02,0,ewIXHLlaIfp9U3NrsgilVw,"This is like a carnivore's dream! You are met at the door by the host. Who is very loquatious (sp) he talks alot is what I am trying to get at. Which doesn't really bother me, it really gives the place ambiance. I loved the meal . My favorites are the turkey wrapped in bacon, the tri-tip and totally LOVE the lamb. It really is an amazing meal.  Their flan is unbelievable! 
I wasn't really crazy about the french fries that were served with the meal but that has been part of the menu forever.  
All in all ... it is a great meal great experience.. I suggest going with a group of people, it makes for a lot of fun",Pn4W0F3wc6B5fAEwpKY0rQ,3,0,4,2ZMnSSVzA7wQSiwBwhkRhQ
960687,2014-11-09,0,ewIXHLlaIfp9U3NrsgilVw,"The good is OK and the service is horrible. They argue in front of us and the other guest. When we ask them question they just walk away. I feel like we were unwelcome due to i use the groupon because our server and the busser hardly stop by and when we ask for a refill, they just give a jock for us to do it for ourself. I will never come back and do not recommended this place for anyone.",eFAoIuCwbW_PsFrW5-NMdA,3,1,1,BQLBZDIMN62ty9frr-NOpQ
971207,2010-10-28,3,ewIXHLlaIfp9U3NrsgilVw,"My employer hosted a lunch event here and as the second in command for organizing the event I was EXTREMELY dissatisfied with this place. First off this wasn't my selection of restaurant. Had I visited it before like the organizer did I would NEVER have selected to host our event here. 

Decor needs a major update. I understand redecorating is expensive but that is NO excuse for your out of fashion decor to be dirty. Filthy walls, carpet and seats. Dirty and dingy smelling bathrooms. 

Next disappointment was the SLOW service. We had about 15 guests and 5 presenters/event staff. It took forever for our Grandpa server to get anything including drink refills. At one point I had to get refills on my own from the bartender who appeared to be doing nothing. Why could he have not helped out is beyond me. There was only one other table in the restaurant. Food was coming out and different times, some tables had salad while others had nothing, when the meal came out it was also not timed very well. 

One of our guests even had a bug in her food (the potatoes). I was really disappointed with the quality of food. The sides and cuts of meat seemed cheap and there didn't seem to be anything overly ""Brazilian"" about them.

Save your money and your time.",m2gyh-W4wdVEAPmp6pkV0A,3,0,1,iuk5xaSEJk_Pfki-MhY1Vg
1042002,2016-04-24,0,ewIXHLlaIfp9U3NrsgilVw,"I love this place! Food is fantastic, the staff is wonderful and the caipirinha's are legit.",82pqym75NhvgHP6Cbp5lcQ,0,0,5,BSTVDP2C9cVrRuJc9d6uNw
1122796,2009-11-26,1,ewIXHLlaIfp9U3NrsgilVw,I dig Yolies. It isnt the best Brazillian steak house I have been to but I have never been disappointed. Not a lengthy review but its just a place you have to try once and if its for you it is if its not it not. I guess thats the epitome of mediocre lol,bxdD3-7c_qQvwz6mYzTL1A,1,1,3,a6q6J0WjOXbJF41MtONwUQ
1169703,2014-10-14,2,ewIXHLlaIfp9U3NrsgilVw,No way to give no stars. I was served raw chicken. I only caught it with the flash from my phone because lighting was so dim. I told the waiter who said he would tell the chef. No one came to apologize by the time I left. I stopped by a pharmacy on the way home for stomach relief medicine in anticipation of a very long night spent next to the porceline bowl...  :-(,Dc9LdVpoBPu8v5uUy1lj8A,8,2,1,lDMtaJ4cOi7ForGdtGS_Mw
1245624,2015-11-06,0,ewIXHLlaIfp9U3NrsgilVw,"Sat down ordered water and a Arnold Palmer and got tea and a lemonade mix for mixed drinks. Very sour!   Got are ""Meats"" and as they progressed they got more and more salty. The lamb I didn't finish b/c it was so bad...  If less salt I think it would of been better. Used Restaurant.com and the manger tried to say he wouldn't except are coupon from the website.... Was $45!!!! A plate... Insane and not worth it by any means for 45$ a plate! $20 a plate would still be high.... Will not return here and I recommend you go ELSE where!!",RCFhy_7h0m6n9oz19PhRPA,1,2,2,1nvonUqXzbdMbpYHo4iefQ
1317548,2014-03-08,1,ewIXHLlaIfp9U3NrsgilVw,"One star is too good for this place. OMG!! It was horrible.
I have eaten in Brazil dozens and dozens of times, I have eaten Brazilian in many cities of the USA, and other countries. None and I mean none have ever been as horrible as this place.
This is NOT Brazilian food......
How the heck can anyone rate this higher than two stars......maybe if they were drunk or ""high""......
The lack of decent service, the crappy mixed drinks, the owner/manager was annoying like a used car salesman, other writer said ""it was fucking horrible"" they are 100% correct.
It may have been good 3 or 4 decades ago ....... Those days are well past!

As an update after being away from this horrible place for 16 hours my stomach still hurts! My wife has ""Yolies belly"" !!",CO_Skd-m3qgFKHk7FUtIDA,4,0,1,UAgLmj8fJgeBzeKrlut7dg
1362099,2013-02-24,0,ewIXHLlaIfp9U3NrsgilVw,"Nice! The service was slow, I guess they didn't have many people working, but the food was very taste.",I_xWzMkZ6YPQZgoMUgi9CQ,0,0,4,BpCCQBoKnDbsotqJ5zfITQ
1396040,2012-05-17,1,ewIXHLlaIfp9U3NrsgilVw,"I went here for my 21st birthday, so it's been years since I've eaten there. Yet I've been to Vegas many times since...that's already somewhat telling. The service and food were lackluster. If anything, I can at least say it's somewhat cheaper than other Brazilian establishments, but knowing I can get higher quality food and service elsewhere, I do. 

I think we had a party of maybe 12 people. It was not busy, even though it was a weekend back then, and still the service just sucked...I can't even recall a buffet, and maybe they have one now, but didn't then? If they did, wow, then it was not very great, either. 

I've also been to Samba's in the Mirage, and it's decent, but can be crowded. It's still higher on my list for Brazilian than here. Definitely go to Fogo's if you want classy and upper-end. You'll also have more options for some fiber with your meal with a large salad buffet. You get what you pay for and this place embodies that meaning perfectly!",imv9q5orKbOliuo8y44yhw,0,0,3,JKxgkFR6C8luXfJg6pZFLA
1460452,2008-02-11,0,ewIXHLlaIfp9U3NrsgilVw,"The ambiance of this place was more formal than lively, not what I expect from a less than average churrascaria.",VlUnhotMqY6msql_GMyvhg,0,0,1,H8hZuyp-q7idrwpIEfjZ2w
1520834,2014-10-17,0,ewIXHLlaIfp9U3NrsgilVw,I love that it has old school ambiance.  You think that all the old vegas gangsters dined here.  The food tastes homemade like from Brazil.  The yucca potatoes are delicious and the meats are savory.  The black bean soup is very tasty also.  The waitstaff is nice too.  The raspberry capriohana is the best fruity mixed drink ever!!!!  Its top quality and is worth the $10.00.,INTuUWrobi-dK2oyko8Dpw,0,0,4,itgSrh4IOPDcEk6eCJZeOQ
1615178,2009-07-20,0,ewIXHLlaIfp9U3NrsgilVw,"The food was ok.  
They had available tables, and that was the major draw here.  The place was upstairs and out of view.  I didn't read about it before going and didn't know what to expect.
They didn't have as great of a selection on the 'brazillian' menu as some places.  The meat was decent.   The sides with the meal were adequate.  It was a fair amount of money to spend for a meal.  I'd say that you should be hungry if you go to get your money's worth.  I've been to better brazillian steakhouses.  This was ok, but nothing special.",_IwQX6dlRKPl5_ok7bL7Mg,0,0,2,Ic3X0TgLCMN3L4h4GQVHUQ
1787406,2015-11-25,0,ewIXHLlaIfp9U3NrsgilVw,"So angry bought a Groupon to try Yolies wasnt worth it, plus they cancelled contract with Groupon told me I couldnt use it $70 really.  First you take an elevator up  dirty and shaky that was odd, place had only 3 people in there, what a creep atmosphere to begin with, my daughter didnt like just when we went thru the door.   It was so ins insulting to be told we will give you the same dinner but you need to pay.   Oddly I think I was glad it was old and smelled odd the people eating there didnt seem impressed with the food.  They were saying dry huh?   I will not recommend this place restaurants in Vegas are always busy and the other reviews says it all.  Too many other restaurants they try to be Rodizo's that they cant come close too      pick a cleaner place.......if it is a gem it was then now its a lump of coal",qao1pgmzdo2gfRbgwdipwA,0,0,1,lwZlNXf1_Ar3OEqrixBYyg
2048765,2015-03-02,0,ewIXHLlaIfp9U3NrsgilVw,Staff was scrambling around as if they didn't know what they were doing at all! Im not sure anyone even had a specific job title (if they did they didn't know what it was) Food was ok- but we left hungry. Service was horrible!!!!! Sat there for 2 hours. Paid $40 per person and had barely any food!!!,4q4r8qOTgZ_L9N-hg5XnYg,3,0,1,pyy8dWAbu685EPpCUXb6kg
2049429,2011-10-27,0,ewIXHLlaIfp9U3NrsgilVw,"My in-laws took us here after my brother-in-law's wedding a few weeks ago.  My husband previously went here with his family and had always told me how good it was.  I would have to agree.

Let me start by saying...if you're a vegetarian...stay away!   This is a carnivorous feast!  We recently visited another local Brazilian BBQ, but that place was horrendous.  Yoli's meat was cooked perfectly.  The appetizers were excellent, the service was excellent and the creme brulee was amazing.  I am not sure how pricey it is because we didn't pay for it..but I imagine it's not cheap.

Highly recommend to all of the meat lovers out there!",s5KSC2fh7dtxiiUCBc1iYQ,2,0,4,cahORKsfnVRTWdeyL98-IQ
2086381,2014-12-30,0,ewIXHLlaIfp9U3NrsgilVw,"This is one of the best Brazilian restaurants.  Fresh food served hot.  Everything was prepared to perfection.  Clean, neat and relaxing.  The prices are reasonable, service great and food outstanding.
If you havent tried this restarant you are missing the boat",87zJZZk7DaHerSj0MVR2Cw,2,0,5,wdH92igI6IiS1eCrUqRQMA
2090533,2014-05-14,0,ewIXHLlaIfp9U3NrsgilVw,"This is one of the worst restaurants I have been. Old, old, old....... Bad cheap food....and expensive. Not sure how they survive.",C0CEWVeL_ykn9LZtKLGE8g,2,0,1,4aAe_lmvALFKVxXfAbedKA
2475063,2011-06-04,0,ewIXHLlaIfp9U3NrsgilVw,Have been here several times...bring your appetite!  Good service and good food.  Don't come here if you're on a diet.,faDi7XEBkDAUYTyaL4kpzw,0,0,4,BJTEV6jjkZPs-h7RvKm7Sw
