,date,funny,business_id,text,user_id,useful,cool,stars,review_id
5576863,2014-06-07,2,HnQVDNGFWOS5zle0dhpOkw,"I wish I could give this place negative stars as it seriously needs to go out of business the way it treats people's orders and their management talks to customers like they're idiots.

After waiting almost 20 minutes in the drive thru, i was served a custom combo burrito in a half way unwrapped piece of tin foil, falling out into the bag it was presented in.  I noticed that the drive-thru person was touching that lose food prior to putting it into my bag after touching a register to ring someone up behind me, touching the counter area, touching his face and head, then giving me the food.

They initially refused to refund my order, and blamed me for the loose food in the bag.  I spoke with a female manager who didn't provide her name and again, tried to blame me on their error.  She eventually provided the refund but refused to provide a receipt to prove this. 

I guess it was against my better judgement to give this business a second chance, but I will not be returning, ever and advise you, if you value food safety, quality, and cleanliness to avoid this location like the plague.",gvC9vVIQbTSPOpXvtiUbUg,6,1,1,QGLbSeZES4xX6cq5KGFkGQ
5707508,2013-03-22,0,HnQVDNGFWOS5zle0dhpOkw,"Ok this is new to the area, this is where our Popeyes chicken used to be. This was the 2nd time that i tried this place. As i wanted to try something different from Robertos. The first time i tried the burrito, not bad but not the best i have had. However i thought i would give them another try. This time a family meal, the char chicken. Well needless to say with the one star i gave indicates the food was not good at all. So not good that i got sick and threw it all i mean all up. And all the night was sick. NEVER going here again. And then after reading another comment someone made that he saw a worker empty trash and not wash her hands, now have me really questioning the cleanliness of the restaraunt. 

I am so good and will be back to Robertos when i want my Mexican food fix, fast food style that is.

I had to edit this review to add that even at 1:30 pm i am still feeling ill so i thought to at least call them to let them be aware that something that i ate from there made me sick. At first the worker (not manager as one was not there) was shocked and understanding. Asked me to hold on then came back to the phone and tell me that she is sorry but its impossible that i got sick from anything there because they make all their food fresh! REALLY????? 

All i could say is ok thanks and hangup, KNOWING if they are that stupid to think that, then that definitely not a place i would want to eat at ever again.
STILL FEELING SICK THANKS!!!",LSw5J-mDFXr75jmYmRnWow,5,0,1,Y1xxBqWbphzljPB-NQaAgQ
5819958,2014-05-12,0,HnQVDNGFWOS5zle0dhpOkw,"Okay so I made a review for this place back when they first opened, since then they have really gotten their shit together. 

I went in last night for a 3 item plate. I got a plain carne asada taco, chile relleno, and an enchilada. Everything was excellent except for the enchilada. It was like 3 small taco tortillas in one wrapped up to make it long but it didn't have enough meat in it. Does that make sense? Not enough meat/tortilla ratio.

Anyways the taco was perfect! Can easily compare to the one's you'd find on the east side. The meat was very flavorful. The chile relleno was good too, the sauce has great flavor.

My dislikes are simple peeves not enough to take any stars away.

1. I went right before they closed so they ran out of lemon, I got 3 tiny pieces but I feel like that's my fault for going so late.

2. The red sauce still doesn't do it for me. I prefer the home made salsa's and this one tastes like spicy pace :(


That's it! Everything else has so much flavor, especially the rice! I'm sad it took nearly 2 years for me to go back, but I'm glad I did and I'm glad they've improved.",v3in4pF9w0wxtPNF09za5Q,1,0,5,rFXyV9hEkuQJQuTs9pg8uA
5911088,2013-02-14,0,HnQVDNGFWOS5zle0dhpOkw,"Went here one night after an evening of debauchery. My friend and were curious of this place. The way we rate Mexican food places, is based on their Carne Asada fries. Man, I was not disappointed. The meat was chopped into small thin bits(which was good), was very lean, and flavorful. But if they want to make it better. A little less guacamole, it overpowered the whole dish. Employees were very nice too. I defiantly recommend this place.",rMwYUSvoDOaGQvGqSj_6gw,1,0,4,t2aS8zjo0L5CSaWmHtU1cA
5915285,2013-04-14,0,HnQVDNGFWOS5zle0dhpOkw,"Put this place on your cheap eats list people!
Portion to Price ratio is awesome!

We came here for lunch because of the advertisement coupon for $5 off a $10+ bill (we aren't cheap we are frugal!) 

We got 4 soft tacos
2carne asana
1 carnitas
1 chicken
Taquitos
Carne asada fries
The bill came out to a little over $12.00 after the coupon!



The carne asada as really dry and kibble-ish in both dishes. The carne asada fries were chocked loaded with cheese and pico. They used a battered type of french fry which kinda threw me off from normal french fries (which I prefer)
The carnitas and shredded chicken tacos were great! Both were moist and full of flavor. The stars of our lunch!

I'd dare to give this place 4 stars but I have to take a star away because the salsa bar was  horrendous and in dire need of attention. The salsa levels were all low and there were plastic cups and lids in every bin. Thank goodness we didn't need any salsa since the carne asada fries and tacos were loaded with pico. 

For the price, taste an portion size this is a  good alternative to those taco chain guys down the road.",E_Ts8j758tpiAZknHR7k4g,2,0,3,azARDZLw-4ewD-Sy19_RBg
5929774,2014-03-29,0,HnQVDNGFWOS5zle0dhpOkw,"Just tried for the first time and I will definitely be back.  Had a chicken burrito, smothered, and it was very good.  Real good flavor, good salsa, too from a salsa bar.  Prices were average.",42LUxWiXgD6P4FHYZ3K9tA,0,0,4,ij2Wsd3AlBKioWFevzXWmA
