,date,funny,business_id,text,user_id,useful,cool,stars,review_id
2180,2014-09-29,0,IOwTrStIy6NinyquhBrLZQ,"Overwhelming usage of ginger on practically everything...fried rice, noodles, orange chicken and mildly on the House special ginger chicken.  Bourbon chicken and green beans were good.",3mZFkwfa6XV0BBazRTva9w,0,0,3,YYHJRLJ-DWgOSF25y-9gbw
93473,2016-01-22,1,IOwTrStIy6NinyquhBrLZQ,Horrible orange chicken and fried rice. It costs $3 for a small drink and then another $1 for a refill which is ridiculous when there are free drinks in the casino. Staff needs customer service training and a cookbook. Worst Asian I have ever had.,wI_xpxzovBPdhKiMinqHfQ,1,0,1,R-Mzx92ExDOt2W8I3KZTZQ
152245,2014-08-09,0,IOwTrStIy6NinyquhBrLZQ,I usually am not a picky eater and I love love love Chinese food. When we stayed in this hotel we ate here and it was awful. Everything tasted old and gross. The noodles were watery.,PLANti5C9IUdN5V2sQF2QA,0,0,1,ytTdMfOkkcx0xzcUVPWsxw
263603,2015-03-17,0,IOwTrStIy6NinyquhBrLZQ,"Horible service.  I know it is ""fast food""  but they should realy treat the customer with respect. They just force us around then say good bye.  Food is ok at best.",hIqgUyQENPFC0xIRrxHFMg,0,0,2,zQkdMlMfHSVYpyDRONlmmg
375613,2017-05-29,0,IOwTrStIy6NinyquhBrLZQ,Spicy chicken it looks like it's the leftovers. service is horrible place at this place. Orange chicken I wouldn't feed my dog with lol. Never again !!!!!,ueWw-FoZ_AVDznz_qrxrxQ,0,0,1,SXnyRMPzQT4RrlmjBiy65A
427749,2013-10-05,0,IOwTrStIy6NinyquhBrLZQ,"Horrible food, its nothing like it use to be. This is probally the only one that serves there food like they do & its disgusting. Why open another pick up stix in las vegas but not have it the way it use to be when you would order and your food was freshly made?",TGFNYeWHjQxqxQ_bnq4SMg,0,0,1,ch03qHygOIISGKphtsfeMw
510313,2014-01-04,0,IOwTrStIy6NinyquhBrLZQ,I was very disappointed when Pick Up Stix closes its locations around Vegas.   They made fresh food to order.   Now we get a mall version that is a pale imitation of the original.    I would recommend waiting for a fresh serving of any dish.  This location needs to step up its game.   China Max located around town is better than this joint right now.,YUz1FRgWHeW2AgLCU2PDkw,0,0,2,cqmOUIGUsy0k6MWvD7p_KQ
693092,2015-06-13,0,IOwTrStIy6NinyquhBrLZQ,"Service was horrible. They ignored us in line. They made food that they already had plenty of and did not make what they were out of. We had to ask twice how long till the honey chicken would be ready twice with no answer. 

The noodle taste like Ramen Noodle flavor packs. The chicken was overcooked and my rice was burned. Horrible would never go back.",dQSVVUoLwjx3sAFKwAhZmA,0,0,1,02r3NYmSFgM4yb1VDpMX4g
825970,2013-02-28,0,IOwTrStIy6NinyquhBrLZQ,"Don't go here for a late night fix - they close earlier than stated/advertised. When questioned about it their staff said their clocks said it was closing time - perhaps their clock is 10 minutes fast, or the staff was just trying to close up a wee bit early...

Maybe for the best - unlike any other location I've visited (and I'm normally a raving fan of Pick Up Stix), all the food at this location isn't made fresh to order. It's pre-made and sits in warming trays. I'll need to go to the LA area to get my fix.",ttALUVVK-zINxQeXghoK0A,0,0,1,q1NZlOgBx6caykBT4Ka-Hw
931794,2015-03-20,0,IOwTrStIy6NinyquhBrLZQ,Worst food in Las Vegas so far in the four days I have been here. I ordered the chicken egg rolls. It was putrid.... chicken????? is that what it was suppose to be? Good thing Cinnabon is next door.,FwNJnRlqww_BIGzI7-2IOg,0,0,1,1ehdvbskrNnnTRQvE6u6Xg
1298599,2014-08-03,1,IOwTrStIy6NinyquhBrLZQ,"Definitely not worth your time or money despite being a ""cheaper"" option. It's my fault for craving Asian food at an old resort, but this isn't even up to Panda Express' standard. 

I ordered a 3-item combo so I could use one of my rewards coupons for a free drink, and it was a pitiful waste of $10.  I was better off getting $10 spicy McChickens. 

Vegetable fried rice was poorly cooked. Kind of soggy and grainy. 

The Kung Pow chicken was mostly water chestnuts and cardboard carrots. 

The ""premium"" extra dollar Thai shrimp was okay at best with plenty of onions. 

The beef broccoli was the best thing I had. The broccoli was cooked well but I don't even remember having much beef. 

So upsetting. Luckily I can use this as a business write off. 

Excuse me as I use the restroom to get rid of what I just ate.",b4bTks98idS6-hx5AT92WQ,0,0,1,WPhWlY_sQU2GOkgfJWuMig
1615751,2015-03-06,0,IOwTrStIy6NinyquhBrLZQ,"Worst place I would say to get food, food sucks with no flavor and the the servers were rude and not friendly and food bone in the chicken not coming back here !!!!",KT4M_dbdpQWEMdx-3w5ibw,0,0,1,NG9vHvnIAcqRUJZn3slx3A
1798710,2014-01-02,0,IOwTrStIy6NinyquhBrLZQ,Slow service considering they just had to scoop the food into containers and the food was so salty i couldnt even eat it all... Avoid this place!,x0d6-8neeYdZKLNw9OcejA,0,0,1,0NhOcasgH6Le70IX6bZlzw
1940504,2017-01-25,0,IOwTrStIy6NinyquhBrLZQ,I spent 34.00 on a dinner last night....orange chicken.....eeeeh ok .....white rice was ok...my daughter got spring rolls and told me to taste because it tasted funny.  I took one bite and apt it out in front of evewryone!  Nasty Nasty Nasty. What a terrible taste... I might as well have chewed on a dirty bar rag.....Horrid.   The employees were very nice...and all did the uosell uosell upsell uosell upsell upsell upsell.....on a positive note....I am not throwing up.....,6PH8anfFrgBIYweonS-U_g,0,0,1,PmJFMp16mZE16zuqKROlcQ
2120233,2016-07-10,0,IOwTrStIy6NinyquhBrLZQ,"I guess I was one the lucky ones.  I had ordered the Kung pao chicken, the green beans, and the noodles.  I guess when I got them they were fresh because they tasted good.  They were a little salty but that was expected.  My girlfriend said the orange chicken was hard as a rock.  After she mentioned that, I thought it looked a little dried out in the pan.  I would suggest getting the non battered/glazed chicken to be safe.  Or make sure you ask if it is fresh.  As for service,it was awful.  The workers were not happy.  Overall, I probably would not eat here again.",XJlO3JkonghDu59nmE62Mg,0,0,3,4w07DBDzT2oXFTcZCr4t8A
2241274,2014-01-02,0,IOwTrStIy6NinyquhBrLZQ,"I come typically come here when I'm at Excalibur because the food is decent, depending on what you get. The food is Asian fusion but some of it is way too oversauced and salty. But for some reason I still like to come here...probably because it's the only location in Vegas. If given an option though, I'd probably choose Panda Express over this Pick Up Stix.",zBi_JWB5uUdVuz3JLoAxGQ,0,0,3,CEulbLR7QdUsxSe0H6OobQ
2288485,2017-07-08,0,IOwTrStIy6NinyquhBrLZQ,"We ordered beef & broccoli when it was literally served with only 1 piece of beef. Which the lady told us ""that's how it is"". This does not deserve any stars. Food didn't taste fresh at all!!!!! I don't recommended going at all.",1m3LSmqCQDGgjkinqXtE5Q,0,0,1,5PPzVv0qfvXVUI7f0MLH6g
2304982,2016-08-22,1,IOwTrStIy6NinyquhBrLZQ,"I order  general chicken, beef and broccoli and also string beans! Half and half on the noodle and rice! I got to say this is the worst Chinese fast food I been to! I wish I should just go to Panda Express! This place is really salty and I don't even think they know how to cook Chinese food! Very disappointed! Don't ever go here!",3cdJs-fYWvVTkEuTzWXZtQ,3,0,1,p57ViGZXRJCDQqPrOC-Vtw
2323202,2017-07-19,0,IOwTrStIy6NinyquhBrLZQ,"I can't say this is anything special.  Ordered steamed rice, the ""house chicken"", and broccoli beef.  I exchanged my third entrée for potstickers.  Broccoli beef had a decent amount of flavor in the traditional brown sauce, but this was the only thing I would recommend.  The house chicken stated that garlic and soy flavors were present, but I detected neither.  Rice was made in a batch that was far too large.  Clumpy and dried pieces.  I was interested in the Kung Pao chicken, but it looked like zucchini was included.  Haven't seen much true Kung Pao in years.

Condiments (even soy sauce) is hoarded behind the counter which slows down an already slow process.  Might have better luck at the popcorn stand.",H7SNU9NAEiwbBonwuZWYWA,0,0,2,w5L564dBAXDfaO9RWQy_HQ
2437986,2014-07-18,0,IOwTrStIy6NinyquhBrLZQ,Don't go there if your staying at the excaliber hotel even if your going to just get a little snack before or after taking ur kids to go to the fun dungeon there food is not great and they even give small proportions not like panda express it's like the more expensive but generic version of it!!!!,TXeGLq0XpViE78BkSF2UjQ,0,1,1,OgFtmGVDmPrpHkemy9c_Mg
2505633,2013-07-04,2,IOwTrStIy6NinyquhBrLZQ,"Wow, this place is really gross and it's expensive (cuz it's Vegas). My friend and I shared a fried rice and two sides of kung pao chicken and veggies. The fried rice was really salty, the kung pao chicken and veggies were just ok. To say the least, we wasted a lot of food. My friend wasn't feeling well from our partying the night before, so she didn't want to eat Popeye's, which our guy friends got. I think I'd MUCH rather prefer fried chicken. Pick Up Stix is pretty much another Panda Express...gross, unauthentic food. Sigh.",_iSS1m_QBY9E1f1xOZovlg,1,1,1,fsosyXWQXergSowpjkIEPA
2703503,2017-05-08,0,IOwTrStIy6NinyquhBrLZQ,This was the worst Asian restaurant I have ever been to. I got that Bourbon Chicken. I might as well ordered chicken and sugar water. I admittedly threw it away the fastest $9 I have ever given away. Stay away it's better to go somewhere  else!!!!,93BpgrvCpiQwwGstUJyZxQ,0,0,1,hGN3C-3hO8GB5pig3sdp4g
2791227,2014-05-25,3,IOwTrStIy6NinyquhBrLZQ,"I was craving Panda Express so I decided to make due with Pick Up Stix since we were staying at Excalibur. It was a terrible decision. I ordered the chow mein with green beans and some kind of chicken.  Everything on my tray was extremely salty and oily. Not only was the quality of the food lower than Panda Express, the price was also more expensive. $10 for a meal full of oil and salt? No thank you. Will definitely not be returning here ever again.",2vNW5TFsK7UQfjPB_No1eA,1,1,1,QdfieG4g5SGtvfTS5xeUiA
3097222,2014-05-04,0,IOwTrStIy6NinyquhBrLZQ,"Wow, seems I should've read reviews first! All of the food in this food court was pretty unappealing so we gave it a shot. 3 meats and much of it all tasted the same. Ended up throwing out most of the container. 
Best thing I had was the bottle of water.",tWBLn4k1M7PLBtAtwAg73g,0,0,1,TBdwRhHJM2LB6JMZWUqnHA
3128702,2015-07-14,3,IOwTrStIy6NinyquhBrLZQ,"As others have stated, this food court at the Excalibur has potential, especially when one is simply looking to grab something fast.  Unfortunately, in my opinion, this is really the only decent lunch option, and it was pretty bad.

I'd arrived at the Excalibur at around 1 p.m. and I simply wanted to grab a quick bite, as I had some things to do and was planning to meet friends for a larger meal later that night.  I came here, got the orange chicken, fried rice and a soft drink. 

EVERYTHING they had in the pans in the display looked to be dried out, as if it was cooked hours earlier and had been sitting under warming lamps, or in baking pans ever since. The fried rice I got was OK, but the portion of orange chicken I got was pretty tiny, and while most of the pieces were fine, there was one that was a 2 inch round ball of breading with an undercooked piece of chicken in the center.  Needless to say I left that on the plate.  

For a small portion of dried out orange chicken and fried rice in a Styrofoam container and a small soft drink, I paid more than $10.  Horrible.",-VOylYXNq7sG6As966yTxA,9,6,1,ivNdLuqCarM4EhNgP332_Q
3164787,2017-03-28,0,IOwTrStIy6NinyquhBrLZQ,"We love Pick up Stix back in Orange County.
Nothing, I mean nothing the same. 
Food was drowning in grease and cold. 
We felt sick for hours!!",-53IoOhD9Fjs1bLiGURaAQ,0,0,1,a0Uwc9mp2ZzX_vHWe66hNg
3210965,2013-08-30,0,IOwTrStIy6NinyquhBrLZQ,"If I could give negative stars I would... A three side plate is 8.99 the serving is small and all the food is beyond greasy and salty. I never knew green beans could be soooo horribly drenched in oil and salt!!! :( please please do yourself a favor and do not come here... The girls working had the most sour of attitudes and looked sounded like they were hating life and their existence ... There are better fast food options within walking , tram and taxi distance",sgbFcAldZvCC94hzBChUvw,2,0,1,YUHrnkPU3BI_c3KqKa5SUw
3253914,2015-06-08,0,IOwTrStIy6NinyquhBrLZQ,"Terrible! I love chinese food and Pick up Stix, I don't love you. Their chowmein was good, their fried rice was good, but the chicken was terrible. I had chow mein with orange chicken and bourbon chicken. Orange chicken was bad, couldn't even finish it because it was so bad. However, the bourbon chicken (if you decided to try it yourself) is actually probably their only good option because it was delicious. My boyfriend got chow mein and fried rice with beef broccoli and orange chicken. His beef broccoli was more leftover soysauce than actual beef, and when he did find some beef, it was tiny. What the hell? 

The food was not good, I will never come back to this restaurant. I did enjoy the potstickers, but expensive for those so not in a hurry to come back for those. 

Also weird service, the girl serving the food doesn't give enough of the 1st and 2nd options (ex: chickens, not the chowmein or rice). She hardly gave my boyfriend anything and the girl serving drinks, overfilled everyone's drink, maybe they should switch jobs. 

Pick Up Stix if you are reading this my suggestion for better food is to keep your chow mein recipe, keep your bourbon chicken, and the fried rice, but change that orange chicken recipe, that killed it and offer different potstickers. Also, make sure your servers are serving enough food for those options, because we don't want to be just eating soysauce when we're supposed to eat broccoli and beef.. I recommend Schlotsky's and even McDonald's over this restaurant at the Excalibur food court.",lFDfCQh6RgDWfJBVjlWgSw,0,0,1,uuzfh-GorN1suf3qtEGXtQ
3310186,2018-01-08,0,IOwTrStIy6NinyquhBrLZQ,"This gave me bubble gut for hours, I had the runs and could not stop barfing  very very icky",96q951DUuDC_Gxm8Yq9-AQ,0,0,1,s0n2oA7cazf1TuP6mAaltw
3348294,2018-06-12,1,IOwTrStIy6NinyquhBrLZQ,"Can someone re-staff their employees? A young guy named ""Jetski"" gave my husband and I the worst costumer service we have ever gotten and we are from NY. Food was decent but for 2 meals, 2 drinks it came to $38. I asked for the 3 combo meal and Jetski was standing there talking about how cool his name is when I tell him "" I'll take the firecracker chicken"" and he said "" your talking to me?"" And I said yes, I'm ordering my food, I want that chicken. Then he goes and says I don't think he's funny. HE'S right! He's not funny at all and should be fired for lack of common social skills! My god, 20 mins later and I'm eating overpriced food that gave me a headache before i even ate it!",LXuvz6RNJT8LQSZdiHuzHg,1,0,1,SXjDfchso8WZL4uXI0m13w
3524578,2012-12-30,1,IOwTrStIy6NinyquhBrLZQ,One of the new places in the food court that is still undergoing renovation in the Excalibur Hotel. They currently have a deal (coupon required) in which you can get a free medium drink with the purchase of a 2 chicken item combo. Good place to eat at if you just want a quick and cheap meal. I prefer this place more than Panda Express.,29yBaTFMSh-l6wNwy9d_mA,2,1,3,R2Ty1L7OT5ZWEajRGBOQNg
3527647,2016-02-29,2,IOwTrStIy6NinyquhBrLZQ,"By far thee most disgusting ""asian"" food I've ever had. Like are you serious, how is this place even still open?? Waste of money and not to mention how soggy the noodles were and the orange chicken oh God horrible!!",1srxnuQ_iDtfnJ6nrG6GoQ,1,1,1,yOp_BO4dURfsqnL8cOaMBg
3607623,2018-04-25,0,IOwTrStIy6NinyquhBrLZQ,"Came here starving. Ordered a 3 item combo and and order of cream cheese wontons . Went to my room to enjoy my $20 meal and was highly disappointed. This food had to be sitting there for hours. It tasted like horrible left overs. Dry, saturated in sauce. It wasn't hot. It definitely was NOT fresh. It tasted really old. I felt like if I ate this I would get sick. And the lady that served me didn't look to pleased to be there. Basically I paid $20 for wontons because that's all I ate. Very, very disappointed. If I wasn't so tired I would have went back and demanded my money back.",zSTWR7ZvD7Hfv4s5B-1YVA,1,0,1,Fi7utKfrddl8GPPs1tNwow
3677265,2014-01-30,3,IOwTrStIy6NinyquhBrLZQ,"Just under$4 for a one-item craving at midnight isn't a bad deal. Husband and I circled the Excalibur food court on foot a couple of times before I settled on fast-Asian (over McD's, Popeye's, Schlotzky's, a smoothie place, Krispy Kreme, or Auntie Anne's).

Having no other meatless options I ordered just the fried green beans. They looked so over fried I sampled one first (samples are free, just ask). Thinking I could handle a full order I went for it. I finished off the night's supply. ($3.77)

A couple oil-soaked napkins later and a LOT of oily sauce at the bottom of my container and I ditched the beans for a much healthier donut. (Not kidding. Def healthier). 

Friendly service, especially for the time off night, but at least have one mixed vegetable option! (No, veggie fried rice doesn't count). I regret my food and restaurant choices.",1dQiuUvvK8427TBmqj_4Vg,4,3,2,Kt_Lms6DPLzceFljZvS8sQ
3758176,2015-11-30,0,IOwTrStIy6NinyquhBrLZQ,So little food for a good amount of money. And for the love of God stay away from their orange chicken. Its horrible. Yoshinoya has better orange chicken and that's not saying much. Their orange chicken taste horrible and will leave a bad taste in your mouth. I will probably not eat here again,tlWa-lG8LL40B7eip3H_Zg,0,0,1,0EfReJGY_3YaSp-3R-9IQw
4009627,2018-01-27,0,IOwTrStIy6NinyquhBrLZQ,this probably hands down one of the freshest food court meals I have ever had in Las Vegas. and I'm aas Vegas native. I also would like to comment on Ariannas customer service she is world class and any business is lucky to have her.,fxnpWESebBre5XeWMU7Vnw,1,0,5,qVDFjY_w-op_DfT-M21okg
4044210,2018-04-10,0,IOwTrStIy6NinyquhBrLZQ,"Yes, this is basically Panda Express... however, we enjoyed it. Keeping in mind that this is food court food. The noodles were great and so was the bourbon chicken. This is coming from a group of Asians. We liked it so much we went back later for late night food. For the price, portion, and convenience this was what we wanted when we couldn't decide while hungry.",d0PPh2jNQF8sGUP-hE_mJw,0,0,4,OoYCJLvIF8f1Joizc8ayyQ
4122021,2014-04-28,1,IOwTrStIy6NinyquhBrLZQ,We were not expecting much from a fast food type Asian cuisine place and this one lived up to our expectations. A very young disinterested crew was on duty with no obvious leadership in place. They were more interested in talking about their personal lives than giving prompt attention. A pass thru window allowed us to watch horseplay in the kitchen while the food pans ran empty up front. This caused us to have to wait even longer to get our food. When we finally got our food it was hot...and fresh and that's about the only positive thing about most of it. Rice was under cooked and crunchy the noodles were no better than a package of ramen available anywhere for under a quarter. Most dishes were heavily salted or drowned in so much soy sauce that's all you could taste. The price point was about the best thing about this meal but felt I overpaid with the quality of food and service. I feel I would have been better off going to the McDonalds just to the left of it. At least when I go there I pretty much know what I'm going to get....,n87RobGZgoyTkJhy2jUWBw,1,1,1,4IU8bnWXAZqMuRdFjgKWLg
4262994,2015-08-27,0,IOwTrStIy6NinyquhBrLZQ,Just wasn't a fan at all.  Can't say I've ever enjoyed pick up stix.  The service was always less than acceptable :p. But that's just me,NJxfyWtbOi9WDxAvfgqLIg,0,0,1,3YkGgqgBdmRkrg5Bwltigw
4776181,2014-06-20,0,IOwTrStIy6NinyquhBrLZQ,Did I just eat the dead sea? Aka the sea with the highest concentration of salt on earth? Cuz this food was salty :(,Y3viwPgm_fIZ_SFNIc3SOw,0,0,1,_Nb__KtpxjQqwK9piKHo4g
4825128,2014-10-01,2,IOwTrStIy6NinyquhBrLZQ,"This is like a low-grade panda express, and that's saying something.  I ordered the 2 item combo, and it was almost $10 without a drink.  They did let me get half rice and half noodles and then I opted for the Bourbon Chicken and Kung Pow Chicken.

The rice and noodles were bland and awful.  The kung pow chicken only had four pieces of chicken in the whole scoop.  It was all vegetables.  The bourbon chicken was decent, but my mall foodcourt has better bourbon chicken.

Only went here because it was attached to the casino I was staying in.  Would never go back.  Man, those noodles were gross.... ::shudders::",56R2wE9mboArx090ivQPsw,0,0,1,ED19_Tn6kN_RJYincyl86g
4883262,2015-03-04,0,IOwTrStIy6NinyquhBrLZQ,"Not very good at all,  it is like a wanta be panda express, noodles are terrible!!!! Drink refill was $1.40.",wH3_kwalQtjycGb4OlH2TQ,0,0,1,R9I8MIg4D98eiJbTeTnvTQ
4922382,2013-06-23,2,IOwTrStIy6NinyquhBrLZQ,"This place is a joke.  Pick Up Stix, you need to pick up your attitude, show some smiles,  and stop hating your job.  I came here twenty minutes prior to closing.  They had run out of most of their food, but there was still a huge line.  I ordered the kung pao chicken and the orange chicken.  There were almost no other options.  They were rationing what little food they had to the customers waiting in line.  Everyone surely did not get what they paid for.  The staff members that were packing the boxes were extremely rude and seemed like they rather be doing something else.  The owner needs to work with these employees, and either needs re-train them in customer service, or fire them.  

As for the food, there was very little in the box.  The fried rice was hard and grainy.  The noodles were overly sauced, and salty.  The orange chicken was too sweet, and was soggy.  The kung pao chicken was all sauce and vegetables.  It was overall very disgusting.  The food was terrible, served alongside terrible service.",RQqfT8WQlmFHmPp9X8G9jA,1,1,1,hhkKkULEyJA4QsDXDv7_GA
4951992,2014-09-19,0,IOwTrStIy6NinyquhBrLZQ,"I would give this place 0 stars if I could!!!!  I Was So Upper When I Came Here Because There Is A Pick Up Stix Where I Live In Cali and it is AMAZING! !!!! I LOVE It! !!!! Such good, fresh food that they make right when you order it. The one in Excalibur in Vegas was fast food Panda express style and the food looked so greasy and nasty that I wouldn't even touch it with a ten foot pole! !!!!! The food looked like it was coated in mineral oil and they didn't even have tofu!!!!!!!!  I am going to complain to the awesome one in cali and tell them to fix it cuz it's a sad world when the people can't enjoy delicious pick up stix in Sin City........",FJ222-BjHUPztpur4ofVew,0,0,1,ixup4xjMBv4G61sA1Ahs-g
5052779,2018-03-20,0,IOwTrStIy6NinyquhBrLZQ,"Exactly like Panda express. Nothing too special, flavoring and food options were all the same if you were to compared to boot-leg Chinese-American fast food restaurants. 

Greasy, fatty, and no fresh. Feels like the food had been sitting there for a while on a heater. 

This is located in a hotel, 2nd floor on their food court. It's definitely convenient.",4UDJNO0e4QechtJ35SD5UA,0,0,3,uQPheuF_n8NuAgAo6QUT9Q
5152500,2015-06-26,2,IOwTrStIy6NinyquhBrLZQ,"Salty food, grumpy looking workers. 
the pick up stix in my hometown is pretty good but this one in Vegas-NOT!",Ou9RNq18vfbfL-7adJNA9A,0,0,1,sFrJG9G0BWk9rOMDW1BRdQ
5251502,2014-07-29,0,IOwTrStIy6NinyquhBrLZQ,"We were excited to try this place as we missed the ""real"" restaurant version since it closed its location on Flamingo. This was NOTHING like the stand alone restaurant. They had the same options but did not taste anything like it. The meats were really bland and there was too much ginger in the noodles. They didn't even have the yummy potsticker sauce I remember from the old place. They just had a sweet and sour sauce that was not very good. We definitely will not be eating there again.",Sqd6-nf0gOnMAkE5tPS-FA,0,1,1,hBsQU3vdgc4bA9o0eQdN8g
5271605,2018-03-18,0,IOwTrStIy6NinyquhBrLZQ,"Was so yummy, we ate there twice during our stay! Tried the orange chicken, house chicken, bourbon chicken, firecracker chicken, orange chicken, fried rice, and lo mein.  Best Chinese food court restaurant, hands down! Prices are reasonable and servings are very generous; hubby and I shared the 3 entree plate ($10.99) both times and were stuffed!",oeEASZYK_EemIDYQu07Jiw,1,0,5,DmVMu5XDz-35xmNn2QT57A
5327978,2017-07-31,1,IOwTrStIy6NinyquhBrLZQ,"This place sucks!!! Took over an hour for delivery. Uber eats driver took the slowest route, and when I finally get my food, my egg rolls that I really wanted wasn't in there..smh. If I could rate this this place 0 I would.  The employees sucked!!!! And there's no napkins! Wtf!!!??",rgTUD1wyJLkIoIdSfSQjdA,0,0,1,higDI1YZo8oeFRMPM2oykQ
5475958,2018-06-28,0,IOwTrStIy6NinyquhBrLZQ,"Jet ski and tamerin were absolutely amazing. Jet ski had me laughing throughout the whole order, definitely made my day.",bkjjC5Baa3kZG0FsxBdnOQ,0,0,5,q_RWpL9rlqDtj9Vfs842lw
5515676,2016-02-29,0,IOwTrStIy6NinyquhBrLZQ,If only I could give this place a negative star. Fried Rice and chow mein were disgusting so I tried to drown out that taste with the Orange chicken.... Orange chicken turned out worse! Waste of money. First was a little upset about how little of food they give you but now I'm really glad they didn't like that crap on. If you are staying at the Excalibur I highly recommend DO NOT GO HERE!,pbM0vMdrLhvcqMtkwJGLdg,0,0,1,oQcNxoSDfXSggUosIuXh8g
