,date,funny,business_id,text,user_id,useful,cool,stars,review_id
5528845,2014-02-11,1,IOwTrStIy6NinyquhBrLZQ,"Let me begin by saying their honey chicken is great, but that's were it all ends.

The orange chicken and fried rice tasted over cooked and burned.

At $8.99 for a combo I expected better and I have had better at other locations.

This location dropped the stix!

Never Again.",UtmsHIyNNgeVZlm6CYLWjA,1,1,2,ipZ6gqXPV6uu36MlthiH6A
5543013,2013-07-01,1,IOwTrStIy6NinyquhBrLZQ,Rice wasn't cooked all the way. The servers were really nasty and didn't act professional.,OcshxlJzWe3Z8h3d4LjIAw,0,0,1,fOQXemqpNYbnwtC_C9HClw
5643824,2015-09-05,1,IOwTrStIy6NinyquhBrLZQ,"Yeah, the 3 item combo I got here left me feeling lousy. Usually Chinese food is a safe bet, but here it was just gross. All the chicken (honey, orange, garlic) were either too sweet AND too salty or just underwhelming. Yeah, go someplace else, hell, I'd even recommend Popeyes and McDonalds. The fried rice was alright though (even though it could have done with less soy sauce).",fsKOJJAKMgv1KygGrm_X7w,1,0,2,9z5KEbXdVG7RXBW_QdF8oA
5893039,2013-01-29,0,IOwTrStIy6NinyquhBrLZQ,"Pick Up Stix is back!
All Las Vegas area locations closed a while back, and I was a little heartbroken. I love their fried rice and cream cheese won tons!
When I heard about the Excalibur location, I was excited to get some of my beloved fried rice. Never mind having to drive to the Strip to get it, I was committed. The food court has been remodeled and is not hard to get to on the 2nd floor of the casino. I was diasappointed that this is a quick serve layout, which means a Panda Express type layout instead of the traditional made to order Pick Up Stix I love. Alas, they had fried rice but you can't get it with plan shrimp or chicken, only with the fancy entree items such as orange chicken or spicy shrimp. The employee was very helpful as she saw my diasappointment at the offerings, and she told me about the kid's meal with fried rice. This is not posted on the menu, and it was a pretty good deal. The fried rice was a little different than I remember, but was good enough for me to go back.",Kp5KHBSmV-Htc9NeSjJfPA,0,0,3,8XaR0G31ATSt0YVwav9aPg
5932830,2013-12-30,0,IOwTrStIy6NinyquhBrLZQ,Unfortunately Yelp won't let me give it zero stars. For serving raw food and denying a refund even when I presented my credit card they should be sued. I just didn't have the energy or patience to do that. The staff is rude And the place is terrible. Located in the Excalibur food court. Don't go!,Qu86_qG57QQtcwHLHjOtCg,0,0,1,OSIXisvFFjaKs61-VWqmSw
5972333,2016-05-25,0,IOwTrStIy6NinyquhBrLZQ,"I come here at least once a week. I recommend house chicken, honey chicken, and the bourbon chicken. I don't like the noodles or fried rice so I opt for white rice instead!",wTGylaW6WUMZLRDjiwyWsw,0,0,5,NIENLGyoRZ1iAMcN4ZGn5w
