,date,funny,business_id,text,user_id,useful,cool,stars,review_id
1500057,2017-03-19,0,IyrDnrvUKpndj5zIv1KvGQ,"We were told this was the best place for Tamales. Very disappointed. Tamales were dry. I ordered a Carne Asada burrito ,, that was good.

Our server , Magalia, was great.",Gj-HUDiECFZWxPwkrG6QZA,0,1,1,yewusNH-WZ77diRIVMfpqQ
1525017,2014-07-28,0,IyrDnrvUKpndj5zIv1KvGQ,"I was turned off by the smell as I entered. Kind of a damp musty smell. 
The biggest turn off by far though was the pre-formed of the ""store bought"" variety,
Taco shell. In a Mexican restaraunt that makes killer tamales...REALLY???
The beans tasted like the canned refried beans, although they might not have been.
I probably will not return to that location at least.",V2rzZUNKyzWeO7ohMTPs8g,2,0,2,kdbyTyUb6e7X_6CfqrkWXQ
1560392,2017-05-09,0,IyrDnrvUKpndj5zIv1KvGQ,"I wish I could properly express in words just how much I love this place...

I usually hit Las Vegas for a beer fuelled weekend of fun twice a year. I think Las Vegas is a wonderful food city and love it for its many great pizza offerings. However, Dona Maria's Tamales is the one MUST for me on every Vegas trip.

I love Mexican food. And I really love Tamales when they are done properly. These are the best I have personally ever had. The chicken verde are my favourite, followed closely by the cheese. Homemade and always perfect.

The homemade salsa they serve with chips when you sit down is the greatest salsa I've had. I could drink that stuff by the pitcher. Seriously. I always have to hold back not filling up on chips and salsa before my Tamales arrive.

The staff here are always fantastic. Dona Maria's Tamales is always a chill hangout for us on a hectic Vegas weekend ... a place to unwind, eat great food and sip a few Victoria Cerveza or high octane margaritas before moving on to our next adventure. We love you guys!!",BwrccHlkp3xbIEZRIaAd-Q,1,2,5,JUdYaKYhl_Yk4cvTwKojRQ
1564641,2017-01-24,0,IyrDnrvUKpndj5zIv1KvGQ,"What a great place to come eat and get amazing hot fresh Mexican food every time. The service is great, the restaurant is very clean. Can't earlier after 6 years in Vegas, I finally came here. Employee Estella has been cleaning the whole time, answering phones and smiling to the customers, she's wonderful!",g-HFMffU6L2nH4bwv04FIw,1,3,5,ENvGEK72jP7IfldDZo1dJQ
1601481,2016-08-11,0,IyrDnrvUKpndj5zIv1KvGQ,Wow!! Excellent meal. I had the shredded beef tamales. Large portions! Friendly staff! Great mango margaritas.,llcBkH2mCfMVFnj6bXWROA,0,0,5,i_J53MmSAuzENg05ZgmphQ
1606420,2015-08-01,0,IyrDnrvUKpndj5zIv1KvGQ,Oh man is all I can say food was on point and some of the best Mexican food I have had!! Will recommend it to everyone I see!!,iF8L-0chphOpC9CBTNDN4w,0,0,5,_zZr6Vw7UHw_srWnJum2Dg
1607528,2016-07-17,0,IyrDnrvUKpndj5zIv1KvGQ,Tried the chicken tamales and cheese. Not very impressed. They were a little soggy. The service was great! Quick and very polite. The menudo had a smell to it that didn't seem right. My husband loved the queso fundido.,vnI8Gp7AGRw7BInn68XMww,0,0,3,HzUpmcBEIKuTpFL2tH7VmQ
1634443,2013-02-16,2,IyrDnrvUKpndj5zIv1KvGQ,"Stopped on for lunch after a discussion with group about tamales.  I used to dine quit frequently at the DM's at Tenaya location.  God, how I would stuff myself with tamales containing beef or chicken or cheese.  They even have a desert tamale with cinnamon and raisins.  But I am older now and don't eat to excess so it's been awhile and we were closer to the DT location.

Pleanty of seating at this location so coming in at lunch time was not an issue.  The service was great, we must have had five different people stop to fill glasses, drop off chips, and just wee how things were going.

I ordered up a cheese tamale w/ beef taco.  Both were tasty as I washed them down with horchata.",HJj82f-csBI7jjgenwqhvw,5,5,4,a6cNd4F0Dm7lPG1V_fi2Sg
1687168,2016-02-04,0,IyrDnrvUKpndj5zIv1KvGQ,My favorite happy hour stop. pitchers are $12 and they make it really strong  can't go wrong with this local place and have amazing tamales.,sT1QAsSzEY7r45nCYxCtTA,1,0,5,eJqmXKQF9ahy2h6w3Y4BTg
1694488,2017-12-22,0,IyrDnrvUKpndj5zIv1KvGQ,"I cam here and got the tamale special, it is 2 tamales (I got 1 cheese and 1 pork) they come covered in enchilada sauce with a side or rice and beans. You also get a choice of soup or salad (I got soup). 

The feeling of this restaurant is very traditional and the service was great, the horchata has UNLIMITED refills. 

I personally enjoyed the meatball soup, the meatballs had flavor and seasoned great. I just wish I had more squash but that is personal preference. 

The tamales were great, super loaded not a lot of masa. The rice had full of flavor and seasoning and the beans were great as well. I will be back here and will try more food. I want to explore the menu as I have been missing good mexican food. Maybe this place with scratch the itch that has been missing from my palette.",cqy-OvaSX5fCiL6F6_Rffw,1,0,4,kQncqjE6Q-YbFpScs2ldQg
1697690,2014-06-18,5,IyrDnrvUKpndj5zIv1KvGQ,"When trying to decide where to catch the  World Cup game and enjoy lunch central to both our locations, my husband and I settled on Dona Maria. We sat at the bar and ordered a diet coke and my pregnancy drink of choice, raspberry ice tea. The staff was courteous enough, although we waited about 10-15 for the menus to be brought over. 
The complimentary chips and salsa tasted very complimentary -stale chips and salsa that tasted like marinara sauce. We opted for 6 tamales (pork, beef, cheese, chicken x2 and ""sweet"").  I had beef and chicken, and thought they were ok but slightly dry. I had to drench them in cholula sauce for added moisture.  Also the tamales were relatively small. The tab was close to $25 which is pretty standard for a mid range quality restaurant. I'd say this was purely a convenience thing and based on the food I would have no desire to go back.",7tpZVkiYuMbDP4-NufK2Iw,9,12,3,cTnB0qvX7PWFULMmYX-Svg
1703378,2017-08-08,0,IyrDnrvUKpndj5zIv1KvGQ,"Great service! I stopped during a trip and I loved it, the coffee is prepared with cinnamon, como en México!  I highly recommend it!",YxDz8BEg6ehUN0DQ7hliTg,1,1,5,dRrOQujYOPVwR0EyPUy1_w
1728254,2017-12-29,0,IyrDnrvUKpndj5zIv1KvGQ,Awesome food good portions nice atmosperic reatauraunt reasonable pricing great food kudos,SzpFv5GP5vzEOY2xYg1s2Q,0,0,5,i5_0Aamdz5Axkrod3qWtWw
1728593,2015-06-21,0,IyrDnrvUKpndj5zIv1KvGQ,Do not recommend. Tried the quilaquiles. Horrible soggy mess. Looked and tasted like the had used the table salsa as their sauce. Not to mention waiter took out order and we never saw him again. Worst Mexican food place in las Vegas for sure. Will not revisit.,IBhpQlPIRTZDqzMiKLmDYg,0,0,1,-3C5mJvZnrGNplyeRwMebw
1732323,2013-08-13,0,IyrDnrvUKpndj5zIv1KvGQ,"Great authentic Mexican food. They are known for their tamales but they weren't anything special- service is friendly, margs are tasty :) More on the touristy side and ok for families..can be a little pricey.",MUIoOSt5n9F6hcnQ4aUYRQ,1,0,4,aGWPcaGIJv1kotBkzqv3yQ
1755853,2015-12-14,0,IyrDnrvUKpndj5zIv1KvGQ,"My husband and i came here for our 1 year anniversary. Our server was Jorge, he was on top of everything from our drinks to our main meal. I ordered the pork tamales and my husband ordered the beef tamales. We were not disappointed. The tamales were stuffed with tamale filling the refried beans were yummy as well as the spanish rice. Will definitely come back. I have not had as good of tamales since i moved from Texas until i came and ate at Dona Marias. Keep up the great work.",6RlYp-LxkGg1kgQGS-OShQ,0,0,5,g5UYUUTo_-NpocF8RYy0tA
1814439,2016-12-01,0,IyrDnrvUKpndj5zIv1KvGQ,"AWESOME place for authentic Mexican food. Order the shrimp cocktail, super fresh with good size shrimp. We ordered chicken, pork, cheese tamales. The masa is great, light & flavorful.
If you want authentic Mexican food, try this place. Clean, well lit and good atmosphere.",L9F6txfQnURTyNRQ2cB5jQ,0,0,5,xb7lOt45ABlkQTfyHNbgfQ
1875440,2017-04-15,0,IyrDnrvUKpndj5zIv1KvGQ,"Disappointed . The tortilla soup came out room temperature, so it was microwaved and brought back. Seafood enchiladas were cool but a bit warmer than room temp. Chili relleno was good but had a cold sauce. I do not trust the cook. He will cause someone to get seriously ill.",5dM2xdU_MvdVdsl_adHrZQ,0,0,2,6BSxYIhjTQ0hoANPaWsYow
1953015,2015-04-04,1,IyrDnrvUKpndj5zIv1KvGQ,"Food was great. Tamales were tasty and the rice tasted just like my moms. But there was one major problem today when I went in by myself for lunch... 
I got up to use the restroom and when I came back, a family of 4 was sitting at my table and my food was gone! I was livid! I literally had excused myself for 2 minutes. The girl in the front didn't offer an apology and the manager did nothing about clearing my table and food.
 Food is good. Customer service is terrible!",QNYWkECXA9X4xK97fjz93w,2,1,1,yAjpJALDVvIjD79hOqL01g
1970659,2010-10-21,1,IyrDnrvUKpndj5zIv1KvGQ,"Just driving by and saw 'Tamales'.. sounded good, so what the heck, why not?

Of course we opted to try the Tamales:

Red - pork in a mild sauce
Green - chicken in a spicy sauce

Both weren't dry/mushy and had the right crumble when the knife sliced into it. I liked the Red Tamale better maybe because of the pork, not necessarily the sauces. The Green had a mild kick but wasn't bad. 

4/5 stars for the Tamales

I also had to try their Carne Asada as I usually order this at every Mexican place I go to, especially the first time. It was quite disappointing, just didn't do it for me. But their Tamales, definitely worth a try.",mY3mROf28N-vY1fpR-FFUw,2,1,3,7W3stzSOM-JsK2yrobGT-A
1986903,2015-12-24,0,IyrDnrvUKpndj5zIv1KvGQ,Good food not great. Terrible service. Rude waitress. Will not be back. Not sure how they stayed open 35 years,_zWasrUbxAb_CPB522jWoA,0,0,1,7i3ej2T6NTXcD-rHUqXKzw
2008598,2011-01-19,1,IyrDnrvUKpndj5zIv1KvGQ,"I wanted to love this place since it's one of the only Mexican restaurants within walking distance of Fremont.  But the food was just run of the mill.  Nothing amazing.  

Tamales were 3 stars.  Everything else I've tried on the menu (enchiladas, tacos and burrito) drags the place down to two stars.  If it weren't in the run down part of downtown, I'm not sure Dona Maria's would still be around.",wOSHvuJEJflUEesNLno51A,2,1,2,utCqED3TlWoFbJOD3QdYQQ
2031004,2016-10-26,0,IyrDnrvUKpndj5zIv1KvGQ,"Oh my God. SO SO delicious. Chips and salsa were perfect, margarita was amazing, tamales so yummy, beans were perfection. Couldn't ask for a better dinner.",laGloISDmC8mxdhfYY4sKw,0,0,5,2SUKnTFD1wpTabNJrtZkXg
2085592,2016-02-29,0,IyrDnrvUKpndj5zIv1KvGQ,Well I gotta say for me is A must go every time me and my husband go to Vegas .service is a plus food is delicious is fast and a nice clean place ..,dbcvsCN24i2T8mrEMNuuyQ,0,0,5,zV2NZEXbfl6m6gFBdQyi5w
2089100,2018-05-26,0,IyrDnrvUKpndj5zIv1KvGQ,Really tasty food. Their cafe de la olla is a must try!! Had the enchilada style burrito with shredded beef also very good but it was a little too much for me. My friend had albondigas and that was soooooo yummy!,KrQDP6Wa-CUresB0fBHoCA,0,0,5,23ugPbkYVjB0v-RMrhjoTA
2113130,2012-05-31,1,IyrDnrvUKpndj5zIv1KvGQ,"food          3.5 to 4 *
service      3 *

While in Vegas, I got to go the many places and few made the list, some were bad, some good and some shouldn't be open if you asked me.

Dona Maria's has good food and bad service. we get there and waited for a few minutes to be seated. We sat in the back, close to the kitchen. It was a group of 6. some ordered shrimp soup, steak and shrimp, I got the tamal chile relleno combo. Almost everything was good, but what I got. I just decided that I should not get chiles rellenos at a restaurant because even if they are good they will never be as good as my family's recipe so, and also the tamal was ..... how can I put it? big, lots of corn masa, lots of dry chicken breast with almost no sauce at all. I was surprised because they do have tamal on the name so I guess not doing justice to it. every tamal is priced at over $4, really??? I could get 3 better bigger tamales for that $$ at my usual spot (lol not Vegas I guess)

The menu was extensive, unorganized and repetitive.

The service was kinda bad. Two people in the party ordered dished that came with tortillas, well only one of us got the tortillas really late in the dinner and they were cold.

The place is big colorful with a bar and decor that does not go with the rest of the place.

DMTR OK to good food, bad service avoid the tamales.",yQqMq9795AG_SgcePa7EDQ,1,1,3,44unZ47Xlk7oVjgvOHLZ-w
2122517,2016-12-20,0,IyrDnrvUKpndj5zIv1KvGQ,"I've been coming here since I was a child and let me tell you, having been raised on these tamales, nothing beats it. I've been to many places and none of them are as good as here. I always go for the chicken, but the pork and cheese are good to. If you want a restaurant that provides amazing food, great service, and low prices, Dona Maria's Tamales is the place to go.",_0mcylD7NKSLkil66O5aQA,0,0,5,ikbNSIBFLPwGD9H_hjk2Rw
2158358,2015-11-03,0,IyrDnrvUKpndj5zIv1KvGQ,"I have eaten here for over 40 years. Excellent food amazing service. Original food scratch made each day. 
When in Vegas and you want the finest Mexican food here is the place to go.greatest good on the planet . I am going to move back to Vegas just to eat here each week.",aWJBn8jL1ZKzzyrHPOOXCw,0,0,5,G5bQMG6a4MO5UTTbuGmoiw
2185445,2014-09-06,0,IyrDnrvUKpndj5zIv1KvGQ,"This was my favorite Mexican restaurant for 13 years but, tonight I found a cocker roach in my tamale!! I know this location is old but, if your roaches mix with the food this is a bad thing!! Feeling very sad because we love true food but just can't go back:(",qxRMJc80Uw33BL6IdmVhNw,3,0,1,PWFUP3W_0m-AIq1V2NWugw
2200414,2017-10-17,0,IyrDnrvUKpndj5zIv1KvGQ,"My favorite thing about this restaurant was how authentic it felt as soon as you walked in! Service was great. The waitress was very attentive and friendly. 
I ordered the lunch special which was two tamales, rice and beans. I chose two chicken tamales, one with red sauce and one with green sauce. What I didn't realize was how huge the tamales are! The tamales are good, but not the best I've ever had. I think that the sauce that is put on top of the tamale is what gives them the flavor. The red sauce taste like an enchilada sauce, and was not spicy. And the green sauce was ok. The rice and beans were good though. 

Over all, the food was good. Very, very filling!",9khRNWDxvmiE0ewnX6LPTQ,0,0,3,YdHLDFW4_boqQynF5m4Tvw
2203714,2017-09-28,1,IyrDnrvUKpndj5zIv1KvGQ,"If you like Southern California Mexican food you will not like this place. Better yet,  if you love tamales Los Angeles style save your money and eat elsewhere. I really wanted to like this place but I was very disappointed.

$4.50 for a tamale is just outrageous, specially since it was tasteless. I had the special of the day which was a pork tamale with the chile relleno with rice and beans. The chile relleno was pretty good, the tamale lacked so much! Where do I begin? There was plenty of meat,  but seriously no flavor whatsoever. No salt, tasted like just plain pork meat that was stewed in its own juices. The beans were subpar. Rosarita canned beans are amazing compared to these. The rice was meh. My daughter had the quesadilla with corn tortilla instead of flour with rice and beans and that (quesadilla) was way better than my tamale. 

I'm sorry Doña Maria, you really need to step up your game in the seasoned tamales. A bit of Knorr bouillon seasoning would go a long way.",qK8fdPExUzQv7zxAu0R3Dg,0,0,3,8KR_Y-iu668uNsJeUlKznA
2243817,2016-06-04,0,IyrDnrvUKpndj5zIv1KvGQ,"We wanted Mexican food on our last night in Vegas so we came here. It's not far from downtown. The margaritas here are the best I've tasted in Vegas, finally a margarita with tequila! I ordered the chicken fajitas and my wife had a couple of chicken tostadas. The food portions were huge and filling. We enjoyed our dinner here and would gladly come back again. If you need a margarita fix then try this place. The places on the strip suck!",6aBOPDOubZ6hJlv6Uw3p8A,0,0,4,wCuIk9ym_4ujNdC8iABFtg
2244991,2014-10-12,0,IyrDnrvUKpndj5zIv1KvGQ,"I will never come to Vegas without visiting again. Incredibly hard workers. Margaritas are the bomb, get the pitcher it's $2 more than two glasses and about 3x as many.  Beautifully decorated. They made me nopales con Juevos (eggs with cactus).  This place rocks.",uOtOOTjFOYmrU826dPzeKw,0,0,5,OgmftsvNOT_IEeYTnbo5dQ
2301827,2016-02-14,0,IyrDnrvUKpndj5zIv1KvGQ,"The tamales are the best I've ever had but I'm forced to say two stars due to the horrible service we have gotten two separate times. The waiter (older man with glasses) truly acts like you are bothering him and is beyond rude. As a matter of fact everyone in the restaurant acts like you are bothering them. When we went, it was not busy but yet they speed past you, slam your food down and never come back until it's time to slam your check down. There was no ""thanks"" ""please come back"" nothing. Save yourself and drive the extra few miles to the Cheyenne and Tenaya location, they actually provide excellent service.",jw_PIficedCAWkE6wp8p_A,0,0,2,VUTvFtqWKQGBjYdWOAc2xw
2315884,2015-06-01,0,IyrDnrvUKpndj5zIv1KvGQ,Awesome tamales! Had the beef and pork. Burritos were good. Beef enchilada was great...5 people and everyone enjoyed their meal (raves for the steak tacos). Great service too!,rTUdg74U5BfyvzrgglXWtw,0,0,5,OZsuW2cjmojNvpEQt0zuFw
2321993,2012-09-13,0,IyrDnrvUKpndj5zIv1KvGQ,"Been eating there tamales since I was a kid, so good!  But the last couple time I have gotten tamales the have been heavy on the corn meal and light on the meat.  I truely hope it was a new cook or something along those line.  But I have  feeling the are being ""cost effective"".  Still good but not at the level they use to be at",euqDhXqWZQ5CO2c0eMyPHg,0,0,4,MromQnxiYZ04qZdwgTdMKQ
2385698,2010-08-09,0,IyrDnrvUKpndj5zIv1KvGQ,decent. took our server a while to get us our check and they wer not busy at all. but the food was good. im sure  the service is better on different days.,m0aeKCg9AAvwvnKUf1Evcw,1,0,3,9W_0zaw2CGR6ipKIbq4HaA
2442283,2012-11-15,0,IyrDnrvUKpndj5zIv1KvGQ,"I have always liked this place. However, their prices are getting ridiculous for Mexican food. They charge more than $4.00 for one tamale. Really? My grandmother made hers from scratch and I know the ingredients don't cost that much. I would rather support that entrepreneur who shows up in his white unmarked van in the parking lot of Wal-Mart. He sells his for $1.00, and they are tasty. OK - so I am a little trusting. 

I usually opt for the Chile Verde burrito (a la cart) because I refuse to spend the 15-20 dollars they ask for -on most of their entrees. The burrito is simple -Chile Verde, onions and beans.  Don't get me wrong, the burrito is good - but not $10.00 good.

The reason I keep coming back is that I like the old school vibe it has inside (at least at this location). Plus, the chips and salsa are fantastic. 

There are half dozen Mexican restaurants in the area that I enjoy better than this place. If they keep raising their prices, they may drop off my radar altogether. 

Hmmm, it's about time I go visit my tamale guy.",fOut10lknIp64tm3z6UTNg,3,2,3,cXkswe8WTa5oKZ9swQffXg
2458205,2012-05-15,0,IyrDnrvUKpndj5zIv1KvGQ,"Had lunch here today with the wife.  Food was ok, not spectacular but not the worst I've had.   My taco was a bit greasy but the shredded beef was well seasoned.   The wife had an enchilada and said the sauce was tasty.  Beans and rice were both very good.  My biggest complaint was the service - marginal, at best.  The waiter seemed annoyed by my request for an extra napkin and our glasses never got refilled.  I'm usually a good tipper, but that guy got a measly $1 from me on a $25 ticket.  On the plus side, the food only took about 10 minutes to arrive once ordered.",6v1HlPjl5GANhCCbk6Hs6Q,0,0,2,3VDPTkfm8uli2Am5OM3DUg
2513460,2017-05-12,0,IyrDnrvUKpndj5zIv1KvGQ,"Don't order the chimichanga, covered with all lettuce and stuffed with air. Crap!!! Tamales, ok! 
My friends told me it wasn't that expensive, well I paid almost $40 for an order of 6 tamales, 1 soup and a drink.",LKpq6xGxO-VtSvCn4o_L4w,0,0,2,z-reLr96cJGCNgClYH2cCQ
2518126,2014-12-02,0,IyrDnrvUKpndj5zIv1KvGQ,"A place like this calls for numbered issues:

1. The dinner special (Tamales, Enchilada Style) was way too salty. 

2. The tortillas were very obviously store bought; they were served dry and hard. 

3. The micheladas are nothing but your choice of beer with Bloody Mary mix. This was especially disappointing bc we were craving micheladas. You can find better ones at Bonito Michoacan. 

4. The menudo was extremely bland. The broth tasted like watered down ramen soup BEFORE you put the seasoning in. The actual tripe was very soggy. I may be wrong but I think this means they didn't cook it long enough? Either way, it's not the way I like it. You can get better menudo at Pepe's Tacos.

5. Are we having a lime shortage again? Not one lime seen, but lemons galore. In the menudo, the food, and the micheladas. No lime.  

6. The salad that is offered with your food was comical. Store-bought cheese and half a tomato placed on top (not even diced up).

The chips and salsa are good. I leave this restaurant with a full stomach of that. Unfortunately nothing else left a great impression and we will not be returning. For the prices this place offers, I would expect the food to be a lot better. Very disappointed.",zgFpxIm2_I86lhtHOdmjsQ,1,0,2,tGIXWNJo1JgMxlmSqs6yTA
2518948,2013-02-27,0,IyrDnrvUKpndj5zIv1KvGQ,"The best Tamales in Las Vegas, hands down. I grew up eating at this place and every time I come back home I make my required visit.",1T-N4ko8XZr9Ggm-qFtQzw,0,0,5,OiRTeQyIrjwaUR_JXY5r9A
2523549,2012-01-04,0,IyrDnrvUKpndj5zIv1KvGQ,"After hearing from everyone & his/her brother & sister about this place AND seeing in the paper how its a huge local Christmas tradition to stop by and pick up 100's of tamales at a time, I decided to try it out for myself.

I wanted to go in and sit down but unfortunatly my time was pressed & I got a Chicken Tamale to go. The price was kinda high at $4.15.....$2.75 would be more reasonable BUT it is what it is. When I got home I was surprised to see a big bag of warm homemede tortilla chips & some mild sauce. This made the price a little better and the Tamale did not dissappoint.

I look forward to going back & sitting down & trying a combination platter & reviewing it here....stay tuned",pFnRSBFyU7IEF-9Z-UHP7A,0,0,3,LgTFQaV8k9J9NgLzMJuNWQ
2558878,2007-04-04,0,IyrDnrvUKpndj5zIv1KvGQ,"It's been said already:

These are the best tamales you will ever taste.

Dona Maria's been hanging around downtown since 1980 on the corner of Charleston and Las Vegas Boulevard.  It's not the most visited of areas, especially for dining, and Dona Maria's has been here and packed for almost 30 years.  They recently opened another restaurant in Summerlin so you won't have to drive your nice car downtown (wasn't that sweet?)  The reason why it's done so well are the tamales.  They are out of this world.  They come in pork, chicken and cheese with expertly crafted sauces.  The rest of the menu is great as well - just good Mexican food - but really, people come here for the tamales.",VeYSD3Xgxd-R4yowet51tA,2,2,5,t5LburN8GeG4w__KQv6M0A
2627155,2014-10-12,0,IyrDnrvUKpndj5zIv1KvGQ,Amazing tamales as always!  My family has been coming here for about 40 years.   Not always at this location...used to just be a walk up counter back in the 70's.  I live in Colorado now but nobody's tamales even come close to Doña Maria's.   I bring home two dozen each time I visit.  The chicken are my favorite but the pork are also great.,f_YKU1YshVylXeAeQ7mGcw,0,0,5,3fEKFOBRov4moSd0grwm_A
2636155,2017-02-22,0,IyrDnrvUKpndj5zIv1KvGQ,"Being a tamale lover I had to try this place and was not disappointed!! Husband and I split 3 - chose the chicken, pork and beef.  Chicken and pork were my favorites!! Meat to corn ratio was perfect- staff was friendly, my margarita was great and hubby loved their horchata!! Great salsa also",fpf4JE29zqK9_7V1JCngBg,0,0,5,kLHgG1aVIMrtLflFLR_74A
2636449,2014-09-07,0,IyrDnrvUKpndj5zIv1KvGQ,So good. Their coffee has cinnamon in it and it's the best. I had 3 full cups. The tortilla soup was scrumptious and the census from the family was that the menudo was very satisfying. The tamales oh my gosh they were so delicious. Very moist. I would definitely hit this spot again .,-olXaDA89nSfIvCjSPni9w,0,0,5,Bss4K2ULBBiBUaGZjzFj_g
