,date,funny,business_id,text,user_id,useful,cool,stars,review_id
2674876,2014-03-13,1,IyrDnrvUKpndj5zIv1KvGQ,"We have passed by this restaurant many times and always said that we bet that dive-looking place has the best Mexican food. So tonight we tried it. We won't go back. We got a margarita. It was strong, which is unusual so it had that going for it, but that was it. The mix had no flavor, not lime or even sweet. Weird. The chips and salsa were good. People on Yelp had said that. I ordered the Mahi Mahi tacos. The menu said 3 and there were only 2. The fish was very over cooked. There was supposed to be a mango salsa. I guess there were a few mangos there. There was so much mayonnaisey something on it that it ruined it. Just overall icky. It came with ""grilled"" veggies which were Birds Eye at best and not grilled. The rice was white with peas. Way too much butter. I only picked out the edible pieces of fish and left the rest on the plate. All that for $19.00. My husband ordered a steak and enchilada plate with green sauce on the enchilada. The steak was chewy and although there was green sauce on the enchilada there was red sauce inside. What? The waiter should have mentioned this. The Mexican rice was too tomatoey. He didn't even finish his food. Not once did the waiter come to our table after the food was brought. When another waiter came to take the plates he asked if I wanted a box. I said no. He didn't bother to ask if there was something wrong. I had planned to order a tamale to go just to try it based on the reviews. Honestly, by that time I just didn't care. Side note: We overheard the people in the next booth ask for limes and the waiter told them they only had lemons not limes. What?? A Mexican restaurant that doesn't have limes? 
We sure haven't had much luck finding a good Mexican restaurant here. Any suggestions?",J7_9NQbVDV95N25BJ3aAiw,0,0,1,-BNacwb1TzVaUSBDTsSCvw
2679135,2014-03-13,0,IyrDnrvUKpndj5zIv1KvGQ,"Just so you know...my dad first brought me here when I was in grade school and I have been coming back ever since.(I'm 48 now) The best tamales ever!!!! I moved away to Oregon for 13 years and was on a quest... telling people of the awesome tamales I knew in Vegas, I got lots of suggestions but nothing compared to the pork tamales I grew up with, and now that I'm back in Vegas this is a regular stop for me. The rest of their food is OK but nothing beats those Tamales",-GEe27E7IE_2ViOn5hTphQ,0,0,5,1snG_xfcZIs9gR5zibI0cg
2693420,2015-01-16,0,IyrDnrvUKpndj5zIv1KvGQ,Can you say - Horrible Service = The staff get caught up in their own conversation therefore the food sits longer then it should. I was not given what I ordered. Part of the food items on my plate were cool. The quality of service and food has not been up to standards.,ttR9s1EEXXjINGNOC7689A,0,0,1,Gl5hQXSm_T8mIE8wW0Z9Ag
2693986,2018-03-27,0,IyrDnrvUKpndj5zIv1KvGQ,Been here multiple times. Always good. Guacamole is awesome. Service is spot on. Wait staff is friendly and attentive!,B3JCCTYI-AO2M0VzMzU5hA,0,0,4,4MmqfJq7HJqlpnR2vPIadA
2727361,2015-10-22,0,IyrDnrvUKpndj5zIv1KvGQ,"The place was really nice, however, the customers need to mind their own business!  The waiters really need to pay attention to the order and get it correct!  The shrimp tacos were fantastic!  The guacamole was really good too!!!",1Y028C0v0Ry_JC8PGMMKdw,0,0,3,0FPXAjz62jtx-PdowtUYFQ
2731758,2015-07-24,0,IyrDnrvUKpndj5zIv1KvGQ,"Good horchata. Good service. Food was a little better than okay. For a place with Tamales in the name of the restaurant, my expectations far exceeded my experience.",asiAapjTX5tYmQWlUcc4BQ,0,0,3,bq6Al0sX1nGN7HuZU8l9kg
2754375,2016-02-12,0,IyrDnrvUKpndj5zIv1KvGQ,"Wack. 1 star minus 1 star. Do the math. Lunchtime. Sat at bar. Service and treatment received forced me to submit this review. I never review but as a public service, here i am. go somewhere else. You. Are. Welcome.

Now i have to go submit 5 good reviews on other restaurants to get rid of this negative energy. Woooosahhh",0NNUPuBA70P57aUFM8jBcA,0,0,1,84RxILJrnrfnO1KJB3nnvQ
2767673,2008-12-29,0,IyrDnrvUKpndj5zIv1KvGQ,"This place has the best tamales outside of Mexico!!  After we arrived in Vegas, we headed straight for Dona Maria.  I had 2 chicken tamales in red and green sauce and they were amazing!  The chicken is so finely chopped  that it literally melts in your mouth.  The sauces are also fantastic.  My husband ordered the chilequiles which was also excellent.  The guacamole dip is also delicious and huge for the price.

We loved our meal so much that we came back 4 days later.  Don't miss this wonderful restaurant when you're in Vegas!!",B2x9i-9H_qWFolMiq-aFSg,0,0,5,OPJRdvrnV92UsmL2R4FqQg
2775704,2012-03-21,5,IyrDnrvUKpndj5zIv1KvGQ,"I only let my old lady eat here once a year, otherwise the bitch would be 300 lbs. And if that ain't a good enough endorsement for ya, how about this: I was having lunch there one afternoon while a nice Latino gentleman was painting the mural. While I sucked down my chips and salsa, he painted a farm-hand's mustache  with chiaroscuro outbursts of vigor reminiscent of Picasso himself. Foolishly, I yelled, ""Make it bigger!!!""

He looked at me perplexed.

""Make the mustache bigger, señor!""

He smiled. 

I was in a friendly place.",WltNPOXSLUck_eeiKCnsig,0,1,5,Hk2Dn4nflaJm4UzyhokaCQ
2781545,2011-12-28,0,IyrDnrvUKpndj5zIv1KvGQ,"Four Stars are for the tamales and the soup.  Everything else is good, but not up to par with the wonder Mexican food closer to the border (much less in Mexico). 

The staff tends to be friendly there and I was generous with the stars because I do think they should thrive as a business---though they should cut down the menu a bit.

Buy the tamales in bulk for a small group, or even more for a bbq or a party--it's much more cost efficient that way and they heat up nicely.",qSltbb4Puw_D9IqQf-s0dw,0,0,4,aiQDYY-DToE_xYC8X44D0Q
2783565,2018-01-04,0,IyrDnrvUKpndj5zIv1KvGQ,"Happy Hour Is My Favorite !!! 
But the Chile Relleno was dissapointing
But the tamales are great !",JwKTHgaGU5BVr1o2ORGOKA,0,0,3,2HrzZ2-oHT0N1c7XbJR0Kg
2787741,2015-05-04,0,IyrDnrvUKpndj5zIv1KvGQ,"We have gone here twice for dinner. Wonderful service both times! The servers are quick and attentive and food and drinks come out fast! Food is pretty tasty too. Good guac, good salsa, and good enchiladas! Their jumbo margaritas are really strong too - plan accordingly if you order one! We will definitely be back!!!",EmWRBnsaKgpJLT2xmKJgiA,0,0,4,3pN80CmpS_P2lBjpLVShqw
2858932,2014-12-14,0,IyrDnrvUKpndj5zIv1KvGQ,"My family & I fully ENJOYED this place. After a ""VEGAS"" weekend starting on Thursday & doing family things, toys place was cozy, comforting & almost peaceful. The background Latin music was soothing & not in my ear.  The food was GREAT!!! We will definitely be visiting again when we revisit Vegas as couple.  Menudo small was just right size & delicious, Huevos Rancheros was good, & beef tamale was good. ""Champurrado chocolate was the bomb,""  my kids words.",AXl5Caiv5kCHC5VjQSO0Jw,0,0,4,suqgYftyzXxH_r2QMdOUDQ
2901831,2015-08-19,1,IyrDnrvUKpndj5zIv1KvGQ,Overpriced and food is mediocre at best. The tamales are good but were just thrown on a plate with old rice and beans. Had to ask for the salsa that they said were served with them. Sucks when the best part of your meal is the chips and salsa.,KS5gL02-p4-b0E5YctqDrA,2,0,2,jD-QrDExJvuO__xDjW1GvQ
2905777,2015-07-20,2,IyrDnrvUKpndj5zIv1KvGQ,"The fajitas were 5 star...so why just a 1 star rating?

1. Location...it is technically on the strip but it is the nasty part between the Stratosphere and the Sahara.

2.The service...it sucked in a major way. The only clients that were getting proper attention were the 2 business men seated next to us. Otherwise the waitresses are lazy at their job.

3.The food...other than my fajitas, EVERYTHING ELSE was Taco Bell grade at best. Very cold food. The ""famous"" tamales were just gross. Dry old masa with gummy slightly slimy texture meat...old frozen and microwaved I imagine. Yuck.

4. The silverware looked to be dirty. Good thing I had tortillas to use.",oEJm7HWTOi8K86F1lWvWUg,6,2,1,2TYnO4ocCPMsbjspU4hALA
2919729,2013-09-02,0,IyrDnrvUKpndj5zIv1KvGQ,"This place is still good eats!!! I'm from San Diego and this Mexican food was just as good as we have in diego . I'd highly recommend this place again to any one . 

It had been several years since I was last here like 5-6 yeas ago and I wasn't sure at first but they didn't disappoint us at all . 

If you want good Mexican food , close to the strip, and reasonably prices here's your place go check them out I know I will be goin back when I visit again !!!",MbTbyTeFRRHobUD98tToUw,0,0,5,WpJK6OE1SLw_6n5h2P8NSw
2927322,2009-11-25,0,IyrDnrvUKpndj5zIv1KvGQ,"I went here a couple of weeks ago for breakfast. 

The free chips and salsa we got were sooo good! The chips were so light and crispy and the salsa was perfect with it! I couldn't get enough of them.

Our waiter was pretty attentive as well. He kept filling up our glasses of water when they were only halfway. The only problem with drinks that I had was that I ordered an orange juice and it came in such a small little glass and it was like 3 bucks!

I ordered the huevos a la mexicana and he ordered the Machaca con huevo. I really enjoyed my food, it was so authentic and ooh soo good!  Our plates both came with tortillas on the side. We got the flour tortillas instead of the corn and they were so fresh and so yummy! I could eat them as a snack!  

I would definitely recommend their Mexican breakfast, just beware of the pricey OJ!",AuvaQaRHBowFaFtoEMqkVg,1,1,4,AMiClblzw2Aw_IpwAvtTlw
2930620,2017-04-23,1,IyrDnrvUKpndj5zIv1KvGQ,If you are looking for authentic Mexican food I would recommend this place. The service is great the people are friendly the food was okay. I ordered tacos and like tacos I expected a flour tortilla or corn I did ask for flower and I got a hard shell. Didn't really eat it cause it wasn't that good. The rice and beans it came with were okay.,p8IDOaEADVMeV65GzHbqKQ,0,0,3,HkJURlbbUiQrYL3_GjyUHw
2994019,2011-02-23,0,IyrDnrvUKpndj5zIv1KvGQ,"When I first started coming here, it was a 5 star joint. When I came back this weekend, I see it for the 3 1/2 star-red joint it now is. It's unfortunate. The server no longer take the time to converse with the patrons to make them feel welcomed. The complimentary chips were crumbs. Quite literally, crumbs. They fell through the holes of the basket. They never refilled my salsa and chips like they used to even though he SAW (and yes, I know for a fact he saw it because he looked right at it) that it was pretty much empty. After bringing us our order, he basically never came back again until he saw that we were finished with our food. Um, thanks for nothing, jerk! I'm not going to tip you more for coming right before we ask for the check!

That's just service. As for the food, a bit salty. I'm embarrassed to have dragged my friends here swearing they've got the best tamales ever. FAILED.",JYw4OmQhq33CijEojhK72A,1,0,3,-z6JMAk_96LnCN6zZMGBvg
3018873,2017-03-18,0,IyrDnrvUKpndj5zIv1KvGQ,I'm shocked that this place only has a 3 1/2 star average on yelp. I love this place and so have all of my friends that I have brought here. The food is excellent and the staff is friendly. What more could one want.,r5HRW5mIzaag94HpsHWQxQ,0,0,5,-5yD29UtupcryPjcrsUuNw
3035390,2016-10-04,0,IyrDnrvUKpndj5zIv1KvGQ,"Worst tamales i have ever had.  We went and ordered the special, tamales with beans and rice.  The tortilla chips and dip they bring out is nice, but it took them quite some time to get the food ready.  The tamales were dry, certainly not cooked the same day, the rice was bland and overcooked.  And all that covered with bad sauce and heated up it a microwave most likely... Because the plates themselves were as hot as the food.  Never going back, not recommending.  Vegas has much better places than that.",pamMZKnHOJjMeIc5Kc53KA,1,0,1,OWE4XFqp-8RKD9DM_xdnGw
3069968,2007-07-16,0,IyrDnrvUKpndj5zIv1KvGQ,"Yes, their Tamales are really good.

I knew that a place like this in Vegas had to be better than anything on the strip. It's always great to eat like the locals. I ordered their burrito with tamale dish and was more than satisfied at the end of my meal; that pork tamale was really delicious! The burrito was really fat and unfortunately filled with refried beans (I prefer black beans). What's nice too is that they serve crisp tortilla chips with tasty salsa while you order your meal.",sd93J2mAZnQga-HVU_Zxyw,1,0,4,P-C7JTKi5ldqzSMXjlKd6A
3074935,2011-04-07,1,IyrDnrvUKpndj5zIv1KvGQ,"They proclaim to have the Best Tamales but they are mehhh

I had the 2 Tamale lunch plate, Green Chicken and Red Pork.  The pork tamale was definitely better.  It was more moist and had more flavor.  I found the chicken to be dry and lacked kick.

I ordered an additional taco for $2.35 and it was decent at best.

On another visit, I had the menudo and was pretty pleased.  

The chicken fajitas were pretty tasty as well.

All in all, it's a decent spot.  3 stars....4 stars at best.  There has to be a better tamale in Vegas.....The search continues...",ZyGrNTbnab8N3kmesYaQBQ,2,1,3,LA3D-eXOKWolbWKFVIwMYw
3083315,2010-06-15,1,IyrDnrvUKpndj5zIv1KvGQ,"Doña Maria's is a classic family-style Mexican restaurant, from the grey vinyl booths to the ""cantina"" inspired decor. From the outside it doesn't look like much...a squat, dusty building with bars on the windows. Yet, considering that it's been around since 1980--practically Biblical times in Vegas years--you know it's probably pretty decent. 

I arrived for happy hour at 4:00, walking from the nearby bus stop. Other reviewers have (accurately) described the neighborhood as dicey, but it's perfectly fine in the afternoon. I ordered a jumbo lime margarita for $4.95 which was roughly the size of my head. It was far from a masterpiece, but certainly got the job done!

The chips & salsa were fair--chunky corn chips in a thick, fruity salsa. I followed up with a bean & cheese burrito. In addition to being one of my favorite dishes, it's a surprisingly reliable benchmark of quality. It arrived, somewhat alarmingly, in two minutes. The presentation was straight out of 1983, replete with the decorative lettuce and tomato garnish that inexplicably accompanies Mexican platters. It was fairly tasty--dripping with melted jack-- and I nibbled for about an hour as I emptied my glass. 

Apart from happy hour, it's not especially cheap. with a la carte lunch entrees in the $10 range and seafood dishes exceeding $17. While hardly outrageous, I personally expect a bit more individual attention and detail for these prices. Nonetheless, I'll probably return to Doña Maria's and write up a full review of their eponymous tamales.",tfDKZHUUb4SnAWuPOPqw5Q,1,1,3,hTt_10DHMtvTs81qNr5BpA
3083910,2010-09-21,1,IyrDnrvUKpndj5zIv1KvGQ,Ever walked into an old establishment and feel like you leave needing  shower...welcome to Dona Maria. It's plain damp feeling and just unpleasant. The food was OK but being  regular lunch eater in the downtown area I'm glad I waited so long to try this place and it will be a long time before I try it again. Sorry!!!,KABt0m_4IqRv4-b3dW6M1A,1,0,1,5wbWmU2I8bZGZJFuGWD3CA
3088144,2013-08-08,0,IyrDnrvUKpndj5zIv1KvGQ,"I had lunch here today.  Tamales were very good.  Food overall was good, but not great (but not bad either).  My wife has an avocado allergy and the menu did not disclose that the tacos came with guacamole on them so it would be nice if the menu were clearer.

There are over two dozen well priced combos, breakfast items, and a full bar.  I'd go back.  It was good.",NohOpIwdV45ogbP0RGV4rg,0,0,3,xLeFygeHRYor_NLgbC4z4A
3093324,2015-01-24,1,IyrDnrvUKpndj5zIv1KvGQ,"Yes it's good!  Took a chance that this local hole in the wall would be good and was not disappointed! 

Pozole is yummmmmm... And tamales were good too!  And the pozole was amazing!!!! Oh and the pozole was...

Definitely going here every time I'm in vegas!",uNvLkDvas66dGcs8qukptg,1,0,5,OJTJqw52E82kcNE-aK6_Xw
3104825,2018-04-01,0,IyrDnrvUKpndj5zIv1KvGQ,Food is delicious my fav are the chilaquiles verdes they are a lil spicy but very flavorful. The coffee is good especially after a night out. Been coming here since last year its a must while in Las Vegas!,rXOCGiKT_909ii4lLfKoEw,0,0,5,d0pBUvECUHKHSNNTA2L9Iw
3129849,2007-07-27,0,IyrDnrvUKpndj5zIv1KvGQ,"Salsa enfuego!

I love this place.  After years of living on the East Coast, Dona Maria's got my fiance' to eat Mexican food.  I started him on the chips and worked him up to the tamales.  

This is also a great place to bring out of town guests who don't want Strip crap.  Good stuff.",VW-QqbO5CLn3H1wBuFrOGQ,0,0,4,DZbvXhIGtO_djL2BTHEe-A
3151269,2012-02-27,0,IyrDnrvUKpndj5zIv1KvGQ,"1. Horrible and unfriendly service
2. Took almost half an hour to get food
3. ""Shredded beef"" taco, not recommended
4. Single tamale is NOT worth $5, should be $2.50 TOPS

Used to be a much better and friendlier place. Last years experience wasnt the best, but i gave them the benefit of the doubt. They only confirmed that its getting worse, wont be going or recommending this place anymore.",g5kMM9e0F0i6hxI7pUjoRA,2,0,1,yuVg4xvIp9F-Tf8oCl1bzw
3153039,2011-05-15,0,IyrDnrvUKpndj5zIv1KvGQ,"I always come here before heading to work. I get my frozen mango margarita, the BEST in town by far for the price and size. Its Vegas, you pay too much for any alcoholic crap on the strip anyways.
But this place does not pull your money out of your pocket.

Food is always fast, service is ok, its a family style so there is a lot of chattering sometimes late and not much paying attention to late night alcoholics like me :)

The only down was once, when I spilled my new drink and was not offered a refill or replacment free or cheaper. It was totally ignored.

Oh well... othetr than that I always had good food and strong drinks there.

its tricky to pull in from las vegas blvd and charleston, so go on 4th from charleston and pull in from the back.",VVvPNapOOZi-TwNIM1YnsA,3,2,5,MFJ7BoFhGx2HMLqQikoczw
3158537,2013-10-28,0,IyrDnrvUKpndj5zIv1KvGQ,"Unexpected local find on our way to see gold and silver ""Pawn Stars"" shop. Service was great, servers were friendly and knowledgeable. Mexican food was authentic and drinks were awesome. Try the strawberry margarita made with real strawberries not the flavored crap you get on the strip for $20 bucks. Prices were reasonable. Would definitely go back. It's not a ""fancy"" place but it's good food from friendly people at a reasonable price!",hUxYSIES9Zw98TNO4vDPjg,1,0,4,P0aY-gvUiz_oA2CoWQaEdQ
3166214,2015-03-11,1,IyrDnrvUKpndj5zIv1KvGQ,"Gastro is the word ... GATROnomic experience ... NO
GASTROintestinal distress ... guaranteed 

The WORST Taco ever .. 
Bad enchilada , the Tamale was so-so

There are so many choices for Mexican food ( like Taco Bell ) skip this place",x-WX7YV_2HQU_IL4hGIrPw,0,0,1,4SVUMZj5BGFujQj_HYdgDA
3193065,2007-12-06,0,IyrDnrvUKpndj5zIv1KvGQ,"This rating is for their Big Fat Meaty light Delicious TAMALES.  The best I've ever had outside of a private home.  Light Masa, Flavorful, Beautiful.

The balance of the menu is a little Gringoized for my taste.  Too many ingredients in the tacos.  Guacamole too creamy etc.  But the Pico de gallo chopped salsa is realy nice.  They put cinnamon in their carnitas which I dont like...but the carnitas were meaty and juicy none the less. Id give the restaurant as a whole four stars.  My problems are more with style than quality. The quality of everything I tried was uniformly high.

But the TAMALES are WORLD CLASS. ...and I know tamales.  Ive eaten them in four countries and know the styles.  These to me seem like Jalisco/Nayarit. (Mexico)

I ordered 12 dozen a day ahead and they made them up for me and froze them so I could drive them home to LA.  Now I'm set for Christmas Eve.  We always make some but since the average visitor to the casa Hollywood eats about 4....it's nice to have a backup supply of the good stuff.

My favorite way to eat them is ""a la comal""...meaning that they are steamed first (as always)...allowed to rest...and then crisped in a non stick pan.  You kind of squish them down in the pan so that more of the masa is in contact and then treat them like a pile of hash.  DONT ADD ANY OIL!!  The manteca comes out of the masa and allows everythign to get a little crispy.  You can start them in the pan with the corn husk still on and then sort of shake the tamale out ofthe husk once it heats up a little.  Then just squish it with your spatula and let it cook.  Hard to burn so High heat is ok.

I asked for them to be prepared this way as an appetizer in the restaurant and they did it for me.  I would skip the ""enchilada style"" thing they offer.  Tamales, like oysters, (and women), should be enjoyed with minimal additional complication.  The simple essential item is as good as it can be.

After transfer to a dish I like to drizzle mine (tamale I mean..;) with Blanca's smokey tomatillo/Chile Japonese salsa.  Increible.

I'm convinced that this is the way the Tamale was intended to be eaten.

BITE IT and see.",wuouYwwc_19EY5dzM8evsw,2,1,5,HWVKzqvNyl9eUhf7Wt_EHQ
3196297,2016-02-24,1,IyrDnrvUKpndj5zIv1KvGQ,"Not among the best Mexican restaurants in town. 

I had the fajitas while my mother got a combo with a chile relleno and enchilada. We asked for bean dip as an appetizer which came out as plate of refried beans with a little cheese on top...weak. 

My chicken fajitas were just ok. Chicken wasnt the most flavorful or moist but were edible with the toppings. My mom didnt care for hers and left most of it on the plate. 

The establishment itself was beyond empty. Not a good sign for 6-7p on a Friday night in the burgeoning downtown region. Not to mention it had that smell of ""old"", no music and extremely harsh bright lights.",LWxR64_-iziF1fjGhAURHw,0,0,1,D38WL7obk4j_yXN7PgHrmQ
3208298,2016-11-05,0,IyrDnrvUKpndj5zIv1KvGQ,Food was delicious and the service was outstanding. Make sure to try the coffee here it is not like any other you have had before it has a hint of chocolaty/ cinnamon taste that is addicting. If your in Vegas for a visit you should plan on coming to this place.,fjxY-om1HrzZKLOciNL6CQ,1,0,5,nbbJDpaliB13RrcPdsBRBA
3216124,2013-09-11,0,IyrDnrvUKpndj5zIv1KvGQ,"I don't know how this place got these reviews! Look at the tables graute how dirty and black it is. This place stinks really bad. The food is not authentic Mexican food, you can tell its out of a can or box. The tamales were reheated several times and did not have a good flavor. You can tell how old a Tamal by the leaf",BgvaMfksRjIJPaeYs69DDg,1,0,1,6-SGKv09iSKKFAutrpx6PA
3229477,2011-09-17,0,IyrDnrvUKpndj5zIv1KvGQ,"I ordered #22 the famous pork tamale and the cheese enchilada. It was very disappointing. Too much cheese on top of everything and salty. The tamale had a conchinita pabil type stringy pork with an unusual flavor and the rice had an herb that was very different flavor. I have lived in Guadalajara and Mexico City and now live near some of the best Mexican restaurants in Santa Ana and Costa Mesa California so I think I have a good pallet when it comes to Mexican food and I have to say Dona Maria is an Gringo version of Mexican food ""not authenic"".",S6C1t0Djf-YOjJVR3lQrCg,0,0,1,52UAT9L8uYGsQT1Zmq0BpA
3271043,2018-05-01,1,IyrDnrvUKpndj5zIv1KvGQ,"A beautiful restaurant in the middle of a not so desirable part of the strip. But don't judge a book by its cover here people! 

Came here for breakfast before my flight home and enjoyed a variety of house specialties, ordered both their chicken and their pork tamales, the chile rellenos platter and made to order vanilla custard filled churros. The pork tamale was a bit dry and flavorless whereas the chicken variety was really wonderful and seasoned perfectly. So perfect that I had them pack up 3 more for my long plane ride back to the east coast! Vanessa my waitress was even so nice to take each of the Tamales out of their husk wrapping and gently placed them in a sealed foil wrapping before putting them in their styrofoam to go container so I wouldn't have any leakage issues.

The Chile rellenos platter was so delicious and filling, I could not stop eating it. A large poblano pepper stuffed with cheese then topped with more cheese, who can say no to that kind of deliciousness! They offer the usual plain Cinnamin sugar dusted churros and then they also offer one that is filled with rich sweet vanilla crème. A beautiful light golden fried piece of stretched dough, it was the perfect way to end my successful Vegas business trip.

I'm really excited to get back there in my next visit and try the rest of their menu!",gZKrQxAG2cpsXpwOMLvcow,4,1,5,w_Zpo32N53BsatfjQQK4bA
