,date,funny,business_id,text,user_id,useful,cool,stars,review_id
233561,2011-11-26,0,jgtEoeE2uoA27J_UvbE20g,Stumbled on this place and the pizza is fantastic...a must if you're on Fremont St in Vegas,-q599PRu6ML0xDpnfOQthA,0,0,5,eTRxCQK6wKqmsmPtzEUfJQ
303432,2012-03-08,4,jgtEoeE2uoA27J_UvbE20g,"I was downtown by the El Cortz and needed something quick to eat.  I recalled seeing Uncle Joe's on Yelp and decided to make a stop before I hit up the Fremont area for a rugby event.

I stepped inside and felt like I was transported back to one of the many old-school pizza places back home in Pittsburgh.  Yes, the place advertises Philly Cheesesteaks on the window, but is eastern PA really so different from west?

If you're an east coaster, I think you'll know the place well: small interior, dimly lit, old school booths for seating, the overwhelming color palate from 1978, an ancient stove with a pot of sauce bubbling away, some sports game on a small TV, and a ""hurry up and order"" feeling you get from the guy behind the counter.  I honestly forgot for a minute that I was in Las Vegas.

My husband and I got the 2 (huge) slices for $4 deal.  For a dollar more you can get a drink.  You cannot beat these prices, even Downtown.

Taste-wise?  Ok, maybe not 4-star.  It's your typical thin-crust, greasy, east-coast-style pizza and nothing really jumps out to ""wow.""  But it's definitely solid pizza at a great price.  Go for the atmosphere and to fill up before a night of drinking in the Downtown area.",ELfzWgdf64VBLi5z1ECItw,5,4,4,MTS79CY9eylF0gRgCgAjLg
379879,2011-07-08,0,jgtEoeE2uoA27J_UvbE20g,of all the pizza joints i've tried in vegas this has to be hands down the best and closest to new york style pizza that you're going to get...even just ordering the classic cheese pizza slices are so tasty you don't need toppings unless you are a crushed red pepper person like myself...you can get 2 slices for 4 bucks or a large 1 topping for 10...definitely pretty well priced as well...just wish it were a bit closer to where i live...not very convenient to where i live...but if you're in the fremont street area give this place a go...you won't be disappointed...even down to the kitschy decor like scarface and sopranos posters on the wall...,ZjpZMJhCE5GGGG98tZLvYw,1,0,5,QfVa79v1qVRZpwv6D2MesA
446742,2014-07-26,1,jgtEoeE2uoA27J_UvbE20g,"I was looking for somewhere to eat after 11:00 pm on Thursday night with my son and two nephews- all teenagers.  We tried a few places and it was near closing time for many of them- none of them seemed overly eager to serve us- casinos and shops included. Jeff set up 4 of us with a large pepperoni pizza, 25 chicken wings and 4 drinks as he and his employees were wrapping up the day. After wandering around Vegas for the day, it was the best pizza and wings ever!",OhhUX9gUG4h_bmucCxdnFg,0,0,5,ducYhIxhAeKwZJ5XEO9BqA
455545,2013-08-08,1,jgtEoeE2uoA27J_UvbE20g,"This place has been around since Fremont was ""dangerous"", I've always enjoyed the pizza but bummed on the early hours. (They were closed before midnight on a weekend!) 

Now, with Fremont exploding, Zappos moving in, and the people from the suburbs who no longer think downtown is ""ghetto"", Uncle Joe's decided to shut down for a brief moment and do some remodeling! It's better than ever ; new counter tops, ovens, a window to serve side walk customers..still the same great pizza!! An the most important, they are now open late, till 3am! 

If you want fast good pizza while bar hoping, go to Uncle Joe's (local, Independent an a downtown Las Vegas main stay.)

  Also, avoid the corporate chain place across the street at all costs!!!!",AmRlsgOLvp96SsXBHK7P-Q,2,1,5,iItD1ze8OEdzpUZgLZOsXA
532821,2012-01-09,0,jgtEoeE2uoA27J_UvbE20g,"Sometimes you come across somewhere special. Uncle Joe's is one of those places. It is not very big (only ten tables). The decor is not very impressive. But the combination of the people running the restaurant and the taste of the food makes it unforgettable. When you come in for the first time and get greeted by Joe, he makes you feel like family. Like you've been coming in regularity for a long time. Some times Joe's son is running the place and he is just as friendly. The kitchen is very small and you wonder how they can put out so much food in such a small space. There are seven tables for two persons and three tables for four persons. The walls have photos of the Rat Pack and others as well as a photo of Joe when he was a poker player.

Uncle Joe's is known as a pizza place, but he has much more. He serves pasta, chicken and the best burgers and fries in the entire Las Vegas Valley. His spaghetti and lasagna are very tasty and filling. His pizza has a good crunch to the crust and a sauce with a lot of flavor. Not the best I have ever had, but very, very good. But what Uncle Joe's should be known for is his burgers and fries. The burger has a lot of flavor and is very juicy. The condiments are fresh and the bun it is placed on is lite and fluffy. The fries are nice and crisp and taste just like a fry should taste like. I ran into Uncle Joe's the other day just to get a burger. The price is so low for such high quality. I ordered a double cheese burger and the price was only $4.05 with taxes (prices subject to change). You can't get a burger that big for that price anywhere in Las Vegas.",I8_iXLcpYHAb_xi2vShgOg,3,0,4,4RB7LsyK1vYByltoMa3WSA
533572,2009-04-05,2,jgtEoeE2uoA27J_UvbE20g,"I am sitting in the Downtown Cocktail Room listening to some flithy paralegal skank trying to impress the pants off some married hot stud young attorney  ---that has nothing to do with the story but I threw it in because the Cocktail Room is fairly upscale and it sits among tattoo parlors and pawn shops.  

I've eaten at the Middle Eastern take out next to Uncle Joe's and it's great but the bartender intervened and told about the pasta.

The lasagna with meatball and sausage (around the corner) at this divey hole in the wall is beyond description.  You must go here.",IVEEVwjnwg2s2w3XMp0LTQ,2,2,5,eEKjtl1ID3JpC3z47i73rg
610023,2013-01-13,0,jgtEoeE2uoA27J_UvbE20g,Really delicious pizza with thin crunchy crust! Chicken tenders and fries came with a lot of food and were pretty good.,FUEg2IffH0tUUEL2dEP9kA,0,0,5,9i1Zbs4EMIe1_eoX5sbr0g
743581,2010-06-09,1,jgtEoeE2uoA27J_UvbE20g,"Perhaps the worst food experience I've ever had.

Uncle Joe's is a little divey place a block or two from the Freemont Street Experience.  It's decent pizza and quite cheap, especially for Vegas.

The positives end there.  I shared a small pepperoni with my wife and it ruined our 4 day weekend in Vegas.  A few hours later, I was as sick as I've ever been.  I literally managed to keep nothing but water down my entire vacation, and basically lacked the energy to leave the room.

A week later, I was still feeling a little queasy.  I've got a pretty strong stomach, but whatever was in this pizza floored me.

I'm suspecting that it may be their pepperoni supplier, because I heard of several other people getting sick in Vegas from pepperoni pizza from different places.

This pizza tastes very good, but I will forever steer clear.",YqKPdIv18KjwpyEOIGKrEQ,0,0,1,WNEaFzeDxDvEb2Pl4bR-nw
762819,2008-04-19,0,jgtEoeE2uoA27J_UvbE20g,Great traditional crust pizza located less than a block from 'The Fremont Street Experience'. A local favorite sure to take you back to the parlors you knew when you were young... less concerned with their appearance than crafting a great pie.,1pc9B_Ref8TyKtm-wSqNRQ,4,2,5,NACCFxA2nZBbhVXqX5tFng
786018,2012-07-09,0,jgtEoeE2uoA27J_UvbE20g,Wow! This place is freakin cheap!!! We were tired of going to expensive restaurants all the time and we wanted was some normal middle class food. I looked up this place in Yelp and the reviews were decent. Its a small mom and pop pizza joint. They take cash only.,-ObNZL0n8YwBW-WYJiJipg,1,0,5,6Ergyh_X7CWwcH3CzVP-1A
829402,2011-03-26,1,jgtEoeE2uoA27J_UvbE20g,"For a kind of ""hole in the wall"" place, its one of the best of its kind. Its definitely cleam (enough) and you feel comfortable eating here. Its a perfect spot for a date, as you can get 2 laaaarge pizza slices and soda for 5 bucks, while enjoying the sights and sounds of downtown Las Vegas.

If you enjoy exploring downtown, and are a person that appreciates local eats and very INEXPENSIVE (yet tasty) homeade pizza, fries, and garlic bread, get yourself over to Uncle Joe's.",dJLWIPagO5T0WdmQKYnQaQ,3,2,4,DoNCzF5CZgo65JRzoeYypw
983082,2014-03-24,1,jgtEoeE2uoA27J_UvbE20g,"Extremely complimentary to a night of drinking on Freemont.  Pizza took some time.  Lineup wasn't that long and seemed like everyone else had been patiently waiting and getting impatient.  When we did get our pizza I would say it was well worth the wait, crust was thin and tasted fresh and handmade.  Toppings were also fresh and perfectly cooked, soft yet still had that slight crunch.  Felt full and satiated without the grease and heavy feeling other pizza places offer.  After this stop my wife and I were recharged and ready to resume enjoying Freemont.",Dxv_hiuYdgBr_BffrUj0og,1,1,5,G3-pbESeUeu-VtdeLQrLUw
1013848,2013-02-20,0,jgtEoeE2uoA27J_UvbE20g,"Really good crust, and they serve pizza by the slice.  I have been looking for a place that serves really good pizza.  So while walking around on freemont we found this place.  Great pizza, nice crunchy crust, I had a pretty big piece of hawaiian for 4.50, and my husband had two pieces of cheese pizza for only 4.00, and it was a half of pizza.  Very yummy good service, and a nice little pizza shop, we will be back.",bjroYktIOEuBZAqx-Cuppg,1,0,5,wE4rzoRlldebs3SKXHjVwg
1180746,2012-10-20,1,jgtEoeE2uoA27J_UvbE20g,"Way back in the day, before Downtown was hip and trendy, my almost-native (he's lived here 24 of his 39 years) husband insisted I had to try the pizza here. That was nine years and a bad run-on sentence ago and Joe's is still my favorite in the city.

Things change, people move around, we left suburban Henderson to move Downtown. But Joe's continues to be our place.

The pizza is greasy and hot and delicious, the way pizza should be. The meatball subs are huge and saucy. Be prepared to tuck a napkin into your shirt out down your sleeve, if you're eating the pizza. 

After reading the reviews, I now know to try the lasagne and the Philly next time we go. Thanks, Yelpers!

But seriously, go eat at Joe's. You won't be sorry.",xDGHlxXxXg7GZI048lmo0Q,2,1,5,bZB78OD-999XMWbfy0kHrA
1228998,2013-12-22,2,jgtEoeE2uoA27J_UvbE20g,"So, this pizza place has been around for FOREVER. And it probably ain't going anywhere soon now that the hipsters have discovered it. 

I didn't discover it until recently myself. Good decision.

Is it mind blowing pizza? Not exactly, and it's not as good as the No-Longer-A-Secret Pizza Place at the Cosmo or Pop Up Pizza at the Plaza, but it does it's job as a dive-y pizza joint in the middle of a bar street. It's a lifesaver for those of us in need of cheap eats to either stave off the munchies before we go party or sober us up late at night before we go home. 

Oh and there's more to it than pizza too. The Stromboli in particular is to die for. 

The good:
Stays open late.
Option for sobering up.
GREAT stromboli.
Practically a downtown institution.

The bad:
Can get really crowded.

Return factor: Whenever I come back to par-tay on Fremont.",w2PyT_BYJSHOlCyxh8LzzQ,2,2,4,fIIeHeYT9axaC4BNFFm60g
1350371,2012-02-13,0,jgtEoeE2uoA27J_UvbE20g,"Greasy, tasty New York-style pizza best when not entirely sober.",pG9y1uv735_8gqz3-fK-Bw,2,0,4,94S-_cAba2dA9so_Y4VJag
1549794,2013-08-17,0,jgtEoeE2uoA27J_UvbE20g,"9:30 pm on a Thursday, security guard prevented us from parking at the El Cortez Hotel w/out a Players Card or room key... Got a free spot on the street instead.

Joe's is very close to the sights on Fremont Street without actually being in the thick of it.

Pizza was just ok, but the owner made up for it with authentic NYC enthusiasm! On the edge of being annoying (and annoyed), but it was clear his heart was in the right spot.

Very nice vibe; they even held our leftovers until we were done with the Fremont Street Experience!",TsqW06I7_kDp6nkXy-R_sg,0,1,3,iV9TNHu68CRj6TGmbdCLxg
1574308,2008-05-06,1,jgtEoeE2uoA27J_UvbE20g,"I accidently stumbled upon this place while searching for food on Fremont street. It was pure luck! We were hungry, we were like..oh let's just check out this pizza place.

Off the first bat, there weren't that many people and the few that was there were just sitting waiting for their food. Their menu is good. LOTS of choices. I got the Chicken Parmigiana sandwhich and my cousin got the Philly Cheesesteak. This place looks like old school NY pizza place or something. It's pretty low key and yet genuine and authentic.

The service is good. I'm not sure if he was the owner but he was super friendly, talkative, laid back, and easy going. Loved it! 

Food was really good too! So large in portions!

It took a while to get the food but it was worth the wait! By the time we got our food, the whole place was filled with people ordering pizza. 
The only improvement I see, is to tidy up the place. Either than that, great place to try out!!",ShE-cXiI7VwJ8GMixw6JOw,2,1,4,H80m0lFitkAGiW9pT0j0Gw
1580306,2014-06-26,0,jgtEoeE2uoA27J_UvbE20g,"I've been going to uncle joes for the last 5 or 6 years since I stumbled out of the griffin and needed some late night eats. I ordered the Italian sandwich and literally to this day it's still the best sandwich I've ever had in my life. I tell everyone I know about that sandwich. I moved away from Vegas about two years ago but went back recently on vacation. Uncle joe still remembered me and what I always order. How awesome is that? 
I have tried their philly and their pizza as well and it's dam good too. The pizza is thin and crispy and delicious  and the Philly is awesome. Can't wait to visit again and have another Italian sandwich.",ApX_I-Gi-kF_eI-BntPDcQ,1,0,5,dhoSoO-IUkU1K6YEb_HhvQ
1601562,2014-07-15,0,jgtEoeE2uoA27J_UvbE20g,Not anything to write home about but some decent pizza for downtown when you have a buzz. Typical street pizza  greasy.,3ZCS3niZj8GjbZY6Dx7uqw,0,1,3,0bwkaeF2rl_Ct1FYomAigg
1629043,2014-03-17,0,jgtEoeE2uoA27J_UvbE20g,"This place was ok.

Uncle Joe was actually there working his butt off .. So props to him!

Can't base my review on the pizza because I unfortunately gave up bread for lent :(

But the chicken wings I had was pretty good to me! Simple, plain wings. Had asked for the buffalo sauce on the side. It was a good sobering meal for the night! 

They were busy, but quick! Which is always a plus!",-C-l8EHSLXtZZVfUAUhsPA,1,0,3,1g0LE9ouxJpMcIDo5jP19Q
1655493,2012-10-11,0,jgtEoeE2uoA27J_UvbE20g,"This is not a review as such, hope to try this place on our next visit to Vegas, but a question.
The opening hours on Yelp are listed as Mon-Sun 11:00 - 22:00. However, people have left reviews stating that they have visited after midnight, which is when I will probably be visiting. So, does anyone know the actual opening hours?
Thanks",Im1K9d_lGC-8whBJYft4eA,0,0,4,AQfHvhLGl52EVHG9qvMF4Q
1812478,2009-04-14,1,jgtEoeE2uoA27J_UvbE20g,THE best pizza in Las Vegas! I've gotten delivery a few times and it was delivered fast and hot!,QZa1yDj1vM-o94x5r3odBw,0,0,5,Mr_5w73YCq5jXr2Jgl78Vg
1834436,2012-07-21,1,jgtEoeE2uoA27J_UvbE20g,"Perfect late night food!!
I am not going to try to tell you that this is authentic, or even better than just good, but it is pretty darn good.

Uncle Joe's a ""Pop in for a slice"" kinda place by day and a ""Pop in for a slice with all the other drunk hipsters"" kinda place by night.

Worth a shot... honestly, if you are standing in front of Uncle Joe's, you likely have a few drinks in you and shouldn't be driving or making complicated decisions. Go in a get a slice :)",rdysF0ymVkMX82Bu_8x3nA,1,1,4,5E6G7ncMwcXGt5ob6UD7oQ
1839356,2011-01-14,1,jgtEoeE2uoA27J_UvbE20g,"I love family owned places like this. Okay, So I'm not really crazy about pizza. If I do eat it, I prefer it to be a day old at room temp. We came across Uncle Joes while we were waiting for a band. Right outside of it all these people gave it a whole bunch of street cred. That was enough for me to try it. They had this deal 2 cheese pizzas for 4 dollars. I usually don't like cheese pizza, but this was something I gave my heart to. It wasn't even about the cheese, but the simple great taste and texture of the dough.

I came here a second time and tried their wings with a Faygo root beer. The wings were good to me. I just like how everything is classic. Nothing over the top. If anyone knows about taste and quality.. It's Uncle Joe. 

It sure is in the heart of Freemont street. I usually park at the El Cortez self-parking. It's free and plenty of space.",KyieFxrQxDx6ncUVLaCPAQ,7,1,5,1Wq_Dd6Q_a-9cCFIHFGTMw
1846714,2010-09-29,0,jgtEoeE2uoA27J_UvbE20g,THE BEST PIZZA JOINT I've ever been. This place blows everybody else away. Better than any other pizza place I've been and I had many and live in L.A. The cheese is great. Recomend highly! If you are near Fremont St. (The Old Strip) drop by.,-a-ZtmKxbdspPmVhCcDnfA,1,0,5,1Cj36M1iV02xrSzm6liI5A
1882214,2012-07-04,0,jgtEoeE2uoA27J_UvbE20g,"A very untraditional cheesesteak which was saved by the exquisite amount of carmelized onions loaded on the sandwich. The bread is decent too, but needed more oven time. This is a 12 inch monster which is hurt by the use of shaved steak and the cheese part is mozzarella which isn't folded inside, but instead melted on top. If you happen to be an onion fan though, this philly (only 7 bucks) will hit the spot. Just dont expect ribeye and i would order to go in order to avoid all the losers and other vagrants who wander into the store, which was a bit unswept. Onion fans unite, real cheesestaek fans run away.",ELcQDlf69kb-ihJfxZyL0A,1,0,3,I2MZrVP4Zd861yVM8GY27A
1882739,2010-12-03,1,jgtEoeE2uoA27J_UvbE20g,"We were just walking downtown til we walk passed this and discussed if we should have it, a guy walked out and overheard us and said it's the best pizza in town, guaranteed. So I told him I'd take his word for it and walked in.

It was a little empty with Italians yappin away while eating some pizza inside but I didnt mind, it kinda gave it 'home' feel.  My mind was already set on that 2 slices of cheese pizza for $4 bucks deal.  We got the two slices right away on some paper plates, but I didn't really care about presentation.  The slices are wide and thin, and just melted in my mouth!  The dough was nice and fresh with no air bubbles, a perfect cheese pizza if you will.

I'm glad that guy spoke about this place so highly.  Uncle Joes is that comfort food type of pizzeria.  Along with all the other restaurants that are in downtown LV.  I can't wait to try the other items on the menu.

UPDATE: Me and my gf just shared the 20 wings for $10.99.  These are the smallest wings I've ever had! =( good thing we still ordered two cheese pizza slices.",wLc6l8v7O9hXjrDi3Q7tyw,5,2,5,9zohcyw7ObEUtPWwBraV8A
1975897,2013-03-11,1,jgtEoeE2uoA27J_UvbE20g,"This place is a trip.  Some just plain great new york style pizza - and its perhaps the only thing done right. 

I cannot give it a bad review, because its independent, cheap and good.  But I'll just say this:  they just barely started accepting credit cards this year.  And half the time when their is a great crowd of drunk, hungry people outside on the street - they're closing up for the night.

They could definitely use some pointers on business accumen, sales, and investment.

But honestly, they make a damn good pie.  And that's probably enough.",3Apvsrrf4wJuG4NdwIfXwA,1,0,4,iWpdjIXNHjQ1Fba4lt0wkQ
2140327,2014-06-03,1,jgtEoeE2uoA27J_UvbE20g,"Old style hole in the wall pizza joint with great food, great prices and great people!",v114WiYGjcq-4R_cG_GiSg,1,1,4,_W5qi1bIojU6K2Io1SZXlw
2242814,2012-04-05,1,jgtEoeE2uoA27J_UvbE20g,"I'm not usually one for small restaurants, especially in unfamiliar areas, but I heard about Uncle Joe's pizza on a travel site and decided to try it. My family loved it. I had never been to down town before, and it was fairly easy to find. It was great food at a great price and I was disappointed when I returned to Vegas and could not make it back to downtown to eat here. I definitely recommend it!",5bnTeMyT7iAfSculZtYIdQ,2,0,5,AxFN3fCQkNE1WfOII3TIfw
2247917,2010-12-02,0,jgtEoeE2uoA27J_UvbE20g,"Fresh dough pizza. I can tell not even by the taste, but by the residue on my fingers, and lips. Owners say they do make their own dough and own sauce. 

Gotta say, this is one good cheese pizza I've ever had, so I'm rating them on the one slice, even very much worth my $2. This place is located in the heart of downtown, so nothin' like a good pizza shop with tables that have engraved tagging on it.  Locals know this place is a shiny rock in the rough. Great hospitality. Glad I didn't pass this up. They have good deals on wings, so next time I'm downtown, I'll be back.",DASkWfrV6kWHE_4xC7BkYQ,2,1,4,D1BeXbYtt3FiTwWIhHfAxw
2261584,2010-12-22,4,jgtEoeE2uoA27J_UvbE20g,"Let me just start out by saying that this place is closed on Mondays. Closed on Mondays.  Oh, and did I mention, it's closed on Mondays.  Just a little shocked and appalled that this was not mentioned in 18 different reviews and a little bitter that I hoofed it down here on Monday, only to be denied.

Anyway, after my usual office food truck (Curbside) threw in the towel because of the rain (who can blame him really... even Slider Truck refused to come out today), I took the opportunity to finally try this restaurant out on a Wednesday at lunch.  I tried the cheese pizza (which is now $5 for 2 slices and a soda) and I just wasn't digging it.  To like this pizza, you have to really like crispy crust pizza.  Like saltine cracker crispy.  If you do, then this is the place for you.  But I'm more of a thin, soft crust gal so it just wasn't working for me.  Plus, the cheese and sauce are not particularly flavorful.  Pizza is such a personal thing, like BBQ.

But this place get stars for atmosphere.  The owner was having a good old time screaming at people, hopefully his children, about various financial matters which was entertaining to say the least.  If you aren't up for this type of authentic Italian atmosphere, then this probably isn't the place for you.  The owner is super nice and friendly, just a little feisty.  It gives me hope for the world and this restaurant.  

Because almost everyone recommended the pizza, I had to try it first.  I will definitely be back for more fun and will try some of the pastas or sandwiches and re-review.  

And yes, it is CASH ONLY as indicated in the business info above.  And the ATM next door at the Griffin trick only works after 6pm when the Griffin is open so come prepared.",iAevEfcmtCr2cpd6IRqnTA,8,1,3,gtB-IBHwk5NkekvEuNKbYw
2263092,2011-09-09,0,jgtEoeE2uoA27J_UvbE20g,pizza was alright  but the service  was of course horrible. all in all its not worth it to go out of your way to eat here.,yCfgnFtmOQijmRzTP3adzw,0,0,3,TTzion4CXsRjILKI_JhW4Q
2308375,2011-10-19,1,jgtEoeE2uoA27J_UvbE20g,"Just updating my last review.  After drinking copious amounts of beer at the Las Vegas Shakedown, I was suddenly struck with the 1:30 AM hunger.  Kabob Korner was closed, so we stopped in a Uncle Joe's.  Ordered a HUGE single slice of cheese pizza for only $2.00.  I survived!",KFWOn7x19RmrO6kzTJYmrQ,1,1,3,T0LY_lWyoGjMcnHvN7tqNQ
2340346,2012-06-16,0,jgtEoeE2uoA27J_UvbE20g,"Located diagonally across from the El Cortez, this place doesn't look like a lot from the outside...but don't let that fool you. I had the meat calzone and it was among the best i've ever had. cooked perfectly with generous amounts of all three meats, I thought, ""Maybe I just got lucky""....so the next day I went back for lunch...it was just as good. I will make this a regular stop anytime i'm staying on Fremont. Well done!!",-tnodf38uCXjogMhZtcWxw,3,0,4,jDsIAPEcjl7bXklaaxyDVg
2445829,2012-05-20,0,jgtEoeE2uoA27J_UvbE20g,"I've eaten here on numerous occassions being downtown and I enjoy their pizza.... You get it by the slice, and 2 slices are enough for me along with a soda.... The pepperoni pizza has great flavor and the dough is cooked thoroughly with plenty of toppings with enough cheese to not feel like you've been give just pepperoni and crust.",SmS3lS6Xlttc1hi3Qbwf-Q,1,1,4,Vpzdge5xFQ8U8vJ95nUzjg
2456239,2012-06-07,8,jgtEoeE2uoA27J_UvbE20g,"""Pizza is like Sex...no matter how bad it is, its still pretty darn good!"" -Unknown/Everybody

I won't lie: this is truly the worst slice of pizza I've ever eaten...Dijouro, Frescheta, and Pizza Rolls are better.

However, its cheap and completely satisfying if you're drunk, as my wife and I were when we staggered in here after concluding another fun night dancing and drinking with the Yelp Spring Breakers at Vanguard Lounge...which is just across the street.  I wouldn't eat here sober.",IzJ36jX6V6ky5BtoN-Agng,1,1,3,vMD4OZvoQLdA7TKVLl8aIQ
2490410,2011-10-11,1,jgtEoeE2uoA27J_UvbE20g,"My last visit to Las Vegas was 9/16-9/22/2011.  Stopped at this place one day on my way back from the El Cortez heading to Fremont.  Read the reviews so I thought I'd give it a try.  Ordered one slice of pepperoni pizza with a side salad for $6.00.  Didn't wait long for the food but when I took my first bite of the pizza, it was delicious!  I took my time and enjoyed the food since I was in no rush to meet anyone.  I would go back again.",48852E3RO7ku5mEe3L_77g,1,0,4,j01Cu3fx6QMEYYxAvJ4W0g
2521437,2013-01-18,0,jgtEoeE2uoA27J_UvbE20g,"Good place to grab a quick lunch, weather you're looking for a slice of pizza, sandwich, or pasta.  Be sure to check out their daily specials!",Q0qo1Gi99LihNjitnpfCAw,0,0,3,eqXlmajLdKHsKuKYYo45Nw
