,date,funny,business_id,text,user_id,useful,cool,stars,review_id
4386023,2014-08-15,0,jgtEoeE2uoA27J_UvbE20g,"It came to my attention yesterday that I have not written a review for Uncle Joe's.  I'll keep it short:

In the evenings you'll find a passionate pizza purveyor working his magic.  Jeff is Sicilian, he's ""from back east"" as our people say, and he puts a little bit of home into each crust, each topping, and in fact each item on the menu.

But there are two reasons I'm giving all 5 (and possibly two more if possible) stars.

1. I asked Jeff about a ""real calzone"" like from back home, he came through and has done so every time since.  We're talking deep-friend, but not baked first.  Ham and cheese, that's what a calzone is, out of the fryer with some sauce.  Done.  

2. My mom was in town for a couple of days and while she's not able to enjoy the full depth and grandeur any longer due to some dietary constraints, Jeff whipped up something delicious anyway.  Maybe that my mom is 100% Italian from back east had something to do with it?  Eh, while Jeff certainly took care of us and they talked about growing up Italian, Jeff is an all-around good guy, and no matter how frazzled he gets he still wants to feed everybody some good stuff, because that's what you do when you're Italian.

Uncle Joe's has been around for a while, Jeff is no small part of the reason.  That's where I go for my pizza and calzone fix...",-hJ9Q0OSYqdOTVBLOMdg7A,2,1,5,zlysQ4yI60iafYn-_GZpAQ
4391715,2012-09-22,0,jgtEoeE2uoA27J_UvbE20g,"This is pretty good NY style pizza.  Cheese and sauce were excellent and crust was very unique, almost melt in your mouth crust.  I'd put this place 3rd or possibly tied for 2nd with pop up pizza (both behind Secret Pizza at Cosmo) of all the Vegas places I've tried so far.  Uncle Joes gets the nod on price though.  Solid 3 1/2 from me, rounded up to 4 because it's so cheap and still really good.",q6XnQNNOEgvZaeizUgHTSw,0,0,4,qJz0Cz8Q7rXXPX3awT26iA
4393347,2012-10-15,0,jgtEoeE2uoA27J_UvbE20g,"Great hole in the wall.  Pizza slice is ginormous, not dripping with fat & really cheap. 2 slices of cheese for $4.50. Also ordered lasagna with garlic bread for $5, it was their special for the day. The lasagna was ok, nothing special. But the garlic bread was good. We also ordered chicken fingers with fries. The fingers are big. Only drawback is that it's at a very ghetto area. Overall, good place for lunch if you work near Fremont and you need a quick lunch.",x7WYJzuBdYqM9PpSoNkM1Q,1,0,4,lIkKt9W5kgeLvv6cmcj-mw
4537351,2013-03-21,0,jgtEoeE2uoA27J_UvbE20g,"Second best cheesesteak I've ever had.wow double the meat for $1 and split it.
Uncle joe thank you for the good food!!!",cjrpT2nE12jEpRMJkE8FCg,2,1,5,D76bxvOvN-uIXLArrAXlMA
4559073,2014-05-30,1,jgtEoeE2uoA27J_UvbE20g,"Nice hole in the wall pizza spot downtown! The guy behind the counter, I believe was the owner was very nice and friendly to everyone who walked in. We ordered a large supreme pizza with half pepperoni and jalapeo. Tasted good, almost close to my style pizza I guess lol. We'll be back again for sure!",W5NduvWX04nIazbmgBtpEw,1,1,4,CdjpNiz6thv0d5_eJzAf_Q
4597360,2014-04-30,0,jgtEoeE2uoA27J_UvbE20g,"Best pizza in Las Vegas.   It's the only pizza that I've found to be comparable to New York Pizza.  Also the calzones are great and made to order, not pre-made and gross.",1TAgVflTTswlp5DFUOa0qw,0,0,5,FUngSL1iHafYNhWUPiDNtg
5053039,2011-08-02,1,jgtEoeE2uoA27J_UvbE20g,"Our monthly bar hopping trips to Fremont is never complete without going to Uncle Joe's.  Greasy, cheesy and delicious, the pizza here is the perfect night cap, lol.
 
Its definitely one of those hole in the wall places you hate to love.  The place itself is pretty hot and musty, especially in the summer months.  The ventilation must not be very good or something.  I can't complain too much because we really love the pizza here. Sauce is perfect and its so cheesy.  Perfect for when you might be slightly tipsy from bar hopping.  I've never tried anything else here, but other yelper's have good things to say about the lasagna so I'll keep that in mind for next time we come out here.
 
If your with a group, it's probably cheaper to get a 9.99 pie (comes with 8 slices).  Otherwise, it's 2 for 4 bucks for cheese or pepperoni.",JHFuMHQBLuQ3TtkWwx1bmQ,4,1,4,LFUtHeSxuKBUr47RUTsXGw
5088407,2012-04-18,0,jgtEoeE2uoA27J_UvbE20g,"Tried this place for lunch, on the recommendations of fellow yelpers....  I ordered the 2 slice with a drink for 4.50... You can tell this place will be good when entering... The 2 slices i got were the 2 best slices of Pizza i have had in Vegas... I have been looking for 5 yrs...  I highly recommend this place for great NY style Pizza... The steak hoagie looked pretty good as well...



5/19/12
I took a few friends to this shop for pizza before a 51s game...  Ordered large PEP and Shrooms, and a lg Cheese...  I have been here 3x now, and it still confirms in my opinion to be one of the best NY style pizza's in the valley... The consistency of the pie, makes this a great place... My friends also thought it was very very good... Thanks Uncle Joe for a great pizza...

5/29/12
I had lunch at Uncle Joes,, instead of getting the usual pizza I tried the steak sub... I am the type that doesnt like cheese on beef,, so i am not a fan of cheese burgers or cheese steaks,, Steak with LTM and Hots...  Well i have to say,,, This was really good.. The meat was good and good sized portion, the roll was fresh... I really enjoyed it,,, I usually get the fries,, fries are fries, but i did like the sandwich and will order it again and again...  This joint is quickly being my fav spot in DT... Cheap, fresh and good,, what else can one ask for....  Thanks for reading,, Try this joint if you are in the area....",1KTOdG4HltlP5GwGD3jJ-w,2,1,4,NiE8d5Ktl7grmtfRNTdrsw
5105750,2013-09-02,1,jgtEoeE2uoA27J_UvbE20g,"I like eating here when I go downtown. As I'm grubbing, and I'm the only customer there, the fat bald cook proceeds to yell at the busser. Borderline threatening him. One of the most uncomfortable experiences ever. Shame on that dude.",Tl2Jybc8IH9sTkAQNPSPcg,1,0,2,H5_C6npCurW5ceo5n1pKpg
5116447,2010-08-18,2,jgtEoeE2uoA27J_UvbE20g,"Sure , go ahead and take the plunge into this dive near the corner of Fremont and Las Vegas Blvd. The pizza is more New York style, good/solid, above average for sure. Pleanty of people realy love their pizza. Their 2 slice special is a killer deal at 4 bucks with a soda. Here's what blew me a way though...an earlier yelper had mentioned the lasagna. Hmmm...I had never even considered ordering anything other than pizza here. We all know lasagna in a restaurant can be VERY hit and miss. The lasagna here rocks! 3 square slabs were heaved into my round to go tin, it weighed a ton, can easily feed 2, a little not so great garlic bread, strap on a very well seasoned sausage, plenty of cheese, and sauce...BAM $7.25.  Sure the place is kind of dingy inside, not filthy, not spotless. If good and cheap, or delivery/to go is your thing, this is the place. Service has always been friendly every time I have been there. It took a San Diego yelper, via a Downtown Cocktail Room mixologist, to turn this local yelper onto the lasagna here. What a world.",TwUqavuMpDWCw9iCva3KXA,2,1,4,s8wXWtStnbjIoaf8VdVRlw
5132788,2011-04-23,0,jgtEoeE2uoA27J_UvbE20g,"Prices are good, pizza is good, sauce was a bit sweet for my taste but the crust was great, not doughy, high grade cheese...As close as you're going to get to authentic Italian pizza in Las Vegas.  Great customer service, fast, accurate and friendly.  Location is so-so but that goes for most of downtown.  You can park right in front of the place (10 minute parking) or a couple blocks away (parking meters) and walk.  Homeless people may ask you for a slice of pizza on your way back to your car if you choose to walk so if you're not in the giving mood or don't have a sense of humor then you should probably park directly in front just in case.",k7iAd9u4D9J1kgpEWLwAzA,0,0,4,z3plgzYuWSeiE85ecaVu6Q
5192703,2012-03-15,0,jgtEoeE2uoA27J_UvbE20g,"Great pizza. 2 slices for $4.50.
 Best food deal in all of downtown.",k1FxBPNVosnWJHttRNdvPQ,0,0,5,mNQUrQts9jNYbBUed6Lmqg
5195037,2014-01-30,0,jgtEoeE2uoA27J_UvbE20g,"I was skeptical... With a predisposed love of all things BK  or NY tyle, and pizza is definitely number one on that list... But kudos for the cheese slice. Now I've got my go-to spot for a slice of some good pizza...NY style. 
Need more visits for that 5-star. Hmmm maybe next week. Mmmm pizzzzzzaaa....",CShpbzQyU59Ev8VkIHUWsA,0,1,4,Wxkfz77ibyUppwZR3PcaYQ
5337105,2011-07-07,0,jgtEoeE2uoA27J_UvbE20g,"For less than 5 bucks it's definitely as good as it gets. 

In my opinion I'd skip the pizza, but their burgers and sandwiches sure are tasty and hit the spot.

I just wish there was one in San Francisco.",V1SOy8pmuLVso8sJisFm8A,2,0,5,NAI2oeDj7HT7ulzMa-L1pQ
5344068,2014-08-13,0,jgtEoeE2uoA27J_UvbE20g,This place has a heck of a philly! the 8oz was split between 3 guys along with a large sausage pizza. I took a half and a slice and I was stuffed. They truly pack the philly!,Ik_HDHaaxzxxUcQhvJkiVw,1,0,4,jrUmY7GfoFVhb9dPcbEkSw
5347747,2011-09-08,0,jgtEoeE2uoA27J_UvbE20g,"Very good pizza. Hot and fresh. Only negative is that it is hot inside the building. Could use some air conditioning. But the pizza and price is top notch. Family of 4 ate a large pepperoni and sausage pizza,  and drinks for about $20",ERhw6BezXs3KU-3vqfjG1Q,0,0,4,U25vXSFGRubq-4cAgaQjfA
5373188,2012-05-17,2,jgtEoeE2uoA27J_UvbE20g,"$9.99 for a large one topping pizza. I will admit that I was in a state incapable of driving and needed some sustenance before continuing the fun at the Drink & Drag. When Katrina M. and I got back to her place and opened up the box, we were pleasantly surprised by the bountiful amount of topping on our pizza. For this inexpensive price, we were not expecting every inch of cheese to be matched by pineapple. When their other special costs $4.50 for two slices, why not just grab a friend and get a whole fresh baked pie to share? We ended up eating two slices a piece and were full. That left half a pie for another meal. Nowhere else on Fremont St. can compare.

Uncle Joe's ovens are magic because they deliver a nice golden brown crust that is crisp without being burnt. The center of the pizza was cooked just as well and had an adequate amount of sauce to cheese to topping ratio.",N3oNEwh0qgPqPP3Em6wJXw,6,5,4,a6H4T1P2p3ymsnQ9XirZRQ
5386890,2014-06-23,0,jgtEoeE2uoA27J_UvbE20g,"My wife and I both had the Philly steak cheese sandwich with fries, the sandwiches were made really well they had cheese, they were dry and lacked all the juices that normal Philly steak cheese sandwiches have .  You could tell the sandwiches were made with good ingredients peppers mushrooms and onions and cheese but they were kind of dry they didn't have all the juices and flavors of had sandwiches in the past but they were good! Coca-Cola soda machine was pretty flat and the ice was broken will still go back and uncle Joe's is a staple in downtown we like it!",bnKo6L4MgcUbLZH7fmnkrA,0,0,4,mDFmR_owBrnXD7kH5skbog
5564701,2012-11-12,0,jgtEoeE2uoA27J_UvbE20g,amazing food! the cheese pizza is perfect and their chicken fingers and fries are amazing! this is a weekly place for us,jgoG_hHqnhZvQEoBK0-82w,0,0,5,9r2Y7-jYP_WkF1ooTsE8bw
5567440,2009-12-09,0,jgtEoeE2uoA27J_UvbE20g,"Loved the pizza.  Everyone should stop by when on visiting downtown area.  Crunchy crust, good sauce and cheese, good value too.",edfrbX4KMM9RAXOUYXKxpw,1,0,4,ovBQ7x8QoOIM97E-XcW5Vw
5616853,2014-09-20,1,jgtEoeE2uoA27J_UvbE20g,"Usually they have amazing pizza, but today it was room temperature and below average.",rbS-PoGtdAYeRlTZusolFQ,1,0,2,yUfEKHAlulOpcMjwiqmFRQ
5757195,2013-01-27,2,jgtEoeE2uoA27J_UvbE20g,"The best ny style pizza I've had outside of ny! You think of pizza delivery and you think of cold over or under cooked pizza that's either too cheesy and greasy or just too crusty and doughy. 

The veggie pizza here was delicious and after two slices, all I wished for is that I had a larger stomach to fit in one more! The slices here are quite large btw!

They chop their veggies finely - don't know why it's so hard for others to do this - so every bite is perfectly balanced. I really don't like large chunks of veggies thrown on top. It also was not cheese overload - they used it for flavor but I didn't find myself tearing off chunks if unnecessary cheese from any part! 

The pizza here was amazing! Amazing amazing! Highly recommend!",kW2dk1CWihmh3g7k9N2G8A,4,2,5,W4YZyET_Lmrv4J2Jo5yFDw
5763888,2014-01-08,1,jgtEoeE2uoA27J_UvbE20g,"I seriously love this place.
When you have been drinking all night walk all around downtown, there is nothing better than an affordable piece of delicious thin cheese pizza! Ands affordable so you can offer your friends/date. 

Its the best late night on the weekends, the place is kinda full of drunk fun people, and it gets crazy I love it though. I will come here anytime I am on a night out!",owbC7FP8SNAlwv6f9S5Stw,1,1,4,ToivojrY2J67-sRmu7q2qw
5820010,2014-05-21,1,jgtEoeE2uoA27J_UvbE20g,"You might pass this place by if you aren't looking for it, but it has the best pizza in town. The pizza is also a great price! 

The first time I went to Vegas we stayed downtown at the El Cortez. The bf and I wanted pizza, so we decided to try Uncle Joe's because it was so close. We walked over and took a pepperoni pizza back to our room. Let me just tell you, it was such great pizza we went back later on that day and the next day for more! 

Now whenever we go to Vegas we have to stop by and get a slice or two. As long as the pizza stays great, we will be coming back.",ITaPr6zvycMyvPnGveMHbw,2,1,5,u-lhrDQKdXG5FwoM6SmU1g
5876917,2014-09-14,0,jgtEoeE2uoA27J_UvbE20g,"I have to say I was very impressed with the pizza here. 

This pizzaria serves a near perfect crispy and chewy crust. It should be scientifically impossible to get a pizza crust perfectly chewy yet crispy like they do especially on a thin crust New York style piece of pie.

The sauce was sweet and spicy; the toppings while just sprinkled on top of a piece of cheese pizza and reheated her plentiful and delicious.

Service was fast, decor was very ghetto inspired New York city. Graffiti on the walls and about $100 in singles with names on them pinned to their home town on the maps painted on the walls. 

I definitely won't forget they are there and will be stopping by for another slice or two.",Yg08tRMxm0eaL-rXyNIAHw,3,0,4,l7_dZxesjFZaMnXdQUUAyg
5905658,2011-09-21,0,jgtEoeE2uoA27J_UvbE20g,"I gotta say the pizza was pretty good... really greasy, the crust was just perfect and yummy

The wings were meh and took forever both times we ordered them. First time we waited about 25 mins for them to come out... when we went to ask they said 15 more seconds... which turned out to be 5 more mins... which i wouldn't mind... the ranch was kinda runny, and the fries soggy so minus a star for that.

What I really really didnt like was the  cashier, he was very rude! Both times, he was short with all the clients walking in... I'm sure he is used to it getting busy since its located in down town but yelling at everyone that there is only cheese and pepperoni slices without waiting for them to even ORDER PIZZA kinda ticked me off... Another minus star for that.

Overall if I'm in downtown I will definitely go back for the pizza!",tL3iZDuWKXP6wh4IOrw62w,0,0,3,QR4E3Fc8RF4ftWMEcKqzXg
5963251,2012-04-04,0,jgtEoeE2uoA27J_UvbE20g,Best new york style pizza dt!,B1eP4dbuvJCfGbnypMZ4VQ,1,0,4,_Lq-uAQKef3eKcDKVnMrnw
