,date,funny,business_id,text,user_id,useful,cool,stars,review_id
5852228,2016-09-07,0,jJ2ca6wqp_YwTsdAWzplkQ,"Great place!

We stumbled upon this place by accident and I'm glad I did. I'm a total newbie so after staring at the menu struggling with my choice, I found asking the staff what are the favs the best way to go. I got the #1 with seaweed wrap and the # 8 with soy wrap. If you seek the sushi experience go with the seaweed. The size of the burrito was nice too.

I enjoyed the flavors a lot. I really liked the boat they provide to customize my wasabi and soy sauce dip. Also the little ginger packet was a nice touch. The water station is a blessing. 

The rewards program they offer is good too. I don't see myself spending this much on weeknight dinners a lot so any little bit helps. I'd go back, the rewards help out. 

Try it. = )",uv9VIYijUSjQHgVvC5wj4w,0,0,5,OL9A76T5-EG0S5o5CWv7sA
5922564,2017-04-13,0,jJ2ca6wqp_YwTsdAWzplkQ,"Probably one of the best sushi burrito places I've been in town! I have a gluten allergy and they were extremely helpful with telling me what I can and cannot have. Love their set up and especially love that they have all the fish and condiments refrigerated rather than on ice. Clean storefront, and quality service!",Ri3exmOUQLb1_RFvnmto6w,0,0,5,M6iq8vIXzPrhSuVYjyMkfg
5923742,2017-10-01,0,jJ2ca6wqp_YwTsdAWzplkQ,"This is my go to spot for lunch at least once a week. I have never had any complaints till recently over the past couple months I've noticed big changes from them taking down the tint off the windows to putting up these horrible tacky curtains the new manager has done something to the ambiance there that I just can't get over changes in ppl there and they way she talk to her coworkers and her short responses to ppl, food is still amazing but even that has changed also in just they way it's made. Andrew and Steve if u r out there it's not the same with out you there you guys were amazing and really made that place!!!!",BCyoZAU2QcRsc7TWSjsAyA,0,0,3,H0UV37fTxSNF9zk3V8hl2w
5928796,2016-10-31,1,jJ2ca6wqp_YwTsdAWzplkQ,"I've been seeing all these sushi burrito places popping up around town, but never had any interest in trying it out, until recently. One night the husband and I were eating dinner at Zen Curry Express next door. I love that place, but was unhappy that they were out of brown rice that night. As we were leaving, we saw Ted's Sushi Burrito next door and browsed their menu outside. We looked at each other and said ""We should have just ate here!"" 

So we came back the next night to try this place out. Sushi burritos are basically bigger sushi rice rolls packed with protein and veggies, which sort of look like burritos. The employees here were friendly and made good recommendations after finding out that it was our first time here. You can either create your own burrito, bowl or bento box, or you can choose one of Ted's Favorites, which are also customizable and great for me since I don't like things like onions and radish. I got the #8 - Ted's California as a burrito. Had all of their suggested toppings, except for the radish and added Yum Yum sauce as suggested by one of the employees. I know California rolls are everywhere, but this sushi burrito was very tasty and filling. I think the sauces made the whole thing delicious as well! My husband tried the #1 Sashimi Oishi and the #4 Chicken Karaage and enjoyed both. Okay, so it's not as awesome as getting sushi at an authentic Japanese restaurant, but this is a great alternative when you can't spend so much for great sushi all the time. The ingredients are fresh and they don't make the food until you order it. 

Will definitely be returning in the future. One of the things I really miss from back home in Hawaii is take out sushi places. This is a great option for dinner or for taking lunch to work. They also have a reward program through the FiveStars app - punch in your phone # as you are paying, and you get one point for every dollar spent here. You can later redeem your points for stuff like free seaweed salad, can of soda and 20% off your order. Give this place a try, they are the same owners as Zen Curry!",FOoN3DJzDUnl4EAQaTJIGg,3,3,5,f3QcxutYJBb6yr4D6YT46A
5996338,2017-06-13,0,jJ2ca6wqp_YwTsdAWzplkQ,"I came here today to see if this place would be better than any other sushi burrito places around town. When I first entered I was greeted by the workers and asked if it was my first time. I told the guy who was helping me it was my first time. I think his name was Steve. 

He explained their menu to me very well and told me that the burritos wee the most popular. He gave me recommendations which I did consider and went with a few things he recommended. 

I did go for a burrito instead of a bowl or Bento box. I chose soy paper and choose salmon and ahi tuna as my protein. He suggested to go with a wasabi poke sauce and garlic ponzu. I also went with his suggestion on the veggies of cucumbers, green onions, cilantro, and added sweet egg (tamago). I didn't see other options such as crunchy wonton chips so decided on just those to fill the burrito. 

My total came out to $10 and I tipped him for all of his suggestions. The burrito was not anything special and a bit on the higher price point for me since I'm used to going to other places and getting way more options to choose from to add into my burrito or other options of burrito choices. The cucumber was cut thicker than I like so it felt like I was biting into a big piece of carrot every time I took a bite of the burrito. I couldn't taste the wasabi ponzu that much so it wasn't spicy for me and I added soysauce to it while I ate it. 

Overall, the burrito was okay , but maybe in the future I'll come back to try one of their bowls or Bento boxes",P0rGN5mDue55uIiAzkrRlw,2,1,3,jwy8jh1ngf4bwMrDxRTGeA
