,date,funny,business_id,text,user_id,useful,cool,stars,review_id
47748,2013-10-05,0,jnroKk9qi0FR2bFSkxYZNg,One of my fav mini hot pot place in Las Vegas chinatown. always stop by whenever have a chance. Tried most off the soups and they are good and comes with a healthy bowl of brown rice. Dinner time need to come early otherwise when full gotta wait outside.,7nEVBkkRZaDnQgWr8r04Cw,0,0,4,QEqMW_HIn-N3cusfRFZWaA
203821,2012-07-29,0,jnroKk9qi0FR2bFSkxYZNg,"This place is great! I had the beef hot pot. The meat was tender with no fat or gristle. Good veggies in the broth. Very tasty.

A little different than traditional Hot Pot. Each person gets their own Mini Pot (hence the name) and the ingredients are already cooked and in the broth when the server brings them to the table. A bonus is you can easily eat the left over broth as a soup!

You can order about 30 extra ingredients to go into your pot, but the basic pot order was filling by itself.

I hope that hot pot Chinese catches on more in the states. Yum!",uY8jZKBwtLuUG6-EQbCfOg,0,0,5,u-h8lkzS1nPsTv9TWCzJ5g
218156,2012-07-22,0,jnroKk9qi0FR2bFSkxYZNg,"This by far is the best authentic northern hot pot I ever had in Vegas. The value was great, getting so much food for around $10. Lamb skewers brings back memories when I was in China.

Service was very friendly and attentive. My water glass never got to empty even though the poor waitress had to refill it 10 times. :).

If you are in Vegas, you have to make this a must try.",QvsRBiNAYGkwnsHXvpodCA,0,1,5,MCax2zRbw86slbBe3IiQyw
230806,2015-01-02,0,jnroKk9qi0FR2bFSkxYZNg,The service is too slow and the hotpot is regular. Maybe other dish will be better. A little disappointed.,siJc6dwUMOsh1OeHlei7lw,0,0,2,XYHKCzUuxNCugcj1r9SZ5g
267322,2015-01-08,0,jnroKk9qi0FR2bFSkxYZNg,This place offers a really unique type of flavor for hot pot. My favorite is still seafood and be sure to utilize the sauce they have available at the back. And the customer service is always excellent.,SNY7L2PaSLV1U7n9S2Q87w,0,0,5,z5F8feYTOA5ECpYO5axCXA
304200,2016-01-08,0,jnroKk9qi0FR2bFSkxYZNg,"Amazing food , great service. Couldn't find a good spot to eat because in Las Vegas everything is so packed. Truly is a hidden gem",04Kxw1hHIC8XrKoU6NYkVQ,0,0,5,H6w14vNApVp5fqgAgh0X8w
356227,2015-11-08,0,jnroKk9qi0FR2bFSkxYZNg,"Only stars for the food, its just the best beef noodle soup ive had in my life. Service aint really matter since they only have one staff and shes the owner of the restaurant i assume. Shes nice but once there comes lots of ppl she wont be able to cover up all of the customers, and i think its understandable tho.
So just a reminder if you looking for a really great service you are gonna be disappointed. But the food here, i mean i am from Taiwan, beef noodle soup never is my favorite food back in my country, i was craving some hometown food then my bf found this restaurant. The first bite of it just no words can describe it! The meat are soft but not chewy, thats exactly what i like, the handmade slice noodle with the soup that tastes really cost lots of time to cook it. 
I would sayyy this beef noodle soup is better than dingtaifeng(im not a fan of it, its just a famous international chain taiwanese restaurant)
It tastes exactly like taiwan! 
And i love ittt! Been traveling around LA and vegas, had so many taiwanese food..this booming pot restaurant is the one!",ncgsleYrRq5_90lt6Spx4Q,2,0,5,xEQJzE83V5AUQiwuZBczCg
374242,2015-05-14,7,jnroKk9qi0FR2bFSkxYZNg,"I think this place is a joke. We ordered 3 different kinds of mini hot pot were thinking that we could share. We ordered pork bone, tomato & veggie and chicken hot pots. When they came on the table, they are almost the same. The only different were one has 2 pieces of pork bones, one has a few wedges of tomato and one has nothing...Beef and beef tongue skewers were way too dry and not worth the price. Nothing special with the dumplings.

My girlfriends and I said we will never go back again...",v1KY9k-a8Bfxz9szI1be_Q,10,5,1,7puMy2nnxpl5juj0dvtZ_w
396658,2012-05-01,0,jnroKk9qi0FR2bFSkxYZNg,"Best hot pot in Las Vegas!! Very good value. I would recommend it to couples, friends and family gathering. Cozy and warm dining environment. I prefer mini pot to traditional big pots. The guests can have different soup base and it is more hygiene. Lamb pot is my favourite, $9.9 for a big portion of lamb, pig's blood, tofu and veggies, etc. My friends love the cage-free chicken pot, better order it with no spicy soup as the pure chicken soup taste really delicious! You can create you own dipping source to go with your hot pot from the source bar. Every time I will get a little bit of everything and mix them together. I like the house-made bean paste and the sesame source. You should try them and I'm pretty sure you will like them too!

Grilled lamb skewer is a must try! Tried lamb skewers in other restaurants, not as good as the one I found here. Booming Spot offers the best in LV for sure. The owner is an undergrad from UNLV. He told me that there are more new dishes coming out later such as cold pot and many cold appetisers for summer season. I'm looking forward to try the new stuff! Will definitely come back again! :)",VlTOuxug1QYwQ6SmYYzhaA,1,0,5,85itxOfvkTuANnaqJZQA8w
397819,2015-11-03,0,jnroKk9qi0FR2bFSkxYZNg,We were hungry and searching for an Asian restaurant. Then we saw this Chinese restaurant in Yalp and also an ad in a Chinese newspaper. Therefore we decided to check it out. We like it! The food is good and the owner and his wife are very friendly and nice. The price is fair. We will for sure to visit again next time when we are in town.,Dr4JmbqWN_029xiinQ6JPw,0,0,5,Js5enIh472JCRHAxFAof1Q
452839,2015-05-24,0,jnroKk9qi0FR2bFSkxYZNg,"Best kept secret in town. The Booming pot has new owners. They make you feel right at home. The food is excellent , the Beef Noodle soup , Marked Pork Wonton Soup and the Box Leek fried vermicelli dumpling is my absolute favorite. I eat Chinese food all the time and I recommend this place to anyone who wants great authentic Chinese food.",c1odn0tPrHOHCwRoZf9m5Q,1,0,5,MsFOWLbh8cb_OvJ-bLtDkg
589298,2015-01-14,0,jnroKk9qi0FR2bFSkxYZNg,It's good for cold weather. The food is good. I had a lamb hotpot which was my favorite. The service is kinda slow a little bit.,0aae7ZQeYD2z3kIP8t4YrQ,0,0,3,_qA6hYptFRzw5ZoOOqntYQ
593975,2016-04-07,0,jnroKk9qi0FR2bFSkxYZNg,"I found this restaurant on yelp after being turned away from another restaurant. Found this little hole in the wall restaurant, that looked good. ordered the beef noodle soup, and i must say its the best taiwanese beef noodle soup i've had outside taiwan! I also had the hot oil dumplings that were very good.  If your craving taiwanese beef noodle soup give this place a try!",i2kIXMzNSZROx47yIM04aA,0,0,5,NbYEQwMOOAdkfdwXtHm0kA
633343,2012-05-24,0,jnroKk9qi0FR2bFSkxYZNg,"I been here a few times already and enjoy the food each time. I love the beef hot pot that they offer and I get it with a 3star spicy level. It's not too hot for me because I love spicy food. For those people that doesn't eat spicy food, probably just go with 1-star and get the spicy sauce on the side and adjust it to your liking. Back to the food. I always get the beef pot and it comes with all your usual ingredients, beef, mushrooms, napa cabbage, tofu, etc. it's very yummy and the soup broth is excellent. I can drink the whole thing and I usually do. I've also try other pots when I bring friends or my wife with me and each one is good also, each with its unique ingredients and taste. Very yummy. They offer around 11- different hot pot combinations so do yourself a favor and come try it. You won't be disappointed.",7vtqdgiiBge1UmhjgjFsqQ,0,0,5,iT_1Y5K6wn3_dJZhitAVlQ
648820,2012-05-05,0,jnroKk9qi0FR2bFSkxYZNg,"Absolutely love this place!!!
After eating on the strip for 2 days, food got a little mundane... so my friends and I decided to give this new mini hot pot place a try in Chinatown. Lets just say that everything we got was absolutely delicious. The hot pot portions are HUGE for what you pay for. (average around $10 per pot)

1) Chinese yogurt
      MUST try if you have no idea what this is and if you do, MUST get it!
2) Lamb and beef skewers
      very authentic! Taste just like the ones you find in China's night markets.
3) Hot pots
     So many different flavors... Luckily I went with 7 other people and got to try a lot of different ones. I have to say my favorite one is the cage free chicken broth with chinese herbal medicine. You do not taste the medicine part at all and the broth is soooooo authentic. The individual flavored pots came with A LOT of stuff inside. We thought the cost was just for the broth and we had to order other stuff separately to cook in the pots...boy I was wrong. The flavored pots you order come with a little bit of everything they sell separately so there really isn't a need for you to order more side dishes in addition to what comes with your pots already. 

Though the tendon soup pot is very delicious, I think they should add some meat inside and less tendons. 

It was a great experience overall! Everyone should stop by and try it!",WDQdukv-2sRPtEEEXXSM1g,5,0,5,_b8Z4ijY19e5sm3rc2M2Kw
700279,2012-10-09,0,jnroKk9qi0FR2bFSkxYZNg,"Booming Spot Mini Pot was okay,.  There was nothing special nor was there anything horrible.  I went with two other friends.  We ordered the lamb hot pot and the beef hot pot which were each 9.99 and one order of each skewer- beef, beef tongue, and lamb.  The prices ranged from $5 - $6, and came with three skewers There were meat and vegetables in the hot pot and mushrooms.  For the price, there was not enough meat.  The skewers were pretty tasty, though.  I really like lamb and beef tongue.  It was nice and chewy and the flavor was delicious.  

The server was really good. He was attentive to our needs, and he explained the menu really well.  He explained popular soup items as the different skewers and other items.  5 stars for the service, but the food was just so so.",yP9UmCxs1PSqljLfpR9R5g,0,0,4,AmHxPLyDMvRm0aqF2GKUzQ
711122,2014-03-31,0,jnroKk9qi0FR2bFSkxYZNg,"Wow. I'm so impressed. Service was great. Informative and patient. As you all know that is HUGE for an Asian restaurant. We had 5 different pots and all were really good. The pig feet pot was so tasty and the pigs feet were stewed perfectly. All three grilled skewers were also yummy. Last but not least- I have eaten fish balls my whole life- but none like these! Soft, fluffy, full of flavor. Must try.",B45XwSvLapLR-hB2__sPaw,2,0,5,gpXrH_K8KycI3GmOMveqfQ
746029,2012-05-20,0,jnroKk9qi0FR2bFSkxYZNg,Delicious hot pot in an unassuming location. We had the chicken/mushroom and pork bone/potato with a side of lamb skewers. The soups were great and the lamb skewers were even better. Will gladly go again soon.,1sHS6kRtBYfuvdZCG0ULQA,0,0,4,YUN9IVCLOchxGvc89XdDPg
840331,2013-11-25,5,jnroKk9qi0FR2bFSkxYZNg,"Rudest people!!!!!
 
I called to place an order so i can pick it up. The lady on the phone started screaming at me saying that it is a chinesse restaurant and they don't deliver. She hangs up before i can even say i wan't it to pick up not for delivery",nG-aOt03VdE_dmJMqVYkhA,2,1,1,DLFPO5XZaTFMd240B43GyQ
910823,2013-03-21,0,jnroKk9qi0FR2bFSkxYZNg,"Definitely a hidden gem!  Tasty , easily customizable food.",NzPU4fkC3sEXztOogNDHpg,0,0,4,ZMMU5ZJi9klhQ68rEjk_iA
915151,2012-11-04,0,jnroKk9qi0FR2bFSkxYZNg,"My girlfriend and I visited this place a week ago, and the experience was yelp worthy.  When we showed up we were greeted by a very nice young man.  And he proceeded to explain that their hot pots were just a little different.  He was very helpful.  He even took us over to the dipping sauce station and told us his favorite combo of sauces.  The hot pots were amazing.  Unlike some hot pots, everything in the pot was edible.  And our server also mentioned a house brew iced tea, and it was pretty good itself.

I would suggest this place to anyone who is looking to branch out and try hot pot.  You can't go wrong.",BdRi4hquvHsTE_yZxchGtg,3,2,5,5Wu8qTswzsxXHQwzqSWmyQ
919695,2013-02-27,0,jnroKk9qi0FR2bFSkxYZNg,"It took coming to this place to finally write a review for yelp. I've yet to really find a place that really amazed me enough to write a review until I came here. 

Talk about your hole in the wall establishment, this place is in some random corner that you'd never pay attention to. It's really small, but the setting is really nice. I liked the small setting, it made the meal much more intimate. The server was really informative. First thing he did was show us pictures on a tablet. He explained how the broth was made and made it a point to say there was no MSG at all. Once we were finished ordering, he showed us how to make our own sauces to dip our food in. 

I've had plenty of hot pots, but this hot pot here has the BEST broth I have ever tasted. I ordered the lamb pot and the broth was so flavorful and fresh. You can order plenty of sides so you can add additional things to your pot. I ordered a side of noodles and it was perfect. The broth made the noodles taste perfect. The only small complaint I would have is that my pot didn't have so much meat, but the broth was so amazing, that I really only focused on the soup anyways. You could order a side of additional meat as well so my tiny complaint can be solved. 

If you ever want to have the best broth of your life, come here, trust me. It ended my yelp review virginity. It was that amazing.",H1vdRvlmdGRwNgkBpX-g0A,4,0,5,TOiUytPnYqpaqgwlxwXWig
925490,2015-04-21,0,jnroKk9qi0FR2bFSkxYZNg,"After this place went thru new ownership.. It's even BETTER!  Plus they have more variety than just hot pot now. They have noodles, dumplings, and noodle soups! Knife Shaven noodles that are freshly made too.. Not the frozen or packaged kind w all the preservatives and whatnot. The management is a lot more friendly and nicer than the ones before and they're not petty about stuff.. Like if u wanted a little more rice.  Obv don't go overboard and get multiple bowls of rice and expect the price of one but hopefully u get what I'm saying about them not being petty like the previous owner young guy.  Anyway I always get the knife shaven beef noodle soup and leek dumplings all to myself OM NOM NOM NOM!  Enjoy!",kli4pFv0HPieztzbW2v3Ew,1,0,5,DRD9DMp_9Z3qYGNNqC5m0w
1001240,2012-08-14,2,jnroKk9qi0FR2bFSkxYZNg,We went in and since one of us was rather full so we decided to order only 1 mini pot with 2 bowls of rice and some beef skewers. When its time to pay we realised that we were charged 2 bowls of rice instead of 1 since 1 rice always comes free with a mini pot. What a ripped off!,N8Cz3CuM5jNu3rouocyLiA,2,1,1,ndPVwirckZlxdtSwyxda_g
1002922,2015-12-07,0,jnroKk9qi0FR2bFSkxYZNg,"?????????????????very good
????????????????
???????????????????????",T0syxWVxWOuuW3AyFKJ2Kw,0,0,5,Zc9tCuj8kGbDxtkYQf9uiA
1020972,2013-02-10,0,jnroKk9qi0FR2bFSkxYZNg,"Lots of goodies in one little pot. I got the beef mini hot pot and items inside besides the thinly sliced beef included veggies, tofu, pork blood cubes (super yummy as i took everyone else's at my table), different types of mushrooms, and bean curd. The sauce station is a lot of fun and I really enjoyed the home made sesame paste sauce. They also make their own chili sauce too. The beef tongue skewers were tasty, but the seasoning on top gave them a curry taste, would have been better just plain with a little salt and pepper. Sometimes items are good enough to stand on their own.",tQVTyovdm4doXxDSkfYUUw,1,1,5,ZH1Nd40XIwF7nuVjcSZRbw
1022652,2013-11-15,0,jnroKk9qi0FR2bFSkxYZNg,"After moving here from San Diego, home to the infamous Little Sheep Mongolian hot pot, I went searching for a similar location in Las Vegas and found this little family-owned restaurant. Although it isn't like traditional hot pot, where you are given a boiling bowl of broth and raw meat to cook it in, Booming already cooks everything for you and brings out your order on a mini broiler. 

I ordered the cage-free chicken soup and lamb skewers. Their broth had just the right blend of spices to make a deliciously savory soup ..I can already envision coming here when I need a quick hangover fix and plain old pho just doesn't cut it for me anymore! 
The lamb skewers were coated in a layer of spices which made it a bit messy to eat bit they were delicious! I could taste the heat from the cumin and combined with the spices from the chicken broth, it felt like an explosion of flavor in my mouth!

The only downfall to Booming is that we didn't get to cook our own meat - it took away the entire experience of hot pot! However, I will definitely come back here again for the broth!",xOCTfCwrxTECbGOX6uD_KA,2,0,4,eVYfZCHZ3j14lsmrRtZeYQ
1066005,2015-07-20,0,jnroKk9qi0FR2bFSkxYZNg,Very delicious beef noodle soup! A must-try! It's a very cozy restaurant. The staff are super friendly.,NcFRXsA7cbfPDF7SVloUxA,1,0,5,T6BkV8j9ti9JDVOgRBeK8g
1100155,2012-09-19,2,jnroKk9qi0FR2bFSkxYZNg,"This is another reminder to not trust Yelp reviews when the numbers are just in the dozens.  This place retained the decor of the old HK cafe it replaced.  Imitated the menu of now popular small pot places in LA.  But that's where the similarity stops.  It is clear the recipes are haphazardly put together.  The condiment counter was essentially emptied of the fresh ingredients, and the little that remained were wilted, and this was during lunch.  So we are looking at leftovers from the day before.

The meats, which we had the displeasure to sample, were tough, precooked but not seasoned and the worst crime was they were not the customary cuts customers of hot pot, shabu, have come to expect.  Lamb was more like Mutton leg meat, most likely conveniently same as used in the skewers, cut lengthwise along the fiber, and merely dropped into the luke warm soup giving it no taste and impossible to chew.

If you are expecting a shabu or small pot experience, do not come here. This is not one of those places owned and operated by people who have pride in their food.  If you are a friend of the owner who has helped contributed to the 4.5 stars, please at least be honest to him that their food needs drastic improvement.  Why have so many selections when you can't even have the basics right?",dEr94Zwb65HqUI114uMgng,5,3,1,NNKbyBq1Wy3l2grfZD6WNQ
1167589,2013-12-03,0,jnroKk9qi0FR2bFSkxYZNg,"When I visit Vegas, I usually eat at China town instead of fancy restaurants on the strip. Saw this place a few month ago, and I decided to give it a try since it was so cold. 
There was only one lady serving tables. She was friendly but really really loud. I didn't like to hear her shouting while I was eating. 
I ordered the beef tendon and daikon pot. The soup just tasted like standard beef noodle soup, nothing special. There were not much ingredients in the pot, only tendons, daikon, cabbage, tofu and mushroom. For the price $12.99 , I expected more kinds of ingredients like fish cakes. 
I also tried some of my friends hot pots, fish head pot and chicken herb pot. For chicken pot I was expecting clear chicken broth, but it was not. I guess all of their soups are on the stronger heavier side, which I don't mind if im in the mood. But its just not special at all! 
Also, they only let you add soup once. They will charge you from the second time. And the lady only added about a tea cup amount of soup when I asked. Wouldn't recommend to people who like to eat a lot of soup. 

Wont be coming back.",9QnieVGV7-oW0nc6cX4JgQ,1,1,2,-IuBcX9x7TyPgX-QixGUQw
1175465,2012-12-31,0,jnroKk9qi0FR2bFSkxYZNg,"Wow! This place is really good... I ordered the seafood hotpot, it comes with purple rice which is healthy, the seafood is fresh and the number 4 spice is just right. I love their sauce bar. They have homemade sesame sauce. I found out about this place from another yelper. It is very romantic to eat hot pot, take a lover to this place, highly recommended.",OQqBdDPBXYXQY0qRL20Dew,0,0,5,JiRamAnKksx1NNUUGqExvQ
1232557,2014-10-10,0,jnroKk9qi0FR2bFSkxYZNg,"Love this spot. The food is authentic and really good. You can make the dipping sauce yourself, so you can change it up if you like. Plus, they have fresh squeezed juices as well. I usually stop by here once every other Vegas trip, it's definitely one of my go to spots out there. There are so many restaurants to choose from in Chinatown but there is no other place like this one!",W7Zr7qPnsQY3Q6djf_WyYw,1,0,5,PauBg15NBaxuNP5avFz86w
1257227,2012-11-01,0,jnroKk9qi0FR2bFSkxYZNg,This place is the BOMB!!!!  Service was excellent!  Our host showed us everything on how the hot pot works to mixing the sauces and providing his recommendation on his favorite sauce mixs.  Everything in the hot pot was edigible and the soup broth was sooo good!  I know this will be my favorite place now to go for hot pot!  And the price was reasonable!  For two hot pot w/ two ice tea was $25.00!  I would highly suggest this place before going to Gold Coast Casino for Noodle House.,FAjCZoxiGw9HJKueB8YWTg,2,1,5,ACoHQV4rXyRrXMdpnMUr3g
1262272,2015-11-05,0,jnroKk9qi0FR2bFSkxYZNg,"First time here, got the spicy seafood hot pot and it tasted so good! The soup base is perfect and keep you warm for a cold weather in Vegas! Also, my fiance ordered the lamb and beef cabobs and he enjoyed it! This place is a hole in the wall but don't judge a book by its cover. Most definitely, coming back here again!",J7P31q2MaN3dqcyJur9fdQ,0,0,5,G9rLEHrQC9cQ90CGDFdujQ
1350103,2013-10-30,0,jnroKk9qi0FR2bFSkxYZNg,"Booming Spot Mini Pot specializes in Chinese hot pot - a flame-lit pot of broth that you throw veggies and meat into, then fish them out with your chop sticks. It is a great and simple healthy meal. You can also add some spice and flavor by whipping up some dipping sauces. BSMP is a small hole-in-the-wall joint. The place is clean and the service is friendly. All they need to do is get that beer and wine license back in order!",JqfQCJlKeiALcL3v0bYjAw,0,0,4,99OqyONL-adihcahXpvqDg
1380649,2012-10-19,1,jnroKk9qi0FR2bFSkxYZNg,"Located on the northeast corner of Spring Mountain and Decatur ""behind the Church's chicken. 

Small, restaurant with a few booth tables lining the restaurant and a decent sized round table. 

Since cold weather is swinging around, decided to finally get to try this place. (If i recall correctly, this place opened before summer so it was kind of hot). 

Staff is friendly but their ability to speak english is kind of limited. The owner, Qi, was a student from UNLV. English is pretty good and very friendly. 

Their style of hot pots are individual sized, pre-made by kitchen pots rather than the big pot in the middle of the table and people get and throw everything in. 

Each ""pot"" is priced around 10 - 12 dollars. Fairly reasonable. Pots range from beef, lamb, free-range chicken, etc. Other than the free-range chicken, there is also a spice level you get to choose from.  1 being normal to 5 being very spicy. My friend got a 2, and i tried it. Wasn't that spicy but i eat pretty spicy so dont take my word for the spice level. 

Aside from the hot pot itself, there is a pretty decent sized list of extras you can add (meats, veggies, etc) as well as some skewers they make. The extra meat is around $3-4 dollars each. Veggies is mostly around $1 each. But the original hot pot comes with quite the amount. 

Aside from the hot pot, whats hot pot without dipping sauces. They have a station in the back of various homemade sauces like peanut sauce, garlic sauce, bbq sauce, and chili sauce, as well as cut cilanto and onions i believe. What was surprising was their chili sauce was actually pretty spicy but good. 

This visit, i had gotten their free-range chicken hot pot with no extra add on's. Meat amount wise, maybe a little less than you'd expect but its fresh, free-range chicken available locally. The chicken meat was indeed, good. Chewy and flavorful like you'd expect from a fresh, free-range chicken. The soup base they used was pretty good, using various chinese herbs and ingredients. Other than chicken, the hot pot also had tomatoes, lettuce, various mushrooms, black fungus (cloud ear fungus.. edible.. not a bad thing LOL), soy bean curd, etc. 

Overall the experience was pretty good. The staff keeps an eye on your water cup, so most of the time, you will have a full cup (+1 from me ! haha). Good place to eat at when the weather gets colder, and you want something to warm up in terms of food besides pho or a hot beverage. Good place to go ! best hot pot place in town so far !",Ksp1e9Dw0Jcog_ZBD3-45g,2,1,4,eVy13qhLxRVR-z5YqI_Vvg
1434647,2013-03-20,1,jnroKk9qi0FR2bFSkxYZNg,"Thanks to yelp for helping us find this gem, which is hidden in a tiny strip mall off Decatur.

Wanting a relief from the Vegas buffets, my friends and I decided to give this place a shot. It's a Chinese style nabe, where you pick a flavor of hot pot and they heat it up at the table for you. Each person gets there own hot pot, I had the lamb.

Also, we ordered the lamb and beef tongue skewers and based on a recommendation form our server, the jelly(fish) salad. The skewers reminded of what you can find at the night markets in Beijing, basically grilled meat on a stick w/spices. I preferred the lamb over the beef tongue, which was a little tough. The jelly fish salad was flavorful and delicious. It also had a slight kick to it, nice though.  

Service was awesome, the waiter joked around a lot with our party and was very attentive. He even refilled our Lemon Tea, which never happens at Chinese Restaurants. I guess we got lucky that night.",aaRaGrHfgYnG_Coznlzspw,2,2,4,9c4visyzx5SCJp9BZP0mkQ
