,date,funny,business_id,text,user_id,useful,cool,stars,review_id
2633974,2012-05-01,1,jnroKk9qi0FR2bFSkxYZNg,"With such high ratings but few reviews, my party and I were slightly hesitant to give this nascent restaurant a shot... but boy were we glad we did.

We had a large party of eight and the waitress was very accommodating and patient with our group, especially given how long it took for us to explain to first-time hot potters and how indecisive we all were.

Highlights -

Beijing Yogurt - my mainland Chinese friends just went gaga over this childhood favorite and were so pleasantly surprised to find the treat stateside! 
My drink - Fresh coconut juice out of a coconut is ALWAYS delicious.
Skewers - pleasantly seasoned, not overpowering and very well cooked and high  quality juicy meat. flavor as expected, five spice, cumin, light dusting of chili powder. 

POTS - okay, for the price ($10-12) you get WAY more than you pay for!! Something similar in Los Angeles would probably cost 30% more!! NONE of us actually finished our entire pots. This is pretty impressive. There was no skimping of meat in each of our pots. The herbal chicken was very well received. I had the fish and tofu, it was extremely delicious and satisfying.

As a native of Sichuan, I am used to my hot pots extremely hot and spicy. The fact that I had a no-spice pot and was so pleased with just the aromas of the soup's ingredients alone really says a lot about how tasty and well composed the flavors of Booming Spot's Mini Pots are.

Our group wrapped up the meal trying our best to eat every morsel of our delicious food  but ultimately failing; dragging our feet and hanging our heads weighed down by the heavy contentment of a spectacular food coma.

It was a fantastic meal.",HTbyKdm-2epw1xbhKs2kug,2,2,5,0jCtShi_bQH4ZOqRRPDvxA
2639043,2015-08-09,0,jnroKk9qi0FR2bFSkxYZNg,"My husband is Taiwanese, so we decided to give a try, cause the stinky hot pot is so popular in Taiwan. We ordered the stinky hot pot, spicy beef hot pot , pot sticker , BBQ beef tongue and the spicy jelly noodle. The spicy beef hot pot is ok, I'm not a big fine of that, others are so good! And the server (owner?) is so nice. I like this place, I will be back try the noodles!",b8U_9wQW9Hablld7tA-VyA,0,0,5,2CYLX20-MxI22OW73eMLrg
2681440,2013-02-11,0,jnroKk9qi0FR2bFSkxYZNg,A hidden gem! We loved the beef and lamb broths. Both had so much flavor. Definitely coming back!,mxVT3BQWg5aSD09kiKPXuw,0,0,5,HZBV2bMTboImnlOcNvNtXg
2837580,2012-05-21,3,jnroKk9qi0FR2bFSkxYZNg,"WreckX'N Effect's Rump Shaker incorporated into a Yelp review?  Challenge accepted!

4 of us decided to check out this hole-in-the-wall that popped up on my yelp page recently (check baby check baby one two three four) and I was definitely intrigued since I love me some Chinese hot pot and can eat it irregardless of the weather outside.  We started out with some freshly blended juices (grape and pineapple) although I've read the beijing yogurt drink is also very good.  Appetizers include beef and lamb skewers, which appear to come in generous servings to be shared.  The menu has about 10 base pots that come loaded with all sorts of goodness in terms of veggies and meats ranging from traditional (beef, shrimp) to the slightly adventurous (lamb, fish head) and the outright adventurous (pig intestines).  There was also a healthy option (""cage-free chicken"" in a chinese medicinal herb broth) which seems to be one of their best-sellers and comes in limited orders based on the number of chickens available for that particular day.  There are options for several add-ons for 1-2 bucks more including several veggies and additional meats.  There are also seafood options including scallops, shrimp and stuffed fishballs (made of processed fish paste encasing some tasty fillings which were downright delicious, as opposed to stuffing actual fish balls, which sounds pretty ridiculous and would likely require the work of a microsurgeon)

Although the base pot has plenty of goodies included, one may want to request that they not include certain components since pig intestines and cubed pork blood-cake are interspersed in certain hotpots and these are not nice surprises if you're not expecting them.  Spice level can be selected on scale from 1 to 5 and I thought 3 was plenty spicy by asian standards without overpowering the ingredients.  For further flavor outbursts, I appreciated the condiments bar where one can mix their own custom dipping sauce using soy sauce, homemade sesame paste, chinese barbeque sauce (sa-cha), homemade garlic paste, ginger, chili sauce, along with green onions and cilantro.  

The hotpots are then brought out as individual cauldrons where one can regulate the flames using burner handles at the bottom, which I thought was a fun yet potentially litigious touch (best to leave it to the waitstaff since mine refused to shut off after a few attempts and some minor flames shooting outward).  Since the broth and dipping sauce can border on the salty side, one can request a side of rice (in their case, it was a cool purple variety) or noodles to be thrown into the hotpot.  Overall, I appreciated the intensity of the flavors and the waitstaff is definitely very friendly and enthusiastic to explain their menu options.  Prices are reasonable and you definitely won't go home hungry, although you may need to hop in the shower after the sweat buildup from the spice and heat. Definitely zoom-a-zoom zoom zoom to this boom-boom spot, and you will be shaking your rump in hot-pot nirvana.",syA7uYoDjohc7gWBWaEZmw,7,5,4,mBV0dhSakbHEew-tuu-rLQ
2873081,2013-11-10,0,jnroKk9qi0FR2bFSkxYZNg,You have to be  friend of the staff to get a table doesn't matter how long you have been waiting.  SVC is non existent,J-75bFW5regmjUs8Tltuow,0,0,1,nD0llOPwWcJs64XNeHUIWA
2924568,2015-12-29,0,jnroKk9qi0FR2bFSkxYZNg,"My family and I were staying on the Las Vegas Strip. We were tired of the mediocre (and not to mention expensive) food options on the Strip so we took a cab outside of the area to the Chinatown region to eat at Booming Pot Noodles.

This restaurant is really quaint (read: small) and their tables really don't comfortably fit more than four to five people. 

The staff were nice. They speak Chinese and the main waitress seems to speak English okay (not sure about the line cooks).

The food here is Taiwanese and pretty authentic. My Taiwanese parents approved and said the food reminded them of food they'd get back in Taiwan.

I got the braised pork over rice (lu rou fan). It was quite tasty, just the way I remembered. The portion size was large too, and they give you a good amount of meat and rice.

The spicy wontons were delicious. They give you about six in one serving. The oil and the wontons were married so nicely. I loved them!

The beef noodle soup was okay. I really like this dish in general but thought this one was lacking a little bit in flavor (despite looking very oily). I also thought the hand cut noodles didn't taste as good as the regular thin noodles.

The regular dumplings were also good too. My parents said they tasted Taiwanese. They went well with the soy sauce and vinegar combo that you can just make yourself.

I would come back again for yummy Taiwanese food.",taPq7IxYskEWH7Vfc261pQ,3,1,4,D1v85g_siX5BkRzBzYz2oQ
2973987,2015-06-26,0,jnroKk9qi0FR2bFSkxYZNg,"We headed here for some late night munching after finishing some shakes at shake shack. Our server was really friendly and recommended the lamb hot pot. The hot pots here are meant to be portions for individual people but since we were a bit full from the shakes we just split one and ordered extra fish balls and ramen on the side. There was a bunch of stuff inside the pot but we definitely needed the ramen as a side. Everything was surprisingly delicious and flavorful, especially the lamb meat. There was also a sauce bar, which our server made sure we knew about. We were stuffed by the end of the meal. I'd say that if you were hungry, one portion would be too much for one person but not enough for two, unless you're looking to grab dessert after. Glad we found this small shop tucked away in Chinatown. Food was great and service was unexpectedly good.",Fde33HEt0pjq35WsNv7RmQ,0,0,4,VEiZdeKYzaok0kGXXrBNoQ
3036176,2013-07-27,0,jnroKk9qi0FR2bFSkxYZNg,No where near 5 stars. So lame. NoodleS Exchange is way~ better!,BwkF9_GjzmH_nyqbb1NA_Q,0,0,1,EOgt39g3pBRSO-SwCgR5yA
3044915,2015-12-08,0,jnroKk9qi0FR2bFSkxYZNg,Food is good here but service is horrible. Ordered leek dumplings and beef noodle soup with the big noodles to go and our order was completely wrong! We got pork dumplings and the traditional noodles instead. The beef noodle soup was also supper fatty.,GNz6k_zhW-hQZSjkug6GlQ,0,0,2,ZoH-r0-nfpexutuKuZGUug
3050131,2014-11-10,3,jnroKk9qi0FR2bFSkxYZNg,"I don't know what is wrong with that Bonnie L who wrote a rhyming review just to be funny but it was stupid.
This place is a hidden gem it is real fresh and I imagine this is like getting a home cooked meal in China.  The lamb skewers were Soooooo good.  Dry wontons were amazing and the dumplings were great!! You cannot beat the bang for the buck here and everyone is super nice !!! Highly recommend you try this place out!",pxnfZEfejsAaPOuXxfW-XQ,8,1,5,7_yxE15clu9OAK9ZgCEPLw
3065597,2014-10-03,1,jnroKk9qi0FR2bFSkxYZNg,"Changed owner, warning:: it is not the same: they've invested some money and re modeled, they also added free wifi, but the seats are taped up? Hmmm...",-7bM_DeL2Kj2CuYuVDsLNg,1,1,3,i8UVBeAPrwl5h8PPmRkDFA
3135840,2014-12-01,0,jnroKk9qi0FR2bFSkxYZNg,"New owners for the worse.

Since being back with the new owners I realized what I loved so much about the old place. The old owners were amazing! They had great customer service. They checked up on my party multiple times during the visit. One time a friend of mine ordered a pot way too hot for him. The owner kept peeking in and checking till he finally admitted his mouth was on fire. They happily remade his pot for him. 

These new owners never checked on me once. They never came by to refill my water. They never asked how the dish was. I am pretty sure they screwed up the order because my dish had zero spice. My server walked by me more than a dozen times without acknowledging my existance. 

The pots are much smaller than before. pretty standard for hot pots in Las Vegas. The customer service disappeared completely. There are much better options.

Most of these reviews are for the OLD place with the FORMER owners. I wouldn't pay any attention unless it's been written in the last 2 months.",7pwQ1TrJPz1eTXnxjhAKHQ,1,0,2,4zmQDA1oPrkp9Ucn0VRl2A
3326853,2014-11-30,0,jnroKk9qi0FR2bFSkxYZNg,"Came we my family, ordered the salmon head hot pot, Lamb with lettuce hot pot, beef noodle soup, and taiwanese mince meat rice. All was delicious, the noodle in the beef noodle soup seems to be hand made which is rare to find. I especially loved the TAIWANESE MINCED MEAT RICE! Definitely the best I've had in Vegas so far, it was so goodI even ordered a second one to go. Would definitely come back just for that alone!",zJsBzFG_ayo8mNjZDHzOiA,2,0,5,CvpJ0QecmkftGU5BgXtPCA
3483460,2014-07-24,0,jnroKk9qi0FR2bFSkxYZNg,"Who would have thought to have hot pot in the middle of a hot summer evening.  We have relatives visiting from Canada and decided to try this place out.  There was only one other couple in the restaurant when we arrived for supper at 7 pm.  They serve individual servings of different meat base hot pots such as lamb, beef and seafood.  I had the chicken with mushroom and a side order of beef.  You can request the level of spiciness of the soup base.  You go to their sauce counter and mix your own dipping sauce and you are set.  The hot pot comes out to you all cooked with a variety of vegetables, bean curd and tofu.  The food wasn't bad but I think I would have enjoyed it a lot more in the winter time.  Oh I forgot to mention that we also had their homemade boiled dumplings. You get 12 pieces for only $5.  It was a good deal,  very fresh and tasty!!  Two thumbs up for their dumplings.",cImvLb3Wvd5EZ8SRjKAPsw,1,3,4,V-aMlhW5gAQ7EDI8xZ8FNQ
3494592,2013-04-01,0,jnroKk9qi0FR2bFSkxYZNg,"this place is so good.

i wish they had one of this in 626, i would def come back.

#1 and #2 is good!

theres a cold dish that looks like noodle jelly, that is delicous.",-mlppUMuA9ODwLMPW58jbQ,2,0,5,CxTuhWRPQl4qbxbED8zy0w
3524597,2015-10-31,10,jnroKk9qi0FR2bFSkxYZNg,"Went here last night for dinner and it was pretty good compared to the other hot pot place I went to a few days ago. It is located in a shady area and the outside doesn't look as inviting, but once you step inside it is relatively clean and well-lit. 

I ordered the beef mini hot pot which had a really flavorful broth (I've been to places where the and soup just tasted like water). The beef itself was tender, yummy, and not fatty at all. Some other ingredients in the pot included a fish ball, imitation crab pieces, corn, cabbage, and tofu. 

They also have sauces here, but you have to mix and make it yourself. Some ingredients included minced garlic, cilantro, green onion, bbq sauce, balsamic vinegar, rice vinegar, sesame oil, and soy sauce. I was kind of bummed because they didn't have pre-made ponzu sauce which is my favorite sauce to dip my meat in. I also didn't know how or if it was even possible to make so I just ended up going sauceless which wasn't as bad since the broth had enough flavor. 

The staff is nice, but they could be a bit more aware of the customers. I had to wait for a bit before someone came out to get me seated at a table and the place wasn't crowded at all. Also, I had to ask for rice since they just gave me the hotpot. I thought I had to pay extra for a bowl of rice, but they probably just forgot to give it to me. 

All in all I would recommend coming back here and I will visit again in the future if the opportunity presents itself. I would give this place 3.5 stars if I could, but decided to round down because I feel that most places around Vegas have slightly inflated reviews and I didn't want to contribute to that impression. If you happen to go to the same places as I do, I hope my reviews have been helpful!",29yBaTFMSh-l6wNwy9d_mA,11,11,3,muZk6O4t3lxhYneYD3EC4g
3541777,2012-07-07,3,jnroKk9qi0FR2bFSkxYZNg,"My task was to chose a place to have dinner on a Friday evening, and I chose Booming Spot Mini Pot after the high ratings on Yelp.

The waitress was definitely friendly and she sold us on their HK style milk tea ($2.99/each).  After looking through the the menu, we decided on the following:

-beef tongue skewers: methinknot.  I didn't like it.
-tendon and radish pot: tendons were not tender.  boo.
-pig's feet pot:  not tender either.  eek.
-side of pig's intestine:  pretty good in the broth.

Each pot does have a good amount of veggies (napa cabbage, mushrooms, etc.).  My bf didn't know that it came with veggies so he added a side of napa cabbages and enoki mushrooms ($.99 extra per).

The end of the meal, he gives it 2.5 stars, and I give it 3 stars.  Will we be returning?  Not sure...",5wT0vDycEzgq95yVCZ60Aw,5,4,3,OUf_OTj0M3bcf0t4kC02mA
3550522,2012-12-31,0,jnroKk9qi0FR2bFSkxYZNg,"For a Chinese restaurant,  the service was excellent.  The pork bone hot pot is excellent. I like that they had a good variety of stuff to add into the pots.  Really hits the spot when you're looking for Chinese soup.",AdfOx9qzUe3htq-02yscaw,0,0,4,qj8PSSED2q7h7Duq0qTNfQ
3667539,2012-12-26,0,jnroKk9qi0FR2bFSkxYZNg,"What a lucky find!

Came here with the little brother during our annual trip to Vegas visiting our families. 

I just had Boiling Point (from 626) earlier this week and was in a total hotpot mood still.

Upon coming to Booming Spot, I didn't really have high expectations. It' s a local spot, not too hyped up but had several good reviews.

Since it was freezing in Vegas,  Hot pot was the perfect meal.

The actual place is small quaint  and maybe have 4 booths and one large table. Immediately we were greeted by the young owner (who is super nice btw).

Their menu is simple and straight to the point. There are several different ""mini pots"" to chose from ranging from the standard beef, to kimchee, to free-range chicken, and radish and tendon.

Personally, I went with the Beef Mini Pot and my Lil Bro went with the Radish and Tendon.

The good:
-The broth was amazing. Let me explain this a tad bit, I'm one of those people that love love being able to taste the natural flavors from my food. Although i do enjoy heavy, flavor enhanced broths that mask the natural taste of the meat, veggies, and other substances sometimes, for the most part, I think food taste best when you can actually TASTE it. With that being said, the broth was perfectly seasoned and definitely not overbearing.
-The owner made sure that he went through the menu thoroughly with us before we made our choices. He explained whats in each dish, how he likes to eat it, the fact that NO MSG were used and that everything is fresh and made to order. Just little tidbits that amount to a lot.
-The personal hotpots were HUGE! It will definitely get you full even without rice or vermicelli (what boiling point does)
-No skimping on ingredients at all: for the beef pot there were think slices of beef, napa cabbage, imitation crab, tofu (firm), mushroom of some kind, tomato, and carrots i think.
-You can chose the range and amount of hotness to the tee
-They have a dipping sauce station that you can create your own special crazy amazing dipping sauce concoction. If you're unfamiliar, ask the owner for suggestions. 
-The water they serve already came pre ""seasoned"" with lemon :)

The bad:
-I really couldn't pinpoint anything bad about this location.. I guess the only difficulty would be seating if you come in with a large party...but they're really accommodating..so i'm sure they'll make it work. 

All in all, I must say I was super impressed. But i must warn you that if you're used to super bold flavors in your broth this might not be exactly the place for you. Like i said the broth enhances the natural flavors of each item..not mask it. So keep that in mind.

The portions are great and the price definitely more generous than what you would find at Boiling point and Jazz Cat in the 626.

Also, the most crucial thing, in my opinion, is the fact that the owner went above and beyond to make sure that our experience was excellent. He checked on us throughout our meal, made suggestions, asked for input, and was overall just very helpful and friendly. 

I would definitely return and try the other dishes!",iYeLvhAGiUgKeNkZV19_IQ,4,0,5,1J7ZZksCRWGU7ux4VzgnFQ
3786317,2016-02-19,0,jnroKk9qi0FR2bFSkxYZNg,"Omg, stay away, place looks so run down, taste not good.  i just wonder why it can still
survived",fePJSqMHv_BthkwwR_zqmg,0,0,1,lCq3NoLFyhtWCmD9XpDOVA
3862572,2012-06-26,3,jnroKk9qi0FR2bFSkxYZNg,"Finally!!! A review for this place is way over due!!!

The restaurant is small but cozy. The owner made us feel very welcomed. He spent a great amount of time checking on us and explaining everything. Very nice and sincerely. 

Beef tongue - Delicious, packed of spices, and spicy! I love it! The spices could be a little strong. It was a tad salty for me. Maybe it was better to eat with rice. 

Watermelon juice - Freshly made! Not sweet. 

Water - I asked for water and he gave me water with cucumber in it. Refreshing!!!!

I got the Potato and Pork Bone soup - It was soooo delicious. Full of flavors. I can tell the soup was cooked over time. no MSG could give the soup that rich and creamy flavor. The pot is huge for one person. As much as I tried, I couldn't finish it.

My friends got the Lamb soup and Kimchi soup. Both were good but mine was the best in all our opinion. 

Fish balls - you have to get the fish ball. The fish was chewy and there is something inside that is equally as delicious as the fish outside. 

I am from OC so this place leaves me craving for more. We told him to expand to OC so we can enjoy it more often. Till we meet again. Best luck to young owner!",-ycSxNIXm1IcfMbbTItRCA,5,4,5,u-dQEQloyFlueV-H9xTaeQ
3873102,2012-07-11,2,jnroKk9qi0FR2bFSkxYZNg,"ok, so I have had my fair share of hot pots in this town and this definitely ranks as one of the BEST... I had the lamb, I would def order extra meat cuz it's kinda light.  I tried the free range chicken, also very good.  Only thing I would do is maybe order the veggies seperate so they don't get too soggy, but good still nonetheless....
Tried the beef tongue BBQ skewer, very salty (need to lighten up on the seasoning) otherwise it would be tasty... I like the sauce bar, so you can make to your liking, all they need is the raw egg!  (dat's how they do it in Shanghai) I got the SPICY but could have gone 1 notch up.... I like it HOTT!  

Also had the watermelon juice....yummmmmmm, so kewl n refreshing but I would have loved to have a BEER to squash the heat..... 

Overall, you likey d hot pot?  Then you gotta likey this spot for hot pot cuz it's called booming mini hot pot spot but there's no dots on the walls... okay now I'm rambling..... 

check it out!

manja!!!!",erdvrYG2b-YkTfZljgrXIg,2,2,5,2TrJtoabnJBFyw6spAlJcg
3891459,2015-01-07,0,jnroKk9qi0FR2bFSkxYZNg,I love this place!! My wife and I come to this place often. Always order the beef mini pot with extra meat. The pork dumplings are freshly made and taste so good. I highly recommend this restaurant!! The prices are great too!!,eTmJ-Bg-yAUGDZ0JcPUDpA,1,0,5,hXu4D2SUIjdtUYhBcNGySw
3896793,2015-09-04,0,jnroKk9qi0FR2bFSkxYZNg,"Minched pork noodle  is the best. Beef noodle is also really good.  Pot stickers are my boy's favorite. 

Very friendly service. 

I would definitely come back again.",eRQVolZxna4DDOfEpGobVw,0,0,5,E_CMzYny6158_aT37CNPAA
3909762,2013-02-02,0,jnroKk9qi0FR2bFSkxYZNg,"Mini-pot like a shabu shabu thing. Big old soup, tons of stuff to put in there, some of which was exotic meat things like my friend wants. I'm checking the veggie offerings, and can put taro in my soup! He finds some free-range chicken (honest food in LV!) and supplements with fish balls? Something weird that he loved. 

The best part was their home made sauces that you choose and plunk into your soup.

Nay, the best part was how friendly the family was that worked there. They were the nicest people in the world, and were super happy we found their hole in the Asian, Ranch - 99 led mall.

Back to the soup. I put in a home made sesame paste, a ton of home made garlic in oil (that's how I roll: ""HHHHHow's the HHHHHot-tub, HHHHuh? HHHHHHeather?"")

I also use too much punct'ation, and make up contractions. Y'think? Heather?

They also had multiple home made chili sauces. I perked mine up, ate some taro, some great veggies, and this meal worked. 

Really probably 3.5 stars, but the service was beyond exceptional.",upmvpx1-gu8q7l9XpWdY5g,1,0,4,UYYRaQLzfTFSypqSdE5Zjg
3910261,2012-09-11,0,jnroKk9qi0FR2bFSkxYZNg,"Had the lamb pot, didn't taste like lamb, but with the vegetables and soup it was very delicious.  There is a condiment bar with is a must.  I'll be back, next time I'm in the Land of V.",0oFTMDlozZeYtyOgSbeNUA,0,0,4,sN7y7cl-9-KQWH6Pyjc-Rg
3937737,2015-03-06,0,jnroKk9qi0FR2bFSkxYZNg,"This place was soooo yummy! Just what I needed for a cold evening in Vegas. 

I asked for recommendations at the hotel I was staying at (always ask the locals) and they sent me to an all you can eat place for about $37/pp. My husband and I refused to pay that much so we yelped and found this place. We will definitely be coming back to this place when we visit.

Everything was hot and yummy!",bLckFWWRWZJqmzbMQ3MzLw,0,0,4,S4-y2CivSAMd0mPFkViTWA
3942270,2015-10-27,1,jnroKk9qi0FR2bFSkxYZNg,"Was craving something low carb so ended up here.

I ordered a beef and lamb skewer and a spicey Taiwanese hot pot.  The skewers were ok. Lots of cumin.  Meat was very tender.   The hot pot at a very flavorful broth.  The quality of the ingredients were ok while the portion was bigger than social house and the place at gold coast.   Social house however gives you s choice of carbs on the side.   At booming pot it costs extra.  The dipping sauces you get yourself.  They have have a limited selection but their is minced garlic!!!.

This is really a mom and pop shop. The couple is extremely friendly and decide service is great.  (I wonder if they had kids and if they do, why aren't they helping out their parents like i had to?  Damn ungrateful kids!!!)

Update went again and had the beef noodle soup with the knife cut noodles.  Really flavorful broth.  Very beefy. Knife cut was good but next time i will get the normal noodles to see there is a good elastic chew.   I also asked for a side of the pickled mustard green.  Added hot sauce, garlic,  and black vinegar (which i fondly call the Chinese people's vinegar) to the greens.... delicious! !!!!",r0tJtR8mIq8TVC3ZMD2rOA,1,1,4,-3H_de7l2lDbvuZtay82fQ
