,date,funny,business_id,text,user_id,useful,cool,stars,review_id
5051301,2012-07-29,0,jnroKk9qi0FR2bFSkxYZNg,Pretty decent!  I definitely think there are better soup places here in town but this place is pretty good.  I think I was a little turned off because my skewer was cold but the service is astounding!,eZHCEjr5iJ1iiTm_snGZHQ,0,0,4,273J5AWIichdFPX1LLdfyA
5075429,2012-07-24,6,jnroKk9qi0FR2bFSkxYZNg,"BOOMING SPOT TOTALLY HIT THAT SPOT!!!!!!!!!  for all you HOT POT lovers this is a must try!! ok i was totally bummed out with the all you can eat hot pot @ dragon house shutting down... So my friend and I decided to give booming spot a whirrl!.. and i must say I was so freaking happy  I tried it

I tried the beef hot pot.. You get your own mini pot all veggies are organic veggies and the broth is really good and i must say everything just tasted so good and fresh!

My friend she had the CAGE FREE chicken .. Can you beleive that?! what place has CAGE FREE chicken for a hot pot.. BE WARNED it is boney and not enough meat but who cares its still good for you! just make sure you don't choke on the bones!

As for drinks i had the citrus tea.. really good and refreshing...

For the sides we had the Lamb scewers and it is to DIE FOR! you must try it!!

Overall i give this place a 5 star.. 

gyeah i admitt i was sccccccured going to the location.. me and my freind was like ok time to put our rolexes in our pockets before we get jacked! the location is kinda crappy in the hood spring mountain and jones right next to some shady massage place behind Church's chicken!

I hope BOOMING POT BOOMS on the  HENDERSON SIDE OF TOWN! saves me the trip.. but its still worth the drive...

So for awesome hot pot.. GO TO BOOMING SPOT MINI POT IT WILL SURE HIT THE SPOT!!  :)",r2R9t9_0Je8wP-wh4-xM3w,8,7,5,Ntw4l-a0QwPyuwMxq66Hlg
5100306,2012-09-11,3,jnroKk9qi0FR2bFSkxYZNg,"So much has changed since I first discovered Mini Pot. Qi (the owner) has added a lot more variety to the menu. There are a few additional pots and a ton of new sides. 

There's a selection of grilled skewers--all of which are excellent! The dry spice rub has a cumin base and is incredibly flavorful. Although spice level is objective, I think people of all heat tolerances can handle it. The chicken wings and little sausages are my favorites. But if you're craving something meatier, they've got lamb and beef skewers too.

The new jelly noodle dish is mouth-wateringly addictive... and its cold! It's a pretty hefty serving, so I suggest sharing it with another person or simply ordering it alone with some skewers. It's a wet noodle dish with a somewhat soupy sauce. It's refreshing, spicy, and has a hint of that nutty Chinese sesame paste. Fore-warning: The heat from the chili pepper will creep on you!

A few new mini pots have hit the menu! Kimchi, I believe, is the most recent. I haven't tried it yet but I'm sure it will be a hit. I might be Korean but my frequent orders will probably remain the lamb pot, the tendon & radish pot w/ a side of tofu skins and rice ovalettes. The menu is still finding its footing. So what does or does not come with the pot varies visit to visit. For now, mini pots are sold on their own where noodles and/or rice are sold separately. 

Don't forget to pick up your frequent diner stamp card. Buy 10 get 1 free. I've filled up 2 cards already and working on my third.",AL4hosjTZzsLt99egmBszA,10,5,5,CNzPJf7h0xrOif7soLdaQw
5140355,2013-08-16,1,jnroKk9qi0FR2bFSkxYZNg,"If you have never been here...BEWARE. Saw all these great reviews and decided to give it a try. Came here at around 5:30 p.m. to an empty house...it was still empty when I left after 6 p.m.

A little early for dinner but this being near Chinatown did not make sense.  Ordered the Beef pot and it came with like 5 thin slices of beef cooked already in the pot...oh well, they had side dishes so ordered a side of squid and fish balls.  

The squid rings looked really sad, like it had been frozen for years and finally defrosted, all dried and swiveled up...asked the waitress what's up with that and can I exchange it for something else...can't believe she said NO and insisted that it was fresh...said that it came in a bag from supermarket and they defrosted it and since they boiled it before putting on a plate for me, they can't take it back. I asked her to look at it since it did not look fresh but she kept insisting it was fresh. I did not want to argue any further and it was just 2.99 for the sides so I just let it go. 

I felt sorry for the empty restaurant  and ordered another side of noodles since I wasn't going to eat the squid. $9.99 for the beef pot and 3 sides, a total of around $20.00 (not a lot of money) with only 5 thin slices of cooked beef and 6 fish balls and a sad plate of overcooked noodles, just felt cheated. I was not going to write a review but leaving the restaurant, feeling hungry and used, I just feel that I have to warn those who might think about trying this hole in the wall...It's even more sad when you are eating somewhere by yourself and run into bad food and bad customer service.

Noodle Exchange is 100 times better and being a hotel, I think it's a lot safer.",G5HJ8ojD6Dx515m-eJYaXQ,1,0,1,Br7dgq0fZ48RUV6_wh1nyg
5173493,2012-08-12,0,jnroKk9qi0FR2bFSkxYZNg,"Found this place on yelp when a few friends and I were searching for some good Asian food on a Saturday night. The wait took about 15 minutes, but once we got seated we just ordered four different hot pots. The seafood, and lamb, pork bone and kimchi beef. All of them were great, but and so were the beef skewers. Has to be one of the best hot pots I've eaten anywhere, anytime even in Taiwan. Real authentic, sauces and everything. Come here, you won't be disappointed.",60lMM9SluJX6Vfr59KRhJw,2,1,5,byNgtmIm2A30JrlEN3KPCw
5175856,2012-09-03,1,jnroKk9qi0FR2bFSkxYZNg,"I went there after I saw so many good reviews, but this is not real hot pot, they cook everything in a pot in advance, which is odd, the reason behind is because they think ppl don't put meat in the pot longer enough and might get sick from it, but this is not hot pot is about, you are supposed to dip food in the pot and then eat it, so you can  the food is freshly cooked, and has its own flavor, not dump everything in  a pot , that's a stew!",4WWiCUkZ0Fft3y3qD4ebvg,3,2,1,qhQ_6pKmrLDve8GBTTKRHA
5233210,2012-09-23,0,jnroKk9qi0FR2bFSkxYZNg,"I love, love love this place. I have been there twice and leave stuffed and craving it more! I do suggest ordering extra meat and the noodles.Their homemade chili sauce is so good.",gzhuCV5AMFnHsGf3ajWAeQ,0,0,5,57pEHXlDpTs9GBaKEpmWRw
5265972,2013-10-15,1,jnroKk9qi0FR2bFSkxYZNg,"Even though this place doesnt compare to the chinese hotpot places in cali, it cured my hotpot cravings! Definitely one of the better ones in vegas!

Each hotpot is fit to serve one person with spiciness ranging from 0 (mild) to 5 (hot). There is a ""sauce bar"" in the back where you can pick and choose your own dipping sauces: garlic oil, chive oil, chinese bbq, garlic oil, and also has cilantro, & green onions. 

I ordered the chicken hotpot and for whatever reason, you can't pick the level of spiciness for the chicken hotpot but you can ask for the spicy sauce on the side and mix it in yourself. 

The soup itself is really soothing and tastes very healthy. You can see the goji berries and jujube floating in the soup. It also had chunks of chicken, mushrooms, cabbage, and other vegetables. It was plenty for me but you can also order more on the side if its not enough.

Definitely will be coming back as the weather gets colder!",BvxKENu8F6jqE6uuR7lGOA,1,1,4,jrIU2q1wuC4_IkuoC4HGfw
5285069,2012-05-12,0,jnroKk9qi0FR2bFSkxYZNg,"Never had a hot pot where you can actually sip and eat the broth and add whatever you want to the broth. I got the kim chee hot pot and the salmon and tofu hot pot spicy level 4. It was amazing. The mushrooms were so delicious. The owner was very nice and explained to us everything about the menu. The best part was the mango juice. They actually import real mangos from the Philippines and it is so fresh and has pulp in it! They also have coconut's from Thailand. How cool is that? Best part everything is under $12. I originally wanted the cage free chicken pot but they were sold out and he said it was the best one. You have got to try this place out even the decor is beautiful and the atmosphere is very warm and friendly.

PROS: food, atmosphere, service, price, large portions
CONS: No liquor license yet",4cdPjnXl6DNngTeVDafPkg,2,0,5,-RHt3a2GbTkTAv1hYt1PKg
5361314,2013-06-05,1,jnroKk9qi0FR2bFSkxYZNg,"**Summary**
       - Decor - The place is definitely a hole in the wall place. It makes you feel like you're in an authentic diner in China.
       - Portioning - The mini pots seemed to half a lot of filler and not too much meat for the price.
**Ordered**
       - Jelly Salad - The jelly salad was good. It's a little spicy and reminded me of the jelly fish appetizers at Chinese restaurants except with more cucumbers and in a nutty soup.
       - $11.99 Tendon & Radish Mini Pot - There wasn't too much tendon, but the amount that was inside was good.
       - $11.99 Pork Bone & Potato Mini Pot - The meat was nice. It reminded me of the beef meat from Yoshinoya beef bowls but the amount left me unsatisfied for sure.
       - $6.00 Grilled Beef Tongue - 3 Skewers with 3 pieces of tongue each. It was a little dry and not flavored well.
       - $2.99 Fish Balls - The fish balls had some brown meat thing inside them. Though it was different and interesting, I really just wanted plain old fish balls.
**Recommendations**
       - I wouldn't really recommend this place. Though the flavor wasn't bad, that and the amount of meat did not justify the price.",37S80IUIfb8yMsSwWWDsFA,1,0,2,RJZudJO3G0RmW8ciSI1o7Q
5373383,2012-05-08,8,jnroKk9qi0FR2bFSkxYZNg,"Yuhi K. was talking about wanting to try this restaurant out at the last sushi UYE and it has been stuck in my head to visit. After reading the reviews of my fellow Yelpers and friends, I had to go. At first, I wondered about how they were going to survive with the upcoming summer heat while serving hot pots. I might be a freak that enjoys eating boiling hot soups in the middle of a Vegas summer, but many more are about to join after one taste.

I got the much written about Intestine and Radish Hot Pot. Do not let the name of the restaurant fool you. There is nothing mini about these sterno fueled cauldrons. Although they have a rule about one pot per person, it can feed two easily. Don't like the rules? ""NO SOUP FOR YOU!"" It is ok, just take the leftovers home. 

The condiment bar has everything to personally custom your vat of gastronomical delight. Fresh chopped scallions and cilantro was added with a heavy hand. A side of house made sesame paste and BBQ sauce was ready for dipping. For $10.99, I left with two meals and a happy stomach. Do not let the heat outside deter you. In some Asian countries, eating hot foods helps to cool the body down and Booming Spot has the best cure for the heat.",N3oNEwh0qgPqPP3Em6wJXw,17,11,5,x-6wXrm5Bk9t32pd0NQSSQ
5387299,2013-01-05,0,jnroKk9qi0FR2bFSkxYZNg,"All of the great reviews are legit.  Booming spot has the best service I've ever received in a local Asian restaurant.  The main guy is extremely attentive and friendly.  When you sit down, they have traditional menus and also small Adroid tablets with pics of assorted dishes for your browsing pleasure.  As soon as you order they take you over to the sauce bar, where you can mix a variety of about 7 different sauces, fresh cilantro, green onions, soy sauce, and vinegar to have your own personalized creation.  Honestly, you really can't go wrong, no matter how you decide to mix your sauce because every option is delicious.  They offer a spicy rating from 0 - 5 for your mini pot.  I chose a 2, and probably will opt for a 3 next time.  The 2 was a fairly mild spice level.  Prices are approx $10-12 per mini pot.  The mini pots arrived blazing fast, about 5-10 minutes.  The first 3 people to order got theirs first (about 5 minutes after ordering), and about 5 minutes later the last 2 in the party were served.  2 members of our group had a little too much spice for their tastes, so the main guy came out and added a some more broth to their pots to neutralize the heat a bit.  Each mini pot comes pre-cooked with a live flame under each pot, which you may adjust to maintain your preferred temperature.

Many other yelpers noted that it is quite small in there; it's small, but not as small as I was expecting.  There is one large table immediately to the right when you enter that will seat 8 people.  We came with a group of 5, so they gave us the large table.  Otherwise, I think there are approx 10 other tables (all booths) that will seat groups of 4.  

The food quality is delicious.  I had the #11 pork marrow & potato bowl mini pot ($12).  And I added on fresh mushrooms and noodles.  We split the lamb skewers, which came with 3 skewers and came seasoned with really nice spice.  If you plan to go, be warned that despite fast service, it does take a while to eat your hot pot.  I felt as though I had been eating for a long time when I finished.  I enjoyed every bit of it.  Oh, and the purple rice is so yummy with a little bit of my custom dipping sauce mixed in.  If it's a chilly evening, I highly recommend their housemade lemon, honey tea, which is so good - also offered chilled.

The location is a little tricky and easily missed.  It is at Spring Mtn/Decatur intersection in a tiny strip shopping plaza behind Church's Chicken on Decatur.  It's next door to a foot massage place that has a little sign out on the curb.",KmBPYlD00BupKSwWxOWA6w,2,0,5,RPmmSaGQSqrUpy-S6tSDcw
5390438,2012-08-06,1,jnroKk9qi0FR2bFSkxYZNg,"Had been wanting to try Booming Spot ever since I've heard of it as it sounded like an interesting twist on the shabu shabu style I adore.  This past weekend seemed as good a time as any, particularly after verifying via the Talk threads that they were finally serving beer which is a requirement of any establishment I will dine in on a Saturday evening.

We were warmly greeted by the waitress who explained to us the menu and showed us some pictures of the options of hot pots on some iPad-ish like tablet device while I ordered a bottle of Tsing Tao.  She talked us into ordering some skewers, in which the 5 skewers for $12 or $15 (I dont remember) seemed like a good value.  We decided to do 3 beef, 1 beef tongue, and 1 lamb.  I decided to go with the Fish Head and Tofu hot pot because I hadn't really seen anyone mention it and I couldn't resist the opportunity to eat another fish eyeball this evening.  Who I believe to be the owner came into the restaurant a short time later and he showed us the sauce station and explained some of the options.   Each of the persons in my party all made what they thought would be their own saucy masterpieces and we sat awaiting our food.   Shortly thereafter, our hot pots all arrived.   I was a little disappointed the skewers didn't come out first as I was hoping to polish them off before the hot and highly flammable pots were all spread throughout the table.   As it was the skewers came out a few minutes later, and I think I almost lit myself on fire a few times trying to reach for some beef tongue.    As for the skewers themselves, I wasn't too impressed.  None of them were piping hot which I expected since they'd not come out prior to the pots, and each of the different types were all smothered in the same overpowering spice.  I did find the spices that covered them all to be quite tasty, but would have preferred to be able to taste more of the meat underneath.  The lamb was my favorite of the 3, and the beef tongue, usually a favorite of mine, underwhelmed.   

I ordered my hot pot to be a spicy level of 3 and a half, as when I originally asked for a 4 the waitress' eyes bugged out and she asked ""REALLY?""  I know my limits, and usually when I get that sort of response I know I should probably pull it back some.  Once I tried the food out of the hot pot itself, I was glad I didn't go with a 4, as each bite seemed to get spicier and spicier until I was dripping sweat halfway through the meal (the good sweat!), and relief was found with every refreshing swig of Tsing Tao.  I may have been a bit more adventurous than I should have with the fish head pot though, as I didn't find that there was enough meat in the fish head as I'd like and I got a little annoyed having to go through all the bones to find whatever meat was there.   The tofu and other veggies were all scrumptious.  My sauce that I made consisted of the garlic sauce mixed with chili sauce, and I thought it was a delicious combination to dip any/everything into it. 

One of my dining companions has several food allergies and items she does not like in general and she had a difficult time conveying to the waitress what she did/did not want.   She tried to order a customized beef hot pot and listed the items she DID want, and while for the most part they got it right, there were definitely some extra items she hadn't specified.  Something to keep in mind if you have any life threatening allergies or extreme aversions to certain foods (like I have with celery).   

Ultimately it's hard for me to give Booming Spot a grade without comparing it to Shabu Shabu that I've had.   I don't see many advantages to this type of hot pot versus the DIY version I get on a nearly weekly basis at Shabu Shabu Paradise or Swish.  The one nice pro to Booming Spot might be price, as dinner of hot pots for 3 of us with the skewers and 4 beers came out to a little over $60.   In conclusion, it was a momentary indiscretion like Kristen Stewart and the director, but in the end Shabu Shabu still has my heart in all things hot pot.",v3YOx9T4jRSw8XP9Rd9H4g,1,1,3,lwozLf5qdceuTwTZxXz4uw
5467826,2013-07-27,0,jnroKk9qi0FR2bFSkxYZNg,"After trying a Taiwanese hot pot place in So Cal, I decided to search for a hot pot place here in Vegas and I was surprised there was one. I did not know that there was a hot pot place in Vegas, so I decided to try Booming Spot Mini Pot. The server at this restaurant was really friendly and was happy to promote her dishes to our table. I really like the soup of the hot pot because it had the right flavor and spice to it. However, the lamb skewers weren't the best here and I expected better. Overall, the experience here was nice and the food was good.",bArcCPuX7wLOXO-McxV76g,0,0,3,tSqWxIgOGru9n4DaBbyE3w
5482245,2013-04-04,2,jnroKk9qi0FR2bFSkxYZNg,"Just got home from the hole in the wall joint about two hours ago and what's the first thing I do? Turn on my macbook pro and login to yelp lol.

BE PREPARED FOR AN ESSAY ON MY ADVENTURE AT BOOMING SPOT!

My gf were first timers here, thanks to all those who previously reviewed this place with detailed info, I read through most of them and ordered what you guys suggested. 

Food:
(there is a note at the sidewall of each table that states each person must get their own mini hotpot, I'm sure they wouldn't mind if you ordered one to share and ordered side items as well, but what the hell is a mini hot pot? this was more like two servings, which is good, cause I can EAT! mwauahahhaha)

I got the #10 which was cage-free chicken, pretty much chicken with bones and all.
It came with cabbage, mushrooms, some sort of fungi, tofu, tomatoes, and onions. Really good stuff if you have the energy to pick apart the meat. Think of your mom's broiled chicken, yenno, the type with the rubbery skin and very chewy chicken meat, it's ok, but not worth getting in my opinion for I only ate the veggies most of the time, the chicken wasn't as appetitizing as I thought it would be.

My GF got the #1, which contained beef slices, fish balls?, tomatoes, mushrooms, cabbage. Hers looked good, then again  i think its the same broth, not sure, don't take my word for it.

We also had the most hyped up items at Booming, the jelly noodle salad and lamb skewers, and boy were they BOMB.COM! The jelly noodle salad kind of reminded me of papaya salad that my mom makes, I'm talking about the authentic Laotian/Thai style, you Laotians out there know what I'm talking about, ""Thum Mak Hoong."" It had some kind of clear wide noodles and cucumber slices with a mild sauce on it....HELLLLLLLLLLLLLLLLLLAAA good, trust me, just get it, you'll thank me later. The lamb skewers were great as well, a little spicy seasoning on it and wham bam thank you mam, my mouth was having an orgy. It was juicy and tender. (please do not flag my review for this statement)

Our bill came out to $40, two hotpots, lambskewers, jelly salad, side of purple rice, extra enoki mushrooms

Customer Service:

1 Billion/10

I wasn't expecting this place to be a mom & pop...& daughter type of joint. My gf and I walked in an hour before closing time and they all were super nice and courteous to us.  The young lady asked us if it was our first time there and we said yes so she pulled out an ipad with images of the items on the menu for us to check out, pretty cool. The older lady, I'm sure she would be the mother was very caring as well, reminded me of my own mom, she would always check up on us and ask if we needed water or anything, overall this place was delightful to be in, small but the booths were comfortable, P.S there is a hidden condiment station in the back where you're supposed to get your chili oil dipping sauce and stuff....we didn't know but the young waitress was kind enough to make the dipping sauces for us, and because of that, my GF & I left her a big tip, we both came from restaurant backgrounds so we know what awesome hospitality is and the folks at Booming made us feel like family, MOSDEF going back!!! Have I won you over? GOOD, what are you waiting for? GET DRESSED AND GO!",PRuDregSKLJzupkCtmEfoQ,3,1,5,ko36lcf4pMyuuuGDCBJDGw
5500713,2015-03-23,0,jnroKk9qi0FR2bFSkxYZNg,Great hotpot at a very reasonable price. Probably one of the better hotpots i have had. Would highly recommend this restaurant if you're in town.,AjA7U_ctz-AGkXSaN-QJhQ,1,0,5,rM3hYOIhv1cEme0If9gHBQ
5522133,2012-07-11,0,jnroKk9qi0FR2bFSkxYZNg,Service is great and so friendly. The lamb skewers were to die for so yummy. I had the free range chicken mini pot it was awesome.,okgTPcVGlOgoooTV_KzeDA,0,0,5,6m7HxPZ8VztdOd6hzOZxwg
5525889,2012-07-02,0,jnroKk9qi0FR2bFSkxYZNg,"Since there's tons of reviews I'll just make this one short. 
It's a cozy restaurant. They speak both English and Chinese, so that a huge plus. 
Prices range from 10-12$ for hotpot. 
To add extra meats, fish balls, tofu etc will be around 1-3$
I had the watermelon juice very fresh :)
Goes good with the seafood pot. 
As hotpot goes there's a spot where you go make your dipping sauce that includes the Chinese BBQ sauce, scallions, soy sauce, black vinegar and I forgot the rest. (I only use those)
If you are carb conscious this place is perfect and will leave you feeling full. 
I will be back with some friends and gonna try that pork bone with potato pot.",YD58b0ZxmB6a2pdX4yjziw,0,0,5,wiDwpB5T0GjBWM8MMWdYgQ
5549192,2013-07-14,0,jnroKk9qi0FR2bFSkxYZNg,"family trip to vegas on 4th of july weekend! LOL funny thing is, we came here when it was hella HOT in vegas. my family came here because we saw some pictures through friends and was like! WE MUST GO. funny thing is, it was very hot in vegas and we still manage to go here for some hot pot. but i have to say i will come back! the service was nice, and it was pretty good! everyone gets their own POT!",RRVRqO1uFRv70t-OKvzo0A,1,0,5,y16ZzGdK5iwOOO99pPu18w
5597513,2015-11-27,0,jnroKk9qi0FR2bFSkxYZNg,food was pretty good. staff were very friendly but slow.  got the mom and pop shop feel. it could be a bit under staff depending on how busy it is. a good place to go to support a family/small business.,di84GJrZbnM2Ma8l63Fc9w,0,0,4,yiWa6lMOQ72tcb2mN0akTQ
5607504,2016-02-27,0,jnroKk9qi0FR2bFSkxYZNg,"Yelp once again helped us find a great little spot.  This is a mom and pop shop with good food.  Finding an excellent Taiwanese beef noodle soup was such a treat!   They have homemade shredded noodles, super tender beef, and a flavorful broth.  We enjoyed our new favorite spot for beef noodle soup!  
 
Don't expect great service.  The place is not very trendy.  The food is great so all is forgiven!",0hZfE2He1YssM_wEvKhfcA,0,0,4,v4E16db6uFqTbznqNb5j_g
5734973,2012-10-11,0,jnroKk9qi0FR2bFSkxYZNg,"I don't know if Vegas has any other hotpot place.. but this place is most definitely worth visiting. ESPECIALLY since winter & fall are just right around the corner :b.

You can pick different types of mini pots, like lamb and beef. We got the lamb and beef and it was pretty good. We had 2 pots and 3 different types of skewers (beef, lamb, & beef tongue) between the three of us. You might wanna get a pot for yourself to be full. It's a mini pot so it's not SUPER huge. There are all kinds of other stuff to add to it and I will need to come back a few times to play with that.

There's also a sauce mixing area/station so you can experiment with that to get the sauce you want for your meats and stuff.

I liked the lamb and beef tongue skewers the most. Give them a try :). There's 3 skewers per order. Beef is $5, lamb & beef tongue are both $6 each.

They also have stamp cards for each mini pot you order so don't forget to grab one :).",7weuSPSSqYLUFga6IYP4pg,2,0,4,YcgQ9TYltOXTi-lznZsU-A
