,date,funny,business_id,text,user_id,useful,cool,stars,review_id
1490785,2014-01-07,0,jnroKk9qi0FR2bFSkxYZNg,"I have never written a review on yelp EVER before...but this dining experience warranted one.  Also I have come to expect subpar service from Asian restaurants in general (in fact no service at all) but I have never experienced such a horrible experience than this ""Bumming Spit Hot Shit"".  Initially, the food was decent and actually quite flavorful, besides the fact I ordered the lamb hot pot with a 5 spice level, it tasted like Kimchi.  I believe they reuse the leftover soups and sauces.  My significant other and I were seated quickly enough, most likely because the restaurant was COMPLETELY empty on a cold winter evening. I can now see why...all was well until the end. Upon asking for a little to go container for the leftover dipping condiment, the lady/owner said they do not give containers for the sauces. Cilantro, spring onion, chili oil, etc costs next to nothing, yet alone the 0.02 cent container for the sauce. After the Kimchi flavor in my soup, I came to the realization they quite possibly DO reuse their soups and condiments.  I was so upset to waste the leftover sauce that I poured it into the teapot and filled it with my chopstick wrapper and napkin, so they will not be able to subject other patrons to endure their leftover reuse of product.  I sincerely hope this place doesn't last, next time I will go all the way to Henderson to have AYCE Chinese hotpot on Silverado and Maryland.  This place sucks! They need a lesson on sanitation, service, and business.  They just lost a major patron with huge retention potential...God help this establishment!  It is GROSS just thinking about the very REAL possibility they reuse product.",Z8HooJ9pH4mfW_8dRxFUug,2,0,1,qv3Yw0yJQ4551k1tWpDKZA
1550042,2013-02-25,0,jnroKk9qi0FR2bFSkxYZNg,"What a cute restaurant.  Came here based on yelp reviews and a craving (it was cold in LV!) last wednesday night.  While the food didn't blow my mind or anything, I had a really nice time there slowly consuming my hot pot.  The service was great and the young owner was so friendly.  He chatted us up about what we were doing in Vegas and everything.  As they say, it's the service that keeps you going back to a place.  Next time I'll know not to get a level 5 spicy pot, it was ridiculous and I have a very high tolerance for spicy food.

Oh yeah, the jelly noodle salad recommended by the owner is delicious!",IjxJiSab2aQ7gP35jAMh3w,1,0,4,r55vpmPx-TggtNfkACpNuw
1560557,2012-04-10,0,jnroKk9qi0FR2bFSkxYZNg,"GREAT PLACE! 

Just came here for lunch with my family and friends, and we all loved it. Each person gets their own individual hotpot (Chinese hotpot is a heated pot of soup filled with fresh meats and vegetables). They have a great selection that includes lamb, beef tendon (yum!), beef, chicken, and a large assortment of fresh Chinese vegetables. You can also go to a ""sauce bar"" to grab extra flavorings, and you can choose the spiciness level of your order. You get a ton of food for about $10 a serving.

The owner told us he just opened the place last week, and it's already been doing well via word of mouth. He says they will also be getting their liquor license soon. He clearly takes a lot of pride in the place. Check it out!",n-WaeqDWHp1kR2d1wulCvw,0,0,5,xHfbQfHSnkM1G5UgnCBP-g
1590056,2015-03-26,1,jnroKk9qi0FR2bFSkxYZNg,I came to this place to try their hot pot but ended up LOVING the noodles. The Zha Jiang noodles and the beef noodle soup were on point and some of the best I have ever tasted in America. I'm from the Bay Area and I've tried a lot of noodle places before but this place has a very authentic flavor.,XaCwNcTrN1OemYye5xEVwQ,2,1,5,pfUj6CzuHdp9bpm1MOMYZA
1740937,2015-12-26,0,jnroKk9qi0FR2bFSkxYZNg,"Just returned from our 4-day Vegas trip. The best food we found wasn't on the strip, but this hole in the wall joint.  The four of us ordered a short list of goodies for lunch after we picked up our rental car.
????, ???????, ?????, ???, ???? ???????? 

Everything was flavorful and the prices were reasonable. There were two other families that arrived at around the same time, the service was fine. I had a short chat with our server who might also be the owner. I told him that the dishes reminded me a lot of the military family village (??) that I grew up with while living in TW. 

We sampled different foods on and off the Strip in the next few days. From Fashion Show food court to the Buffet at Aria, and Chinatown. This was the only place we returned for a second visit. If you like comfort food, this is it. I highly recommend the beef noodle soup - half tendon and half meat.",qq-z2PpjCjN-fMbvbFsg6w,1,0,4,5gpSQlOVBwZ1yGUsE-hwWw
1810324,2016-01-12,0,jnroKk9qi0FR2bFSkxYZNg,"????????????????? ????????????? 
They told if tow people's orders one we will pay more.!!",sEDZZItVFo7gHEyLE0_sPA,0,0,1,kwy3HawwIAAkYEqB-kb0Dg
1811524,2012-09-28,0,jnroKk9qi0FR2bFSkxYZNg,"Let me preface this review by saying that I am a midnight snacker.  No matter what I have for dinner, I will invariably find myself hungry a few hours later and lookin' to munch.  But this place left me full long after my usual feeding hour, which is saying something.  On to the food...

Beef tongue skewers - These came on three generously sized sticks, but unfortunately, they weren't really seasoned great, and the cuts were a bit unwieldy and hard to chew.  Would not recommend.  

Fish head/tofu hot pot - YUM.  The owner advised us that they only make a few pots of these per night (limited number of fish heads), so I jumpd on this right away.  And let me just say, they give you a HUGE head.  And what I seriously think is an ENTIRE box of tofu (firm).  I ordered the ""dong"" tofu as a side too (frozen tofu with the holes in it to really soak up that soup flavor), which ended up being a TON of tofu.  I asked for the super spiciest broth, which was really spicy and really really delicious.  You can order all sorts of things to supplement to your pot, but the pot itself (without add-ons) comes with tons of cabbage, shitake and regular mushrooms, wood ear and onions.  They are generous with the vegetables here, which is a huge plus.  I also ordered a side of clams, which weren't really worth it in hindsight, given that they only give you a few, and they cook them for you beforehand.  They weren't UN fresh, but they also didn't taste SUPER fresh.  The fish head though?  No complaints.  A++

Pork hot pot - I'm not clear about all the ingredients in this one, but I can tell you the stew was delicious - really nice pork flavor (I think they pretty much put all the parts of the pig in here), and same vegetables as in the above fish head hot pot.  

Now on to the sauces:

They have a self-serve bar of sauces/other soup goodies, which include scallions, garlic, cilantro, your usual hot pot satay sauce, a spicy red sauce which I highly recommend, and a salty chive sauce which I would NOT TOUCH.  We tried it just to try it, but they're not kidding when they say salty.  

Overall, I'd say that this place is pretty good if you're looking for an alternative to korean tofu bowl.  It is NOT however, ""hot pot"" in the sense that you're probably thinking - the bowls come pre-cooked, and everything inside is already cooked for you.  The base of the soup though, is really good, especially if you like spicy!",7VhXchEryix_jrWv3ziRZg,1,0,4,PBhN5fGNrti5DaUmzNGccg
1830907,2016-03-15,1,jnroKk9qi0FR2bFSkxYZNg,"This is a great place to come after a hangover or a night full of partying. Best for being sick with the cold or flu as well. This spot is like a hidden gem in Chinatown and spring mountain road is the best place to find ethnic cuisine. 

Although it's hard to find, it's on the corner of Decatur and spring mountain right next to churches chicken. There are limited seats and I bet it gets more busy during winter season. 

Let's talk about the soup. I like my pot spicy and this place got level 4 of spices. I ordered the seafood pot and it comes with mussel, shrimp, veggies, mushroom and your choice of rice or noodle. Perfect, and the pot stays boiling until your noodle is almost finished. Spent 45 minutes at this joint finishing my pot only because every flavor is just savory. I would put it in a water bottle and drink that sodium content lol.

I'm coming back here when I get sick. I hope I catch a cold soon this place is healthy too!",qQxpmxc9wM8qzzKHtiUgJg,1,1,4,wqE-43qN-LeeZFqjhYLmaQ
1837291,2013-05-28,0,jnroKk9qi0FR2bFSkxYZNg,"I've been craving hot pot but no place was coming to mind. After reading the reviews here, I decided to take a trip down to this little hole in the wall. Sadly, I was a little disappointed. Perhaps it's because I've been spoiled by So Cal hot pot and authentic lamb skewers when I visited China that nothing was memorable or impressive about this place. I'll give credit for the nice service and the lemon in my water. The mini pot looked like imitation boiling point but the flavor is not as good. The lamb skewers were overcooked and chewy. Maybe I'll give it another chance one day but for the time being, I'll get my hot pot fix from LA instead of here until I find a great one.",O_3ceyOjYpXxLxboGfusYA,1,0,2,USXjPKEUTbdk3PeDdNSqsA
1939578,2012-11-24,3,jnroKk9qi0FR2bFSkxYZNg,"Talk about a local hole inn the wall tucked away secret!

Not only does Booming Spot have some great hot pot for amazingly reasonable prices, they add lemon or lime to their water so it tastes better. I know it's stupid to nit pick at the water they serve but it's this kind of attention to detail that wins me over. Dont know how many times i been to an expensive ""high end"" restaurant to drop some dough just to be served the finest of Las Vegas tap water that's been poorly filtered. 

Anyway the hot pots are legit. Only gripe i have is it's not the 'here's a bowl of boiling soup and here's some raw stuff, do your magic and we'll be here to clean up after you when we're finished' setup.",7A7FOLZZKL0iokQVOAEbgA,5,3,5,gooc7H23WdbbiJnnVYUm6A
1989786,2015-01-28,0,jnroKk9qi0FR2bFSkxYZNg,"It's cold, rainy, and dark - so where can I go for some hot, satisfying, hot pot?  Booming Spot Mini Pot!  Sure... this spot has had some off days but hey - I think it makes this spot even more legit. 

I get the lamb mini hot pot with an additional side of beef tendon and a cup of rice.  Ya ya, beef tendon is an acquired taste for some, but I thoroughly enjoy it.  I load up the tendon into the pot and while it softens walk on over to build my own specialized dipping sauce at the sauce station.  Once everything has simmered and cooked through, I have at my mini hot pot - dipping each morsel of hot pot goodness into the sauce mix concoction I made earlier. I only wish I had a bigger stomach to eat more - they call these pots mini, but for me, they're more than enough.",P8I1j-p6hxYrewXFCdkXLQ,2,2,5,51m0Y6eg2DjsE0em8eK1Ug
1993077,2013-05-03,0,jnroKk9qi0FR2bFSkxYZNg,"This place gets a 4 star rating compared to its peers in the Vegas vicinity. If they had this place in CA, I would only give it a two because there are far more superior hot pot restaurants here.

The place is small (behind Church's chicken on the intersection of Spring Mountain and Decatur) and it's hot inside with only fans to keep the circulation going. They probably operate like this to give it some authenticity by mimicking the hot and humid weather in Taiwan. Ordered the Lamb mini pot and got the medium spicy (which is SUPER mild so if you want to get a medium spicy order level hot). There isn't plenty of meat but the soup is delicious. Also ordered the skewers which was tasty. I don't live in Vegas anymore, but if I did, I would be a regular here.",1xqwVCfdpmjNjm4tDsEslg,2,0,4,coyRQrzAxmrGN3LgA9k-4g
2022386,2013-09-26,0,jnroKk9qi0FR2bFSkxYZNg,"I had the beef soup pot with spicy level 3. The soup was seasoned well and tasty.  They have a small burner underneath to make sure the soup stays warm and they have a little sauce bar to make your own dipping sauces for the meat. 

For the price i was expecting a bit more slices of brisket in my soup.

The lady that was working there was very helpful and it is a good place for a first timer to try hotpot.  It seemed that she guided every customer step by step and showed us pictures of what some of the hotpots looked like.

Overall the food was good, just wish there was more meat in. Would probably stop in again during the winter times",XetOgmeZKHhpiauBCK_t1w,2,0,3,45sW45wNoyCFGxtH-UaRgQ
2094128,2013-07-27,0,jnroKk9qi0FR2bFSkxYZNg,"I expected a lot more from this place. I came here with a friend and we both ordered a hotpot. She ordered a beef hotpot and i ordered a lamb hotpot. We included one side of beef skewers. The waiter was nice and very energetic and advice on the hotpot and sauces. We were informed the soups are all preboiled for 5 hours before serving. The spiciness scale ranges from 0-5 and a 2 is already very spicy. I ordered a 1 in spiciness level, and my friend a 2. Our skewer had more fat than meat and dusted on the outside was a dry spice (which could have been grilled on instead to taste better) and the soup was fairly good although inwould have prefered beef over lamb. The portion sizes were pretty large, and can easily feed one person without leftovers. This would not be my first choice restaurant, however it is decent and is the only official hotpot only place in Vegas right now and to satisfy my cravings, i will come again.",LPn2OWtlRXMySdxmHJAOlw,0,0,3,jVFPMo_K0SLtVVf4S8_iNg
2105163,2015-04-30,1,jnroKk9qi0FR2bFSkxYZNg,This was the most awkward restaurant experience I have ever had. My parents and I came in and waited at the front to be seated and no one came out. We came in at 7:15 pm so it definitely wasn't closed. There were two Chinese families seated. A Chinese guy said something to us in Chinese and we had no idea how to respond. So we waited a little longer and still no help. We just decided to eat somewhere else. soooooooo awkward. I don't know if I feel like eating here ever again.,U3H61vMIWIvFDFjVN8qr9g,0,0,1,bzlLrsK7iJZT2JQBv4sbSQ
2106450,2015-01-08,0,jnroKk9qi0FR2bFSkxYZNg,"Soup taste good! I remember coming here when my friend was sick, and just knowing the soup hit the spot!",-MqEeaw31xIn1U8mSPWG-Q,0,1,4,WcYmw7XkFXT6HoyEtN1Avw
2150817,2014-03-21,0,jnroKk9qi0FR2bFSkxYZNg,"What you say? A hot pot all for myself? Yeah!

I had the lamb hot pot and my partner had the beef hot pot ($9.99 each). The lamb broth had a vinegary tang to it, which I liked and the beef broth had a good hearty flavor. Both came with tofu, crab sticks, tofu skin, mushrooms, a fish ball (with pork inside), bok choy, carrots, tomatoes (ideal for a good broth flavor), and their respective meats (thinly sliced). We ordered add-ins of fish balls ($1.50) and noodles ($1.50), which we split between us, and spicy level 4.

The broths were very flavorful and you could adjust the flame below if you wanted it more or less bubbling hot.

It was our first time there, so the owner was very helpful in explaining how it worked, which we both appreciated. She also showed us how to do the sauces, even offering to make one ""special"" for us. I mixed green onion, cilantro, and garlic oil; my partner was quite fond of the garlic oil and Chinese BBQ sauces together.

Tip: the ingredients can be quite hot, so take out the goodies and put them on a plate to cool off a little before wolfing them down.

While I wish we hadn't waited so long to finally stop in,  now that we have, we will definitely be back. Next time, we're going to try some of the skewers they offer, too.",OcpxS8U7evLWyfw1K2pwng,0,1,4,RayLWz_mF8LlqJ_299hR9Q
2218496,2012-08-12,0,jnroKk9qi0FR2bFSkxYZNg,"Sad to say but I was kinda disappointed.  In Boomin Spot's defense, I have been spoiled from SoCal's amazing hot pot restaurants.

The lamb skewers were indeed very delicious.  I think they were 3 skewers for $6.  

I ordered the Lamb Hot Pot.  It was ok.  Spice level was good but it had too much junk in it.  I had 3 slices of lamb.  Maybe 4.  Again, there was so much junk...it took some time to find my meat!  They overdid it with the pickled cabbage.  There were 3 or 4 small tofu squares, some mushrooms, intestines and one fishball (fishball was yummy).  I asked them to leave out the pork blood but there were still a few cubes in my pot.  

They have a sauce ""bar"".  Basically a wooden book shelf with metal containers of the essential sauces.  I mix almost everything together....peanut sauce, garlic, sa cha, green onions....and whatever tastes good.  I usually add an egg to my sauce but I didn't see any at the sauce ""bar"".

I would still recommend people to check this place out but just don't have high expectations.",DyQpYGALYV-WmKfb5rThGw,1,2,3,AJ4hApMHesvulNxxkwxmuQ
2225453,2012-12-05,2,jnroKk9qi0FR2bFSkxYZNg,"miss yuhi k. mentioned that her friends were opening a hot pot spot the first time i ever met her and she said it was called ""booming spot"".
i must admit that i thought she was joking at first because, seriously, who names their restaurant ""booming spot""?
apparently, the name is fitting as they've literally been the booming spot since they opened earlier this year.

we finally made it in the weekend after thanksgiving with my mom.
we popped in at 3 pm on sunday and they were dead.....because they were closed!
the lady (possibly the owner) who greeted us when we entered seated us anyway and was more than happy to feed our hungry and cold bellies.

i wanted to order the fish head and tofu hot pot but because we came in an hour before they officially opened, the fish head soup wasn't ready yet so i ordered the assorted seafood pot.
my mom had the free range chicken pot.
arvin had the chicken and mushroom pot.

everything was delicious.
the soup base was full of flavor without using msg.
i'm used to the shabu shabu style hot pot where you cook your own stuff but booming spot serves your hot pot with everything in it already.
i don't think i have a preference either way so long as it tastes good.

our only complaint would be that my mom's pot was full of all the ""throw away"" parts of the chicken like the neck, feet, etc.
not that those parts aren't perfectly delicious but it would've been nice to see some breast, wing, leg or thigh parts in the pot as well.

the self serve sauces are one of the highlights of the restaurant.
i love that you can mix your own sauces to complement your meal.

our meal was so comforting and enjoyable and the service was fantastic so we'll definitely be returning...especially as the temperature continues to drop.",pN6pzJR6mK7549M0azoaxg,5,6,4,j7JbTx3rTP1x_ESn9Z7Enw
2267326,2012-10-11,0,jnroKk9qi0FR2bFSkxYZNg,"It's getting cooler in Vegas, and therefore, it is HOT POT SEASON!

I dropped by here with two friends and we ended up sharing two hot pots, and three orders of skewers. Everything was really good. Each of the hot pots were loaded with various vegetables and mushrooms. They could have done with a bit more meat though. I felt that each of the hot pots had too less meat for the amount of soup/veggies inside. 

Next... What's hot pot without SAUCES!  Normally, I like to eat my hotpot with a sauce consisting of peanut butter, cilantro, green onions, sa cha (barbeque) sauce, and an egg. I was sad that they didn't have any peanut butter (instead, I used some sesame paste they had, it kind of did the job), and i had to pay an extra 50 cents for an egg.  Seeing as there was not much meat to begin with, I opted to not get the egg. :(

We had an order of each of the skewers (beef, beef tongue, and lamb). I really loved the beef tongue and the lamb skewers, but the regular beef skewer was just so-so.

All in all, this place is great for a nice warm meal at night, and I would definitely come back to try their other hot pots! =]",RoDHuFS54UO8uw8Xw9Wk3Q,1,0,4,TGgAMnUnIyLFcHgQrSeJIQ
2309499,2012-05-25,0,jnroKk9qi0FR2bFSkxYZNg,"This is the booming spot for complex flavors and homemade goodness.  My wife and I ordered the pork bone marrow and lamb hot pots.  With all the optional add-ins offered, I figured the hot pot might be lacking on ingredients.  It was not.  Plentiful amounts of vegetable and meat, along with the side of rice, made the $10-12 pots a meal.  And with the brewed iced tea, condiment bar and friendly family run service, this is definitely a five star experience.

They were lacking any appetizer selections, but as they are new this may be something in the works.",zXFyGQuMZ6zVaj4yP92vQQ,0,0,5,CAkxj4CUXTtU4I9plxrzIg
2357128,2014-04-01,0,jnroKk9qi0FR2bFSkxYZNg,"For the hot pot fans who had sampled many similar type establishments in So/No California, I think you will be up for a huge disappointment. However, according to many of the locals, there are not many hot pot options exist in Las Vegas.",2kHZHocXo47ZEur30cTy6w,1,0,2,lir06iURHDuK4wLqB8ZJvw
2537558,2015-04-09,0,jnroKk9qi0FR2bFSkxYZNg,"Excellent noodle dishes.  Hand rolled noodle is so tasty.  Everything so fresh here, and it is a clean Chinese restaurant.",p4WyyFWnXuW9tQXExSizfw,3,0,5,4tsxLIr7MOs-rF9mbWxXDw
2569326,2015-11-22,2,jnroKk9qi0FR2bFSkxYZNg,"I wouldn't come here to satisfy your Taiwanese cravings. When you first enter, it is as if you entered into a sauna. You sit yourself down and find yourself taking off your layers as you look at the menu. My friend and I ordered the Pork Bone hot pot and the beef noodle soup. The pork bone hot pot was meh. The soup was not as rich as I had anticipated. The contents within (potato, tomato, pork, napa cabbage, crab chunks, and mushrooms) were soft and unflavorful. It seemed as if it was a jumble of left over/ frozen meat and veggies. The beef noodle soup, on the other hand, was delicious. The noodles were thick and al dente. It seemed home made because the strands were not uniform. The beef was tender. The soup was on point. This place offers a ""sauce bar"" consisting of sesame sauce, taiwanese sauce, chili oil, cilantro, and garlic. It was very limited and the ingredients did not appear to be fresh. I would stay away from the sauce bar if I find my way here again. 

The owner who was our server came once to give us our waters and take our orders and did not check up on us again. We had to flag him down for our checks. This is a very laid back mom-and-pop shop. Don't expect them to be on top of customer service!",g_4zySOI_HisK5rG_2dw6Q,3,1,2,fC6mBnwAWSRIN8MLRgA46Q
2574038,2012-05-24,0,jnroKk9qi0FR2bFSkxYZNg,"This place has super good food.  It's hot pot, but it's also soup.  So, you don't have to cook your own food, rather you get to enjoy delicious food.

The servers are very nice, but don't let them pressure you into odering too much food.  We ordered a chicken and a beef hot pot, and that was enough food for 4.

The chicken....lets just say you should definitely order the beef (the beef is way better).  Also, the coconut water was too...real.  I would suggest ordering any of the other drinks because they were sooo good.

Also, make sure to get spicy on the side so you can add it.  The broth is very good on its own!",zAw_GEU1Sp08e6Hdy3IxKQ,0,0,5,eIVs7mZ42XDuVFaHuxa9LA
2597030,2016-01-17,1,jnroKk9qi0FR2bFSkxYZNg,Broth is tasty and I especially like the wide flat noodles. The noodles taste fresh and look hand cut.  I ordered the pig feet noodle and my husband ordered the lamb noodle soup and some dumplings on the side.,t1YrELAeIDjS70Y5L3We-Q,1,0,4,7XBV4qkvnPcs_VTua0B8SA
2603933,2012-12-26,0,jnroKk9qi0FR2bFSkxYZNg,"The food was delicious and the service outstanding. The owner was extremely hospitable, doing everything possible to accommodate our large party and explaining all of the options available in both Chinese and English for our mixed party. 

Very impressive and cozy restaurant. We basically rolled ourselves out of there. Would definitely come here regularly if we could.",7SHMiL9kQL-djBQYBTV3aA,1,0,5,gSr-4WjzChrZwUZuPArwjA
2609398,2016-01-03,0,jnroKk9qi0FR2bFSkxYZNg,"I love Hot Pot so much, and the Taiwanese Spicy Hot Pot there was super delicious. The soup was really flavorful, and the portions were huge! I ended up sharing mine with my friend, and we both left ridiculously full. It was a really cheap meal for two; I think we both paid around $7? The decorations were also really adorable, and I love the sauce station they have in the back. Definitely coming back again!",sfue39g0U-Gt1lk-PXKYIw,1,0,5,LEbZ0unOWx08lXPQKqVHEQ
2627894,2013-01-15,0,jnroKk9qi0FR2bFSkxYZNg,"OMG.  This place is too good.  When my steaming saucer of pig feet came to me I was in heaven.  And then I added in the lamb slices.  Mmmm.  The only thing that made my meat sauna even better was the addition of their house-made sauces.  

Just ask the guy in charge.  He'll tell you everything you want and more about the food.  Complete with a picture slide show on a tablet of some of their wonderful hot pots.  And the water is so refreshing.  God I hate San Diego water.  

*Reservations are a must.  If you end up waiting, you can always get a ""massage"" next door.",ZLkTG-Q92w-EXKzwkGTmYw,3,0,5,zqI0ZWCpha_nYBbXh2e30w
