,date,funny,business_id,text,user_id,useful,cool,stars,review_id
2669976,2010-06-23,2,kUntNQ5P9IrRzEoHdRxV-w,"Hey Mark Rich! Hi Five Broseph, that's one freaking good pie.  Superior ingredients creating superior taste what a crazy concept, I know it sounds nuts but trust me it works.  Every time I go I get a large pie with pepperoni, sausage, mushroom and ricotta cheese. The flavors are off the hook and they aren't stingee with the toppings.  The ricotta is creamy and flavorful.  My only complaint is that the crust doesn't get as well done as I like it.  Dudes all you got to do is take the pizza off the sheet and lay it directly in the oven for the last 2 to 3 minutes of cooking.  This will give that nice char on the bottom and will prevent your slice from laying there like a flaccid dong the moment you try to pick it up.  I can't speak for the rest of their food, considering I've only tried the pizza. I'm not saying it's the best pie in the valley, however if you live in the northwest and looking for a quick slice this is the place to go.",AoII0-uM9z0EesGnb9YCjQ,3,2,4,kVdABJtNvZgq6G1wCoY6Bw
2705004,2010-08-10,0,kUntNQ5P9IrRzEoHdRxV-w,I like running in here for a quickie lunch with their slice and drink special.,xPySNt9FFPIfE07vcHJxPw,0,0,3,-Y8P4McJ_6pAVj3wlEhtmQ
2829589,2012-04-13,0,kUntNQ5P9IrRzEoHdRxV-w,"Had to stop coming. Pizza is ok, there's much better in town but the service has been awful. Twice we ordered pizza, arrived before our quoted time, only to get cold pizza that had been ready a while. The next time we waited over 30 min past our quoted time for our to go order.",rdz9QHEPoecQ7DJk49ZI-g,0,0,2,SNP50qHiQqq_n_N1Q36SOQ
2851608,2014-05-11,0,kUntNQ5P9IrRzEoHdRxV-w,Centennial location: I usually give Mark Rich's 5 stars.  Had a bad experience as the pizza had almost a cinnamon flavor to it this time and the pizza was no better than any other pizza here in LV.  Usually it tastes great.  None of the regular servers were there and they didn't have their license for beer and wine which they usually have.  Also the garlic knots were much smaller than usual and the sauce is a bit sweeter than usual.,xM3BhfoJHZFbKClx-ij62w,2,1,2,4-8QAiwiRowZxh1uIPbCLw
2879882,2011-11-22,0,kUntNQ5P9IrRzEoHdRxV-w,I only had their stuff pizza here and I'm a fan :-) I really enjoy when the owners care enough to remember their repeat customers too :-),Bj_MarPEKBe2xN12YimekQ,1,0,4,uF42I4GjWVapWYS11jiWjQ
2938878,2014-05-04,1,kUntNQ5P9IrRzEoHdRxV-w,"Pizza is good. Service is good. The BBQ chicken wings are amazing. They have a special with a large pizza and a bucket of chicken wings which is priced at $29. Wife and I take the 4 teen kids and all of us eat for that price. One time a calzone was a little undercooked and they were very good about fixing it immediately and getting us a new one.

The best part about this restaurant is that they have not caved in to the trend of all the chain restaurants in town (e.g., Chili's, Olive Garden, Tony Roma's, Applebee's, Red Lobster, etc.) where they seem to be heating up TV dinners in the microwave and serving them. At Mark Rich the food is cooked fresh.

Enjoy.",QszFudVWwmaQenAMmIDCqQ,0,1,5,TegTb9ZeGv6q7PH8eKs4yQ
3014515,2010-02-18,0,kUntNQ5P9IrRzEoHdRxV-w,"I was trying to find a great place to order pizza from aside from the usual chains.  I came across their website through Google and ordered online.  We ordered one Works pizza, a pepperoni, and some plain wings with ranch sauce.

The pizza was supposed to be NY style, but it's too doughy for me.  I was expecting it to be a thinner pizza, but it was okay.  What we really liked were the wings!  They know how to make them crispy and not oily.  They delivered it nice and hot.  It was so yummy.

If i ever order from them again, I'd just get wings.  They were awesome.",o68A_3bAJTge-ioGXHdxKA,1,1,3,sbu9S1g9g6z_Uxs-PrP34Q
3103108,2015-05-07,0,kUntNQ5P9IrRzEoHdRxV-w,"I ordered  food  to be delivered to my job and waited over and hour for it , when I called to get a status on the delivery , the guy tells me the driver already delivered it, I told the man on the phone I had not received it , so he then tells me someone signed for it , mind you I paid with a credit card He clearly didnt check my ID when someone signed for it , At this point the manager tells me he cant do anything about it that it was delivered and he cant refund my money , so I am paying for someone else to eat. He was so unprofessional about it and completely unhelpful, He refused to credit my card the money I spent on food I clearly did not receive , I have worked in a restaurant  just like this and  the owner I worked for  obviously cared about reviews like this and always made the customer happy , I will make sure that the area businesses know what this restaurant does to the customers , Im going to tell my friends and they can tell their friends and so on. Hope it was worth it !",95_kb-PJ6-txZTPBut3ivQ,0,0,1,PHr1nKRCtVI1AUg0cLogNQ
3112962,2012-05-29,0,kUntNQ5P9IrRzEoHdRxV-w,"Great pizza, made fresh. Chicken parmesan is awesome. The stromboli is great also. His red sauce is awesome, great local place to dine in or take out.",7IX-t73xfZdI1PH52rgYgQ,0,0,5,Az3usS35encgtXqI2xbUdQ
3143775,2009-11-30,0,kUntNQ5P9IrRzEoHdRxV-w,"The pizza was as bad as the service. They did not greet me when I came in, forgot half of my order (unapologetically) and didn't so much as thank me.

The pizza had sweet sauce, soggy sweet crust and was about as close to authentic New York pizza as dominos. I moved to Las Vegas from New York. If you want authentic New York pizza and good service, check out Rocco's.",II6YjclTbesSBgsV4teGRQ,1,1,1,ddO-kGCclobvqhs-oDDghA
3149577,2010-10-19,0,kUntNQ5P9IrRzEoHdRxV-w,Just tried their gluten free pizza. It was pricey but excellent. It seems they make their own crust instead of using the tiny frozen ones that most places use. I printed out a buy one get one coupon from the Entertainment Book online so I got a great deal.,hb4n7QXHl6m7PBOfFeJLlQ,0,0,5,o7VlH9hfTbVwdeP1w9cNXw
3283265,2011-05-09,0,kUntNQ5P9IrRzEoHdRxV-w,"Little family owned place in a walmart shopping center.Stopped here for noms after visiting a comic shop a few stores down. Service was really friendly here, but I expect they usually haves in the evening. The place was filling up fast when we left. Menu is nice and big with several pizza options, stuffed, new york, and Sicilian. We decided on the stuffed and were not disappointed. The only thing that I could recommend is that they make the bottom of the crust on the stuffed just SLIGHTLY thicker, it tended to get a soggy.",YJsjA7msCI4-Dh8_pDcSYQ,0,0,4,TuM_zbxE4QOcXjEO4hB41A
3290966,2015-09-11,0,kUntNQ5P9IrRzEoHdRxV-w,"I thought being a privately owned pizza restaurant they'd have a good recipe. Sadly I was very disappointed. Paid $25 for a medium pizza and wings and that was with the special. The wings were in this kind of breading which was soggy and unfavorable. The pizza lacked much flavor and wasn't very good. Delivery was fairly timely, about 30 mins but then again it was also early Thursday evening. I probably won't be back. For that kind of money I'd rather go elsewhere and get more quality for my dollar.",LvYnN2EbDEyaIWduLBIZPg,1,1,2,e9PscJ6iygG6M1r9ZxAvsg
3519824,2014-10-29,33,kUntNQ5P9IrRzEoHdRxV-w,"I stopped in for lunch to check out this new pizza place. Mark Rich's NY Pizza and Pasta used to be here. I recognized the girl at the register when I walked in, so I asked her if they just changed the name, but she said that Mark Rich's recipes transferred over when the new owners bought the business in this location. Mark Rich's NY Pizza and Pasta still currently operates another location, using the same recipes and ingredients, but has nothing at all to do with Giani's NY Pizza and Pasta.

I ordered the lunch special for $5.95 which was 2 slices of cheese pizza and a drink. The pizza slices were a good size. I didn't care for the pizza though. They might be using the same recipe the previous owner used, but it doesn't mean it comes out the same and it just didn't for me. The pizza was somewhat burnt and had a stale taste to it like maybe it was from the day before. This is a real disappointment for me because I regularly shop in the shopping center Giani's is in and enjoyed stopping for pizza. Good thing ""Above the Crust"" is just around the corner though on Ann Rd so there still is a solid pizza joint in the neighborhood I can go to.",Fv0e9RIV9jw5TX3ctA1WbA,48,36,1,BUznjmR1-gTc9D9g8V0Ovw
3558452,2010-08-15,0,kUntNQ5P9IrRzEoHdRxV-w,"This has to be my favorite family Italian restaurant since moving to Las Vegas 5 years ago. Great service, the food is classic NY style pizza as close to a NY pizza as I can remember. The pasta is home made and they cater to people with gluten free pizza dough and soon pasta. The pizza maker is tossing dough right before your eyes. Dinner specials every night. I had the Chicken Marcela overall very good a bit on the salty side but very good. My wife had stuffed shells that she cleaned the plate. Staff was very friendly and will take the time to just have a conversation with you. I really like this place.",MyVzMcT-z2vXC3OSuEFeuw,1,0,4,AQokiwA8uUDJcw5JnV96hg
3666420,2013-06-08,0,kUntNQ5P9IrRzEoHdRxV-w,Don't order the gluten free. Obviously they don't know that you have to bake the crust first!  Under the cheeses my pizza had the consistency of oatmeal ! Yuck !,cnntN_K1cuvb_6GF8LjoCg,0,0,1,QXap8k036dHhewPJ38WrBA
3714671,2015-01-28,1,kUntNQ5P9IrRzEoHdRxV-w,"I came in after karate. Good service and the food surprised me. Wings, fries and pizza all excellent!",njFl1xQYG5Oa2bC-BMM4dw,0,0,4,nBSaqoIcMRIQHt9qltkbYg
3795223,2011-09-10,0,kUntNQ5P9IrRzEoHdRxV-w,"I have eating @ mark Rich's for years and I have found it to be decnt family fare.  The pizza to me is good espeically the sausage,italian beef and the homemade ranch dressing is yummy.  there are Not that many places in vegas that are truly kids friendly and mark's does this well",NHKZNjGtbkVWRncQrEKHTQ,0,0,4,CjflKirb3BxTzxDNChm8qw
3827024,2010-06-29,6,kUntNQ5P9IrRzEoHdRxV-w,"I've ordered delivery from this place and I don't recommend it because the Pizza will be soggy when it arrives....that's like most NY Style Pizzas.....because of the Thin Crust, it can't survive a delivery without getting soggy.

I wanted to give it a try dining in.....so I stopped by today for lunch.  I intended to order 2 Slices of Pizza....but after reviewing the menu, I couldn't help myself and ordered a NY Hot Dog (Dog, Fries, Green Peppers, Onions, Parmesan Cheese, Italian Roll) and a Slice of Sausage Pizza.

The Sausage Pizza Slice came out first.....it was loaded with Sausage....too much in my opinion (see pics).  I also thought the Cheese to Sauce ratio was off.....not enough sauce, the Pizza tasted dry.  The Crust was good and cooked well.....if I was rating just on the Pizza, this place would get 2 or 3 Stars.

The NY Hot Dog on the other hand was Fantastic!  The all beef dog was juicy & full of flavor.  The combination of the Fries, Green Peppers, and Onions made the sandwich taste a little like Breakfast.  It was soooo good!  I could have eaten 2 of them!  This NY Hot Dog is what bumped this place to 4 Stars for me since I've never seen this item anywhere else.

Overall, I enjoyed my experience here.  There are other items on the extensive menu that I want to try.

Will I return?  Fah-getta-bout It, of course!  Probably not for the Pizza though.....ironic.",QJI9OSEn6ujRCtrX06vs1w,5,5,4,UG3FOHeW1bm7_KuP5yIIQw
3862832,2013-08-18,1,kUntNQ5P9IrRzEoHdRxV-w,"This place is amazing! Their garlic knots are so delicious, the pizza is pretty good & the service is good. I can't complain!",fo7KIcXhZf1FA-yiI8TesQ,0,1,5,Zi4czC-VDxDqyokXuN2pXQ
3875784,2012-11-01,1,kUntNQ5P9IrRzEoHdRxV-w,"OK I have to say, I'm really starting to lose faith in the YELP community. 
Decided to go out for pizza with some friends tonight and since I'm still learning my way around out here, and starting to see that sometimes yelpers will lead you astray, I asked a friend of mine if this place was any good since its kinda close by. She said it was but also suggested another place that was equal distance away. Since I now had a choice I decided to see what yelpers had to say about both.
Both had the same amount of stars and good and bad ratings. So the deciding factor to come here was that my hubs likes thin crust, so we were directed here. I liked that they offered GLUTEN FREE pasta and pizza. 
Our server was super nice with just a little sass that I actually fell in love with right away! It made me feel comfortable and at home. 
I asked if the salads were big and she said s large would feed 3 people. I honestly did not believe her and ordered the NY CHICKEN SALAD for myself and we also ordered a XLarge combo pizza with bell peppers, pepperoni, mushrooms, and olives.  The salad was HUGE!! I brought 1/2 of it home! And there was so many fresh crispy veggies on it! More than actual lettuce, which was fine with me! The pizza was DELICIOUS! The veggies on the pizza were fresh and perfectly cooked and everything was perfect! Not one bit was soggy like I had read in other reviews. In fact, everything about this place was FABULOUS! 
Its not a stand alone resturaunt like I expected, Infact its wedged between a radio shack and a port of subs. So when we walked up and I saw it was just a bunch of tables inside, I thought ""great, loud, noisy, and uncomfortable!"" But it was just the opposite. Surprisingly quiet, pleasant, and staff was attentive   and the place was FULL! It must have been that everyone was eating because the food was so delicious instead of talking. 
Like I said, our service was great, and for all that food for 5 of us our bill was 30 bucks! 
We will definitely be regulars here. It was AMAZING!",jJAomrEIMZSSNC8WJrTL4g,2,0,5,uhfXC6DMVCPMhDdwuepIAg
3963992,2015-03-29,0,kUntNQ5P9IrRzEoHdRxV-w,"Tomight was our first time visiting Giani's New York Style Pizza.  Flavor was just ok, Xtra Pepperoni & sausage, bacon  and mushrooms.
The crust was way way undercooked. With GF crust with the best texture and flavor longer cooking time is required, the crust should be baked like cracker so it is crispy, but not hard.
We will try it again, but will give more direction.,but please try it

Where Giani's scores an A is with their CUSTOMER SERVICE. The young man working the counter was exceptional at his job",0ZhUhVFEaDcSuQuCGHiBXQ,0,0,4,68-ZZVPo3mOgIIfgQGSKEA
4023393,2013-10-13,1,kUntNQ5P9IrRzEoHdRxV-w,We came for lunch. Ordered the lunch special spaghetti w/ meat sauce & garlic bread. Let me just say I love the meat sauce! It's a traditional sauce instead of the kind out the jar. Also had the antipasti salad small; which is basically a large salad. Each bite of the salad had a different veggie or meat! Was all very good. I gave four stars because the service was slow... Usually though we have faster service.,bJaz5L61e3UrtRDb9dIWKg,0,0,4,QIUdyDHxvfTJmiKYzMHVjA
4049873,2015-01-06,1,kUntNQ5P9IrRzEoHdRxV-w,"This place was great when it was called Mark Rich's NY Pizza.  The new place has gone way downhill.  I used to love their pizza, but now it's way below average.  I used to drive miles out of my way to eat here, but no more.  It's just not the same.  The staff changed and I guess they changed cooks.",Gab1_sLsjJLAJojoFd-d-g,4,2,2,Wg4qXD6HEUjtLnm5NPozrQ
4059626,2010-02-10,1,kUntNQ5P9IrRzEoHdRxV-w,"I've been a semi-regular here for a long, long time... I like their cheese pizza, but if you add toppings it does tend to get a little soft in the middle. Their salad is soooo good if you mix ranch with their italian dressing. I pine for it. Their spaghetti is delish and their lunch specials are a good deal. My boyfriend loves the stromboli more than he loves me. When I'm thinking of going out for lunch, Mark Rich's is usually in the top 5 choices.

Service has usually been good, except for once or twice. But once or twice in 5+ years? not too shabby, M.R.",A0UVmr5DAVr6rQJYIfNsDA,0,0,5,nr7qpX3TdRyUAl1JygROiQ
4116863,2015-03-31,1,kUntNQ5P9IrRzEoHdRxV-w,Good lunch specials. I had the side salad and slice of cheese. The rest of the fam had 2 slices of cheese. It was filling. In fact my daughter didn't even finish both her slices. Daily specials also. Would defiantly come back.,5KzHxAaHgG0UCUQiaXH5oQ,0,1,4,kaqSulRyyh1YuD1h_85Spg
4134622,2010-08-18,0,kUntNQ5P9IrRzEoHdRxV-w,"I have ate at Mark Rich's numerous times, due to the fact that I lived across the street and used to work next door. If you are eating in or picking up and planning on not traveling far before you eat, the food is great. However, there is something that doesnt work out when delivering or picking up and having a more than 3 minute drive home. If you get something breaded, it get soggy. There have been a few times where we have had pizza delivered and had to reheat it. If you chose to eat here, make sure you eat inside the first time so you dont get a bad taste afterwards and not want to go back. Aside from the food, they always have very courteous employees.",2KXR93JrBu2FOjFIhy0QzA,0,0,3,jcsnTokL3ghEsNzuXsVTTg
4175461,2013-12-17,0,kUntNQ5P9IrRzEoHdRxV-w,I ordered a half-pepperoni and half-cheese pizza for my first visit yesterday.  Very fair price and very close to my house.  I wish this place was next to bars because it'd be the perfect pizza to smash after being hammered!  Mark was there and he is a super nice guy.  I used to work with his daughter so I guess niceness runs in the family.,vepRbwKOq3KuN7VSB3PEcA,0,0,5,zEQgsD4DUYF_R3PFk_MrKg
4222948,2008-11-22,0,kUntNQ5P9IrRzEoHdRxV-w,"Pretty darn good pizza, the BEST chicken cesar salad, yummy pasta and great soup!",CtD3xma3B9OBXFo4H1X0ag,0,1,5,wkUdAdbQHSw60dDzBLHyCw
4247367,2010-10-14,0,kUntNQ5P9IrRzEoHdRxV-w,"I have always got the pizza here take-out, but I'm sure there isn't a massive difference at all.  The pizza is good when you first start eating it, but don't let it get cold.  Something strange happens to it and the pizza becomes inedible to me.  And since pizza is one of maybe three foods I can eat that is a day or two old.  That is a big no no.  Despite that I'm sure the best thing to do at this place is to eat it fresh.",30Apfs9u9-kqQE4qHEWqUw,1,1,3,oHoHDUOyqF5446PqU2ITjg
4343770,2013-10-14,1,kUntNQ5P9IrRzEoHdRxV-w,"Great pizza, Very good atmosphere.  My favorite pizza joint in the area.",FTPe7VVwGDM8j9csFhShWA,0,0,5,8Bkc23pqKKX-dRjCS0ZVww
4381398,2011-12-06,0,kUntNQ5P9IrRzEoHdRxV-w,"First time there and my first review. I tried this place because I had a buy one get one free coupon. I ordered a large with pepperoni and sausage and another with chicken and bacon. The proportions of all the ingredients was spot on, but it felt that they were slightly lacking in strength of flavor. The sausage and pepperoni were slightly bland. The chicken was as well. I did taste a slightly herby overtone in the chicken. Not exactly sure what it was, but I'm leaning towards oregano or rosemary. Not horrible, but not exactly playing well with the other flavors. My biggest complaint would be the crust. It's properly cooked, but still ends up being soggy. My preference is for a crust with bits of charred crust. I like the flavor, texture and structure that it provides. If it go back I'll try asking for a well done crust. All in all, this place wasn't horrible nor was it spectacular. I wouldn't be opposed to eating here again, but I also wouldn't go out of my way just to eat here.",sNN8w_aPSZv-E-KUoQpZug,0,0,3,Zjjo2q1JPrwV9YYs3F_jcQ
4417524,2014-04-28,1,kUntNQ5P9IrRzEoHdRxV-w,I always get the chicken Marsala her so good! Other favorites are spaghetti and meatball and chicken alfredo. I am not a big pizza eater but my family is so to find a place where I can have good pasta and they can eat pizza is a definite plus! Service is always really good and I have never had to wait to be seated.,qnWm-keeZ55NSgX6t6vRzw,1,0,5,foDzkA3yYlhX9152l1Pgsg
4440090,2014-11-22,0,kUntNQ5P9IrRzEoHdRxV-w,"Never ever order from the Tropical location they are closed! Although they have no problem taking your money. We sat and waited for our order for over an hour, then someone called and said: ""We did not know if this was for delivery or pickup. Then we told them delivery. Okay. About 10 minutes later they call and say, so sorry the location you order from is closed. If you don't come to our new location and pick it up, you will not be getting your food. Oh and also we can't refund your $60. No food, no money. Happy birthday to me. Thanks a lot for nothing.",W4xequhmTfNQZxKUYrWbFg,1,0,1,Gln2z7QdKB3QGdofWfjpmw
4486725,2013-07-10,0,kUntNQ5P9IrRzEoHdRxV-w,"We ordered on 6/18 through grubhub and the food is average. The garlic bread was great but the pizza was a little different...stuffed crust means, not the crust only stuffed but all the ingredients are stuffed in between two layers.  Wasn't too impressed with it, but it was average.",jhPqCicJKqBdCHj29Q81iA,0,0,3,ueNaKEHYt5abuVlsRI1afg
4795454,2014-08-19,0,kUntNQ5P9IrRzEoHdRxV-w,"On my first trip to Mark Rich's I tried a small personal pizza with pineapple, green olives, bell peppers, and onion. I asked for the then crust and was a little disappointed the crust was too floppy to eat with one hand. However, the dough was tasty and the toppings fresh and plentiful. 

I also tried the Caesar salad, which had a lighter dressing than I'm used to, less creamy and more of a vinaigrette. I tasted my friends' seafood linguini (Pasta Christopher) with pink sauce and Linda's Linguini, noodles in red clam sauce.

The Christopher was definitely better and I liked the creamy but lightly fishy tasting sauce. Because we were celebrating a birthday they brought us a candle cannoli and it was rich and sweet.

Overall I liked this place, the service was decent, and the prices good. It didn't jump out as spectacular but overall a good experience.",OYjc1fiTDkALWeOxHWQlHw,0,0,3,Y9pRwVZGQSPVKKGlxDcj5g
4957159,2011-01-08,0,kUntNQ5P9IrRzEoHdRxV-w,"My girlfriend and I decided to try a new local pizza place, and we bought the gift certificate from Restaurant.com. We are definitely coming back here. The food was amazing with very reasonable prices. Our large pizza with an appetizer was right around $24 before the discount. We even had leftover pizza that I'm enjoying as I write this. Our server was very attentive and helpful. We like to drink a lot of water, and she brought us a whole pitcher of water so we could always be topped off. We marveled at every dish she brought to other tables. The food has large portions and it all looks so good. We will definitely be going back.

The only bad thing about this restaurant -- and hence giving it four instead of five stars -- was the fact that the restaurant wasn't very warm. We were seated near the door, and every time it opened the room got very cold. It never really warmed up. We had to wear our coats the whole time to stay warm. Everything else about this place was stellar. I recommend experiencing it for yourself.",jnBBQOyN1apWBSsZkzFnCQ,0,0,4,G-Q372G8WgGCITjWoEF4xg
4988128,2013-03-17,0,kUntNQ5P9IrRzEoHdRxV-w,"Love the pizza here. Great eat in lunch special. Reasonable prices, and a good quiet spot for yummy pizza. The inside decor is boring and bland, nothing to write home about definitely, but the food and staff make up for it.",PCh486d3OzWRh6NoPMm0XA,0,0,4,YbDCt2Ahwl3987XBGe8oAw
5084163,2013-04-12,4,kUntNQ5P9IrRzEoHdRxV-w,"This place is so ASNFPI#&$*#$Y YES!
If you want to eat at this place, make sure you go to the one in Centennial Center, it's awesome. Can't say the same for the Summerlin one.
I've been going here since high school, it's always so much fun and the environment is very family-oriented and friendly. I remember a few years back they used to have this balloon guy that came in and made all this crazy shit, but haven't seen him recently, so me and my friends probably scared him off.
The food is a reasonable price and super good, the pizza is what this place is famous for, but the pastas and everything else is also just as delicious! I take my mom here all the time. The waitresses are so funny and they're always so nice, it's nice to see her have a good time for a change.
The place never gets too crowded, so it's often pretty quiet in here and you can actually hear the conversations with each other. It's Seat-Yourself policy unless you have 5 or more people, so you can even pick where you want to sit.

This is truely one of the only places I'm a regular at, I recommend it to anyone!",4N-HU_T32hLENLntsNKNBg,5,4,5,eKK3ern_UGsXiUdGcWm5PQ
5159649,2015-09-02,1,kUntNQ5P9IrRzEoHdRxV-w,Love this place we have been eating here for a few years and can't beat the combo for football  sundays.,hKynoUBN0Wl79NAXHRZ4jg,0,0,5,v_L_E05kvkXojAMQXh_mdQ
