,date,funny,business_id,text,user_id,useful,cool,stars,review_id
5278206,2014-06-03,0,kUntNQ5P9IrRzEoHdRxV-w,"It's safe to say that I am a huge fan of Mark Rich's NY Pizza. This cozy restaurant is located in Centennial Center in the Sam's Club parking lot. The restaurant is small-ish in size and the seating area is pretty compact.  Don't worry though, the noise level inside always is comfortably mellow and you still have plenty of elbow room. The walls are completely covered in pictures and hallmarks of the East Coast, building on the overall vibe of the place.  

You must order the garlic knots! My husband and I are nuts for Mark Rich's garlic knots ($2.99). They're soft, thick, and loaded with garlic. I can't go here without having an order of them. I'd also recommend the eggplant parmigiana hot sub ($7. 95) with a side order of fries ($1.50). My husband's favorite is the schwarma pita ($6.99). All the food tastes fresh and homemade. The food comes out with lightning speed too. We used a restaurant.com certificate and our total came to $13! Mark Rich's is crazy affordable and has awesome food to boot.

The service is always great. The servers are attentive and very friendly,  yet casual too. The garlic knots will ALWAYS keep me coming back for more.",U-nR7ND8CDN2x8ia73CH2Q,1,1,4,SF4NIlRX_s2tEF7XY-Fq8g
5300152,2011-12-14,0,kUntNQ5P9IrRzEoHdRxV-w,"I'm a fan of Mark Rich's New York Pizza.  We usually get a 12"" supreme style pizza with olives, pepperoni, sausage, mushrooms,  peppers, and onions.  Every meal I've had here has been delicious, service quick and friendly, and at a good price.  I'll not argue how ""authentic"" to the New York style they are as I'm no expert however, I'm an expert in taste and I've enjoyed all the pizza I've had here!",FbDqt_QhPnWv4FsU9hkkvg,0,0,4,Gv0swdSdaGk5-0PjzVqgIQ
5320062,2008-06-27,1,kUntNQ5P9IrRzEoHdRxV-w,"A friend told me about Mark Rich's several months ago, but i've never had to opportunity to visit the Centennial Hills location.  Yesterday, I decided to stop by for my lunch break.

I'm definitely coming back again!

I ordered 2 slices with sausage and pepperoni and a drink.  It was definitely the best NY style pizza I've ever tasted.  The service was quick and friendly, and I felt right at home with the ambience.

I look forward to trying other items on the menu in the future.",BJi8obH6QLPlHWFIvbCG5g,0,0,5,EGwzEiJ4lxYjCJFY0QfpDw
5326512,2014-03-22,0,kUntNQ5P9IrRzEoHdRxV-w,"Ok, I'm sure there are several other reviews on here from native New Yorkers and I may sound a bit redundant but here it goes...

THE FOOD: This' New York' pizza is just ok. Its about equal to your below average pizza in the city. Had the two cheese slice special for $5.95, a very good price as it comes with a drink. The slices are slightly smaller than your average NY slice but not by much. The crust And cheese were slightly burnt. I felt the sauce was just right. Not too much, not too little. Not too sweet, not too tangy.  It wasn't very hot when they served it.

THE SERVICE: Pretty good. Nothing special but just the right amount of attention. Welcoming, friendly, courteous and professional. 

THE ESTABLISHMENT: Very accessible in a great commercial area in Cenntenial Hills. Very clean and cheery. They have a couple of TV's with the game on. Lots of NY flare and memorabilia. The lighting US a little low though. Most importantly they have beer and FREE WIFI!",3MwccEgTNoXgc-en9e7Qzw,1,2,3,SmB1mVu4JZVtwZ9_R9h69w
5471010,2012-12-01,1,kUntNQ5P9IrRzEoHdRxV-w,"I love this place. They have such great pizza, and it's only down the street! Their garlic knots with mozzarella cheese are to die for! Their veggie pizza is downright amazing, and they have the best cannolis I have had. They have a very good lunch deal (until 4pm) with six options for 5.65$ with a drink. My favorite lunch option is either the two slices of cheese pizza, or the one cheese slice and a small salad. They have an extra large cheese pizza  (18 inches) for 16$, which is the best deal in the neighborhood. 
They also serve gluten free pizza here.",g8_8roieVRwGJVTpNOgbYw,3,0,5,F4alGBLYYpcULY8HHp-RMA
5528023,2011-03-04,1,kUntNQ5P9IrRzEoHdRxV-w,"My favorite place for lunch specials. I always get the spaghetti marinara, and my mom loves the meat sauce. Great prices on salads for the group, and a slice of cheese pizza on the side is less than two bucks for awesome crispy cheese pizza. Homemade salad dressings are awesome. Me and my sister have made this our regular place for years before we moved across town.

My ONLY complaint is the last couple times I went before I moved they have new servers...I always get a small side of marinara for my pizza and use leftover salad ranch...its just awesome to dip. The one new servers charges us for EVERYTHING. We always get a big salad to share, but get a couple different dressings because not everyone wants ranch. Getting charged 1.50 for a side of Italian is lame. So as much as I love this place, by the time I moved I was kinda turned off and stopped going in.",rpWCcNQD7nGVUYoU6vzCFw,1,1,4,JyeqwL6G1g4fgqPvGTxWJw
5549989,2010-04-03,0,kUntNQ5P9IrRzEoHdRxV-w,"I came here strictly because I have had a restaurant.com certificate sitting around for 6 months for this place and wanted to use it.  Little did I know that it was all the way the hell in the Centennial Hills area and it was a long ass drive.  At least I got to get familiar to a new area of Vegas I have never seen before.

It wasn't really worth going out of my way to go here, however I would like it better if it was a neighborhood joint for me.  I didn't feel like eating pizza so I had the wings and fries, and I didn't like the wings at all.  I asked them not to drown them in hot sauce when they asked me if i wanted the sauce on the chicken or on the side, and they ended up giving me a bare faint of sauce, which ruined the whole entree for me.  Wings need to be tossed in sauce the moment they come out of the fryer.  When I told the waitress the wings didn't really have sauce on them she brought me some on the side, and they still didn't taste like they should after they are tossed in sauce out of the fryer.  Yes I'm picky about wings.

Anyway, husband had a medium pepperoni and although a little greasy, was pretty good.  If this was a neighborhood place for us that delivered, this would be the best pizza ever, but being that we trekked from the Henderson area, we weren't thrilled with the meal overall.

However, this was a complete bargain with our restaurant.com certificate.  We only paid $15 for two drinks, medium pepperoni, and my wings/fries.  We won't be coming here again unless we already happen to be in the area, however.",PomQayG1WhMxeSl1zohAUA,2,0,3,aWRA8Am_URZTjVWrx16HWQ
5600084,2010-12-06,1,kUntNQ5P9IrRzEoHdRxV-w,"Maybe slightly higher than a 3 star - but not a four star.  

I have been here about 5 times.  It is a small pizzaria with a New York Theme.  The staff is very friendly.  The prices are very reasnoable.  It was cool because we ordered a ""pitcher"" of root beer - pitchers of root beer take me back to the pizzaria days of my youth...

They have decent food.  My major hang up with this place is the pizza is soggy in the middle part.  You can't fold it properly or even lift up.  The pizza tastes good but it is just to soggy - almost wet in the center.  There are 2 ways to eat it; you have to fold the point end towards the crust or you are reduced to eating the pizza with a fork!!! 

Also, Ordered a cannoli.  It was very good.  They might even make the shell homemade (if this can be confirmed I would rate this a 4).  It was the right color and it wasn't perfectly round like the a factory made shell.  I told the waitress - ""Leave the gun - take the cannoli.""  She had no idea what I was talking about.  

So - It isn't the best in town, but it will cure a pizza fix if you are in the northwest part of town.",L15JCA18Ib_vMUVJILxiSw,3,2,3,7wMZnyfRJiHDKncYtohd_w
5659387,2010-11-29,0,kUntNQ5P9IrRzEoHdRxV-w,"Ate here yesterday as a group of 10 after we hiked at Red Rock. I'm not sure if any of us had been there before, but our cars were parked in the lot and we were a bit hungry so we voted between this place and In-N-Out and pizza prevailed. We were seated right away by the kitchen around 3 ish. 

I don't know about you, but I HATE splitting things as a group. The group wanted to order three large pizzas to split between us along with garlic bread. Ugh, I always feel like I'm going to have to throw down $10 for two slices or some other nonsense. I decided to opt out of the pizza and garlic bread sharing (and bill splitting) by ordering an Italian beef sandwich and fries that came with au jus (hence the reason I ordered it) and jardinere for $6.99.  The fries were thick and gave them to a guy at our table and I ate the sandwich. It was filled with a ton of meat, but I wish there had been a bit more aus jus and jardinere. It was really yummy and I'd for sure order it again, subbing onion rings for an extra charge, though. 

Apparently the pizzas and garlic bread (half with cheese, half not) was really good, according to the rest of the group. One of my friends from Jersey also opted out of the pizza sharing and got the $5.65 two slices of cheese pizza and a sprite and she said it was ok. 

The place is covered by family photos and the owner (or I assumed he was the owner) told us who the various people were on the wall.",OLn8EvPsu4hNug8V5PF2jA,1,0,3,f3jzMG2vNqL7QeMXoUL5jQ
5668453,2011-07-11,0,kUntNQ5P9IrRzEoHdRxV-w,Love the finger bucket! Pure heaven and the pizza rocks!!!,BtP80pkEWeW3aypxKfWE9g,0,0,5,f8vG6A0NmvHAfE-hRb1w7w
5670083,2015-05-03,0,kUntNQ5P9IrRzEoHdRxV-w,"I'm very disappointed and I will never order from here again.I called to place a order(every time I've called,I have ALWAYS been put on hold) to be delivered and was told that it was going to be  a hr and 20min.for delivery ,so I said ok I will come pick it up.he said it will be 40 min.(that's still a long time,but ok)when I arrived at the place to pick up my order,I was right on time(40 min).I was informed that it was still going to be another 15 min.(what!!!!!!!!!!!!!)my Pizzas were sitting on top of their oven,but my wing,fingers and a salad were not ready...he therefore proceeded to have me pay(when I called to place the order in the beginning,he took my card info)I told him that I already gave you my info and I believe you already charged me.....he came back with my cc info on a scratch piece of paper,it was somewhere in the back. (scary,for someone to get that out of the garbage)..about 20 min later,my food was ready and I asked for some blue cheese and he said that's a extra charge(are you f ing kidding me,you already had me waiting a long ass time for my food)I said ok, never mind and as I was leaving I heard him say to another customer in there""what does she expect,its a fight night""seriously,I have been ordering and getting food from you for a long ass time and I have never been so offended it all my life.....you just lost a long time customer",Gh5ihX-ihyuu7Rc2mzrxQQ,1,1,1,AntUivGZgBUpoDZQXjkXuw
5707493,2012-10-10,0,kUntNQ5P9IrRzEoHdRxV-w,"My first visit here and i was going to use the groupon i bought, but they had a special of half off any pizza so i decided to try that and save the groupon for another time. I can say my daughter and i enjoyed the pizza, far from the usual papa johns or pizza hut. she usually doesnt like thin crust but loved it. and while my only complaint is that the end of the pizza was a lil soggy but that was due to the fresh vegetables. Overall it was good enough for me to try again.",LSw5J-mDFXr75jmYmRnWow,1,0,3,0VfklBNvGpW26YCF5frIbQ
5786203,2009-05-21,0,kUntNQ5P9IrRzEoHdRxV-w,This might be the best pizza I have ever eaten. New York style thin crust with high quality ingredients on top. They have thick crust selections as well. New York theme and decor. Very friendly and good service. The place is packed in the evening even on weekdays. Superb price/value on food and drinks. Located across 215 about 20 minutes from the strip in the suburbs of Las Vegas. If you go by cab be prepared to wait a long time for one to pick you up.  There are not many destinations for cab drivers in this part of Vegas so they do not like driving one way without a fare to pick you up.,B8c17RLH6AaglKN-jW4RwQ,0,0,4,x8yuf9QpUDxdjES77Gilaw
5842126,2013-11-02,1,kUntNQ5P9IrRzEoHdRxV-w,"What this country is lacking is more small businesses like this place. I can't even begin to tell you all how wonderfully we were treated here. Not to mention that the food is spectacular!
Our server, Tasha, was sweet and helpful. Who I'm assuming is the owner, ""Mr. Rich"", walked around and greeted each table with a silly pizza puppet making my kids giggle.
We WILL be back and an planning on making this our new little family spot.",h4X30KkTuSOX9hxmZDsNZQ,0,2,5,es06JfCvHCTAS1sriSeRxw
5929394,2009-05-15,0,kUntNQ5P9IrRzEoHdRxV-w,"The prices are very fair, the pastas are good, and the pizzas are great.  The restaurant is very small, so sometimes you feel like you are eating in your neighbor's lap.  The help is always friendly, if a little familiar.",5uFncIskfmLIV1FI-dNY5Q,0,0,4,G8eEiXpkV5Ibwk8JVVMIjQ
5962184,2010-12-29,0,kUntNQ5P9IrRzEoHdRxV-w,"I am not a local, but I suspect this gem stays in business thanks to many loyal local fans.  We tried the salad, 2 types of pizza, and a chicken dish.  Everything was fresh, nicely spiced, and served hot and on-time.  The atmosphere was comfortable and quaint, with authentic New York photos and decorations. Good food, good service, and fair prices - how many other places have this perfect combo?",MX6_V3sV1Dz0gYIUW4_MsA,0,0,4,18HYhwwBdPoBdDolux9E-w
