,date,funny,business_id,text,user_id,useful,cool,stars,review_id
1632476,2017-12-30,1,LwQB9H3jZ9wTk24Lr-AnZQ,"I would give the food 3 stars but service 5 stars for this place. We came here on Christmas day without reservation, so we decided to sit on the bar instead of waiting for a table. We ordered Hand Cut Fettuccini with Wild Mushroom and Gulf Shrimp, Burratta, Calabrian Chile, and Mint wood fired pizza for both of us. 

The fettuccini had great flavor however i felt the dish was lukewarm and did not seem to be delivered right after it was made.The paste did tate like it was made on site rather than from a box..the fettuccini texture is different from other pasta restaurant that i had been to...second dish was  the wood fired pizza we ordered, the flavor is great but the cheese was MISSING..we had to ask them to re-make it..the pizza flavor is very unique as the shrimp is very flavorful and complemented well with the chile and mint. 

Our server Tiffany did an incredible job to make sure that she provided excellent customer service even though we were sitting on the bar. .initially we were neglected but later realized that our server/bartender had one person short and she was the only person who was making drinks for the entire restaurant and also trying to take orders/serve all the guests sitting at the bar table. However, by end of the our meal we were extremely satisfied with the service she had provided. She consistently asked us how we are doing and how was the food. She definitely went above and beyond to make sure we had a great Christmas meal. She definitely worked really hard to make sure everyone sitting on the bar getting exceptional customer service despite how busy she was. 

Overall, i did have a great dining experience here.",h949ZwQiQAXD5GR3G5wMCQ,1,1,4,sIUVUWtfKCD436ees0zPZw
1634041,2012-12-19,0,LwQB9H3jZ9wTk24Lr-AnZQ,"I came in just in time for the 20th anniversary pricing..which I still think was slightly overpriced. We sat pretty close to the kitchen.... for a minute I thought I was at Gordon Ramsey's restaurant and we were on TV,  as the uncomfortably loud yelling from the chef almost had us get up and leave the establishment. I love the passion and appreciate they want the food to come out right, but I prefer a better atmosphere then eating at a yelling match. 
The server was really nice, but we arrived at 6:40 and the people seated after us were done 30 minutes before us. We received our meal at 7:45 and weren't to thrilled about the long wait. It was seriously getting to the point were I was about to politely ask the server what was taking so long
The complimentary bread was def a good thing and held us over. 
The app was the Tempura Shrimp with some sort of lime cilantro cole slaw $12 (?). I def liked it .....though it wasn't anything too out of the normal. 
I ordered the Lamb which was cooked perfectly and vegetables were mouth watering. I'm just not sure I'd pay $36 again for that. 
The duck was somewhat overcooked, unseasoned and dry... Though everything else on the plate was terrific. 
I'm glad Spago offered this menu
I'm not sure if we got the short end of the stick this night but I've eaten at less known places with a better experience and better food as well. I would not want to pay for the Wolfgang Puck price and experience if this were to be my outcome again. I truly wish this would have been a better review.",MG8BlMvNED_r40jPxpqArA,2,0,3,_yhQM5eHIjuNiXI6WhUH4Q
1635262,2009-08-13,0,LwQB9H3jZ9wTk24Lr-AnZQ,"I came here for lunch and really enjoyed the bread and spread- it was a little goat cheese mixed with cream cheese.  

I ended up ordering a glass of white wine and the pork tenderloin sandwich.  It sounded better than it tasted- it was served on pretzel bread, but the bread was too thick and salty which I guess I should have expected.  I thought even the side salad was a bit too salty.  

I don't know if i'd stop by here again if I was in Las Vegas.  I definitely enjoyed the food selection at Postrio more.",LtdPEmVNxjx3padmljjfdA,0,0,3,1spddjp0roG7eGxqmY0kiQ
1639750,2017-07-23,1,LwQB9H3jZ9wTk24Lr-AnZQ,"I really enjoyed my dinner at Spago in Caesar's Palace. I was playing some Texas hold 'em in the nearby poker room and decided to eat there for dinner. After much yelping of options, I decided on Spago because of the name (hello, Wolfgang Puck).

I often eat alone, being single and hungry tends to make that happen, and prefer to sit at the bar.  It was a late dinner--around 9pm on a Thursday, and the bar was relatively empty, so I sat right away and was greeted by the bartender, Amalia (sp?) promptly and ordered a glass of their house Sauvignon blanc.  I always ask my server/bartender what they recommend, with an idea of what I want, partially because I'm indecisive and also because I figure they know best.  I was debating between the crab cake or tuna tartar appetizer and Amalia suggested the tuna.  The plan to order a pizza as my main course was diverted when my neighbor at the bar received his plate of duck and I looked at it longingly.  So the tuna tartar and duck it was. 

The tuna tartar was yummy although your basic chopped tuna with avocado. The crisps that came with the tuna were a nice vehicle to stack the tuna on.  Overall, fresh and a good amount for the price, but not crazy out of this world amazing.  The duck with roasted corn and creamy polenta (if my memory serves correctly) was delicious.  I take my duck medium and it was cooked perfectly, with crispy skin and great seasoning.  I love corn and it was fresh with a nice slightly charred taste from the roasting that I enjoyed.  

Overall, I thought the food was very good and the service even better.  They do offer a discount if you check in, which I of course did, and then forgot to show the bartender when I went to pay.  It's ok though, I will be back and will check in again!",ohxtm77aSt-sB6EZSLq_Xw,1,1,5,5aIpXcqDfabTB25g5qAUqA
1645069,2016-03-09,0,LwQB9H3jZ9wTk24Lr-AnZQ,"WHat a disappointment...we ordered 4 pizzas. Shouldn't an expensive pizza have sauce and cheese?? Could hardly see it and certainly didn't taste it. Sausage was cut like pepperoni which looked cool but cut so thin you could barely taste it, baked fennel non existent.Crust was very good and size of pizza generous. Too bad they don't put any ingredients on it. The shrimp pizza did have a good amount of shrimp. Service good though never asked us how the meal was. Over all a very overpriced mediocre experience from a big name chef.",LNmXpxlEEFvhZhdxsjuD_g,0,0,2,mtnZ1g7z5PjBU24PzL7x8w
1647872,2009-10-10,0,LwQB9H3jZ9wTk24Lr-AnZQ,I had my wedding reception here a few weeks ago. I can't say enough good things about the place. The manager was wonderful and so accommodating. I researched a lot of different restaurants and Spago had the most flexibility for my small group. The Kobe beef sliders were my favorite. I can't wait to go back next time I'm in Vegas.,4zNxmB7DAYSS1IiONOENMw,0,0,5,nllZe_GQxDlXAyfMJjEuWw
1656584,2009-12-23,0,LwQB9H3jZ9wTk24Lr-AnZQ,"Service was great.  I came alone for lunch.  The waiter was appropriately attentive and friendly and gave a great recommendation for my lunch.

I really enjoyed their salad of romaine with roasted salmon and unagi sauce.  It was the perfect dish for a tasty but light lunch.

The salad came with radish (cut into strings), chopped romaine lettuce, slices of half an avocado, pickled ginger on the side and a fillet of smoky, roasted salmon glazed with unagi sauce.  Perfectly executed and delicious.  My only small complaint is that there was a little side pile of remoulade, which although tasty, I felt was totally out of place.

Would definitely come back here again for some people-watching and a leisurely lunch.",fIl2vuddRLlfjf9ya_aUSQ,0,1,4,GLyIIrWu_GO0n5neO3mU9g
1656630,2015-08-25,0,LwQB9H3jZ9wTk24Lr-AnZQ,Solid italian food; great for groups and business gatherings. Tartare for appetizer and the lamp I can highly recommend,aJ-eXDPePJ6ZsY-7kMBfVQ,0,0,4,YCTgR9bdlTwRhSDtXsWjgQ
1659554,2013-05-25,0,LwQB9H3jZ9wTk24Lr-AnZQ,Any time a restaurant offers a wienerschnitzel I am in. And if it's owned by an Austrian chef is a no brainer. Loved the salad and the very attentive service.,tTG-gAVDDdu4qbp7kJ8z2Q,0,0,4,48Elk7FIWGHDtlf-ClrhcA
1662395,2015-01-10,0,LwQB9H3jZ9wTk24Lr-AnZQ,Service I was adequate  .  The food is delicious . Pizza was wood fire and amazing .  The crust was not over done and had a wonderful combination in taste,eB8z5Ho_pGlbAWMVvha1Yw,0,0,4,PQafteShOhhey5hJUwTtVA
1687240,2012-12-27,0,LwQB9H3jZ9wTk24Lr-AnZQ,"Had lunch here with family and had a great time. the service was attentive and the food arrived promptly and tasted delicious. the butternut squash soup was yummy, the new york strip tender, and the caprese salad refreshing. pricier dishes but definitely worth it in my opinion.",3WW_w0uI8HCRRaft0Yzv2g,1,0,4,il2k7SH_bfXaO0oIOqX4LA
1695037,2016-04-01,1,LwQB9H3jZ9wTk24Lr-AnZQ,"We came here before watching Mariah Carey and had a truly wonderful experience. We had a fairly big group (9 people) but we didn't have to wait at all (we had a reservation) and our service was impeccable throughout the entire dinner.  The food was fantastic as well! I got the filet mignon and nibbled on the truffle spaghetti. The truffle spaghetti was soooo good. I loooooved the flavor and wish I had got that myself. I also nibbled on the sea bass and that was perfectly cooked and really good. The majority of my group got the special of the night, which was a spicy tomato sauce pasta with lobster and seafood. Everyone said it was delicious and practically were licking their plates. We also ordered the seafood platter as an appetizer and another appetizer I can't recall. For dessert we had the apple cobbler and salted caramel soufflé and both were great. 

My only complaint is that I ordered the filet medium and it practically came out alive that's how rare it was. For $60 a steak I was expecting it to be perfect so I had them cook it longer and when they sent it back it it came back still a little less than medium rare, which I just can't eat. So I sent it back again hoping third times the charm. This time it came back medium but by the time it came back everyone in my group had already finished their food. I'm a slow eater so I felt a little anxious and tried to eat as fast as possible. However, they comped my meal, that's how amazing the service was! And when the steak was cooked medium it was really good. Not as good as Mastro's but still good. 

This is a great restaurant if you'd like something a little upscale while in Vegas. It's perfect to eat here if you are watching a show at Caesars. The food and service can't be beat!",_v73c6e9bo8D5TyIa8V0WQ,1,0,5,znXbwSCGgrY-LJVBqxcKdQ
1708178,2011-10-02,0,LwQB9H3jZ9wTk24Lr-AnZQ,"It was our first night in Vegas, and we had decided on a restaurant in Caesar's for dinner. Unfortunately, we forgot to make a reservation and the wait was too long for us to go there and the concert we wanted to see that night. So my boyfriend and I consulted Yelp and OpenTable and discovered that Spago was supposed to be tasty AND had seating available immediately. We scurried over to the Forum Shops.

We were seated quickly, but our waiter decided to ignore us initially. The manager came by and started to take our wine order when the waiter finally decided to come by. Our service was just fine after that, so props to the manager. 

After checking out the menu, we decided on two different pizzas: the lamb chorizo and the Greek. We chose the former because everyone seems to rave about it in their reviews, and the latter because, well, I heart Greek-style pizzas like nobody's business. We chose a tasty glass of albarino to go with our meal.

The pizzas were great, especially for the price (yeah, $15 for a pizza, but it's Vegas!). Honestly, we could have shared one and been plenty full, but it was nice to be able to taste both types. The lamb chorizo was hearty, meaty, and delicious, but the Greek pizza was my favorite. So many awesome, fresh, flavors. It made me happy. 

We were so temped by the desserts (particularly the Smores thing; that sounded amazing) but we weren't even able to finish our pizzas, so we decided dessert was a bad idea. 

In summary, we were not expecting to dine at Spago that fine Thursday evening, but we did, and it made us happy.",Wo_ASbM3pzJ4r1Qf6CcNOA,2,1,4,YM1q8IAP4VDJI4_RDYeIbQ
1726483,2014-07-31,1,LwQB9H3jZ9wTk24Lr-AnZQ,"another fabulous meal! I truly love this spot. It's a great location in the forum shoppes and close to the casino floor. The food is always exceptional and service is on point. They frequently change up the menu, so don't be disappointed if you go back for seconds, most likely it won't be there.  Try something new Every time bc it will be a new favorite.. The pizza and salad is good for lunch but I prefer dinner items..  This most recent visit I enjoyed the short ribs and ricotta gnocchi! The gnocchi was light enough for summer and filling enough for dinner! The best  ever! Oysters were fresh and Caesar salad was balanced well, sweet romain and a light dressing.. Go now if you can!",ohLH1DFgfqC-I5nEe2z8Nw,2,1,5,nbFVP2oO3l5Ybvwbrz_39w
1731329,2017-03-29,1,LwQB9H3jZ9wTk24Lr-AnZQ,"I came here tonight for dinner, and had not been back since 2013. Previously, my parents and I used to frequent Spago when I was younger, too. I was in town for a business trip and wanted to make sure I stopped by. 

I ordered a pineapple ginger mojito, which was delicious, as well as a steak. Originally the steak was supposed to come with pommes frites, but I substituted the potato purée for no additional charge. The steak was a little salty for my taste but overall I enjoyed it, it came with a sauce that was very delicious as well. I also made sure to do a Yelp check-in to get the 20% off deal.

All of the food, including the bread basket, was very tasty, and service was great as well - my water glass was never empty, and 2 to 3 different waiters came over to make sure that I didn't need anything throughout my meal.

Even though my meal was short - only about 45 minutes total, but I was dining by myself so I preferred a shorter meal - I would definitely return to Spago in the future, as I have in the past.",rr5zzVWVu0u-P5P1rHIV-Q,1,0,5,l2admqWj7B4u9kzhynL-yw
1734919,2007-01-05,0,LwQB9H3jZ9wTk24Lr-AnZQ,"Whenever we're in Vegas we always end up having lunch at Spago.  Its just a really good restaurant.   I'm sure dinner is fantastic as well.  Its moderately priced and has a great selection of menu items.  The best part is the location...its perfect for people watching!  

The only downer is the slow arse service, but the place is huge and always packed so it's to be expected.",_txhy3UvyGffFh8FLO2_qw,0,1,3,8k2JAwYWuCdq7i_-tXq54A
1735156,2008-04-04,0,LwQB9H3jZ9wTk24Lr-AnZQ,"Dear God - I finally found a Wolfgang Puck restaurant I don't hate!

I had some type of lamb panini that was excellent, but not so much that I bothered to remember what it was called. I mean, whatever - I came to Las Vegas to drink and take pictures of myself to whore on to Facebook. Eating is secondary. (I kid, I kid!)

The clams were fantastic, and it's something that my friends and I still talk about to this day.

In truth, Spago deserves 4 stars, but our waiter drove me NUTS! He lingered at our table to flirt with one of my friends for what seemed like 15 minutes (and this guy must be sick, because my friend looks like she's 12!). I desperately wanted him to leave so I could devour my sandwich in the most unladylike manner. 

Dear Mr. Waiter, what is WRONG with you? We don't want to meet up with you and your break dancing friends at some locals pub off the strip. Who comes to Vegas and does as locals do? Come on!",rzwtOxYQ6LUSQSHfCkRBOw,0,0,3,W1nFM5MCn3Be1SEMTPLSbA
1742289,2015-03-30,0,LwQB9H3jZ9wTk24Lr-AnZQ,"This place is AWESOME!! We had the beef tartare and Mac n cheese as an appetizer. Both were exceptional, I really liked that the Mac n cheese was cooked perfectly al dente. As a authentic Italian, I appreciated this! For entree I had carbonara and my husband had the filet mignon. We loved them both. Like I said, this is the kind of place where you leave FULL but want to continue eating simply because everything you are was so delicious. Don't even get me started on the dessert. I didn't want to order one but hubby convinced me. I can't remember what it was called but basically it was an ice cream cookie dough concoction that was truly five star quality. Soooo good! I usually don't order desserts but this was exceptional. I would have ordered my own except we were running late for a show so were a little late on time. Bottom line, this was a great last minute find that we thoroughly enjoyed. We sat at the bar and our bartender, Emily, was super helpful and friendly. We would definitely come back!!",QVCzYGCFkgb0kET38w1ybQ,1,1,5,yQcuZfhUPD4knJTfBjLaSQ
1746647,2012-07-05,0,LwQB9H3jZ9wTk24Lr-AnZQ,"Spago is great! The turkey sandwich I had wasn't dry, nor bland. The bread they serve is tasty as well... something else - it's not just plain bread. I would eat their bread the whole time if it were possible. :)

The atmosphere is kinda... hm... it's in the Forum shops of Caesar's Palace so A LOT of people are walking around, thus, it's kinda really noisy.

It's not too expensive for my taste. You get what you pay for and what I got was really good quality food and service.",GgnIo7CH8ffVC0lNowbHtQ,1,0,4,aBZcugzouEXQqd9aKhNwoQ
1747368,2015-11-07,0,LwQB9H3jZ9wTk24Lr-AnZQ,The best and freshest food I've ever had!  Love this place.  Alex was an awesome server!,Nzvoj5BUxRB8IZkd5eO2pw,0,0,5,tW0pZKwcpZkgBiuhqgEjzw
1753789,2013-11-09,0,LwQB9H3jZ9wTk24Lr-AnZQ,"Fantastic dinner! The food was incredible, pleasing both to the eye and the pallet. We sat inside to get away from the noise of the forum shops and had a wonderful romantic meal. The short ribs were so tender you had to be careful not to spill any before your fork reached your mouth.",LO-YMkCCNg9J8V4NxIYglg,0,0,5,ZawpiVSSlnDLCS-zuJXzMQ
1755006,2013-12-01,0,LwQB9H3jZ9wTk24Lr-AnZQ,Consistently delicious with incredible service. This is one of the best restaurants on the Strip. It never disappoints.,-IcuwptriARnTWf_EaqgrA,0,0,5,0WALlNSGEg5VwBRc68m4aQ
1759984,2016-08-27,0,LwQB9H3jZ9wTk24Lr-AnZQ,"This. Place. Is. Absolutely. Amazing! I honestly don't think there's a better word to describe it . From the hostesses, to the wait staff, everyone was friendly and welcoming. But honestly, you probably want to hear about the food, right? Here goes...

No pictures you say? Yeah, pretty much, and I truly apologize but the food here was so good that I didn't really get a chance to snap any photos of the masterpiece on a plate. Seriously, THAT GOOD! I got the spaghettini plate and my wife ordered the hand-cut fettuccine plate both with chicken. The chicken was cooked to perfection and loaded with flavor. Everything was perfect. I highly recommend this place, but make sure to bring your pocket book because this place isn't cheap. For lunch our bill was about $100 but well worth every penny! TWO BIG THUMBS UP for Spago's!",5J5akoctu-c28miRgE1TlA,0,0,5,yo5x9VPgc571VS4S1U2iCg
1763849,2014-02-18,0,LwQB9H3jZ9wTk24Lr-AnZQ,"Excellent food! Excellent service! Fancy...pricy, but deservable! Highly recommend the octapus..",IdQwlf2rbmbXywDcIA4P_A,0,0,5,0PYWz-0t-OnEVWLOSqyjNg
1783575,2012-05-15,1,LwQB9H3jZ9wTk24Lr-AnZQ,"There are 2 separate dining areas/menus for SPAGO (the cafe and the dinner area ('aka upscale dining' area).  This review is for dinner.. where entrees are $30+.

Food: 5 stars
Service: 5+ stars
Location: In the walkway as you enter the forum shops.

We ordered:
- Asparagus salad (white/green).  Served soft & cold.  Very different from what we expected but it was GOOD!
- Pan seared duck breast.  Once I took my first bite, it was over.  I didn't want to talk to my husband, and I just wanted to keep eating.  If you looked at my plate you probably would've thought I licked it clean!  Not an ounce of anything was left.. their duck is really comparable to some Chinese restaurants if not better!
- Braised beef short ribs.  Not an ounce of fat on them!  Two juicy big lump pieces came delivered to our table and I look at my husband, and I already knew he was thinking 'that's it? that wont be enough' .. but he couldn't even finish his meal!
- Bread pudding.  Wow, the bread pudding here was better than some places we had it at in N'awlins!

Our salad came split for sharing, its like they already knew!  AWESOME!
Another server came with a plate of fresh bread for us to choose from.. he gave us one of everything! All of it was really good, the sourdough, pretzel, and cranberry walnut were our favorite!

Service is top notch here!  Servers cover your glass while pouring so it doesn't splatter all over the place, they brought my wine with an extra decanter, and they even scraped the crumbs off our table with crumbers..  

Wolfgang Puck you did not disappoint!",NV7Iqq3yQEN1_WWt5qDsCQ,1,1,5,DM5BOkysH9nr6TPGi43XLg
1783644,2011-08-05,0,LwQB9H3jZ9wTk24Lr-AnZQ,The Chopped Salad made me a believer in raw vegetables.  Fantastically good.,H154YfLkI98qALi_vm-v5w,0,0,4,hdLYkVbr_xfA5r_sbHzf_g
1785290,2009-12-04,0,LwQB9H3jZ9wTk24Lr-AnZQ,"I went here on a saturday night, right before going to Pure at Caesar's. I've heard about Spago's in Beverly Hills but never tried it so when I saw it at Caesar's I wanted to see what the rave was all about.

Overall was it a mediocre dining experience. I don't recommend coming here on a truly empty stomach as you might walk out with a huge dent in your wallet.  I shared a portion of the soup, (delicious!) two drinks, two entrees of curried lamb and scallops was well over $110 plus tax and tips. Portions were small, luckily their bread was very different and good.",4lMHxMGPufFEtTdw3kOBfQ,0,0,3,EjAkx626ZgZtmZYmoB-x8w
1785412,2017-11-04,0,LwQB9H3jZ9wTk24Lr-AnZQ,"Server was great no complaints on that. Very nice place but how are you out of a signature item at 1:35?! I had my heart set on chicken salad sandwich yet somehow it's out already. I order the chicken with potatoes purée and mushroom. Chicken had ZERO taste and corner of it not cooked through still pink.
MAJOR DISAPPOINTMENT",NkHknHqExVg9dieQtAb3Ig,0,0,2,jK-MxlkuiTNL5TDotPec8g
1794823,2016-01-19,4,LwQB9H3jZ9wTk24Lr-AnZQ,"One fantastic meal. I'm a huge Wolfgang fan. This location is located inside the forum shops at Caesars, not too far from the casino entrance. There are two menus offered. The dining room menu has fewer options and the dining room is a bit more upscale. The cafe menu has a lot more options and more casual with faux alfresco dining.  The server offered a sashimi appetizer that I couldn't resist.  So glad I orders it because it was so freaking yummy. It came with a variety of fishes and three delicious dipping sauces. For my entree, I had the jidori chicken. It was served with potato puree and they were able to give me delicious grilled brocollini instead of the normal carrots. The chicken was crispy on the skin side and tender on the inside. The portions were huge, it was half a chicken plus the starch and veggies. Very reasonable prices and great ambiance.",XCNi6raOHuxmI66Cg2Er2Q,9,8,5,hmG9Phig_tfDs9LjX7avaw
1808533,2015-10-25,0,LwQB9H3jZ9wTk24Lr-AnZQ,"So wonderful to revisit the fabulous Spago in Ceasar's Forum shops.    We had a bottle of the Wolfgang Puck Cabernet Sauvignon, wow great wine.  We asked for the salmon pizza, which apparently only customers my age knows about and they did not disappoint!   The flour Spago's uses for pizza is so unique, light, airy but still chewy.  Then crème fraiche and layers of delicious salmon!  The best!   

To top off the night we met the engaging and charismatic Roberto.  What a great asset for Spago's!  Roberto is an seasoned restaurant and nightclub veteran who still is passionate about the business, very rare.   He made our entire evening!  Regaling us with stories about restaurants and history, we couldn't have asked for more!   Thank you Spagos",kyPZAc1Q3lbcj4_CiTchPQ,0,0,5,D887_nDmgYXwWknalhF0hw
1813268,2017-01-17,0,LwQB9H3jZ9wTk24Lr-AnZQ,"Let's start with what I DIDNT like, even though I'm giving a 5 star review.

The night we went, the managers were on the floor making sure everything was perfect - ABSOLUTELY perfect. He stalked the waiters every move & when something wasn't right, he would scold them right in front of us and made us KNOW that he was making it right. Now, I'm all for good service.... but I definitely felt the tension as a guest. I knew they were being closely watched and it ruined the personable experience and relationship I could have gained with the staff because everything seemed way too forced and faked just to make the manager happy - not the guests.
 I also know that they've had some bad reviews on service in the past so it's probably the manager trying to whoop the staffs asses into shape, however it would probably be best to leave the ""scolding"" to a more private area where the guest can't see or hear what's going on. Definitely a tense atmosphere. 

HOWEVER, I can't deny that the service WAS perfect and so was the food.

The food was incredible, thanks to the head chef Dillon who was working the night we came in. Everything was cooked to perfection. So creative and I ate every bite. Even the bread basket was incredible and so tasty.",WprLWLMfdlbstGuCQvUHJQ,3,1,5,ZpzKdxiHD3XkR1qt84N75A
