,date,funny,business_id,text,user_id,useful,cool,stars,review_id
4638776,2008-01-05,1,LwQB9H3jZ9wTk24Lr-AnZQ,"Very expensive place..some dishes didn't seem worth the price, and others seemed acceptable. The service was good, as they kept giving us more bread and refilling our water. Because the menu was so expensive, my table only ordered an entree, and our waiter kept on asking us if we wanted drinks, appetizers, desserts, etc. Got kinda obvious and annoying.

The braised beef short rib was delicious, and well worth the price. The paella wasn't extraordinary, and the ahi tuna was good, but also not worth the money. oh, they didn't have foie gras...Spago doesn't serve it anymore like many other restaurants - just an FYI.",KURUGmYN2kwDpr6BcEcrRA,0,2,3,MDda1MVUI_lH9fXHt2iWvQ
4640560,2012-07-29,0,LwQB9H3jZ9wTk24Lr-AnZQ,"What a pleasant surprise. I was here about ten years ago and it was just ok. Went with a group of friends and family and really enjoyed it. We sat in the back dining room instead of the ""patio"" so we could talk and not stare at all the tourists. 

Our meal was really delightful. The service was great. All was top noth. So, why only 3 stars?

I noticed when we sat down there was little specs of debris on the table. Then it was in my water, not once, but a few times. I was puzzled until I looked up. The air vents in the ceiling were extremely dirty. The debris on the table and in my water was from this vent. 

Spoke to the manager, but he did not seem to interested in the issue.

As side from that issue, I would return.",ZtSzW0n2gSqWRAmQ_stkXQ,0,0,3,y8VaDIkMRmmx0B6olGWECQ
4642843,2014-09-25,0,LwQB9H3jZ9wTk24Lr-AnZQ,"I sampled a variety of dishes here during lunch, including their Margherita pizza, mushroom fettuccine, the fried calamari, and their prime rib sandwich. The food was average. Nothing too special or too different from the many restaurants in Vegas that serve casual but higher-end lunch options. I think there are better pizzas (Secret Pizza), pasta (Olives), appetizers, and sandwiches around. It's not that the food here is not good; it's just not as good as others'. Service was average and our party of 7 was able to sit down right away on a Saturday afternoon.",oEvsA_IvL0yRyI7d4lT-IA,0,0,3,0nx1bgdeSpWdAMGu7fJJew
4652631,2016-11-14,1,LwQB9H3jZ9wTk24Lr-AnZQ,"Best dirty martinis! With blue cheese olives! Keep them coming!

Tuna tartare- this is a must, if you're more than 2 people I recommend ordering more than one as you will want to indulge in this appetizer. 

Main dishes:
Sesame chicken salad was very good perhaps can do with a little less candied cashews. 

Salmon salad was cooked well and was a nice meal if you're not looking into getting too full. 

The bolognese was okay, it wasn't anything special. Though it is known as one of the popular dishes there.",jXTsUyPTGUrLIpIIQA1Mhw,1,1,4,Ak9lw6bgxzAUtKh1f6gmXw
4652762,2014-10-13,0,LwQB9H3jZ9wTk24Lr-AnZQ,Come here every time I'm in Vegas. Their chopped vegetable salad is amazing. Of course their pizzas are great as well!,2IYYx6g91zACOys8xjPc_Q,0,0,5,rL-9Wk7zOMfXQ5ZcRp3w1g
4658745,2011-11-15,0,LwQB9H3jZ9wTk24Lr-AnZQ,"Spago really deserves 3.5 stars. My boyfriend and I had lunch here during our long weekend in Vegas. The restaurant is tastefully decorated - it has a very modern appeal and  there was great energy from the staff.  

I had the pork loin sandwich with sauerkraut on a pretzel roll. It was good but very salty and they put way too much mustard on the bread- my sinuses were on fire (I ended up scraping some off - much better). The potato salad was phenomenal!

The boyfriend's chicken parmesan sandwich was very tasty! I only had a bite but would probably order this for myself if we return someday.

Spago is definitely worth repeating.",paaaoTuBGM5tyVYdLiOMGw,0,0,3,pKE5dr8qZ2CLHlpAO-Wd2g
4662462,2017-12-19,1,LwQB9H3jZ9wTk24Lr-AnZQ,"Never disappoints! Always on point with the food, and the service!
    We had our annual holiday lunch at Spago, and as usual I left there feeling more full than any woman in a skin tight sweater dress with a belt wants to feel, but I regret NOTHING. There were tiny crab cakes that were like lightly crisp clouds, and these little cones of spicy tuna that, had I not been there with coworkers, I would have eaten the entire plate in 3 seconds. The flat bread pizza was amazing, the pasta fresh and tender, the sausage cooked to perfection and then dessert. DESSERT! The crime brûlée was melt in your mouth perfection, there was a little molten cake thing that was just sweet and rich enough and there were macaroons and brownies with hazelnuts. Everything. EVERY-SINGLE- THING was delectable. The service was (as usual) exceptional. We will continue to go back. Over and over and over. If you haven't gone, you're missing out.",PKhNTl32IRMXFOK1cUuOPQ,0,0,5,rF7rabMkaTiMGY3e-b44WQ
4668595,2012-10-13,0,LwQB9H3jZ9wTk24Lr-AnZQ,"We went to Spagos for oue New Years dinner back in 2009 and had a really good time.  We were sat right in the middle of the dinning room and the place was packed.  Service was great and the food was an adventure.  I had always heard about the Smoked Salmon Pizza and wanted to try it.  It did not disapoint at all, great flavor.  We also had the pear and cheese salad, good and simple flavors all around.  The Beef carpacia was well executed by the chef as well as the Braised Short Ribs on Gnocchi.  My wife got the Fillet Mignon with roasted vegi's, perfectly cooked for her.  Great way to spend time with friends ringing in the new year.",-G-zFaXF3vEizDv5YTK0OA,0,0,4,XHREyDcdek6qSAArbZBvww
4674448,2015-09-07,0,LwQB9H3jZ9wTk24Lr-AnZQ,I come to vegas 2-3 times a year for work and vacation and spago cafe is a staple of our trips!  we eat at the cafe part because its nice and casual and the food is great but the prices are quite reasonable.  my daughter always gets the kids pasta with butter and cheese and every time I taste it I feel like its the only kids menu meal I have EVER had that I would actually eat and really enjoy myself.  they also make the most amazing chocolate milk just for her...I don't know how they do it but it is definitely NOT hershey's syrup!  lol   I like to try a different thing off the menu every time and a few trips ago chef erik klein had a meatball sandwich on the menu that was the best I've ever had!  and last trip my wife got the pasta with bolognese sause that was outstanding.  leave a bit of room for dessert as the pastry chef is amazing!,1lbwkKIKKa7eS4c_7qNztQ,0,0,5,rlhqj56lLBNXYYDhNIarkA
4685962,2016-04-18,0,LwQB9H3jZ9wTk24Lr-AnZQ,"Spago has really unique and delicious appetizers. The pork belly and steak tartar were really well prepared in terms of presentation and also very delicious. It's very shareable, even with a sizable party. 

I went with the prime filet here and it was definitely aged and prepared just the way I like it. Can't go wrong with it. I've heard the duck breast is also very delicious!",ZR56RR4UwhijBnmLzgVf8Q,0,0,4,OoqMMjsmy7HBdD8A_d-QsA
4692206,2014-05-22,0,LwQB9H3jZ9wTk24Lr-AnZQ,"Delicious!  Great service and great ambiance right in the Forum shops!

The food is yummy...who doesn't like Wolfgang Puck?  We came here for the last night of my bachelorette party and everyone ordered a couple plates and shared. My sister and I ordered the asparagus salad and a veggie pizza.Both were delicious.

Our waiter knew it was a bachelorette party because the bride wore a crown and sash on, so he gave us a plate of yummy truffles and chocolate brought to our table to end the meal.

The view is fun...great place for people watching and what trip to Vegas is complete without visiting the Forum  Shops at Cesar's?  Love this place!

Only problem:
BEWARE of the specials menu! We ordered the special asparagus and though it was delicious, we realized after the bill came that it was $28 and there were only about 5 pieces of asparagus given to us.",P3gYzJ2UxK5mQlcRhQTq3A,0,0,4,FnLt4HYFQ9vH_dVeIhcgww
4695518,2014-12-09,1,LwQB9H3jZ9wTk24Lr-AnZQ,"I came here for a quick lunch with my family before we left to drive back to LA. After doing a little last minute shopping in Caesar's we got hungry and decided to try Spago. We all shared the Chicken Sausage Pizza, their handcut fettuccini with shrimp, a burger, and a plate of their calamari. The prices here were actually pretty decent for Vegas, as were the portion sizes. The pizza was very warm and crispy, but a bit too thin for my liking, as I usually prefer pizzas that are thicker and heavier. I think my favorite dishes of our meal had to be the fettuccini and calamari. The calamari was breaded nicely and chewy like how calamari should be. However, the crowd favorite was definitely the handcut fettuccini. The fettuccini came with 3 fresh pieces of jumbo shrimp served on top a nice warm bed of noodle-like pasta. I say ""noodle-like"" because unlike most pastas, Spago's fettuccini had a texture that was more like the texture of Asian egg noodles.

The only complaint I had was that in contrary to the what others mentioned in their reviews, my family was not at all offered bread and had to ask both our waiter, and the woman who seemed to be the head waitress, twice for a plate of bread. Not only that, but they didn't serve the bread to us until the rest of our food was out as well.",83ivu6_UjSUaBnR5jD27rw,4,2,4,TCitFilWbTQSmY8S9e5bOg
4699102,2017-01-08,0,LwQB9H3jZ9wTk24Lr-AnZQ,"I went here on Christmas day for dinner. We didn't have reservations, but we were able to sit at the bar. We ordered the Spago Chopped Salad, Lobster Risotto and the Pan Roasted Main Diver Scallops. 

Everything was super delicious, especially the Lobster Risotto. It was probably the best risotto dish I've ever tasted. I wish the portions were a bit bigger though because my boo and I shared everything. I think the meal would have been more complete if we ordered another appetizer. The service at the bar was super attentive and I saw other people around us order pizza, which looked really good. 

I would definitely come back here and chill at the bar again.",HRuqJeBV8quh-trMscVDOg,0,0,4,MuwAlJRF2vjveW81aBi0xA
4702263,2015-07-20,1,LwQB9H3jZ9wTk24Lr-AnZQ,"My BFF and I came here for an apertif, so we sat at the bar for a couple drinks and light bites. The bar was very lovely and our bartender was delightful. It was a wonderful setting for a nice evening out.

I opted for the Oysters on the Half Shell ($22 for half dozen). The selection was Pickling Pass Oysters served with Red Wine Ginger Mignonette. The oysters and mignonette were great, but unfortunately had broken-off shell bits everywhere.

We also shared the Cheese Plate ($25):
Flora Nelle Organic Blue Cheese: Organic cows milk, aged 6 months
Tête de Moine: Triple cream cow's milk, aged 2 weeks; Burgundy, France
Brillat Savarin: Semi-soft part skim cheese; AOC, Switzerland 
Chimay à la Biére Trappiste: Pasteurized cow's milk, semi-soft, washed with beer; Belgium
Pyrennes Pilota Vach-Brebis: Aged 3 months, pasteurized sheep's milk; Aquitaine, France

The cheese was served with Cherry Walnut Bread, candied walnuts, raisins, apples, and honey. Everything was really nice. I enjoyed all the cheeses, especially the Tête de Moine and Brillat Savarin (one of my favorites).

For beverages, I had a Moscow Mule ($12): Russian Standard vodka, lime juice, Fever-Tree ginger beer and my BFF had the Shogun ($15): Yamasaki 12-year, Cocchi Americano, Honey Yuzu tea, and lemon juice. Both selections were great.",TdYKJgSgY2GF_YJnwsi5yQ,5,3,4,_4Rxe_KdOZC9OzdV0Mu4WA
4703317,2015-11-01,0,LwQB9H3jZ9wTk24Lr-AnZQ,"Service. very good.
Arugula salad. Tiny, but excellent.
Braised Beef. Dry. Room temperature. Poor.

Overall, a disappointing meal. Shame, we had our hopes up.

:(",gmxOZm0iLQNi6ZuSQz0ELw,0,0,2,FTjEZW3B68Hwq2TJBDe_9g
4704126,2012-07-27,0,LwQB9H3jZ9wTk24Lr-AnZQ,"Upon arrival you have the option of sitting inside the restaurant or in the ""cafe"" area, which is the part in between the cafe and the mall. We chose the cafe area just because it was more happening and there was more people watching, haha. We were deathly tired from not sleeping the night before and day club (check out EBC!) so just wanted to grab a quick bite before continuing on to watch a show and then another night of clubbing. Here's what we shared:

Pineapple mojito - quite delicious

Some stirred drink with cucumber - SO GOOD! It tasted like sweetened cucumber juice. I was so surprised! It was really refreshing and yumm.

6 oysters on the half shell - ($22, 5 stars) - I forgot the name of the oysters they had that day, but they said it was a larger version of Kunamoto oysters (my fav!). They paired really well with the rhubarb mignonette. 

Sauteed Maryland crab cake - ($16, 5 stars) - They were just how I like them - lump crab meat, lightly breaded, and served with a lemon garlic aioli.

Pan seared duck breast - ($37, 4 stars) - I LOVED the mushrooms, stewed cabbage, and mashed white corn they paired it with, but the duck breast itself was OK. I thought it had a cured taste to it, instead of the usual gamey flavor, but the boy thought it tasted like bacon. We asked for it medium/medium-rare and that was spot on.",651O9OjViLIE8O5aUBxZ7Q,4,4,5,lw76RvpTFDmNKxrzNprxdQ
4717363,2015-04-05,1,LwQB9H3jZ9wTk24Lr-AnZQ,"I've been coming here for years and have always enjoyed every meal and experience!:) The service is always exceptional! It's always a pleasure seeing Mr. Carlos, he always makes my guests and I feel like a million dollars:)",vsycMyAF-KPR7jsMJXbIEw,1,2,5,VhHZJklaqwlJs0JKUOxKrg
4720217,2012-08-02,1,LwQB9H3jZ9wTk24Lr-AnZQ,The pizzas here are ok.  The quality of the pizzas didn't meet my expectations of a Wolfgang Puck restaurant.  The service wasn't so great either.  There were two managers walking around like mobsters. I've even caught them messing around off to the side. I just didn't get the feel of an upscale pizzeria here.  I've had way better pizzas. The complimentary bread basket was yummier than the pizzas:(,72OpzOwUrxgjgzBElwvAPg,1,1,2,vFaTxUS23wwzEZmuctHCKA
4721921,2010-01-13,0,LwQB9H3jZ9wTk24Lr-AnZQ,"I have been here for lunch a dinner and have to say you are better off at lunch. The prices are cheaper and the food is good, there is no waiting and the servers don't look stressed out.",ivkO3n3ibxswFTgRH8Gy6A,0,0,3,3kK7DH5ZxZptgvXfPmod-Q
4735328,2014-09-07,0,LwQB9H3jZ9wTk24Lr-AnZQ,"My wife and I have been making an annual pilgrimage to Vegas for over 10 years. We come primarily for the food and make it a point to try new (to us) restaurants. However, we've been to Spagos MULTIPLE times and will continue to return... the experiences have been THAT good. We nearly always do the tasting menu... if it's not listed, just ask. We've found the dishes to be just as inventive and ambitious as those found at establishments sporting Michelin stars... and at a quarter of the cost.",LZnpss63QKakH8j9u4q2YQ,0,0,5,7BDiQMADi1khkFDVfX3mrQ
4761390,2015-08-11,1,LwQB9H3jZ9wTk24Lr-AnZQ,"What to order: free range chicken (it's jidori!) and agnolotti pasta was excellent!  My little one wanted a shirley temple and our waiter informed us that they have their own version of ST which is better and he was right.  It was so good that I ordered one for myself.  For dessert, try the chocolate souffle.  

Service: top notch as expected from a WP establishment.",Q4ksGMVKcTzNi5CDpoAE4Q,0,2,5,xkXTGLcJMW5Jue0WbwSccg
4762260,2015-10-15,0,LwQB9H3jZ9wTk24Lr-AnZQ,"For my one dinner during this trip, I picked Spago because Wolfgang Puck and because it was right next door to my hotel. I had the brussel sprouts side and the squash agnolotti as recommended (between Truffles w/spaghettini and agnolotti). Both were meh. The brussel sprouts were described as miso and yuzu flavored - aside from a brief note of citrus, these just tasted like slightly salty brussel sprouts. The agnolotti, though beautiful, tasted exactly like any other squash ravioli with butter and sage I've ever had.

I had asked for the dessert menu up front so I could strategize and it didn't impress me enough, which is why I decided on the brussel sprouts instead.

Portions can be small, but it seems to vary depending on what you order. The housemade ravioli, was seriously a single 5-inch ravioli on the plate. I quickly decided against it when it came to the diners next to me.

Expected more from the Puck. Shoulda gone to Border Grill.",LEGudhGQU2sBvpyltEov1g,4,1,3,JRMg3tsP_X4f9gXfiGH1KA
4763702,2016-03-01,0,LwQB9H3jZ9wTk24Lr-AnZQ,"I was disappointed in my first Wolfgang Puck dining experience. Although the atmosphere was elegant and clean, this was more confusing than good.

We shared a Caesar salad, and this was probably the best part of our meal. I would order this again as I thought it was a pretty good salad, with real anchovy! Probably full of sodium though...

I have to say that although their wine menu is a good one, it doesn't coincide with the menu. The prices seem outrageous compared to menu prices, and we purchased bottles at 5 star places all weekend. They are just missing this here. 

I had the Hand Cut Fettuccine. It seemed like the pasta was straight out of your grocer's refrigerated section. The mushrooms were the best part. HOWEVER.... this ""meatless"" meal had some sort of mystery meat in it. We are still not sure exactly what it was, but it was a huge turn off. There were several chunks. At first I thought it was mushrooms. NO. 

He had the Rigatoni Pasta. It was not what he expected, kind of bland and unremarkable. At least this didn't have mystery meat and was kind of what he expected....

I would not return or recommend. Wolfgang Puck is now on my ""nope-nope-nope"" list. On a positive note, all of the staff were truly fabulous and cordial.",w47K60hE7QOiCqPB1lKHDw,0,0,3,88lPB4216EJh1QCScaiLIA
4763824,2013-02-27,0,LwQB9H3jZ9wTk24Lr-AnZQ,"Had nice Sunday lunch. Great waitstaff, attentive, not pushy. Pricey as you'd expect for LV and the location on the forum shops at Ceasers is interesting venue. All the food was tasty and fresh.",3HrT5IcO3sd4pSBCFP4OYw,1,0,5,6cs4-Z0-b3uBo0VmfTJ26w
4782383,2009-07-29,0,LwQB9H3jZ9wTk24Lr-AnZQ,"Ambiance: Very typical... nice restaurant, nothing original or crazy here.  A nice restaurant located in the Caesar forum shops.

Service:  Our service was excellent we were offered more bread even after we finish ours and they checked on us just enough.

Food:  This is where nothing really stood out.  Ordered the prime rib I believe which was soaked in like a bean sauce of some kind which completely took away from the flavor of the minuscule portion of meat that was sitting on my plate.  Really not worth the money.  I understand if you are going for small quantity more flavor, but it small quantity and less flavor.   -2 stars.",vJF32ri0DCmeORsj99OuSQ,0,0,3,eHRqIMkzsGPG6Xz7B_jN8Q
4784684,2010-12-11,1,LwQB9H3jZ9wTk24Lr-AnZQ,"I came here for the first time with coworkers back in Aug.  We had just finished a long day at the Convention Center and decided to eat at Ceasar's because we had to check up on the retail store in the mall.  We noticed that Spago was packed and asked for a table in the atrium area.   We were seated right away and had a fabulous waitress who made great recommendations from the menu.  I had the caprese salad, duck breast, glass of wine and dessert.  Yay for the company expense account.",0E3zMPX6TWMUJ1NKkJNNBA,1,1,4,RrztjoCjvMigfcvCmUYvsQ
4791200,2015-01-23,0,LwQB9H3jZ9wTk24Lr-AnZQ,"Came here for a team dinner. I'm disappointed at the food. Very expensive and tiny portions. The sea bass didn't taste good, it was dry and bland, the cream on it was really heavy. I didn't want to make a big deal out of it because it was a work event.",zQxDUhxKOHdZygnNRZ-4ng,0,0,3,1DUbet7MH-xgQtUrt_w3SA
4795262,2011-09-28,0,LwQB9H3jZ9wTk24Lr-AnZQ,"Had dinner Monday night. Had the Fillet $43.00. it was the size of a large ping pong ball. overcooked and too much salt. Way WAY overpriced. It was literally three bites. I was with a group, so did not send it back. I should have. I all most that it was a practical joke. I quess I should have ordered a simple pizza!",ZmMQOXmZzEYhnG1cbK14sA,0,0,1,qzUy-kwm7pE1VSej_9w87Q
4797321,2014-01-18,0,LwQB9H3jZ9wTk24Lr-AnZQ,Absolutely outstanding. Waiter had us brilliant suggestions on the cocktail and entre choices. Top with decadent dessert and Irish coffee. Gee this give my first girls wknd night a kick start.,rwFzNFDybFlEJylV0T_qFw,1,1,5,-QQJj87zfoSL7H60ld41tA
4801377,2014-11-10,1,LwQB9H3jZ9wTk24Lr-AnZQ,"I lived in LA for a few years but never had the chance to try the Spago there. Per our double date partners, the one in LA is classier and overall better. Save the trip to the one on LA instead! 

We were first provided with a tablet to view our drinks from. This new Vegas trend I found impractical for larger parties. 

One of the highlights of the meals was their bread basket. They come around with an assortment of about five breads that are all quite good- I especially enjoyed the cheesy bread as well as the crispy parmesan cracker. 

The menu itself is divided into three seconds, One being appetizers, Two pastas, and Three entrees. My fiancee and I chose one from each. 
The Mushroom Soup was the most impressive of the three dishes. I loved the fluffy wild mushrooms atop the delicious lightly creamy soup.
Our saffron Risotto dish with scallop, crab, and chorizo sounded amazing on the menu but didn't quite deliver. The scallop was plopped in the middle of creamy risotto, but the risotto itself tasted plain and did not encompass the flavors of the seafood and meat. 
The Cabio, which was described as akin to swordfish, was a hearty dish, but also lacking in taste and failed to leave us with a positive impression.",gRtIqKlpP_YNp45x-MmeQQ,2,1,3,T_X_vrZSmdqWl2pV3H437g
4804266,2013-10-13,0,LwQB9H3jZ9wTk24Lr-AnZQ,"The food is always amazing, both for the eyes and the palate. The food always lures me to Spago but the exceptional customer service is what keeps me coming back. We've spent our last three special occasions at Spago and there will be more to come I'm sure.

I lived in Austria and I can say that the Weinerschnitzel is not only delicious but authentic. The braised short ribs are also not to be missed.",hZbWiHRRBlJ-YCewmjCkyw,1,0,5,hLQBITgJvGGCfd0BkxZpLQ
4809199,2009-01-23,1,LwQB9H3jZ9wTk24Lr-AnZQ,"Granted, I only ordered one item off the cafe menu at lunch.  And granted I shared that one item with my wife.  But, damn, that was the best half-hamburger I've had in a while.

Did I hesitate or pause at ordering a $25 burger?  Not really.  ""MESQUITE GRILLED SNAKE RIVER FARM KOBE BEEF BURGER, Brioche Bun, Smoked Onion Marmalade, Black Truffle Aioli, Vermont Farmhouse Cheddar and Pommes Frites,"" sounds SO much better than ""Cheesebuger with Fries.""

I thought it might be just a gimmicky burger, but it was all it was cracked up to be.  And it was plenty of food to split.  They didn't scoff at our request and even served it up on separate plates with equal portions of sides.

The service was excellent and very friendly.  We spent a lot when you factor in a couple of drinks, but somehow we didn't feel taken.  We'll give the dinner menu a shot next time.",0l_0KpelMBhHzflxt8PkqA,1,1,4,5re8JFk2qNfjDXgO4hj2ZA
4809613,2017-05-23,0,LwQB9H3jZ9wTk24Lr-AnZQ,"We tried the power lunch special. 3 courses for $30. The first courses we tried were the chopped salad and minestrone. Both were good and a smaller size, but it seemed like a good portion. The soup was hot and the salad was good with the vinaigrette dressing. We both had the chicken breast with Yukon mashed potatoes and gravy. Also with broccolini. Excellent entree. For dessert we had the chocolate brownie and the Greek yogurt with berries. They were both very good and again, smaller portions. The service was a bit slow",UhW9bxvCy3LgJx4y-1X5bg,0,0,4,cwlHMgZuZOc7XN_KM45sXg
4818854,2017-01-03,1,LwQB9H3jZ9wTk24Lr-AnZQ,HORRIBLE SERVICE and average food. Wolfgang I'm so disappointed that you would run a restaurant this way after all you preach. Literally so unimpressed. Will NEVER COME BACK HERE. tried to go to Il Milano but they were closed. You should take some notes from them... You should staff your restaurant appropriately!,VDQEQg3aDXlnzdyRp0CHfw,0,0,1,GXiivFlJJEqYXQA0gYLgGw
4821528,2006-07-07,0,LwQB9H3jZ9wTk24Lr-AnZQ,"This spago is sub par as far as Spago's go. We've been about 5 times, each time hoping that last time was just an off day for them. Wolfgang needs to work on this location. The Spago at the Four Seasons Maui is my favorite restaurant ever so don't judge them by this location.",H-LOkNSBBOrGPQOruqx74w,0,0,3,uUKoFSQpB3IZ_49tE-b1uw
4823056,2015-03-21,0,LwQB9H3jZ9wTk24Lr-AnZQ,Service was fabulous! Pasta dishes delightful...would return in a heartbeat!,l72Lq56fkUszAEaZyIH_pQ,0,0,5,XKJwQHwYgFwgPqEZ9DjYlQ
4829315,2015-08-09,1,LwQB9H3jZ9wTk24Lr-AnZQ,"I was really excited about Spago. We had the calamari and tartare as appetizers, the bucatini carbonara, burger, chicken bbq pizza and skirt steak. The food was good, but I just don't think it was worth of what we paid for. I was expecting more, but I guess their special menu was not available when we were there. On the other side, servers were polite and the ambience were good.",-594af_E7Z9VVjQc9pJK3g,1,1,2,1jquO0JcO8S1GD8IL7c3UQ
4829850,2013-08-26,0,LwQB9H3jZ9wTk24Lr-AnZQ,Everything was great from the setting to the food.  I had the NY strip and it was cooked to perfection - for dessert we had the peanut butter soufflé - which literally melted in your mouth.  I would recommend eating here on your next trip to Vegas.,crLqk7dkCdofm-HtGvTOVA,0,0,4,Z1BFeQQNYYnZrQBQ3VgIqg
