,date,funny,business_id,text,user_id,useful,cool,stars,review_id
1568636,2012-01-26,2,O589S0opFB9oK8VcL5tRcA,I went to this club with a friend and I am sorry to say it was less than mediocre. There are so many good strip clubs in Vegas but dont make the mistake of going here. P.S. dont get a lap dance from Morgan she took my money and never saw her again.,7RnjTT36Fut7tFsXYHDR9w,2,0,1,gNy3cfS8qBZHYQkImA04aQ
1619517,2010-07-26,3,O589S0opFB9oK8VcL5tRcA,"Good club. Cushy, comfortable seating. The seating has a dark, tucked away feel for the customers. Great main stage and talented strippers. Cute, classy girls. Next to Olympic Gardens, Treasures is my other gentleman's club of choice unless I really want to get down and dirty in which case it's Palamino Club.",x9zsPE6h1mtOcTZWGmZ2ww,7,2,5,J1xbAVzG9gTnlP5IlZfYwg
1694599,2014-04-13,6,O589S0opFB9oK8VcL5tRcA,"This place has a nice little racket going on where they hire promoters on the strip to do their dirty work for them. What is their dirty work? Lying to customers about what club they'll be taken to, and then shuttling everyone here, to Treasures. And when you realize the bait and switch? They berate you for wanting to go elsewhere. If this is how they treat potential customers on the outside, one can imagine how they treat the trapped souls inside.",yGGGUYCGXm2UKVNYKT1U3g,9,2,1,vTjnduYnDJOysHwjqJH5jg
1730501,2011-04-29,1,O589S0opFB9oK8VcL5tRcA,The girls here are great. better than the rhino and sapphire.,f0F7WCR_YebKouO2MWJf3Q,1,1,3,9mTJ9qEqYqhcwYgOYI3Egg
1732878,2017-01-04,1,O589S0opFB9oK8VcL5tRcA,"There is a special place in my heart for treasures. Whether it's th poorly done buffet with drinks and hot girls or the stories from Lolita of the home country, I've never had a bad time.",dqbilLAnLZ0PFplEqCMscw,1,0,5,j2M1CtHGaWWk151ckVNeLA
1832857,2012-09-07,4,O589S0opFB9oK8VcL5tRcA,"I'm sad to say that I no longer frequent strip clubs like my younger days. Long gone are the endless nights at Sapphire, leaving at sunrise with a few debit and credit cards less than when I came in with. Hey, the recession is tough on everyone, myself included.

Suffice to say I wanted to go somewhere new and Treasures has always been on my list. I've heard endless stories of the Chris Farley portion-sized steaks and steak and legs is the motto. Treasures can definitely be pricey if you allow it to be. However, for $3 per person you can purchase a dinner voucher from Tix4Tonight that will allow 50% off your entree.

I ordered a massive New York Steak (18 oz?) with a baked potato, and my friend also ordered a over sized piece of meat. We skipped on appetizers because we knew the portion sizes were going to be insane and we were also given bread and butter. Our waitress was friendly and courteous throughout the whole service. She told us stories of regulars who come in and wolf down 28oz Porterhouses on a regular basis...INSANE.

My New York Steak was nothing overly memorable but was definitely Steakhouse quality. The meat was tender, juicy, and cooked perfectly to a medium rare sear. I barely touched my baked as I put all my effort into finishing my steak. Unfortunately, the steak won and my jaw was beat. My friend also enjoyed her dinner, but we could not move as our food coma started to take over.

If you like strip clubs and steak, this is your place. The interior aesthetics are very brothel-like with lots of velvet. The chairs at the dinner tables are big and comfortable and don't help against the cause. The dinner area and strip club are in separate rooms but less than a 15 second walk, as they are in adjoining rooms. My friend and I had an early dinner (8pm), which meant the strippers weren't out in full force. I was a little bummed, but I was ready for a post-coma nap anyways.

Note: Unless you want to pay $10 for a diet coke at dinner, I suggest sticking to water.

Happy Hour: $1 Well Drinks & Domestics from 4-6p.m.; 2 for 1 Premium Drinks from 6-8p.m.; Free Buffet 4-8p.m.

Ambiance: 4 Stars (out of 5)
Food: 4 Stars (out of 5)
Service: 4 Stars (out of 5)
Price: $$
Overall: 4 Stars (out of 5)

Pros:
+ Steak, steak, steak
+ Steak and legs
+ Brothel interior
+ Tix4Tonight discount (50%)
+ Free limo pick up

Cons:
- Lack of strippers during dinner time (8pm)
- $10 diet cokes",BdV-cf3LScmb8kZ7iiBcMA,5,1,4,nWjELWtzkLdcl96ta_WC6w
1912326,2014-06-25,3,O589S0opFB9oK8VcL5tRcA,"Came here based off the reviews. Sapphires reviews were bad so we passed. The girls here are pretty good lookin just a few here n there that made me ask how did they even get the job. Seats everywhere and the I like how there is a center stage and a main stage.

The bad I came in there with no cash so the ATM was my first stop. Bouncer told me the charge was like 2.50 mmm no how about they charge $10 or 9% for every transaction which ever is greater.. I'm not really caring at this point until it hit me I'm going to be charged 10 for 20 dollars ughh PLEASE bring cash the ATM will kill your pockets as well. Women's bathroom ..,. Well u share it with the strippers and a Mexican service lady and the room is soo small you would think 5 strippers wouldn't hang in there taking selfies. The dancing overall was basic only a couple would do pole tricks smh and drinks are soso. 

If u find a man on the street make sure u tell him u want ladies in free or u are not going",XSDGaMpCbfP1rWmmh_8Gbw,4,2,3,9QunNkBHZm_h0SOO5QeVrg
1915479,2006-10-31,0,O589S0opFB9oK8VcL5tRcA,"I'd only been to one strip club previously, and was appalled that the girls there had on house arrest anklets.  Treasures, however, is in a class of its own, with fine hardwood paneled walls and gorgeous women.  This place is the best strip club in Vegas, which puts it in the running for best strip club in the world, leaving you feeling satisfied instead of dirty.  So have fun, bring lots of money, and beware of Tristan:  that little firecracker stole my heart.",kQ_XJHgPnOMJZ6kUQQEB-Q,1,0,5,Nwi5O5mAOP1kYV9ZPGjF5Q
1994863,2016-03-28,2,O589S0opFB9oK8VcL5tRcA,"I LOVE THIS PLACE! 

As much as I would love to keep this place all to myself I have to give credit where it is due. 
The lap dances are so amazing and everything is so reasonably priced. It's so much cheaper then sapphire and so much better! It's two stories. You actually get you're own seating area. The strippers are freaking amazing and the lap dances are so much better ;). They offer you quality drinks for just a little bit more with the drink tickets and their drinks are very strong. I'm not sure why this doesn't have a higher rating. Don't waste your time anywhere else. This is the place to be. 


Not sure why the reviews aren't better.",DAras3WY2ubz2idUU-g8Tw,3,5,5,Zo5Ys46lOuhy5XnliXCnDw
2023762,2010-08-24,0,O589S0opFB9oK8VcL5tRcA,Really enjoyed this club. There were a plethora of girls walking around so it wasn't hard to get a dance if you saw something you liked and some of them were from other countries which was a bonus. Not the best of the best in Vegas but a solid place.,611MiIXJkXM82I1y3Hg9eA,2,2,4,2h1raVLJihYcg1bTc-2IDQ
2032658,2014-11-12,4,O589S0opFB9oK8VcL5tRcA,"The happy hour here between 4-6 is pretty bomb... plus all the attention since we were basically the only ones there....

Don't judge me!  :O",oGCXJ36sDH8JYzb6Iranfw,3,4,3,K0BBdzxee1h53fyZ4I40iw
2033855,2012-07-27,0,O589S0opFB9oK8VcL5tRcA,"Treasures 4 stars (good place for a drink and just chill)

4-8pm happy hour free buffet (not that good) free cover (we drove ourselves) 2 for 1 premium drinks ($10-15)
Had about 5 girls working around 7pm and they were friendly and not pushy on $20 dances. The girls here were just as good looking as Spearmint girls. 

---------------------------Note: if you take a cab to stripclubs they will charge cover!

Spearmint Rhino 3 stars (have no money) or 5 stars (if money is not an issue) 

1-8pm happy hour ($3 beers) Free cover (we drove our own car arrived around 7pm) As soon as you walk in there will be girls on you. They were actually friendly and not pushy like some other reviews have stated. There were 3 girls per customer so the only safe place is in the restroom or the bar. VIP area was more private but rates are negotiable depending on the time of day. Better selection of girls than Treasures but Treasures girls were less pushy.",sB8Ta-xnYmW8N6w6RgxwIg,2,0,4,W_L9vuk6YDXwJRUoq6AN9g
2037086,2009-08-24,10,O589S0opFB9oK8VcL5tRcA,"Billed as ""the most luxurious gentlemen's club"" in Vegas, Treasures definitely tries to live up to its name. I showed up on a Thursday night for a bachelor party and were greeted with a $30 cover, which is pretty much standard for Vegas. We were able to sit immediately and drinks were procured at the bar. 3 Jamesons on the rocks = $39. 2 shots of Patron = $40. I guess ""luxurious"" means ""ridiculously expensive."" 

While the girls were nice (not pushy, not mean) and the staff was too, I couldn't get past how insanely overpriced the booze was. Even the Heinekins were, like, $12 or $14 (I can't remember because at that point I simply stopped looking, because the only way to enjoy myself was to pretend like I wasn't getting raped by the bartender every time I was thirsty). 

Overall, it's an alright club. Not a single girl on stage did anything other than strut around (disappointing when you're from Portland and the girls here do insane pole acrobatics) so there's ZERO reason to sit at the rack. Drink before you go, or maybe go for the bottle service? I generally avoid bottle service, but the drinks are so expensive that it might be worth it. You're better off showing up toasted or smuggling in a flask. 

This is definitely not my first choice for adult entertainment in Vegas unless someone else is footing the bill. The level of ""luxury"" they offered me (standard strip club chair, standard strip club table, same drinks as anywhere else) is not worth the luxury price I paid. Maybe if a high-roller is rolling with me footing the bill, I'd be into it. 

It blows the Rhino out of the water, tho.",Pf7FI0OukC_CEcCz0ZxoUw,20,10,3,ZE8K-TFSVMJAV4xUAdTZSg
2037763,2014-09-04,2,O589S0opFB9oK8VcL5tRcA,"Honestly don't even remember how we ended up here after leaving surrender back when I was in Vegas celebrating a friends Dirty 30.  Okay, I remember a limo picking us up at some point and my friends brother yapping about how we should go here.  It was wayyyy to late in the night or early in the morning I should say to be thinking clearly.  My friends brother picked up a friend from Bellagio who happens to be a dancer for Cirque du Soleil ""O"".  She was just getting off work for the night.   Funny thing was that I had met her before a long time ago in SJ but just couldn't put a face to a name.  

Entry was like $25-30 once we got there, game face was on and I was ready to tastefully throw around some money for my friends B-day.  Got in and the place was dark and a bit small in my opinion.  It looks so much larger from the highway for some reason ahaha.  It is two levels, so we ventured up to an open table up there.  I think a Asian stripper came up to me and started to ask me about the girl we were with, lol.  If you go to a strip club, bring a girl cause it will always attract more attention. There was something very hot about watching our female friend get some freaky lap dances from the strippers... I might have even bought her a dance I don't really remember :-P  I bought my buddy a lap dance from the Asian stripper who kept trying to hustle me.  Terrible I can't even remember what her face looked like; although it was dark and I was prob. partially drunk.  -----(this is why I'm a photographer ***)

Had a lot more fun once we went downstairs to the main stage.  My friends brother had a whole stack on ones for the dancers.  We found a table right next to the stage luckily and we immediately got service from the sexy servers.  I noticed all the guys around us kept starting.... probably cause we were the only group that had brought one girl with us haha.  My friend starting throwing around some ones, and I think I usually enjoy the main stage most at strip clubs because of the lights and music.  I think my friends got me a couple lap dances but I can't even remember the strippers now, LOL.  I don't remember how much money I spent that night but it wasn't absurd.  You really don't need to spend a ton at a strip club to have fun IMO.  

Things I hate are the douches who smoke and get out of control around the main stage.  Security is pretty good though at most places if anyone gets out of line, they will boot their asses out.  I had fun b/c of the group of people I were with were down to party and have fun.  Albeit I have been to much better strips clubs with sexier girls and better interior so I'll have to stop this one at a 3 star rating.  I likely will not be back to this specific strip club whenever I'm back in Vegas. 

I felt like our service might have been above average...  or better than most of the other guys who were hanging out here.  Our server was pretty attentive to our table and made sure we had all the drinks we needed.  By the time we left the sun was coming up; I haven't ever stayed up that late in Vegas before and time really  does fly when you're having fun haha.",gUhL_vkTY_zwrzT71a73Bw,0,0,3,XxquS7aCKRUc0P-E1EYpFQ
2048008,2018-02-15,1,O589S0opFB9oK8VcL5tRcA,"From a street promoter, I got two tickets for ""free"" limo and entry. You just have to pay for two drinks. Too bad two drinks is almost the same price as entry, $40 per person. You get in and the strippers immediately want to get you to buy a dance. $20 per dance, about 5-10 min. Then they'll try their hardest to get you to a private room, which is anywhere from $250-600+. If you don't have cash, the ATM fee is $10. I was there for 30 minutes and spent $150 for myself and my girlfriend. The limo drivers will also tell you that they go by tips. ""The free limo stuff is BS"", is what he told me.

In short, bring lots of cash before you go. Drinks will break your bank. Do not let them have your card information. The place was nice. I didn't eat any food. The girls ranged from average to pretty good looking. Topless. I assume VIP will get you full nude. I went on Wednesday night so there were plenty of girls and it was empty.",pRne0ayc__JDBiUnrAMw-Q,5,3,3,1wM3RzGFtn96z0upDzWS-A
2057002,2015-08-16,3,O589S0opFB9oK8VcL5tRcA,"The limo free ride (LMAOROTF ) looked like it came from a junk yard (inside), it's an negotiate to get back to your hotel. The club was dark and nothing exciting to look at. Beware of prices for  drinks $18 for a beer",KI4o5PyfyTF9BWA2UQTdxw,2,0,1,NUQMQ1l8VBQstwiiZsMUPg
2141166,2013-08-31,3,O589S0opFB9oK8VcL5tRcA,Meh. At least the drinks were strong so you would be drunk enough to buy a lap dance from a relatively clean girl.,pBylxjhy8czLq-7lfzzqhg,1,0,2,le54QYbjmiHFb5iq9WzzWQ
2236436,2015-07-01,2,O589S0opFB9oK8VcL5tRcA,"Small compared to sapphire. Limited seating, not enough women walking around. Low lighting, to dark. wouldn't come back here. NEEDS MORE SEATING AND GOOD LOOKING VARIETY WOMEN instead of just black and white.",JxShwrytY0E7TEjLaoBQVQ,2,0,1,3UoLYztBVi4qbq5hZ8RXcw
2251770,2017-06-11,8,O589S0opFB9oK8VcL5tRcA,"Absolute robbery! they will more then hussle you make you think you're getting more then a dance then charge you 500 for 30 minutes,,. Not to mention we were lied too from the beginning by the guy who said ""Free Just buy two drinks for 20 bucks free ride in limo there and back and free entry"" all lies... They drop you off and immediately as you walk in they tell you its 70 dollars cover charge"" by the time you come out, the limo and guy who put you in it is long gone and your no where near your hotel and that limo won't come back. You walk in after you pay the 70 bucks immediately a stripper grabs onto you and will act like shes going to do more then just strip... She'll tell you she wants you to go upstairs with her and that's when you're hooked like a fish. Immediately she'll tell you its 300 for 30 minutes... Then when you go to pay they'll inform you there's a $120 drink minimum(and that gave me a whole 2 drinks) ... Then once your in the room the striper will do everything to waste time by asking you your whole life story before you know it 30 minutes is gone and she hasn't even fully stripped... That's when she'll ask you for another 30...That's when my brain kicked in and i stopped myself before all my cash was gone... Came out to find all my friends angry at going through the same experience... Please please stay away from this place... You think you have will power but you go through those doors you will regret it",MOFb8wn0UpLj1D284ZNfZQ,11,2,1,ElizQ1am7W5sECcFAy5aAA
2256953,2015-05-31,2,O589S0opFB9oK8VcL5tRcA,Me my boyfriend and his brother came here on a Saturday using a promoter it was 35 dollars for cover plus two drinks and ride back and forth. We had a great time we sat at the round table.,2iOHDk79OerTEEWP-sOqmw,3,1,4,xQhMwf8kVqPivtVeh3Yg1Q
2282959,2016-04-06,1,O589S0opFB9oK8VcL5tRcA,"Went on a Tuesday night and they had a good selection of women. Called the club for a free limo and no cover charge. The staff was professional and the place was clean and nice. A few of the girls were too pushy to score a private dance. Even after my friends and I told them we wanted to sit and enjoy the show they kept pestering us. One even asked my nephew if he was gay. Several times the stages were empty because I guess they were busy doing lap dances. We were having a good time until we started getting warm beers. I know this is Vegas but $14 a beer is a bit much, especially warm. We left early but had a good time and would have stayed much longer if the beer had been priced closer to 8 or 9 dollars.",vicCngyJQKbXkNvwJ8APvw,2,2,3,u890O0VlHuyFkHWH3W3OOQ
2300314,2015-08-18,3,O589S0opFB9oK8VcL5tRcA,"probably the worst experience i had in this club and it totally spoiled my mood and day, The drinks which comes with the cover are diluted and not upto the mark. The waitress knowingly ignores you even after making the eye contacts and the management doesnt care about the overall experience of the customers. The beer rates are over the roof here 18$. 



Also while initial stage they tell you that the pick up and drop is included in the cover, but during the night when you are leaving, you have to wait for an hour before you get a drop and that is also not guaranteed. Also the manager & staff shirks responsibility when asked to arrange the drop off.

I think this club is total waste of time, which can be spent on other wonderful & caring clubs. 

As majority of us come to Las vegas on vacation, we all have a limited time. so personally will advise not to spend time in this one and look for alternatives",So_I1_yUD6J3ICxQxcxTrg,3,0,1,G-2HYVPfqAGt8KBasrCSFQ
2309048,2014-08-25,0,O589S0opFB9oK8VcL5tRcA,"Went to eat only on a Saturday night. Had to pay $70 to get two girls and one guy entry. $10 went to a shirt because tank tops are allowed. 

The three stars is going to the incredible service from Sici (an older women from NY) who made the whole experience worth it. The steak was alright. The 400 dollar dinner tab was not. 

Entry should have been free. Overpriced food.",tijY6q1RKwXi3yG8ckF2EA,0,1,3,LYDOBYiPw_8dWlEVuaDpOA
2378363,2017-10-20,2,O589S0opFB9oK8VcL5tRcA,Made a reservation with Shaun during a UFC event with my husband and had a blast. We enjoyed the fights and the sights. Great service and atmosphere.,aaLhP48B8Ex_K0AAoqe2Tw,1,1,5,DGWYGJwpt35T2F3AtyrpQA
2386008,2008-09-02,6,O589S0opFB9oK8VcL5tRcA,"You like steak?  You like titties?  Come to Treasures for both!

Food:  Fantastic!  Treasures was classy and their steaks were on par with some of the high end steakhouses that I had in the past.  Steak prices ranged between 40-70 dollars and sides are separate.  They also had a huge lobster tail and filet mignon special for $65.  Even if you're not down for titties, I would recommend coming here for dinner.

Girls:  Better than average.  My friends argue that Spearmint has the best girls but I say that's only because they have more to pick from.  On an average basis, I think Treasures wins.  The venue is much more luxurious compared to Spearmint and it's less crowded.  If you want to get titty slapped with class, Treasures is the way to go!

Another word of advice, call their limo service to save on cover charge.  702-259-GIRL.  We didn't know about the free cover if they pick you up, so my friends and I ended up paying $30 each...which could have gone to another 10 lap dances.",VH-sP1PAuwi8_gebVxpg1A,11,3,3,JhSnD3HHv4vP4n2dIAiDSA
2424553,2013-11-06,6,O589S0opFB9oK8VcL5tRcA,"This has been such a fun day! Where to next?! TREASURE'S!! This is the first time I've set foot in a strip club in Vegas for at least five years! 
It's MNF aaaand they had AMAZING deals here! 
Football is on, on the BIG screen. $1 well drinks. Or they have buy one get one on their regular drinks. $12 buckets of beer.. Which WHY wouldn't you when ONE beer costs $11?!!! Free food buffet, raffle tickets are given out for every drink you buy AND they have $1 dances. WHAAAAAAAAT. 
This was actually SUPER fun and I recommend going here if you are into football, free food and cheap drinks! Or I'm not even INTO football but I'd go for the free food and cheap drinks anyway! LOLOL.",Rdt-JiAN7Qlw3dJ7UVdNtw,6,3,4,a5ONluW3W8NUqgalQIEcWA
2476779,2014-04-14,0,O589S0opFB9oK8VcL5tRcA,"We went here on a Friday night thanks to a strip promoter. Free limo ride, no cover charge but had to pay for two drinks upfront (we would've bought the drinks anyways,so that wasn't a big deal). $20 for a decent dance in Vegas...not bad! Girls are pretty, not too pushy, and nice. The music was good but the drinks were a little weak. Is recommend this place and would definitely come again.",bt5Pf-nYfdrm6rP1_DIiMw,2,2,4,pM1hooLCvHyFPL8fNJUDhA
2486349,2011-09-13,1,O589S0opFB9oK8VcL5tRcA,"My husband and I came here on a Sunday night.  The crowd and selection of girls doesn't get going till around 11.  

The dancers on stage were mostly looking bored, but there was a couple who knew how to dance.

We never felt pressured for a dance.  Maybe bc we were there as a couple.  The girls are very personable and will sit and talk for a while.  

Prices are about average for a strip club.  We did VIP with Mary Jane, had a lot of fun.  But that story belongs on another forum....

If you are a couple looking to have fun without the pressure go here.  Just remember to not be uptight about it :)",WNrrUmyiNVK7Jrpbxfwbag,7,5,4,GvIRn4zf2r_IYl3XdsBldg
