,date,funny,business_id,text,user_id,useful,cool,stars,review_id
3335198,2014-10-27,1,O589S0opFB9oK8VcL5tRcA,"This is my second review for this establishment... and there is a reason for that... Treasures has VIP customer service down to an art!

My wife and I planned a getaway to Vegas after a grueling 6 months of organizing a large charity event.  A VIP trip to Treasures was to be a cornerstone to that trip.

It did not start off well, however.  I had sent an e-mail with questions about the VIP packages that was never returned.   Finally I called an made reservations for 8 pm  and that that went very well.  Just before 7:pm I received a call from the driver stating he would be there in less then 10 minutes, making him about an hour early.  I told him that my wife was just getting out of the shower and he said that he would wait until 8.  

The limo was a LONG stretch Escalade that was obviously used and a bit worse for ware.  I ASSUMED  that was something they picked up second hand and were going to refurbish, but the driver didn't say anything about gaping holes in the headliner, or bad condition of the upholstery.  The ride itself was TERRIBLE!  The driver has a heavy foot on the gas and the break.  So with hard accelerations and heavy breaking in stop and go Vegas traffic over its legendary potholed roads...   My wife likened the ride to the seen in the Wedding Singer where they are ""trying out"" the limo driver.  When we arrived we were not escorted in as we were before. 

This evening ended nearly before it began.

In the past, we paid up front for our VIP package so pricing was understood.  Not this time.

Now for the good part.  Once inside we were escorted to the restaurant and seated.  The waitress asked if we had been there before and we commented on the great service we had had in the past. Through the conversation we learned that that same waitress was still working there and on duty that night!  The waitress we had relinquished our table to CC who either actually remembered us from two years ago, or did such a great job of customer service that she made us believe that she remembered us!

Service was thorough and prompt.    My wife had the Lobster Bisque which was excellent.  We both had dinner salads which, I have to say had to be the most well presented and tasty dinner salad I have ever had... in a strip club or anywhere else for that matter!  I had the NY steak and my wife had the Filet.  In my previous review I had complained that the quality of the steak was not Treasures claim to 5 star or Prime.  Not this time.  It was both 5 star and PRIME!

After dinner we were escorted into the club.  My wife and I both dress for nights out and I would say that we were better dressed that most of the clientele... as such, we had girls at out table constantly!  It was happening so frequently that we could not hold a conversation!  Drink service prompt, pleasant, and accurate and I was never wondering where our waitress was.  I was happy to leave a significant (30%) tip!  After a while we were approached by Brian the VIP manager and asked of there was anything he could do for us and gave us his card and offered some discounted VIP services in the future. 

Later, as we were leaving, Brian went out front and ordered a limo to take us back to our hotel.  In our past VIP experiences at Treasures, they only brought you to the club, and you had to take a cab back.  This was the first time we got a limo ride back!  The ride back to our hotel was VERY pleasant!  I do not remember the name of the driver, but it was her last day and she was moving back to Texas.  

There is a reason that I am writing a second review for Treasures.  They have customer service DOWN!  Aside from the ride there, they made us feel like we were the most valued customers in the building!  I don't know if CC actually remembered us, but she made us feel like she did.  I am sure that Brian offers his services to a number of their clientele, but he made us feel like we were special.  At the end of the evening, even though we were not going to spend anymore money there, they gave us a limo ride home, and the driver, even though it was her last day and no longer dependent on that job, treated us like we were her favorite clients of the night.  

We are not rich by any means.  We are about as average as you can get.  When planning this trip we wanted the VIP experience and budgeted $400 for this night out.  We received VIP treatment that exceeded our expectations and walked out of there way under our budget.  I am not saying that this place is cheap, or even reasonably priced, but if you plan for it, you can get more than your money's worth!",2xa5FYd6SRxPI9qDkF0N8w,1,1,5,F3xHzlHu6IhW6oeUlilL8Q
3432916,2013-01-15,5,O589S0opFB9oK8VcL5tRcA,"This probably should be a one-star review...
The extra stars are only because someone in management/ownership understood I'm not a ""dumb drunk bitch"" and have a brain. 

Went on Saturday night, with thanks to a promoter who was hoping to show 3 girls a good time (two of which were celebrating their 30th birthdays; one of which, was me). 

Promoter told me in advance there would be no cover but a $27 two well-drink minimum (which is paid prior to entering the club). 
Okay, fine. 

We're given receipts (which are also drink tickets). 

After sitting down and getting a feel for the vibe, a server comes over to take our drink order. 
At the same time, another server swooped behind my girlfriend and took her drink ticket(s). 
Original server said she could only serve us 2 drinks for the 3 of us (after we had explained another server just grabbed the tickets without taking an order). 
And, wait a minute, we had 4 additional tickets between 2 of us...?
What just happened here?
Pretty sure 3 chicks x 2 drink tickets = 6 drinks. 

This is where management came in, asking who took the drink tickets and they'd be happy to compensate the next round of drinks. 
That's nice and all, but I already PAID for the SECOND round of drinks. 

Me and my girlfriends decided it wasn't worth staying and asked the front if we could at least receive half of our money back. 
We didn't even take but one sip of our drinks before attempting to walk out and the entire (shady) debacle had me completely on edge. 

Another manager (may have been an owner?) came out to explain there would not be an opportunity for refunds, but he wanted to try to make it up to us. 
Being a business owner, myself, I would want the same opportunity before someone completely gave up on me. 
So we followed him back in and were accompanied by a private table, server and bottle service -- all which were excellent, unexpected and much appreciated. 

Long story short:

-The men who worked there were respectful and helpful. 
-The female servers try to pull wretched shit over other females. 
-The entertainment is so-so (some entertainers were really into it and others were not). 

To any female party interested in checking it out:
I'd most definitely proceed with caution, add dudes to your group or just pay for a reserved table.",U-Guj2uWBA-egraGG-QRVw,11,3,3,r2Z6RWdPn3qL3FgoyLoB-w
3481260,2011-10-14,1,O589S0opFB9oK8VcL5tRcA,"I am not going to lie, I was a little buzzed when I went here, but I had a great time. I went here for a bachelor party. They were super helpful. I called in advance to get the free limo and the driver was awesome. The workers there are super cool, and the happy hour there is awesome. Buy one, get one.... that will get you...

Dancers are cool and talk to you.. I never felt like people were getting pressured to get a Dance. It was fun, and the bachelor was taken on stage for a little bit of cost, but it was worth it and not to expensive. I would definitely recommend to people are looking to have a good time, that is more of a jovial atmosphere, not so much a sleezy, weird vibe.",tJ5h4ggUvB-CmpRL6QzU-g,1,2,4,StCmPp5duAnIciw0B86-tw
3500463,2013-05-16,0,O589S0opFB9oK8VcL5tRcA,cheap lap dances (20 bucks).. lots of talent.. although a lot of that talent disappears by 3 AM.. at least my bachelor friend had a good time..,rW-iz5OKzzp2WOHh-CC9uQ,1,0,3,sv9TW5Jk5JUTSiQiLA7XfQ
3545026,2018-03-12,0,O589S0opFB9oK8VcL5tRcA,They have a Host  named David who is Terrible and always yelling at the Dancers and he is very rude to the Customers .He is Detrimental  to that club and their business. I would think  that they would want people  to come back and be repeat customers instead this guy scares everyone  off.,9-xXbrOJcl7zaEw_IBXzSg,2,0,1,8m3DX0qJyT3rmg3SPJ-Cow
3684187,2014-10-06,0,O589S0opFB9oK8VcL5tRcA,"I visited the club. On the outside there were many Security other personnel, making sure that we and everyone's cars was safe. I like that. 

When we walked up to the entrance,  we were greeted nicely and was treated with kindness.  This was a world class club.",UL9SYGy0Nrit-XvFakhQ5Q,5,2,5,EMBUXTNPVvsfzMrudV84RQ
3684248,2015-12-02,4,O589S0opFB9oK8VcL5tRcA,One star is too generous. I was literally dicking around in our own little solo corner. Paid 35$ to get kicked out. Don't go. Aging old men bouncers. Brainless inadequately stimulating people.,jWGcOVUbZTd7gFRDOTj1Rg,2,0,1,uyDtGoa9UFX3H2rEn1WApg
3689724,2013-07-30,0,O589S0opFB9oK8VcL5tRcA,"This place wasn't too bad.  I was there for brother's bachelor party and (with a lot of money) they did a nice job taking care of everyone, especially my brother.  The drinks are a bit too pricey, and my oddest complaint is that for how huge it looks, the seating is done so poorly it is a bit crowded and uncomfortable.",nLN_gehnTY6vRgpNJP2tOg,0,0,3,KAxC2iNd8a3oK83XDg11Ig
3692124,2013-07-16,5,O589S0opFB9oK8VcL5tRcA,If Spearmint Rhino and Treasures were siblings then Spearmint Rhino would be Charlie Sheen and Treasures would be Emilio Estevez. Spearmint Rhino is a lot more fun with a lot more going on. Treasures is small and booooooring. Bottle service is a lot cheaper though.,kKy2XrlFbQxtbukkFYMiPA,5,3,3,OccIfCGhMPKH-16HtnewDQ
3714257,2013-07-17,4,O589S0opFB9oK8VcL5tRcA,"Not my favorite strip club.  Just because I didn't feel the girls were really into the dancing.  Just more about collecting their dollar bills.  For us women out in the audience, we want to see some moves girls.  You are living art,  people paid to see you perform.  Also dancers, you are supposed to give us ladies ideas on our private performances at home.

The shuttle was a nice service to have.  I was super impressed with hot large the place was.  Two stories!!!  Felt like it was a Chuck-E-Cheese from the outside, an adults playground on the inside.",vXrUBAIN4aoCt7F5p0kU_g,5,3,3,KMIRoCnGooG2-rlC5gKrmQ
3724575,2008-09-01,0,O589S0opFB9oK8VcL5tRcA,"Went here a couple years ago and didn't leave until the sun was coming up. I think after all those wild turkey cokes time or money did not matter. I had several dances including two privates...that was two consecutive privates. It ended up being a night both the stripper and myself regretted but hey, it's Vegas and whatever happens in Vegas...???",PQ6_5QpgusNI4j5Zu8pM5Q,2,0,4,J7GYZv-cuX2rso0sFhCuyw
3765444,2014-11-20,0,O589S0opFB9oK8VcL5tRcA,"This is the worst strip club, all the girls are older and it's mostly empty most nights well everynight I come with friends it's always empty and we always end up at another club, last I ever visit this club on top on that that Asian manager who ever he is tried ripping us off on entry until he found out we wr locals, they scam and never stepping foot in this trashy strip club, goodluck!",wKns-bfoOUCd2EujYBn6Sw,0,0,1,KyC9AeC_LnJ2Emc86CFBwA
3787157,2014-11-08,4,O589S0opFB9oK8VcL5tRcA,"If I could give this place zero stars I would. Came here last night after the club with my two sisters. Thought it would be a fun way to end the night. It wasn't!!!! We requested  lap dance and got sent a girl that was unenthusiastic, flat assed and busted. After standing in front of the birthday girl and shaking her butt for one second, she got ""offended"" and huffed off with the $20. Who knew strippers were so prudish?! Guess she'd rather be groped by an old fat dude... Complained to management and got comped one drink. Big whoop! The only plus were the bathroom attendants who were actually sweet and helpful.",3ksu5MGyt4aeIL7Ytbn3NA,0,1,1,LT3sGTPJcSU9fV4u-Df5kA
3789666,2013-05-12,5,O589S0opFB9oK8VcL5tRcA,"On the strip we were stopped by a promoter claiming a free limo ride to and from the strip. free cover and free drinks. we got there and there was a cover fee of 25 bucks. 

the drinks were hella over priced, again no big deal however we were promised free drinks and got nothing.

when a member of our party tried to show a door man the video of what was promised shit went to down. hella lame and we lost our ride.

door man knocked our friends phone outta his hand. doing hella much. 35 bucks in taxi fee, we had to take 2 back to the strip. 

bay area got no love here that night.",fTmRX6r8zHAcQ9S8SbGucw,11,1,1,jD1Yi0NI9b9MKQxmvcwPdg
3793510,2014-04-14,8,O589S0opFB9oK8VcL5tRcA,"So we just left Treasures on our last night in Vegas. We had a party bus drop us off for no charge and the two drink minimum was fine and easily understandable. Drinks were strong. The girls were sweet and very talented. So why the two stars?

My beau went up to a girl to try to get his friend a dance and on his way up, he accidentally dropped his winnings from earlier that night. Before I had a chance to even say anything, a girl ran over and picked it up and ran back to some dude's lap. I confronted her about it and she was about to give it back to me when some senior stripper told me ""any money on the floor is fair game"". And the girl stuck the money back in her purse.

I was having an absolutely amazing time until then. We left right after that, there's no reason to give any more money to thieves. 

Watch your back when you're there.",lccsIaHyqWcvhzhLYN8LOg,26,2,2,E0L9eJEVDtS3pOZiA509AQ
3805646,2011-06-21,1,O589S0opFB9oK8VcL5tRcA,"Pretty nice looking building, inside and out, but not a cool place at all. Weird set-up, rude drunk girls, bad service. No way.... on a separate note, the majority of dancers here are usually Latinas, (which is fine), but wonder why there isn't a nice mix?",z18RD3wOIJ8pfey4f82PUw,0,0,1,BtmEW7FNk8I7fhwnvohVhg
3810821,2011-09-21,2,O589S0opFB9oK8VcL5tRcA,"$25=  entrance fee, 2 drinks, and taxi ride
not bad  for a first time-curiousity trip. $20 for 3 minute lap dances- jeez. and the women were amazonian-sized.",hXaRCEtK7175XyLPSDM-Kg,0,0,3,OassmsBWvGVmY6NlONtqDQ
3868870,2017-06-25,1,O589S0opFB9oK8VcL5tRcA,"$70 entrance fee when me and the wife hit up this place, we said screw that lets uber back it to the hotel, however one of the dudes inside came up to me as she was using the restroom and said how about $30 for you and her? so i said deal. Inside the layout was nice and good quality of dancers. However when i hit up the bar for two mix drinks of 7&7 each one was $14 so in end end they still squeezed out what $$$ they could.....second star is for they chick who my wife paid to give me a lap dance she had some amazing big boobs.",y8rL_GVhEtGyA5rt3wigmg,0,0,2,rW-q7VgmDBgutptRRIummg
3881554,2016-04-16,10,O589S0opFB9oK8VcL5tRcA,If there were zero stars that's what I would give. This woman by the name of Leila walks around like she is a stuck up middle eastern broad that probably did a few lines. She kicked us or of the place after the security told us to wait inside for an über. Maybe she needs to take the stick out of her butt and get some personality.,IJ_4Iw3wSoBiAk8d4lbR4w,6,2,1,C0SFTGMjZ6rHNn1C-ZNN1w
3888357,2008-06-04,4,O589S0opFB9oK8VcL5tRcA,"My continuing search for the great steakhouses in Las Vegas has led me to this Gentlemen's Club. I wouldn't come here normally but a well-informed local told me it serves some great steaks. And he's right. The meat is very, very good; almost as good as Prime, believe it or not. Thick and juicy...well-prepared, and simply seasoned. The lobster tails were not as good, but still tasty. The service is prompt and quite colorful.  The decor is kind of upscale ""vegas brothel"" but not unbearable. Prices are a little lower than the Strip steakhouses: in the low 40s.

However, there are two areas that ARE irritating.
First, the wine list: it is very modest and obscenely over-priced; 5 times retail in some cases!  A bottle of Siena which can be purchased for around $20 at Lee's Liquor is on the winelist at over $100!!!  It should be about $50 tops.
Second, because the restaurant is connected to the strip club, dancers wander in thinking that diners want their company, which is extremely annoying. Just do what I did and tell them they are not the kind of meat you came there for.",yi_4YTVS6XL7s5atKPbmpA,3,5,3,Dz6wCsW7fRJhk45uRAo5UA
3896401,2012-03-02,2,O589S0opFB9oK8VcL5tRcA,"I tried to go here for dinner with my friend. We got to the front door and they carded us , im over 21 and my friend is 20 . we  werent allowed to the steak house part of the club because of that . I herd good reviews about their food . So she and I left ......since you have to be 21 and over to apperently eat there...I try again some other time .",em8n7IUsqMtWPY7ECmYDEw,0,1,3,Ny5C52J9YM2_pXPmTZvhFA
3914310,2011-11-08,0,O589S0opFB9oK8VcL5tRcA,"VERY expensive liquor, but very good.  Must be seen to believed.  Would be a 5 star if full nude.",M8_SCgSFAS8MYNtIzy5aZg,0,0,4,XlvDAz9QuAXAZ4Tib_JhyA
3937266,2010-06-09,0,O589S0opFB9oK8VcL5tRcA,"free shuttle/ limo from the strip, $25 cover that came with two drink tickets....not that bad of a deal. lots of poles but i was pretty disappointed with the main stage. if i go to a club i want that pole to be taller and i want the lil mami on stage to be doing some tricks. it seemed like any other strip club ive been to so i wasnt that impressed. they did lap dances right there on the floor. i am not sure if they had private rooms but i can go to any club and see a chick giving some random guy a lap dance so again not impressed. but hey it was pretty much free so i guess it was fine.",KmqivnDXe3mVjBtp9ZxkOQ,0,0,3,mfp6YCAP6JC0QYagoZDxhQ
4058123,2012-11-09,2,O589S0opFB9oK8VcL5tRcA,"This review is solely on Treasures Super Bowl party!!     What an amazing deal!!!  Limo service, unlimited premium drinks and shots, wine, great food which was changed out at halftime. One dollar half time dances. Great viewing to watch game. It is the best  deal in Vegas bar none to watch the big game at. The service was second to none!!  Our party of 25 will NEVER go anywhere else. The bar staff , perfect, the wait staff , exceptional, management totally has their stuff together and organized. It was classy, fun , and an incredible value!   thank you Treasures and we are looking forward to 2013!",RiEo6fAuvM-3D6mTNtc9FQ,3,2,5,DEqYttJ4batK4IVeME2c7A
4077803,2014-09-17,1,O589S0opFB9oK8VcL5tRcA,We knew this was a scam but we didn't realize how badly we'd be scammed. Avoid avoid avoid!,vy-XfwAqpOV834szifaQLQ,1,0,1,Lb0sXcbIgPLkln_0lFky6Q
4125231,2011-12-15,42,O589S0opFB9oK8VcL5tRcA,"D
A
Y
U
M

Talk about sweet girls that can be brought home to meet ya mas.

mas = mattress and sheets (seewhatididthere)

Seriously, this place is a fun spot for a bachelor party or even for couples.  The dancers are very relaxed and aren't all over you for lap dances every second you are in there.

About 98% of the dancers look like lingerie models...the other 2%...well..they should stick to dealing cards at the casinos.

I was more than happy to donate funds to this gentlemen's club...although...those nekked ho's weren't so happy to have me make them do some crazy shit on that stripper pole...cuz...I AIN'T NO GENTLEMAN.

yea I said it.",Yjer78RnYr7OCzirgdcOaw,12,7,5,rGCTb63AnUQYGAsI8Hjpnw
4128185,2014-11-29,2,O589S0opFB9oK8VcL5tRcA,Not the best in vegas! Can be better if they worked on they're management! Pretty dam hectic in there!,cargpgMliRat6htmphmwgQ,0,0,1,SGL5v7LxotfO9gcRN0-hHQ
4193452,2015-04-28,0,O589S0opFB9oK8VcL5tRcA,I love everyone here! My husband and I always make sure we stop by.... I know it is odd since we are very professional people but we always have a great time and get taken care of. Bottle service is very well priced and when you are in the VIP section you do get the best girls. Thanks Chico for always being a great host,L1zhHJE253LHXAuM-J9dZQ,0,0,5,0LSVO6Wx-sjf-BjHR7jndw
4197390,2009-01-23,53,O589S0opFB9oK8VcL5tRcA,"It's true that what happens in Vegas stays in Vegas.  Especially what happens at a Vegas bachelor party, but this story is too good not to share.

Last day of my week-long Vegas stag party.  Most of the gang already broke out early in the morning, but half a dozen of us diehards have evening flights home and we're gonna get in one more round of blackjack, Crown Royal and T&A.

Early morning the Rio treated us somewhat nicely at the BJ tables so we had a decent grip of cash to rain with.  About 10am we head out for breakfast, but the limo driver from last night just happens to be pulling up to the curb and recognizes us.  We couldn't say no.

So we had him take us directly to the nearest titty bar.  The only thing open at that time was Treasures so we head over.  1st points in their favor is they comp us the entire cover when they find out it's my bachelor party.  Only thing is, the place is like a freaking funeral home.  No lights.  No music.  No girls.

Us: Is this place really open??
Hostess: Oh yeah, just come on in!

So my boy Hap walks past the entryway into the main room as we follow.  Still, dead silence.  ""What, does this fucking place run on headphones or something?"" he asks.

Hap almost breaks his neck tripping over a big object in the darkness.  Turns out it's a passed out dude.  ""Oh never mind him,"" says the hostess, ""That's Dan.  He's been here since last night.

The fuck?  Whatever.

All of a sudden, the lights turn on, the music starts thumping, we're whisked into plush seats right up against the stage, and a bikini clad blond materializes in my lap like she just came out one of them Star Trek Transporter shits.

Freaking awesome.  I imagine somewhere in the back there's a panel with a switch that says ""Off"" on one side and ""Music, Lights, Tits"" on the other.  Shit was amazing.

We quickly dispatched a bottle of Crown as the girls came crawling out the woodwork and onto the stage.  Good times, although the one single mom attached to my lap was really starting to put me in a deep sleep with her neverending dreams of going back to school.  Luckily, it was eventually her turn to go up onstage.

At one point they put on ""With Arms Wide Open"" by Creed and I jumped on stage and belted out a few lines (with my arms wide open, of course) before the manager came and escorted me down.

As we were about to leave, there was more humor to be had.  A stripper marches into the joint and confronts the manager.  They exchange harsh words and she goes storming off.  A few minutes later Mr. Manager has some security dude go after her.  We go outside to see what's up and girl is a couple hundred yards out, buck nekked except for a bikini top, 5 inch heels and a strip of floss between her legs -- running across the desert in the middle of the day.

Security dude jumps in his pickup and starts coming after her.

She speeds up.

Trips on something.

Eats it, face first.

Fuck, heels must be murder to run in.

p.s.: To Ryan H. - I feel you on the grip of money you burn through at titty bars, but as far as pervs, most people really don't go to these upscale joints 'cause of that.  The pervs get their diddle on at the seedy little local joints.  I'm not a huge titty bar fan, but the fun is in throwing a few dollars around and acting like you got it like that.  Don't nobody really live like that.  Paying double for drinks and cover isn't exactly my idea of a great evening out, but where else can you throw down a few twenties and motorboat a hot gal while she tries to grind your nuts into jelly?",RJ1BpR2vLWZedb68_m6kcA,6,10,4,HBrxiJLsWoGs24KSYogFIw
4241223,2010-01-22,15,O589S0opFB9oK8VcL5tRcA,"I'm usually more impressed by atmosphere than food quality -- but here is a place where both are above reproach!  I've been here twice, and both times I had an awesome meal accompanied by excellent sevice and even excellent-er people watching.  Talk about dinner and a show! 

Treasures is a super-classy faux-baroque McMansion nestled in a cozy industrial area on a frontage road off the freeway. Once you make it past the dago thugs at the door, take a left into the plush, clubby, restaurant, seemingly decorated to evoke Colonel Mustard's drawing room -- white tablecloths and plush wingback armchairs, and a super-cool ultra-Vegas lady server with a raspy New York accent and a brusque yet affectionate tableside manner.  The chef apparently paid his dues in some gourmet rooms on the Strip, and his pedigree is reflected in the food, every bit of which was awesome.  I had typical steakhouse fare -- Caprese salad, Caesar salad, filet, potatoes, creamed spinach, cheesecake, etc. and everything was GREAT!  
But for me, what really made the place special was the fact that you can watch strippers feeding and being fed choice tidbits of meat to/by fat old conventioneers and perverts.  I think the wonderful lady server checked with us to see if we were interested in having female company, and since we demurred, we ate our entire meal unmolested by the girls.  But we did go into the main room after dessert and give them some business, so all was not lost for the club.
Anyhoo, if you're looking for the QUINTESSENTIAL Vegas experience, swallow your square-ass Puritan qualms and go here!  All that other shit is just Disneyland -- thid is what the Vegas of today is all about!",0o8HUzggoNKay9-ZMj3HqQ,9,8,5,oiUWBWHcoCzbWyvZTNU-3Q
