,date,funny,business_id,text,user_id,useful,cool,stars,review_id
7793,2017-05-01,0,O589S0opFB9oK8VcL5tRcA,This was by far a VERY uncomfortable experience. We came here to be entertained not haressed every 5 mins for lap dances and when we declined the guys got pissed off looks on their faces. They were like vultures circling their Prey except for one male stripper that was actually polite & respectful. Thank you Rebel for being a gentelman & for the memorable lap dance. (Rebel & our waiter - I would give 5 stars.....the rest not so much). I'm not a prude by any means but this was too much...I at on point had to tell one of the strippers to back off because he was making me uncomfortable and he still continued to massage my scalp & kiss my hand/arm. Never Again!!,RvnZgQNm0EX7XsY5SZcKeg,0,0,1,1-PxZ0GFZLoQeKL9gJRNGg
7974,2012-04-04,1,O589S0opFB9oK8VcL5tRcA,"yes, it's a strip joint but it's also a Steakhouse and the girls keep their bottoms on, I personally wanted to experience it but they made us wait over 30 minutes for a table and we had a reservation so we didn't get the peep show or to try the steaks. too bad.",MfGPntpM3IGtHHFOf4qf-A,1,0,3,lQ8J2sKYICzceFcTSTZ8Vw
25648,2017-03-25,1,O589S0opFB9oK8VcL5tRcA,"As a local, trust me this place is terrible. There are MUCH better places in town than this, keep looking. Be careful of the bait-and-switch for private dances. The management staff would rather have an extensive argument with their patrons regarding the bait-and-switch problem. (e.g. not taking responsibility for the sales techniques of their girls by saying ""They are independent contractors and they (the management) have NO CONTROL over what they do and say"". That's such a convenient cop-out that I heard it from more than one manager there. It sounds like the management has no control of what the girls do there (hmmm..) unless, of course, it's something that may cost them money then their story changes real quick!",wkgywRYov-7Ou03TLZdUCA,4,0,1,Kew-ERII9cJHXlH2BCv9gw
119904,2015-06-15,1,O589S0opFB9oK8VcL5tRcA,"First time in Vegas... Every day on the streets there are hundreds of people trying to convince you to go to these clubs. I was with a group of friends and we decided to go. The ""promotor"" said that the entrance was free plus 2 free drinks. We got there and was said that we had to pay ""taxes"" which was $35 each to get in. We did recieve a voucher of 2 free drinks. But when I asked for a blacklabel the blond bartender said that it would be more $ for that drink. The place was way full. I could hardly find a place to stand. There were a lot of girls but they werent that great looking. The third round was about an $15 drink so... bring lots of money. I totally understand that in a strip club you have to spend alot of money (I get it) but why the hell do the promotors act like if I'm getting a major discount and then surprise us with charging us at the entrance? Be honest people.... the drive there and back felt kinda unsafe. Beer bottles on the floor. No seat belts. Driver driving extremely fast. I do wished they had better music. Overall it was an OK experience.",_Q8dmyd5y3fvMMGyqeFZHA,1,0,3,E7ls37xcxlo_iMYDdw85VQ
136138,2015-06-08,1,O589S0opFB9oK8VcL5tRcA,"Completely awful car service. The people were so rude! And the guy taking us back to the hotel dropped us off nearby and made us walk the rest of the way! Not re commended. Plus the drink cover charge. Ridiculous. Only go if you want 1 star service. Horrible. Will not go again or recommend it, ever.",BdpZZ9rWAhcEIRCOg4BiZQ,0,1,1,URJLhxd8sk5FEJlkKhtx2A
201708,2016-09-04,3,O589S0opFB9oK8VcL5tRcA,Waste of time and money. Congested and really small place. Girls were giving lap dance right on the public floor. No privacy for paying extra. Going to try a new place but not coming back here again.,qE0c1g1B6Lno0GXW4N8VYw,1,0,1,fliGYEo4lLscbiHjIyozQA
228990,2016-10-06,1,O589S0opFB9oK8VcL5tRcA,"I will NEVER go to this club again. Me and my friends went during the day and they had some of the most oldest bitches I've ever seen , my grandma could work there. The music is horrible one of the dancers told me that the club is not aloud to play hip hop because they don't want to bring in the (wrong crowd "") what is that suppose to mean exactly ??? And to top it off my drink had a bug in it ... I would not recommend going here at all . WORSE EXPERIENCE EVER!!",3TmIvS-2ii_-ulgJ9RJ_SQ,0,0,1,VomHsrpvnCWJtnArkArw-A
261364,2013-08-28,2,O589S0opFB9oK8VcL5tRcA,"Went here with hubby to celebrate his birthday. We told everyone it was his birthday, but nothing special was done nor did they appear to care. There were all different types of girls here, but barely anyone came up to us at all. I believe we asked two girls to come talk to us and they were very nice and gave us dances and introduced us to a friend who also gave a dance. We went up to the stage to ask girls to come up to us. I am not used to have to beg women for attention at a strip club! 

The club itself is nice and spacious, if they actually had girls walk around the entire club and not congregate in the back of the club, it would actually be just as good as spearmint rhino. We left after feeling frustrated that we could not get any girls to come up to us.

There were several couples in there so i was happy that they were welcoming to women. The black dancers in there are very friendly. Can't speak on the white or asian ones because they ignored us.",tMrJ0w9CSoB98BDHPYHMyA,2,0,3,hgteTc9Bb-xjlabH3fmVmQ
297213,2017-02-05,0,O589S0opFB9oK8VcL5tRcA,"I've been a frequent vegas visitor for a few years now been to this strip club a few times and heard nothing but good things about the restaurant, I should have just took their word for it instead of actually visiting. The food, amazing but the ladies that work there are hideous. I'm not sure how long they've been there but they don't even try to make the experience more pleasurable. I understand some of the dancers are cut throat but I expected more of a laid back feel in the restaurant especially for the prices we paid. Maybe if they were hot the bad attitude would be easier to take lol, this place was five stars until I met the condescending and rude waitresses if you can even call them that.",Zs77kJmQMjjDm8vIScIAug,0,0,3,COLKhmj-YQY0iFS7GloZ3g
340305,2010-05-09,1,O589S0opFB9oK8VcL5tRcA,"Best HAPPY HOUR ever!!!

4pm-8pm everyday!
FREE buffet!
$1 and 2 for 1 beer, well, and call drinks!
FREE cover when you drive your own car!
HOT dancers!

It's only 2 blocks off of the Strip!

NOTHING TO LOSE! CHECK IT OUT!

I seriously give it two thumbs up:)",kSo5c-yLEBTzzlaDy1oj0g,7,3,5,nLSK9MrolSdTjJcnq34c0A
352522,2017-07-24,1,O589S0opFB9oK8VcL5tRcA,"Overall, not a bad place. During conferences, I've gone every night for 3-4 nights straight. The atmoshere is very nice and plenty of space and seating. Some nights are less busy but there is still a mix of hot and not so hot girls. Many are pretty friendly and not too pushy. There are always those who are in every club including this one. This is not the problem with this club though. Dances on the floor are about $20 but upselling to go upstairs for a private dance is common. This wouldn't be bad if they told you that the dances are ~3 for $100. Although this is not bad and pretty standard in most clubs it seems, some girls want to charge more. One year I was told $150 for 15 minutes, another time I was told $200 for $15 minutes. Then I was also told $250 or $500 for 30 minutes. So...what is the price? From what I can see, definitely depends on the girl. Oh, and they forget to tell you there is a 2 drink minimum once you get up there. That will cost AT LEAST $20-30, if not more. Expect to spend probably $200 just to go upstairs. If not for this extra cost, it wouldn't be a bad club. Maybe other clubs are like this, but in my experience, this is not the case. Lap dances upstairs can be very, very good depending on the girl but if course that varies by the girl. Some girls may upcharge even once you are upstairs (I will only get topless if you pay another $100). My suggestion is get a dance on the floor first, see what the girl is up to and what she says it will cost before going upstairs. 

I'd recommend this club if you are okay with the upcharging and are willing to spend quite a bit more for privacy in the dances. It's not a bad place and the girls can be better than I've seen in other clubs.",74-vM7fXLbcWnz48hJ_txg,2,1,3,aO88u056UDk46VFk0lwGjw
368773,2016-09-06,5,O589S0opFB9oK8VcL5tRcA,So this place plays the worse music. Where is the hip hop? I'm convinced this is why no one makes it rain on stage. The whole vibe was off. Felt like the twilight zone. PLAY HIP HOP!!! And those poor girls could make money,Bpj4JTIMoz4YsNTm3aBxig,1,0,3,yMOn5Au_22c6ktzNCRv_BA
390605,2016-07-11,1,O589S0opFB9oK8VcL5tRcA,"This is the best club in vegas! the ladies are not aggressive, the drinks are strong, and the vip rooms are  the most private compared to rhino and sapphire. If u come in the club limo,  u get comped drinks for the club entry. If u use them upstairs with the lady of your choice, it's worth the whole  trip to vegas. But the 30 minute rooms are the best ever! Me and my spouse love everything about this place!",fuK40i0KGZv3VbavRxso-Q,0,0,5,523ssRWyl1IfJygCexg0Ow
436327,2014-04-11,1,O589S0opFB9oK8VcL5tRcA,we enjoyed the atmosphere and the staff was very friendly.. the dancers there were very friendly and not pushy like some other clubs we have visited.. we left after a few hours of a great time..,MTxKvY7v7bKzPYGlyLvUew,14,12,5,O7ETwIouYHBqe3VCmEjj5Q
451560,2016-03-08,6,O589S0opFB9oK8VcL5tRcA,"Come on guys! I came from LA with my lady, were in our late 20's. Limo picks us up for free and were at the joint, Whoops! I had a knife in my pocket, slide it to the doorman with a 5$ tip and we are in the door... Big surprise everyone, yes it's 35$ per person and you get 2 drink tickets. NOW LISTEN TO THIS PART! It's Vegas, therefore it's expensive. We all know this. For Christ's I bought a pack of cigs at my hotel for 15 bucks! But in the club my jack and cokes are 17 bucks (and for the love of god JUST GIVE THEM THE 20 and get back to the business at hand! THE GIRLS YOU DOPE!) I digress, so... 2 drinks come with each cover, so that's 34$ effectively voiding your ""cover"" and don't forget that free ride you just stepped out of. For the 2 of us, that's 70 at the door and I use my card, I sign the receipt and the counter lady says ""In Vegas you ALWAYS fill out your receipts"".. That's a great tip! Slap a couple bucks on the tip line, shoot her a smile and were in the club.. We grab a table next to a rather boisterous group ladies and drunk/loud and ""balling out"" guy throwing money around getting loads of attention. Not gonna lie, I hate those guys but after a few lap dances and a few more plumes of singles thrown in the air, I didn't even see him leave. The cocktail waitress is at the table within minutes, and we pass her 2 tickets and I let her know we're gonna burn through these vouchers, pull the required funds from the ATM, and yes that's a pricey endeavor so be forewarned. Loaded up and walking back to the ticket i look my lady and see that she's looking at a dancer and the dancer is looking back at here. So far friendly to ladies, I sit down, hand some cash to my lady who in turn lays them out on the rail. At the end of her dance, I see a smile exchanges and a minute later Georgia sits down and introduces herself. The cocktail waitress sees that were polished off the first of our included drinks and 2 fresh ones hit the table. FIRST LESSON PEOPLE! The waitress is there, the dancer is there OFFER THE WOMAN A DRINK! Including the tip to the waitress, and a drink for our girl, I part with a even 20 and PRESTO. You have just established that you are not a cheapskate back-row peeper, WERE HERE TO HAVE FUN. I'll be completely honest and brief from here on out. I lost count of drinks for my lady and I, and encouraged my lady to spread a stack of singles around where she saw fit. I am somewhat aware that i have parted ways with somewhere in the realm 250 dollars. That's penny's is this town, and YOU KNOW THAT.  I decline an initial dance but offer Georgia a 20$ for the chatting and looking her up and down for a good 15 minutes. All 3 of us are smiling and she's leaves her drink at our table and tells us she will be back after this song. These girls are at work guys. There job is to like you and make money, be a man and meet them half way just like you would anywhere else. Ultimately we have a great time, we decide to go upstairs for a thrilling private dance (short but fun) and only do the one round at 100 bucks, 2 slightly higher priced drinks with tips and the next thing you know we wander out at 5AM, pocket roughly 600 dollars lighter. I look to my lady and we have  smiles plastered on our faces... WORTH IT. Sadly the limo guy went home, I collect my pocket knife from the valet and he manages to convince 3 locals to drive us to our hotel in their 70's shaggin-wagon. 10 minutes of laughing and reminiscing with complete strangers and were back on the casino floor buying a bottle and heading to the room. My personal belief is that the shitty reviews come from people who refuse to accept how things work, or have unrealistic expectations. Had we had the energy we would have done it again all over again tonight! Neither of us want to come off as a creep but we both admit wanting to see Georgia 1 more time, but we truly are feeling the effects of 5 nights in Vegas. Maybe if the stars align we will see you again girl! Big shout out to Georgia and the folks over at Treasure. We had a blast and are defiantly coming back. Until next time! Tye & Chantal from California",qudS2jg2hkd60GbN6Wxl5w,8,5,5,R68vSc0xcvn3Jhh6RNPcQg
489476,2012-01-24,2,O589S0opFB9oK8VcL5tRcA,Was here for the AVN so a friend wanted to try out this club . Great dances if you pick the right girl ! Came here cause I was force against my will . The quality of girls are good . Tried out the VIP again was force against my will . Drinks are pricey & especially in the VIP which the drinks is totally rip-off ! You have to pay for 2 & you'll be lucky if the waitress gives you back your change so you pretty much get ripped-off twice ! Girls here can get money hungry so they always try to get you to do VIP which pretty much the same dances you get from the regular couch dance . Unless you're like Charlie Sheen ... you're better off getting dances from the couches ! P.S. Was my friends idea to come here in the first place .,zRiusaL8cv-zgXYXISTTzg,1,3,3,L67Ha1865GaUY_8GGygRrw
490053,2014-10-24,5,O589S0opFB9oK8VcL5tRcA,"The place is filthy....Warning...theres bugs BED BUGS...I work for a internal med Dr. And I know what those little critters look like I got up to go to bathroom and I thought what the f*** is crawling on me and long behold  there was one of those little critters crawling up my leg.... In the bathroom that was filthy girls are actually sitting there eating their dinner  Yes in the bathroom eating gross disgusting... Then was another girl actually doing drugs right out there any open whether it was cocaine or meth I don't really know the place reeks of marijuana... Then I overheard two dancers talking about how they buy their drugs from the house mom then some big old blonde lady  fat one comes by...
 and tells the girls oh okay I got it come on I'm like really are you kidding me this is supposed to be the house mom.... needless to say I don't care about the drugs but the bugs bother me so I got my 
party together and we all left I still feel itchy for the rest of the night and all I could think about was that f****** disgusting bugs crawling on me so it's not a place you want to go if you want to have fun unless you like to be itchy  and have fun with bugs..
By the way  bed bugs I really really difficult to get rid of",VzhUaRjio8DwWqoaVwrBYA,0,0,1,sylU6_DetNmeSLA1ucMuTA
570859,2015-07-24,2,O589S0opFB9oK8VcL5tRcA,"Hello, well I went there for the happy hour and buffet, the bartender ignored ,me there was no buffet it was too dark to see anything the girls were of lower quality, this was a Friday in Las Vegas unbelievable spread the word!",nWeMeqiVREQ7pNQQqjqlYg,1,1,1,TouU7Zqx4YWd_uO2hPS9hQ
596900,2014-12-06,1,O589S0opFB9oK8VcL5tRcA,"1. Only good part was the girls. A few were very interesting and intelligent on top of being hot as hell. Though most were nothing but manipulative. 
2. Drinks are$28 for a DOUBLE WHISKEY AND 7UP. If you ask for anything bigger they charge extra and if you ask for a simple double rum and coke they charge you extra and it's not even a decent double.
3. The bartender tried to stiff me on my drink by asking for my drink ticket when he already took it. Then instead of admitting his mistake acted like I was the one being a dick.
4. Do not make this your first strip club. Even with the ""free"" limo service it's going to cost you 3-10 times what you should be spending. Go to another club. Pay your cover. Enjoy a reasonably priced drink instead of having your cover hidden in the drink cost. 

It may have you looking for treasure but they're going to rob you of yours.",ogTQQqaf46852WwgcHvEvw,1,0,1,XebJLSEa6mqWviGZha5n7g
603941,2016-09-26,2,O589S0opFB9oK8VcL5tRcA,Worst place to go ever!!! Very small and dark and only one woman came up to us. She was HORRIBLE! Completely scammed us and was only about trying to rack us up a huge bill. DO NOT GO TO DEVINE!!! She's horrible and rude. Worst experience ever.,XD0V3ApS8AxF5vG2Sppz3Q,0,0,1,ZXIAxM3P81caEERFj9xHJA
668677,2012-12-26,4,O589S0opFB9oK8VcL5tRcA,"What can you say? A few months ago I was there for my batchlor party and it was just me and three other guys.

All the girls clamored to my friend who obvouisly was better looking than us apparently. 

""Oh my friend (points to me) is getting married in a few weeks""

Girl: ""Oh that cool...so where are you from?""

Me: ""I'm from Portland.""

Girl: ""I mean him (points to the friend who she sitting on his lap)""

Friend: ""Portland""

Girl: ""Your so hot, I want to fuck you.""

Gee if I was gay I probably have sex with him too.

So that's how that night went, plus it was really dark. A girl complained that my friends smoking was irritating her. Earth to girl, your in a strip club...

Eventually I had a decent time there. Take advantage of the limo service they have to avoid covercharge. The driver was really cool and told us how he lost like $2000 in one night. I'm thinking Damn...I should have been a limo driver.""

It sucked that the ride back the limo driver told all the patrons in the car that he was dropping us off at PH and not at the Tropicana because he had people to pick up at PH...",9m2_9wTiATczzA77xNM7-A,3,2,3,JfZloMevaxjD-4XVGUYD7w
687940,2015-07-22,2,O589S0opFB9oK8VcL5tRcA,"Total waste of time. $35 drink cover, the girls spend more time yapping rather than dancing. Lap dances are ridiculously over priced with a mandatory drink charge. Free limos.. I don't think so. they want to charge you to leave. Sadly this was probably the worst excuse for a club that I have ever been to.",qj4ilIpdr9FQqgjD0-SUvg,3,2,1,Jvjlv2CKc9rlmNNjkid18Q
693791,2015-02-01,4,O589S0opFB9oK8VcL5tRcA,"A rather cliche Las Vegas gentleman's club. Great architecture, viable and diverse crowd of ladies and bouncers dressed like broad, tuxedo masks. 
  Was brought here with my friend and fiancée by limo after a rather fun encounter with a promoter, which overall was part of the experience, but to judge the club itself by it merits, let us break it down. 
Pros: 
      *Great service for me and my fellow interlopers. Perhaps it was the female in the party, whom enjoys the womanly figure, but the girls seemed to really enjoy our business. 
      *The girls were kind and attentive, perhaps too attentive at some times. (explained later). 
       *Diversity is always a good thing in a club of this nature. Some were foreign, some were domestic, some were older and some were young. While some may have one, specific demographic in mind, I myself enjoy all the unique qualities the opposite gender possesses. 
       * It has food. While this is alien to me it is nice to have access to food. Steak was overdone a tad but it is difficult to complain in such a setting. 
       * Great seating. At least, when I was there, I bet it can get crowded during busy season. 
       * Music was as diverse as the women who danced to them.
Cons: 
       *Fabricated circumstances; the promoters and the door men seemed to have different stories regarding costs. While I was promised I'd get in for free, it became clear as we arrived that the only one getting in without cost was the girl in our party. They wanted 40$ per person but I implore you that you negotiate this if you mention the promoters offer. They will probably knock down the price to get your business. 
       * It is dark. Really dark. The lighting could use a little more residual image in its wake. You will have difficulty discerning people at a distance. I understand the desire to obscure the feminine imagery but it was a little much. 
        * these girls can be aggressive, and I fear it's because of the income pressures brought on by the vestigial employees. Some are more patient than others, willing to sit and at least talk, but others are far too 1-dimensional in their propositions. They try, vehemently to get you into VIP, which is expensive and comes with a myriad of hidden costs that don't even go to the dancer; this includes tipping the host bouncer, which is ridiculous because he is not the one providing me with service. I prefer to give my money to the hardworking females not the tuxedo clad sentries that stand there broodingly.
      * Expensive drinks. Your average lust inducing beverage is 15$, which is almost a dance without the fun. Come tipsy if you'd prefer not to spend hundreds on drinks themselves, and do not rely on any of the deals the promotors or managers give you because they won't last past 15 minutes.
      * Some dancers aren't as enthusiastic as others. While I was taken care of, my friend noted his particular girl was not as into the fantasy of it all.
      * Overall you will at times feel you are being scammed. I might not be local, but I'm not an idiot either. Be careful of what you ask for and if you want to have fun without wistful regrets, make a plan and remain adamant. 
     
        Treasures has some of just that, but it all comes with a nearly constant pressure and hue of financial foreboding. If you do find yourself here, make sure you have surplus spending money for the inevitable occurrences of extra costs. In conclusion, not a terrible place, and some of the performers are legitimately nice as well as conducive; but at times it feels like you are in front of a slot machine, and a gentlemen's club should never be a gamble.",f5GcSh-E4pTfJF8UX6fdAA,16,6,3,bw_apVUfpOhVWwJbclqIjQ
706675,2017-06-02,8,O589S0opFB9oK8VcL5tRcA,Racism at its finest! Nothing but blonde crack head looking women! Vegas is pitiful!!!! Can't believe this is what these people call entertainment,5ec6ejgfs4u0u74OEEN9sw,7,1,1,lKOEHaxUcTY_6clVYOca1A
712278,2008-12-02,19,O589S0opFB9oK8VcL5tRcA,"It's official, I'm in love with a couple of the dancers here.  Why is my husband just fine with that??",x9g-i1DsB-VjSDGVOdRonA,11,10,4,u2LxeWOKhOQprJ2z3uDuTg
