,date,funny,business_id,text,user_id,useful,cool,stars,review_id
3256289,2016-04-17,1,pHJu8tj3sI8eC5aIHLFEfQ,"I went to Nora's for a special dinner for prom. Very disappointed...I heard nothing but great reviews and when we arrived we not only waited 20 minutes to be seated even though we had a reaervation, but we didn't get our food until 40 minutes after ordering. Reservation at 9 and food arrived around 10:35. We wasted so much time sitting and we were so hungry we filled up on bread and by the time we got our meal our appetite was gone. I was disappointed with my order, for it was not worth the ridiculous wait. I understand if it is busy, but the resteraunt was not packed by no means. I liked the inside but not the service at all. They offered us a free dessert. How about no dessert and you just discount our bill ? So much time wasted. We are not going back.",EdOwjy-XK90W-fWSXFe7qQ,1,1,1,yRw04DIe6ei6HHd90ZInPg
3257231,2014-11-16,0,pHJu8tj3sI8eC5aIHLFEfQ,I have been coming here since it opened.  I love the food here well the pasta.  The pizza is not really my thing here because the crust gets soggy.  But the pasta is amazing.  The antipasta salad is amazing I cant eat certain types of meat that are in it but I still get it anyway and just pick them out.  This place does get busy so you should make a reservation.,gAGUItPJ16hLyAln6MtkeA,0,0,5,0tMzlIqNp5DTXXRkmz3qrA
3264493,2017-06-16,0,pHJu8tj3sI8eC5aIHLFEfQ,Visited Nora's recently for my dad's birthday dinner. I really enjoyed Nora's. The service was outstanding the wait staff was very attentive. They also surprised my dad with a dessert for his birthday free of charge. I will only review the food I ate as everyone has different tastes. I had the brown butter shrimp for the appetizer. It was good but not quite as flavorful as I had hoped. The brown butter gravy dominated the dish. The shrimp however were cooked perfectly. For my main dish I had the Fettuccine Carbonara. I loved this dish! The pasta was cooked perfect. The sauce and ham were excellent together and was a very generous portion. Very comforting dish. The meal for 4 people including a few drinks was about $175 an incredible value in Vegas with out feeling cheap in any way. Well done!,dJ4RT4iObUqJdpKx-z6GjQ,0,0,4,xbMyJuVnkhvB1NuglYMYHw
3268554,2017-05-15,1,pHJu8tj3sI8eC5aIHLFEfQ,"Poor service and very average food. 
Red sauce and is basically red water. I had the veal parmigiana (typically one of my favorites). Bland!! No flavor to the veal or red sauce. Even the pasta was bland. Smothered it all in parmigiana and red peppers. 
Did I mention the device? Horrible. I've had better service at outback. 
Here's the topper! My wife gives them about 800-$1000 a month in lunch banquet business. And the manger that know her by name couldn't even say hello. Just stand there watching his staff struggle and stare!!",8pnPIHe9YJTLHlugEmOcBA,2,1,2,zRswS9sfEChNI7ZsAWSzeQ
3269714,2016-10-13,0,pHJu8tj3sI8eC5aIHLFEfQ,I went here for lunch and dinner within the same week. Food is delicious and service is impeccable. I really love the new location. I go to Carmine's usually but now I don't have to go the strip for clam linguine!!! Thank you!!,XNqIs9x4VDWt-yKfcOmJ-A,0,0,5,KV2nUAhmMqquhlGIhW76wA
3272338,2012-03-05,0,pHJu8tj3sI8eC5aIHLFEfQ,Great food and pretty reasonable considering Vegas.  Loved my pasta dinner and the service was great.  I would go back but probably ask to sit in the dining room instead of the bar.  Salads are  large so share.,_fz8e_UpOaMR_ZwjGDknvQ,0,0,4,xFE2vqOZJBpt9q7YkV0xRQ
3274786,2016-12-27,0,pHJu8tj3sI8eC5aIHLFEfQ,By far one of the best Italian restaurants in Las Vegas! Love the new location and the service is still amazing! Thank you for a wonderful holiday celebration dinner!,akvRjb2sg9JqngqIIx-gdw,0,0,5,8FFOY8UHIwoVFYmB-KKsvQ
3277581,2013-06-24,0,pHJu8tj3sI8eC5aIHLFEfQ,Excellent Italian! Will not disappoint. Pasta cooked to perfection and sauce is very tasty. Will definitely return when back in Vegas.,4_6UW68r5WRK83nbtid86g,0,0,5,_50CrtPpOXtgA2-jmfM8lw
3284337,2009-10-30,0,pHJu8tj3sI8eC5aIHLFEfQ,"This is an excellent restaurant. Great for family, friends, and date-night. The service is always very good. The food is delicious. The Pork Tenderloin is a family favorite, as is the antipasto salad. Make sure to get reservations and good directions so you can easily find this cozy restaurant.",YBWeFCP1Ou28KBXb-mFjkw,0,0,5,Y69XeNEr9QQAvRxUmbmtuQ
3285307,2018-01-30,0,pHJu8tj3sI8eC5aIHLFEfQ,"My favorite Italian restaurant in town! This place has everything I expect from a restaurant: beautiful building with a nice view, indoor and outdoor seating for when the weather is nice, variety of foods that are delicious and reasonably priced, and good service. 
This time I booked a reservation. I arrived early and was still able to be seated right away. The waiters looked nice in their uniforms which added to the elegance of the restaurant. 
The garlic bread sticks are tasty. I appreciate that they brought them out right away. After we ordered, the food came to our table in about 15 mins. 
I had Veal Cannelloni alla Vodka that was delicious. I  enjoy everything I've eaten from here.",Bj3neXYOGRUqGeqhUWwm6g,1,0,5,6ASBnO4-3NMon1ko4goWbQ
3286301,2017-07-30,0,pHJu8tj3sI8eC5aIHLFEfQ,"My favorite restaurant of all!! Celebrated our 22nd Anniversary tonight with our 2nd son's close friend & his wife (We lost him in March). They just purchased their 1st home as well....there was no better place to take them rather than Nora's.  The service is awesome, atmosphere is spectacular... their new location... WOW!! Most of all their food, anything you choose, is out of this world!!! Thank you once again for hitting it out of the park!! This was Matt & Lindsay's 1st visit, I could assure you they will be back",lqL_vyU6Ar5ol3yEm5VAwA,0,0,5,cyfKHJasSILMn6BABYAnMA
3291736,2016-03-26,1,pHJu8tj3sI8eC5aIHLFEfQ,"Reservation:  7:15 pm
Seated:  7:35 pm
Out of the Restaurant: 9:37 pm
Party Size:  3

This place is definitely a local spot. The food is decent but the service is so, so slow. My family and I ordered salads to start and then we got a  pizza and 2 pastas.

Salad:  I had the Caesar and my mom had the house. Way too much dressing and cheeses on both. 

Pizza and Pasta:  The pizza was ok and the pasta again was nice, cooked on point but again way too saucy. Almost overwhelming. 

Service:  We were a table of 3. We did not order anything complicated.  We did not leave until 9:37 pm. It took almost 50 minutes from the time that we finished our salad to get our entree. Absurd!  The waitress did come by and say it would be just a few more minutes however that's just nonsense. There was a large table of 12 that they needed to serve before us apparently and that is why the wait was so long. We were about 5 minutes from walking out.  Management seemed to be more focused on the locals at the bar as opposed to getting the food out. Disappointing. 

No one should have to wait that long for decent if not average food. Quite disappointing considering all of the '5 star' reviews. Not worth it.",t915J2Cz0sMYQk-nEwA0Ng,4,1,3,X0kwzMCNbPRmdIl5InAMxA
3294089,2017-11-06,0,pHJu8tj3sI8eC5aIHLFEfQ,"Update: The meatballs are not like they used to be... just had them tonight, please go back to your original recipe.


Been coming here for years. You can take a New Yorker outta New York, but you can't take New York out of a New Yorker. This place is legit, true Italian good food like Nonna used to make. The meatballs are the best in the west. 

They're building a new location at the moment, can't wait to see the story go on with this place.

Salute!",8RpcFdRXQMb1iZnfBg_01g,0,0,5,ClPUXcVJ4lXrBRYoXwzHNQ
3294133,2009-11-17,0,pHJu8tj3sI8eC5aIHLFEfQ,"Nora's is one of your not-so-secret neighborhood gems residing in a nondescript strip mall on the corner of Jones and Flamingo. it seems as if much as been written about this place and opinions vary. Mainly, it seems like an issue of expectations. So here is what to expect and you can decide for yourself if this is going to make your dining rotation. 

Nora's is really the combination of two suites in a strip mall. The room to your right will have a band at 9pm on a weekend night offering smooth jazz or whatever is Italian restaurant appropriate. The music is not too loud and you can either enjoy the music in the background or sit nearer to the band if that is what you are there for. There is also a semiprivate room for about 10 if you are having a little party. The other dining room is just a dining room. I didn't eat there, so I can't really say what the experience is like. 

Service. I will get this out of the way since this is where they lost a couple of points. The service was by no means terrible, as we were seated on time, food timely and drinks filled. It was just more of an intangible indifference I felt, as if I was not supposed to know about this place. Maybe everyone was in a bad mood because the night was cold and they were missing out on the Pacquiao vs Cotto fight. Or maybe you need to be a regular for a little warmer service. 

Anyway, I just desire warm, friendly service with Italian food. It just seems appropriate with pasta. Just like I expect bad service from the best Chinese restaurant. Not a big deal, but this prevents this place from being remarkable. 

The interior design is nice and they do good job of providing a good atmosphere. You will forget that you are in a strip mall. 

Food. Obviously, that is what we are here for. Firstly, by no fault of the restaurant, I ordered the wrong dish. Rare mistake. However, having said that, I believe that carbonara should be a wee less salty. Granted, this is from the perspective of a guy trying to limit his salt for health concerns. However, it is rare that something is so salty that I cannot finish it. The first few bites were delish, but got increasingly harsh as time wore on. Personally, I think that the prosciutto itself would lend enough sodium to flavor the dish nicely, but they went overboard by salting up the sauce. 

Shrimp scampi appetizer = good. Nice large shrimp, good sauce that goes well with the garlic bread. Speaking of which, the garlic bread was okay, with a home made kind of feel, if you like that sort of thing. 

Dessert. Somewhat limited choices, but the tiramisu was satisfactory with a nice wet cake to it. Ladies should have no problems here. 

Wine. An excellent selection of by the glass in case you are drinking solo or otherwise cannot take on a full bottle. Mostly Italians and California wines. You can go budget for $6. I got a couple of glasses of Regaleali for 8.25 each. 

What you must compare all this with is the fact that most of your pasta dishes range from $10-20, dessert is $5 and tea is $2.50. The scampi is mildly pricey at $13.95, but it was still worth it. 

I think it is unreasonable to expect some sort of mind blowing experience. Really, Nora's is a nice local restaurant for a casual meal with a lady friend or perhaps a decent group gathering. Good for conversation, a generous serving a pasta and perhaps a nice bottle of Italian red for a reasonable price. You can stroll in here with a sportscoat or dress more casually if you like (maybe leave the jorts behind, though). So don't expect the world and just have a good time.",xgcxhbbnokR-ZBazUrtXnA,3,1,3,cd7ACueFuDBa6k5UMngsyQ
3305477,2014-01-19,0,pHJu8tj3sI8eC5aIHLFEfQ,"In Vegas for a soccer tournament. My friend went there the night before and had nothing but good things to say. Due to the 45 min wait, we ordered to go. Had the fettuccine Alfredo with chicken, angel hair pasta with meat balls and Caesar salad. We kept it simple, I know but these simple dishes were outstanding with flavor and cooked to perfection. The taste was above average and I could tell the chefs put a lot of time and effort on these ""simple"" dishes. Home run for sure.",6LKZ8R67xkzLeVreRwOJUw,0,0,5,Stry5K_ApRxVBHIga7ZBFA
3310195,2016-12-06,1,pHJu8tj3sI8eC5aIHLFEfQ,Great food! Ever since Savana got fired things have only gotten better,96q951DUuDC_Gxm8Yq9-AQ,0,0,5,XkLJQ7Gzcgb4l7Rh_Jwudw
3315634,2015-07-03,0,pHJu8tj3sI8eC5aIHLFEfQ,"Tip: their pasta is huge so you can share it with someone else. 

I like the chocolate cake it's really yummy. I'm not sure how they make it but it's def a must try. 

I'm not super impressed with their pasta but the pizza is good. I always get the calamari for the appetizer and like it all the time.",U8oBThyq7PSeYPZ3rUfgAw,0,0,4,8klyQdRdC441KqSiEL-2_w
3315878,2018-06-20,0,pHJu8tj3sI8eC5aIHLFEfQ,Wow! What an amazing experience. The wait staff was amazing and the food outstanding. Highly recommend this restaurant!,E6l2iMQxAxXCzQ4MDwF9tA,0,0,5,OFrp-IyuwuTGdFQupT0vcw
3320964,2016-08-05,0,pHJu8tj3sI8eC5aIHLFEfQ,"I come to Noras about once a month. Every time my meal is perfect and the service is spot on. Simply put, Noras is THE place in Las Vegas for Italian food.",6uc89JTPtcBW1yaovKNaUw,0,0,5,E-2o0UZmDFWelsiGuEDvkA
3322120,2017-12-19,0,pHJu8tj3sI8eC5aIHLFEfQ,"We walked in on a Saturday evening around 6:00.  We saw that the place was packed but we went in to see how long the wait was.  We were quoted a 2.5-3 hour wait or we could sit outside on the heated patio.  Granted it was windy and cold outside but I really wanted to try their Chicken Marsala.  We decided to sit on the patio, all by ourselves.  It was cold even with the heater and we did sit out there for maybe 10 minutes before we were acknowledged.  But once we were acknowledged, service was good.

I started with the Pasta Fagioli Soup.  It was good but not super memorable.  The Chicken Marsala was really good.  Chicken was tender and the sauce was flavorful and had enough mushrooms.  My husband ordered his usual Chicken Parmesan.  He liked the flavor but said his chicken was a little tough.  Their garlic bread is amazing.

Like I said, our service was good and it was quiet outside until a large party with kids came outside to wait for their table.  The kids were screaming but the most annoying part was the loud, pompous man with them demanding his table inside.  He marched around like he owned the place.  Unfortunately, they finally got their table when we were ready to leave.",Xo1IpSNvNhOwyFm_tN4sug,2,1,4,X0V38e693vDNq9gUN8aHCQ
3325585,2016-12-25,0,pHJu8tj3sI8eC5aIHLFEfQ,"LOVE the new building and the food is ALWAYS wonderful. A couple of suggestions: invest in black napkins (white rubs off on dark clothing). Get your electrician to put a dimmer on the overhead lighting in the room w/the bar. It's too bright for the amazing atmosphere you have created.
Really enjoy Nora's and wouldn't change a thing on their menu. It is always an enjoyable evening with friends. Will you bring back the live music?",1QTEpIPcX5LUDBlmOyd9XQ,0,0,4,ioxSHypR85J3foT48qS_-Q
3326778,2015-04-14,0,pHJu8tj3sI8eC5aIHLFEfQ,"Family owned and operated....and AWESOME!  Friends brought us several years ago, and we don't visit any other Italian places since. Pizza is great, and my favorite...the Baked Ziti is YUMMY! I crave it at times. We've tried several items, and not a bad one yet. Also be sure to get the Antipasto salad!",-9B3OS9cH8jIwIjYdqn8xQ,0,0,5,sEhJpVeyLZLAIG3C-kBX5Q
3327706,2012-05-16,0,pHJu8tj3sI8eC5aIHLFEfQ,This is such a great place for locals and for visitors who are looking to eat off of the strip.  The staff is extremely friendly and entertaining.  They usually have live music on the weekends and the environment is romantic/inviting and not pretentious.,bRqnuN53TCN6V0eTfSpl8w,0,0,5,tSJLXEQYmh1R7oYqVDjmBg
3332781,2016-01-01,0,pHJu8tj3sI8eC5aIHLFEfQ,"What more can you ask from an Italian restaurant.  Nora's is located off the strip in a shopping plaza, where you would never expect to find this little hidden gem.  I made a reservation but my party members were late.  The hostess had no problems with this and I was seated promptly when my party arrived a few minutes later.  You walk into Nora's and you see a part of the kitchen immediately.  To the left and right are dining areas that are reminders of what you would expect at an Italian dining establishment: lower lights, intimate areas, cozy, etc.  

We were seated and given bread.  We then ordered some wine and beer which was reasonably priced considering it is Las Vegas.  I had the house specialty seafood pasta with a caesar salad; all perfect and as tasty as expected.  The other members of my party had Chicken Parmigiana and an Eggplant Parmigiana.  Both were also great when I tried them.

The restaurant is very good in most ways, and I recommend it to anyone looking for quality Italian cuisine.  It just did not blow me away in any category to earn that fifth star.",JaqcCU3nxReTW2cBLHounA,0,0,4,uFuyCab_p611Ck2qaRJZQg
3335056,2017-04-10,0,pHJu8tj3sI8eC5aIHLFEfQ,"This place is so cute inside and out.. There is a live band playing, indoor/outdoor eating and they have little private rooms for private parties. 

It was my first time eating here and I really liked. We had a party of 10 so they placed in us a private room with a tv, music and lights we could control.

When we sat down they gave us baskets of garlic bread to hold us over until we got our actual food. I ordered the gnocchi in vodka sauce and it was delicious. The price of food was fairly cheap  $12-$25 a plate depending if you got meat or not.

I really like it and it is for sure one of my favorite Las Vegas italian spots!",-PXJEs_9T0lRKpssxf3otg,3,0,5,dHmwzyzOTTIntfJ6sk5B3w
3335929,2015-07-25,0,pHJu8tj3sI8eC5aIHLFEfQ,The food here is great. We started with a house salad which was a nice portion. For entrees we ordered the popular Crazy Alfredo and Rigatoni Gorganzola with chicken. Both dishes had great cream sauces and were delicious. Finally for dessert the chocolate lava cake. I normally dont care about dessert but this was bomb. We ate at the bar and the service was on point. We will definitely be back.,VarDMO6Pn0tBp6jDJQcMyQ,1,1,5,Cgwip8S6j81c1Ozry2vvPw
3343665,2017-04-02,2,pHJu8tj3sI8eC5aIHLFEfQ,"This is a great neighborhood gem. Everything here is good. The Crazy Alfredo is my favorite. They tend to be really busy and sometimes the hostess' can get into the weeds when it comes to seating people. But don't worry they'll get to you. It's worth the wait. 

April 2017 Update
This is based on the rude customer service the ""hostess""
gave my wife over the phone when she was confirming a dinner reservation. Here's a tip, if you're not nice to loyal customers you lose customers. We went to Capo's instead. Everyone there was lovely.",mkY4jH-4v0TBP2EdhGN0_g,4,1,1,CI5pcEnKJwPmfmwhSfzojw
3346343,2017-07-27,0,pHJu8tj3sI8eC5aIHLFEfQ,"I've been to Nora's multiple times and I am a lifelong fan of pappardelle noodles, but ... 

My most recent dining experience tonight left me both angry and disappointed. 

1. No one likes a cutter. Our reservation was at 7:45pm and we checked in 30min earlier,  but apparently that was not enough for the hostesses who chose to seat a couple that not only checked in AFTER us, but WITHOUT RESERVATION. Not cool. 

2. Third times a charm to cook a steak? NO. Medium rare does NOT EQUAL well done, but the server quickly offered to re-cook a new steak. Again, medium rare does NOT EQUAL rare- the second steak was not only unappetizing to look at, but also extremely red on the inside. At this point, the MANAGER came to CONVINCE us that it was the right cut and the right level of doneness. Third steak...AGAIN- it comes back medium well, but everyone has finished eating and it has been over an hour since we sat. For better or worse, we seemed committed to this third steak. 
Not cool, I know what medium rare looks like and shouldn't have to be convinced/almost bullied into accepting it. 

3. Check up on us. If you and other members of your party have ACTIVELY VOCALIZED CONCERNS/COMPLAINTS about the restaurant YOU ARE MANAGING, I would recommend checking on them to assure no other problems or even to offer solutions to fix problems. No manager in sight after initial conversation. Not cool. 

Overall- expect good food, but know there is a long wait and apparently inept staff from my experience tonight.",D2UH9y_nhmZcOxGZ42SsVQ,2,0,2,8_vBEco9zOk-dR0AcKQ1zQ
3347477,2012-01-04,0,pHJu8tj3sI8eC5aIHLFEfQ,"The food is absolutely amazing. No reason to go to an italian place on the strip when Nora's quality of food, preperation, and price are perfect. The calamari is just right, the free basket of garlice bread is a perfect addition as well. The main courses offer such quality and variety, and the servers are spot on. DO NOT MISS THIS PLACE.",p5YSVJLB3NGmFhiYf2HXSw,0,1,5,Z22Lh3Ruf673xu37nS8-GQ
3354297,2017-01-28,0,pHJu8tj3sI8eC5aIHLFEfQ,"Nice late dinner with friends, food was good, service very kind, drinks awesome good sugestión from nicola my server, my busser the small asian guy was very attentive, ambient was ok. One big dissatisfaction is the manager a dark skin guy with a suit , welll my friend i try to get your attention for a question about the drinks but you IGNORED US!! That is what i hate from managers they think their job is just looking around like a clown!!! My friend you are supposed to be friendly and kind with the guests but instead you walking around like a big AHOLE!!!!! I was about to make you a nasty review but the crew in the floor and kitchen don't deserve that because of you!! Mr manager.",Vy1sCEcJlXyVZyy3CRsFkA,2,9,5,FKqmPqOOxoDJK2mK_-ceNA
3357497,2015-10-03,0,pHJu8tj3sI8eC5aIHLFEfQ,This is by far the best Italian food in Vegas. They have the best selection and a great atmosphere. You can't go wrong when you eat here.,gxYsLtosNDh9EAoT87MD8g,0,0,5,7eV3Wsclv5Lwncwo0UuhAg
3369113,2013-09-15,0,pHJu8tj3sI8eC5aIHLFEfQ,Always excellent...! The service and the food is great. The atmosphere smells great. I didn't need a reservation and i waited 12 minutes... Not bad... Great date place. San Genero event was in town and Nora's was still busy..! That is awesome!,c-hfLhNWxgMlww002apw5g,0,0,5,YVyCkTcvb5rp8fTTvG3cOw
3371011,2015-03-04,0,pHJu8tj3sI8eC5aIHLFEfQ,"Delicious italian food!! And you would think that it is more pricy because of the quality of the food and the atmosphere, but it is really cheap for what you get!! I am in love with the white pizza!!",bOcaAgav3wXAZBky64_diA,0,0,5,qam10FkhOWQv7ljKAkNK7A
3371429,2015-08-05,0,pHJu8tj3sI8eC5aIHLFEfQ,Love this place and try to come whenever I am in town.  The service is excellent and very attentive.  Had the antipasto salad and it was delicious. It is big enough for 3 people.  Had the veal Marsala and the veal was cooked perfectly.  My son had the lasagna and it was good as well.  My husband had the veal chop Parmesan and he thought it was adequate.  Will continue to visit when in town,6pccpLEAUFucNcXqAVxwYg,0,0,4,34icXoIHVlUpHDbqx9DYrA
3371901,2017-12-10,0,pHJu8tj3sI8eC5aIHLFEfQ,"The garlic bread!!! I could end this right here right now and tell you just to go there for that, but I wouldn't be doing my due diligence. The second most important thing I can tell you is MAKE A RESERVATION! I was very lucky that I have a friend that lives in Las Vegas and was able to recommend Nora's as well as warn me to make a reservation. When we walked in we were sat immediately thought there were a bunch of other families standing there waiting for tables I assume were just walk-ins. We had the mozzarella sticks as a app and they were pretty good. For dinner I had the chicken Parmesan (very good) and my husband had a chicken dish with pesto that he said was absolutely phenomenal! Unfortunately, we were not able to eat it all because the portions were substantial and we were also unable to doggy bag it because we were from out of town. I wish we had Nora's here! If I find myself in Vegas again I will most certainly come back here!",eWoDT73RQBoWlXF3_CcjUg,0,0,4,D8iA2f0h49-h4PDCYf8SdA
3381255,2015-03-26,0,pHJu8tj3sI8eC5aIHLFEfQ,"Great go-to spot for reliable, well-priced food. The garlic knots are my favorite. They have good happy hour deals.",qjcQD7_-4C5Ig9q_B7dp-Q,0,0,4,4Nb1HIAyaAdRBuwuiTlzgA
3384927,2012-07-07,0,pHJu8tj3sI8eC5aIHLFEfQ,"Anthony @ the bar is amazing!!!  Gotta try his Milagro peno martini! Well that and everything else we tried.  Good vibes, good food food, great drinks, great service!!!  I'll be back.",9GxfojOeFoJ7C2E8JcVmCw,4,4,5,CuGjTYJsoPuNqFqHGXFINw
3401444,2017-09-18,0,pHJu8tj3sI8eC5aIHLFEfQ,"Really 2.5 stars

Very disappointed. It's been a while since we ate at Nora's. Used to be regulars. Food is not the same as it used to be. Sauce was bland. Marsala was salty. The anti pasta salad is still very good. Ravioli could have been better.  

The service was mediocre. Never came to refill water. Very slow.  We had to ask to get dessert.",hp7a4dDL0px7qoxy-wunrw,2,1,3,3pB4H7zJbEe7B0jf2FEjFQ
3403088,2016-10-30,0,pHJu8tj3sI8eC5aIHLFEfQ,"Local gem, similar to Ferraro's .
Terrific ambience, bread delicious and desserts of tiramisu and spumoni ice cream fantastic.
Spinach faro salad w/chicken was very good and lasagna was some of the blandest I have experienced.
Noodles tasted doughy, meat sauce had NO meat and when I told my server Sebastian, he simply shrugged his shoulders. No credit given , no replacement offered.",I3GK8bRnBmwzVDEuRtZt_w,2,1,3,MCqn0DP93B2xPNxlPkIDoA
3407295,2018-03-09,0,pHJu8tj3sI8eC5aIHLFEfQ,"This place is really good the food is really Italian style feeling, the white pizza is just really so good it's so fresh and the staff is just incredible. The new location is so pretty and spacious as well. They do a fantastic job",G2ToQ5eT91v2hkIT7I4X7g,0,0,5,6ow298DSSmpnTXk_su9FnA
