,date,funny,business_id,text,user_id,useful,cool,stars,review_id
4506577,2010-05-20,0,pHJu8tj3sI8eC5aIHLFEfQ,"Best of Las Vegas in 1996, 2001 and 2009.

On my menu....

Trying to keep track of what someone else is consuming is a pain. I'll just recite what I had yesterday...

Garlic Bread (*** Complimentary) Unlike other patrons of Nora's... was not overly impressed with this Garlic Bread. We had two to three re-fills, and each refill was not consistent with any previous refill. Bread not up to par with the rest of the meal...

Alla Nora (**** 1/2 $10.50) Spaghetti, Eggplant, Ground Beef, Tomato Sauce, Pesto, and a variety of Cheeses with a light layer of Breading on top thrown together into a Bowl and baked until the surface is lightly crusty. I told you I was going to have this entree on my next visit! Did not disappoint!

Carafe of Sangria (****) Sangria is supposed to be the Wine Punch of Spain... what is it doing on the menu of an Italian restaurant? The Red Wine was light and dry... but in Nora's version the Fruit, either sliced or chopped was missing or in small supply. Would have been more refreshing with more Fruitiness.

Service was business-like and efficient... and distant. My favorite Italian, where I live, the owner is quite a bit friendlier and attentive... and hand-kissing towards the fairer sex. Maybe I didn't notice it on my first visit, but I was sitting on one of the outside seats of the table.... and caught my attention very quickly. Waiters a little too brusque for me... maybe they weren't Italian!

We got to Nora's around 5pm to 6pm, and there was no problem getting in and, most importantly, no waiting! But... after we got seated, the rush of diners started.",K5FrmVM70cJDbMiZ9ywMag,1,0,4,C502YGwKkvCc6X3dJNTFVw
4507916,2017-04-26,0,pHJu8tj3sI8eC5aIHLFEfQ,"After all the hype I expected the food to be really good. Maybe it was an off day but my eggplant parmesan looked good but it was very bland with no garlic, Italian flavor at all. The side of pasta had about two tablespoons of sauce, also not flavorful. My husband's sausage did not taste like sausage, also not flavorful. 

It was very noisy and you could hardly hear each other. But the waiter was very nice and accommodating. May give it one more chance on the patio.",T9KGawbYlehkYy0MfwroXg,0,0,2,kTyqevcxKakFn7eeF3WL5Q
4508022,2013-10-19,0,pHJu8tj3sI8eC5aIHLFEfQ,"Very nice quality Italian food, I have been here a couple of times. First time I had Penne w/ vodka sauce. Good.. not great. Second visit I had the Spaghetti Marinara, better much better. I am a fan of their marinara. I am not a fan of how close you are to the other tables. I need just a little elbow room for my spaghetti dinner.",FEwPxhjdVKxSPVQQAHX2gg,0,0,4,clvX9mmp061s_gTRK34cqg
4513849,2018-05-31,0,pHJu8tj3sI8eC5aIHLFEfQ,This place is the kinda place u wanna come to every time you're in vegas. Inside is super nice good for dates or group parties. Waiters here are super friendly and very attentive. Can't go wrong the pasta ala nora or my favorite the crazy pasta. Truffle fries and calamari is a must too and save room for their canolis. You'll thank me later,7Mv-naox2ioYjgDK5HsVKg,0,0,5,bE6hODKWFDRaqHlICpRxrQ
4522202,2017-08-21,0,pHJu8tj3sI8eC5aIHLFEfQ,A great place for family and a quite night away from the strip ..  you forget you are in vegas once you are in there ! Not a bad thing when you want to enjoy great Italian food in great company with a glass of wine ..  !!,S9A-S2sLxJ7h7zUBc6PFUg,1,0,5,Z1rIhyj89J9OYcEZUFsutA
4524000,2013-05-15,0,pHJu8tj3sI8eC5aIHLFEfQ,"This is my favorite Italian place! Doesn't look as fancy until u get in. It's nice, quiet (sometimes they have a live band), food is DELICIOUS!!! Good sized portions, very flavorful, great atmosphere.",HTOaU96ad8bKSUkq963h9Q,0,0,4,AgWdQFnQDcJN3uzaP8eP_g
4526823,2015-03-16,0,pHJu8tj3sI8eC5aIHLFEfQ,Found this when searching on Google/Yelp for best Italian Restaurant in Las Vegas and preferably wanted something off the strip.   Saw pictures of the Crazy Alfredo dish and knew we had to go there.  This play did not disappoint.  My husband had the steak special that was so buttery and tender.  My son chose the homemade chicken tenders-he really enjoyed it.  I had a Caesar salad to start that I have to say wasn't very tasty:/.  Very mild flavor.  My crazy Alfredo pasta dish was TDF!  Probably one of the best Alfredo dishes I've ever had!!!!!  Overall we give Nora's a 4 out of 5 because of the Caesar salad missing the mark for an Italian Restaurant.  Our family is already planning our next visit to Nora's when in town!,sYmI0xkRB39phezU8sbNng,0,0,4,z3Eimd-nxQdpTrodAUk6dg
4529878,2014-10-01,1,pHJu8tj3sI8eC5aIHLFEfQ,"Great restaurant!

We came about 5:30 on a Friday and was asked if we had a reservation, but we didn't.  They still sat us down, but asked if we could finish our meal by 6:30 for the next reservation. We agreed as long as they could have the food done fast too. They said no problem.  And they did. 

I ordered the Caprese Salad for an appetizer and of course filled up, so I didn't have much room for my main meal. I got the Crazy Alfredo following the advise of my fellow Yelpers.  It was Yum!!!  

No room for dessert, but still finished my beer. I would come back again.",-50XWnmQGqBgEI-9ANvLlg,2,0,4,AYQyR51emkqeXwULpYDL6A
4531182,2017-12-08,0,pHJu8tj3sI8eC5aIHLFEfQ,"When we to Las Vegas we always look for off the Strip restaurants. We found a gem in Nora's Italian Cuisine. The food, service and cost of the meals were great. I would recommend reservations and you will not be disappointed.",yNDstV5y-0lPQRSUuExnpg,0,0,5,cXoO4TPGLnDFFt7RNjvxGA
4540300,2015-05-16,1,pHJu8tj3sI8eC5aIHLFEfQ,"This was my second visit to Nora's in the past week.  We stopped in for lunch one day because we have heard from two people how good this place is.  Lunch prices are very reasonable and the food is amazing.  

The lunch service was a little slow but I'll tell you what, the FOOD was worth the wait.  We got the Steak and Arugula Bruschetta as an appetizer and it was out of this world!!!   AMAZING!!!  They do bring you a small basket of Garlic Bread, the first one is on them the menu says and then $2.50 after that.  The bread is amazing but when you get a basket with just 4 small pieces for two people and then want to charge me $2.50 for another 4 pieces, that I may question.

I had the Rigatoni Special and the sauce, the sausage, the meatballs, OMG... we also a Nora special which is not on the togo menu so I cannot tell you the exact name but I was told it was the BEST they have ever had.

So since our experience with the food was SO AMAZING, we decided to go back last night and bring my daughter and her husband.  Of course we had the Steak and Arugula Bruschetta and they ordered the regular Bruschetta and both were again very good.  We also ordered the regular Antipasto Salad which we have had in a lot of Italian places and this was by far the BEST.

This time I decided to try the Chicken Parmigiana which you can get breaded or not and it was AMAZING..  The portion size was give me a to go box size which I did take home.  We also had the Veal Chop Parm, a $42 plate but I tell you what, the size of this Bone in Veal was so big, it came home and provided two more meals.  My daughter had the baked Rigatoni and her husband had the Snow White Pizza.  I guess he was having a Disney moment.  

Both dishes were amazing and to go boxes were in order for those as well.  he ordered the medium pizza and it was big enough for 2 to 3 people.  

They all wanted deserts and OMG, the cheesecake is to DIE for, no you won't die if you eat it but after all the food you might explode, the Cookies and Cream Tartufo was amazing, the Panna Cotta was WOW and then a Toasted coconut drink with drambui, and brandy was the topping on the meal.

My friend Frank from AZ comes here all the time and this place was packed non stop last night until about 8:30 then it started to slow down, but I truly understand why Frank says there is NO PLACE like this in Vegas for food of this quality.  Everyone from the hostess to the Manager last night were some of the warmest and friendliest people who ensured the place was running like a well oiled machine and they did an AMAZING JOB!!!  Many kudos to the kitchen and the entire staff, this is one of the BEST Italian places we have ever found her in Las Vegas and HIGHLY HIGHLY RECOMMEND this place and we will be back often, it is just that good.

They do not give military discounts but that is ok, this place is so good I will support them and so should you.  The prices are very reasonable and it is worth every penny.  I don't want to see corners cut to provide a discount and GOOD FOOD is worth paying for and this place is for REAL!!!!",kzRq4H_nSf4b3F_sdymWSw,5,4,5,RiXlrTfgcseLhqN1tmEKzg
4541467,2017-04-28,0,pHJu8tj3sI8eC5aIHLFEfQ,"Ordered a ""To-Go"" order for a business luncheon today.  VERY disappointed!  We ordered two Italian Subs and they did not include the dressing.  The sandwich was too dry to eat.  The Veal Milanese was to be served with tomato and a house salad.  They forgot to include the salad and tomato, so all we received was a fried piece of veal without anything else.  They completely forgot the Mozzarella Caprese, so one employee was without a lunch.  Only ONE order out of the FIVE was correct!!  They didn't include cutlery, napkins, etc.  Their lunch was just embarrassing.",6gO0lRLc_Q45c3NyVp4n5w,0,0,1,eIiCCH6VLQWNCtY_iZg5LQ
4545763,2016-10-17,0,pHJu8tj3sI8eC5aIHLFEfQ,??????????????????????????????????????????????????????????????????????????????????????????,o2OJI1mHZJcYEiEb6LI4WA,1,0,4,7HZZOz3bY2uJFmodpFXLfw
4552723,2014-04-21,0,pHJu8tj3sI8eC5aIHLFEfQ,"I have been here several times (always for take-out) and have never been disappointed.  Their pizzas are delicious and so are the pasta dishes.  I love the ambiance: it's very casual and friendly.  The kitchen is right in the middle of the action and it's something you see as soon as you walk in the door.  The smells are outrageous and enough to kick the salivary glands into high gear!  On my most recent visit (4/19/14), I ordered the snow white pizza with prosciutto on top.  The pizza was delicious and the crust was perfectly crispy and very tasty.  I also ordered the Rigatoni Nora and the Baked Rigatoni.  Everything was delicious...I'm still dreaming about the leftovers from the next day and how good they were!  Next time, I intend to take some friends with me and eat in to truly enjoy this excellent restaurant.",6mTwT5zQB_JvwZ0IpxP3_g,0,0,5,J3Sp2U83NKc47HBUyUlSLQ
4553910,2017-05-01,0,pHJu8tj3sI8eC5aIHLFEfQ,Service pretty bad couldn't get a waiter to come to the table place was almost empty finally after 15 min had to waive one down then waited again . Food ok nothing great .,G4N6SmsEvMOE-A91l1FmzA,0,0,1,HLD1v6FU2CnUEy5x1LD3YQ
4558608,2017-09-10,0,pHJu8tj3sI8eC5aIHLFEfQ,Love getting away from the strip and Nora's is a solid option!  All the traditional dishes and some of their own unique dishes. At least 1 large and 1 smaller private dining room.  Authentic Italian at reasonable prices without the tourist crowds.,0BGqgH9hYa-kKc42af0SEA,0,0,5,vNviwQ7JdCvKivseYVT1Gg
4559028,2017-06-19,2,pHJu8tj3sI8eC5aIHLFEfQ,"I hate to write such a bad review but I have to. It was my friends birthday and we had a party of 10. Our reservation was on time which was good but they sat us at this round table. The chairs were touching each other and the silverware was touching the next person. Not only were we touching legs but we couldn't even open our menu without getting in the space of the next person. When we asked the host staff to move us and that fitting that many people at a table was really uncomfortable, she said to us: We always sit large parties here and there is never any problem.
She basically made it seem like we were crazy. The server agreed that they were crazy for sitting us all at that table and went and spoke with the manager. They basically said we would have to wait until another large table opened up to move. We ordered a few bottles of wine and waited for a table. It took them 1 HOUR. tables were opening up next to us, they could have put two tables together to accommodate us. It was clear they were irritated that we wouldn't try to eat squished together. 

Once we got the new table, we got a new server who never came to the table. We had to flag down other staff to ask for water or whatever we needed. 
My food was burnt. The list goes on.....

Terrible experience for a birthday. The old location was amazing but now its like all service has gone out the window. very sad to say.",bQABQSWl_wvqYZ6CHhJ1zQ,2,0,2,x2BiaJF4kxy10Y69HovYkg
4567312,2017-05-29,1,pHJu8tj3sI8eC5aIHLFEfQ,"I have dined to Nora's on numerous occasions, from the old location off of Rampart to the new location on Flamingo. Excellent food, wine and service. I will say though, I do miss the intimate setting and ambiance that the former Nora's on Rampart gave.",82kxXl_1K8M3cU66dhB8lw,1,1,5,hFNnAqtBhDsQyBm9nuu0eA
4571111,2008-11-07,1,pHJu8tj3sI8eC5aIHLFEfQ,"I am from the Washington DC area and I came to Las Vegas with my family
for two weeks. Before this restaurant, I wasn't turned onto the idea of Italian
food..but this place did it for me! The Pasta Fagioli was amazing and so was the Gnocchi with Vodka Sauce. I had absolutely no complaints.  The cannolis and the chocolate cake were great too. If you are in Vegas, its def a must.",-Uesh1nDb26yc10ABNR_4g,2,2,5,08ReORsyeJK80uWFWWcTIw
4573464,2016-08-29,0,pHJu8tj3sI8eC5aIHLFEfQ,"Wander off the strip it is well worth the ride. Food was great, service was incredible. Would go back anytime and probably will.",rxHOvm6koUDv-3joGH-JUQ,0,0,5,P_58NhEbfJvGGh1wLqnjUA
4574992,2018-01-01,0,pHJu8tj3sI8eC5aIHLFEfQ,My wife and I went here on NYE 2017. Sebastian was our waiter and did such an amazing job it prompted this review. If you have the privilege to go here and be served by Sebastian you will have a phenomenal experience. Food was awesome. Cannolis are the best in town. Whiskey Sour was the best I've ever had. I will be returning over and over again!,ySSaOzhezsJfQ7AryhGF_A,0,0,5,w_ynrhzNIeiTESNLWLakdg
4578155,2015-11-20,0,pHJu8tj3sI8eC5aIHLFEfQ,"First time there was for lunch. The smells were fantastic, reminded me of places in NY and Boston. Great service, menu included many segments, pasta, seafood, meats etc. Moscato and Cianti was exceptional. Appetizers and entrees were delicious, gnocci alfredo and veal marsala. Will be back.",DJy0V-YTYVpxQaxOpTbNdg,0,0,4,udBNPBe5CRZGCzE-ZyFzTQ
4582387,2013-03-27,4,pHJu8tj3sI8eC5aIHLFEfQ,"I DON""T UNDERSTAND WHAT EVERYONE IS REVIEWING.

This is the equivalent to average pizza place food.

Maybe the garlic bread was decent and someone else wrote favorably about the crazy alfredo -- But if you're in the mood for chicken parmigiana or eggplant parmigiana -- You will be wildly disappointed.

Chicken Parm - BLAND, FLAVORLESS CHICKEN, FLAVORLESS SAUCE/GRAVY, FAKE CHEESE (Not real mozzarella)

Eggplant Parm - TOTAL MUSH and hardly any flavor in sauce either, FAKE CHEESE

Do I really have to spend $$$$ to get decent Italian in Vegas??!!

:(",Ahe7lp0DdVfhhCHb8yaXOA,5,1,1,iR4XrT4tOhODf9CiNVK71g
4587863,2014-12-31,0,pHJu8tj3sI8eC5aIHLFEfQ,"Simply put, the best Italian food in Vegas and perhaps the west coast.... I only review the really good or really bad.  This is really good and a fair price.... Drive off the strip a couple of miles and head west on Flamingo past The Palms.  Make reservation in the weekend. They have the traditional faire plus great specialities.",SXim7Z23lt4Up4gNrE6oYw,0,0,5,12aOCpCZP6HmTytKsEjkPA
4589267,2016-06-29,0,pHJu8tj3sI8eC5aIHLFEfQ,"We came to Vegas to celebrate my daughters 21st birthday and chose to eat here. It could not have been better, the service was attentive and helpful, the food was so good we mentioned it even days later. When the server found out it was my daughters birthday she insisted on bringing out a beautifully plated dessert. All in all great experience, not one negative thing about it. Thanks to everyone there!!",5GO-2f7c9CdOTzRbbmZiSw,0,0,5,klDltTi7dC-wedKaYu8pPQ
4590388,2010-07-01,0,pHJu8tj3sI8eC5aIHLFEfQ,"This place was referred to us by a freind, who is a local, and boy where they spot on, especially when he recommened the Anti-Pasto Salad. Yummy garlic bread.  We had the Spaghetti and Meatballs, and the meatballs are excellent!  Full of flavor, moist.  The Antipasto Salad is super fresh, crisp romaine lettuce, great deli meats.  Sadly The Chocolate Cake was a bit disappointing for us.  I think it had like nutts and and lemony sauce, it just wasnt quite our cup of tea.  But their Canoli's, OMG those where some of the best i've ever had, very very good!  We visit Vegas often and so far we've been back twice( in 2 months) .  You just cant beat their prices and great food.  We'd rather eat at a great local place like this then pay the over-rated and over-priced fees of a lot of the restaurants in Casinos or on the strip.",22O2cL6hxqZp-NgUG5B1pQ,0,0,4,8csAQ03D4LKO5ZVK3kVSOg
4593416,2016-07-01,0,pHJu8tj3sI8eC5aIHLFEfQ,"I wanted to see what all the hype was about with Nora's. We went around 5:30/6:00 on a Thursday night and it was pretty calm but right as we were seated tons of people started coming in. The service was great and our waiter Kenia was fabulous! She always checked on us and the bussers were constantly walking by checking on us too! The only downside was the wait time to actually get your food but it was well worth. The portions were pretty big and the quality is excellent! We ordered salad to share, Crazy Alfredo, & Rigatoni Gorgonzola with Chicken. All of it was great! I can't wait to go back and check out more!",V0GV8oGj4G_u5MBZEZt18Q,0,0,4,mDLnCxfaf2y4iuQpE6mzxg
4596900,2012-02-27,0,pHJu8tj3sI8eC5aIHLFEfQ,"Great service, quality Italian, awesome live band (Nat King Cole/ Frank Sinatra jams), off the Strip and close to home--what can be better than this?  I came here twice within a month.  It's intimate, yet fun to bring a small group of friends.  Reservations are recommended, because they are quite popular with the locals.  

The calamari is a great starter (light in batter, crispy, yet not oily).

The Frutti di Mare with the spicy marinara is yummy if you like a whole lotta seafood.  All portions are big, so you can share between two people. 

But if you like something light in taste and creamy and not too meaty... I recommend the Melrose Shrimp.  Creamy basil pesto, zucchini & sun-dried tomatoes, and linguini-- garnished with 3-4 giant succulent seasoned shrimps.  There are pine nuts added which gives it a nice crunch, but you can ask them to hold off on that if you're allergic or it's not your thing.

I really enjoyed their live band which played a lot of vocal jazz (New Orleans kinda tunes).  It was great vibe.  My friends and I had so much fun--we'll definitely be back!",gtEjMgcW74ZcG0zzMctmKg,1,2,5,azEauWOrgkBDEqnCEUy7gg
4621908,2016-02-16,0,pHJu8tj3sI8eC5aIHLFEfQ,"Heard Nora's was the place to eat, but got their & soon realize they should've just changed their restaurant to ""Reservations Only"". & btw 2/12 Hrs is not 45Mins. I seen people been waiting patiently for hours but of course ""Reservations"" will be seated first. That's not really an issue. But the real issue is ""Reservations"" that had missed their time & show up late can still be seated ahead of Walk-Ins which makes 0 sense.",yTMQ33T1mvZF1jmTIwX8_Q,0,0,1,88DtqvD_2dY2GKUMCIXh8A
4621956,2016-09-30,0,pHJu8tj3sI8eC5aIHLFEfQ,"Chose this place because its my daughters name...Nora who? The food is phenomenal, atmosphere relaxing, my server Donald was top notch, absolutely loved the music playing. I will def be coming back here hopefully bring others so they can have a great meal and experience",JB1zbyo8m_uJBqTYISxSdw,0,0,5,NBD8aM6mlsYaP2XU_TaXJg
4624369,2015-09-25,3,pHJu8tj3sI8eC5aIHLFEfQ,"Noras is one the locals favorite Italian restaurant. Their food is very authentic and delicious. The atmosphere is cosy and pleasant. This is one of those places where the servers would recognize you and make you feel welcomed. There are a lot of locals who frequent this restaurant and are treated like family.
We ordered one of their most popular dishes, the Crazy Alfredo. The portion size is definitely crazy. You can easily share this dish with someone else. The pasta is super creamy and it comes with chicken, sausage and shrimp. I was very satisfied with this dish. However, the best part was the chocolate lava. It takes about 20 minutes to get it, but it's worth every minute. The dessert was soft, super tasty and thankfully it was not overwhelming sweet. The pistachio on top was a very nice addition to the dessert. Overall, this is a nice place if you want great food while feeling like your home.",wtNopFY2ybprzk4FuEbWJQ,6,3,4,YGottBUVDtaKH2wSLPVTVQ
4625383,2013-05-08,0,pHJu8tj3sI8eC5aIHLFEfQ,"We'd been looking for a mom n pop italian restaurant and this one hits the spot! Yet another classy, yet casual place.  The service was great and the waiters very friendly. The food was delicious as well - for an appetizer, we ordered the bruschetta, which was light and very well done. For the entree, I ordered the Alla Nora and my boyfriend ordered, what I'm assuming was the special for the night as I do not see it on the menu.  The Alla Nora was a wonderful combination of eggplant, cheese, and pasta, baked and topped with herbs. I remember his dish as an amazing pasta dish that had a good amount of vegetables, but what stuck out was the gargonzola that was mixed into the dish and was blended into the sauce.  I had expected this to be too cheesy and creamy, but it was just right.  And how can we not top of an Italian meal with a dessert of Cannoli?  Not only was the presentation beautifully done, but it was delicious.  

Price-wise, the restaurant was very reasonably priced and I'm sure I'll be going again in the near future.",fNeBIAZOhR3FSwjKnsT9JQ,0,0,4,3d8kf4DbIQJJ_lW5t--_2Q
4632457,2017-03-18,0,pHJu8tj3sI8eC5aIHLFEfQ,Went to new location for our annual big dinner party. Unfortunately new is not good. No longer same charming place. We were there for 7:30 reservation and didn't sit until 8:45. No apologies just attitude. Service was not the same. I am no longer a fan,vMJfgZLZmMjwLaEWrllyCg,0,0,2,2-YGEMvSQPH2G_HPphSnFw
4639425,2017-05-04,0,pHJu8tj3sI8eC5aIHLFEfQ,"The food was good, nice atmosphere and a very popular place.  I would tell friends about and I would return to try something else on the menu.",rc7MOepnGjpmldvvrzHjDg,0,1,4,mneIdTV_2nRxvFc5b0TXdg
4639817,2015-10-22,0,pHJu8tj3sI8eC5aIHLFEfQ,"While visting Vegas, my boyfriend and I wanted to try a nice local Italian place off the strip and found Nora's.  The atmosphere was very nice.  Our waiter was very courteous and attentive. The items on their menu had traditional fare and some other authentic plates as well which offered a good variety! I had the Veal Cannelloni al Bosco  which was nothing I've had before.  I thought the sauce was quite delicious, but the filling was a little dry.  My boyfriend got the Chicken Parmigiana.  The sauce was full of flavor and not watery.  However, the chicken did was not crispy, but instead a little soggy, so that was disappointing.  The portions were pretty good compared to your typical huge vegas portions.  If we come through Vegas again, we will probably stop here again! :)",fw_6in7Fvx3yRGDOLtXUdA,0,0,4,UqIx9i-ILN5xOZC4VdaO6w
4641512,2014-07-16,0,pHJu8tj3sI8eC5aIHLFEfQ,"Nora's has been my favorite italian restaurants for years! You really can't go wrong here, it is italian comfort food for me. The sauces are all so delicious, I never even liked Alfredo sauce until i tried it here. The calamari is some of the best i have ever had, and all the specialty pasta dishes and pizzas are great. The service is always great and the staff is so friendly. They have a great drink menu with many wine and craft cocktail choices. The deserts are to die for! my favorite are the cheese cake and the cannoli. Also the lunch menu is awesome and everything here is really affordable and amazing.",P4R0xEG0_bzDkRnnjZY-nQ,0,0,5,5DuOLYOj_pVsOVfOPhoeLw
4642091,2013-04-03,0,pHJu8tj3sI8eC5aIHLFEfQ,"Great food and fairly priced.  Really busy, even during middle of the week so don't come starving.

My only squawk is that the bartender that served us while we waited for a table was less than friendly.

Things got better once we go to the table and after we sat it was on.",DoGNqIcV70TVY1jy7xEDTw,0,0,5,BXtUk0JoDt2rsaZDo0ayZw
4644417,2015-09-28,2,pHJu8tj3sI8eC5aIHLFEfQ,"Good Italian restaurant where it seems like locals actually eat. I had a veal chop parmigiana and it was great, a large chop nicely presented so the bone did not interfere. Also had good spinach sautéed with garlic. Service was professional yet friendly. A really nice break from The Strip.",tkAjiVsQEhcVjc-0CKzcNg,2,2,5,FKpoi1yuxPRA73tBLpZf1w
4648673,2014-11-02,0,pHJu8tj3sI8eC5aIHLFEfQ,Went tonight based on a recommendation and we were pleasantly surprised! Delicious. Everything we ordered was very tasty and you get significant portions. Garlic bread is awesome. The antipasti salad was great. The crazy fettuccini and chicken marsala were on point. Great service and family owned. This will be our go-to Italian spot from now on!,Y500--aJtnKTUPgel26cIA,0,0,5,gbirmEziPftw7T-ayYryHQ
4649662,2015-09-14,0,pHJu8tj3sI8eC5aIHLFEfQ,"Crazy Alfredo was very tasty, although a bit smaller than i would expect for 25 bucks.  You get 1 basket of bread for free - only got 4 small pieces of bread that was more or less burned.  Waiter spent 20 minutes straight talking to the table next to me and ignored me more or less.  I think he liked the daughter.  Thank God for the bus boy who kept bringing me drinks.  Overall well worth the hour long walk from the strip.",xl4rsQqpibUNhR8Jqxp4OQ,0,0,4,zGPPNCOWk7mfSBRvNsKyew
