,date,funny,business_id,text,user_id,useful,cool,stars,review_id
1940434,2016-10-15,0,pHJu8tj3sI8eC5aIHLFEfQ,"YUM! This place is great. Make sure you go to the new location and not the old. It was super busy on a Friday night, so I was glad I made a reservation! Super cute location with an awesome wine fridge against the front wall. I got the special, which was the pappardelle with wild boar...amazing. Cant wait to come back!",p5nLjLUiVLMVVBRryzg28Q,1,0,5,e18_pgNFOdvCOY5tAe8EbA
1943944,2017-03-08,0,pHJu8tj3sI8eC5aIHLFEfQ,"My husband and I went to Nora's back when it was a tiny hole in the wall, now they have moved and apparently they are just too good now to care about their customers.
 It makes me sad, but we are extremely disappointed with our experience and food last night. First, I remembered having soup back in the day and it was yummy, so my sweet husband called to see about placing a to-go order since I am with a cold. First without even hearing what we want, the girl on the phone says ""It will be an hour & half for togo orders"" WTF.... ok but we just want soup. Which she replied ""ok anything else but that and I can't do it"" umm ok at this point I told my husband just hang up but he is way nicer then me to put up with that. SO we order for pickup 3 soups, 2 bowls and 1 cup (small was for my son), he brings it home and much to our dismay all were exactly 4 oz. of soup!!!!! 4 oz!!!!!!!! Seriously !!!!! it was a tiny little cup and he was told ""we don't do cups of soup anymore"" OK but where is the soup if this is your ""bowl"" of soup!!!!! I don't want a shot of soup! 

In regards to the food, that was sad sad excuse for a shot of soup I've ever had!!!! 
I can make chopped up onion & celery here at home, add water, salt & a crap load of pasta noodles and call it soup!!!!!! 

Today I will make my own soup and enjoy!!! 
Hey Nora's want me to bring some over to show your cook what real soup looks like!!! (a real chef would never make soup like they did - hence cooks!) 

PASS PASS.",sxqOFdFtQgqtpZUumcFe-g,2,1,1,jwjRrqFbWsZAauuIryBZ-Q
1955690,2017-05-11,0,pHJu8tj3sI8eC5aIHLFEfQ,"The parking lot is small. Our server seemed like she was only paying attention to half of the table, like she would walk away and we weren't finished talking to her. Horrible because we were there to celebrate a birthday. Based on experience I'd rate them a 3 because of the tiny salt and pepper shakers, I mean come on even Olive Garden has salt and pepper grinders on the table. Also their grated cheese is in those glass bottles that you would expect at a casual pizza place but not at a nice restaurant. They get a 4 because the food was good but I'm not in a hurry to go back.",2mof3UPy9zNJK0cN5t4_NA,0,0,4,5PiYg1ZaKBeEO6m4qoifew
1967195,2016-03-11,0,pHJu8tj3sI8eC5aIHLFEfQ,"Nora's was recommend by a friend and I will never doubt her recommendations again. This place is amazing food was superb, the drinks were top notch, the price point was way below what the food is worth. Hope that doesn't change when they move into their new digs. I will definitely be returning sooner than later.",qFgbxW2Ld_9RyHkC6WGhzA,0,0,5,RX6B3Qe9O0DZ34gc0sI3GA
1970257,2016-07-02,0,pHJu8tj3sI8eC5aIHLFEfQ,"Fantastic? Good size portions, even as a lunch entree. Nora's maintains high quality any day of the week.
A treat for sure.",Mnih8S-cKglOzMWm46hSNw,0,0,5,56WFuYtPyzCPIoFPURMujw
1972071,2017-12-18,0,pHJu8tj3sI8eC5aIHLFEfQ,"Love this place! Every time we are in town we make sure to come to Nora's and escape the strip!!  Our favorite is the Crazy Alfredo, which is spiced with this Alfredo sauce with chicken, shrimp and sausage! Lasagna is ok but we've had better! Love the antipasto salad is the bomb, tons of pepperoni cheese, olives with a wonderful house dressing! For those of you who are gluten-free they have gluten-free penne pasta too!",Ovzxb1n5FzpCSaGM7j0wdA,2,1,5,e7Z4FM3XwCHh3Tq7tfd97A
1977013,2016-03-12,0,pHJu8tj3sI8eC5aIHLFEfQ,"Originally from NYC and living now in Henderson, I had a difficult time finding  ""REAL ITALIAN FOOD""! Nora's reminds of back home where you have delicious Mom & Pop Italian restaurants. You can keep all the famous chef's trying to be Italian restaurants on the strip.
Nora's is the best you'll get in this town.

I could smell the wonderful aromas as I write this. YUM!",hklImHWEzHjgRcR2SkJIQw,0,0,5,L0FJJKJ73Z2_LBegulrv5w
1986604,2017-04-07,0,pHJu8tj3sI8eC5aIHLFEfQ,"My wife and I had lunch at Nora's today
I ordered chicken Parm and my wife ordered steak with salad.
My chicken Parm was over cooked and the gravey tasted like it just came out of a can.
My wife ordered salad dressing on the side. The salad was served on the same plate with the steak and the dressing.",lxs-i47nJYnOnlIzODG3rQ,0,0,2,PtvHcQYVGmBNzmSsXOYbdA
1987043,2017-11-11,1,pHJu8tj3sI8eC5aIHLFEfQ,"I only want to have small bite and a beer, lady said no, we close at 11... I show her the time on website, still no service....",HvYod4a2B-6OTJcgzJgtjw,0,0,1,xsas160kEVDPlivGd1qeyg
1997413,2015-04-15,0,pHJu8tj3sI8eC5aIHLFEfQ,My favorite Italian restaurant in Las Vegas. I have been going here for over 12 years and still look forward to every trip. Great quality and affordable!,nXMEEyj75ir7Y7Xb1-mUTw,0,0,5,wSHkUdqExiB-UZA3RUq4nw
2000883,2018-03-16,1,pHJu8tj3sI8eC5aIHLFEfQ,"I've been going to Noras for years now, and when they announced they were moving to a new location down the street (last year) I was worried.   I've seen so many smaller restaurants ruined by ""upsizing"".  Unfortunately it happened at Noras too.   

First the new location, while beautiful was horribly designed from a noise perspective.  You literally cannot hear people across the table from you...when I leave I sigh in relief because the din of the dozens of conversations at once has ended.   

I mentioned this on my first dining at the new location to the manager... I work in the studio sound business and I recommended Paul Tan or Acoustic consultants.    I noticed this trip one wall has tapestries on it, but they need some Rockwool (Roxul) or sound soak behind them.   We're not talking a bunch of money here....a few thousand bucks for a noticeable reduction in noise.   Though if they really did it right, it could cost close to $25K for maximum reduction

Nora's, the noise IS hurting your business.   Once the newness of the new location is gone...people like me may not come as often.  

I love your food please call an acoustic consultant... you'll get 2 stars more from me if you do.",8bIPzyH1Xm4qrYv51Xbmuw,5,0,3,4xGD8Xk4OxVBUh3O5YVXgQ
2006079,2018-05-22,0,pHJu8tj3sI8eC5aIHLFEfQ,"Nora's has been on my list of places to eat for years now. I finally got the chance last night for a birthday celebration! Walking in, it has an old Tuscan feel to it. It's dimly lit, bar is situated in the middle, and it gets pretty noisy. Our server was great! I think his name was Don. He kept our drinks and garlic breadsticks full! Speaking of the garlic breadsticks...omg they are the best thing ever. And they're complimentary! 

Onto the food!

Calamari: Yum! Fried and seasoned perfectly. It wasn't oily at all! I really enjoyed the sauce it came with. I'm not sure exactly what the sauce was but it tasted like a marinara and it was a nice change from the typical creamy, white sauce most other places give. 

Grilled octopus: I wished it had more of that char taste I was looking for. The texture itself was nice but it wasn't the most flavorful dish. I would probably skip next time. 

Lasagna: omg so. much. cheese! I did wish it had more meat sauce (l like saucy lasagnas). This is definitely not for someone who's lactose intolerant. But then again, who takes that seriously? Lol kidding. 

Crazy Alfredo: I really enjoyed this dish! It has a nice kick of spice from the jalapeños. The pasta was cooked perfectly and the dish had the right amount of sauce on it. 

Osso bucco: this was so tender! Comes with mashed potatoes. 

Ribeye (came with truffle fries): We asked for it to be cooked medium and it was perfect! It had the nice char and wasn't chewy at all. It comes with a side of truffle fries which I am all about! 

Most of the entrees could be shared, such as the osso bucco and crazy Alfredo. They're huge! 

Overall I do recommend this place. It's nice that it's not on the Strip and the prices are reasonable. The food and service was excellent. Only thing I wasn't down for was the noise level. It gets LOUD. I found myself shouting a few times across the table...but I don't know if that's saying much because I generally have a small voice haha.",60skTN6p8SdQ2sGNKL0vRQ,1,1,4,G7JsB0nms8q1c53BHReZnQ
2006442,2012-11-29,0,pHJu8tj3sI8eC5aIHLFEfQ,"OK, so I have this little problem: When I go to Nora's I obsess over the last meal and ALWAYS end up here AGAIN within 2-3 days for another round!

We bring out-of-town guests here and they love the ambiance and the food.

We always sit in the bar area and I never get a bad look when I'm there in jeans and sweatshirt (yes, sometimes when your tummy is yelling for Nora's you just go!)

Our favorites:
1. Antipasto Salad
*Romaine lettuce, mozzarella, pepperoncini, olives, onions, tomatoes, topped with
ham, provolone, and salame, in our homemade Italian dressing.
-FOR REALLLLL.  Little pinwheels of meat and chesse?!  OMG-YUM!
2. Caesar Salad
*Romaine Lettuce, topped with Italian croutons and Nora's own Caesar's dressing.
-Just tastes better than your normal Caesar.  My husband swears by this one!
3. Cheese Ravioli w/ Vodka Sauce
*Might sound plain, but this is the only entree I've ever gotten and its DELICIOUS!
4. Penne w/ Arrabiata sauce & sausage.
*Husband LOVES this one.  The arrabiata sauce is fabulous- not too spicy, but more flavor then your regular red sauce.  They make their sausage in-house!

I'm hoping to one day venture out of the ""ravioli box"" and try one their pizza's or maybe some seafood?  But I love what get every time, that it's so hard to try something different!

They bring out yummy garlic bread (on the house) but the next round is $1.50.

NOTE: Make reservations on SATURDAY!!!  They get crazy busy, even at 5:00pm!

They have GREAT takeout (especially for lunch!)",Ii1PkdRpONUNwKC3lmhl1A,3,1,5,of-2puTBCBcyk1cb64YqrQ
2008254,2016-10-10,1,pHJu8tj3sI8eC5aIHLFEfQ,"Have been a regular at Nora's for many years. I really don't want to write a negative review but was highly disappointed with our experience last week.  Noras recently moved to a new location just a few blocks east of where they've been forever . Beautiful restaurant and excellent decor. Place is stunning . Had a 645 reservation on a Tuesday for a 30th b day party. Only four of us.  Wasn't seated until 700pm. Had to flag down the manager and ask why walk ins were being seated before us?  Eventually he sat us and bought us a round of drinks. Don was our server as he has been for many other visits and did a great job as always. Appetizers came out in a timely fashion 10-12 minutes but we waited a full hour to get our entrees. This is not an exaggeration . Manager Dan was apologetic and compensated our table with many rounds of drinks and a reduced bill, but that's not why we visit Nora's.  I did not want a free drink (was drinking sprite) i wanted to enjoy my meal.  The food is always spot on but they were not ready to open at the new building. The kitchen was buried , one hour for entrees is inexcusable.  He said they are working on getting ready for the Grand Opening which is in a couple weeks which made us feel unimportant.  That is why you run a play day and a soft opening with friends and family of the employees to work out the kinks before opening to the public.  It was an awkward dinner to say the least.  We will return eventually but not any time soon.  I put this on the owner of Nora's not on the manager or server.  Don't open unless you are prepared",Ak72_epukA6xrSLtf6i28A,1,0,2,nQN2RrN1VP5sE5ciAaZEkg
2009475,2015-07-08,0,pHJu8tj3sI8eC5aIHLFEfQ,Bestest pizza ever.! One of my favorite italian restaurant in vegas. They also have sangria!,AQpt0Lt4SWF5kFeUbvd88A,1,0,5,XWyC_Z9E5e-yRhOd32Uhdg
2020241,2016-06-10,0,pHJu8tj3sI8eC5aIHLFEfQ,"When I went there was a hour and 15 min wait, clearly this place is popular. Sat at the bar and was well worth it, got a whole basket of delicious garlic bread. Most authentic Italian cooking I've had in years, the portions are huge.",jknOtizX1pOfGeNCRyh_GQ,0,1,4,zPl1o5HKl8jtwH8MZx_BNQ
2022395,2013-10-08,0,pHJu8tj3sI8eC5aIHLFEfQ,"This place has a nice vibe and feel to it. Garlic bread was amazing, super garlicky just how I like it. We also had the steak and arugula bruschetta and that was really delicious also. 

I ordered the linguine and clam as my entree and this is where I was a bit disappointed. The sauce was bland and not garlicky enough for me and had some gritty stuff in the sauce.

All in all i would like to give this place another try.  Oh and free sangria with a checkin isnt all that bad.",XetOgmeZKHhpiauBCK_t1w,0,0,3,V-GS0t9Yo3-49W2zOdZLVw
2030489,2015-10-21,0,pHJu8tj3sI8eC5aIHLFEfQ,Based off the rating my expectation was not met. The shrimp scampi app was Delish. We also had veal and chicken parm. Sauce was not up to par - breaking was falling off and it was a bit dry,ot6C8ZHxVZND42dcLW5s1Q,0,0,3,HOUXKWv-NRBtBUb0eoP0iA
2043105,2013-06-09,1,pHJu8tj3sI8eC5aIHLFEfQ,"Absolutely incredible. The garlic bread is to die for, along with the wings. I ordered the pasta fagioli, which was the best I have ever had. I also ordered chicken marsala. It had the most amazing sauce and I enjoyed every bite! This is definitely the best Italian restaurant I have EVER been to. I will be coming back soon!",aC-rW559lqI33SwW9TE4ig,2,1,5,LkO_vrR8jo4kgBXb4DrC_Q
2046398,2016-10-29,0,pHJu8tj3sI8eC5aIHLFEfQ,"New location and building, same great service and food! The crazy alfredo is my go-to dish every time. Happy to see the new spot packed as usual. Well done!!",TjgjuPSXy-mr43okGX49gg,0,0,5,PwASC96-kRx6AuMzMaOHRg
2047276,2013-03-22,0,pHJu8tj3sI8eC5aIHLFEfQ,"If you are looking for a light, low cal, healthy option in Italian dining-go elsewhere-you won't find it at Nora's. The food is good in that carb laden, dripping in cheese and sauce way that is absolutely yummy to eat, but requires a double trip to the gym the next day to work off the guilt. Additionally, the portions are large so the overindulgence brings on the required nap afterward. One of the best lemon drop martinis in a long while, however my pizza was very good in flavor, but too heavy in crust and cheese-almost dripping-and while i favor a thicker crust-it was almost like eating a loaf of bread which was too much for my taste. Prices are right, service is prompt, taste is good, just will keep this for a very very occasional if the goal is to eat a bit lighter.",C3-__jJNxwbR5Rvr-CaW1g,0,0,3,3bV4vNBqfa93v1LGv04x-Q
2052785,2016-04-02,0,pHJu8tj3sI8eC5aIHLFEfQ,"Food and service was excellent. Had the crazy fettuccine, arancini, mozzerella caprese, and bread pudding for dessert. Would highly recommend this spot as well as all of these menu items. First time visit and will definitely go back.",TQ1_fZ7-Fkwf_gng7yn8Cg,0,0,5,YUIssyE_fOzRkcaNcnY-RQ
2064532,2016-03-15,0,pHJu8tj3sI8eC5aIHLFEfQ,I just had the Melrose (linguine pesto with shrimp) excellent dinner here as always! And such friendly classy service.,Amt7v32lWx2GcW5goeXKPQ,0,0,5,eucejT6u2NGPVAXoblpMhw
2064611,2016-06-14,0,pHJu8tj3sI8eC5aIHLFEfQ,"Wonderful service, yummy food, great atmosphere. I had the baked rigatoni, added meatballs and substituted vodka sauce. It came out just as I ordered, and was absolutely amazing! I reheated the leftovers later that evening, lo and behold it was even more delicious! In my opinion, you really can't go wrong with this ricotta laden baked dish!!!",x3Z7p4A7S447JnMU7zl_ow,0,0,5,oH1kDYcNhlGkY4slLq4iYw
2067726,2015-08-17,0,pHJu8tj3sI8eC5aIHLFEfQ,"One of my absolute favorite restaurants in Vegas. I have been going to Nora's since it was only the now middle room and it has been great ever since. The food is amazing it's a cute restaurant with great service. Everything I have eaten there has been delicious including- chicken Alfredo, Veal, pretty much any pasta is awesome! And OMG the pistachio chocolate is to die for!!! The best dessert you will ever have if you like pistachios and chocolate. You have to order it early because they make it fresh when ordered so I recommend ordering it right when u sit down to make sure there won't be a wait when you are ready for it. It's got a warm melty center and soft outside drizzled in the pistachio sauce. I cannot tell you how good this is. This restaurant has been my favorite for years and will continue to be as long as they keep doing what they are doing! There is also a room for large parties in the back that is really nice and the doors close if you want it more of a private party. There is live music on the weekends not sure about weekdays. It gets a little cramped but not too bad. Overall awesome place to eat!",WvtU0fA_GZcYcfLWGZBz2g,1,1,5,c1p70Y_Zp-bbH3J0-Oxq-w
2072652,2014-05-20,0,pHJu8tj3sI8eC5aIHLFEfQ,"Came in for lunch, had the seafood misto and antipasto salad.  Food was very good.  Service was fair, had to ask multiple times for more bread.  Finally came after we had finished.  Would try again.",kc8X2sAnmEpZL0V757yj2Q,0,0,3,kJTdd9-PwBa_Saer5RJkOQ
2073079,2011-08-16,0,pHJu8tj3sI8eC5aIHLFEfQ,"Woman at the jacuzzi said they make Italian like ""mama used to"" here. So I ventured out here to find out what my Italian mama would've made.

So I step inside and the first face I see is old baby blue eyes. It's too bad that this and a street name is all we got left of him in Vegas.

The hostess was distracted with takeout orders when I entered and I was left waiting for more than five minutes at the front. After I was seated, I was greeted by the server, who addressed me as ""sir"", which would normally be awkward for me but came off as polite in this instance.

My bread and drink came out relatively quickly. The bread was a garlic toast which was a little on the soggier side and not so garlicky. 

I ordered the ""crazy"" Alfredo, which is the standard fettuccine Alfredo with jalapeños, sausage, chicken, and mushrooms. I guess somebody was eating pizza and decided the toppings would be just as well in a pasta. The peppers really did overpower everything else in the dish as it was hard to even taste the Alfredo sauce. The pasta was cooked correctly but the taste was not all that great.

The check took a while to come out so I would say that the service is inconsistent here.

I guess this would be the point where mama would hit me in the back of the head with a spatula for this review.",umZPUpLSJuCTXLckxA4nmg,0,0,3,b5Bgvtn1ATv6LcBHT-dZLA
2073164,2015-05-22,1,pHJu8tj3sI8eC5aIHLFEfQ,"I have been here on several occasions. I've had some truly excellent dishes. Yesterday, however, was not one of those days.

I ordered the fettucine carbonara, a usually, well-balanced dish. They missed the mark yesterday. Where do I begin? The pasta was not cooked properly, some was al dente and some was close but under done...how do you do that? Perhaps they realized they didn't put enough in the pot and added some a few minutes later...? Who knows. They use ham in the carbonara. It was like they rolled up a bunch, cut it and threw in the. They didn't separate the pieces. There was so much ham I couldn't taste anything else. I spoke to the manager and showed him my plate. He agreed that there was too much ham in the dish. We didn't discuss the other issues. He asked me if I wanted it remade but I didn't. I had to go in search of a manager because I couldn't get the waiter to come to my table. No one asked me if I needed more water. No one came to inquire about my satisfaction with my dish. Had someone done so early on I might have had them remake it. As it was the manager took the pasta off the bill. I would have preferred enjoying my meal. Maybe I'll try again but at the moment I am undecided.",CowhYaQKTHI5WL8S6RLQAw,0,0,2,5hYFSUgXcst_Kc9G-2gQvQ
2074120,2014-12-27,0,pHJu8tj3sI8eC5aIHLFEfQ,I have eaten here a dozen times. Food is fantastic but service varies. Sometimes really good sometimes rushed but more often than not service with an attitude. This place is very small reservation recommended. They really could expand and still stay full. Food is so delicious it over rides any negatives.,GQ1FJxhowR9Qf4a5QuqcOw,0,0,4,A9skSW1XYfKphE6bnbY82A
2078205,2014-10-14,0,pHJu8tj3sI8eC5aIHLFEfQ,"I've been here a few times over the past 3 years and it's been consistently good! The wait staff is knowledeable about the menu and very happy to accommodate any special requests. 
 For Appetizers I've had the Calamari which was deliciously seasoned and served with a tasty blush type of tartar sauce however I asked for a side of marinara that was gladly and promptly brought to me.  The Arancini were tasty and nicely seasoned. Crispy on the outside and soft on the inside with a good amount peas, meat sauce and mozzarella on the inside. The presentation was beautiful with basil leaves on top and served over some marinara (which was way too skimpy of an amount but they'll gladly give you more!)
My friend and I had the Eggplant Parmigiana and Veal Parmigiana both of which were delicious. The eggplant was breaded and fried lightly with just enough marinara and melted mozzarella on each slice. The veal was tender and well seasoned as well.  They've also got a nice wine list with  reasonable prices. I also like the way they redecorated the dining room with multicolored ceiling tile and the Trinacria. This place is always busy so I'd suggest a reservation especially if you have a larger party.",k8HAfLq8BGxqcM8nvXHvag,1,0,5,VEFLHFSr26c_FqXWJeQs8g
2079108,2015-06-09,0,pHJu8tj3sI8eC5aIHLFEfQ,"From the time you step in the door to the time you walk out expect extreme service, amazing cocktails,  and the best Italian cuisine vegas has to offer.",QYmMIYZc0VL4bTZyacCPiw,0,0,5,O8S4tIABTYZcQXRXwK02Pw
2081017,2015-12-21,2,pHJu8tj3sI8eC5aIHLFEfQ,"I met my friend Rachel and her hubs here for dinner on 12/20/15. I made a reservation for 4 people at 6:30 and we arrived right on time. Unfortunately for us, they made us wait for a bigger table because Rachel brought her son. I didn't think that it was necessary to make a reservation for 5 people because he's a toddler and sits in a high chair, but whatevs. We had to wait an additional 15-20 minutes to be seated because of this, so by the time we sat down I was hangry. 

Our server was nice, but service was slow the whole time. We ordered drinks and then ordered our food. We didn't receive appetizers, salads or bread for *at least* 30 minutes. The bread was good, super garlicky and buttery. The salad was yummy, and I enjoyed the house Italian that came on top. Finally after what seemed like forever, our main courses came. I had the chicken parmesan with spaghetti alfredo, and my boyfriend had the baked rigatoni special and a side of meatballs. The baked rigatoni and the rigatoni special are separate entrees. The rigatoni special has meat and the baked rigatoni does not, but he asked if he could have both put together and they accommodated him. It looked so cheesy and delicious, but I was too busy enjoying my delicious cheesy chicken parm to even ask for a bite. He said it was amazing. The meatballs I tried and they were good, but a little cold on the inside. We all sat in silence for a good 15 minutes eating. We all agreed that it was a delicious meal and no one had any complaints.

Even after all that food, Rachel and I ordered the chocolate lava cake for dessert, because YOLO. The cake has to be ordered when you order your entrees, because they are made to order. This cake was nothing short of delicious. It came hot out of the oven, garnished with pistachio crumbs and a sweet vanilla sauce. When I dug into the cake, I got a spoonful of hot, creamy chocolate and it was divine. This cake was the perfect end cap to wonderful dinner with wonderful frands.",JYcCYNWs8Ul6ewG5kCYW4Q,6,5,4,o6TTa4t611bjfAAc2GFVcQ
2082947,2017-05-28,0,pHJu8tj3sI8eC5aIHLFEfQ,Get some hostesses over 18 or IQ Over 50 and you might actually have some semblance of something more competent than a Chinese fire drill.  Especially when having a reservation.    Good thing food is decent or this place would be a one and done.     Bar mixologists are well trained  a positive.     The  hostesses were a solid zero tonight. Look at other reviews.   The hostesses are killing you guys.  Find someone with experience.,HkkLyvgBjhDenVTK8RDx9w,1,0,2,MqJn4bliBp9nZvZIhDrh4A
2085266,2010-12-06,0,pHJu8tj3sI8eC5aIHLFEfQ,"What a great restaurant. This is definitely a 'local' gem and if you want to get some high quality Italian at a reasonable price while in LV definitely check out this place. Normally I don't rave about Italian places but this place is worth it. Good service, quality food, and nice atmosphere. Go here for a romantic dinner that won't empty your wallet.",MsFzmAB-i4xYeawXnGR7rg,0,1,4,fXe7_cx91i4_ct-6jq0EbA
2087664,2016-03-15,0,pHJu8tj3sI8eC5aIHLFEfQ,Excellent food as always. We used to make it an annual restaurant to visit when we're on this side of town. May have to increase the frequency.,gpEcQsSADbordXJuwJ3p3w,0,0,5,yM46sVocYiDBDOqgloyJhQ
