,date,funny,business_id,text,user_id,useful,cool,stars,review_id
20759,2016-07-04,0,pHJu8tj3sI8eC5aIHLFEfQ,Has the Crazy Alfredo it's amazing! If you like pasta with a little spice you have to try it. I went on a Saturday so the wait for our food was a little long but if your into cocktails have a lemon drop and you'll be fine ;-).,bQFnFCkJgoXhVR28GqxSJQ,0,0,5,T9DdBjeIAOvibnk7mXKUaw
24943,2014-01-29,0,pHJu8tj3sI8eC5aIHLFEfQ,"Found this restaurant on a recent trip to Vegas. Great food and atmosphere. Prices were not crazy. We ate at a lot of places on the Strip but I thought this was the best food I had during the entire vacation. If you go, try the Lemon Drop martini!! It was amazing to watch the bartender make this specialty drink. It's not like any other one you have ever tried!",EQLcDRalU9Ksr5hW85ho2A,1,0,5,NpyS2bKIjYYNuBJvt8MqhQ
29979,2011-02-16,0,pHJu8tj3sI8eC5aIHLFEfQ,"By reading the other reviews , I am guessing I went there on a bad night.
I see lots of people complimenting their marinara sauce, so it can't be that bad.. but the one I was served was either the end of the batch of they ran out and had to use some baught in the store.
Their pasta were very bland, nothing out of the ordinary, store baught pasta are just as good.
The worst part, to me , was their garlic bread. i refuse to believe that what i was served is what they normally serve. I look, and tasted, like frozen garlic bread from the store, only with more garlic and more cheese added.
I had a garlic taste lasting for days after that one..
Like I said , after reading the other reviews, something must have been wrong when I was there , was the chef off ? maybe they didn't receive some deliveries ? Maybe they had tons of cooks calling sick ? 
I am not sure , but I will have to come back , for sure it won't be as bad..",MgTR_Hp2YhIDaodXcZgIhw,0,0,1,wGa4-jNbIRCLaFCOagHeZA
31617,2015-01-17,0,pHJu8tj3sI8eC5aIHLFEfQ,"Only had the pizza here and the arancini ( and some of the crazy alfredo ). All were excellent. Flavorful sauce, great crust and topping on the pizza ( I had the ""salami"" pizza ). I will be going back for more !",Xmbg0lUpmxKFiB0teo94EQ,0,0,4,1ES6oJCdYbh_Xp1DfEantg
34811,2012-09-26,0,pHJu8tj3sI8eC5aIHLFEfQ,"Soooooooo delish!  Smells wonderful as you approach the doors of this hidden gem.  Don't let the strip mall location fool you, this is wonderful, friendly authentic Italian!

Decided already this will be among our favorite dining spots.  We topped by for an early dinner prior to a show, the place was filling fast on a weeknight, so call ahead to reserve your table!",0koJ8HNgTDeSoz83rxrlgw,1,0,4,poocuMGhUCNaA18dMFu3Lg
58359,2017-02-12,0,pHJu8tj3sI8eC5aIHLFEfQ,So busy!! Make a reservation. I ordered the cheese ravioli with vodka sauce and a side of meatball and sausage just to try. All of it was delicious and the service was great. The live music was a nice touch as well.,pNTLlLAa7Pr5yfUi6RPKQQ,0,0,4,rbvIC3tmORaBZVLjq3AM2A
60135,2016-07-07,0,pHJu8tj3sI8eC5aIHLFEfQ,The place is very casual but fantastic food...I am a born and bread NEw Yorker and to find such fine Italian food out in Vegas is unreal!!! I had the Veal chop parmigiana which was out of this world!!!  Food 5 stars decor only 3...but that is not what this place is about.,I2OmfhC-jBwo4BjB82C-gw,0,0,5,CMIweoelukTwW_PFSjcWKA
65300,2014-04-18,0,pHJu8tj3sI8eC5aIHLFEfQ,"This place is great! We came from CA with the kids and we are coming back! I don't care about any reviews this place is awesome.  Great food, great service, I might just drive back from LA for the food.",MknzFb5OQuHcQ_Z8ZeEvkA,0,0,5,F8qr4QupiFkBKP_mqaQjkw
65420,2017-03-28,0,pHJu8tj3sI8eC5aIHLFEfQ,"If I could assign""zero"" stars I would. Absolutely horrible. Service......bad. Food.......worse. No attention at all is given after you're seated. Had to get up and find my server for a knife! Had to get up and find my server for drink refills. And I still left 20% grat. Used to frequent the original Nora's back in the 90's. They lost their way from those days. But the place was packed so I'm sure they will not change. However they will go forward without my business or that of my friends unless they do change. ASAP!!!",PH03N4PaKdM5RuM5UdNCnw,0,0,1,x0L07IC58GCpCBXXQgOYmw
82077,2011-10-08,0,pHJu8tj3sI8eC5aIHLFEfQ,"Unsure why this restaurant is rated so high.  The young boys who greet guests at the door and bus the tables were lovely and adorable but the food was really average or less than average.

I visited Nora's many years ago and was disappointed but after hearing so many positive things, I decided to go back - eager, hungry and with an open mind.  I figured I must have visited on an ""off"" night before.

Nope.  Quite mediocre.  Food quality seemed greasy and cheap.

Fried Calamari:  Greasy but certainly edible (2.5 stars)
Caprese Salad: Mozzarella (5 stars), tomatoes (less than 1 star)
Tortellini with Vodka Sauce and added chicken:  pretty tasty (3.5 stars)
Garlic Bread:  Tasty but cheap and I am huge bread fan (2.5 stars)
Chicken Parm - terrible, way too salty (1 star)

Soda: crisp and bubbly (5 stars)
espresso:  strong with great flavor (5 stars)

Ambience: bustling, a bit noisy because they are so busy, jubilant crowd during baseball game on bar TV, pleasant staff....This is a regular ol' family restaurant.",qTllTILQ6JVifkO-5ezm2Q,0,0,3,1IyUfblLdodQtu4KoVxbxQ
82625,2016-12-09,0,pHJu8tj3sI8eC5aIHLFEfQ,"Since Nora's moved to their new location, there has been a major parking issue. The parking lot is too small; there is an inadequate amount of parking spaces. My husband and I were forced to parallel park on the street next to the restaurant at 5:30 pm on Tuesday night, Dec. 6th, 2016, which led to us getting into a frightening altercation with another motorist.

Although the food is excellent, we will not be returning to Nora's restaurant until they resolve the parking issue---either by expanding their parking lot, or offering valet parking.",Ms8eanQr7o-357srYQrDqQ,2,1,2,0zeDWx_EIDs53dwp0M78kw
92021,2009-10-27,0,pHJu8tj3sI8eC5aIHLFEfQ,The food was well priced and the actual location wasn't too bad.  My wife had the spaghetti and meatballs and I had the lasagna.  Both were really salty.  Probably won't go back.,Dk3G9MKS3zKc6QroeTl-Sw,0,0,3,szS90sZtQ-wMCEeQnaxe8g
97296,2014-06-29,0,pHJu8tj3sI8eC5aIHLFEfQ,"I had eaten there many times with the same friend and after an absence of many months the two of returned. The waitress recognized us and gave a friendly greeting. I asked for chicken erbi fini and the waitress said it was no longer on the menu, but it would be no problem. So far so good. 

When the chicken came it was a bit over cooked and I thought the spaghetti sauce not up to par, but it was still pretty good. 

It was my friend's turn to pay and he gave the waitress his credit card. She returned and apologized and said since we hadn't been there in a while she would have to see his ID. My friend was not put off by this, but I was. I would have been very annoyed if that had happened to me, especially if I was bring someone there for business and they recognized me as a returning customer and still wanted to see my ID. I left not eager to return. WHEN I MENTIONED THIS CREDIT CARD ISSUE TO MY FRIEND MUCH LATER, HE TOLD ME THAT HIS WIFE INSISTS ON WRITING ON THE BACK OF EACH OF HIS CREDIT CARDS, ""PLEASE DEMAND TO SEE MY ID."" So, I think what happened is that the waitress obviously didn't look at the back of his credit card, the cashier did and just told the waitress w/o explanation to check that customer's ID. This goes to show how it can be tough to please in a service industry such as a restaurant.",3b5EsiTkqgdbxPXz7LfBpA,0,0,4,MIanUe_B-cge7OdsbTAxzw
100847,2014-09-27,1,pHJu8tj3sI8eC5aIHLFEfQ,I've been coming here for many years and it's just as wonderful today as the first time! Always have stellar service & delicious food...especially love when they have piano players!,K6a_FGhUbj59Aw84gcI-cg,0,0,5,IsfvMkP78gCsDjLc4RgeXg
108434,2013-03-16,0,pHJu8tj3sI8eC5aIHLFEfQ,Great place in Las Vegas for good food at a reasonable price.  In the past i ahve had the Crazy Alfredo and Shrimp Scampi both were great.  This time i had the Frutti Di Mare it was great.  The Antipasto is very good.  All the portion are generous.  You won't leave hungry.  They had a special Osso Bucco special that a couple in our party had that they said was very good.  Overall i try to hit this place everytime i am in vegas.,aAxho3JVUjh8dc9YWPtdVw,0,0,4,leIPHYMRcZq_SMSsmtlLvQ
109663,2014-04-30,0,pHJu8tj3sI8eC5aIHLFEfQ,A friend told me that this was a very good Italian Restaurant & i have to say I was a little disappointed..they gave you garlic bread that was very hard. The calamari was a little chewy. The baked rigatoni was over cooked. The restaurant itself is a little outdated. I sat near the bar and they have this ceiling to floor curtain that look like it hasn't been cleaned in 20 years..The service was ok. I owned pizzerias and I made better Italian food than this so called really good local Italian restaurant..I am sure they will never see me again,T1F_QZDwRoth02ufRu2R3w,2,0,2,5q1giO82ySr96SzGd9e0-w
117032,2017-01-20,0,pHJu8tj3sI8eC5aIHLFEfQ,"The uber driver's navigation couldn't get us there, but Google came to the rescue and we made our reservation. 

We were seated immediately and our server, Ed, came to greet us with a smile. He made good recommendations and we were pleased. 

Starters were tasty. The shrimp scampi was very good. Lots of tasty garlic bread to sop up the sauce. Would I make the bread crispier? Yes
Did I eat it? Yes
Would I order it again? Yes

The Mozzarella Cambrese was fine. Cheese was on the edge of grainy....not awesome, but fine.

The Osso Bucco was outstanding. Tender but not overcooked. Delicious and sumptuous.

The crazy alfredo was excellent, although a little stingy with the protein, but still, quite tasty.

Veal Parm was solid.

The surprise of the table was salmon piccata. As dish that would be easy to mess up...they didn't. They married those hard to meld flavors into something special.

While I have no need to return to Vegas this year, if I do...we will return.",Wy7k_kdV1Dk3ch2d_yTejQ,0,0,4,QttxebULvcIkFc5n9mDnRQ
120007,2017-04-02,0,pHJu8tj3sI8eC5aIHLFEfQ,"Have lived in Summerlin for 14 years and am a total foodie. Ate at Nora's years ago before Yelp and had a great meal. Super excited to try the new location for my 22nd wedding anniversary after having tried all of the DTS restaurants and nearby restaurants in the Summerlin area, i.e., T-Bones, Vinter's Grill, Andiron, Echo and Rig. While the food was pretty darn good (enough to overcome sending back the Veal and Molten cake because they were too cold), the biggest bummer was the service. She made no attempt to help us celebrate our anniversary or remedy the not so perfect temperature of the food. And the only reason I am even writing this is, they forgot to bring us our leftovers!!",HlamBOG0IlVMaTTbtyRPtQ,0,0,3,Q8NslD1XGALynRAjJOFR-w
126128,2016-11-09,0,pHJu8tj3sI8eC5aIHLFEfQ,"Went on a surprisingly busy Tuesday night of the Election.  We had made reservations for 6:30 pm, but because we were a little bit hungrier than expected, we arrived at 6:00 pm.  Obviously, we were a bit too early so we waited for no longer than ten minutes to get seated for dinner.  Not a problem.  When we finally got the chance to sit down, we were immediately greeted by assistant waiters who eagerly got our drinks order.  Again, it was a busy Tuesday night so the wait for the drinks was a little bit longer but wasn't waaaay too long.  It gave us just enough time to say dinner prayers so we were thankful for that.  I ordered the Puttanesca as my entree and while it was deliciously hot and tasty, it was somewhat lacking the anchovies which I was looking forward to.  Mom ordered a Riesling from the wine collection and it was dynamite.  So good.  Ramon was our waiter and my goodness, what a terrific server.  He asked us first if we had any questions about the menu after we spent about ten minutes with the menu before he came over to take our order.  What a rare treat!  We are also grateful for the hostesses who accommodated us.  Forgive us for not remembering their names, but we do remember their faces.  We are coming back soon.",9bp-Eo8pg-Jhp1KAOJBxPg,0,0,5,x6sQj2Dhp6CNhLJIaP0PSg
126775,2016-07-01,0,pHJu8tj3sI8eC5aIHLFEfQ,"When ever i am Vegas, i make an effort to go to Nora's Italian Cuisine.  Its a quiet oasis off the strip for good ole italian food.  The antipasto salad is one of the best.  The pastas are excellent and well proportion.  I rarely have room for dessert.  but i try that's for sure.  

Do not be intimidated by the strip mall location.  once inside the doors, the restaurant brings you back in time to the local italian meals that i remember my parents take us for a special night out.  Make sure you ask to be seated the same room as the bar - a bit more atmosphere on that side of the ""house"".",3rw8VB4-o_Yzn3wLOC-wUw,0,2,5,NyCNgm20W487YP-ZhBpujA
129296,2010-02-19,1,pHJu8tj3sI8eC5aIHLFEfQ,"The best Antipasto Salad!!! It's best to eat it at the restaurant instead of taking it home. If you take it home, the salad soaks a bit and will not be the same. Since it is a local favorite, be sure to call to reserve your seat. It is always packed.",Qwaz48YnqehiAtWHr_-6DA,0,0,4,dRoDxSziLKbQyybx0aFYHQ
137409,2017-04-02,0,pHJu8tj3sI8eC5aIHLFEfQ,"Two stars only for the food. The food was great, the service was TERRIBLE. They told us there was a two hour wait when we arrived even though there were empty tables everywhere. Then we went online while there made a reservation for the same time and was seated. The wait time is a lie. They always have empty seats. Then they told the couple behind us 45 and another couple was seated right away. They are completely selective. They also charge four dollars to change sauces. The experience was terrible, only the food made up for it.",TFXHh5iIDcgnFv-DEbFUdA,0,0,2,xEzIB_duUFXlqBUU38j_zA
139192,2011-07-02,0,pHJu8tj3sI8eC5aIHLFEfQ,"The Veal Parma Entree is amazing.  That is my go to dish every time I am here.  The garlic bread is terrific, the only problem is they cany keep your bread basket full as your group will surely eat the bread faster then the servers can fill it.  I love this place.",DWfos3PxcrkqAJoAZHEg3A,1,0,5,HlfYlaQz5ZhRis20hIF8xw
139846,2012-10-10,0,pHJu8tj3sI8eC5aIHLFEfQ,"Had dinner with friends here last night and everything far exceeded my expectations. We had the steak bruschetta and spinach farro salad for app's and both were so delicious. We all loved our main courses, two of us had very picky specifications and they got both of our changed dishes perfect. Such an enjoyable meal. Then we shared their homemade cheesecake for dessert and it was to-die-for. Our server was good too, don't remember his name. Next time I am in town I will definitely be back!",pBziiKj9N6dRqIMHxN4VTQ,0,0,5,B2wrOaVSofdq1c5GhFsAjA
144015,2015-09-17,1,pHJu8tj3sI8eC5aIHLFEfQ,The Food is fantastic! The staff is very personable and make the experience that much better! I highly recommend locals and visitors of las Vegas visit this restaurant for food and drinks they will never forget!,J8eO3S6SMZ1FuVfQn2mBuQ,0,0,5,d3-P3mdgYBNhfzYJCLKNNA
148056,2011-04-27,0,pHJu8tj3sI8eC5aIHLFEfQ,"Crazy Alfredo.

There is one thing on this menu that is incredibly delicious, and that is the ""Crazy Alfredo"". First off it is a massive portion, should be eaten by two people, or one really hungry person.  It also travels as a to go item pretty well.  It's a mix of jalapeno, chicken, sausage, cheese and a great alfredo sauce. Very flavorful.  

if you are there for lunch during the week, they do a great Ribeye with salad lunch portion that has fantastic flavor as well at a great lunch price.",GFPx32mip-47kDOGYeJzog,0,0,4,rBqYvh3tobjC1aCeRRLfHg
148815,2017-11-16,0,pHJu8tj3sI8eC5aIHLFEfQ,"Most people while visiting Vegas tend to eat in a restaurant right on the strip or in their hotel. However, my friends and I decided to venture elsewhere and jumped on Yelp for reviews. This is when we found this little gem. 

We called ahead and made a reservation and was seated promptly upon arrival. They gave us a seat outside and even though it was 100 degrees that day, they had these little cool fans pointed our way so it didn't feel bad at all. My favorite thing about this restaurant was that it just felt like an Italian restaurant instead of being a flashy place to eat in Vegas. The crowd was a little older and there was a band playing music as we dined.

The servers were attentive and the food arrived promptly. We ordered the fried calamari to start which had a nice crunch to it. My main dish was the Primavera which was good. Everyone seemed to enjoy their dish and portions were big so we all had leftovers to take home. If I'm back in Vegas one day, I would check this place out again.",64tX7lyyIPifkSZay_93VA,0,0,4,pI3XMeyacDYJYihohWFTMA
149192,2014-12-26,1,pHJu8tj3sI8eC5aIHLFEfQ,"Ordered take away Spaghetti & meatballs and extra serve of garlic bread - said it would be 45m (at 8.30p), so I thought I would give it a go due to the great reviews. Kids were sleepy so I went in 15m later to see if it would happen to be early and luckily it was ready for pick up - 30m more and it would've been cold.  Got home and found a small box of pasta with two meatballs.  Luckily I ordered extra garlic bread (1st one free) because I would've still been hungry!

Pasta and sauce were average - meatballs were tasty and garlic bread was too garlicky...the kind that leaves your breath humming for a day hahaha and I am a garlic lover!!

Sad to say I probably won't be back, but had to try - just too many other options.",bGUs2VtGoIj2ri_5hNSh-g,1,1,3,1T_efSdIijgYQlbbfC05LA
153448,2012-03-31,0,pHJu8tj3sI8eC5aIHLFEfQ,Come hungry! The garlic bread is delicious and the entree portions are huge. Excellent service as well.,KZD0NYJ2B2__OGsxKOX8dQ,0,0,5,G6PbBxpJHQauXQRwDIq73w
157865,2015-06-20,0,pHJu8tj3sI8eC5aIHLFEfQ,"My husband found this place and told me that it was one of his favorite Italian restaurants and that we would have to go the next time we were in Las Vegas together. Well, that time recently happened, and he was RIGHT! The food was delicious! He had the rigatoni special and I had steak sandwich for lunch. We thought that going there for lunch would be not as busy, but it was pretty full with the locals enjoying their lunches too! I'm looking forward to going back the next time we're in Vegas for sure! Will try their pizza, but I have no doubt it will be good! Clean restaurant too. It's not on the strip, but not everything good is there, remember that!",G4fAFj0xD1W1CXjHf1WnDg,0,0,4,7zbcgvdNYmzm1JmopWGFzA
162503,2017-03-14,0,pHJu8tj3sI8eC5aIHLFEfQ,"We were looking for great Italian food and we found the best! We had a shrimp pesto dish, linguini with clams, cannelloni, and eggplant spinach with pasta. Every single dish was delicious. We had a wine from Sicily that went well with all of our dishes. The service was superb. Our waiter was originally from Sicily, and was friendly and attentive! The dessert looked decadent,but none of us ordered any as our entrees were very generous portions. If you are in Las Vegas this is the perfect Italian restaurant!!",eEqAc-jo0p7K40pt5jPK3Q,0,0,5,M8RuF0T2rk3ZUsyT3t3c9Q
164793,2015-04-08,0,pHJu8tj3sI8eC5aIHLFEfQ,"Went here on a recommendation and had a great meal. Frutti di mare was terrific - ask for it spicy! The fettucine alfredo with shrimp was also good, though it could have used more garlic. Can never have enough garlic!  Very good wine list, well priced with great variety. Food was yummy, service was professional and the evening was great value compared with the top rated Italian places on the strip. I look forward to going back and trying more of the menu.",-P-3bbREWamwOrbzTccuJQ,0,0,4,v1pioMIEPAXVHBx544PFbA
180628,2012-01-05,0,pHJu8tj3sI8eC5aIHLFEfQ,"Good food nice atmosphere, Will come back to try more yummy stuff",KuzBmUaR-NJcNI1GhYmQ9A,0,0,4,265GzSsTPGdlBRGwLg9ZSg
186659,2013-09-18,0,pHJu8tj3sI8eC5aIHLFEfQ,"By far this IS the BEST Italian restaurant just off the strip. Don't let the outside of the place fool you. It looks small and somewhat uninviting. But once in side, great atmosphere. Very clean with cloth tablecloths. Excellent service!  The wait staff are well versed on the dishes. Your water glass never stays empty. Food portions are decent sized but not over the top. Absolutely wonderful. We will definitely be back!",GopgW2K2qlIGbg0u-X0cOw,0,0,5,PfgtcYe6KX95wx2thviPnA
188105,2017-07-21,0,pHJu8tj3sI8eC5aIHLFEfQ,"We ordered Calamari, Lasagne, Linguini and Clams, and Shrimp Scampi for lunch. While the food was good, we faced a few logistical issues while ordering and with our order. We wanted the lunch portion of the Linguini and Clams which was priced at $9.95 on the online Lunch Menu at the time of the order. However, while placing the order via the phone, the hostess on the line said that there was no lunch size for the dish. I let her know that she should ask management to take that off the menu to prevent further confusion. After picking up our food and driving back to our hotel room, we noticed that the Shrimp Scampi had no linguini! It only had shrimp and sauce! We called to let them know, but all they could say was that we could go back for another Scampi dish. We would have liked a refund since the dish was $19.95. Unfortunately, our flight was later that day and we could not make it back to the restaurant. Hopefully they update their menus online soon to make sure the price of all of their items are accurate.",vVuzXMaKlDkq8U8YfeJxWA,0,0,3,CDmS_QVCGm1wL4N955NUng
195884,2011-10-20,0,pHJu8tj3sI8eC5aIHLFEfQ,"Best Pesto in town, hands down.  Garlic bread is clinically addictive.  Is built into a strip-mall, so the exterior doesn't look like much, but inside is a great atmosphere, classy, perfect for a nice night out.  Occasional live jazz.  Be sure to reserve ahead-of-time - this place is always booked!",GOWBkpDlkJY4jvHL0xWGlg,1,0,5,5MKcKhHpNoXvnAn7y_MZhQ
203548,2014-12-27,0,pHJu8tj3sI8eC5aIHLFEfQ,It was my first time visiting this restaurant and I only have great things to say. Baked Rigatoni was exceptional. I've never had ricotta this creamy. We will be back next time we're in Vegas. YUM!,vDAOsucL8bdWC5HN9Qv3Yw,0,0,5,uLuVQnrxcfqUR20j5vrEQA
204981,2014-01-01,0,pHJu8tj3sI8eC5aIHLFEfQ,"Don't get there often enough! Food is wonderful, wine too!! LOVE their spinach/farro salad.",iDfQikdiXnhu03VBFM4rqg,0,0,5,jXpge7Z27nqm0iAY3AGOUw
213144,2015-04-07,0,pHJu8tj3sI8eC5aIHLFEfQ,Nora's was somewhere I really wanted to try while in Vegas. I read reviews that the vodka sauce was to die for. And it did not disappoint. Our service however was lacking.,jyJ1rRhLRCQF_pc5ax3h6w,0,0,3,UgtjZzt6rLWaqQIh2-mhKg
217032,2012-01-08,0,pHJu8tj3sI8eC5aIHLFEfQ,Im a italian and live in Ct. And we are spoiled with our Italian eateries but been traveling to Vegas every year for 9 years now. My aunt who lives out in Vegas now brought us there and we were totally astonished. We make it to Nora's at least twice while we are there. The atmosphere and service are great. We always try to order something new and different each time we go and nobody has been disappointed. Even me who is a chef and is very weary about ordering pasta at a restaurant even though a simple dish to make can turn into a catastrophe with a poorly made sauce loves the baked ziti. I can go on and on but u get my drift. If you are in Vegas and you are looking for a great place to eat and drink this is the place. P.s Even my mother who wont eat anybody's sauce but her own loves this place and if you knew her you would really take that into consideration. Lol,UFRlLlEYRfGCHd9XoT5k9Q,0,0,5,hmEGWgcPEm4su-FitxKFmQ
220156,2015-12-18,0,pHJu8tj3sI8eC5aIHLFEfQ,"BEST ITALIAN EVER!!! I have been coming here for years. The Arancini is the best thing on the menu. I get it every time and it's always amazing. Absolutely the best Chicken Marsala - but ask for no marinara on the side pasta, that way you can mix the pasta with the chicken. I love this restaurant. You can't go wrong with anything on the menu.",4141Q9KIHJYdMTArkqc9fw,0,0,5,08hNFgp7kuc9iPZ6Ukk2Hw
223042,2016-12-19,1,pHJu8tj3sI8eC5aIHLFEfQ,"Food is amazing. But......
Hostess is too busy flirting to seat anyone  and bartender is anywhere but actually at the bar. Food keeps this place going because there is no service. Be sure to carve out a large portion of your day.",O-zmregbsU3N7VvmEjU0sA,2,1,3,YgAVUxoVv-zB3zds8qiBKw
233317,2016-02-10,0,pHJu8tj3sI8eC5aIHLFEfQ,"The food is amazing, I can honestly say this my favorite authentic Italian food spot,",rbALw5vyXoiu6X_BN_6RaQ,0,0,5,RxGBMX17p3d-M-gQiMo_LQ
241470,2012-09-02,0,pHJu8tj3sI8eC5aIHLFEfQ,Lasagna was ok but they killed it with tooo much cheese baked on top. not enough sauce either.,D3L03YDKUTfwWmrfYQFyjQ,0,0,3,5OPw2-Ig_L_itKG4w3pynA
242700,2014-05-07,0,pHJu8tj3sI8eC5aIHLFEfQ,"Intimate dining, thus need reservation or you will wait. Food was excellent, service was pleasant. Prompt service, did not have to wait more than 10 mins for food. Drink refills were very timely. Prices were reasonable. Only negative, garlic breadsticks were not very fresh. Other than that it was a good experience.",oRVvN0RDUSMIVCA0f-S9ig,0,0,4,tBxuitFGD42V6pu5x5XjjQ
242781,2014-11-01,0,pHJu8tj3sI8eC5aIHLFEfQ,"Good place to get good food, I got the crazy Alfredo and it certainly was a good helping of it.  The bread was also really good, I'd have come again to try other items so I could give a more detailed review but from what I tried the food was good, service was great.",GfBJcMMB6nv2A1w5U_du7A,0,0,3,RD_wz2tuC_HPAYnkZwTePA
