,date,funny,business_id,text,user_id,useful,cool,stars,review_id
2797506,2014-07-27,7,pTJ8f4AfUW6uwKGdawLcfg,"Before you come here, lets get the most important thing out of the way.

GET YOURSELF THE ROSETTA STONE KOREAN LANGUAGE LEARNING PROGRAM OR BRING SOMEONE THAT SPEAKS KOREAN!

Apparently, these guys are trying to be so authentic that they hired Korean staff that hardly speaks any english. I asked for a fork and dude says, ""You want spicy pork?"" I said yes because I love spicy pork but at the same time I really wanted a fork because I am chopstick challenged. I dont have any patience to use that crap.

Anyways, I came here because of their grand opening special of AYCE bbq 12.95 for lunch and 15.95 for dinner. Add 5 dollars more if you want AYCE sushi with that. Come August 1st its going up to 20.95 for lunch and 25.95 for dinner. The 5 dollar sushi AYCE sushi option still applies.

Keep in mind that you pick out what you want on the menu and they bring it out to you on plates. It's not like Sura where you get up and get whatever you want and bring it back to your table. 

We ordered Short Ribs, Brisket, Bulgogi, Pork Belly, and Chicken. The short ribs and Barbequed Steak (which they were out of) are only available for dinner. All that we ordered was really good except for the chicken which was kind of dry. 

Besides the language barrier as the first major disappointment, im sorry to say that there were more to add to it. One was the parking or should I say lack there of. The parking lot is small and the spaces are narrow. Dont be surprised if your car has a few more dings or dents when you come out to leave. I recommend parking on the street. Next, the grills they have you use are gold colored and are not designed properly. When cooking fatty foods like Pork Belly, there is no place for all the excess oil to drain except the sides of the grill where they can catch fire. Ours did and we had to turn off the fire so they can extinguish the flames. One of the bussers came up and sprayed some kind of all purpose cleaner to put the fire out but it caused it to flare up and almost burn our faces. Im glad I didnt get burned or there would have been a severe lawsuit pending. All they could say was, ""Oh, sorry"". From that point on, our server would come by and mop up any excess oil off the grill with napkins. Really? I dont ever recall any Korean Bbq joint doing this.

I would also like to mention that they have these crystal grills that you can use as well. We were not offered this option and would have turned it down anyway because of my friends that tried it several days ago said it sucked.

Some random info: Hours are 11 am to 12 midnight every day. Lunch is from 11 to 3 pm. Dinner is 3 pm to closing (12 midnight). Makes me wonder if you can sneak in right at 2:45 to get charged lunch price and get dinner items. If you try it and it works, let me know. Lol. Also, dont eat here if you are wearing nice clothes or are planning to go to a nice or formal event. The smoke from the barbeque stays in your hair and clothes. I made the mistake of eating at a Korean barbeque restaurant right before going to a graduation ceremony. Everybody was looking around wondering if somebody was barbequeing somewhere close by and ironically thats what people wanted to eat for dinner as soon as the event ended. 

So in closing, I suggest that if you wanna try this place out, bad service and all, now would be the time because of the promo price. Then, you can decide if its worth any future trips when they charge regular price. For me that's a negative captain. 

Yelp 2014 365 Review Challenge #162 ""Only YOU can prevent Korean barbeque grill fires""",0FMte0z-repSVWSJ_BaQTg,6,4,2,jN2jCWN2vs7NyPHMZbyKiQ
2887730,2014-07-26,3,pTJ8f4AfUW6uwKGdawLcfg,"At the grand opening price of 18.99 for AYCE bbq & sushi lunch I can't complain.  Oh yeah this is Yelp so, I guess I can.  We've had 4 star Korean & we've had 1 star sushi all at the same time here.  Skip the sushi altogether. Stale fish.  The bbq was decent.  Wagyu beef belly, short ribs & spicy pork were good.  Some of the flavors left much to be desired.  There are tons of worker bee's making sure the drinks were full.  Service was funny and pleasant.  We were going to be seated in a booth then a manager said, ""Oh we put them in da tabol, he's a beeg boi."" hahaha.  Being a pacific islander I don't take offense.  We had our meats placed on the grill for us.  I had to flag them down to, uh, turn the grill on haha.  Growing pains.  They were all trying very hard, so I appreciate that.  Towards the end some actually ""biig boys"" came in and they had to be seated at the other end of our table.  Those guys..  Big haas and bubba immediatly began oogling our grill.  I'm sure our meat felt violated, hahahaa.  This price is validated as they are all new to business,  but after this price goes up we will probably be going back to Gangnam or Wagyu for korean.",ZngF2uBYrqyFjXd6LvuluQ,3,3,3,eur_y5PyORaeksGdBofjkg
2964459,2014-09-29,0,pTJ8f4AfUW6uwKGdawLcfg,"This place was great! Me and a friend got the Shilla A and his girl got the all you can eat sushi. His girl loved the sushi. She said it looked great and tasted even better. I got the thin sliced beef and the chicken while my friend got the pork belly and the rib eyeand everything was really flavorful! The lady attending us was super friendly and was very helpful. All this for my first time trying Korean BBQ!

Definitely coming here again when I visit Vegas next time.",50OtIqCwTJNykmoCsLjVfw,1,0,5,sjhzuEyZroRL2NJqEiiDLg
2980417,2013-05-29,0,pTJ8f4AfUW6uwKGdawLcfg,"This place is amazing. My friend invited to go because she thinks it a great place, and it lived up to what she said. The place says Korean BBQ the place has amazing sushi. The chef spoke with us the whole time. He was very kind and the food was great. He listened to what you liked and not liked and made great recommendations. The place was clean and my glass was always full.",rcgcVAmE1rXlBaWGsCrQaA,0,0,5,_T2BuNpU0dvWieTDyP4eMg
3144896,2014-09-03,0,pTJ8f4AfUW6uwKGdawLcfg,Great food and great service....we did ayce sushi today. Uni is fresh garlic tuna is great also cowboy roll have to order that is the best one. Have no problem with the server that not speak English like another review said so i guess u just have to try it yourself. But I will def b back to try Korean BBQ next time...,bPbSNpQTAuLa96e2tFQXlw,0,0,5,7BZtRuORfoqMKmGQWDYceQ
3542613,2013-04-15,0,pTJ8f4AfUW6uwKGdawLcfg,"This place has been here for many years. They have recently remodeled, nicely might I add. I like how this place is so original looking. You will not find any other restaurant with this type of decor. The food is very good and they have recently re-added their sushi menu. The quality of the fish are always fresh each time I go and I also enjoy coming here not only because of the food but also because of the service. I would definitely recommend this place to anyone who enjoys Korean BBQ and/or sushi! :)",wMjv76lMNLRJ6g9XmpNavA,0,0,5,kq-BpZJZELFLCPRMejJCyQ
3912424,2007-01-24,0,pTJ8f4AfUW6uwKGdawLcfg,"Very good Korean food.  Pricey but good.  This is an off the strip trip that's worth it if you are looking for K-BBQ!  

This is an odd pairing of a Japanese Sushi Bar with a Korean BBQ place.  I've never tried the Japanes food but I've had a chance to eat here 2 or 3 times for a Korean fix in my regular trips to Vegas to visit my family.  

The Blu Go Gi, the Kal Bi, and Dae Ji Bul Go Gi are very good.  You have a choice of cooking (i believe) but we've always been too hungry to cook and just had the kitchen prepare everything.

Pros:
+ quality food!
+ plentiful parking
+ good service

Cons:
- typically empty restaurant
- high prices for Korean food (but the quality is good!)",ASvjSBCYRd4GhOtSIn8Gyw,9,3,4,0mCtAL1od3TH80X_RpLnvw
4260207,2010-08-04,0,pTJ8f4AfUW6uwKGdawLcfg,"I was introduced to this restaurant years ago, by some Korean co-workers who took me to lunch here. I had the Bi Bim Bap, which was sooooo good. It's my favorite Korean dish to this day- an egg on top of, tender beef, mixed vegetables, spinach, and kimchee, over white rice and hot sauce- that you mix all together, served in a stainless bowl. 

We used to come here for the lunch special- shrimp fried rice- which really sounds weird to get here, but it's really good. They don't offer the special on holidays, so we stopped coming (yet the sign advertising it still stands outside). (I went here with a friend for the sushi special but he didn't like it.) The service is ok. Usually, there is maybe two other parties at most, like the other reviewers mentioned. The server would disappear, maybe to the other side, which is a sushi bar. I also agree with one of the reviewers that this place needs a makeover or something because it looked a little tired the last time. 

There are so many other Korean restaurants now that I would rather go elsewhere.",fiGqQ7pIGKyZ9G0RqWLMpg,0,0,3,AjvBSkYVIJGC66N-oQHoNg
4563760,2014-08-03,0,pTJ8f4AfUW6uwKGdawLcfg,Rolls where pretty fresh tasting. Not bad for 20$ under new management price. Not sure for how long its up so take advantage!! Sushi maker Bon is on point and attentive Korean BBQ is under the same roof too. All in all good experience. Kanpaii!!,Z9O4lksocKqhDWP5mqzaHQ,0,0,4,YgzMsUYA8mVeoHsEH9zhsA
4574408,2011-09-05,0,pTJ8f4AfUW6uwKGdawLcfg,"TIME SPENT
1 meal @ Dinnertime

LAYOUT
small, adequate wooden furniture...  some tear in booth seating.   i was seated near the bathroom and noticed a mildew and strange odors.^^;

SERVICE/FOOD
prompt, attentive, and friendly...  my waiter was VERY talkative after he found out my party knew about the Nintendo/Atari era.^^;

the food was not bad and the sides and salads were surprisingly good.   but the mildew and odors may have ruined an otherwise good meal. T.T

PRICING
average.^^  actually, kinda lower than average...  maybe the owners of Shilla knew about the sub-par LAYOUT and decided to save themselves with good pricing.

CLOSING
a good meal cannot substitute for a bad overall experience.   i'm willing to pay a couple more dollars for less smell and better furniture.^^;",nxtqjMAPbIyJT2-0rYFUbA,1,1,3,jDtDYnWbgSv7Ci0EdGhbpg
4722509,2014-07-30,0,pTJ8f4AfUW6uwKGdawLcfg,"Have a really cool dinner tonight, i got the sushi and BBQ. The sushi is fresh rice with a big piece of fresh fish on top,  BBQ are fresh and taste sweet. Server with shiny smile they teach me how to do the BBQ help me a lot, I am happy to having a delicious food in this wonderful restaurant .",aQzxSZ1ln-wr9MFeair4Vw,0,0,5,G9Tmn9qHRrWAWXe0_C8n9w
4779993,2014-07-26,0,pTJ8f4AfUW6uwKGdawLcfg,"I heard that the owner of the restaurant was changed, so I went there to check out. Parking lot was packed. There was very narrow space to park. Overall, one star is just enough. BBQ section smelled so bad (not enough ventilation) and so hot! I was sweating a lot and I still can smell BBQ from my clothes and from my hair.
Food was not good too. They lie to customers who don't know what Kobe beef is. They DO NOT have Kobe beef, just cheap junk to eat. Only four side dishes came, tasted so so. Fountain drink tasted metalic, and I saw no bubbles at all. It seemed like there were many servers, but no one checked our table while we were eating although they came back so fast when I asked for the check. 
I had to call the server a few times to get more salad. 
I would never recommend this restaurant. I will never go back. 
But if you want meat for cheap price, now it's the time to enjoy $15.99 dinner AYCE BBQ. After that it will jump up to $25.99.",sf8w4vCA_ppXUAje04FjOQ,0,0,1,jePTPYGHp0L8A8wJkcGpqw
4835451,2014-07-26,2,pTJ8f4AfUW6uwKGdawLcfg,"I really wanted to enjoy this place, but there was too many things that were wrong during my visit here.

A buddy of mine and myself came here and we both got the AYCE bbq and sushi. We both ordered some baked mussels, I happened to try the first one, and it was cold and had a bad taste. We let the waiter know and he apologized for them. My buddy ordered a soft shell crab, and when my buddy cut into it, the insides oozed out, and he stated that it had a bad smell. The waiter took it and apologized yet again. My buddy also ordered some dynamite and it never came out during our whole time there. We let the waiter know again, and he apologized for all the mistakes with our orders during our visit when we left.

The sushi we got was okay. Our philly roll had a exceptional amount of cream cheese in it. We couldn't really taste the salmon or avocado because of it. The yellow tail nigiri and tiger roll we got was okay.

Half of the bbq we ordered was pretty good. The galbi and pork belly was the two things we continuously ordered and enjoyed. My buddy liked the octopus they had, but it was too salty for my tastes. The other bbq we had didn't have a whole lot of flavor and just tasted like cooked meat, like the kobe beef belly and the spicy marinated pork.

One of the most annoying things during our visit was how overzealous a female server there was. We repeatedly told her we were fine with grilling our own meat, and she consistently continued to mess with our meat we would be cooking and adjust the fire for our grill without our permission. We even noticed her talking to our male server, looking in our direction with a disgusted look on her face. We figured she didn't like how we were cooking the food we paid for.

If it wasn't for the cool, attentive, and apologetic male server we had, I would give this place 0 stars if I was able to. Between the sushi that didn't stand out, the undercooked and possibly spoiled appetizers we were repeatedly served, obnoxious waitress, forgotten or lost orders, and the inconsistent quality bbq, there isn't much reason that I have to come back to this place.",JN-F23BIngBKd9MSaXoI8w,3,1,1,VCj7IbP51XcszpT0i8IfKw
4946531,2007-04-11,2,pTJ8f4AfUW6uwKGdawLcfg,"If you wanna go off strip and eat somewhere 'normal' and kinda feel like Korean, this is THE place to go. The food is excellent. OK, you'll smell like a BBQ when you walk out, but the food is great and the panchan is also really good.

Whenever we've been it's always been a 99% Korean clientele -- with us being the 1%. Prices are not cheap, but no more than what you would pay in the LA/OC area. Just a thought since I don't particularly like to eat on the strip at the hotels where everything is overpriced and often, not really all that good. Plus, it's the same stuff over and over again. I like variety thank you very much.",nzsv-p1O8gCfP3XijfQrIw,15,4,4,wRmE_Zp4VNOCn6T4CSqBUw
4983358,2010-03-01,0,pTJ8f4AfUW6uwKGdawLcfg,"During my last trip to Las Vegas, I decided it was time for some authentic Korean food off the strip. Looking for a good Korean bbq restaurant, I found this place with the yelp app on my phone. The place had a four-star rating so I thought it should be at least decent.

Boy was I wrong. The place was ill-maintained with run-down furniture and dirty bathroom. I don't mind an old venue if the food is good but even the food was mediocre at best. Price was extremely high and there are no combination deals! I've eaten at some of the best Korean bbq restaurants but none which charges per plate of meat with no combo. We ordered kalbi & chadol (two types of meat) with soup and the bill came out to nearly $70. Once again, if the food was good, I would've been okay but the meat quality was mediocre and service was unprofessional. We were the only customer there from beginning to end and I now understand why. The owner lady was disgruntled, not-at-all friendly and there is absolutely no service whatsoever.  

I walked into the bathroom after the mediocre meal and was surprised to find old water spots everywhere (looks like it hasn't been cleaned in weeks) with one stall closed (God knows what was in there). If I'm paying for meat that run $20-30 per plate, I expect good service & good food in sanitary conditions. This place failed in all areas. For those of you who hasn't had really good korean bbq, this place may seem okay but I would never consider this place a 4-star dining experience.

We checked out Jin-Mee (another Korean restaurant) the next day and this place had much better prices and food. I'm extremely dissatisfied with the misleading 4-star review of this place and encourage its management to improve (I mean greatly improve) their management all around to stay competitive.",-J2u3687TUp2YAk_RkA3AA,0,0,2,zbapBtFO6J5En3Rsjsc-2w
4995662,2012-08-13,0,pTJ8f4AfUW6uwKGdawLcfg,"The food is really good, service is great  our waiter is very personable  and he catered to our kids which was really nice. We had two orders of kalbi ,seafood pancake and 3 sodas which ran us $80. Pretty darn expensive compared to the other Korean restaurants I have eaten at but we cleared every dish served including every little side dish they gave. The interior decor is outdated and the parking lot is not well lit enough for me to feel safe.",7eXW0KClU3J1ehd-QHO3Sg,2,0,3,J6dDVeGrB-pHAgLuI3PTnA
5103781,2010-03-23,0,pTJ8f4AfUW6uwKGdawLcfg,Went here for lunch.  Portions are good and service was ok.  Quality was acceptable.  There was only one other table occupied during lunch so it was quiet and the food came quickly.  It's a good alternative to fast food since the price is comparable to a combo at a QSR (quick serve restaurant).  I would come back if I was in the area and was driving on the same side of the street as the entrance.,7J6Hb7VuTsJq50iiNwqvCg,1,2,3,l63YTwt0vcGlOEEwATzmqw
5224058,2014-07-26,1,pTJ8f4AfUW6uwKGdawLcfg,"Be aware that if you do not speak the language, you will absolutely be taken care of last.  Such a darn shame because the food was good, when my friend wa$ not getting burned from the grill that was ridiculously close to the seating.

Quite okay though, because as another excuse rolled in, I realized that even at the opening prices,  no doubt would I prefer going over to Tofu Hut. At least there, they will not treat you worse than the table next to you.  They will treat all of you the same.  Bad service? Yeah, it was that obvious.  

I told the nice owner that I would put a review.  

One server that served our area and a single chef for a weekend night? Hmmmm.....never, ever coming back to this place.",NCF8_lVpX0sHy9p9Cvft4g,2,1,1,dOd8FgCCJ1_VZ9MAiEbEfA
5338847,2014-07-30,0,pTJ8f4AfUW6uwKGdawLcfg,"The place smells like sewer... Parking not Enough... Service was ok but there's still room for improvements!
They offered All U Can Eat but they ran out of a lot of things even a simple tofu for the salad, they don't have it!!!!! What kind of Restaurant is THIS!?!?!?!?!?",43e4JMr60OPmKZx_JaAbaQ,0,0,2,pwsj46Vvd6HeN-Vwh2Fi2g
5387548,2014-10-23,0,pTJ8f4AfUW6uwKGdawLcfg,"The food was pretty good, but the place was filthy and the wait staff was beyond confused.  We ordered Korean BBQ, but instead of the normal metal grate over the flame they offered us a thick glass dish to cook our meats.  This worked less than okay, resulting in longer than normal cook times and much greasier meat.  Furthermore, obtaining water refills was quite a challenge.

Later in the evening when we attempted to use the restroom, it was in poor repair, as well as poor cleanliness.",KmBPYlD00BupKSwWxOWA6w,0,0,1,G-1Fq-80HWn6kZ8EfiEDhA
5492560,2014-07-24,6,pTJ8f4AfUW6uwKGdawLcfg,"This 3 star rating is based on what the prices will be after the end of July.  For the current grand opening prices of $15.95 for dinner AYCE sushi or korean bbq and $12.95 for lunch, I would give it 4 stars.  

We decided just to opt for the korean bbq by itself.  AYCE Korean BBQ and sushi is available for $5 extra which is a nice option that other restaurants in Vegas do not have.  The Korean BBQ and sushi sections are separated.  This is a good thing, since the Korean BBQ area is HOT! I'm a little sensitive to warm temperatures and with all the grills going, it really seemed like the AC wasn't working properly and the vents over each table weren't working properly.  The decor is a little dated and has an old school feel, which matches the location of this restaurant.

The cuts of meat I feel were average and on par with all the other AYCE Korean restaurants.  The galbi, kobe beef belly, boneless short rib (dinner only) were the best cuts of the night.  The pork belly was pretty average.  The barbeque steak (dinner only) was horrible and a waste of stomach space.  It ended up being tough and dry (and no it was not the cooking technique).  Other options available that we didn't get a chance to try are the chicken, marinated pork, bulgogi, brisket, octopus, intestine.  On the AYCE appetizer menu, there's steamed egg, gyoza, crisped rice, mixed tempura, and chap chae.  The ban chan selection was average with kim chee, cucumbers, bean sprouts, and a sweet marinated dried fish.

So don't be fooled by the picture of the crystal cooking plate in the pictures, out of the 10 tables that were there, only one lucky table got to use it.  By far it is not the standard.  Most of the cooking plates are these gold colored plates that burn and stick badly compared to the cast iron ones at other locations.  They did change out the plate once for us since I turned it off because it was smoking so badly.  One older asian lady was outraged that she was not given the crystal plate and went up to the staff and complained loudly.  They ushered her back to the table and quieted her....not sure what the response was in regards to one table getting the magical crystal plate.  I did notice the crystal plate didn't smoke and burn like the older gold cooking plates.  So overall, great value for the current grand opening price.  For $25.95 for AYCE korean BBQ and $29.95 for AYCE korean bbq and sushi later....I'd probably pass.",Tdv7HZa4Hyjm-X0MtNmeag,8,7,3,LCl9RdqKC9zdtqWZyLD_hQ
5496158,2014-01-18,0,pTJ8f4AfUW6uwKGdawLcfg,"My wife and i were really in the mood for Korean. Found this place using yelp, and I'm glad we did. Great service, great food. Las Vegas can be tough, sometimes the food just isn't worth the price. In this restaurant, it is fantastic...pricey, but worth it.",i2-JCPDICia0V53P2aWwHg,1,0,4,R7uJV9Yu5LtbVVo2SNc3QA
5557569,2010-11-09,0,pTJ8f4AfUW6uwKGdawLcfg,"Oh my.... this is not the same shilla I knew few years back.  Horrible service and NO taste.  This is NOT the same Shilla of the glory days.  I think they are trying...but need to try harder if they want to stay in business.  Over priced on most of the menu and the few that we had, 'Mixed Seafood Jungol' and other dishes were forgettable.",_DsKs6DT8o7-TQ2uA2MiFw,0,0,1,tc3vAxW6d6XY7zKbSAFhVA
5719713,2013-06-02,1,pTJ8f4AfUW6uwKGdawLcfg,"Korean Cuisine, best I have found. Highly recommend! Nice dining experience, BBQ in the table. Drink Meal with OB golden lagers. I will be back very soon. $$$  worth every penny. check out",SYc0JiofjHKHOiJtqt9ZUg,2,1,5,-N2xZgAMwRzFsJUHtyU15Q
5856038,2014-08-05,1,pTJ8f4AfUW6uwKGdawLcfg,"Visiting Vegas for a Star Trek convention this past weekend, my wife, son and I wanted to try something different than what was offered in the resorts and we wanted to be away from the strip.  So we ventured to the Korean BBQ place that we found through Yelp.  Not all the reviews were favorable but we gave it a shot 

There was a decent amount of space for parking and immediately found a parking spot.  As we entered the establishment, we were quickly greeted and asked about our dining needs.  We told him that we wanted Korean BBQ and was led to our table amongst many other BBQ diners.  As we sat down, we were asked for our drink requests -- easy, waters (3x) please.  A very pleasant young woman came to our table and handed us the menus.  The prices were very reasonable and they even had a AYCE Korean BBQ & Sushi/Sashimi combo.  Again, the prices were very reasonable and to our surprise, they were having a promotion of giving $5.00 discount off the prices we saw printed on the menus.

We told her that we wanted the AYCE Korean BBQ.

Minutes later, our drinks arrived which was followed by the usual Korean side dishes -- Mmmmm kimchi and spicy lettuce/salad.

Let the AYCE Korean BBQ begin.

We ordered 2 AYCE dinners and 1 1/2 price AYCE dinner for our son.

First round:
 - Beef Bulgogi
 - Samgyubsal (pork belly)
 - Dak Bulgogi (chicken)
 - Jukoomi (baby octopus)
 - Gyeran Jjim (steamed egg casserole)
 - Gyoza (dumplings)

Second round:
 - Joomulluk (boneless short rib)
 - Saeng Deung Sim (steak)
 - Steamed rice

Third round:
 - Chadol (beef brisket)
 - Galbi (short rib w/ bone)
 - Gyeran Jjim

After all that, we called it quits and asked for the check.  All throughout the dining period, we were checked upon, they made sure that we had our meats available for cooking.  In general, we were quite pleased with the entire experience.

As we got up from our table and proceeded toward the exit, we were asked to come again.  Unfortunately, we leave for home (Maryland) the next day.

I will make a note of it to visit the place again when the opportunity presents itself.",DT8ZsgmKCHNGak1gJq0leA,2,1,5,cY9cFXGas-unWT6x9uP94A
