,date,funny,business_id,text,user_id,useful,cool,stars,review_id
198809,2012-03-16,0,pTJ8f4AfUW6uwKGdawLcfg,"There was not a soul dinning at this restaurant when I arrived, that should have been my sign to leave, but the hostess was really nice so I decided to give it a try.  I had the Bulgogi and it was decent, but the price was outlandish.  $30 for the exact same dishes that I have gotten at other Korean joints for $10-$15, that this was not worth double or triple the price.  The restaurant decor is really old and outdated and the places feels a little grimy.  I would skip this place.  The only reason I am giving it two stars is because the lady was really nice.",42ycAVFQCUmDZT8cPIAfTA,0,0,2,2uoZGqdGG3H9vagOVfdmSA
320177,2011-05-01,0,pTJ8f4AfUW6uwKGdawLcfg,"I have been to Shilla Korean BBQ several times while staying in Las Vegas on business. The Atmosphere is ok, sometimes the tables are sticky, but the food is really good. I have been there while it has been busy and other times my table was the only one with people in the restaurant. The staff is very friendly and helpful, and you will walk out of here with a full belly. The traditional Korean dishes are always good, the salad they bring out is also tasty. Overall, I will come back here.",ha2SwGmllMpOk9YlqMyGew,2,1,3,MzkjYInleDW16b0uSBX9LA
352868,2014-08-17,0,pTJ8f4AfUW6uwKGdawLcfg,"Rating based on the BBQ buffet (sushi not included for what we came in for)

It was an ok place. Nothing spectacular, even in food. I loved their gyozas though. We went during the grand opening promo period (which seems to be going on for a while....) so the price of $15 was fine. The grill was tiny, perfect for two persons. They bring out little portions at a time. Not recommended to have 4 hungry adults sharing one table. Would I go for the full price? Definitely not. Would I ever come back again? Likely not. 

If I had paid full price, I would've left pretty disappointed---could've gone elsewhere, paying a few bucks more for quality and quantity.

Five stars for friendly staff though.",9Kgz60mivLD10Xrs5WB5Zw,0,0,2,uCQ1q1VMeq4wyIcDF5IGtg
374916,2013-01-16,1,pTJ8f4AfUW6uwKGdawLcfg,"For some reason, we decided to venture off to get some Korean BBQ.
Found this place on yelp and headed over.

This place is ok, considering Vegas has such great eats, this place was ok.
Compared to other Korean BBQs this place was ok.
Nothing stood out. Even now, I try to remember something specific about it, it's a struggle.

If you have to have Korean BBQ, then this place will do just fine, if you can wait, I'd go sample some other food delights that Vegas has to offer.

Just my 2c.",_72QdatN4fPKO5QSNGFYRA,0,1,3,llpmzEDkRS7Jj1IuKA-8XQ
434910,2014-09-22,0,pTJ8f4AfUW6uwKGdawLcfg,"I had been looking for a good Korean BBQ and decided to try Shilla, they were awesome. Food was soooo good, you can't beat all you can eat for $13.95. I've been there about eight times now and each time the service has been great and the food as well. It truly is all you can eat, you order and they bring it, no attitude. I love it. The all you can eat sushi is the best, it beats Yama sushi where is where we usually go and again the service is awesome.",0MYiRwYYxm5wF9dK1Dmdvw,0,0,5,g40in8yee3yZQPbJZS6lBQ
693072,2014-07-28,0,pTJ8f4AfUW6uwKGdawLcfg,"Have a wonderful lunch today with my team. No wait seating for seven is pretty good at lunch.

The food was great! Service was spectacular. I will be back. Great dining experience!",Jsl5hVofgyfqGoYACCE3Yg,0,0,5,yEjm7e-fDZ4DFjEp-uwM6A
700736,2014-07-31,0,pTJ8f4AfUW6uwKGdawLcfg,"It is my first time been here after they changed owner. Won't be here anymore,bad Service and waiting for long time to get the food,they lost the order list but keep telling me that the food is coming!",3qDSJFZzFPtHkTNYDmAoWQ,0,0,1,PRFwg7TdrMTd5KVPv_zE8Q
972925,2014-07-20,0,pTJ8f4AfUW6uwKGdawLcfg,"I went this evening with my family that came from out of the country... The service was excellent and the food was as well. They were absolutely sooo accommodating. Tabitha was helpful and made this experience for me and my family a wonderful one. From now on... every special event that involves dinner I will take here. You will not be disappointed in the staff and service !!! I highly recommend this restaurant.  I am a food server here as well and so i think my expectations may be higher than guests that come in... I hope you will choose this place before any other Korean BBQ. If you find a place cheaper, I can guarantee you that you will not have the same exceptional experience,. Thank you Tabitha and to the staff that served us. Great Job !!!",komBK-O7_9cUYi7hJoqYOA,0,0,5,AopKW5viE9GUCZ4f1y20eg
1018867,2014-08-02,1,pTJ8f4AfUW6uwKGdawLcfg,"First AYCE Korean BBQ place that you can also get a combo with AYCE sushi, and just a $5 difference in price. 

After reading the reviews I was a bit hesitant to come here. But, the service was definitely on point and not lacking in any sense. Everyone was extremely friendly and very attentive. 

We enjoyed the Kobe beef belly, brisket, pork belly, and the Galbi. At first the brisket was sticking to the metal grill so they switched it out to the crystal grill. That particular grill took awhile to heat up but the meat didn't stick one bit to it. I guess it just depends what you prefer because the crystal grill completely covers the open flame and the food takes just a little longer to cook on it. 

As for the AYCE sushi, we ordered the Spicy Tuna Salad, and a couple of nigiri sushi pieces. All were pretty good. No complaints. 

The pricing was $19.95 for AYCE Korean BBQ, and $24.96 for the AYCE Korean BBQ and Sushi. Both menus were pretty extensive and the meats offered were much better quality than other places I've been to.",jOW3BGthCDL3l7Dd6AWZtA,2,1,4,R4LZsA6QOYNZvQtnYfKTeA
1091548,2014-08-18,0,pTJ8f4AfUW6uwKGdawLcfg,"The restaurant is under new management and it's located near the I-15 South exit in Sahara Avenue. We came here for our friend's birthday dinner and we absolutely love it here! The place is huge - separate area for sushi, korean barbecue, and a family room if you want it to be more traditional Korean dining. The food was great for the price as well. $25 for AYCE sushi + korean barbecue and $19 if you just want either. The service was amazing, the owner of the restaurant even took care of us when we were there! Cool right? This place is a must try. Or a #1 go-to place when you're actually craving for some great Korean barbecue and some yummy sushi. :D",VWxQyQo-nCx0oapaK-bAxQ,0,0,5,BzVz7lWRBWBYMZB1RCQ-nA
1376487,2011-09-06,0,pTJ8f4AfUW6uwKGdawLcfg,"Ok... I'm kind of indifferent about this place. The food was pretty good but in my opinion it was overpriced. The atmosphere was nice at first but if you really pay attention it loses its appeal. The waiter was nice but barely spoke English and being a foreigner myself, this really annoys me. I believe the novelty of these places is that you cook your own food but the two waiters kept coming over and messing with the heat and flipping our meat. I am a chef and trust me when I say that about half of the time it was unnecessary. Over all it was a good experience but I must say it is extremely doubtful I will return.",8sJGHuxHtTpQOnlXZkfDZw,0,0,2,orAogYBPx-Jr7G-DjVnA4Q
1510895,2011-09-24,0,pTJ8f4AfUW6uwKGdawLcfg,"I was here 3 years ago when I throw a farewell party for a couples that going to move to Colorado. They were the one who chose the restaurant. To be honest I do not like the food here.To me the food here(except Japanese food)tasted like they has been influenced by western cuisine.

The service is pretty slow.The bathroom is not so clean.The restaurant is kind of dark and stuffy.The price is ok.

I am kind of wonder why it rated 4 stars in Yelp. For me I am not impressed.",sF1okJwZYz8l1Esy3ONE7w,0,0,2,RwqFmDVpdW-fb0AaLkcrWw
1595420,2014-07-25,4,pTJ8f4AfUW6uwKGdawLcfg,"Yes the grand opening special $16 for AYCE krn bbq is great and all but its still not worth it in my book. 

First off, parking. IF this place ever gets off, where will all the customers park? Is everyone forced to carpool? because there are literally only 20 spots and its a cramped lot. Gotta fix that.
Secondly, service. Our service didn't suck as bad as everyone else's but it was still bad. I mean the servers try to be nice and all but they did forget a couple of dishes. I also don't mind them cooking for us, however  much of our food turned out burnt. boo.
Lastly but most importantly, the food was just not that good. I really like strong flavors and both the marinated bulgogi and galbi were too bland for my taste. The other meats were also too dry and chewy.. maybe an indication that stuff wasn't too fresh? There was also a lack of variety in the AYCE appetizers. Sure gyoza and the steamed egg are good and all but I wanted more. I mean you're up against all the other AYCE krn bbq places in Vegas.. step it up yo.",cdCvHUFdssePxowTHIo3dQ,5,3,3,-MWmWcEUsQZMI5La4AQdAA
1920622,2009-02-07,0,pTJ8f4AfUW6uwKGdawLcfg,"This is definately a good place to go if you're craving korean food while in vegas. Off the strip which is something i love to get away from after being there for too long.
  The service i got was eh... i had to get my own menu, took too long to order and too long to get our food. there was only one other table in there for lunch.",wIR0nQNrCU7O-91xHAWjLg,4,0,3,-EOtwy1SdxOcbs_8M3KgsA
2114430,2014-10-06,0,pTJ8f4AfUW6uwKGdawLcfg,"Shilla Korean BBQ has been around for quite sometime in the city of Las Vegas. I remember this being the first Korean BBQ restaurant I'd ever tried when my family first moved to Las Vegas in 2005. 

That being said, I fell in love with their potato salad which needless to say - is the only place in town that serves this as one of their appetizers. I'm too nervous however to ask the Korean women how they make it, I'm sure it's a secret recipe. 

I however, recently went back there with my older sister for Sunday supper and the place was completely dead (perhaps because it was Sunday and everyone was at church is what I'd like to assume)

Anyhow, I order the Kalbi Tang my sister order a Seafood Sundubu and it was great. The food is on point the establishment is clean and tidy. The place has good customer service and I think the only thing preventing Shilla from getting more customers on a Sunday afternoon is probably the restaurant location. It's a bit tucked away on the corner of Sahara.",8g-IA2xZoWkt2Ui4ThQ90g,0,0,4,Ru9_a1NysYbO0DC4nH6WIw
2323012,2014-07-28,2,pTJ8f4AfUW6uwKGdawLcfg,"Came last week for the grand opening special during lunch and thought it was ok. For about 12 bucks for AYCE Korean BBQ, the grand opening special is a great value and we thought the meats and some appetizers were really good, although service were a little lacking. Keeping in mind that this business is under new management, and there might be some kinks that need ironing out, I'm giving my experience a 3-star rating which was really difficult because...well...just read my review:

The interior is a little dated and it is super hot inside, most likely because there are grills on every table and everyone is grilling at the same time. Not sure if the big copper looking vents above each table work because they were silent, but I didn't think we smelled too bad after leaving which was good.

We got set up with a crystal grill top when we sat down that I thought was pretty cool and it definitely retained heat a lot better than a normal grill top and was non stick as well. I realized after talking to my friends that came on subsequent days that there were apparently 3 different types of grill tops but I think I would still prefer the crystal. I was still able to grill meat 15 min after the flame was turned off by one of the staff...this wouldn't have been possible on a traditional grill top. The secret is to wait until the crystal heats up before placing the meats on top. The staff did not allow us to heat up the grill after switching us out to a clean one and threw all our meat on top of the grill for us while it was still cold. This pissed us off, especially because we prefer to cook our own food and don't appreciate them butting in and grabbing our meat/tongs off the table, especially if they're going to screw it up and do it the wrong way. They also kept trying to serve us cooked meat with our tongs that had been used to touch and flip raw meat, making us a little uneasy. Not sure why they have to be so controlling!

Also, there appeared to be a language barrier and we were unable to get items that we needed such as napkins, water and sauce refills and additional orders. When the servers came by we attempted to communicate things that we needed each time. They would either have a confused look on their face or acknowledge us and then never return with the item requested. We asked about 4-5 times for more sauce before we got it. Same with napkins. One of the servers even blamed me for Michael K not having a plate even though she was the one that never brought him one! WTF! If I had to rate service alone, it'd be a 1 star rating for sure! Either bring a Korean speaking friend or expect to have to ask 4-5 times for everything you need.

Food quality was better than I had expected and the meats appeared fresh and well marinated. My favorites were the bone-in galbi and pork belly. Just don't let the staff see you cutting meat while it's raw or they will give you a lecture about waiting until it's cooked. Really? With scissors and tongs that have already been touching raw meat? This will also make them want to cook and serve your food for you....if I wanted that then I would have gone to Bennihana or something. 

With all the service issues I am not sure how they'll ever have a good customer service rating...because of this, they're definitely not worth more than their grand opening special and once their price goes back up to normal I would not come back or recommend this place because you'll be here forever trying to grill and eat just 2 plates of meat due to service issues and waiting on your orders, drinks, napkins, sauce, etc.

I also would not recommend doing both sushi and BBQ together...pick one or the other and sit at the designated section. Tony T sat with us in the room with all the table grills and it took him forever to get his sushi orders and some of them were wrong or confused for something else. If you want sushi, go sit at the sushi bar near the front door!",zBi_JWB5uUdVuz3JLoAxGQ,3,1,3,Pizkmc2vH7YLhfzZ1Al9iw
2388740,2014-07-30,4,pTJ8f4AfUW6uwKGdawLcfg,"I dont know how its pronounced but I always think of http://m.youtube.com/watch?v=wbL2lMn34Oo 

Due to their surrounding area Ive never thought of trying Shilla until now. Since they were offering an almost half off grand reopening special why not. 

When I got there for weekend lunch I had no problem with parking, even got one closest to the door. When I left it was about half capacity. If it ever gets to a point where they were out of parking in their parking lot then theres some street parking along the front.

The interior seemed nice. There were 3 dining areas one for sushi, one for KBBQ , and another I don't remember. I could be wrong but some of the decor seeemed more Japanese. Its just something I noticed, didnt bother me or anything.

So down to business. I came here to chow down on some Korean BBQ and by chow down I mean eat until I cant move or they kick me out. Round 1 was a good quantity of thinly sliced beef brisket. The quality was excellent. Our cooking surface was a clear crystal thing which I was kind of doubting how it would cook the meats but it actually worked out well, no big raging flare up, no big clouds of smoke that gets in your closes, and it cooked the meats about the same as your normal metal grilling surface. Back to the beef brisket. It taste so good that it really didnt need any seasoning except if you wanted it a little spicy you can dump some hot sauce on it. Since it was thinly sliced it cooked in a matter of seconds.

Round 2 short ribs! I love short ribs especially korean style short ribs. I dont even remembered how many I ate. It wasnt to overly marinated and again an excellent quality meat.  Some people like them cooked all the way with it tough and charred, not me, I'll cook it until right before it charred.

Round 3 pork belly. Its pork belly just cook it and all in the world is right once you start eating. Not gonna lie but after completing Round 3 I was sweating a little cause it was getting hot and I was filling up. Took a little break to wipe the sweat off my face and said I have to do Round 1-3 again with the same quantity. 

Round 4 and 5 was a breeze. Then they decided to offer some beef belly also so here they brought a plate full of beef belly. So Round 6 was a huge portion of nothing but beef and pork belly. It was a pretty greasy Round 6 but it was so good, I needed soda and some salad to cut the grease. I was actually thinking of doing it all over again but after seeing almost everyone arrive and leave while I was feasting for 2 hrs straight I felt like they wanted me to STOP. Well they didnt have a time limit but if they do later on, my bad.

The sides were OK though I really didn't try to fill up on it, wasted stomach space. There werent a lot of variety and the quality wasnt the best Ive had but edible.

The service for most part were pretty good. They occasionally placed meats on the grill and cut them. They refilled drinks, sides, and plates of meat. There were a couple hiccups but nothing I'd ding them too much on. When I wanted to start drinking soda in the middle of eating the elderly lady seemed to have forgotten and I had to ask another person to bring it. When I wanted the bill they took forever.

Overall, at least for the AYCE KBBQ option, I'll give them a 4 star cause thats the only option that mattered to me. I'll be back again even when the price is regular, the quality is better than any of the other AYCE KBBQ places Ive been to in Vegas.",vWP8-aQX0rYJszqkWVL7Ew,6,5,4,SVuANkSiUPSxvkWGkXX8Hg
2451639,2014-08-17,0,pTJ8f4AfUW6uwKGdawLcfg,Very clean. Very good servers even the restaurant owner came in our table to help us cook the meat.  Excellent customer service. You should try this place.,7ghDA6ipvr10v9fP6dA02Q,0,0,5,hiWkvUDr17g-m_P3N6CGgw
2537835,2014-07-22,0,pTJ8f4AfUW6uwKGdawLcfg,"Get down here before August 1 for their grand opening special $11.95 for lunch $15.95 dinner, for all you can eat sushi or Korean BBQ, if u want both add an extra $5. The Sushi and Korean BBQ are both decent not extraordinary, but it is nice to be able get both at the same time for AYCE. I would consider the meat slightly better than Sura with more meat selections and better priced.",bWGg5KbAZHGJHeqvC71PuA,4,2,4,B8c1YXJnrWTnGzwfeL4Q-A
2637566,2014-07-28,0,pTJ8f4AfUW6uwKGdawLcfg,"I went here yesterday and I got the best service I ever got at a restaurant. The waiter helped me on the grill constantly checked on me to see if everything was ok, the food was great and so was the service and everything was A++++ pricing was great as well it came out to around $18.

I am going back to Vegas for my Birthday next month I will try there sushis.",TdLCm4m3UE3mnPy4uhTRPw,0,0,5,89mtJQ9I5kSRxL99qiwY9g
2662722,2014-08-06,9,pTJ8f4AfUW6uwKGdawLcfg,"Shilla Forilla! Prepare to sweat peeps, it gets smokin' hot in here! Summertime, 100 degree afternoon, plus tabletop grilling, should include A.C. right? Sadly this place is old school like that, so the A.C., well, was nonexistent.

It's a good place to come on discounted terms, but we won't be back anytime soon since it's at regular pricing now. 

We were lucky enough to try out their grand opening Lunch Special $12.95 AYCE BBQ - we were hesitant to try the sushi since it was just way too hot in there. The honest truth is, we would only eat here again if the prices stay that way. The regular pricing is absurd. The meal isn't worth that much, it's average. 

We ended up with the poorly designed gold plated grill and it was also tiny. You can barely fit your meats on there, let alone the veggies that come on the plate. Also, it burned quickly. Oh wells, at least they changed the grills out if needed. 

They don't have duk bo sam (rice noodle squares) or the vinegared radish sheets to legitimately wrap up your meats and sides, but they do offer rice. In the end, we didn't miss it all too much. 

Here's what we selected from the lunch AYCE menu: 

APPETIZERS:
- Gyeran jjim (steamed egg soufflé) - the egg was very fluffy, airy, delicate and flavorful. I enjoyed it.
- Doenjang ji gae (soybean paste stew with tofu, vegetables, beef) - on the weaker and watery side, but it was still piping hot and perfect to sip and wash down the greasy meat. 
- Gyoza (dumpling) - hot and crispy, but the filling was boring. I wouldn't order this again, it's just a filler.
- Japchae (sweet potato noodles mixed beef and vegetables in season) - the noodles and vegetables were cooked well and plentiful, but it was bland. We drizzled some of the gyoza sauce on top, mixed it up and voila! It was awesome! 

MEATS:
- Bulgogi (thinly sliced eye beef marinated in bbq sauce) - the meat was mildly seasoned but it was tender.  
- Yangyum galbi (short rib marinated in bbq sauce) - this was the best cut of our meal. Tender and lightly seasoned. Dip it into the seasoned sesame oil for a flavor explosion! 
- Samgyubsal (think sliced pork belly) - not terrible, but pretty chewy.

**they didn't have usamgyop available (Kobe beef belly) :(

BANCHAN:
- The sides were all super bland and lacking so much flavor. The best one had to be the Kimchi, but it was weak. We ended up grilling them and they tasted so much better! 
- Salad - the dressing was great. Very flavorful, tangy, and well seasoned. 
- Sauces were decent, but you need to ask for the seasoned sesame oil with salt and pepper. It really turns up the bland meat and wakes up the flavor!

The service was friendly but chaotic. It's hard to get anyone's attention when you need something. We had to yell loudly a few times since they couldn't even hear us over the loud grills. They forgot to bring us our rice that we ordered, but we ended up not needing it anyways.",u_wqt9RshdZsoj8ikLqoEQ,10,10,3,nm3mgec4Tdo-C0E9t-gZkA
2750073,2012-09-10,0,pTJ8f4AfUW6uwKGdawLcfg,"Was driving around Vegas with a friend from Torrance who was kind of homesick.  We decided to try this Korean place.  It was around 8:00 pm on a Saturday night and the place was mostly deserted.  We thought it might be closed, but the door was unlocked so in we went.  The decor was kind of old and cheesy.  It reeked of BBQ and the floor was properly greasy like most Korean BBQ places, so we decided to stay.  The service was adequate.  They only served Korean and American beer.  I asked my friend what he'd like, but he couldn't make up his mind.  We settled on standard fare:  Bulgogi and Kalbi, Kim chee jigae and Hite beer.  Overall the food was just OK, nothing to get excited about.  Banchan were below par in my opinion.  Overall, just an OK meal.  However, when the bill came I was shocked.  Over $100 for that meal?   I paid and left.  The food was just fair, the price was way too much.  Now I know why the place was mostly empty.  I don't know Las Vegas that well, but I'm sure there are other Korean places there that don't charge so much.",f-SfvoAu6vaHqN-6gVc4Uw,1,0,3,05OFltwjd7LVhwc8cZEKxg
