,date,funny,business_id,text,user_id,useful,cool,stars,review_id
3517933,2017-08-16,39,urSuLlkYXXI5uwtKIxl9ew,"Joe Maxx Coffee is not at all near my side of town, but after seeing all of the delicious looking pictures of the pastries here, I had to give the a try. Rishi, one of the really talented bakers here at Joe Maxx Coffee, comes up with some tasty treats. There's a bit of something for everyone including more than one vegan option. I recently arranged a ladies brunch here at Joe Maxx Coffee and they were great about reserving us tables/chairs. I'm not sure however they were prepared to serve our large group even though this was scheduled well in advance and I kept in touch with them as a courtesy so they would know how large my group would be. I was assured the large group would be fine, and all in all it was, but some orders were forgotten and that meant some people had to wait even longer for their food and or drink to be made. Staff was apologetic and I do appreciate the effort made to correct things. 

Joe Mocha Maxx ($5.50 large) The menu says this drink is loaded with chocolate and all the caffeine you'll need. My taste buds were really stretching to find that chocolaty flavor. It was more of just a regular mocha than anything with super chocolate flavor. 

Black and Tan Frappe ($5 large) - Mocha steamed with peanut butter. If you like peanut butter this is the drink for you. It can be made hot or cold. Really delicious peanut butter flavor and something I'd order again. 

Blueberry Cheese Danish ($3) - This is actually what I came here to try and was lucky enough to grab the last one out of the case for the day. You can have the pastries warmed up if you'd prefer. I loved every single bite of this blueberry treat! Definitely worth trying if they aren't sold out already. 

Chocolate Nutella Croissant ($3) Good amount of chocolate inside, flaky and delicious. 

They have a lot of breakfast items, but they do have wraps and some other savory baked treats that are worth checking out.",Fv0e9RIV9jw5TX3ctA1WbA,61,59,4,Mr48HSFH-2JKaRtqY4lzow
3541767,2018-03-20,0,urSuLlkYXXI5uwtKIxl9ew,"I got in and I got out.  I tried the Black and White, which is the vanilla latte with cinnamon.  Not a typical coffee shop that I would lounge around though...not my type of environment.  I think it is a great spot for students.

I like the yelp check in for a free coffee, though I didn't use it.",5wT0vDycEzgq95yVCZ60Aw,0,0,4,Nzcj0fpj16DD8x_ZciOWhw
3586391,2017-03-22,1,urSuLlkYXXI5uwtKIxl9ew,"One of my favorite coffee shops in Vegas.

Joemaxx offers pretty much coffee every type of way you could possibly want it.

My personal favorite is the cold brew, which they have on tap (Nitro Cold Brew)

The service is quick and very informative, and Lee (the manager) is always very helpful and incredibly friendly.

Today I went and tried the Turkey Bacon Pesto wrap.

The wrap had a lot of flavor, and the pesto adde a nice flavor and moisture to what can sometimes be a dry meat (turkey).

Overall, the decor is very homely and modern, with that ever pleasant coffee shop vibe. 

Came here to study once, but I come back for the service and coffee.",wWhllrw0Y_Dl5rHEUDUdww,0,0,5,VhQ_569skfnDd7fF4O144g
3589613,2017-03-18,0,urSuLlkYXXI5uwtKIxl9ew,"Ordered the spiced cider, avocado roll, and chicken roll. Don't be fooled by the fancy names because the avocado and chicken roll are basically the same thing except for the obvious. Lots of spinach in both (too much for my taste). It tastes healthy but don't expect to be happy eating it for anything else. 

The spiced cider has a weird aftertaste and I wouldn't be surprised if the barista poured some cold apple juice and stuck it in the microwave prior to serving as hot cider.

Wish I had just ducked out and got real food somewhere else nearby...",XzVWoqcbzHMBMW04QBYsww,0,0,2,dhCH7xOXPDSahlcmtEbMpw
3629462,2017-02-06,0,urSuLlkYXXI5uwtKIxl9ew,"Joe Maxx is a great Coffee Shop! The coffee is great (especially the hazelnut latte) and they have a pretty good selection of pastries & baked goods! The service is awesome as well! I really loved the atmosphere & layout of the shop. They have some artwork on the walls, that combined with nice furniture, good music & lighting makes it a great place to hangout, especially if you like a mellow place to go read or draw. I'd recommend this shop over any other in town!",mMoeMXoQrAZf_EUFYoF5iw,0,0,5,c52UGs_TKzu0al349TeaIw
3634166,2017-06-22,0,urSuLlkYXXI5uwtKIxl9ew,"The very first visit I had an Iced Chai Latte and it was delicious!! The second time my coffee was comped because I was broke :(. BIG thanks to the girl with red hair!! She was so polite and awesome! The third time I went with my kids through the drive thru and got two apple turnovers which were ok, one cinnamon roll and a Black and White. It was a little to sweet for me then again, I am picky because I am a Barista and like my own drinks usually. The apple turnovers were gas station worthy and the cinnamon roll was wayyyyyy tooo hard! I'm a person with bakery experience and know that when a cinnamon roll is crunchy like a baguette, that its expired and over heated in a microwave. 

I don't want to give up yet on this nearby spot so I will go back soon to see if I can be convinced to make this my new spot. I really hope so.",4ntsF1HirbeqtG8vEiiR9A,0,0,2,N1NQMbAbMUwA_cU3nHfzVQ
3650184,2018-03-25,0,urSuLlkYXXI5uwtKIxl9ew,"I have a new favorite coffee place. I decided to come way out of my way to try this place because I kept seeing their vegan pastries on FB. They did not disappoint! The vegan breakfast pocket is hearty and filling. The cheese tastes ""real"". I'm a black coffee drinker, got the Sumatra and it's excellent. I love the decor and atmosphere too, local art on the walls and decent music playing. Anytime I'm on this side of town I'll be here!",8utnkSN-xcA-UjkPkCGPSA,0,0,5,s1-0VVyYe5Sgxo2cdbGZzw
3822698,2017-05-03,0,urSuLlkYXXI5uwtKIxl9ew,Lavender coffee? YES please! My new favorite! Delightfully delicious :0) Super service!,UqgmkQuYXFrJ--vOgN_IRA,0,0,5,6qmXiS5cTeVwgrQwNQjKLA
3835472,2018-03-30,0,urSuLlkYXXI5uwtKIxl9ew,"I ordered the Joe's Spiked Lemonade, which consisted of lemonade and a shot of espresso. It tastes how it sounds, and I'm not sure if I'm a fan. I'm sure their more traditional coffee selection is a safer bet. The ambiance is nice, and it wasn't busy at all when I went.

They offer free WiFi. Good place to study, but they close early",dtE5sjRYNIUiIiJxHA89Qg,0,0,4,Pig0BYgJxQ2xF93wtIxTbw
3853656,2018-03-29,0,urSuLlkYXXI5uwtKIxl9ew,First time here im always looking for a vegan spot in vegas and they have vegan options!! I got one garden veggie and killed it and ordered another for my boyfriend :) please open a spot up in summerlin.,yMOsJAriXwdz4fF8PKhrew,0,0,5,dDmQWz5p_2MM14ucOwvejQ
3899721,2017-03-29,0,urSuLlkYXXI5uwtKIxl9ew,"Very delicious!! Ordered off yelp for pick up and the Oder was perfectly made. Cold brew coffee and breakfast sandwiches were excellent and my girlfriend and I could personalize ours to what we liked. Great place, I'll be back tomorrow.",6MwMmIYRBjI34UXMCYI7Bg,0,0,5,fc6at3s86d9eXgB3v0LWuw
3993710,2018-01-01,0,urSuLlkYXXI5uwtKIxl9ew,Best Coffee and Breakfast Sandwich in town!!!  Clean and tidy inside.  Great sign. Great drive through!!!  They even support local artists!!!,SqXQ6u0YpymJ8Asqy5NL-w,0,0,5,A4nVd4OJvNPeM36fPh45Ag
3997776,2018-03-17,0,urSuLlkYXXI5uwtKIxl9ew,"I ordered the macchiato with coconut milk and hey, it was way better than Starbucks.  Well balanced coffee and coconut milk, I can tell the coffee itself made it better.  Very friendly staff too! Although I didn't order food, I saw they have some vegan items on the food menu.  I'll definitely come back here!",dBnSGpL2izhZzZzjjhV7tA,0,0,5,emQuapJ29lNBW_LKMsjW5w
4035378,2018-05-08,3,urSuLlkYXXI5uwtKIxl9ew,"While visiting my cardiologist for the first time we were wandering around the complex where the office was located when the coffee sign caught my eye. I was greeted by a wonderful cashier who took my order and answered questions about the Vegan part of there menu. I ended up ordering a 16 oz latte with Carmel that I shared with my son. I decided to have a large iced tea with lavender. While paying for our drinks the cashier asked if we wanted any croissants or bagels. I was hungry so the recommendation of a stuffed bacon croissant sounded great. The blueberry turnover with lavender sauce I needed too. 

As expected the blueberry turnover with lavender sauce was excellent and it was a vegan choice so much better for my health too. The stuffed bacon croissant was a greet way to eat bacon and bread together and was very filling as well. Since I will be visiting the cardiologist once a month or so, this will be my coffee shop.",I-4KVZ9lqHhk8469X9FvhA,6,6,5,8UbGsGrbSK2wVGrqBByPdA
4041045,2016-11-17,0,urSuLlkYXXI5uwtKIxl9ew,"Love this new neighborhood coffee shop. Great coffee, muffins are soft and full of flavor. Let's support local!",nfp4QXnZM4c_HhdYlyuu0w,0,1,5,1SbIxxGQWWP1wPBYLQLQWg
4045180,2017-10-10,1,urSuLlkYXXI5uwtKIxl9ew,"Cool place with a wide variety of delicious options.

The ambiance inside is pretty relaxed with couches and board games and they allow dogs on the patio.

The coffee options were great, and they had an extensive variety of non-coffee options, too, including italian sodas. Most coffee shops don't have soda, so they don't offer them, but it's a treat my girls really enjoy.

The food options were really good, too: healthier stuff like wraps and salads and not-so-healthy stuff like pastries and cookie butter toast. Decent selection of vegan options, too, if you're into that.

Prices are reasonable.

Joe Maxx is definitely on our list for repeat visits when in town.",YIMeEHUYm69m-Mqf-NjPHw,3,1,5,4pBgClKxIR8sF9xV04YYlg
4045993,2017-12-16,0,urSuLlkYXXI5uwtKIxl9ew,I usually come here and just get an iced Americano and it's always delicious and consistent. Today I tried their latte and it was fantastic. It was extremely creamy but still had the strong coffee flavor and it was so yummy. I will definitely be back for more of these. I wish it was in a better location because I know this coffee store would do incredible if it was in a busier area.,dgXhaxgQWMc0aw_k_5zAJg,0,0,5,HHuLsNAE2MQOmxKL47tGJw
4052856,2017-03-24,3,urSuLlkYXXI5uwtKIxl9ew,"24 oz. Cold Brew for $4!  Sold!!

I totally dig Joe Maxx Coffee and here's why...

1.  They serve a smooth and strong cold brew. 24 ounces is only $4
2.  Their chocolate covered coffee beans for $.25 each is addicting.
3.  Joe Maxx Coffee is clean, spacious, and Wi-Fi is available.
4.  They have a drive-thru.
5.  They're open at 6:30 AM.

Joe Maxx Coffee also serves lattes, teas, sandwiches, bagels, and a nitro cold brew.  

That's it! Review done!!",y3FcL4bLy0eLlkb0SDPnBQ,7,7,4,8qZ1Fl67BWApkTovrAkmbw
4064013,2018-06-23,0,urSuLlkYXXI5uwtKIxl9ew,This is actually one coffee shop that I probably should not choose over Starbucks... their specialty isn't coffee,rWIdkbw2y7zR5HwXtJ5KyA,1,0,1,dD-hlP2CnAtBQC7W94LQhA
4088452,2017-11-06,2,urSuLlkYXXI5uwtKIxl9ew,"I used to love this place so much I would go 4x a week but now they have completely went downhill. Multiple times I've gone through their drive thru and literally waited 5 minutes just so no one can answer so I had to pull up to the window and STILL no one was there. Then the new employee comes out ""oh sorry we didn't hear you"" I don't care? You're not doing your job. Second the drinks aren't consistent idk if they have a new barista but my drink is always watered down or has too much milk so I gave up on this place after too many bad experiences over the same things. I really hope they get better employees and make their coffee like they used to.",j8Dts8irvVBwEhEEae_-wA,4,2,1,fMUng8fxfYIAUyKaZK3haA
4118779,2017-12-14,0,urSuLlkYXXI5uwtKIxl9ew,We stopped to pickup some Violife cheese but decided to have lunch as well. We ordered the beyond burger (which comes with kettle chips) and the garden veggie sandwich. Both were out of this world delicious! We also had the strawberry secha tea which was very refreshing. Service was fast and friendly- we'll definitely be back often!,M_s5D3zATfNTpR_T2p7I5g,0,0,5,uKpx2xCf9cGQzutL2MPG7w
4121049,2016-11-26,0,urSuLlkYXXI5uwtKIxl9ew,This place is great! Would definitely recommend. The staff is friendly and the atmosphere is nice and relaxed.,A8S_auHUyvl1HGz9gxnzDg,0,1,5,_Sc9xly9e5rG5xIL4iQyOQ
4123375,2017-08-15,0,urSuLlkYXXI5uwtKIxl9ew,"Made the not so long as I thought trek to try this spot out. I wasn't disappointed!! From the amazing artwork to great service you can't go wrong. I got a vegan blueberry pastry which was flakey and sweet, very much the opposite of what one thinks of with vegan deserts.  I also got a iced coffee which had a nice flavor. I will definitely return!!",2WzeDz2CObN9Xfh67UoftA,0,0,5,UHSBfuWzSkR-R2db8RFViw
4125735,2017-05-30,0,urSuLlkYXXI5uwtKIxl9ew,"I decided I needed to study somewhere other than my house and looked up some coffee shops. I was surprised to find so many in the southwest. This place is right off of windmill so I decided to try it out. 
This place is new with some rad art on the walls(all for sale). They are open until 6:30 everyday and serve little snacks and have an awesome selection of coffee. Lately I have had an obsession with coffee and peanut butter together. I know it sounds strange but it will rock your socks. They sure enough had a drink that fed my obsession, I think it was called Black and Tan, and it was so so good. I got it hot, but you can also get it as an ice blended drink. I highly recommend it.

They played Radiohead style music at a volume that can be overlooked during studying. They also were not too busy so it wasn't distracting. I will most definitely be back and probably with friends!",jP4YUD-fWcf6j4bqZ13ikQ,1,0,5,p42Ptj6FOI7C3qpnSrFNFw
4186549,2017-11-25,0,urSuLlkYXXI5uwtKIxl9ew,"What a great shop. The decor and the atmosphere are both very inviting. We didn't try any of the pastries or muffins today, but they did look great. They even offer a breakfast burrito. Maybe next time! 

I chose the free coffee with Yelp check in. They offered 3 different ones, with a flavored being one. My husband got a hot latte with Carmel and vanilla. 

Both coffees were great. Lots of flavor. Service was friendly as well. Will definitely be back.",bnk8hI3N5tprKm_lMK4I-w,5,1,4,zlsrJuu1wOU8yqz0M0N-hQ
4193969,2018-04-02,0,urSuLlkYXXI5uwtKIxl9ew,Really enjoyed my brunch experience with my family here. The food and drinks were extremely fresh and made to perfection. The service inside and out was welcoming and sincere. I was able to visit twice during my stay in Vegas and it was a definite wonderful treat!,CvDwx5ZXvlJf2pIOS24H7w,0,0,5,IVISTq3WfheK_-ffsWSReQ
4204825,2017-06-24,0,urSuLlkYXXI5uwtKIxl9ew,"Yes it is true Smooth Coffee, Great bagel sandwiches and Great customer service. Very happy I found this place.",yCamAdiSHqi4m6cb3UXFmA,0,0,5,yOzIOwGwWEHj6eI2ZaBFmw
4210224,2018-02-18,0,urSuLlkYXXI5uwtKIxl9ew,The most amazing cold brew ever! I really enjoyed the atmosphere and the artwork. They are all super nice as well as very accommodating when requesting specific coffee items. Plus who else has a stuffed breakfast burrito croissant?,q-1kTJfhMDLx8nxQiplv6w,0,0,5,9y84M8RN3AUD3BxS1lC4Hw
4215294,2018-02-17,5,urSuLlkYXXI5uwtKIxl9ew,"I like to come here after a long day at work burning the midnight oil. This is conveniently near my area, and they open pretty early for people who are natural early birds. Sometimes there would be the typical morning rush but as soon as it starts, its a breeze once it ends. You feel a strange sense of calming here when its quiet. You'll notice a tasteful amount of artwork adorning the walls inspired by The Legend Of Zelda and Star Wars (to name a few) which blended well with the rest of the cozy interior of this cafe.

I ordered the caramel spiced cider in hot with whip cream. An interesting flavor-- you can definitely taste the caramel mixed with strong apple cider so it definitely requires a certain type of person's taste buds to handle it well. 

My friend got the caramel macchiato and was able to finish it with ease. This place is fairly good for relaxing and having small morning conversations as the cafe music echoing in the background isn't so overbearing. You can also make use of your time to study here for whatever reason since I notice people sitting here comfortably with their laptops and tablets.

The baristas are welcoming, informative and convivial when I specifically wanted a non-coffee drink that isn't overly sweet nor bitter. I have yet to try out the majority of their menu (their vegan items have me curious), but lets just say on first impressions they had me sold.

Note that they carry a few off menu items as well -- don't hesitate to ask! I ordered the Earl Grey latte here recently out of curiosity mixed with  craving and it definitely hits the spot with its light lavender undertones and bergamot hitting the senses.",pHk6gWq3gFPNG0smjd9cRQ,6,6,4,7WWmYSvCW5lP_HnzjrgV2A
4235161,2018-03-19,0,urSuLlkYXXI5uwtKIxl9ew,"My 1st time here. It's cute and everyone was super nice. I got the turkey bacon spinach wrap. But it had too much spinach. I also got a black & White, and it was really good.",-CsCHO54CGllgyy1ilrjSQ,1,0,3,czY3IxmHfL0S27EkzX3zeg
4271515,2017-09-27,2,urSuLlkYXXI5uwtKIxl9ew,"Every coffee shop has its own personality. If Joe Maxx were to take one of those Myers-Briggs Type Indicators it would probably be an INTP. The shop is always quiet, brightly lit and has a very open spacious seating area. I don't even think they were playing music when I was there. 
If you're looking for your hipster coffee spot with a lot of personality this probably won't be your favorite joint. If you want a calming atmosphere to chat with friends or to even study this is your spot. The open design makes the voices of those inside echo a little, but nothing bothersome. 
The drinks are good, the food is fine. It was your usual coffee shop pastries. 
Parking is easy with lots of spots. They have huge windows with bar seating up against them if for some reason you want to keep an eye on your car.....",8XKSiMpMxgdwI3qjuqmXFg,2,3,4,jIOPJgat2HZ7_Xhmd5jlyg
4283826,2017-08-22,0,urSuLlkYXXI5uwtKIxl9ew,"This place is soo nice inside. Small little coffe joint tucked off in the corner of windmill and Bermuda. They have some really good coffe and tea choices. Also some good looking wraps and pastries. Saw this place after i took the girls to school and read some good reviews,so i had to try. Well worth it. My iced coffee was delicious!",yH1rIEvxXPb_YCmRQVRdBw,0,0,5,h_e7FaNkv7boOU4zf4MR4A
4285823,2017-01-19,15,urSuLlkYXXI5uwtKIxl9ew,"This neighborhood desperately needed a coffee shop. enter joe maxx coffee. 
This is a full service coffee shop open 7 days a week with plenty of indoor seating in a clean relaxed environment. 
Drive through option. 
They have wifi! 
They serve breakfast sandwiches all day. $4.50. Very fair price. 
Croissants are freshly baked in house. So buttery and flaky. Nom mom! 
Fresh bagels from Brooklyn. 
This place is known for its Black and Tan (Mocha with peanut butter) and The dirty white (vanilla with cinnamon)  it appears, however they have several other syrup flavors you can add to your coffee as well. I am soooo glad there is finally a coffee shop in my neighborhood!",L6nrDwHJDyV0KThjON-Kog,21,19,5,CC_b_2MTHCnTAqXUALksdA
4382403,2017-02-19,4,urSuLlkYXXI5uwtKIxl9ew,"I really liked this new coffee shop! Lucky for me it isn't far from home and it's pretty close to work. 

The location is easy to access from Windmill and there is plenty of parking in front of the building. Parking may not matter since there is a drive-thru as well. That was a nice surprise, but I'm glad I went inside on my first visit. 

The shop is clean with natural colors. In front there is a long counter with stools along the windows. There are several tables and an area with a couch. The décor and style of the shop felt calming. 

I picked this particular coffee shop to try because they had a breakfast menu. For food they offer muffins, cinnamon rolls, bagels, oatmeal, English muffins, and other pastries. There were two types of quiche available too. I thought the breakfast menu was pretty impressive for a coffee spot. I saw that they also had a small list of wraps for lunch. 

The Big Joe Maxx Breakfast Sandwich caught my attention. It was a build your own sandwich with your choice of meat, bread, egg, and cheese. I went for scrambled eggs, bacon, and pepper jack on a croissant. It was very good. It made for a deliciously filling breakfast. I liked how many combinations could be made from the list of options too. 

The drink menu offered some unique options. In addition to all of the regular coffee items they also have signature coffee drinks, smoothies, and some signature iced drinks. I went for an iced almond latte. My coffee was tasty. I'll have to try a simple brewed coffee on my next visit though. 

A great new coffee shop for the area. I'll definitely be back for breakfast and coffee!",3nIuSCZk5f_2WWYMLN7h3w,6,3,4,rOJgpZyUz8vkumMec64pRA
4398841,2017-09-17,0,urSuLlkYXXI5uwtKIxl9ew,"Great little coffee shop on the outskirts of Vegas. We stopped by because I took a Pilates class next door. The ambience was friendly and nice, and the coffee was good. They forgot to make my veggie wrap but were quick to fix it once I asked. Would come back if I were out this way.",CaHNSwDZuBqCVtyKCKKr9Q,0,0,4,Cbx2OwULhLN9nRN11pgYbQ
4421619,2018-04-13,0,urSuLlkYXXI5uwtKIxl9ew,"This is a cute little coffee place in the same plaza as Anytime Fitness on E Windmill Lane. Their coffee is tasty, my favorite is the Nitro Cold Brew and they have many food options (with specialties in Vegan foods). Their wraps, pastries and bagels are all delicious. Would definitely recommend you give it a try if you are in the neighborhood.",A-iq0FLoFkuZ-ZG2P9LlXA,0,0,4,bU81Aknq0byEte3ImkKRbw
4560417,2017-07-04,0,urSuLlkYXXI5uwtKIxl9ew,Coffee was pretty good. Nice place to study or just chill. Wish they would bring in some more comfy furniture though. Customer service was great/friendly staff. Will be back for sure :),8FpOYsX0xvWRlKkl6sKnBA,0,0,5,4MSeBw6gDV83FG80FXKnXw
4591993,2018-03-23,0,urSuLlkYXXI5uwtKIxl9ew,"Joe Maxx is my favorite coffee spot in Las Vegas. Hands down. I've been coming here at least once a week for about a year now and it's always on point. If you're vegan, their options are phenomenal. Their walls are decorated with lots of awesome (local!) art work. The spot is pretty quiet (which I enjoy, because I like my quiet coffee time). The wooden aspects are comfortable. Try the Vegan pockets. They are like little hot pockets of vegan-yumminess! Violife vegan cheese, peppers and ""chkn"" sometimes they have the sausage one. They are warm and flaky and to die for! I always get the dirty iced chai with almond milk. The Caramel Macchiato is also yummy but a tad bit on the sweeter side. Their smoothies are also delish. Try the Joe Berry Smoothie!",eT1fMtFjONhOpB30yfAJeQ,3,2,5,DtStFu-U3u1wAz3lGDo8WA
4610245,2018-07-01,0,urSuLlkYXXI5uwtKIxl9ew,We have been here twice and have been disappointed both times. The first time we ordered a cinnamon roll and they forgot it. The second time we went we told the drive thru worker what we wanted and then get up to the window and within about 5 seconds he already forgot what we ordered and had to ask again. We get our drinks and our frappe is extremely watered down. The ICED americano had no ice and was warm. Then we get the receipt and they decided to double charge us. So watered down drinks for double the price...that's great. I wouldn't recommend this place. Just go to Dutch bros right next to it. Way better and they get the order right and don't water down your drinks to save money.,Uc_n9n_ikrmLdRs5ch8UXw,0,0,1,UxEG8TaxlEqr_NpiF3wb0A
4643688,2017-05-19,0,urSuLlkYXXI5uwtKIxl9ew,"I made sure to get there in plenty of time to make it to work. I don't do drive throughs often.  I like to interaction and to see the store. Especially a new one. 8:45am arrived. Only one in line, a few guests already served and sitting. The cashier, though very nice, tell me it will be a minute. Fine I can use a minute, I'm new here. About 8 minutes later he tells me ""I have a huge order to put in for the Doctor.""  Ok. So just about 15 minutes later ""OK what can I get you?""  I order a drink off the menu and a croissant. Easy!  I sat down. Now others have come in and ordered. They get there croissants, rolls and what ever food they ordered immediately. 9:15 my coffee is on the bar. I ask for my croissant. And please make it to go, because now my extra time to enjoy the coffee was taken up by the waiting for the coffee. Which was just OK!  And the croissant was cool. So, my advice either get more staff, train the barista to know the menu before opening and train the staff to not make ""The Doctor"" who couldn't even come in to place his order no more important  Jan the blue collar worker.  Thanks but no thanks Joe Maxx Coffee Co.  I love to support small local business. But, this one fell short. Hopefully I he Doctor can keep you afloat.",o-v8r8vQMhzGKPOgvCo4nQ,0,0,2,_hspCfCZFLyIx1yluTJvrQ
