,date,funny,business_id,text,user_id,useful,cool,stars,review_id
4658093,2017-02-03,0,urSuLlkYXXI5uwtKIxl9ew,"DELICIOUS coffee (I take mine black), environment and service - gave it a shot based on yelp reviews and found the high marks to be true!   Liked it so much I went back the next day for more and brought my coworker to show him.   Then he told me he went back the next day for more too!  Real good stuff!

There was WiFi, but the password wasn't obvious and I didn't feel like getting up to go ask them for it. 

Wish the clerk recognized me when I went back the next day, but he didn't.  Oh well.  No biggie. 

See you next time Joe Maxx, I'll be back!",c38eXDiRJlS7rf_O-U2HVA,0,0,5,f9TiCVgV4odYGUzti_KlmQ
4670211,2017-03-03,0,urSuLlkYXXI5uwtKIxl9ew,First visit there was a line in the drive thru but that is a good thing! Fast service and very friendly. She even gave me a punch card for future visits which is cool. But yes there many things to choose from and the sandwich which I will try next time sound yummy! Definitely will be back.,fsYWDrNkdJXxSkusduChkw,0,0,5,pJmW7q6LpL2-ZEEEogDnYQ
4699453,2017-09-03,2,urSuLlkYXXI5uwtKIxl9ew,"Cool coffee shop with an interesting background that almost seems legendary. I happen to be in the area looking for a new coffee spot that might have cold brew and luckily they do. They have nitro cold brew on top of that. Great.There were plenty of workers and all were helpful answering my questions about what sweetener and creamers they have. Even informed me that if I added creamer to nitro brew it would curdle, so best to use almond milk instead. Good to know! They only have one size for the nitro brew and it's 16 ounces, which is fine by me. Drink came up fast and it was really smooth. Price was comparable to what I have paid at other places about $4 to $5. There was also some unique artwork on the walls and they were availble for sale. There were some muffins and wraps in a case, so if you needed a quick bite with your drink that would be availble. It looked ok. The condiment section was kinda high up for me, but I managed to reach for some napkins that was placed in the far back if I tip toed. Overall, clean shop, good nitro coffee, and good service. I would come back.",yyDp7MZ2st7p0fOQuFYpcA,8,7,4,ypiDfhs8KOhMI45LRDE2dQ
4751822,2018-01-29,0,urSuLlkYXXI5uwtKIxl9ew,My first time trying Joe Maxx and it was worth it. I ordered a Red Eye and it was strong and had a great flavor. I also tried a veggie quiche. It was quite good and wrapped in puff pastry rather than pie crust. They have many vegan options as well as wraps and sandwiches. The muffins looked real good and I will have to try next time. They have a drive-thru as well. I must say I'm impressed with all the new coffee joints popping up around town that are giving Starbux a run for their money.  They are conveniently open at 6:30 A.M every day!,YV-6sw3s29CPDilatMaT2Q,0,0,5,tn_iBoDo9TsMlRStsTXgrQ
4754078,2018-03-06,0,urSuLlkYXXI5uwtKIxl9ew,"While the chain coffee shops are convenient nothing beats the small coffee shops for good coffee and a relaxing atmosphere. This one is one my way to work and has a drive thru. But I prefer to stop inside to relax with a large ice hazelnut coffee and a breakfast sandwich. You get to build your own with choice of meat , bread, cheese, and scrambled or egg whites.  Getting the croissant is my guilty pleasure.  They have great lunch sandwitches and an amazing quiche too.  Plus pleanty of room to relax, get a little work done outside of the office or catch up with friends.",VXoex0JGPIn-B_qxICOLOA,0,0,5,ISjgRPPlofc23XfusOh_Vg
4777278,2017-09-26,0,urSuLlkYXXI5uwtKIxl9ew,"When i first came here they had some great tea options, im not much of a coffee drinker so tea is my go to. Now they really dont. I am still giving them a great rating because i do really like their chai tea and their breakfast sandwhich options. This place is greatly prized compared to other coffee shops.",C0f9S2Ftf88roFx3qwO2uw,0,0,5,_BBGma4Byt1cNLbkS2RcaQ
4779613,2017-06-19,0,urSuLlkYXXI5uwtKIxl9ew,Found this shop by accident yesterday and had to come back again this morning for breakfast! This is an adorable little coffee shop with super creative drinks. Ordered the Bumblebee and it was 10/10 delish! Glad we stopped in ~,LQb9Lc_osaNtjzr5DCI27Q,1,1,5,p5WZN8XhK2XWnuYbOagUDg
4829370,2017-07-30,0,urSuLlkYXXI5uwtKIxl9ew,"Really great relaxed place. Came to get coffee and wasn't disappointed. 
Wraps are the best part. Lol.",ArHWFOLPtw1oMYSB983LEg,0,0,5,FaIH2yAA72rDUO26MaM5aw
4893729,2017-08-24,0,urSuLlkYXXI5uwtKIxl9ew,"So disappointed in their vegan menu  I ordered the vegan burger and it came with no lettuce, no tomatoes, no onions, etc...please go back to the drawing table or check out other vegan restaurant in the area for some ideas. Not sure how you serve a burger or a sandwich with no side either... no pickle, no potato chips, nothing.",R_1T3a5czSrdXL07A2wzDA,0,0,1,4tVAL08V9pQhXg8PPGtumg
4905738,2017-10-13,0,urSuLlkYXXI5uwtKIxl9ew,First time here and it's by our house which is convenient. Came here on my hubby's bday because he wants to start his day with a vanilla latte and warm cinnamon roll and I had a nonfat cappuccino. We lounged on the comfy sofa and enjoyed the free WiFi. They play great music if you're into alternative. Overall we'll be back. Seems like they have an efficient drive thru too. Check in on yelp to receive your free small coffee.,DaEuyn1GgLeZ3Jn-bcZnvA,0,0,4,s1vWLgqw3GZoMxZQj26HHQ
4979706,2018-03-21,1,urSuLlkYXXI5uwtKIxl9ew,"Yes!!!!  This place is fantastic!!  Its on the other side of town from me so when I knew I would be in the area,  I was so happy to finally try them and now I wish they were in Summerlin!  I live a vegan lifestyle and couldnt wait to try their goodies.  They offer a vegan menu to choose from which looks awesome and they have pastries as well. I grabbed their vegan fajita and cheddar scone which was incredible.  The cheddar scone reminded me of Red Lobster's cheddar biscuits, I wanted more!!

Ok so my coffee order was the Black & Tan. Good Lord have mercy it was unbelievable. It's their peanut butter latte and I substituted coconut milk and was completely blown away! By far one of the best coffees I've ever had.  I dont care or wanna know the calories bc to me it was worth every sip. 

The mgr was the one who assisted me and he was so nice.  We talked about their food and drink options and how they carry Violife vegan cheese.  This cheese is so hard to find and Joe Maxx has an assortment to choose from. 

Check them out!",9UfZhqfDptllFTKgHAhMYQ,0,0,5,1EtN1OQkg9IwFvStGUsr1A
4984034,2017-07-14,0,urSuLlkYXXI5uwtKIxl9ew,"Love this quaint and adorable place!  The decor is warm and inviting and the staff is always very friendly and welcoming. I work next door at Detox Salon so I often stop in for a coffee and a quick bite, but if you have the time I absolutely recommend sitting inside and enjoying the atmosphere. Love that they have Nitro cold brew on tap and tons of healthy menu options for breakfast and lunch. Definitely recommend the Black & Tan if you're feeling indulgent.",x1-gzN7P-vA1-BrpYDFYgg,0,0,5,QBhcZ41WBcm4qAu5P4_0PQ
4993860,2018-02-14,0,urSuLlkYXXI5uwtKIxl9ew,Always a courteous staff. The coffee is consistently delicious. You don't have to wait long and there's a drive through! Support your local businesses!,wJX_T7m_CNZjV-HRxdyb0g,0,0,5,fOP8BL37rK0F5_qxEXyjww
4995775,2017-04-17,0,urSuLlkYXXI5uwtKIxl9ew,"I'm pretty picky about my iced coffee and this place does it right! We grabbed breakfast, the quiche of the day (bacon and cheese) and a breakfast sandwich (bacon egg and cheddar) on a croissant which were served hot and extra delicious! It was a pretty quiet Monday morning. The shop is bright and clean and the customer service was great! There's some art on the walls that you can purchase. We loved the simplistic decor with wooden tables and little succulents everywhere you look. They have a large table for meeting space and a comfy couch to relax in. Or if you're In the mood to sit at high countertops looking out the window, you have that too. I loved how they had the cream/sugar/utensils right next to where you pick up your coffee so you can fix your drink up any way you like!  The pastry case was full of yummy looking baked goods and it was so hard to resist! They also have a lot of grab and go drinks. Definitely will make this one of our normal coffee shop stops!",F7poxH-y8vInyzs2NKBzRw,0,0,5,E3Gw5ZEOinF2XFQD1ZikxA
5019837,2017-04-18,0,urSuLlkYXXI5uwtKIxl9ew,Best tasting coffee in Vegas and the nicest group of people to serve you. The Baristas know their stuff and take the time to listen to you.,6NALefTVb8yR2oNQO8Iv-Q,0,0,5,7CEX-qP9pQb99FkELqAswQ
5030455,2017-06-16,0,urSuLlkYXXI5uwtKIxl9ew,"Great coffee here - a good example of a place run by people who care about the coffee they serve, whether it be drip coffee or a specialty espresso brew.  Breakfast pastries were top notch - special shout out for the breakfast ""burrito"", which is really a stuffed croissant.",1i6KoGjzSkKo4iDZ5LhkEw,0,0,5,ZymO6Zb5GUSA5zlHhohKIQ
5049234,2018-06-27,1,urSuLlkYXXI5uwtKIxl9ew,I love this coffee shop they have a variety of food options and delicious coffee. Every time I come in the staff is so helpful. Both emerald and joey were funny and had amazing hair!,YGYLTP8Hm8SmhXcodJnAhQ,2,1,5,_k89uhoqYssYuxW8dHfZ8Q
5053850,2018-05-14,0,urSuLlkYXXI5uwtKIxl9ew,Ran in here for a quick iced coffee. Helpful barista and plenty of sugar free syrups. I would have liked to see more specialty latte and drinks available on the menu. This establishment has a modern and hipster feel. They also offer an assortment of vegan baked goods.,Aoj5BixQseuKJo__1uY__w,0,0,4,4iP-jRg-M5iFU79eYN15dQ
5080262,2018-05-02,0,urSuLlkYXXI5uwtKIxl9ew,I've been going to this Joe Maxx coffee shop since they opened over a year ago and it's my favorite coffee shop in Vegas.  Iced Dirty chai with coconut milk and extra shot everyday! Their overnight oats are so good and a healthy option.  Love the breakfast burritos and all the pastries as well!  They make me feel like family as well.,-l-p_BN5PTYMgyrOZt7sng,0,0,5,6sosO_sx_d32etbOX4dnUQ
5109857,2017-01-07,2,urSuLlkYXXI5uwtKIxl9ew,"Love this new spot! One of the few places in town that serves a traditional Cuban coffee - espresso whisked with sugar until dissolved - It's a guaranteed pick me up!

Some other note worthy stuff is their Nitro brew and cold brew as well as their other assorted bottled drinks (sweet mama chia, Perrier etc...)

The friendly staff and great coffee are worth checking out If you're in the area!",XnuuGtEl7E8syck0QhjO3w,6,6,4,zmXIWKLRxnyp1gXCpsNfjw
5148641,2018-04-02,0,urSuLlkYXXI5uwtKIxl9ew,"Was in town to visit my son, and being the kind of person who looks up coffee and breakfast places as soon as he gets anywhere, and because this was close by, we came here first. The pastries are vegan- I'm not. That said, they were both fantastic. I had an almond pastry and my wife had a savory scone thing that was fantastic. Cappuccino was spot on- the girl at the coffee machine knows what she's doing.
Really nice people too.",UQpBvCwR_HrFclIfFzMxeA,0,0,5,kFdPTOGHBWGmBQ5lrHO4Bw
5187193,2017-02-23,0,urSuLlkYXXI5uwtKIxl9ew,Been here a few times already. You can tell the baristas definitely know what they're doing and always have great suggestions! My go to is always a good nitro cold brew but lately the iced dirty chai always hits that caffeine spot for me and they make the best one ive ever had here!!,ykUilvBuuNKSPQ2Ff0xTtA,0,1,5,VoDRZWLs1wS06kxkAsND4A
5202285,2017-09-07,0,urSuLlkYXXI5uwtKIxl9ew,"Worst customer service ever. Our favorite thing when it rains is to go get a coffee at a cute little coffee shop. The girl was clearly so put out to be at work. First she doesn't greet us, then I ordered a decaf. She makes a face looks at me and says decaf what??? In a super rude tone. I said a decaf coffee. She says well we don't have any brewed so a decaf latte? I said no thanks I just want black decaf coffee. After an eye roll She then informs me she's gonna have to charge me extra because they don't have any brewed. I say okay that's fine, and in a for here cup please. She gives it to me in a paper cup. I said this was supposed to be a for here cup, can you just pour it in one? She slams it in the trash and tells the guy to start over. Then when it's remade, 15 min later again she puts it on the counter and doesn't even say here is your coffee or anything. I was 1 of 3 people in there. So disappointed. Had such potential and this wasn't my first visit but it will be my last",oqOOEEbKF2AOpslye_9CIQ,3,0,1,Q-V-G7lbInrVY8V4OZBJeg
5220854,2017-03-16,1,urSuLlkYXXI5uwtKIxl9ew,"Came here in the late afternoon to try this place out and walked in to a modern and artsy little coffee shop. The employees were really nice and welcoming. With it being my first time I appreciated the patience and suggestions they provided for me. I ordered two drinks; iced Kiki Aloha and Cookies & Cream blended drink. Both were about $11 with tax and my student discount. I really liked the cookies and cream, the cookie crumbles at the top of the drink makes it stand out. Although I suggest you mix your drink so you could get the cookie crumbles in each sip, I just scooped the cookie crumbles from the top and ate it haha. The Kiki aloha was filled with a lot of flavor changes, first it was caramelly, then you could taste some saltiness, and the after taste would end with coconut. I will be back and start to try every single item on their menu because so far the first two drinks I ordered from here was good and unique!",80qYPp6Fk_jmO3334DKGGg,3,2,5,c2-A0NmtLBHThNEfTizXOA
5277092,2017-11-12,0,urSuLlkYXXI5uwtKIxl9ew,"Poor Customer Service, I came here to order a latte and said what the heck give it a try again. This place has gone down. I'll rather stick with Starbucks. Such poor customer service and quality of work put in the coffee.",LMB_K_XZ8Ym97RsT5t9mdw,1,0,1,CE3F4TYkZgGC3kg8y6TvaA
5279384,2017-04-03,1,urSuLlkYXXI5uwtKIxl9ew,"Items Selected:
Cold Brew on Ice
White & Dirty - Sweet Vanilla Latte steamed with ground Cinnamon
Black & Tan Frappe Sample - Espresso Blend, Ghirardelli Chocolate and Peanut Butter 
Broccoli, Chicken, Egg and Cheese Breakfast Pocket
Lemon Square
Mixed Berry Pie Bar
Blueberry Scone
Chocolate Chip Scone
Nutella Croissant
Nutella Bacon Twist

Although where one lives determines many things, where they come from cannot be changed, and although many may feel that Ohio and the surrounding states are little more than 'fly-over' country The Heart of it All actually contains a lot of passion and the roots of several national brands, the recent expansion of Youngstown's Joe Maxx Coffee Company to Florida and the Southeast Corner of Las Vegas bringing the legend of a World War Two Era Pilot to a city where a good 'cup of Joe' remains scarce in all corners.

Now open for just under five months and slowly spreading the word by way of little more than word of mouth, a location near the original Bachi Burger and daily hours from 6:30am to 6:30pm plus a drive through generating a fair amount of traffic, it was just past 8:00am on Saturday that the front doors of the spacious shop decorated by local artists was entered, the vibe cool and casual with clean lines and a lot of white plus some comfortable looking couches alongside a handful of chairs and tables.

Playing everything from ambient modern rock to classics like My Girl at a low level, the smell of coffee and baked goods hanging in the air, it was after a brief chat about life back in the Midwest with a General Manager from the original store that the Las Vegas expansion was explained by the fact that one of the original investors was based out of Henderson, while the store's good fortune in finding former Mothership Intern Rishi Stocks to reinvent the bakery was described as ""an accident, she found us"" - and that is most certainly a good thing.

Using Beans roasted in nearby Cleveland, several Organic Free-Trade Origins forming blends used to make everything from Drip to Cold Brew and Nitro, plus several Lattes and Frappes, it was with both a Toddy-based pour over on Ice plus the Cinnamon-rich White & Dirty in hand that a table was located, Ms. Stocks and another man bringing out seven of the scratch-baked Pastries with the Manager quick to follow offering a sample of the indulgent Peanut Butter and Dark Chocolate thickened Frozen Black and Tan.

Impressed by the quality of the Cold Brew, a clean blend that starts strong but finishes fruity, while both the Frappe and hot Latte are clearly well thought out despite not being too Espresso-forward, a focus on Pastries made by the self-trained young woman who states that she ""discovered my love for baking a couple years ago"" shows that with enough heart and effort one does not require a degree to make something delicious, the Broccoli, Chicken and Cheese smooth and creamy inside a flaky pastry shell that makes one wonder why there are so many lousy Pot-Pies in Las Vegas when a small Coffee Shop is already making something similar, and better.

Progressing through the selections slowly, a choice to focus on Fruit first leading to bites of a Lemon Bar that is welcomingly sweeter than many, though perhaps not as sour as it *should* be according to purists, Rishi's popular Blueberry-Raspberry Pie Bars made their return to the weekend menu with outstanding results, the juicy berries soaking into a thick crust without rendering it flaccid while the crumble on top was smooth, buttery and mellow.

Happy to see Scones featured at Joe Maxx, the time spent with Beth Ryan-Small in Henderson hopefully paying dividends as the unique collection of flavors at Mothership continues to set a high bar for the rest of Sin City, Rishi's version is scaled down to about half the size and more focused on traditional ingredients without being any less delicious, certainly not the dry versions that require Clotted Cream and Jam over in England, but rather a hefty sort of pasty offered with Blueberries or Chocolate Chips that eats akin to a French Financier.

Acknowledging that things were about to get rich, the use of Nutella rarely subtle, it was with water replacing Coffee that a fork and knife were used to pierce the golden shell forming an arched cavern around a dense center of the Chocolate-Hazelnut Spread, each bite from beginning to end growing a little more filling while the Bacon-layered Twist took very slightly different approach that almost seemed as if it was made of Phyllo Dough, tiny flakes raining down with each bite from the lengthy stick that is equal parts sugary and savory.",U4INQZOPSUaj8hMjLlZ3KA,6,3,4,DVWpKZShUN2P8EmorWO65g
5290884,2017-09-29,0,urSuLlkYXXI5uwtKIxl9ew,"This place is quick and to the point which is what I prefer.  Solid nitro brew. Very good flavor, also used the check in to get a free coffee, asked for it to be iced and solid regular coffee, if you're in the area go here and avoid Starbucks. Get the nitro brew and you won't be disappointed.",9rFhmLItlXwNDWBVQVCx6g,0,0,4,6tdI_i2WK1pyg-OIFktjMg
5311360,2017-08-04,0,urSuLlkYXXI5uwtKIxl9ew,"This place is wonderful! I absolutely love the artwork and casual environment. The place is always neat and clean, and the staff is very helpful! R.C. is an AMAZING baker and always provides delicious vegan options. The coffee is spot on as well! I will be back time and time again.",lRZtDXG4ijBqyIlQAno5cA,0,0,5,3o9c4rxkEfqwCGz_m5EKPg
5318527,2017-03-04,0,urSuLlkYXXI5uwtKIxl9ew,Great pour-over this morning with my bagel. I like the shop too. Barista was very nice and gave me samples of their blueberry brew.,-B4dJE9GEi9TN1W0ARjDzA,0,0,4,dIdCzpC4tXSXtCoUbOVgMQ
5342395,2017-04-24,0,urSuLlkYXXI5uwtKIxl9ew,"Had the white & dirty and it was FANTASTIC. Sweet but not overwhelmingly so, served at the perfect temperature by a genuinely friendly barista. Yep. 5 stars.",ECA59mAiODwEB3MaqU60pw,0,0,5,dfEueU_Fw8uQh2wjHJZ2kQ
5410544,2017-07-12,0,urSuLlkYXXI5uwtKIxl9ew,"such a great find in vegas! a welcoming, homey environment conducive to catching up with friends or studying with a good cup of coffee. customer service was great. baristas were knowledgeable and very helpful to finding the perfect cup of coffee for each of us. the drinks were amazing. definitely coming back again. 5/5 all around.",DpQHI6EIwgUFKG1yUJnTDA,0,0,5,YasxIJK74X1Izzv6DPMFJQ
5448216,2017-12-03,0,urSuLlkYXXI5uwtKIxl9ew,"This was a random pick .. not disappointed . The coffee and juice were good the wrap was better than the breakfast sandwich and the ambiance wasn't bad. I'd recommend for a healthy quick breakfast. 
Wasn't a big fan of their peppermint mocha though , it didn't taste like peppermint to me honestly. It wasn't bad it just didn't have that holiday feel and taste.",_OqvZvVxP0K_aOaukuwTeA,1,0,4,FK-8xY4e_6f3UL7NMJ0eQQ
5459727,2018-02-22,0,urSuLlkYXXI5uwtKIxl9ew,I love this place! Everything I have tried has been on point. Coffee lovers drive past your usually coffee spot and give joe Maxx a shot!,w8Xv5s2t5vG2FhP-Yp3VVQ,0,0,5,fceP3gQLbbphzknCk30vrA
5481787,2017-10-08,0,urSuLlkYXXI5uwtKIxl9ew,"My first go to place when I return from work, life on-the-road. I travel the world for a living, drinking coffee everywhere. Yet, I find the best tasting coffees at Joe Maxx! The hospitality is also appreciated.",LjyTgTwe6BB69_DQEjdjNQ,0,0,5,O6mTb4aC3vJJCk-nTqLnIw
5640213,2018-02-10,0,urSuLlkYXXI5uwtKIxl9ew,Went in and got a Black and Tan (mocha with peanut butter)and it was delicious. Can't wait to go back to try other brews,rtqecF2RWslQyzvcCeom6w,0,0,5,iaHc2C_RIkkOJ6oLAMLDHw
5661353,2017-10-03,0,urSuLlkYXXI5uwtKIxl9ew,"This is one of the best coffee places that I have ever been to. The vibe once you walk in is chill and open. The service is inviting and friendly with a touch of suggestions to guide you in the best beverage or breakfast sandwich. I was in a rush and barely had time to pick up the meal. I left for some minutes and when I came back she had my food coming out and finishing up making my drinks. The breakfast sandwich with those delightful croissant!! So many YUMS!! I had the dirty chai and an aloha latte, both were perfect!!",xzRCl5O2lAhiZ4jq7W4N6w,0,0,5,Fkh-RBmCCtTySTsRF1drBA
5661571,2017-08-30,0,urSuLlkYXXI5uwtKIxl9ew,The coffee was delicious. I enjoyed the pastries I tried and they had a good vegan selection which I will always appreciate. Cute little shop with a great ambiance.,6XfFVNfGdz-m4K9ov9a5oA,0,0,5,FviVRqJUdFhe3AhZ67S7iQ
5708082,2017-03-06,1,urSuLlkYXXI5uwtKIxl9ew,"We stopped by this coffee shop while we were on vacation and it was definitely our favorite. Here's our top 3 reasons:
1. The shop itself - super cute set-up and design with lots of natural lighting making it very bright and welcoming. Also, great use of subway tile! There was a ton of seating mixed with cafe tables, a larger table near the back, and a couch area for lounging. 
2. Customer service - the barista was super helpful and recommended drinks for us. Ended up talking to the owner who was super sweet, helpful, and knowledgeable about his coffee.
3. The coffee itself - I am not a normal coffee drinker, we normally go for my husband whose an addict but we both found a drink we both loved. In fact, we grabbed 3 bags to take back home. 


Definitely would recommend as a great place to stop by, hang out, or even get some work done.",xvtb35uBwzNC8IhKUZctNQ,1,3,5,SoyOAiVu7nQyhPv5k7ii7g
5746108,2016-12-17,0,urSuLlkYXXI5uwtKIxl9ew,"I've only been here twice, but I'm already in love with this place. Their coffees taste amazing and their service is even better. The staff here is all so sweet! The set up is also perfect for studying or meeting up with friends.",rc6rJipexu6vPlhBnx6dxg,0,0,5,WxEOUq2HnZBVXgYdPbnX7Q
5761327,2018-03-10,0,urSuLlkYXXI5uwtKIxl9ew,Beautifully delicious Lavender Latte (almond milk) and Vegan Fajitas Pocket. So happy I finally made it here!,zTZRmaQFRDCOblOEqUswug,0,0,5,cmn1ut4y7sCvCr8iR1UzHw
5769635,2017-12-28,0,urSuLlkYXXI5uwtKIxl9ew,"Tried this place for its vegan options. The dessert was pretty amazing, however I have gone on two separate occasions to try there vegan fajita pockets and both times they were sold out. I went at 9:30am so I guess they sell out quiet early ;(",KzG_6Aq-nz0nwgisf1EdTA,0,0,4,hKLX1prXk1DWxnNPmrx0SQ
5815627,2017-08-01,0,urSuLlkYXXI5uwtKIxl9ew,I love this place. So many great vegan options. Their coffee is really good too! Cute coffee shop with friendly staff. It's nice to have them in the neighborhood.,UGBJ86rBN6RkFaOUd_iN_A,0,0,5,26OdfeeBbwQ9Ki6H29WIMg
5852015,2018-03-25,0,urSuLlkYXXI5uwtKIxl9ew,"We came here on our way out from the strip. After a weekend glitzing on the strip, I wanted to go somewhere less flashy and more intimidate. This place has such cute decor and their staff are sweet and helpful. I believe the art on the walls were by local artists so that was cool to see. It was nice seeing the local side of Vegas away from all the glitz and glamour. The food was great too!",FlBh6GwSb_L7DH-LBUaMJw,0,0,4,Vh2xn_3h2wHgSUrD3ZcwOw
5873245,2018-06-28,0,urSuLlkYXXI5uwtKIxl9ew,"If you're looking for a family owned coffee shop to go to and you're in the area, I definitely wouldn't miss out going to this one. Most of the pastries are vegan and made in store, which I love. The wraps are the size of a Chipotle burrito, and I definitely wasn't expecting that. Efficient and excellent customer service, Emerald and Joey are my favorite employees. They act like everyone there is family and take the time to actually talk to you and get to know you. Did I mention they sell quiche as well? That's another thing that I love. Free wifi and music isn't as loud as Starbucks is.",PFs0_lUg6NlQvwdjnqZhUg,1,0,5,GPbw696nyjqyluiFTsftVA
