,date,funny,business_id,text,user_id,useful,cool,stars,review_id
2123928,2017-03-23,0,urSuLlkYXXI5uwtKIxl9ew,This is by far my favorite coffee shop in vegas. The Black and Tan is incredible! The service is great too! Highly recommended to anyone that is sick of chain coffee that just doesn't meet standards.,KD2eEp71-3_75r3iy2HvCg,0,0,5,6-R41wJ_wWpSYz_n7rskAw
2126501,2017-02-26,0,urSuLlkYXXI5uwtKIxl9ew,Nice little cafe with a tasty breakfast sandwich and free WiFi. There's even a drive-thru option available.,SgMuZsZtBhBD1Hnp9AMk2Q,0,0,5,x9yTY3RgfjN91WWAVoaHrQ
2130455,2018-06-29,0,urSuLlkYXXI5uwtKIxl9ew,This is probably one of my favorite go to places for a quick getaway breakfast while I need to get some work done before a busy day or before work. I do wish there were more vegan options but the vegan options that they do have are so delicious.,jviCbPOvb08T6nZu5R1tkw,0,0,5,cV05GZGN5qDtGC7x5CSrRg
2202367,2017-03-06,0,urSuLlkYXXI5uwtKIxl9ew,Good breakfast. Fast and delicious. Very cute spot to have a coffee date. Staff was friendly.,RKzR_9-Epog7XgKSTFzgAw,0,0,5,n0XAq7AS4GbwxpdqwqBd7w
2212750,2017-01-16,0,urSuLlkYXXI5uwtKIxl9ew,"I love this coffee house! The perfect addition to this part of town. From the decor, free wifi, welcoming friendly employees you feel really welcome here. I'm so glad there's a coffee spot which offers such a variety of creative options for both food & beverage. The biggest issue I've had with Starbucks is they don't offer food items for vegetarians or vegans most of the time and if they do it's not that great. I was super excited when I saw the menu for Joe Maxx. I ordered the veggie quiche & black & tan drink. Amazing!!!! My taste buds went nuts. Full of flavor, awesome ingredients, & a great compliment to one another. Their social media should win an award! The creative photos they post each day grabs my attention & reminds me of why I love this place so much & can't wait to return.",FpgW6vcWa7ouRmuMxjDTvg,1,0,5,819y_wr2gjfOuin6gYU8BA
2302912,2017-01-05,2,urSuLlkYXXI5uwtKIxl9ew,"The Dirty White (or as I like to call it, the white and dirty) is life changing! It really is the most delicious winter drink I have ever tried. It's a sweet vanilla latte with ground cinnamon which is not overpowering at all. Before you run for hills, you should know I am not even a huge cinnamon fan. I don't even love cinnamon rolls! This concoction is just the right mixture of vanilla to cinnamon. Unfortunately for me, I am on a diet and delicious blends like this can't be my go to anymore. 
Exploring other options on the Joe Maxx menu today did not disappoint. I tried a hot rose tea and the smell alone was intoxicating. It is loose leaf and it comes out right away, where they inform you to let it steep (mine was for about four minutes because it was a black tea). The rose taste was subtle which is perfect for my taste. I like this tea on its own I couldn't imagine how amazing it would taste as the base for a latte.  

The ambience is nice. It's a slow and relaxing place where both unwinding and working seem to be live in harmony. I've never seen it packed. As I write this there are four other people here enjoying the brews. The music isn't too loud which I really appreciate. I hate it when stores blast their music. OH! Two more people just walked in. Six customers here now - seven including myself. The wood accents on metal chairs and counters really give it a clean, open, modern feel. 

I'm a fan! I will be back. This hidden gem is so perfect I can hardly believe it is a chain. I'm glad they came over from the east coast and gave Vegas a shot!",JB4_tH5U_oN7Xl3MA4aeHw,10,7,5,KZwnvCFAnARm7YYWM7lqew
2311944,2016-11-27,0,urSuLlkYXXI5uwtKIxl9ew,"This is the new coffee joint in town!  Great friendly staff from Youngstown & Cincinnati Ohio. Love friendly Midwestern people. I had a chai latte.  Some good looking stuff on the menu and definitely in the bakery case!!  
Next trip a black n tan. Give it a try!!",KJ5gfIAWhE-IZ2DEqgS1nQ,1,1,5,WKWlH54ej2s8QOjdpP1r-g
2321203,2018-03-22,0,urSuLlkYXXI5uwtKIxl9ew,"Ordered two lattes and sat down- 15 minutes later still didn't get our order. The two ladies working behind the counter seem disorganized and don't know how to prioritize drive thru and in house customers. After seeing them make food and drinks for customers after us, had to actually go up to the counter again to say something despite there being only 5 people (including the two of us) in the shop. They said they didn't get our order even though they just rang up or order. Didn't even apologize for their mistake and didn't even make the drinks right. Don't come here unless you have all day to wait for your coffee.",T_I8pt-hJy-y4Y1_4hIbyQ,1,0,1,gRBOjkE6X_Gp7bmwHF8viw
2360831,2017-01-17,7,urSuLlkYXXI5uwtKIxl9ew,"A new coffee spot and they're offering a free small coffee with Yelp check-in!? Fine I'll bite. I mean if you're just giving it away and all. Seriously though the people at Joe Maxx Coffee Company make some good drinks. 

On my first visit I literally left double fisting two coffee drinks, I was wired all day. I had the Kiki Aloha which is a salted caramel iced latte with coconut. I couldn't turn that down it had salted caramel and coconut enough said. I'd order it again. I don't remember what the other drink was but it could've been the Jamaican Me Crazy. The name sounds like something I would order.
 
If you're a peanut butter cup fan the Black & Tan is going to be your drink. Hot mocha with peanut butter. Occasionally you're going to have to stir the cup cause it seems like the peanut butter will form at the bottom of the cup. 

The rest of their drinks menu includes a few more hot and cold drinks, even frappes, teas, and smoothies. There's a lot syrups and sauces you can add to your drinks like butter pecan, cinnamon, peppermint paddy, dark chocolate, etc.  Be on the lookout for their seasonal drink. In December they had a variety of peppermint drinks and an eggnog drink. I had the candy cane latte. Right now they have a butterbeer latte, a firecracker spice white mocha, and a few more.

They have a comfy couch don't be surprised if it's already taken when you come in, board games like scrabble and sorry, plenty of seats, and even a drive-thru for those in a hurry which ain't me. I don't even remember when's the last time I've used a drive-thru anywhere.

And so you know I've only used the free small coffee Yelp check-in offer only once. Come on what kind of person do you think I am!? Though I don't think there are any rules about not using them EVER SINGLE TIME. 

I'd be back.",vWP8-aQX0rYJszqkWVL7Ew,14,13,4,l2rEzbqqO09sCFsddwp6hw
2386207,2018-01-09,0,urSuLlkYXXI5uwtKIxl9ew,"Tasty coffee and an awesome staff!

I have been here a couple of times now and have tried something different each time. 


Black & Tan 
Coffee and Lemonade
PB&J Latte 
White & Dirty

All four of them have been delicious! 

This last time I tried their breakfast sandwich, which was delightful as well.",E2BcmK_rIoT4Qsd-o431Vg,1,0,5,xu6W68qGowo4fPItjXVW_A
2388839,2017-01-26,0,urSuLlkYXXI5uwtKIxl9ew,"I am a personal trainer next door at Anytime Fitness and have been waiting a year for this place to open. So far I've had the plain latte, house brew coffee, bacon quiche and The Black & Tan! Lived them all!

The atmosphere has got a nice, quaint ring. I can't help but think New England in the 1930s! Service was great! Employees are very knowledgeable of their craft. 

Definitely recommend!!",q0nrt3fePvXJQFM4ykGYqg,3,1,5,eMkJtKpxEm42s3BQsmOFtA
2394978,2018-04-21,0,urSuLlkYXXI5uwtKIxl9ew,Just moved to a new neighborhood & didn't realize how close I was to joes! I love the Kiki aloha along with the bumble bee coffee. Yum! My only issue is the breakfast sandwiches usually come out slightly over done/burnt. For a healthy snack I recommend the spinach banana wrap.,IskuZyQWNe7DR5eI6QyZKQ,0,0,4,4hgU5_ICsJogJ7oMCOlM3w
2447303,2017-12-04,0,urSuLlkYXXI5uwtKIxl9ew,"Decent cappucino.   Girl taking our order was playing with her fidget spinner and seems anxious for us to order. She brought up a special holiday contest about drinking all the holiday coffee options to be entered in a contest... yet she did not know what the prize was.

Food was very limited in selection and not the freshest.  We got two breakfast sandwiches,  one on a bagel and one on an English muffin.  They needed salt and pepper.  I think the egg patties were heated from frozen.

Decor was pretty nice with decent amount of seating and lots of outlets available.",J6F6DVLHD4WGT5ztMjVg-w,1,0,3,HQ0LmTAoSQlh8-_o4AvhZw
2495848,2017-09-11,0,urSuLlkYXXI5uwtKIxl9ew,"My husband and I went here while we were visiting Las Vegas this past weekend. I ordered the White and Dirty with half the normal shots of vanilla and it was awesome! I don't like overly sweet drinks so getting half the pumps of syrup really helped! We went back the next day and ordered a bacon, egg and cheddar croissant and it was piping hot and super buttery! And was a great price! I also got a regular coffee and it was pretty good as well. Probably should have tried another specialty coffee though! I'll go back next time we come to Vegas!",7UdQsxxQ9LIJ-3BvWzDFfw,0,0,5,lZIIwTCqD7m2IMincRrSfw
2515434,2017-03-01,0,urSuLlkYXXI5uwtKIxl9ew,My boyfriend and I love it here! We always come in for their large amount of sugar free options and the coffee is always delicious! Everyone is friendly and always suggesting new delicious creations!,npkp1t_5fPj67iUCtQ9L9A,0,0,5,XYLrsBBXLmpz9kpnRUBVbw
2523288,2017-10-19,0,urSuLlkYXXI5uwtKIxl9ew,We each had the Spinach Cheese Croissant and one Vanilla Latte and an Americano. We were very pleased with the beverages and croissant. We will definitely be coming back.,A1crxz4I0A2P_gmHJDdYyQ,0,0,5,aHyaxTIzvzOKhnuByZII_A
2571530,2017-06-23,1,urSuLlkYXXI5uwtKIxl9ew,Lavender Chai Tea Latte... yes please. I really love their powder chai tea they have here. It's so much better than the liquid form (like from the box). This place has been my new go to on my lunch breaks when I need a nice pick me up.,hmC6USwaC7o21Hkc7DIa_A,1,1,5,sfgUW91x-r2oXU883Oe7GA
2574549,2016-12-15,0,urSuLlkYXXI5uwtKIxl9ew,"I love Joe Maxx!  The staff is so friendly and welcoming. The coffee and tea flavors are awesome and with a lot of options.  John and Lee are very knowledgeable about coffee and they always have suggestions if you are undecided. My favorite breakfast sandwich is the croissant with egg whites, bacon and american cheese.  Love me some homemade quiche and beignets!!!",jDALUhbZ1-ELhAnbci-nRA,0,0,5,EUklCvjcC6S3SnQv0p7trQ
2587129,2017-04-16,0,urSuLlkYXXI5uwtKIxl9ew,"I had a yummy-ass ""Turkish hazelnut"" latte. It wasn't too sweet or too artificially flavored, everything was delicately balanced & SO GOOD. Seriously worth a try.  Price was good, there's also drive thru! They have alternative ""milk"" options. It made my day! If I could change anything, it would be: a) I wish it was open later (6:30pm in Vegas...plenty of us work nights or want coffee late! And b) Hope there are plans to expand locations, because this location is like 35-40min away from the NW without traffic & I am addicted now.

ETA: We also got the ""cookies & creme"" frappé, which was very sweet & VERY chocolate-y, too much so. It didn't really seem to fit the title, just seemed like straight up chocolate on top of chocolate, no ""creme"" in there.",D9m4JQ7bM-or5sw54L5Dhg,1,0,4,hcREny9yOhsr5O9fmOpaKA
2596532,2018-06-14,0,urSuLlkYXXI5uwtKIxl9ew,"Very clean, great atmosphere, local authors will love it. It has a drive through too. I didn't see it at first. The internet is fast and when you get hungry after working all morning.... lunch is great!",dCb5UED545JNAW37C_I_9g,0,0,5,obyePBFl34K3G1bTB9EWmw
2609090,2017-01-18,0,urSuLlkYXXI5uwtKIxl9ew,"Hidden gem! This place is so delish! Everything is so fresh and clean. Great hangout or study spot, lots of tables and chairs, and they have a drive through! I was impressed of how many sugar free options they have!",-e34AMTGqW1vRWD8VMMAvw,0,0,5,UnO9q68tCy4B4jEZxDyX1Q
2610013,2017-11-10,0,urSuLlkYXXI5uwtKIxl9ew,Delicious vegan burger and coffee. The Violife cheese is amazing. Definitely going back to try the vegan pastries and the Violife cheese,6WUtqoziiC8h5d6LQHd7dg,0,0,5,cKpNwI2g_WXHCG_r7va-VQ
2699664,2016-12-18,0,urSuLlkYXXI5uwtKIxl9ew,"Easy 5 stars. I redeemed the free coffee via Yelp and ordered a plain bagel, sausage, egg and ghost pepper cheese sandwich. The staff offered me two different brews w/ their origin details- I opted for the Tanzanian blend which I added milk and sugar to on my own. The coffee is great. I'm most impressed with the sandwich for its size and price. The bagel is so soft and the cheese has quite a kick. 

The environment gets 5 stars as well. Very spacious and CLEAN. This would be a great place for students to study or for a quick business meeting. The staff seems like people I would become friends with and are certainly knowledgeable about their craft.  

I really hope this new coffee spot makes it for the long run. Please support this local business!",WcHrKAGuewJxxlPqlelN4g,3,2,5,XDQSL0PMIzNM46M38LptzA
2733677,2017-06-18,0,urSuLlkYXXI5uwtKIxl9ew,The most amazing cold brew ever! I really enjoyed the atmosphere and the artwork. They are all super nice as well as very accommodating when requesting specific coffee items. Plus who else has a stuffed breakfast burrito croissant?,Yh6YukzA_wBlH-v7XmPgHA,0,0,5,E1I6W4FU48I91Cqk0u31qw
2751606,2017-01-06,0,urSuLlkYXXI5uwtKIxl9ew,"Loved this place! Very quaint and comfortable ambiance. Staff was super friendly! Stopped here for a late breakfast with my hubby.  We ordered the double chocolate muffin ( has a hint of cinnamon with chunks of chocolate ) and a couple of berry beignets. I ordered a White & Dirty, hubby ordered their Black & Tan. We both really like the Black & Tan, which was a unique blend of mocha and peanut butter ( we are both chocoholics and peanut butter fans!). Wish they had more of these places near home. We will definitely be back! Like tomorrow!",Ta65eX-UuPXOJjOjM0JQvQ,0,0,5,ozTgdU9CtnwTBdVUBMmd8w
2773005,2018-04-30,0,urSuLlkYXXI5uwtKIxl9ew,"If your a coffee snob your going to love this place . I like coffee so I thought heh the coffee is better then Starbucks, but strong. Lol.",Zp2H97YDMZ30o0Lu85NzQg,0,0,5,eWxRZ-cw-NMIjs3cRwassQ
2794153,2017-09-22,0,urSuLlkYXXI5uwtKIxl9ew,"I really really like this place. My old boss and I used to have meetings here. The coffee is great, the staff is truly amazing and the atmosphere is perfect for relaxing. The gm suggested once I try their spiked lemonade. Basically lemonade, espresso and honey I think. At first I was like....dude you're crazy. But he brought us a sample of it and when we tried it I loved it!! Who knew! 
I want to reiterate on how awesome the staff is. I'm not sure where the manager finds such friendly people, but I'm glad he did! It's such a nice change of pace when employees are genuine and pleasant :) 

Raises for everyone! ......Worth a shot;)",cix4P3OBM6NsfmzmzKPcdg,0,0,5,CHoP0q4l-F1XUMqagzJiiw
2806346,2018-05-14,0,urSuLlkYXXI5uwtKIxl9ew,"This place is great - staff is very friendly, customer service here is an absolute blast!",pA5uPH0F32BXOO9hr9ubTA,0,0,5,CfShy8ZI2OfX6UnixAnvSA
2843561,2018-04-05,0,urSuLlkYXXI5uwtKIxl9ew,"There is a reason why people are raving about this place! I stopped here for the first time this week to check out their vegan food and coffee. I had the veggie sandwich: spinach, sun-dried tomatoes, avocado, cucumbers, vegan cream cheese in a bagel-- really tasty! The vegan cream cheese was delicious and didn't taste like a substitute. I had a caramel, coconut flavored iced latte (I forgot the name of the drink) with soy milk and it was sooooo good! I was expecting it to taste too sweet, but it had a nice balance. The coffee tasted smooth, similar to the blonde espresso at Starbucks but better. 

Excellent customer service! The man who helped me was friendly and he made my drink in less than 2 minutes. I can't wait to go back. I wished I lived closer! 

Give this place a try :)",4bVNmQHJWQlWfGOWL_lYOA,0,0,5,5pR_zKGxNZbAy5T2TM5Few
2867115,2018-03-30,0,urSuLlkYXXI5uwtKIxl9ew,"First time here and I ordered a croissant and Joe's Spiked Lemonade. It is right next to a rolling ice cream place, inside of a plaza. I was given the option if I wanted the croissant to be warmed up, and of course I said yes! 

Next time I come here though, I will probably try a new drink. Lemonade and a shot of espresso is literally what Joe's Spiked Lemonade is, and I'm not sure if I'm honestly a fan. 

The interior decor is nice. There is a black couch to lounge on and several tables, along with some board games that you can play with. It's a nice spot to study and or do work in the morning or during lunch, cause they close at 5.",1iBkIyXBHhUd_4TAzXr--Q,0,1,4,L0oOQ0REMLLDrH6MW0DYxA
2921502,2016-12-23,0,urSuLlkYXXI5uwtKIxl9ew,Giving this place a little shout for out-of-towners too. We stopped here twice on the way out of Vegas to Hoover Dam and the Grand Canyon and the food was AFFORDABLE & delicious and the coffee is on point. Staff is super friendly too. Highly recommend!,ghgPkJSCgspd1Ea9iPY-FQ,0,0,5,IDG3FD-Zq_gyMkre2FIq_w
2946075,2018-04-06,0,urSuLlkYXXI5uwtKIxl9ew,Stopped in to just get coffee n iced tea n came out with delicious strawberry lemonade n pistachio matcha latte blended. Wonderful customer service love her recommendations. Will have to come back n try the food too. Menu was very tempting. Friendly clean n not outrageously priced. Will be back : ),dN1u6MDkD6nov44bxB7_2g,1,0,5,dOfbfWbUoxzjLOvoC-FNrA
2955045,2018-02-17,0,urSuLlkYXXI5uwtKIxl9ew,"Outshines Starbucks. Stronger coffee but not lacking on taste. They show local art, better prices and a slower more comfortable pace. Quiet lots of sitting.",5ceyPTF_m7o4cDgxhFhAcQ,0,0,5,PReDHwWUlHGrx2aA8hodEg
2970745,2016-12-08,25,urSuLlkYXXI5uwtKIxl9ew,"Did someone throw water on the Vegas coffee scene? Because like the Gremlins, they're multiplying as staggering numbers. 

Joe Maxx Coffee is a great coffee spot for getting some work done, lounging with friends, or just flying solo and sipping on a Cubano style coffee. Yeah, this is one of the few places in the valley that serves a Cubano, and it's pure percolating perfection! They make it in the traditional style with sugar, two shots of espresso, stirring wildly until the everything mixes. 

They also offer a ton of other coffee drinks for every taste, cold brew, drip coffee and signature drinks as well like the Joe Mocha Maxx, Dirty White, and a Kiki Aloha; seriously there is a multitude of drinks brewing over here. Getting hungry? The deli case is packed with wraps, baked goodies, and if you plan on being there for a while the Wifi is great! The last few times I've been here the nitro brew was not working, it was fixed on my most recent trip, but I've grown to enjoy the Cubano... maybe too much. 

The crew that works here has a great knowledge of coffee and are happy to answer any questions you may have. Need a boost? Joe Maxx has your back!",i_DR3vdE73nVm2GlMbGpGA,32,31,4,Tm3n7qYl7xOfkfa91zCw6A
2971128,2018-04-11,0,urSuLlkYXXI5uwtKIxl9ew,Stopped by on our road trip and Emerald and Tessa hooked us up with an awesome snootiness and breakfast! Great and friendly staff,yeR5SC_MLorfAMnSrm3TOw,0,0,5,5NoMja_GKEd-DPJF3cs3ew
2999421,2017-08-04,0,urSuLlkYXXI5uwtKIxl9ew,This place is super cozy and posh! It's hipster minus pretentiousness! The coffee is gooooood and strong! The space is good sized with lots of seating. Even has drive thru! Kind of am in love. The staff is super nice and you know I love a woman with tats.,xF7Ugkw7NV8U12Uf6dj8pw,0,0,5,R4ZMKXLyeqQZvttXgdal8Q
3076999,2017-05-08,0,urSuLlkYXXI5uwtKIxl9ew,"I ordered an Iced coffee with caramel syrup. I liked my drunk. I thought the barista was extremely nice and helpful. The cafe itself is cute and relaxing. There's some really nice art on the walls. Not a huge fan of the music they play here.

Found out they charged me $20 for my drink. Pay in cash.",yuGgUsSygLkxS_USiACvHA,0,0,1,kQYdvW6C-BGEjXz-3yOZaA
3088215,2017-02-04,0,urSuLlkYXXI5uwtKIxl9ew,Loved this new coffee spot! I had the white and dirty. It was delish! It's a sweet vanilla latte with ground cinnamon. I also had the blueberry bar which was also amazing. My mom had the Cubano Coffee which I liked as well. Nice to see a coffee shop that even offers this. I mean come on there's nothing like Cuban coffee:). They have a good selection of coffees and small bites. The hummus wrap looked good so I'll probably try that soon. I'm glad to see small coffee spots opening up in Vegas. I usually drink Starbucks but I'm kinda over it. Very over rated! The also have a drive thru which is very convenient when you just wanna get coffee in your PJ's haha.,nUcQM8aXckWq0WraI2_3kA,0,0,5,p1OPTA7WtJZql_hwWgY4qA
3241955,2017-07-29,17,urSuLlkYXXI5uwtKIxl9ew,"It was a bit of a journey for me to get here.  Almost felt like I was driving in the same odd squares.  Well a one year resident of LV can't claim they know how to get everywhere.  But I found the place and made it!  

Was happy to see friends again that I had made last year!  Some I hadn't SEEN since last year omg.  A very enjoyable time - quality time especially.  And to learn how in just a year, a handful of us friends had some life changing experiences.  

Thanks for Joe Maxx to accommodate our girly gathering for caffeine and little grub.  Super cool of Joe Maxx to honor a coffee delivery pilot; different and meaningful purpose.  Love that they also allow local artists to display their art for sale along their walls.  This community outreach and welcoming effort in one place - some kinda awesome.",JQIZhoQB-Tg9hdBEj90m4g,32,31,4,9yFQEQHCF8KdYsvNQLYgEA
3344128,2017-04-18,0,urSuLlkYXXI5uwtKIxl9ew,Our favorite spot for coffee. The staff is friendly the drinks are delicious. Coffee just doesn't taste the same anywhere else's.,yJVM1Io2nS2g0S4geq1YCA,0,0,5,5z0s2ITKA6SgXMI85zEK5g
3423116,2017-04-13,0,urSuLlkYXXI5uwtKIxl9ew,"Where's the umph!  When I order an expresso drink, latte or cappuccino, especially at a local grind, I want some coffee flavor. Mind you the coffee was ok, just not rich and smooth and strong w/o the bitter edges. Funny how my partner also ordered a blended chai and she said the same thing. I tasted it; tasted like milk, ice, with a faint spice (and I mean faint) hint in the background. If I lived here, I'd either ask for extra shots of expresso or drive on by. I do hope the owners read this cause they were extremely sweet. Very personable. On an added note: we were new and could not locate the cream, sweeteners, straws or napkins. They were up on the counter around the back corner in an unobtrusive spot. Not on a table where it could be spotted. Nobody said a thing about where to find them. In fact, they handed my partner her chai latte w/o a straw and we finally asked. Frustrating. Just wanted to sit down to a hot bold cup of Jo. It was weak and I used my own sweetener.",1viszljzsa8W7VnYPuWosw,0,0,3,6tEqQurnVQS6hcMBRwL36Q
3432383,2018-06-11,1,urSuLlkYXXI5uwtKIxl9ew,"I love this place! 

Great VEGAN menu for a coffee shop. For a sweet tooth I particularly like the Cookiebutter Toast. They also have a very tasty Beyond Burger if you are hungry for something more substantial. Their frappés are the best I ever had. They aren't a block of slushy ice that requires constant stirring like other places (cough, cough, $tarbuck$). They carry a great selection if Violife cheeses , too! 

The ambiance is chill, clean, and pleasant. They have local art on the wall and a nice selection of music playing. 

Customer service is great. They are always kind! 
Another plus - drive thru!",fRXFVBRKn9Ma9VWuU7-0uA,1,1,5,lVgHpnjDI5Q7lGp0UzjZTA
3439591,2017-02-06,0,urSuLlkYXXI5uwtKIxl9ew,A real coffee shop vibe.  Nice place to hang out and work or read.  Most important really good coffee.  Really happy to have something like this in the neighborhood.,rGD6mnPFafUY1PARadA9pA,0,0,5,OeRkpCSNa7kZMIRzvaZFgg
3450547,2018-06-16,0,urSuLlkYXXI5uwtKIxl9ew,Great place to stop by for a cup of coffee and a delicious hot breakfast pastry. Warm friendly staff.,t9zOybxIAL6AF4CjezzTFg,0,0,5,YkDN1iFargcYM1Si8PQypA
3477293,2018-05-02,0,urSuLlkYXXI5uwtKIxl9ew,"Decided to come here late one morning to get some caffeine & a snack. I got a very tasty bacon egg & cheese croissant sandwich. It was so hot & flaky, & the perfect size. Also a great iced coffee with a little marshmallow syrup flavoring. My boyfriend got a blueberry bagel that was really good. Located in one of my favorite plaza close to where I live. I will definitely be back, especially for my free small coffee",ijmrtNxdVCLiorLnJzPojQ,0,0,5,lp3f86iLVE32yQlU2S1ADQ
3517349,2017-08-28,1,urSuLlkYXXI5uwtKIxl9ew,"This chain coffee shop from the midwest is open in southeast Vegas. The minimal, modern interior, full of art from local artists, is home to quality coffee drinks, pastries made in-house, breakfast sandwiches, and wraps. 

Specialty drinks are great options to get, like the black and tan (rich mocha steamed with creamy peanut butter) or Kiki aloha (salted caramel iced latte with a coconut kick). I don't like milk and only drink almond milk when I have to, so I love that they have coconut milk as an alternative.

What separates this coffee shop from most others around town is their pastry program. Made in-house, their options are plentiful with quite a few vegan items, too. But, if they offer to heat up something for you, just say no. I made the mistake of saying yes and they microwaved my nutella croissant, rendering it a soggy, limp mess.",C2C0GPKvzWWnP57Os9eQ0w,7,7,4,vJaqT4U6yXM6uk3p01hqqg
