,date,funny,business_id,text,user_id,useful,cool,stars,review_id
1789910,2017-02-11,5,y3EkxHO-qPODtzs_D6E7Rw,"Pearl Ocean is the dim sum restaurant located on the second floor of Lucky Dragon Casino.  Like the main casino, its a gorgeous restaurant that's very artsy.  Dim sum is order-by-menu and its helpful that there are plenty of photos, clear description of the dish size, and a pricing guide for each dish size.  They charge $2/pp for choice of regular teas, or you can fork out some more dough for premium tea by the pot.

Overall, its a solid place to get dim sum on the Strip.  Pricey, but lower than what you would find at Bellagio and somewhat more convenient than going to Rio.  No where near the quality of Bay Area, Seattle, or LA, but decent.  Favorite items were:

* Five Guys Xiao Long Bao: each color has a skin made using different ingredient.  Green for kale, Black for squid ink, etc.  The regular pork Xiao Long Bao were decent too.
*Staples like Har Gow and Pork and Shrimp Shu Mai were solid, as was sticky chicken rice.
*Spicy Wontons were nice - more sweeter than spicy with a gentle kick.  Packed with lots of shrimp!

Some shortcomings
* Beef Chow Fun a bit oily, and had way more beef than noodles.  Its better than the reverse situation but still the dish seemed unbalanced.
* Pork Spare Ribs in Black Bean had good flavor but the meat was tougher than expected. 

Overall, not bad.  Lunch for six people about $200 including tip and tax.",VHjR5F6mdnLrQcCb0nqCYg,9,5,3,LVbY4mVV47mYJM4KpOJnmQ
1837926,2017-06-14,0,y3EkxHO-qPODtzs_D6E7Rw,"Great Service and atmosphere. Marissa and Tony are the best!!!! Food here is amazing. If ever in need for great dim sum, please come here. Food service and atmosphere is just the best. Thank you Tony and Marissa again for making us real happy!! Definitely coming back here!!!! A+++++++",xUYEb_dfibv7p5BP3shfng,1,0,5,VC6HO11p-vtzVXCcGbqBAA
1846001,2017-07-29,0,y3EkxHO-qPODtzs_D6E7Rw,"We really enjoyed our dinner at Pearl Ocean. Had two young ones with who had a hard time with the menu, but we're we ignored their pain, promised them pizza back at the room and they remained quiet while we enjoyed pot stickers, BBQ  sweet buns, fried rice, vinegar ribs and honey walnut shrimp. Fantastic flavors, perfectly cooked items, attentive service. What more can you ask for. As a non-Asian, I cannot vouch for  authenticity. However, the lack of things like heavily breaded sweet and sour mystery meat on the menu and the fact that we were the only Caucasians  in the place, might indicate they cook for their pleasure. Highly recommended.",rbpiwPAzC-wpY3fCH3yjWg,0,0,5,_skswY9pUIg0UyOi6e7Yug
1885579,2017-01-31,0,y3EkxHO-qPODtzs_D6E7Rw,"Good food, great service,  not so great price :) but what do you expect when you are in Vegas inside the casino. 
We came here for dim sum and it was delicious. We order about 5 dishes and the bill was $70 and we usually paid $70 for a whole family with 15 dishes .. 
We liked it so we came back for dinner and it was quite expensive as well but servers were very tentative ,Always came by to check on our tea, etc....
I enjoyed it. Gave it a 4 stars because it's a bit pricey for my taste .",dwCLkJrxOm2tv5nwOEq9jg,0,1,4,Mq7dkZuasSTiOMdXoiv5HA
1927764,2017-10-08,0,y3EkxHO-qPODtzs_D6E7Rw,"Food still so so.Not good yet.Now a day las vegas slow season.mass shooting last week.
Whole gambling floor.just 3 gamblers.restaurant is 1/3 full on sunday.
Service is improve.food is so so.",XNx-zJzcdfxZHcStYcruQQ,0,0,3,KHspROLQ9jDxTR9fakwMDg
1935616,2017-09-07,0,y3EkxHO-qPODtzs_D6E7Rw,"Because we were so pleased with the dinner a few weeks ago, we decided to try them for Dim Sum. Boy, were we disappointed. 

The pricing on dim sum is outrageously expensive. Food is terrible, full of lard and MSG. Chicken Paw was a frozen dish regurgitated - fridge odor was present.

We had the following:

Steam Pork Bun - B+ 
Baked Pork Bun - D.  Good flavor, full of lard though.
Shrimp Har Gow - D. Have never seen Har Gow that huge. Some pork fat was in the Har Gow.
Chicken Paw - F.
Bean Curd Wrap - C. MSG laden. 
XO Daikon Cake - C. 
XO Rice Roll - C.

In addition, they charge Hot Sauce and Soy Sauce at $7+  each.

With tea at $2 a person, and the charge on the condiments, total bill came up to over $60 without sales tax and gratuities. Even with a 25% discount for local residents, it is close to $60 for 2 of us.  With the food quality the way it is, definitely not worth the experience. 

We went there on a Wednesday afternoon at 12.45 pm. Were we surprised that the whole restaurant has only 2 other tables. Lots of waiter and waitresses running around though. This place cannot be in business long.",35sxzW8p-FGCN4_XB78FCQ,0,0,1,1AKczxzehhDy-NwoGr-RFA
2032743,2017-06-18,1,y3EkxHO-qPODtzs_D6E7Rw,"Date & Time:  Friday June 17, 2017 @ 3pm
Location:  Lucky Dragon
Dining Companion:  The Husband
Scene:  Couples & Groups of Asians in Crop Tops, Cut-Offs & Slides
Decor:  Contemporary w/ an Asian Flair.  Cozy Teal Booths & Redwood Tables
Service:  Personable, Quick, Efficient.  5 Stars
Devour:  Choice of 5 Piece Dim Sum for $10 Per Person.  Dumplings are Excellent
Mediocre:  Baos
Total:  $21.68",7BOLcPyH4YmXGKm4sWaYKA,3,1,4,8aAy5K1X54RivAHT5Bp1UA
2113680,2017-12-06,0,y3EkxHO-qPODtzs_D6E7Rw,"We enjoyed Dim Sum here recently with friends who are regulars. Everything was quite good, the ambiance was a little sterile and unwelcoming, but I think that is the case at most dim sum places. I did like that they bring you the dishes as you order them, rather than wheeling a cart around. We LOVED the steamed pork buns!",VUk3lcb1RzT5QrM6sXtfyw,0,0,4,3thUjZHsZvkQPjXS9-6POA
2136341,2017-03-21,1,y3EkxHO-qPODtzs_D6E7Rw,"Stumbled across this restaurant and I'm glad I ate here. We mainly came here for dim sum and they have large variety for it. First off, their egg tart is to die for!!! Must get the egg tart when you're here. All of their dim sum dishes are very good. Everything tasted so different and knew. The taro bread is very delicious! I would definitely be back!! Dishes range from 4-10 dollars. Its more on the expensive side but worth it. Service was great, they are very fast at cleaning out your table as you eat. I would recommend this place to anyone.",5G7dOTrKQrbyFG8fpBnx7g,4,1,4,xDrIFRO_jsnEw2qFWvYYkw
2164039,2017-04-09,2,y3EkxHO-qPODtzs_D6E7Rw,"Oh my god, this is the slowest dim sum in the history of the universe. Got here at 1:15pm on a Sunday and it's 2:40pm and we still haven't gotten everything we ordered, not to mention the fact that we had to ask our waiter 3 or 4 times for things like tea refills, extra napkins and soy sauce.

Look, don't get me wrong, the food is actually quite good (hence the 2 stars instead of 1), but it is not even REMOTELY worth the wait or the poor service.

Save yourself the headache and get a much, much, MUCH quicker bite downstairs at Bao Now, or honestly, just save that dim sum craving for another time.

UPDATE: It's 2:50 and they just told us they're out of something we ordered OVER AN HOUR AGO. Downgraded to 1 star because this place is a joke.",rfcGYSpwJAUU0Y2352jp_g,1,0,1,5HSUy3TaYQSnpJVA5-SFMA
2221061,2017-01-20,0,y3EkxHO-qPODtzs_D6E7Rw,Waited for an hour for the food and turned out they lost the orders. Didn't even border to ask the entire time that we were there! Won't ever come back!,NmToi-xyH9XIOGrqPLohiw,0,0,1,bQNy90wZ_h7pSTQ0f4m-CQ
2238206,2017-01-20,1,y3EkxHO-qPODtzs_D6E7Rw,"We stopped in on a Wednesday evening to try them out for dinner. I had made a 7pm reservation, but it turned out to be unnecessary. There were only a few other customers dining there.

The decor is very nice and the service is friendly. I imagine it might have been because it was quite slow. But still, very good service.

The food was surprising in a few ways. Some of it was grossly overpriced. But some of the dishes were close to reasonably priced and were very tasty. Definitely above average in quality.

We tried their dumplings, salty fish fried rice, a seafood casserole, mango pudding and Portuguese egg tarts. It was a delicious meal.

We will probably go back and try out some of their other dishes.",TprC8sujz8MkwuomrqUSiw,2,1,4,nmkAw1XobaEk0UvVcZyTyg
2276922,2017-05-04,3,y3EkxHO-qPODtzs_D6E7Rw,"Never been much of a dim sum person in general. Gosh it been years the last time went to one forgot the whole concept. Pearl Ocean it definitely brought back found memories of dim sum! 

Pearl Ocean located in the Lucky Dragon. Second reason came for dim sum never been to Lucky Dragon so got to walk about small property for the first time. Pearl Ocean located on the  second floor. I meet up with friends visiting right when they open at 11am. I was surprise but there was another group that was waiting before the doors open. It got me excited thinking that good sign people line up before the place even opens?? lol. The restaurant interior is really cool. It has lot of personality and kind of big circle open area dining area and all along the outside have booths. The artwork on the walls look all original and pretty cool designs, Very open relax vibe with the high ceilings in the restaurant. 

The food there was three of us. We did decent job of taking down small part of good size menu. Think in all ordered something like eight to 10 dishes all together. So rather then  write them all out. I just tell you the ones that stood for me. The Dumpling section was one of my favorites. Two dishes ordered the squid ink and shrimp xo dumplings that out of control tasty. The squid ink love the color! The fillings in both were solid. The short ribs were good but not person like work for the food. Just me. The noodles dishes were also stand out section. The pan fried noodle with seafood could have had whole plate and be in noodle heaven. It nice hearty with lots of different seafood and nice assortment of vegetables. The thing about the noodle dishes feel like more like normal size then dim sum size. It also reflected in the price just fyi. The boiled beef with enoki mushrooms had no expectations. It ended up being solid choice. It extremely light because the mushrooms and sprouts are the carbs so to speak. It was really refreshing and good one throw in the mix. The dessert section was da bomb!! Make sure you have room and just order it once your done instead of it coming with everything else. We got the sesame seed balls, and mango pudding. Both of them could have had whole portion to myself. The sesame balls talk about #tbt remember growing up in Hawaii going eat at the food court at ala moana and getting the sesame balls. Perfect dessert treat. It just like andagi. It fried donut with outside rolled in sesame seeds and the inside the filling devine and moist. The Mango Pudding is nice creamy and nice balance of Mango and something else. The color is perfect!!! I know missing couple entree but once started coming out lose track...hell dim sum once comes never stops.

One thing that made this dim sum experience no doubt stand out or the lack of dim sum gone to in life. I have always experience traditional with multiple carts that go around and pick the food. Rather enjoy looking at the menu (most part picture of all the items, like list the items by sections, and list prices although some market price so check) then mark stuff on the list and the waiter or waitress checks it off as it comes. Your more then welcome add stuff as you go along. More like normal restaurant comes out then look at the carts and thinking how long that batch been in the cart. 

The service for us nothing but five stars.  The waiter was on it the whole time. He helped us make great selections since it was all of our first time. One thing needs shout out yelp community. My friends reading helpful review mention that local get 20% discount. Mahalos. We asked the waiter and he like for sure just showed him my nevada driver license (just need one id for the bill). He also mention that if have Lucky Dragon players club card get additional 5% off the bill. So we went downstairs all got one. Next go around 25% off the bill. Really not think of dim sum or many restaurants get that kind of discount. It helps cause dim sum might think cheap but the more plates get it adds up REAL quick. 

No doubt plan on coming back again.....!!!!",iSC96O2NjQc3JExGUHQG0Q,8,5,4,kZ1gHVNqqt6Y7St9pqZWlw
2285383,2017-10-14,0,y3EkxHO-qPODtzs_D6E7Rw,"Aunties all the way back in YEG had one recommendation and of all cuisines they recommended a Chinese Restaurant. Count on the older Asian generations to fish out home food wherever they travel. Not like I wasn't missing my white rice anyway, no complaints if bbq duck is on the menu either. Thursday night in Vegas for dinner on the strip is bumpin, Thursday night at Lucky Dragon isn't as rowdy. Hotel was out of the way and empty. It is a newer hotel but it's a sketchier part off the strip. Casino downstairs had more employees than guests, and inside the restaurant had 5 other tables aside from us. Just a lot of employees standing around watching everyone.  

Service was okay, he was friendly, but not really knowledgeable about the menu. We asked for recommendations and what were some popular items on the menu. Aside from being flustered with the question, he directed us back to the menu with ""well they are all pretty popular.."" Oh, yeah? How helpful that was. 

Crab Meat Fish Maw Chowder - ($22) - This was yummy! But no matter where I go I always douse my bowl of soup with a ton of white pepper so my review on this is not going to be pretty helpful to those who take it pure. 
Half Roasted Duck - ($25) - Skin on the roasted duck was surprisingly really good, crispy layer that gave a good crunch and the fattier pieces on the dark meat had an immense amount of 
Steak Cubes in Wine Wasabi Aioli - ($28) - This cubed beef dish has similar flavoring as the viet shaking beef dish. Nice savory salty flavoring and presentation was unique with the nest. The wasabi aioli was unnecessary, I didn't like the mint like aftertaste that masked the beef flavor. 
Pea Shoots with Bean Curd Skin in Fish Broth - ($25) - soooooo expensive for the sad amount of veggies in this dish. 

The hotel overall looks nice, the dining room space is huge and there are a ton of tables. Food was also good, prices aren't worth it though. Wouldn't detour to give this place a try if you're on the strip. I'm sure there's better Chinese restaurants with a better bang for your buck. Will not be recommending this place.",-9QrNxZ0l0cSbTYXPlsu_g,3,0,3,nx4cVLhuWO1ry0MRxySC7w
2293710,2017-01-11,13,y3EkxHO-qPODtzs_D6E7Rw,"Found this dim sum spot while browsing on my lovely Yelp app. Decided to finally give it a try, considering I've never been to the new Lucky Dragon Casino. Located on the second floor, close to the upstairs bar. Cute little place.

Upon walking in, the lady in the entrance seated us right away. Although the hostess wasn't very welcoming. Didn't even smile at us, doesn't hurt to smile once in a while ;)

Ordered a few things, started off with the beef chow fun, and the shrimp with walnuts. That was super delish! The shrimp was huge!! But it only came with about 5 pieces of shrimp. Which wasn't bad. Ordered a few more things which included the beef enoki with bean sprouts, shrimp shumai dumplings, beef shumai, and the yummy juicy pork dumplings! Those 3 things were the highlight of our visit here! It was supppppper yums! If we could order this and only this, we would be perfectly okay with that! Then got the Mongolian beef bun. That was just okay.

Ended our meal with the sugar puff and taro puff. Taro puff was bleh......wasn't the best, but the sugar puff was everything! I would come back just for this.

Overall experience: 9/10. Our waiter, John, was super helpful in suggesting what he thought we'd like and the ladies bringing out our food were all so kind, teaching my boyfriend how to eat dim sum because he's never had it before. 

Only downside I did not like was the pricing. It was just a bit too pricey for my liking, but it was definitely a pretty restaurant. Would come back for more though, that's for sure!",Hj5TpJNOXqNt62Gbpr5WYw,28,24,4,S17MdduzX3gexitp1ATz9Q
2333118,2017-11-23,1,y3EkxHO-qPODtzs_D6E7Rw,"The food is good, but on the pricier side for Chinese food. Everything is a la carte including tea. Peking duck was mostly skin not that much meat but it was good. Convenient from where we were staying.",xuxDaz3ptwwAcV5nxnESqA,0,0,4,qBEeZ91qiUWJMN67Z31aXw
2366375,2017-04-01,0,y3EkxHO-qPODtzs_D6E7Rw,"Did not like the food at all the waiter was kind but unable to suggest a different plate from what I've ordered which was chopped steak and veggies, the meat was really gummy.",_M2YbmVRn21IzTDBJGX8Ng,0,0,1,pdzHSTkl28gRXePjEPo8KQ
2437786,2016-12-28,0,y3EkxHO-qPODtzs_D6E7Rw,"dim sum was really GOOD! 
but the hostess was really BAD! she can't even say hello or even smile at all.",iepzlvBV4cSScD5JGO9irg,0,0,4,MdPmrYHMfevDHcSIF8htSQ
2583798,2017-07-09,0,y3EkxHO-qPODtzs_D6E7Rw,"A disappointing place for dim sum. I've had this place recommended to me by a family member, and was looking forward to the five guys xiao long bao dish that's been raved about on Yelp.  Although it was on the dinner menu, they didn't have that or any xiao long bao (along with about 5 other items).  It's their signature dish, even pictured outside of the restaurant....but I guess we'll never know how it actually is?  As a side note, they didn't have the same photo menu like they have on their website or on Yelp. The service and food were ok so I can give it a few stars, but the quality wasn't exceptional like I hoped for, based on other reviews. Just be aware that the casino is awkwardly empty, so the restaurant is the same.",yh_HDtWbTA2V-RgT9QC6kQ,0,0,3,2EuKO8Ncc5tthNhbQ_tdGw
2677831,2017-10-21,0,y3EkxHO-qPODtzs_D6E7Rw,Food was amazing. Service was wonderful. Delicious authentic Chinese food. Highly recommend Pearl Ocean!,SK3UDj5qTKQRAhGDUamU5A,0,0,5,H0OVoupY-0QumiRPumHmHw
2693951,2017-06-21,0,y3EkxHO-qPODtzs_D6E7Rw,"If you want food, do not go to this restaurant. I would give zero stars if I could. 

My family and I went to this restaurant, was seated, and not given a menu. We asked for mustard sauce and they didn't even have it though we were the first people in the restaurant. When we asked the waitress for a menu, she tells us that the kitchen does not know what the menu is. How does a restaurant NOT know what they are cooking? 

Moreover, the staff was rude and did not inform us that they did not know what the menu was. If we did not ask multiple times about getting a menu, we would've waited even longer. They were not apologetic and gave us an attitude when we wanted to order. 

Also, the restaurant states it opens at 11 but they didn't let us in until 11:10. When I asked when they were opening, the entire staff standing there looked confused. 

The biggest waste of time ever. Don't expect food if you're going to this restaurant. Worst experience ever.",uF9EkiFa_vQyV2TNbnpwyQ,2,0,1,yJxzgf4Ux3Y2SsKIZz6hgw
2695528,2016-12-03,1,y3EkxHO-qPODtzs_D6E7Rw,"I thought I was in China....

About twenty years ago Chinese foods in Vegas were hits and misses...it all changed about ten years ago--especially the last five--as good as China.

I had Jasmine tea and beef chow fun.  That would normally set me back about $20, but because today is grand opening, they are passing out free play and food coupon.  With my coupon, I pay 95 cents for my foods.  I left a $5 tip.

Foods are really good.  People are really nice--good place.",0kZ_WFf52u52ksqfnP20ig,3,2,4,FBIT7282RkBL0aCviQdvUw
2707121,2016-12-18,1,y3EkxHO-qPODtzs_D6E7Rw,"Dim sum on the second floor of Lucky Dragon from the executive chef of Koi Palace in SF. Service and food were both excellent. They have English, Canto, and Mandarin speaking servers once they figure out your language preference. Pricier than then dim sum in Chinatown but well worth it. Best dim sum in Vegas. Get the baked egg tarts for a party in your mouth. 

Sign up for the player's card before dining here to receive a 5% discount. Discounts for locals as well (not sure how much).",9HZEVjeTLuwyCyKW7WE4-g,2,1,5,B9-4JqYESSn7sFYJDOpB5A
2775045,2017-06-17,0,y3EkxHO-qPODtzs_D6E7Rw,"We came here for dim sum only. It was fantastic we ordered the special and it came out right away. The serving staff, Deni & kenny, was very helpful with us and we were guided to the most delicious dim sum",3Q1mmhUb7jPek-N-GGCWYQ,0,0,5,PCROh2l7bUFcguj25eq4NQ
2791949,2017-04-19,0,y3EkxHO-qPODtzs_D6E7Rw,"The best dim sum in las vegas. The food quality can reach the restaurants in Canton/HK. The price is a little bit high, but it worth it for its perfect food quality.",Zxm-lcYyglDPT1twTcCTtw,0,0,5,rKwaovJnkTx2anlg2mgD3g
2816849,2017-06-24,0,y3EkxHO-qPODtzs_D6E7Rw,Lunch at Pearl Ocean was enjoyable! I recommend the dim sum items. Decent portions for the price and all items were delicious! My favorites were the roast duck and the scallop dumplings. The brunch option was a little disappointing. We expected a bit more for the $30.  Service was great thanks to the wonderful Tina! Overall a nice experience.  I would return for more dim sum!,NhqLUIsJlp-R-d0DaaX7iw,0,0,4,8OPOVGz5-xO4SXDLzV66CA
2820220,2017-11-03,0,y3EkxHO-qPODtzs_D6E7Rw,Went here last september for my birthday dinner. Loved the food and place plus they had discounts for locals,J4T_ng42mAl5z9N6BSbh4Q,0,0,4,OCkOv3f0pg7OAPyWB5LLvg
2856111,2016-11-26,0,y3EkxHO-qPODtzs_D6E7Rw,"Best dim sum I've had in Las Vegas!  Yes they just opened but I found the service to be very attentive.  The dim sum offers a greater variety than you usually see.  We enjoyed the duck (very meaty and juicy), the salt and pepper calamari (just a little chewy), the soup dumplings (with the vinegar sauce like it's supposed to have but I don't usually get), and the mango pudding (nice and creamy with a little sweet milk float).  We'll be back.",Cb7s74eB-GziGq_UPMjWQw,1,0,5,TJb8y8pl-Y6YIbxsN2kxHw
2907036,2017-06-18,0,y3EkxHO-qPODtzs_D6E7Rw,Great place! If you come definitely find Tony and Marissa- great service food and atmosphere for fresh and authentic Chinese food. The Lucky Dragon casino is also beautiful a beautiful place-- definitely coming back.,mQ53aut35LWpCmyQ-b5IXQ,0,0,5,CTyyM_Kb5CKY_pQl4unn8w
2943795,2017-11-11,0,y3EkxHO-qPODtzs_D6E7Rw,"I grew up eating dim sum and this is the best I've ever had because it's not greasy and the quality is top notch. Be advised that the atmosphere is not the typical dim sum experience. Maybe it was because I was there at 2pm on Thursday, but I ordered with pencil and paper (like when you order sushi). The familiar chaos of metal carts being shoved through crowded aisles of diners was missing, as well as the loud shrieks from the servers advertising what's on their carts. 

The dining room was very quiet and upscale, which was nearly off-putting for dim sum, but the quality of the food made up for it!",mhbc242-bY_ssXcwRsow8Q,1,1,4,DU_fTlrmGYOPt8s1VKB5hg
2964577,2017-05-18,1,y3EkxHO-qPODtzs_D6E7Rw,"This is a solid dim sum place - nothing I would go out of my way for again for future Vegas trips, but good nonetheless.

The classic options such as the shrimp rice roll or daikon cakes are fresh and tasty. Some less ordered options like the shrimp paste stuffed eggplants and veggie+pork tofu skin wrap were excellent - the ingredients were high quality and nothing was overseasoned or oversauced. The 5 guys xiao long bao seems to be a popular dish here. Visually, its nice to look at on the table, and each bao is distinct enough in taste in order to appreciate the dish's variety as intended. 

My criticisms would be that the seats were a bit dirty when we got there - I had to brush off crumbs on my seat. Also, for the beef chow fun, the beef was pretty low quality and/or overcooked and tough. 

Service was great and friendly. Thank you for refilling the tea pot promptly :P",3oIt2taGHPYczKYm4lISTA,4,1,4,qUSRAhCPA4DWrlJdlxI7rQ
3029193,2017-01-14,0,y3EkxHO-qPODtzs_D6E7Rw,"Lucky Dragon - Pearl Ocean restaurant.  Excellent food. Everything was delicious. Tasty, well prepared and not salty. From the menu we ordered Chefs Recommendation - Pea shoots with been curd skin in fish broth, wine - stewed ox-tail  in pumpkin bowl, and smoked sea bass.  Then 8 treasure & egg tofu casserole. For dessert mango pudding and complimentary sweet bun for celebrating a birthday. 
We had Jason was a wonderful server. Fun and attentive.",0GS-8GRHdYJk6RDGxRrOGA,0,0,5,l09PTnwIptwHJ3i8j2W7EQ
3039664,2017-09-08,0,y3EkxHO-qPODtzs_D6E7Rw,"What a great place for a fantastic deal on the freshest seafood. Intimate dining in a relaxed atmosphere with local, friendly people serving up your favorite traditional (and non-traditional) Chinese dishes. If you're tired of the non-personal atmosphere of the Strip, I would recommend a visit to the @luckydragonlv for a more refined and intimate dining (and gambling) experience. Having been in the casino business for over 20 years, I've never experienced a more traditional Chinese experience in the United States. Of course I'm a bit biased as I am Lucky (get it?) enough to work here; but I still look forward everyday to be able to sample our wonderful restaurant offerings.


So just remember, the @luckydragonlv is just a few steps off of the Strip on Sahara and will provide the most authentic Chinese experience this side of actually being in Macau.",4yG4J05aKzE2zov0Jr37kg,0,0,5,ISHMlXr4orMxElAO9Nkf0g
