,date,funny,business_id,text,user_id,useful,cool,stars,review_id
3060623,2017-01-31,0,y3EkxHO-qPODtzs_D6E7Rw,"This place is pricey for dim sum. The dishes didn't stand out for the price tag. They looked like regular dim sum you could find elsewhere. Similar dim sum can be had at other casino dim sum places for half the price. The exceptions were the XLB and the dumpling soup @ ~$10 a bowl. Our party of 6 spent around $200 for lunch. For comparison, the same party dined at another dim sum restaurant the day before and spent $80 for a similar amount of food. The thing that stood out the most at this place, however, was the attentive service and the cleanliness of the restaurant. The inside was not smokey given that it was located inside a casino. 
I believe this restaurant might be associated with Koi Palace or Koi Garden in the Bay Area considering the tea pots were exactly the same with logos and all. 
Would I come here again? Most likely not unless I were given a comped meal from the casino. The casino/restaurant is a bit far from the Vegas strip. Better deals can be found closer to the hotel that I stayed at.",UzCTKd37AryngWVdGNeItQ,1,0,3,i04Rsogbf38T_JkS1ZrLkg
3083883,2016-12-28,0,y3EkxHO-qPODtzs_D6E7Rw,"My family and I waited for an hour to be seated. Added to that, the food came out so unbelievably slow, and just one at a time. They gave one of our dishes to another table by mistake. We left before they gave us our final dish because of the long waiting time. Even asking for a takeout box took about 20 mins. The food costs quite a bit, but doesn't taste very good. 

The restaurant wasn't busy during the time we went, which gave us a bad impression, and there was no explanation to why they were so slow with service. Definitely not worth the price.",yYFRj6DGq2UDAzqURymwUg,0,0,1,62SIYTA404Bfz8Xkum7XDA
3119289,2017-07-21,2,y3EkxHO-qPODtzs_D6E7Rw,"The hostess were very friendly,  the service can be better and the food was so so... the lobster dumplings are soggy. I did not have a great experience.",rH27u0Kg9FZbIdkw2KfnZQ,0,0,3,GhOTwQGn4YtXqhWt5ZOdLg
3176827,2017-09-26,0,y3EkxHO-qPODtzs_D6E7Rw,This is the the worse place ever dont ever go here. We went here sat down  and they wouldn't let us order Bc they didn't have the menu set for the day. They opened at 11:30 and they weren't ready when we sat down exactly at 11:30. Who functions like that?,ZYLLy11TFqJtYzONPF9New,0,1,1,GGdvfDeyjmSAIrLw8mK3PQ
3183788,2017-12-25,0,y3EkxHO-qPODtzs_D6E7Rw,This is probably the most authentic Cantonese restaurant in Vegas. It's a good place for people who really enjoy eating local food and valuable for money .,4ssyw8JvWMblTVrCasUmrQ,0,0,5,DUrysKQM3XKPq2nfW6LSuw
3277854,2017-04-10,0,y3EkxHO-qPODtzs_D6E7Rw,"The dcor is beautiful, great for big parties, and the food is delicious.  My favorites are the baked bbq pork bao buns and the Portuguese egg custard tarts. You get good portions and the price is worth the quality.",1Z20YaJVA1aTP4LSDWsKMA,0,0,5,sVKQLcBwQF9Ld6r4eBCTKA
3279564,2017-12-24,0,y3EkxHO-qPODtzs_D6E7Rw,Wait 30 mins around 2pm . While a lot of table is empty.waited 30 mins for first dish .  The water cup was very dirty .,3LkJ56oQq38Uuk6Af6FfkA,0,0,1,teA-yIriE-R7CjBFgidsYA
3317046,2017-01-21,2,y3EkxHO-qPODtzs_D6E7Rw,"Awesome dim sum. The Five Guys is a must and the steamed egg yolk and crunchy rice pork roll thing-a-ma-jig are superb.

Just outside the restaurant is a bar (you can order from inside the restaurant as well) that serves an incredible cocktail: ""Ancient Junk."" Its comprised of Kikori whiskey, elderflower liquer and sherry, house aged in a barrel. It's like nothing you've ever tasted; do it.

Also, not sure why this place got 3 $ signs because each serving (outside of the Five Guys) was under $10. 

If you're in the neighborhood, do your stomach a favor and give Pearl Ocean a try.",Xa3UfWQRqYEo_ABz_KSfAg,4,1,5,lHbjATQuBEolHU37FA7C4w
3370626,2016-11-27,0,y3EkxHO-qPODtzs_D6E7Rw,"First restaurant visited in the newly opened Lucky Dragon. The service was adequate as the waiters would periodically come by to check if we had everything we needed. The menu consisted of typical items found in a local Chinese restaurant with a bit more inventive presentation. Pricing is kinda high for the portions given, but it is in a resort establishment after all. Quality of taste was not high enough to justify the pricing if comparing to some other favorite local Chinese diners around Chinatown. We ordered 3 entrees and an appetizer, it was filling for the three of us. A pet peeve of mine is being charged for rice and unfortunately this place does ($2/bowl).",JFbogPoNm2EoADGOF9OqSQ,1,0,3,x9ud0zxekhuq5Qn6_aB40g
3394167,2017-11-26,2,y3EkxHO-qPODtzs_D6E7Rw,"Really expensive dim sum with mediocre flavors. We ordered five guys xlb, lobster dumpling, shrimp dumpling with xo sauce, chicken feet, bbq pork bun, espresso coffee ribs, stewed beef tripe, crispy milk rolls, shrimp rice rolls and bbq pork crisp rice roll. My least favorite was five guys xlb and stewed beef tripe. Flavors were off with the five guys xiao long bao and beef tripe was gamey. Lobster dumplings were disappointing but the fried lobsters was good. The only items I liked was the espresso coffee ribs and crispy milk rolls. Although the ribs were slightly bitter, it had good texture. Crispy milk roll tasted somewhat like almond jello. It was crispy on the outside and soft on the inside. Food came out really slow also. Not sure if I would ever be back.",8e2BqmRoidbO9_MhZ8vXhw,3,1,3,D-Vmc1oTQsh0sslKxYSIug
3413566,2017-01-23,2,y3EkxHO-qPODtzs_D6E7Rw,"It is no Din Tai Fung.
In short, flavorless dim sum in an annoyingly bright casino environment.  
Best thing to order -- the chardonnay...",Xsty4nvBM3tcH87JWCuPVQ,0,0,2,bENGB2TWE5iZzXiDO7gHKw
3464120,2017-03-22,1,y3EkxHO-qPODtzs_D6E7Rw,"Ridiculously expensive. The food is come with number of people serving. If we have two people, they only give us two durian puffs. We order five dishes, they are not even enough for us because they are small as fuck. Three small egg tarts charge us 5 dollar , wtf. The real food is not the same as the pic that you see in the menu. Plus, the food doesn't even taste good. It tastes so general. I suggest, don't come if u are a big eater.",45Rfgd4BZ4IOXREZKqyNFg,2,0,1,7OnSLwZt6pe5cRBzigFSNw
3487081,2017-06-06,0,y3EkxHO-qPODtzs_D6E7Rw,We came as soon as they were open...because dim sum is best early.  I would say my favorites were the Shrimp dumplings (Har Gow) and the Radish Cakes.  We tried so many...there were about 11 of us and we ordered a variety.  Service was good.  I would like to go back and try again.  But I wouldn't say it was the best I've had.,8mHiw7zXtammstn6OHmhtw,0,0,3,Z2U1kuK34LKAWe3L9H-U6A
3494196,2017-04-28,0,y3EkxHO-qPODtzs_D6E7Rw,"I really wanted to give this place a 5-star rating. It has a sophisticated menu, food quality is very high, the server was friendly, but unfortunately despite all that going for it, the service is not good. We had ordered a plate of BBQ pork and it was forgotten to be served to us. So after having an awesome meal the waiter is cleaning the table and had totally forgotten the pork. He then went and got it, served it less the hot and we weren't hungry. Ended up taking it home. But no discount or any favor given for the late dish.
Here we are 3 weeks later.
Great food. If you order Peking Duck they do not carve the Duck at your table but it is still delicious. Instead of crepes they use buns which were very tasty. Definitely worth the trip.",Os4xct_bJoake5XrAncZ6Q,0,0,4,uJOBKKPTvvH_Z0ge2UL3FQ
3527769,2017-01-24,0,y3EkxHO-qPODtzs_D6E7Rw,By far the most expensive dim sum I have ever had. However it is also the best dim sum I have ever had. Worth every penny. Everything on the menu exceeded my expectations. Highly recommended!,PxXJXuHiK7MZ5KK9m3DbWg,0,1,5,F1KWn6so0UCfXPqgooyTGg
3541798,2017-01-30,1,y3EkxHO-qPODtzs_D6E7Rw,"After an unsuccessful attempt at watching Home Fun at the Smith Center, Debbie N and I decided to check out Lucky Dragon.  After trying to order food at the tea lounge and was told they only did that one time and it was for the owner, Debbie N and I chose Pearl Ocean to grab something to eat.

We had the following:
- XO clams: This was sauted in chilis, garlic and though it was good, I bit into a cracked shell that was mixed in with the rest of the clams.  We paid high prices for this so I expected whole clams.
- sticky rice with meats: Satisfying..exactly what we got.
- egg puffs: This was not air crispy and chewy in the center as I would expect it to be.  The waiter came by and ask us how was our meal and I cannot resist telling him exactly how I had envisioned the egg puffs to be.  Shortly after, the head chef came out to apologize to us about the egg puffs and ask if he can whip up a new batch or sub it with a different dessert.  As it was nearing closing time, we respectfully declined the offer.  But, because of that level of service, it definitely made up for the shortcoming of the egg puffs. 

Our pot of chrysanthemum tea was fragrant and was never half empty.  We enjoyed it very much; hence, I am a fan.",5wT0vDycEzgq95yVCZ60Aw,0,1,4,Q8jrkni5iZSKJek-G8LAuQ
3580245,2017-11-02,0,y3EkxHO-qPODtzs_D6E7Rw,They have good quality dims. One of the reasons I enjoyed our visit was the lack of a crowd. No long waiting and no carts. A checklist to order then it is brought. It does cost a little more but at least as good and probably better than the other Dim Sum places in town.,PeKqZ414yF7WuKfqbpOlAg,0,0,4,1sTZt53ERFLCcBF9q_lbnA
3658166,2017-01-12,0,y3EkxHO-qPODtzs_D6E7Rw,"A local friend recommended we all try this new place in the Lucky Dragon Casino, and we were not disappointed. We were there on a Monday at 11:30...no wait, hot-out-of-the-kitchen sumptuous dim sum, and friendly and attentive service!  We had a variety: har gow (shrimp dumplings), mochi chicken, shui mai in a green vege-type wrap, xiao lung bao (five of them each presented in its own little cup so to hold in the delicious juices!), Chinese greens, and Portuguese custard tarts (light flaky crust), among others...all delectable and high quality.  After we left the restaurant and cruised the casino, we happened to talk to one of the managers and was informed that the Pearl Ocean owner also owns Koi Palace in Daly City (San Francisco Bay Area), for our money one of the best dim sum restaurants in the Bay Area...no wonder it was such a great experience...with the service and sparse crowds, Pearl Ocean's even better!",49cXPK6XyI8JK9m4792v2A,0,0,5,w9ZOnJPLwE04ES7ina0pWA
3677098,2017-12-28,0,y3EkxHO-qPODtzs_D6E7Rw,"Wow. Food ok.
They wrote down the wrong order.   
Took very long in between dishes.   Only 4 tables in the whole restaurant.
I asked for two bowls of rice twice to two different waiters.   Nothing....   End of the meal nothing... 

Decor was ok.   Service was ok.  Food was ok...

Spent $41 tip 0$

Not coming back.",yiVV8ZnR5abJbbAz50FmLw,0,0,1,2jpAtAaU6vf0OaN7ZcP_MQ
3688062,2017-04-14,0,y3EkxHO-qPODtzs_D6E7Rw,"Best dim sum in town.  Locals get 20% discount.
Dinner is great also.  I have friends who don't like Chinese food.  I convinced them to try.  We took them dim sum for Dim sum 1st and later week for dinner.  They loved it.

Almost all foods are delicious.   I don't recommend beef chow fan.  I don't like the noodles they use.",NpcID-DE8teIre0Yi7Ut-w,1,0,5,0qTseo2bC62dsjMH9Hn-NA
3700569,2017-07-02,0,y3EkxHO-qPODtzs_D6E7Rw,"Deni served us and the courses were magnificent. Prices range from high teens for simple items with exotic ingredients (the soy noodles with mushrooms had two or three uncommon mushrooms in it) to $85 for an extravagant duck dish. Live fish are available to be prepared in numerous ways, including among other options a rare saltwater trout, prawns, and Alaskan King Crab. 

If you're seeking an experience exceeding the bounds of standard American fare, this is definitely and excellent option!",Y-BvJHpd8QR_hz__iHeQDA,0,0,5,5XYedN4wcEW0_dl13ytq9Q
3708599,2017-11-28,0,y3EkxHO-qPODtzs_D6E7Rw,"Best Chinese in the city so far!

We had the pot stickers and BBQ combo and they were amazing! The pork belly was out of this world good. The service was also excellent and authentic. The seared pot stickers were cooked to perfection, with just the right amount of sear on them.",-EJorVxe7h2GSxdiRyMmDA,0,0,5,pSMr8P2riknuDHrgrMW4hQ
3709884,2017-06-17,0,y3EkxHO-qPODtzs_D6E7Rw,Great late lunch with my girl. Ordered the dim sum special and thought it was pretty reasonable and delicious. Will be back.,FattYYdIo2S_8u1ENM3phA,0,0,5,UgTVSC2-vv7dcMj0IoYwgw
3713606,2017-06-16,0,y3EkxHO-qPODtzs_D6E7Rw,"My cousin and I were here in Vegas for vacation. After eating burgers for days, we craved for Chinese food very much. So we came to Pearl Ocean for the delicious Dim Sum and authentic Chinese dishes. It didn't disappoint us! The food is so good. The restaurant environment is upscale and nice decorated! The waitress Tina is very polite and professional. Strongly recommended!!!",N8ZQiaFVHT-6M3AOBM6R9w,1,0,4,bee_91N6-0mBrXOoy_6V8A
3753544,2017-12-06,0,y3EkxHO-qPODtzs_D6E7Rw,"Meh. We won't be back. Some yummy, others just bleh. Not worth the journey to the strip and the pricing. (We were here for dinner, not dim sum. Wish their website listed the dim sum serving times, we know it's typically mornings, but it's Vegas!  

Staff was very nice and welcoming.",SvSctkkriCsxOHW1KvBPBA,0,0,3,q6rzB70rpUazD3fdetqtRw
3784923,2017-12-28,0,y3EkxHO-qPODtzs_D6E7Rw,"Some of the best dimsum I've had on the West Coast.  The spareribs with black bean sauce and the hargow were on point.  It's a little out of the way of the typical big-name Hotels of the strip (It's inside the Lucky Dragon), but worth the short drive (free parking) or quick Uber ride.",dy_4NAZ0KR2bDoB9qAOMRg,0,0,5,iJEJK9qcJV3tWQCv5saPbw
3803960,2017-06-15,0,y3EkxHO-qPODtzs_D6E7Rw,Mother of pearl!! We went here for a dim sum lunch. The staff was incredibly friendly and helpful and the dim sum was delicious and authentic! Definitely a spot to hit if you are looking for tasty dim sum in a beautiful restaurant.,TLY3pVhhvW4gaBhJArUsJw,0,0,5,iBEIM9H7PC4eXSZSvCp4sQ
3842262,2017-03-20,0,y3EkxHO-qPODtzs_D6E7Rw,"Great decor and ambiance.  Excellent service.  Although the food is a bit pricey, but the quality was worth every bite.  Our waiter was so attentive and suggestive with great dishes, he was very patient with our learning to use food credits sent to us via mail.  Great tea selection as well.
Strongly recommend the dumpling in spicy peanut sauce, the roasted duck had perfect crispy skin albeit a tad salty, the colored dumplings were delicious every each color.  And a perfect round up of a dumpling with a beautiful sweet golden yellow custard, would go back just for that.
We need to support this local business, a great venue, right off the 15 Fwy, a great place to meet up for a great meal, free parking.  The gaming was a bit confusing as most of the penny and nickel slots make you bet a number of coins instead of just the one coin.  
I would definitely go back just for the food.",60kLSWCdmNJ-jOPudycIMA,0,0,4,4KHqSTVRu44AD3SGx8C1aw
3882012,2016-12-31,0,y3EkxHO-qPODtzs_D6E7Rw,I came here with my family on a whim and we have to say we were glad we came. The food was very good and the service was superb. We tried four dishes and we highly recommend the salted fish and chicken fried rice and the assorted sea food pan fried noodles. The waiters definitely work together here as our table rarely had a dirty plate or an empty glass sitting for too long. The serving style is very typical for an authentic Chinese restaurant in that it's more of a family style. In terms of price it is on the pricey side. Our most expensive dish was about 30 dollars and our cheapest was 19 however that's to be expected for the quality in food. Overall our experience here was excellent and we will definitely be bringing our friends here,53SVPCoaXJB0hncSGrBtCQ,1,0,5,QXxFzJkHy1sjAjdUIWcNhQ
3882681,2016-12-28,0,y3EkxHO-qPODtzs_D6E7Rw,"Their steamed juicy dumpling was very good but that was about the only thing good from what we got. 

BBQ pork bun- 3/5 good average compared to other places. 

Shiu Mai-2/5 had better. 

Juicy dumpling- 4/5 pricy for 5pcs but very good 

Beef noodle soup- 0/5 horrible and couldn't eat the beef that came with it. Wouldn't recommend it to anyone. 

Our service with the waiter we had was terrible and another one helped us later who was much more helpful and wished we had him serving us. 

Not sure if I'd come back here again.
Maybe for dim sum lunch but scared to try dinner at he price they have.",F-fh7tbb9sOXfh384nWKPQ,0,1,2,_bApYPzSL56MCnl9gzGkxg
3885140,2017-06-19,0,y3EkxHO-qPODtzs_D6E7Rw,"The dim sum here is delicious!  We just hot here so tired, hungry and angry, but our server, greeted us with a smile and brought out the food so quick.  Must try!!!",kIagwsRRhrm0X3CYs6YYCA,0,0,5,Ho7DTAKeLpfb17GhUx-lUA
3933769,2017-11-25,0,y3EkxHO-qPODtzs_D6E7Rw,Very clean Chinese restaurant! Food was great and inexpensive! Service is pretty slow but the food was savory specially the dimsun. Will go again if I'm back in Vegas.,KUa-Lh6nMRQ7opjJSYrPow,0,0,5,nMQVSthzYLuV47LP_jhgFA
3943258,2017-04-03,0,y3EkxHO-qPODtzs_D6E7Rw,"Just had my first Dinner service here tonight, everything was delicious. Deni was an outstanding server and was extremely knowledgeable on the menu items and the Live Seafood selections. We came in with the expectations of a traditional Dim sum Chinese dinner and very quickly were treated to a Fine Dining experience! 

   As Deni was answering some of our questions on the menu concerning our food allergies he walked us over to the beautiful Fish Tanks and explained the evenings selections. Tonight they had a great live veriety, Dungeness Crab, huge Spiny Lobster, Coral Trout, Goby Fish, large prawns, and Turbot, the Flounder like flat fish we went with. 
 
 Presentation was flawless. Our fish wich was just live moments before was cooked to perfection and De-Boned for us Table side, every bite was flavorful and on point. I highly recommend you go eat at Pearl Ocean now, Go, stop reading this and Go! The food at Pearl Ocean is no Joke amazing! 

     My compliments to the Chef, the attentive staff, our server Deni, our Lucky Gaming Bartender Riki, (he made an awesome Hibiki Old Fashioned) and the beautiful, clean, establishment, Lucky Dragon rocks!",owBS5ySvwvM4lXSRQfdRqg,1,0,5,KCD83NNwaH7SRxSQVMFyvQ
4003203,2016-12-04,0,y3EkxHO-qPODtzs_D6E7Rw,We ordered drunken chicken and some other stuff i didnt like any of them pricy and small serving you are better off with other places im a local and i wont come back here anymore check my pics,I1ept7TooPOw_rPZyNv9lA,0,0,1,5McSDZavFqO5NMx0mkNIcw
4030543,2017-12-22,0,y3EkxHO-qPODtzs_D6E7Rw,"Pretty good dim sum place. The dim sum menu is modest, but the food is authentic. Friendly staff and good services.",NfIlOwbzTaqJWV2mD0L7Sg,0,0,4,DqORJMiOSg57nU0oanChbA
4031273,2017-11-24,0,y3EkxHO-qPODtzs_D6E7Rw,"I absolutely love dimsum! I've always just gone to the orchid garden because of their variety but decided to try something new. This place is located in the new lucky dragon hotel on Sahara, it's casual but could be fine dining, not only do they have dimsum but also Chinese food. They only have one page of dimsum, and compared to other dimsum places, the variety isn't that big by the flavor was definitely there! Prices are more expensive than usual places... $5-$6 for 3 pieces of dimsum, and more for other kinds. Good if you're visiting but for locals, I think there are better options available",fj-cFMD2qheCcv3FNvMcEg,0,1,4,cLbk8iqXIOF4YckScbhn-w
4101992,2016-12-26,0,y3EkxHO-qPODtzs_D6E7Rw,"The restaurant opens at 11 am, and my family and I came early to wait in line. We were second in line, and when the restaurant opened they took people with reservation first. We waited for almost another 20 minutes until they finally started to seat the people in line. When it was our turn, the hostess told us we would have to wait until 12:30 pm because we were a party of 11. She didn't even offered to seat us separately! My brother told her to put tables together or seat us separately. I thought the restaurant would be decently big if they took reservations, but it was so small compared to other dimsum restaurants. I really don't understand why they would take so much reservations and leave people in line waiting.

We ordered a decent amount of food, and it came out slowly and one by one. The food is passable and did not worth the wait and frustration. The portions were small. The food was heavily flavored with something like MSG because I felt extremely thirsty after eating. They also didn't bring us the steamed buns we ordered, and we asked about it many times before we decided to cancel the order to pay and leave.

I rarely would give such a bad review since I worked in the food service, but this restaurant needs heavy work on its service and efficiency to ensure they'll get returning customers.",MN5mPP3o8YMF5E43_cDMDw,0,0,1,E0yQakJ6y7GbITpE20L1Dg
4162941,2017-03-01,0,y3EkxHO-qPODtzs_D6E7Rw,"First time here. Ambience was great and service was fast! Unfortunately, those were the high points. The food was mediocre at best. The chicken and pork were cold as was the wonton soup. Lack of flavor and spices were very noticeable. My wife is Korean and we eat at manu different Asian places but this one just didnt please any of our palates. I will give them a try again for Dim Sum but never again for an entree. My advice, save your money and go to China Mama for the spicy fish!",Q8_NyRxJYb2ROPYasOIdAQ,0,0,2,6aR34jpiHK5uwHVk42WOGA
4231407,2017-06-17,1,y3EkxHO-qPODtzs_D6E7Rw,"We came here for lunch. It was our first time dining and Tina was a great server. She attended all our needs, and I loved how their servers spoke english very fluently compared to other dimsum places. The food was great as well. The squid ink dumplings are a must try since their skins so good! Definitely would come back!

Totally worth the price and drive :)",s01liMq8lG4G3f3AvJMi5w,3,0,5,95L4GtqZkCqhRCxE9JQzGg
4236835,2017-10-26,1,y3EkxHO-qPODtzs_D6E7Rw,"As I said, I think this is the best Dim Sum in Las Vegas, but stated I would not go back unless someone else ""was buying"".  I am happy to say that one of my wife's friends enjoys ""playing"" at the Lucky Dragon, and keeps getting comps, so I've tagged along. 

Even though I haven't picked up a check, I found a pleasant surprise; They lowered their prices!!  So, for the best Dim Sum in Las Vegas, at a not cheap, but price worthy of the quality, check this place out.

Be advised they only serve Dim Sum till 3 p.m. 

Why still just 4 stars, and not 5? They lowered their prices, but it's still pricey.",QvLg2kxqHHahxxOlHlEIZw,3,1,4,IHBP4kCddsxBp9qqzVGshg
4278337,2017-03-05,0,y3EkxHO-qPODtzs_D6E7Rw,"Had the Taiwanese beef noodle soup. Outstanding. Rich deep broth flavor with a nice hit of heat. The beef was tender. The service was on point. Deni 
 was wonderful and attentive. Make a point of eating. It is worth it.",JLbZnoW-1ph11t9SAKMTPw,0,0,5,Fap2LO8p5XgiVd8P5HocXw
4332797,2017-11-23,0,y3EkxHO-qPODtzs_D6E7Rw,"If you enjoy real Chinese delicacy such as shark fin soup and abalone, this is the place.
Other regular dishes are very tasty too.",Y7tEaXYAH68XGlDs0thBZA,0,0,5,5rZMYX6baDEw49QHh70JTw
4337634,2016-12-15,1,y3EkxHO-qPODtzs_D6E7Rw,"It was a good experience dining at this restaurant.  We were there on a Sunday night and there were plenty of open tables.  The service was very attentive and friendly.  We ordered a few dishes and the beef chow fun and duck lettuce wraps were just ok, but the roast pork belly ($23) was absolutely delicious!  The pork meat was moist and the skin was light and crunchy - just perfect!

The restaurant was a bit pricey but I would go back just for the pork belly dish!",FhqheMMVbq1gqaE3FyB5Pg,1,1,4,_2fNk8vxJVTInIBWu35MrA
4345413,2017-12-27,0,y3EkxHO-qPODtzs_D6E7Rw,"Staff are friendly once they know you are there to order lots of food! I guess the more you order the bigger the gratuity. I am learning fast in the States! 
Our meals were good, rice needed more ooomph in it.. White egg yolk and one other additive is not exactly what I call a fried rice! 
I cant say the flavours were all there, and I have eaten a better meal in mainland China!
We had a good time, but a toss of a coin as to whether we would return.

Wine list needs to have a couple of different options.",EbiNVKH9dWbMKTgmyD8ZPA,0,0,3,n7s8uakQbj1Lr2sfHq2c9g
4380784,2017-06-24,0,y3EkxHO-qPODtzs_D6E7Rw,"The atmosphere here is good.The service is nice. Their X.O shrimp dumpling, shumai, chicken feet are very yummy.I recommend the Oolong hot tea.",1fMT3I4fO1xYJ9lgYO6Oww,0,0,4,CH8NNY1iEiOusPxqNkJHog
4456246,2017-09-24,0,y3EkxHO-qPODtzs_D6E7Rw,"My server was Chi. He was very professional, I had no wait time in ordering, glasses were filled, and the food was of the highest quality. Very very good. I'm very happy with the overall service and quality of the food. Very impressed. I will be back and would highly recommend this place above all else for Chinese in Las Vegas period! Thank you Chi.",eynu0uJEon1ORH1nIf4pTA,1,0,5,FBp5vKypkV-ZyO1k-GPh2w
